id,userName,userUrl,version,score,title,text,url,updated
11108005764,hotboxmyhe4rt,https://itunes.apple.com/us/reviews/id1340597511,8.9.19,4,Bring back the option to keep my songs on shuffle it's so annoying,thanks,https://itunes.apple.com/us/review?id=324684580&type=Purple%20Software,2024-03-31T19:03:32-07:00
11107920273,Mar’Quise,https://itunes.apple.com/us/reviews/id1638412060,8.9.19,5,Music is good,51,https://itunes.apple.com/us/review?id=324684580&type=Purple%20Software,2024-03-31T18:28:11-07:00
11107918370,riececlaire 99,https://itunes.apple.com/us/reviews/id87066356,8.9.19,5,Love it,Wish I had this a long time ago!!!,https://itunes.apple.com/us/review?id=324684580&type=Purple%20Software,2024-03-31T18:27:24-07:00
11107914030,Le doy un 💯,https://itunes.apple.com/us/reviews/id1333443793,8.9.19,5,QUE NO HAYGA MAS ANUNCIOS Y QUE AÚN ASÍ SI PAGAMOS O NO QUE SEA LO MISMO PARA LOS DOS,Que ya no hayga más anuncios y que todo lo que dan por pagar que lo den igual para los que no pagas,https://itunes.apple.com/us/review?id=324684580&type=Purple%20Software,2024-03-31T18:25:36-07:00
11107854013,Ballzout2012,https://itunes.apple.com/us/reviews/id87356455,8.9.8,4,Tally hall,Listen to them :)))),https://itunes.apple.com/us/review?id=324684580&type=Purple%20Software,2024-03-31T18:00:37-07:00
11107825646,#livy👍,https://itunes.apple.com/us/reviews/id1607186476,8.9.19,5,LOVE IT!!!!!!,Spotify may have had issues in the past but it’s doing well. And I find myself listing to it 24/7.,https://itunes.apple.com/us/review?id=324684580&type=Purple%20Software,2024-03-31T17:48:44-07:00
11107819235,C. Gal,https://itunes.apple.com/us/reviews/id1173342987,8.9.19,5,Sweet!,Sweet!!!,https://itunes.apple.com/us/review?id=324684580&type=Purple%20Software,2024-03-31T17:45:59-07:00
11107812702,1982bimbo,https://itunes.apple.com/us/reviews/id1199372516,8.9.19,5,Music is Life,Amazing! I love it! Thank you DJ for making it even extra special by choosing songs that had not been heard in a very long time and you playing them brings back so many beautiful memories.,https://itunes.apple.com/us/review?id=324684580&type=Purple%20Software,2024-03-31T17:43:14-07:00
11107777013,Flinardstoenail4,https://itunes.apple.com/us/reviews/id1435410453,8.9.19,5,Premium😡,Remove premium on mobile so you can actually listen to songs you want,https://itunes.apple.com/us/review?id=324684580&type=Purple%20Software,2024-03-31T17:28:11-07:00
11107770483,iheartrobloxsm,https://itunes.apple.com/us/reviews/id1085417106,8.9.19,5,yay,yum love awesome epic yes,https://itunes.apple.com/us/review?id=324684580&type=Purple%20Software,2024-03-31T17:25:25-07:00
11107766657,Blabluhblug,https://itunes.apple.com/us/reviews/id37169433,8.9.19,3,Pay your artists what they deserve,At least 50% of the value of each play where the value of all plays summed is equivalent to the total value of Spotify. Preferably more,https://itunes.apple.com/us/review?id=324684580&type=Purple%20Software,2024-03-31T17:23:48-07:00
11107750948,PLSZZ NO WIFI,https://itunes.apple.com/us/reviews/id1535375145,8.9.19,4,Nearly Perfect,"It’s pretty good and it sounds more clearer than YouTube, but I got 4 advertisements in a row.",https://itunes.apple.com/us/review?id=324684580&type=Purple%20Software,2024-03-31T17:17:12-07:00
11107732523,Tori113771,https://itunes.apple.com/us/reviews/id1641649970,8.9.19,3,Why can I play songs by themselves,Idk what happened with the update but now I can’t choose which individual song I wanna play. It doesn’t help the fact that I can only go back or skip so many times,https://itunes.apple.com/us/review?id=324684580&type=Purple%20Software,2024-03-31T17:09:23-07:00
11107718892,Lovethegamebummeditisntworking,https://itunes.apple.com/us/reviews/id204645515,8.9.19,5,Best music ever!!,If you ask for clean songs it will give it to you so if u are reading this you should be listening to music,https://itunes.apple.com/us/review?id=324684580&type=Purple%20Software,2024-03-31T17:03:39-07:00
11107716384,OFC Welsh,https://itunes.apple.com/us/reviews/id616809507,8.9.19,5,Spotify is the best,"Spotify is the best because of its Great music it’s easy to learn, and the best music app five stars",https://itunes.apple.com/us/review?id=324684580&type=Purple%20Software,2024-03-31T17:02:37-07:00
11107687226,azrael♪,https://itunes.apple.com/us/reviews/id1507909353,8.9.19,4,The songs in my playlist removed??,"Hi, I just tried to listen to one of my playlist and it turns out all the songs in my playlist are removed.
What??
So for some reason, I can listen to songs that are NOTHING like my music taste, but I can’t listen to the songs that were once in my playlist? Like the app functions were good, but now it won’t let me listen to my playlists? And even some songs that aren’t in or were in my playlists but are still my taste are removed and I just find it confusing..",https://itunes.apple.com/us/review?id=324684580&type=Purple%20Software,2024-03-31T16:50:04-07:00
11107635236,BrendanM104,https://itunes.apple.com/us/reviews/id1433404859,8.9.19,5,Great App!,"This is a great app!

Thanks,

Brendan M.",https://itunes.apple.com/us/review?id=324684580&type=Purple%20Software,2024-03-31T16:27:37-07:00
11107619679,Reviewsbyaperson,https://itunes.apple.com/us/reviews/id1641640388,8.9.19,4,Spotify what is it,It’s an app. Uber score 4 out 5,https://itunes.apple.com/us/review?id=324684580&type=Purple%20Software,2024-03-31T16:20:52-07:00
11107604109,Hoolyan Estrada,https://itunes.apple.com/us/reviews/id1324746939,8.9.19,5,the music on Spotify goes hard.,I love Spotify it’s so good that I am going to get more of the free stuff on Spotify for the music to the best man from: Iker Perez,https://itunes.apple.com/us/review?id=324684580&type=Purple%20Software,2024-03-31T16:14:10-07:00
11107595192,TOILET SKIBIDI🔥,https://itunes.apple.com/us/reviews/id1316591666,8.9.19,5,W,Love everything and all of the songs,https://itunes.apple.com/us/review?id=324684580&type=Purple%20Software,2024-03-31T16:10:19-07:00
11107593189,BeantheCatGirl,https://itunes.apple.com/us/reviews/id1599652637,8.9.19,5,LOVE SPOTIFY!!,Perfect for anything. Also has a great free version,https://itunes.apple.com/us/review?id=324684580&type=Purple%20Software,2024-03-31T16:09:30-07:00
11107576176,SPODNRNKENDNSNS,https://itunes.apple.com/us/reviews/id1641636743,8.9.19,5,Good,"Whenever I don’t know the name of a song I can search a lyric and it will show up, other apps don’t have that so Spotify is my favorite. Definitely would use everyday",https://itunes.apple.com/us/review?id=324684580&type=Purple%20Software,2024-03-31T16:02:01-07:00
11107546422,katielynn bug,https://itunes.apple.com/us/reviews/id487960965,8.9.19,5,Great podcast,Love love this I feel like   Everything is all about you too and how to help others . I’m your opinion.s  and  I feel like I’m getting out out off all 3 of them,https://itunes.apple.com/us/review?id=324684580&type=Purple%20Software,2024-03-31T15:49:10-07:00
11107514027,kelsy belsey,https://itunes.apple.com/us/reviews/id1244671995,8.9.19,5,Love this app,I love Spotify so much it ha every song you could think of.,https://itunes.apple.com/us/review?id=324684580&type=Purple%20Software,2024-03-31T15:35:10-07:00
11107513581,murph is amazing,https://itunes.apple.com/us/reviews/id1448853296,8.9.19,4,SAME ADDS,Can you please stop having so many of the same ads it is so frustrating to here the same ad three times in a row!!!,https://itunes.apple.com/us/review?id=324684580&type=Purple%20Software,2024-03-31T15:34:58-07:00
11107509498,KarateGeek,https://itunes.apple.com/us/reviews/id1349055146,8.9.19,5,Review,Fantastic,https://itunes.apple.com/us/review?id=324684580&type=Purple%20Software,2024-03-31T15:33:13-07:00
11107475465,Claudia curz,https://itunes.apple.com/us/reviews/id1503230942,8.9.19,5,it goooood,I love ittt,https://itunes.apple.com/us/review?id=324684580&type=Purple%20Software,2024-03-31T15:18:23-07:00
11107449337,😜🤓 meee$,https://itunes.apple.com/us/reviews/id1458309541,8.9.19,5,I love this app,"I don’t know why but i am addicted to this app, all tho i do nit have the premium i still love it",https://itunes.apple.com/us/review?id=324684580&type=Purple%20Software,2024-03-31T15:07:15-07:00
11107427546,Super 👦,https://itunes.apple.com/us/reviews/id979403688,8.9.19,3,Sorry,I liked it but it didn’t always work 😊,https://itunes.apple.com/us/review?id=324684580&type=Purple%20Software,2024-03-31T14:57:54-07:00
11107424347,BigAcs1017,https://itunes.apple.com/us/reviews/id1148075432,8.9.19,5,Greatest player,Love this app soon I’ll be on it from big♠️,https://itunes.apple.com/us/review?id=324684580&type=Purple%20Software,2024-03-31T14:56:35-07:00
11107409569,cute kittenes6,https://itunes.apple.com/us/reviews/id210483888,8.9.19,5,Amazing,Spotify has a lot more options for music than Amazon. And if you don’t have premium you can swipe out of the app to close any and all ads. You’re welcome,https://itunes.apple.com/us/review?id=324684580&type=Purple%20Software,2024-03-31T14:50:13-07:00
11107405488,Fhfhfhfhgvcdifmseoca,https://itunes.apple.com/us/reviews/id1505966432,8.9.19,4,Good but the ADDS,"I LOVE this app but there are a lot of ADDS they need to work on this I don’t want them to mad at me. A l though I didn’t pay for this but it claims that if you do pay for premium you will have zero ADDS they should really die down on the ADDS because they will have better reviews. Honestly I think that it’s pretty good just work on the ADDS.
                           (P.S I am a kid writing this)",https://itunes.apple.com/us/review?id=324684580&type=Purple%20Software,2024-03-31T14:48:27-07:00
11107368946,Cashmeregvbtjhgyiknfghi,https://itunes.apple.com/us/reviews/id105042752,8.9.19,5,SHhhhh,Gghjmm,https://itunes.apple.com/us/review?id=324684580&type=Purple%20Software,2024-03-31T14:32:46-07:00
11107327449,Connoe1010,https://itunes.apple.com/us/reviews/id1274151374,8.9.19,4,Premium,"I love the premium feature but it seems they keep increasing the prices once in a while, I feel like you should sign up for a set rate and it should never change, other than that the music and features are great.",https://itunes.apple.com/us/review?id=324684580&type=Purple%20Software,2024-03-31T14:15:00-07:00
11107315920,Avon Tju,https://itunes.apple.com/us/reviews/id893893229,8.9.19,5,Garbage,Totally don’t use this all the time,https://itunes.apple.com/us/review?id=324684580&type=Purple%20Software,2024-03-31T14:10:11-07:00
11107287995,Hailey stew,https://itunes.apple.com/us/reviews/id1641612591,8.9.19,5,Like it,I really like it,https://itunes.apple.com/us/review?id=324684580&type=Purple%20Software,2024-03-31T13:58:25-07:00
11107274817,Review.Dude,https://itunes.apple.com/us/reviews/id1607661548,8.9.19,4,Skip limit,"Really good app, but the skip limit is SOOO annoying 6 a hour so that's 1 every 10min and I can't skip to a specific song without an ad or skip limit.",https://itunes.apple.com/us/review?id=324684580&type=Purple%20Software,2024-03-31T13:52:54-07:00
11107232884,dmena2006,https://itunes.apple.com/us/reviews/id107640108,8.9.19,5,music is power,Good👍,https://itunes.apple.com/us/review?id=324684580&type=Purple%20Software,2024-03-31T13:35:36-07:00
11107230874,Ieejhwieheieid388338,https://itunes.apple.com/us/reviews/id1049423508,8.9.19,4,"I love the app, but one big",AUGH THE LYRICS NEVER LOAD,https://itunes.apple.com/us/review?id=324684580&type=Purple%20Software,2024-03-31T13:34:45-07:00