id,userName,userUrl,version,score,title,text,url,updated
10999692439,poboysteve,https://itunes.apple.com/us/reviews/id1220524155,320.1,1,Smh useless,"What’s the point of posting something on your stupid app when you’re just gonna delete it because you people are full of horse hockey, you censor everything like seriously Mark Zuckerberg’s people money and you’re over here worried about censoring people shame on you people",https://itunes.apple.com/us/review?id=6446901002&type=Purple%20Software,2024-03-02T04:48:52-07:00
10999665664,66 and Strong,https://itunes.apple.com/us/reviews/id958438330,320.1,3,Social,"This is a new platform and learning navigation: who has the time!  But so far it has been a pretty simple journey, learning yet another new platform.",https://itunes.apple.com/us/review?id=6446901002&type=Purple%20Software,2024-03-02T04:40:24-07:00
10998075508,Rowe II,https://itunes.apple.com/us/reviews/id530498788,320.1,5,Dy23up,Super Nice!,https://itunes.apple.com/us/review?id=6446901002&type=Purple%20Software,2024-03-01T18:06:17-07:00
10997948601,paewand.1,https://itunes.apple.com/us/reviews/id1630759292,320.1,5,are you so good 🤩♥️,♥️♥️,https://itunes.apple.com/us/review?id=6446901002&type=Purple%20Software,2024-03-01T17:17:31-07:00
10997810214,Duckluckyshot,https://itunes.apple.com/us/reviews/id1162394079,320.1,1,Terrible app,This app fell off and it’s full on bots and losers never download this please I beg,https://itunes.apple.com/us/review?id=6446901002&type=Purple%20Software,2024-03-01T16:23:03-07:00
10997612534,Savage.One,https://itunes.apple.com/us/reviews/id110725125,320.1,1,You don’t need it,"This is doesn’t have anything new. It’s just the same stuff we’ve seen and already have. You don’t need it, and I deleted it.",https://itunes.apple.com/us/review?id=6446901002&type=Purple%20Software,2024-03-01T15:02:38-07:00
10997583505,koko 34,https://itunes.apple.com/us/reviews/id644904145,320.1,5,coco,coco,https://itunes.apple.com/us/review?id=6446901002&type=Purple%20Software,2024-03-01T14:50:36-07:00
10997199470,YeshuaX,https://itunes.apple.com/us/reviews/id1612279937,320.1,5,Very nice app,Who bought it??? I just to congratulate whoever invested to copy Twitter but using MetaVerse!!!,https://itunes.apple.com/us/review?id=6446901002&type=Purple%20Software,2024-03-01T12:13:11-07:00
10996926786,AmyDeGu,https://itunes.apple.com/us/reviews/id202994631,320.1,5,Review,Why,https://itunes.apple.com/us/review?id=6446901002&type=Purple%20Software,2024-03-01T10:28:56-07:00
10996253891,JToecool,https://itunes.apple.com/us/reviews/id377331082,320.1,5,Nice,Great,https://itunes.apple.com/us/review?id=6446901002&type=Purple%20Software,2024-03-01T06:49:38-07:00
10996192609,Frickinlameo,https://itunes.apple.com/us/reviews/id475098555,320.1,5,Fun app,Just got started on threads. Fun and easy to use. Try it out!,https://itunes.apple.com/us/review?id=6446901002&type=Purple%20Software,2024-03-01T06:31:32-07:00
10995846939,dlbild84,https://itunes.apple.com/us/reviews/id118106049,320.1,3,Twitter / X version 2.0,Twitter / X 2.0 is what this feels like to me. It looks clean but it’s basically just twitter. I bet in record time it will be just like twitter / X. Toxic dumpster fire.,https://itunes.apple.com/us/review?id=6446901002&type=Purple%20Software,2024-03-01T04:49:20-07:00
10995587997,Mars from planet Zi,https://itunes.apple.com/us/reviews/id107302975,320.1,1,Notifications are annoying,This apps keeps on notifying you with badges even if you made sure its already Turned Off both on the Apps setting and the device setting,https://itunes.apple.com/us/review?id=6446901002&type=Purple%20Software,2024-03-01T03:24:28-07:00
10994754740,yukkiara,https://itunes.apple.com/us/reviews/id453615285,320.1,1,No thanks,just lemme look at the threads while im scrolling on instagram without making a useless acct ty sm,https://itunes.apple.com/us/review?id=6446901002&type=Purple%20Software,2024-02-29T21:11:14-07:00
10994705696,eazyrooster,https://itunes.apple.com/us/reviews/id42866696,320.1,1,Sends notifications when I have turned them off,"Nothing is more annoying than going into settings and making sure you have selected to turn notifications off and then the app still sends them. No matter how many times I tell it not to send me suggestions it still does. Not worth having an account, they’ve had far to long to fix the bugs and choose not to.",https://itunes.apple.com/us/review?id=6446901002&type=Purple%20Software,2024-02-29T20:47:14-07:00
10994138195,Diamiday,https://itunes.apple.com/us/reviews/id1422615705,320.0,5,Comunicación,Comunicación clara y respetuosa,https://itunes.apple.com/us/review?id=6446901002&type=Purple%20Software,2024-02-29T16:42:26-07:00
10994042310,G ma anna,https://itunes.apple.com/us/reviews/id1620991963,320.0,5,Review,This is a pretty cool app it’s like the old instagram I really loved the old one but this side app works perfect,https://itunes.apple.com/us/review?id=6446901002&type=Purple%20Software,2024-02-29T16:03:00-07:00
10993984745,McMikey🤓🐸,https://itunes.apple.com/us/reviews/id489824635,320.0,2,Fake twitter for new-wave feminists and e-thots,This is literally like Twitter with Reddit-style comments and most of the posts are monotonous in structure.,https://itunes.apple.com/us/review?id=6446901002&type=Purple%20Software,2024-02-29T15:38:37-07:00
10993625422,Be Motivated and Empowered,https://itunes.apple.com/us/reviews/id1163036192,320.0,5,New here - @bemedigitally,This is all new to me and grateful for all you creators!,https://itunes.apple.com/us/review?id=6446901002&type=Purple%20Software,2024-02-29T13:08:25-07:00
10993599587,souljaakyle,https://itunes.apple.com/us/reviews/id867303955,320.0,5,Nice,Very efficient thanks mark.,https://itunes.apple.com/us/review?id=6446901002&type=Purple%20Software,2024-02-29T12:57:54-07:00
10993539781,bills lil lamma,https://itunes.apple.com/us/reviews/id1317213090,320.0,1,I hate this app,I literally deleted my account because i never used it i even deleted the app off my phone and i’m still getting notifications from it and i don’t onow how to stop it,https://itunes.apple.com/us/review?id=6446901002&type=Purple%20Software,2024-02-29T12:33:26-07:00
10993305113,KPS gamer 2,https://itunes.apple.com/us/reviews/id463661320,320.0,4,Taking too long to load,"I love the app, but ever since it updated, it’s taking too long to load the app when I open it. Can you please fix this issue? I really want to start using it again.",https://itunes.apple.com/us/review?id=6446901002&type=Purple%20Software,2024-02-29T11:01:06-07:00
10992811826,My dog shep,https://itunes.apple.com/us/reviews/id1543231398,320.0,3,Caring,Nice to see some kind people without the smut .,https://itunes.apple.com/us/review?id=6446901002&type=Purple%20Software,2024-02-29T08:08:23-07:00
10992779655,edwardnwong98,https://itunes.apple.com/us/reviews/id839731143,320.0,1,easily forgotten,easily forgotten. develop something unique.,https://itunes.apple.com/us/review?id=6446901002&type=Purple%20Software,2024-02-29T07:58:11-07:00
10992563297,Kathhutch,https://itunes.apple.com/us/reviews/id426094435,320.0,1,How do you delete threads from your Instagram?,"To me this is kind of useless for me, so how do I delete it from my Instagram?",https://itunes.apple.com/us/review?id=6446901002&type=Purple%20Software,2024-02-29T06:49:31-07:00
10991943414,Jromeywashereshaboing,https://itunes.apple.com/us/reviews/id620058486,320.0,5,Threads,What and party and how do you do that,https://itunes.apple.com/us/review?id=6446901002&type=Purple%20Software,2024-02-29T03:29:27-07:00
10991424408,SheWhoWanders,https://itunes.apple.com/us/reviews/id35714726,320.0,1,"Horrible, horrible, anti-user experience.","I log in and am immediately logged out. 
This happens repeatedly.

I log in and am only able to respond to one post in the thread of people whom I am following, then I am unable to do anything more because I’ve been kicked off —EVEN THOUGH I can still see the thread, I can’t DO anything.

I log in and am told to prove I’m human. I do. Think I’m in, and am immediately kicked out again. 

I log in and try to leave a note / message / missive / angry letter to the team and IT IS NOT SENT. 

I log in to try to delete my account and I am not allowed to do it.

RELATED: Since joining Threads I am repeatedly kicked off of IG a and have to RESTORE MY ACCOUNT.",https://itunes.apple.com/us/review?id=6446901002&type=Purple%20Software,2024-02-28T23:44:36-07:00
10991230069,WastdTimzX3,https://itunes.apple.com/us/reviews/id143828294,320.0,1,Too much politics,"Eighties love X, Lefties love Threads. WE DONT CARE. Can we not have one place online where folks aren’t wallowing in politics!!?  At the very least, be civil.  If you’re better than them then show it otherwise you’ve created your own counter balancing fess pool to their’s!!!",https://itunes.apple.com/us/review?id=6446901002&type=Purple%20Software,2024-02-28T22:10:40-07:00
10991124559,chellt2021,https://itunes.apple.com/us/reviews/id1235181473,320.0,5,Nice Place,This is a nice place not to much negativity on the TL 👌🏽👍🏼,https://itunes.apple.com/us/review?id=6446901002&type=Purple%20Software,2024-02-28T21:17:23-07:00
10991013912,Master Peewee,https://itunes.apple.com/us/reviews/id1519804543,320.0,5,I’m loving it,Best way to reach out and connect,https://itunes.apple.com/us/review?id=6446901002&type=Purple%20Software,2024-02-28T20:23:10-07:00
10990565649,Whew-child,https://itunes.apple.com/us/reviews/id683635010,320.0,5,Yakery,Yak loves it. 💙,https://itunes.apple.com/us/review?id=6446901002&type=Purple%20Software,2024-02-28T17:05:37-07:00
10990522495,Theresa***,https://itunes.apple.com/us/reviews/id179647654,320.0,5,😊,Kindness and interesting,https://itunes.apple.com/us/review?id=6446901002&type=Purple%20Software,2024-02-28T16:47:07-07:00
10990367346,Never1117,https://itunes.apple.com/us/reviews/id215898028,320.0,1,Deceptive logins,"Facebook and Instagram use tricks to make you inadvertently enter the app. Twitter is bad, but the sleezy always that Facebook and Instagram for a ya to go to threads to boost its usage rate makes threads a no-go as well. Still awaiting a better alternative.",https://itunes.apple.com/us/review?id=6446901002&type=Purple%20Software,2024-02-28T15:40:29-07:00
10990358968,جعفر الساعدي,https://itunes.apple.com/us/reviews/id1630010636,320.0,3,بغداد,انستا,https://itunes.apple.com/us/review?id=6446901002&type=Purple%20Software,2024-02-28T15:36:48-07:00
10990289198,akinguyen007,https://itunes.apple.com/us/reviews/id143148384,320.0,5,Ok,Gần giống fb,https://itunes.apple.com/us/review?id=6446901002&type=Purple%20Software,2024-02-28T15:06:32-07:00
10989517009,Sweet Venom Effect,https://itunes.apple.com/us/reviews/id140084747,320.0,5,Nice platform,I like the platform for business,https://itunes.apple.com/us/review?id=6446901002&type=Purple%20Software,2024-02-28T09:53:26-07:00
10988393247,Jaquanbaines,https://itunes.apple.com/us/reviews/id1515620322,320.0,5,Stop texting me that,I mean that,https://itunes.apple.com/us/review?id=6446901002&type=Purple%20Software,2024-02-28T03:35:08-07:00
10988148615,AGM 007,https://itunes.apple.com/us/reviews/id898657312,320.0,5,Experience,Es agradable aprender y disfrutar con ello “,https://itunes.apple.com/us/review?id=6446901002&type=Purple%20Software,2024-02-28T01:54:11-07:00
10988145037,jonessoda17,https://itunes.apple.com/us/reviews/id557652198,320.0,2,WHERE ARE THE DMS???,I don’t understand why the basic functionality of sharing things with your friends within the app isn’t a main priority for Threads. The connection to Instagram seems really short sighted in the long run as I feel Threads and Instagram cater to completely different audiences which hinders Threads from having its own individual identity. I get excited for every update hoping that they add this simple feature but they never do it. Threads is exactly like Twitter but with less features. It’s hard to justify spending any time at all on the app when you know you are investing in a lesser experience. I would give it a higher rating but it’s been months and the updates have been very lackluster. To say I am disappointed is an understatement. People deserve better.,https://itunes.apple.com/us/review?id=6446901002&type=Purple%20Software,2024-02-28T01:52:35-07:00
10987749926,1684499)5,https://itunes.apple.com/us/reviews/id589413046,320.0,1,Very bad platform,Unlike and basest platform,https://itunes.apple.com/us/review?id=6446901002&type=Purple%20Software,2024-02-27T22:44:52-07:00
10987630862,fhaelma,https://itunes.apple.com/us/reviews/id1478920310,320.0,5,Ótimo,Amando ♥️,https://itunes.apple.com/us/review?id=6446901002&type=Purple%20Software,2024-02-27T21:44:47-07:00
10987414423,UThe has,https://itunes.apple.com/us/reviews/id1627846439,320.0,4,💝💕💋😍❤️💝😃😀😆🥰😍😘,Ceven Holder,https://itunes.apple.com/us/review?id=6446901002&type=Purple%20Software,2024-02-27T19:57:45-07:00
10986970111,Claire faul,https://itunes.apple.com/us/reviews/id1591115554,320.0,5,This is the best app ever,I love it so much@,https://itunes.apple.com/us/review?id=6446901002&type=Purple%20Software,2024-02-27T16:46:34-07:00
10986813209,Punkrockingwithit,https://itunes.apple.com/us/reviews/id636341081,320.0,5,If tw*tter was good,Having fun for once,https://itunes.apple.com/us/review?id=6446901002&type=Purple%20Software,2024-02-27T15:37:39-07:00
10986729256,Aley_Volley,https://itunes.apple.com/us/reviews/id509263540,320.0,5,Aleysha Bueno,"Esta plataforma ayuda a expresar lo que cada uno piense, gracias por esta oportunidad.",https://itunes.apple.com/us/review?id=6446901002&type=Purple%20Software,2024-02-27T15:00:42-07:00
10986621853,Hiram Alfredo,https://itunes.apple.com/us/reviews/id220431506,320.0,5,“No sure how. ..,.. .works‼️😬,https://itunes.apple.com/us/review?id=6446901002&type=Purple%20Software,2024-02-27T14:13:05-07:00
10986299921,LAFBABY,https://itunes.apple.com/us/reviews/id42557756,320.0,2,Bugs daily,"I love the community - left the malignant X And all the hate, lies etc. I am frustrated with Threads set-up- sorting threads 
And I am- DAILY- Posting - and get Post FAILED TO upload - and it’s incensing - and poor tech- I delete app daily and reinstall and makes no difference- please fix",https://itunes.apple.com/us/review?id=6446901002&type=Purple%20Software,2024-02-27T11:56:19-07:00
10986180962,GraciePooh22,https://itunes.apple.com/us/reviews/id1111063014,320.0,5,Best app ever,This best app ever I Swear to the Lord God Almighty,https://itunes.apple.com/us/review?id=6446901002&type=Purple%20Software,2024-02-27T11:08:12-07:00
10986099967,Cheesegod,https://itunes.apple.com/us/reviews/id35420005,320.0,1,Awful,"Stop putting “threads” in my notifications from people I don’t follow. That’s what the feed is for. I mean, I don’t want to see them in the feed either but at least they make sense there. 

A thread from someone I don’t follow is NOT a notification.",https://itunes.apple.com/us/review?id=6446901002&type=Purple%20Software,2024-02-27T10:36:53-07:00
10986059972,youtubeNOmetube,https://itunes.apple.com/us/reviews/id1024495053,320.0,1,Stalked & bullied,"Somebody is paying creators to stock and bully me and discredit me, and ruin my reputation with lies",https://itunes.apple.com/us/review?id=6446901002&type=Purple%20Software,2024-02-27T10:21:38-07:00