id,userName,userUrl,version,score,title,text,url,updated
4722095266,BEG-MIA,https://itunes.apple.com/us/reviews/id427739758,8.5.21,5,Can’t play and can’t find answers,"I am still giving 5 stars as I find this app to have an amazing music choice. However for over a month I’ve been having issues from time to time to play it. I have iPhone XS Max 512gb, with over 75% storage available (20% is music downloaded from you guys lol)
However, no matter what I tried from your suggestions in help page app is still giving issues. I always wait for another update thinking that might be it. Phone is up to dare. Been logged out and logged back in and reset the phone. Reinstalled app. But it still gives me issues at least twice a day. 
You guys should find a way to communicate better with your customers and fix issues if they have one. If it continues like this, I have no other choice but to cancel subscription as I don’t want to pay for something that doesn’t work.
I really hope you sort this out soon.",https://itunes.apple.com/us/review?id=324684580&type=Purple%20Software,2019-09-03T12:50:09-07:00
9587712447,FayWolfe,https://itunes.apple.com/us/reviews/id1493804424,8.8.6,3,Update completely ruined the app,"The app was great up until the update came out. It completely changed the playlist layout, they removed the “queue” button along with the “up next” button, you can’t view and remove the songs added with enhance and there is no longer a button to turn off enhance at all. The new way to view the playlist makes it so that you can't skip directly to a specific song and instead makes it so you have to skip through the playlist to find that specific song. When you try to skip directly to a song, it only plays a clip of the song. Also, when you try to search for a song it plays a “recommended” song instead and won't let you listen to the song you actually clicked on. Sorry for the wall of text, but I do hope that the devs change the app back to how it was before the update. Once again, sorry for the wall of text. And the repetitive use of the word “song”.",https://itunes.apple.com/us/review?id=324684580&type=Purple%20Software,2023-02-05T16:57:08-07:00
5937815806,barley_gives_reviews,https://itunes.apple.com/us/reviews/id964610918,8.5.57,4,My Biggest Problem,"I got this app so I can play music without having to wait till someone is done playing music on an app so then I can.  { PROBLEM }.  I have only one problem , it’s that when I finish playing a song it goes to another random one but that’s not the problem. It’s when i play a song then when I go to play other song it keeping playing, then when I pause the song that I want to listen to, it then pauses the song that I didn’t want to listen too. So I have a hard time switching between songs because it would just play the same one and pause it when I’m trying to play another one. Overall I really like the app but that’s problem now, it’s just really bugging me. Tbh I don’t know if anyone has this problem like me but it’s just ruining my experience a little. I’m sorry if there’s an way to fix it, but That problem just annoys me. Anyways I hope this might had helped you. Good Day~~💕 ..",https://itunes.apple.com/us/review?id=324684580&type=Purple%20Software,2020-05-12T17:32:28-07:00
5429545320,ihatr,https://itunes.apple.com/us/reviews/id684272152,8.5.41,4,It sorta alright but like not really,"If I hear another Billie Eilish song I’m gonna c r y. It’s really frustrating when you can’t change the song you don’t want to listen because you uSeD aLl YoUr SkIpS aNd YoU nEeD tO sLoW dOwN. I especially hate that I can no longer (for some odd reason?? Like???) remove songs from my own playlists. It only says that I can hide the songs but I don’t want them hidden I want them GONE. Like?????? Who’s idea because-????in what w o r l d???? And If I press shuffle I expect the songs to, you know, be shuffled. Not just one or two songs out of order. Also I can’t pick what song I want to listen to anymore I just have to press a playlist and hope a song I like pops up. And if I click on my own playlist I don’t want to shuffle the songs. The songs are arranged by their v i b e s  and if it gets mixed up the playlist just doesn’t work and sometimes I just want to listen to the songs in the order they are in and I don’t want to shuffle them.",https://itunes.apple.com/us/review?id=324684580&type=Purple%20Software,2020-01-20T19:57:07-07:00
5301529877,promingi_,https://itunes.apple.com/us/reviews/id1049425458,8.5.34,3,Could Be Better,"For starters, this app is really good at fulfilling it’s purpose of the whole music aspect. Like you are able to sort songs into your own playlists and follow your favorite artists. However, this is app is not perfect. The fact that you are able to sort songs in playlists is great, but I find it frustrating how random songs will “recommend” or just play random songs that you have probably never even heard of or put into your playlists. Also, the ads are too much. For example, the “30 minutes of no ads” ad pops up every two or so songs. And if you  choose not to to watch the short video, two or three ads will come up afterwards as to say “You should have watched the video”. If this were more like the desktop version, where you able to pick your songs, get unlimited amount of skips,  rewind or skip into songs, all while have a pretty small amount of ads compared to the mobile version, I think this app would be much more enjoyable to use whenever.",https://itunes.apple.com/us/review?id=324684580&type=Purple%20Software,2019-12-21T12:48:05-07:00
4820706386,ambulanceradio,https://itunes.apple.com/us/reviews/id371600764,8.5.23,4,This app could be so good but...,"This app could be so good, but for some unknown reason they want to shoot themselves in the foot.  It seems the playlists want at least 15 songs in them or the fill the rest with crap you don’t want to hear.  Then it only plays the crappy songs and they only allow 6 skips a day. If it just wants to play the crappy ones I might as well just tune in to a radio station I don’t like and save myself the trouble of making all the cool playlists.  I’m not getting to listen to what I want anyway...

Need to allow 20-30 skips a day & allow smaller playlists.  Also getting to listen to one full length song of your choice, instead of waiting to hear it after going through the entire playlist would really help with ones frustration when using the app.  Fixing 2 or 3 small problems would make this a really cool app, don’t even mind the ads, but the way it is I am being generous in giving this 2 stars out of 5...",https://itunes.apple.com/us/review?id=324684580&type=Purple%20Software,2019-09-21T17:17:58-07:00