id,userName,userUrl,version,score,title,text,url,updated
11100325724,J Luis Gonzalez,https://itunes.apple.com/us/reviews/id297483181,6.108.1,5,The most accurate mapping experience!!,"I highly recommend Google Maps for its accuracy and up-to-date information. I have found this app to be reliable in providing accurate directions and real-time traffic updates. It has been my go-to navigation tool for all my travels, and I appreciate the continuous updates to ensure the most accurate mapping experience. Thank you, Google Maps, for keeping me on the right track!

Sincerely 
Luis G.",https://itunes.apple.com/us/review?id=585027354&type=Purple%20Software,2024-03-29T16:47:35-07:00
11100198741,Thaddeus Bonesaw,https://itunes.apple.com/us/reviews/id39013104,6.108.1,5,The gold standard,"Quite simply the gold standard when it comes to a clean, reliable map app. The folks at Google have done an amazing job with this product.",https://itunes.apple.com/us/review?id=585027354&type=Purple%20Software,2024-03-29T15:55:52-07:00
11099068300,Hey Kate!,https://itunes.apple.com/us/reviews/id114427656,6.108.1,5,Casey and the sunshine buds,Great!,https://itunes.apple.com/us/review?id=585027354&type=Purple%20Software,2024-03-29T09:01:37-07:00
11098929589,Person287478266,https://itunes.apple.com/us/reviews/id1537180907,6.108.1,5,Good,Skibidi,https://itunes.apple.com/us/review?id=585027354&type=Purple%20Software,2024-03-29T08:19:49-07:00
11096589771,Mike Uriarte,https://itunes.apple.com/us/reviews/id177499586,6.108.1,5,House Cleaning,We watch pets for a living and could not survivor without Pristine…they make our our house perfect every time!,https://itunes.apple.com/us/review?id=585027354&type=Purple%20Software,2024-03-28T16:40:27-07:00
11096432364,jimiwato,https://itunes.apple.com/us/reviews/id198304754,6.108.1,5,Public Storage Ukee Janet,Thank you Janet for taking the time to assist me with my reservation and for showing me my unit!,https://itunes.apple.com/us/review?id=585027354&type=Purple%20Software,2024-03-28T15:35:53-07:00
11096183593,Befeeie,https://itunes.apple.com/us/reviews/id1522908980,6.108.1,5,Map,LOVE LOVE LOVE THIS APP !!! Great job google !!! Only map I use !!,https://itunes.apple.com/us/review?id=585027354&type=Purple%20Software,2024-03-28T13:54:11-07:00
11096134382,Alleleky67,https://itunes.apple.com/us/reviews/id744158444,6.108.1,5,CubeSmart,Ryan was very helpful make this very easy for me thank you so much Ryan,https://itunes.apple.com/us/review?id=585027354&type=Purple%20Software,2024-03-28T13:34:19-07:00
11095789958,Nancy0012,https://itunes.apple.com/us/reviews/id1157354597,6.108.1,5,Amazing Service!!!!,"I couldn’t have done anything on my phone with these guys. They were patient with my husband and I. They went through every step. Thank goodness for good workers

Ronald, Kenny, Trey and Jaden",https://itunes.apple.com/us/review?id=585027354&type=Purple%20Software,2024-03-28T11:21:41-07:00
11095628970,Silver thanks,https://itunes.apple.com/us/reviews/id609216443,6.108.1,5,Thank you to THE REAL Snyders AC!!!!,"I have been privileged to be a customer for a couple years now. Snyders has always been honest, reliable, professional and reasonable. Richard just left my house and did a warranty replacement on a 9 year old unit that wasn’t purchased from Snyders! He came out and got the warranty completed within 2 days of finding damage. He kept my unit running without issues and the unit has never worked better! I am truly grateful to have people and a company like Snyders AC. This is the only AC company to use!! Thanks Richard!!",https://itunes.apple.com/us/review?id=585027354&type=Purple%20Software,2024-03-28T10:23:50-07:00
11095111598,GarifunaStars(DJNelson),https://itunes.apple.com/us/reviews/id42469309,6.108.1,5,I AGREE,Unfortunately 7,https://itunes.apple.com/us/review?id=585027354&type=Purple%20Software,2024-03-28T07:36:57-07:00
11094596997,D.J. Sohn,https://itunes.apple.com/us/reviews/id1638244684,6.108.1,5,I Owe You,You make my life easy. I’m indebted. Thank you for everything.,https://itunes.apple.com/us/review?id=585027354&type=Purple%20Software,2024-03-28T04:56:13-07:00
11091757128,Camas Client,https://itunes.apple.com/us/reviews/id1058626160,6.108.1,5,Wonderful Service,"He came right on schedule, let me know he was on his way which was so nice. He changed my pilot light on my furnace and walked me through the process so I knew what he was doing and why. He is coming back later to do a maintenance on my AC. Very professional, they were highly recommended to me.",https://itunes.apple.com/us/review?id=585027354&type=Purple%20Software,2024-03-27T09:35:34-07:00
11091600098,Suri2029,https://itunes.apple.com/us/reviews/id208869324,6.108.1,5,Amazing,Excellent service fixed my friends phone! Definitely recommend,https://itunes.apple.com/us/review?id=585027354&type=Purple%20Software,2024-03-27T08:43:51-07:00