id,userName,userUrl,version,score,title,text,url,updated
7021276663,Abyslate,https://itunes.apple.com/us/reviews/id1136048279,137.2,4,What is wrong with the app,Hi so when I’m using google it always shows recent pages but when it’s on a recent page that looks different from the other one it goes back and forth on what recent page goes one had the x so you can delete it but the other one had you swiping it up so you can delete it like that when I’m using google the recent pages always changes and never stays the same it goes back and forth on what the recent page looks like and this is a problem for me cause most of the time it deletes my tabs,https://itunes.apple.com/us/review?id=284815942&type=Purple%20Software,2021-02-21T04:49:56-07:00
10107105649,jakeisley,https://itunes.apple.com/us/reviews/id789346498,271.1,1,Garbage browser,"What is the point of this app? Yes it’s Google search, but it needs to work as a browser when you actually click on a search result. Duh. But it is the worst browser I have ever used! Press the back button when you’ve been navigating click by click and page by page on a website, and what should happen? Any reasonable person reading this just said, “why, when you press the back button, you should be returned to the page you last viewed.” Yes, I agree. This app doesn’t, though. Nope, press the back button, and it skips over everything you’ve done for twenty minutes and takes you back to the original google search. What a joke.",https://itunes.apple.com/us/review?id=284815942&type=Purple%20Software,2023-07-05T09:44:57-07:00
9055790778,Punkimos,https://itunes.apple.com/us/reviews/id1105887228,227.0,2,Browser bar downgrade,"Previously, the tab had been updated to where you were not able to change or type in the browser at all once you searched something. Leaving you no choice but to close that tab and open a brand new one to find something else. It was terrible for me, but another update came out to return the tab back to the original ‘tap browser’ and change it to your liking. Yet again for some reason google decided to return that inconvenient tab setting. 
I downloaded Google for a reason, if I wanted another Safari I wouldn’t have downloaded Google.",https://itunes.apple.com/us/review?id=284815942&type=Purple%20Software,2022-09-05T12:36:05-07:00
5482988134,al..green,https://itunes.apple.com/us/reviews/id141061455,91.0,1,terrible new front page,"There used to be an option to exclude trending topics from the main page of the app, but it seems that’s been done away with. Now every time I open the app, I’m immediately confronted with some overblown, sensationalized news item or inane celebrity diet. And of course these links pop up exactly where the search bar used to be, so the instinct is still to tap there to use the app as usual. I’ve searched through the settings to find a way to change it back, but there doesn’t seem to be one (not anything obvious, anyway). It seems like google’s sold ad space on their front page. So I deleted the app. It was annoying enough, too many times a day. Yikes.",https://itunes.apple.com/us/review?id=284815942&type=Purple%20Software,2020-02-03T05:36:21-07:00
4189022446,FameVenue,https://itunes.apple.com/us/reviews/id600359264,74.0,5,Loving my Google.,"How did you find us?  New clients would say, from Google. Google has brought our historical venue, Broadway Studios and Fame Venue hundreds of clients from all over the world for corporate and special events.  

Google has provided us information which I consider the most educational and entertaining tools for everyone’s advancement and  added knowledge. 

Also, if I need to know anything like a food recipe, or a person of interest or go any where just Google it.  Proudly, I attribute my big success to Google. Thank you so much.",https://itunes.apple.com/us/review?id=284815942&type=Purple%20Software,2019-05-21T20:01:19-07:00
4051524970,BoomClap17,https://itunes.apple.com/us/reviews/id558658563,72.0,1,"Great before, now useless","This is a great app that I use almost everyday. It is very efficient and organized. One problem with the new update is painfully annoying however. Before, when the search bar was open, you could easily click on view all to see your search history. You could simply delete unimportant searches by swiping on them. Now, when you open your history, it has larger blacks showing searches, websites you visited (even if you didn't search for it) etc. You have to click THREE buttons to delete a single piece. It is incredulously annoying and basically a deal breaker. Google, please fix this immediately. I need to be able to see my history because I keep track of things there",https://itunes.apple.com/us/review?id=284815942&type=Purple%20Software,2019-04-23T14:09:39-07:00
3374809391,tinaya7,https://itunes.apple.com/us/reviews/id209510149,61.0,1,ABSOLUTE GARBAGE,"I LOVED this app. This was my go-to over safari over everything. I read the news on the cards, searched everything you could think of, watched videos. My life was on here. Then the update. The news cards don’t update with new stories. They just constantly tell me “we will add new stories when the time is right”. How pretentious of you pricks. When I do get a story its crap I don’t read. Sports crap and when I try to delete it to get a new card it BRINGS IT RIGHT BACK. The touch doesn’t respond anymore either. Jumps all around and does whatever it wants. Can’t save pictures to use as screen savers anymore unless I want to go directly to the site without any choice. DELETING THIS GARBAGE and going to either download bing or use built in safari. DUNZO.",https://itunes.apple.com/us/review?id=284815942&type=Purple%20Software,2018-11-02T21:48:50-07:00
3227705366,painterofgreece_2ne1,https://itunes.apple.com/us/reviews/id607883305,58.0,5,Google Always Comes Through.,"No matter where I am, what device I’m using, or what the default browser is... I always make sure that I’m browsing on Google.  From its first days, Google has been my browser of choice.  It covers all bases as far as my personal needs are concerned, and always gives fast, accurate and superior results.  Aside from its multitude of features, it presents my search results in easy to “digest” and use visual format .   It always makes surfing the web a pleasurable experience.",https://itunes.apple.com/us/review?id=284815942&type=Purple%20Software,2018-09-25T01:09:10-07:00
1879925274,MamaCharVA,https://itunes.apple.com/us/reviews/id508180705,37.0,5,Google is a Verb Too -,"I am a complete Google Geek... honestly, I have learned so much from “Googling” or “Googlizing” - word definitions & origins, history, scientific discoveries, celebrity nonsense, etc.  
- My family & friends make fun of me, because regardless of the question- if nobody can come up with an answer, my response is always “GoogleIt” yep 1 word.  So now they must all mock and respond in kind while putting goofy emphasis on the wrong syllable, oh yes and exaggerated facial expressions are a must too!  - They’re all just jealous of my extreme love for “The Google” - Admittedly, I am a Google addict.",https://itunes.apple.com/us/review?id=284815942&type=Purple%20Software,2017-10-27T19:50:00-07:00
10779528205,Marked Soul,https://itunes.apple.com/us/reviews/id1366463871,297.0,1,Song Search Not Working On IOS 17,"Only reason i downloaded this (EXTRA) app and widget was to use the song search using my voice (hum) because it wasnt working on chrome nor giving me an option for it on iphone 15, and even after downloading this and applying the widget it still gave no option or no way to voice search it saying “what song is this”, instead it searched “what song is this” then lead me to a forum saying to download the app and widget. Pointless app. 
Just use shazam if you wanna know a song, google isnt updated to the new phones or iphones in general apparently at the moment. Ill stick to just using chrome and gmail. Dont download if your looking to search a song.",https://itunes.apple.com/us/review?id=284815942&type=Purple%20Software,2024-01-03T08:57:06-07:00
4297160384,LA Living,https://itunes.apple.com/us/reviews/id412124889,74.1,4,Collected Items disappear,"My main issue I have with this app is my favorite pages constantly disappearing. I could mark a page that I would like to come back to later and I go into the little bookmarks or “collections” tab, and it’s not there. It’s annoying especially when I save articles I want to read later or pages I visit frequently only to open up my collections and be greeted with a “your collected items appear here” message. Yeah I know where they’re supposed to appear. I would just like them to actually be there when I look.",https://itunes.apple.com/us/review?id=284815942&type=Purple%20Software,2019-06-10T15:07:54-07:00
6064487450,tniecey,https://itunes.apple.com/us/reviews/id202261672,111.0,2,What’s going on with the Google app?,"I’ve had the Google app installed on this phone and several others and have never really had a problem with this app up until now. It was my go-to app for searches, trending news, etc. but as of yesterday while browsing through the homepage with my newsfeed it’ll just crash and kick me out. Not sure what has changed but it’s been doing this since yesterday and still is. I’ve even shut down and restarted my phone thinking this would help but it didn’t. I am currently using the iPhone 11 with automatic updates and I see that this app was last updated a few days ago. Perhaps the new update has caused a glitch?",https://itunes.apple.com/us/review?id=284815942&type=Purple%20Software,2020-06-11T14:32:40-07:00
5724480263,monica jomah,https://itunes.apple.com/us/reviews/id1006864965,99.0,5,Google is not working,I love the app it’s a nice app but all of a sudden it stop working and when ever I tried to get on the app it shut off back to my screen on my phone I didn’t know what to do bc it kept doing it so I deleted the app google and it said in the App Store that it is for iOS phone or something and the download button is not blue it won’t let me download google hopefully you guys will put it back bc I don’t know what happens know I have to google Crome but it happened with google chrome too so idk what to do.,https://itunes.apple.com/us/review?id=284815942&type=Purple%20Software,2020-03-27T22:24:44-07:00
4034315370,lihrcig,https://itunes.apple.com/us/reviews/id526759844,71.0,1,Discovery is as bad as it can be,"The google app has two main features:
• Google search: this is redundant with the search available in browser apps
• Discovery: a selection of news stories and web content supposedly tuned to the user’s interest. 

I won’t comment on Google search because it is the same basic search tool that I usually use from the browser. As the browser app has an important additional function the Google search app would be plain redundant it it was only for the search feature. 

Discovery has stopped working and this is the point where I am deleting the app. Before that, Discovery used to select cards that were mostly irrelevant to my interests (e.g. game of throne, celebrities, football and other very mainstream topics that are thrown into everyone’s face all the time from pretty much anywhere). Even though each card has a more/less switch to tune Discovery to an adequate selection of cards, it really doesn’t work at all and that’s to the point of being infuriating: clicking “less” makes the card vanish but only until the next refresh.",https://itunes.apple.com/us/review?id=284815942&type=Purple%20Software,2019-04-19T14:50:01-07:00
10069821333,Amboy Korling,https://itunes.apple.com/us/reviews/id1342483304,269.0,5,The best people you could ever ask for:,"Amboy Korling of Korling Construction and Habitat for Humanity put a roll-in shower for me. I have neuropathy and am confined to a wheelchair 100%
of the time. Habitat for Humanity put me in a hotel for my safety for 2 weeks. Amboy called me after eight days to say he was finished and that I could come home. (10 days early) The shower and spare bathroom for guests is WONDERFUL! I can't thank them enough!
You would be extremely happy hiring Korling Comstruction.
They are wonderful people and do
great work!  Evelyn Boyle of Santa Barbara",https://itunes.apple.com/us/review?id=284815942&type=Purple%20Software,2023-06-24T22:01:33-07:00
6087158860,Sucka4theCelloPlaya,https://itunes.apple.com/us/reviews/id382668757,111.0,1,Google Default Apps won’t let me choose other apps,"This is so frustrating. I used to love the Google search app but this problem is so infuriating. The app used to let me choose other apps as the default for opening links, maps for example. I had it set to Apple Maps as default when opening location. Then all of a sudden it switched to Google Maps without my knowing and it won’t let me switch back. I know exactly where to go in settings but the Default Apps setting just shows me “Featured Apps” and “Recommended Apps” all of which are Google. I don’t even see other options to change anything because that is all it will allow me to see. Please Google FIX THIS.",https://itunes.apple.com/us/review?id=284815942&type=Purple%20Software,2020-06-17T05:42:38-07:00
3334142559,ASmallGirlWithABigStar,https://itunes.apple.com/us/reviews/id253270318,60.3,4,Please read!!!,"I know that you spent time just for making Google but it's worth it. I gave this app 4 stars since the ""update"" came. I've got some problems with the update. Like for example, you search for an image on Google and you go to ""Images"" whenever you click on the photo, it's so different. Please bring back the old one like whenever you click on a photo you want, you can save it. But now, I've got some problems with the ""saving"" thing and I don't know anymore how to save a photo. But Google helps me with my homework so I'm glad of that.",https://itunes.apple.com/us/review?id=284815942&type=Purple%20Software,2018-10-23T04:01:33-07:00
3578327664,Motuu,https://itunes.apple.com/us/reviews/id186307517,65.0,5,Lens is amazing!,"The new google lens feature blows my mind! When I first saw the feature, I expected it to be extremely work in progress, as it was machine learning based. When I saw how well the feature worked, I was amazed! The fact that google released the feature fully operational (instead of as an experimental feature) is amazing! Even when the lighting is dark, lens still works (at least from my experience) The only thing weird I experienced was when it thought a suitcase was a purse XD!",https://itunes.apple.com/us/review?id=284815942&type=Purple%20Software,2018-12-26T22:19:01-07:00
4264134758,bennybaconburger,https://itunes.apple.com/us/reviews/id345163608,74.1,4,Great app. Staple for any device.,"One feature I wish was in the app was the 'open in News' button in the share menu. I'm not sure if Apple controls the shortcut for it and keeps it in Safari, or if Google has the ability to add the shortcut. Google sometimes recommends stories that I don't see in the News app recommendations. The News app is much less cluttered to read (also no annoying ads or crappy mobile site design).

Or, Google could make the UI from the feed much less cluttered and make a serious preference for AMP webpages shown in the feed.",https://itunes.apple.com/us/review?id=284815942&type=Purple%20Software,2019-06-04T13:05:38-07:00
10603165500,Plentyofjacks66,https://itunes.apple.com/us/reviews/id296395029,290.0,1,Share button(Safari) in the wrong place…,"I had to backup my iPhone, and start over. That meant that any app that needed to be updated, got updated. Including Google Search. The problem is when you search for something at first the share button is at the bottom(like it always has, and very convenient location. But when you go to that page or website, the share is located on the top right(sooo inconvenient). Why?? What’s next, the keyboard is going to be located at the top of everyone’s smartphone?? With all the updates, the smartphone isn’t what it used to be, when things were properly placed to be easier on your fingers(or thumbs). It’s Duck Duck Go. Google deleted.",https://itunes.apple.com/us/review?id=284815942&type=Purple%20Software,2023-11-19T12:12:16-07:00
8919150397,#iamawesome+cool,https://itunes.apple.com/us/reviews/id430740015,222.1,1,Terrible updates,"I used to really like this app and I liked it way more than Safari but the past updates have made this app so annoying to use. You used to be able to download images from search, but now you have to go onto the website the image is from to use it. When you open a tab now, it gives you this weird looking search window thing??? It doesn't reach the top of the screen which isn’t nice to look at and makes everything look really cramped. Also you cannot edit the url or search anything else without opening a new tab. I don’t think these changes were necessary at all and are just making the app bad.",https://itunes.apple.com/us/review?id=284815942&type=Purple%20Software,2022-07-27T21:30:34-07:00
8702011209,Mongul,https://itunes.apple.com/us/reviews/id112652954,213.0,1,Sport Score Notifications not working,"I don’t receive notifications about sports scores. iOS 15.5. iPhone 12. Yes, system notifications are on. Yes, it shows that I am following the team and the notification bell for the game is on. Yes, silent switch is off. Yes, I re-downloaded app. 
When a score is made….silence. Nothing. How can every sports app never fail at sending score notifications but somehow Google struggles with this task? Maybe they need to fire their current engineers and hire the ones on the other apps. If there’s any other info you need to solve the problem, then give me some of those ad dollars. Otherwise, my eyes pay you to figure it out. I’ve notified you, that’s all you’re getting.",https://itunes.apple.com/us/review?id=284815942&type=Purple%20Software,2022-05-23T20:12:34-07:00
8670752173,Fenoel10,https://itunes.apple.com/us/reviews/id272693435,211.1,5,I love it,It is really good it does not lag you can literally search whatever you want it gives you choices if you want to do videos or pictures I’m like it’s really I recommend it if you really like look at you like a mysterious person and you want to know a lot and like you’re like we’re like you really need to know this one thing at school you go to search it up and get the answer it’s really good whoever made it thank you I really recommend it,https://itunes.apple.com/us/review?id=284815942&type=Purple%20Software,2022-05-14T10:04:45-07:00
1895966495,Talia whoever,https://itunes.apple.com/us/reviews/id475005224,34.1,4,Great! Just one issue...,"Google has worked perfectly for as long as I've had the app. Only recently, however, I am experiencing interruptions anytime I visit a website. I can only be on the site a few seconds before the screen goes blank and it says ""webpage cannot be found"". If I reload the screen a few times, it goes back to normal, only to display the same annoying message AGAIN and again. This is especially obnoxious when I am trying to watch an online movie or researching for school. Fix this problem please :/",https://itunes.apple.com/us/review?id=284815942&type=Purple%20Software,2017-11-03T21:59:28-07:00
2125295764,ldfairweather,https://itunes.apple.com/us/reviews/id236419820,41.0,2,I agree with johannesien—WAY TOO LIBERAL.,"I couldn’t agree more.  I do specific searches, say for Trump, and am shown options of images and articles that are BLATANTLY leftist...C’mon, Google, you were flawless and impressive not long ago, but this liberal slant (massive UNDERstatement) is so obvious, that the you’re still the talk-of-the-town amongst many, many years people, but the talk is often ugly.

Why can’t you just return to making really awesome things, and stop trying to subversively affect the thinking of those who aren’t aware of your surreptitious attempts to influence people’s political views...(Most) people aren’t the cretins you appear to believe they are, so bring us back the old, awesome, non-political Google!!  We miss it!",https://itunes.apple.com/us/review?id=284815942&type=Purple%20Software,2018-01-25T05:23:17-07:00
9740656744,FrostyTheSnowdog,https://itunes.apple.com/us/reviews/id10523750,256.2,1,Bad News,"Ya, I can still get to the search bar pretty quickly worth this app, but there are several entry points there. One main reason I originally added this app in a prominent place to my home screen is the well-sorted and relevant news items. This feature has gotten worse and worse and worse. It’s now a doom scrolling collection of the same 5 articles that have little to absolutely no interest or impact to me. I no longer can rate these articles or say “don’t show this again”. Now, Hide is still available but I scroll a few pixels and see the same thing again or open the app later to see what I hid earlier now as the first item. I wonder how the Bing app is?",https://itunes.apple.com/us/review?id=284815942&type=Purple%20Software,2023-03-22T10:45:47-07:00
9052626094,Benshenten,https://itunes.apple.com/us/reviews/id914713814,227.0,5,Absolutely Mindblowing,I used to use Google a lot and then I stopped because safari was the default browser and therefore it was much more compatible. But recently I downloaded Google again and the abilities it has as a browser are unmatched. And with the constant update I find google not only repairs bugs but they add new features often. Overall 5 stars for sure I couldn’t think of anything else I’d need from a browser. :),https://itunes.apple.com/us/review?id=284815942&type=Purple%20Software,2022-09-04T13:11:13-07:00
7438984337,EuniceDubham;,https://itunes.apple.com/us/reviews/id1251793459,163.0,2,Get google chrome instead,"This app is so slow to the point to where it’s unusable, especially on boot. The user feedback is terrible as well; I press the back and forward arrow buttons on the bottom of the screen and I can’t even tell if I clicked on them or not. It gets even worse considering after you actually do press the button, it takes forever to go to the previous page. When you press on the search bar, it stalls for a bit, and if you’re typing while it stalls, none of the letters register.
On the other hand, I’ve experienced hardly any problems using google chrome.",https://itunes.apple.com/us/review?id=284815942&type=Purple%20Software,2021-06-07T16:54:29-07:00
6217951115,wor x bxj wor hr,https://itunes.apple.com/us/reviews/id182492379,116.0,1,Bad Algorithms,"I do not know how many times I can tell the algorithms I am not interested in sports, or hip-hop, pop culture, drag queens, or everything else uninteresting for content the app relentlessly pushed on me. The app gives useless to me articles, I had expected it to listen to my tastes and wants. It did not at all. Which is surprising given that Google seems to pride itself in knowing its customers. I did not search these things. I did not engage these articles. I would use the in app article touch-click menus to hide the articles or say that I was uninterested in the content, but this gets tedious, time after time after time. 

It didn’t do what was expected or perform well after 6 months of almost daily use. So, I deleted it.",https://itunes.apple.com/us/review?id=284815942&type=Purple%20Software,2020-07-19T15:34:44-07:00
6001912181,B Dami,https://itunes.apple.com/us/reviews/id193640225,109.0,5,Review,"One of the finest gentleman I have met here at the car dealership is Mr. Alex Steiner. He is several people compressed into one single genius. He has been extraordinarily helpful in allaying all of my concerns, solving all my technical problems, and answering quickly and efficiently a mountain of questions I had for him. I recommended any customer coming to this dealership in need of highly specialized experience in technology go directly to Alex. Truly a wonderful gentleman, very courteous, and I recommend the most highly.",https://itunes.apple.com/us/review?id=284815942&type=Purple%20Software,2020-05-27T13:09:40-07:00
5781946912,Emilia1994,https://itunes.apple.com/us/reviews/id359138784,101.0,2,Getting directions,"Well every time I search a place using google and want to get directions to that place it doesn’t give it to me through my iPhone map gps anymore. there’s no way of getting directions to a place through iPhone maps like it used to work. Very upset and frustrated because now I have to manually type in the address every time through my iPhone maps.

Update - map issue is still a problem and I guess they’re not going to fix it ever. Also since this new update, I can’t have the app opened past a certain time limit because now it completely backs out and closes on me within the minute I open the app.",https://itunes.apple.com/us/review?id=284815942&type=Purple%20Software,2020-04-08T10:37:32-07:00
4733391079,zeusxoxo,https://itunes.apple.com/us/reviews/id1058506198,81.0,5,Outstanding place in Cienfuegos Cuba,"Camilas hostal was the most beautiful peaceful place to stay, arrive to pure beauty. It was easy to find not far from center of Cienfuegos center and close to other attractions. The best of it all was being welcomed by Alejandro getting our accommodation, while explaining everything very thoroughly also very helpful with recommendations. Top it off with the restaurant, very delicious affordable prices, great beverages, outstanding service peaceful by the water. I highly recommend this stay at Camilas hostal in Cienfuegos, I must say a return. 

Jeanie",https://itunes.apple.com/us/review?id=284815942&type=Purple%20Software,2019-09-05T20:43:01-07:00
