id,userName,userUrl,version,score,title,text,url,updated
11063495958,chilalqnguis,https://itunes.apple.com/us/reviews/id662391111,33.9.0,5,Agradecido a tik-tok,"He aprendido muchas cosas en tik-tok hay de todo pero es como todo agarras lo que te sirva y lo demás es basura , libre expresión gracias tik-tok y he comprado muchas cosas en su tienda tik-tok gracia gracias",https://itunes.apple.com/us/review?id=835599320&type=Purple%20Software,2024-03-19T17:29:47-07:00
11063489867,Taly1108,https://itunes.apple.com/us/reviews/id1262408648,33.9.0,5,I think it’s absolutely amazing,5 STARS✨✨✨✨,https://itunes.apple.com/us/review?id=835599320&type=Purple%20Software,2024-03-19T17:27:10-07:00
11063488054,I go by Dee-Dee,https://itunes.apple.com/us/reviews/id1273397947,33.8.0,5,I love TikTok,The algorithm is immaculate 🤌🏽,https://itunes.apple.com/us/review?id=835599320&type=Purple%20Software,2024-03-19T17:26:24-07:00
11063481530,sueños magicos,https://itunes.apple.com/us/reviews/id704965022,33.8.0,5,Habilidad en des estrés pasa tiempo enseñanzas,😘✨✨🤣,https://itunes.apple.com/us/review?id=835599320&type=Purple%20Software,2024-03-19T17:23:40-07:00
11063476013,zoie8,https://itunes.apple.com/us/reviews/id1145287512,33.9.0,1,my honest review,i don’t think this app is fair. i’ve had to make multiple accounts because they get banned for no reason. anyone can report you and then your account gets deleted. they do nothing to confirm with you.,https://itunes.apple.com/us/review?id=835599320&type=Purple%20Software,2024-03-19T17:21:23-07:00
11063469622,mrs Pettybootz,https://itunes.apple.com/us/reviews/id1280633979,33.8.0,5,Really nice,You can really spread love and laughter and learn knowledge is power,https://itunes.apple.com/us/review?id=835599320&type=Purple%20Software,2024-03-19T17:18:44-07:00
11063469134,Mrjazzm,https://itunes.apple.com/us/reviews/id1445092222,33.8.0,5,Awesome app,Awesome app to use and do video’s meet people live videos cool.,https://itunes.apple.com/us/review?id=835599320&type=Purple%20Software,2024-03-19T17:18:30-07:00
11063462980,Soylahermanafeliz,https://itunes.apple.com/us/reviews/id1458366024,33.9.0,5,Soylahermanafeliz,Wa,https://itunes.apple.com/us/review?id=835599320&type=Purple%20Software,2024-03-19T17:15:54-07:00
11063456746,I'llkillyouuntilyoudie,https://itunes.apple.com/us/reviews/id535775536,33.9.0,1,Won’t let me change my location,It won’t let me change the location on one of my videos that I tried to edit the location of.,https://itunes.apple.com/us/review?id=835599320&type=Purple%20Software,2024-03-19T17:13:23-07:00
11063453506,CTGirlinTX,https://itunes.apple.com/us/reviews/id533632799,33.8.0,5,Love this app,I love TikTok my favorite app so entertaining and informative and fun for all ages,https://itunes.apple.com/us/review?id=835599320&type=Purple%20Software,2024-03-19T17:12:02-07:00
11063446120,cmandant,https://itunes.apple.com/us/reviews/id740753435,33.8.0,5,Un loisir,"Un plaisir ; un divertissement tiktok pour moi un loisir de rencontrer de nouveaux amis, amies aussi",https://itunes.apple.com/us/review?id=835599320&type=Purple%20Software,2024-03-19T17:08:56-07:00
11063437131,Skz4life4114,https://itunes.apple.com/us/reviews/id1629624005,33.9.0,5,I love TikTok,I love TikTok,https://itunes.apple.com/us/review?id=835599320&type=Purple%20Software,2024-03-19T17:05:10-07:00
11063435341,bamavseverybody,https://itunes.apple.com/us/reviews/id1403434586,33.8.0,5,TikTok,Whoever came up with TikTok I love it!!! It is my favorite app,https://itunes.apple.com/us/review?id=835599320&type=Purple%20Software,2024-03-19T17:04:27-07:00
11063434946,Amway Ronocerontes,https://itunes.apple.com/us/reviews/id1574674734,33.8.0,1,Que bonito es conocer a cristo,Que bonito,https://itunes.apple.com/us/review?id=835599320&type=Purple%20Software,2024-03-19T17:04:16-07:00
11063433288,adj4323,https://itunes.apple.com/us/reviews/id1244968263,33.9.0,1,Discriminating,I have been living in the US for two years but tiktok refuses to change my region to the united states. I have sent countless emails and wrote so many reports. All of them get automated messages that do not help at all. This is keeping me from joining rewards programs!! Tiktok is trying to keep creators away from making money.,https://itunes.apple.com/us/review?id=835599320&type=Purple%20Software,2024-03-19T17:03:34-07:00
11063424516,Keke jatoria,https://itunes.apple.com/us/reviews/id1585173023,33.9.0,5,TikTok,I LOVEE TikTok sooo much I watch it everyday I can watch it for hours and hours and hours,https://itunes.apple.com/us/review?id=835599320&type=Purple%20Software,2024-03-19T16:59:54-07:00
11063421655,yourasstoes,https://itunes.apple.com/us/reviews/id1197001521,33.9.0,5,Tik tok,I think TikTok is the best I started in 2016 with my brother in musical.ly and we both love to a lot now I’m here watching videos scrolling all day and I love it so much.,https://itunes.apple.com/us/review?id=835599320&type=Purple%20Software,2024-03-19T16:58:42-07:00
11063418710,fjdncnrnfhd,https://itunes.apple.com/us/reviews/id1445103615,33.9.0,4,It’s ok,This app is very cool but it’s just like I keep seeing these inappropriate posts and I report them but the accounts keep getting banned so this why it’s a 4 it would be a 5 if it didn’t have those inappropriate accounts and posts.,https://itunes.apple.com/us/review?id=835599320&type=Purple%20Software,2024-03-19T16:57:26-07:00
11063417397,Sara Obada,https://itunes.apple.com/us/reviews/id189785458,33.8.0,5,Obada bader,Good,https://itunes.apple.com/us/review?id=835599320&type=Purple%20Software,2024-03-19T16:56:52-07:00
11063415645,dwbitcard,https://itunes.apple.com/us/reviews/id1349934180,33.9.0,1,BRING MY SLIDESHOW BACK,Tiktok is getting one star because they have removed my slideshow,https://itunes.apple.com/us/review?id=835599320&type=Purple%20Software,2024-03-19T16:56:08-07:00
11063415621,Soy chivasss,https://itunes.apple.com/us/reviews/id1368080127,33.8.0,5,Buena noche,Hola,https://itunes.apple.com/us/review?id=835599320&type=Purple%20Software,2024-03-19T16:56:08-07:00
11063414644,Btta13,https://itunes.apple.com/us/reviews/id767694926,33.8.0,5,Spread the love,I think it’s great but hope they would give opportunity to those who start it hard,https://itunes.apple.com/us/review?id=835599320&type=Purple%20Software,2024-03-19T16:55:44-07:00
11063407679,م الساعدي الثمالي,https://itunes.apple.com/us/reviews/id798587618,33.8.0,5,ممتاز,ممتاز,https://itunes.apple.com/us/review?id=835599320&type=Purple%20Software,2024-03-19T16:52:50-07:00
11063403238,RSGKiller77,https://itunes.apple.com/us/reviews/id287757933,33.9.0,5,Fun,Such a great app to just lay around if you don’t wanna watch a long YouTube video I’ve learned so much on TikTok and you will too 🤓😇😃,https://itunes.apple.com/us/review?id=835599320&type=Purple%20Software,2024-03-19T16:50:59-07:00
11063401287,African king/queen,https://itunes.apple.com/us/reviews/id333870939,33.8.0,5,It great,Go follow me @ Missbelange,https://itunes.apple.com/us/review?id=835599320&type=Purple%20Software,2024-03-19T16:50:10-07:00
11063391871,Big Kooty,https://itunes.apple.com/us/reviews/id1427961291,33.7.0,5,Tik tok lover,I love tik tok It’s the best of them alll,https://itunes.apple.com/us/review?id=835599320&type=Purple%20Software,2024-03-19T16:46:09-07:00
11063376185,dufujrjejxjf,https://itunes.apple.com/us/reviews/id1372100663,33.8.0,5,T,Tnr,https://itunes.apple.com/us/review?id=835599320&type=Purple%20Software,2024-03-19T16:39:30-07:00
11063371796,Tiger1929,https://itunes.apple.com/us/reviews/id1460606071,33.8.0,5,Bueno,Muy buena app interesante increíble incomparable muy incomparable,https://itunes.apple.com/us/review?id=835599320&type=Purple%20Software,2024-03-19T16:37:37-07:00
11063367057,Nannysgr,https://itunes.apple.com/us/reviews/id259248381,33.8.0,5,🫶🏽,I suffer from adhd and this app for some reason helps me not to overthink all the time,https://itunes.apple.com/us/review?id=835599320&type=Purple%20Software,2024-03-19T16:35:35-07:00
11063365135,Hardworker wants to jam too!,https://itunes.apple.com/us/reviews/id670968406,33.7.0,5,Cool tik’s,Always enjoyable! Sometimes inspiration strikes via viewing Tik’s! And it’s fun to view people’s creative side!,https://itunes.apple.com/us/review?id=835599320&type=Purple%20Software,2024-03-19T16:34:48-07:00
11063365095,Unicorn Mayor,https://itunes.apple.com/us/reviews/id1612264110,33.9.0,5,From Daleyza Mayorga,"TikTok change my life to happiness. As soon when I found TikTok I knew that was my favorite app to be happy. I can watch videos and like find new favorite songs on there and go live with other people, and I have been on TikTok since for the past like six years and I found TikTok, happy enjoying and loving💝",https://itunes.apple.com/us/review?id=835599320&type=Purple%20Software,2024-03-19T16:34:46-07:00
11063362567,Juwany merman,https://itunes.apple.com/us/reviews/id447525543,33.8.0,5,Love this for all!!,Just loving it for everything!! Fun and funny! Inspiring and motivating! Educational too! Self expression and love!! Is what life is about!!✨,https://itunes.apple.com/us/review?id=835599320&type=Purple%20Software,2024-03-19T16:33:43-07:00
11063362337,SASQUATCHADON,https://itunes.apple.com/us/reviews/id20274560,33.8.0,5,SASQUATCHADON APPROVES!¡!,Tiktok goOood.,https://itunes.apple.com/us/review?id=835599320&type=Purple%20Software,2024-03-19T16:33:38-07:00
11063361985,Tata1717,https://itunes.apple.com/us/reviews/id200820926,33.8.0,5,Me encanta,Es la mejor de las redes! Donde encuentras todo tipo de ventas noticias diversión todo!,https://itunes.apple.com/us/review?id=835599320&type=Purple%20Software,2024-03-19T16:33:29-07:00
11063356509,Jaydalynn Dixon,https://itunes.apple.com/us/reviews/id1581089180,33.8.0,5,TikTok,TikTok helps me express myself and it has things I love I love tiktok,https://itunes.apple.com/us/review?id=835599320&type=Purple%20Software,2024-03-19T16:31:12-07:00
11063356179,chulo cb,https://itunes.apple.com/us/reviews/id585951895,33.8.0,5,Very good,Very good app,https://itunes.apple.com/us/review?id=835599320&type=Purple%20Software,2024-03-19T16:31:03-07:00
11063354083,fancygirlbeauty,https://itunes.apple.com/us/reviews/id348186131,33.8.0,5,Excelente,Muy buena terapia para las persona que quieren reír sin hacer daño a sus prójimo este es el mejor modo de votar el estrés,https://itunes.apple.com/us/review?id=835599320&type=Purple%20Software,2024-03-19T16:30:09-07:00
11063353065,Rylee Raymer,https://itunes.apple.com/us/reviews/id1602614405,33.9.0,5,I love TikTok,It’s amazing for entertainment I love to watch it when I’m bored and there is nothing else to do,https://itunes.apple.com/us/review?id=835599320&type=Purple%20Software,2024-03-19T16:29:43-07:00
11063338594,Hola momy,https://itunes.apple.com/us/reviews/id1368630695,33.9.0,1,Worst app,This is so bad I went on Tik Tok  I am 13 so thy set up a private account for me since I am under 16 and I post 3 vids I don’t show my face for privacy reasons for some reasons I add another account and for some reason it says you look under age,https://itunes.apple.com/us/review?id=835599320&type=Purple%20Software,2024-03-19T16:23:42-07:00
11063337275,好日,https://itunes.apple.com/us/reviews/id205089842,33.9.0,1,Tik tok is the WORST.,"Tik tok have the worst guidelines and unfair treatments, they will ban you for allegedly disobeying the rules but never say what you’ve done directly. But when someone does someone worse like explicit content, IT DOESN’T GET BANNED. However, the ones who barely did harm (literally none) get banned for a misinterpretation. Tik tok needs to fix itself.",https://itunes.apple.com/us/review?id=835599320&type=Purple%20Software,2024-03-19T16:23:09-07:00
11063335138,carterasalejandracondor,https://itunes.apple.com/us/reviews/id1189251287,33.8.0,5,Lo mejor,Que existe,https://itunes.apple.com/us/review?id=835599320&type=Purple%20Software,2024-03-19T16:22:16-07:00
11063333917,Cfloc,https://itunes.apple.com/us/reviews/id559119604,33.8.0,5,TikTok,TikTok is the best!!,https://itunes.apple.com/us/review?id=835599320&type=Purple%20Software,2024-03-19T16:21:46-07:00
11063333319,Joemamaoger,https://itunes.apple.com/us/reviews/id1540040776,33.9.0,5,I like TikTok,TikTok is cool I like it I gave it five stars,https://itunes.apple.com/us/review?id=835599320&type=Purple%20Software,2024-03-19T16:21:30-07:00
11063311796,Charlie Grace damelio,https://itunes.apple.com/us/reviews/id1637313836,33.9.0,5,Happy,This app made me so happy 😊,https://itunes.apple.com/us/review?id=835599320&type=Purple%20Software,2024-03-19T16:12:33-07:00
11063308082,Chulla vidas,https://itunes.apple.com/us/reviews/id1595240917,33.8.0,5,Es la mejor aplicación del momento,Espero que activen para monitizar los videos con 5000 seguidores gracias,https://itunes.apple.com/us/review?id=835599320&type=Purple%20Software,2024-03-19T16:10:58-07:00
11063304527,مازن هاشم,https://itunes.apple.com/us/reviews/id1637313236,33.8.0,5,بغداد,مازن هاشم,https://itunes.apple.com/us/review?id=835599320&type=Purple%20Software,2024-03-19T16:09:31-07:00
11063303327,Ask her anything,https://itunes.apple.com/us/reviews/id1527931044,33.8.0,5,Great App,Best yet,https://itunes.apple.com/us/review?id=835599320&type=Purple%20Software,2024-03-19T16:09:01-07:00
11063299651,Dulce novas,https://itunes.apple.com/us/reviews/id1128387790,33.8.0,5,Excelente!,Una aplicación muy entretenida,https://itunes.apple.com/us/review?id=835599320&type=Purple%20Software,2024-03-19T16:07:31-07:00
11063298659,breě,https://itunes.apple.com/us/reviews/id734556100,33.9.0,5,love .,this app has gotten me through everything i love it!,https://itunes.apple.com/us/review?id=835599320&type=Purple%20Software,2024-03-19T16:07:06-07:00
11063297492,Janet Parra,https://itunes.apple.com/us/reviews/id526307503,33.8.0,5,Best app ever 🤩 literally,I enjoy learning new things ♥️I love it more than facebook or instagram ♥️,https://itunes.apple.com/us/review?id=835599320&type=Purple%20Software,2024-03-19T16:06:37-07:00