id,userName,userUrl,version,score,title,text,url,updated
10888639794,gamagoo,https://itunes.apple.com/us/reviews/id561593260,301.0,1,Not that great,"App like to refresh webpages as I’m reading styles or other websites. Rather annoying.

The back buttons or other buttons disappear forcing me to either swipe from the left of the app, or restart the app.

Deleting the app after giving it a try.",https://itunes.apple.com/us/review?id=284815942&type=Purple%20Software,2024-02-01T05:04:04-07:00
10887227961,layla23badddiw,https://itunes.apple.com/us/reviews/id227231561,301.0,1,DONT DISRESPECT ME..!!,don’t ever think you can update my fricking google when i have my auto update off like what don’t get popped don’t ever disrespect me you fugly mugly rusty crusty monkey,https://itunes.apple.com/us/review?id=284815942&type=Purple%20Software,2024-01-31T20:21:28-07:00
10886997265,Spicy pics,https://itunes.apple.com/us/reviews/id1619933517,301.0,5,Best app for spicy pics,Best app for spicy pics,https://itunes.apple.com/us/review?id=284815942&type=Purple%20Software,2024-01-31T18:51:54-07:00
10886880329,* SUPREME,https://itunes.apple.com/us/reviews/id1365797464,301.0,1,Getting Worse By The Day,"THIS Search Engine used to be so reliable. Now, It’s just incompetent. It doesn’t even show my Search History that I enabled.",https://itunes.apple.com/us/review?id=284815942&type=Purple%20Software,2024-01-31T18:08:40-07:00
10886789861,Buthere,https://itunes.apple.com/us/reviews/id1619912829,301.0,5,Purchase of Lexus Rx 350,Experience with the salesman was pleasant he took the time to make sure that I was satisfied with my purchase. He was extremely helpful in ensuring that I was comfortable with the vehicle and operating features; and took the time to demonstrate some of the ways to operate features on this new vehicle. The salesman also advised that I can always call him if I have any questions on my new purchase. I would recommend customers to Lexus of palm beach - sales man Mr Arlington Spencer,https://itunes.apple.com/us/review?id=284815942&type=Purple%20Software,2024-01-31T17:33:44-07:00
10886503330,Kristamhu,https://itunes.apple.com/us/reviews/id506435259,301.0,1,Trash!!,Google is just another paid ad generator and an extension of the corrupt stock market.  Sad because google use to have a vision now they have hungry shareholders to feed. Another public traded disappointment.,https://itunes.apple.com/us/review?id=284815942&type=Purple%20Software,2024-01-31T15:39:46-07:00
10886040040,Why is google so bad,https://itunes.apple.com/us/reviews/id1162677560,301.0,1,Why Crome is better,So bad Can’t even work on my phone anymore,https://itunes.apple.com/us/review?id=284815942&type=Purple%20Software,2024-01-31T12:31:25-07:00
10886007326,Sydne0101,https://itunes.apple.com/us/reviews/id118532839,301.0,1,Setting up a nest thermostat is almost impossible,"When going through the flow to setup a google nest thermostat, it fails to connect to the thermostat 95% of the time. I’ve factory reset the thermostat multiple times, as the app suggests, and it still doesn’t work. I’ve tried both by QR code (the setup flow is completely exited and nothing gets added) and by code and it still won’t connect. This has happened to me every time I have attempted to connect a nest to google home, 5 different time at this point. The last 4 times it did eventually work. Is this app QAed? Do you have integration tests? It appears not.",https://itunes.apple.com/us/review?id=284815942&type=Purple%20Software,2024-01-31T12:17:49-07:00
10885764691,Miaarobb1,https://itunes.apple.com/us/reviews/id1518013099,301.0,2,Blank search results,"When I search on Google, the search results are white/blank. Can y’all plz fix this?",https://itunes.apple.com/us/review?id=284815942&type=Purple%20Software,2024-01-31T10:35:07-07:00
10885484190,J4S0NT4K3R,https://itunes.apple.com/us/reviews/id807791178,301.0,5,a good way to search for what u need,"this is the best searching site I ever downloaded!!
go download it if u didn’t bcz u can find anything and I mean ANYTHING u want to know about.this is a simply 5 star app",https://itunes.apple.com/us/review?id=284815942&type=Purple%20Software,2024-01-31T09:01:56-07:00
10884700007,Dimitri1177,https://itunes.apple.com/us/reviews/id115402459,301.0,3,Awesome yet frustrating,"One of my favorite apps with one very annoying feature.  The feed automatically refreshes every time you open the app.  
Let’s say you’re working your way down the feed like we all do.  If you switch apps or have to put your phone down, you’re greeted to a completely different feed when you return.    

Sometimes it refreshes as your looking at the feed.  You’ll see something you want to read and as you go to click on it… poof it’s gone.",https://itunes.apple.com/us/review?id=284815942&type=Purple%20Software,2024-01-31T05:09:13-07:00
10883336805,Sus24345345,https://itunes.apple.com/us/reviews/id1467168771,301.0,5,Sus,Sus,https://itunes.apple.com/us/review?id=284815942&type=Purple%20Software,2024-01-30T20:23:18-07:00
10883226680,polarizing my nuts,https://itunes.apple.com/us/reviews/id130536418,301.0,5,Idk,Gay birthday party was eyeoe last night and you were invited so I don’t have to be at work at night or not until I see the kids at night and then the night after the night and the night before we go back out to see what the kids can go to the movies I have a few days and no more I think I’m not doing that but do I think about the other person or something I just don’t know how much they do but they have a bunch and I have a new phone so they are no longer available for the kids to see the same as they are and they are going to be in the etiology so they will not,https://itunes.apple.com/us/review?id=284815942&type=Purple%20Software,2024-01-30T19:38:37-07:00
10883050332,ME RIGHT I KNOW THAT🤓,https://itunes.apple.com/us/reviews/id627554073,301.0,1,give me free primogems,GIVE ME NAHISA GOOGLE 🤬🤬🤬,https://itunes.apple.com/us/review?id=284815942&type=Purple%20Software,2024-01-30T18:31:28-07:00
10882895283,Pooh-bears14,https://itunes.apple.com/us/reviews/id827699125,301.0,1,W,I don’t like how I’m trying to download it but it’s trying to make me pay for it,https://itunes.apple.com/us/review?id=284815942&type=Purple%20Software,2024-01-30T17:31:16-07:00
10882846839,Jupiter plwase,https://itunes.apple.com/us/reviews/id1546931592,301.0,1,I NEED HOMEWORK ANSWERS,"My homework is really hard so I decided to use google bc I saw an ad that it would give homework answers. WELL IF U READING THIS DONT USE GOOGLE FOR ANSWERS ON HOMEWORK IT WILL NOT WORK IT JUST HIGHLIGHTS THE WORDS AND DOESNT EVEN GIVE YOU ANSWERS AND IT SHOWS PICTURES TELLING YOU HOW TO DO DIFFRENT HOMEWORK! so I do not recommend google as a cheat sheet, 
thank you",https://itunes.apple.com/us/review?id=284815942&type=Purple%20Software,2024-01-30T17:11:44-07:00
10882679003,Fjdjdjsofjfjdie,https://itunes.apple.com/us/reviews/id955119914,301.0,5,Hi,So that really works,https://itunes.apple.com/us/review?id=284815942&type=Purple%20Software,2024-01-30T16:01:41-07:00
10882006912,TDC0430,https://itunes.apple.com/us/reviews/id237723665,301.0,1,CAN’T SAVE IMAGES.  ZERO STARS,Can’t save images. Very cluttered user interface. Lots of ads and sponsored top hits in search. Lame app.  The worse built in browser. Constantly scrolls you to the top while viewing article,https://itunes.apple.com/us/review?id=284815942&type=Purple%20Software,2024-01-30T11:19:34-07:00
10881716506,Phil Pendleton,https://itunes.apple.com/us/reviews/id115828131,301.0,3,Click sleeves,I need you to send me some large click sleeves with instructions on how to install them. My left hearing aid has no click sleeves at all. In addition I need some batteries and instructions on how to take out the old and replace them with the new which you will send me.,https://itunes.apple.com/us/review?id=284815942&type=Purple%20Software,2024-01-30T09:31:18-07:00
10880133879,Mohammad Tohidi,https://itunes.apple.com/us/reviews/id258413299,301.0,4,App could get better unlike on Windows,"It’s good to be able to keep emails organized and to see what they can be done with. But here are some things that I would find useful to be done in the app. It’s that there’s constant spam mail entering my spam bin, and although I have tried to mute or even permanently delete them without opening the spam mail. The same thing just keeps coming. I have tried doing changes from the website, but there doesn’t seem to be a solution to solve this issue.

Although I can’t do anything, I would suggest Gmail to come up with a solution by coming up with an automated system that will automatically delete all spam messages that are being sent to the user both now and in the future.

Generally though, the automated version of organizing emails has been very useful and convenient, and I thank the developers for this activity.",https://itunes.apple.com/us/review?id=284815942&type=Purple%20Software,2024-01-29T23:56:19-07:00
10879932075,bushymoon,https://itunes.apple.com/us/reviews/id1483879350,301.0,1,Do not download google,"This app is horrible and I hate the company. Duck duck go is a better search engine, there are a lot of options that are better than google. Google is not secure",https://itunes.apple.com/us/review?id=284815942&type=Purple%20Software,2024-01-29T22:21:24-07:00
10879810227,Leannejh,https://itunes.apple.com/us/reviews/id263373356,301.0,1,New home page disgraceful,AI is taking over the world. I feel I can’t search like I used to and the results are too big to where I get nothing out of it. I switched to another search engine and I’m very happy.,https://itunes.apple.com/us/review?id=284815942&type=Purple%20Software,2024-01-29T21:22:35-07:00
10879532582,Sparccds,https://itunes.apple.com/us/reviews/id113421694,301.0,1,Personal Data Harvesting,"Google is harvesting ALL of your personal information and makes billions of dollars quarterly doing so. Don’t believe me, look up their financial records by visiting any stock reporting website. 

People need to be more aware and take back control over what these companies are doing to make money by harvesting people’s personal data and information.

Google is a GIANT snake in the grass!!!",https://itunes.apple.com/us/review?id=284815942&type=Purple%20Software,2024-01-29T19:16:45-07:00
10879178867,Vaporü,https://itunes.apple.com/us/reviews/id877623507,301.0,1,Worthless,You have to make a microtransaction otherwise you can’t get your files,https://itunes.apple.com/us/review?id=284815942&type=Purple%20Software,2024-01-29T16:48:41-07:00
10878866614,my3 cents,https://itunes.apple.com/us/reviews/id1296076166,301.0,5,Google,Would be lost without my Google app. Best way to get accurate quick information!,https://itunes.apple.com/us/review?id=284815942&type=Purple%20Software,2024-01-29T14:30:52-07:00
10878766715,Thecoolduck4125,https://itunes.apple.com/us/reviews/id1124250209,301.0,2,I’m so frustrated,Well the thing is it is very helpful and supports what I need and gives answers but sometimes when I search something up it doesn’t answer my question and gives me other options but it’s not what I want,https://itunes.apple.com/us/review?id=284815942&type=Purple%20Software,2024-01-29T13:46:53-07:00
10877682091,Tweeplin ツ,https://itunes.apple.com/us/reviews/id1098095865,300.0,1,Don’t like the new update.,"Hey Google, I’m writing this review because I’ve been having problems with the new update. The search bar is at the bottom of the screen which takes up around 50% of the screen. It’s very irritating whenever I try to swipe out, because it always thinks I’m searching something up. The app freezes and crashes much easier than before, I have no idea if it’s just my phone, or if it’s the app. Many of the useful accessibilities had also gotten removed, 
(like the small arrows at the left bottom corner of the screen) and whenever I try to go back a single tab, it brings me straight back to the search screen. Very unsatisfied by the new format.",https://itunes.apple.com/us/review?id=284815942&type=Purple%20Software,2024-01-29T07:03:20-07:00
10877465485,hdkqkdbfj,https://itunes.apple.com/us/reviews/id954529491,300.0,1,i want to hum,"Hi google, this is one of your biggest fans, on your profile you said that i can sing and hum for you to find a song, but u lie, u lied to me and all my friends, i downloaded the app and there was no button for humming my amazing songs. u scammed me. please fix this problem because if you don’t we will have a problem.  

sincerely,
Ur biggest fan.",https://itunes.apple.com/us/review?id=284815942&type=Purple%20Software,2024-01-29T05:53:46-07:00
10876986581,sadiewilma,https://itunes.apple.com/us/reviews/id112610724,300.0,1,Waste of time - it does NOT do the job it is supposed to do.,"I have ADT + that uses Google Home. I receive alerts that I cannot view immediately - Camera is unavailable now. Try back later. I try to view my doorbell camera camera video in realtime - I constantly receive a message that it is unavailable and to try again later. I have uninstalled, reinstalled both apps. It works for 5 minutes and then the error messages return. I have turned off my VPN to see if that works - it does not fix tge issue. ADT + is a waste of time and money because of the Google Homes inadequate and useless service. My mom had a saying - this is too much sugar for a dime. Both services are not worth the aggravation, time spent on trying to fix the issues, and the money I am paying ADT+  for inadequate service.",https://itunes.apple.com/us/review?id=284815942&type=Purple%20Software,2024-01-29T03:07:22-07:00
10876452663,PastelTheWo.f,https://itunes.apple.com/us/reviews/id1126832109,300.0,5,Useful,"Google helped me a lot, even in the app, it’s as useful as the website version. You can search up anything, it keeps your tabs, and I LOVE the image finder. I can look at beautiful flowers and know what kind of flowers it is!",https://itunes.apple.com/us/review?id=284815942&type=Purple%20Software,2024-01-28T23:09:49-07:00
10875867422,Epic roblox Jake,https://itunes.apple.com/us/reviews/id1330575406,300.0,1,h,y,https://itunes.apple.com/us/review?id=284815942&type=Purple%20Software,2024-01-28T18:42:55-07:00
10875274543,SK8FEAR,https://itunes.apple.com/us/reviews/id1618803470,300.0,3,I know Google is alright but something is wrong,"Everytime I make an account, it becomes inactive and I cannot sign in, it keeps asking for my phone number and it says it’s already been used to much.",https://itunes.apple.com/us/review?id=284815942&type=Purple%20Software,2024-01-28T14:31:05-07:00
10874402689,FarmCoco,https://itunes.apple.com/us/reviews/id1594462025,300.0,5,Love it,More than Safari,https://itunes.apple.com/us/review?id=284815942&type=Purple%20Software,2024-01-28T09:16:02-07:00
10873777205,CUPCAKE♥︎,https://itunes.apple.com/us/reviews/id1212981677,300.0,1,😜,Safari’s better 😜😜😜,https://itunes.apple.com/us/review?id=284815942&type=Purple%20Software,2024-01-28T06:06:36-07:00
10872693902,Ado hafi,https://itunes.apple.com/us/reviews/id739481918,300.0,5,Review,Amazing service and amazing hookah! 10/10 recommend! Ibrakhim was such a good host!,https://itunes.apple.com/us/review?id=284815942&type=Purple%20Software,2024-01-27T23:24:06-07:00
10871592081,Sour Pack Kids,https://itunes.apple.com/us/reviews/id1259165912,300.0,3,It’s awesome!,"It is so awesome, when I first tried and started using the cameras, to do math or find what type of breed dog was, she was a toy poodle! And now I am getting B+!!",https://itunes.apple.com/us/review?id=284815942&type=Purple%20Software,2024-01-27T15:38:35-07:00
10871321791,Jd8069,https://itunes.apple.com/us/reviews/id13594967,300.0,3,Delayed emails,"Emails seem to be coming a little better now. I cleared cache and its going better. Weird I don’t pay for yahoo and it comes instant, but gmail always seems to be super laggy lately. Have to wake phone to get the messages. Used to just get the alert. And i pay for the premium.. once faster ill 5 star",https://itunes.apple.com/us/review?id=284815942&type=Purple%20Software,2024-01-27T13:44:16-07:00
10871227563,catsanddogs,https://itunes.apple.com/us/reviews/id27730959,300.0,1,Need to Fix the Bug Fix,Need to Fix the problem and Update real Bad “!! Fix the Bug in Camera App,https://itunes.apple.com/us/review?id=284815942&type=Purple%20Software,2024-01-27T13:06:38-07:00
10869080586,olivia26373773,https://itunes.apple.com/us/reviews/id24946251,300.0,4,It’s good but..,WHY IS IT 17+?!?!?!?!!,https://itunes.apple.com/us/review?id=284815942&type=Purple%20Software,2024-01-27T00:56:26-07:00
10868300992,chase201296,https://itunes.apple.com/us/reviews/id1444795133,300.0,5,I loo ok ve it,It’s amazing,https://itunes.apple.com/us/review?id=284815942&type=Purple%20Software,2024-01-26T19:18:42-07:00
10867893792,Avila57,https://itunes.apple.com/us/reviews/id407068122,300.0,1,Crashes constantly,It used to work fine but I don’t know if there was an update but now the app keeps crashing. Every app works except for this one,https://itunes.apple.com/us/review?id=284815942&type=Purple%20Software,2024-01-26T16:35:05-07:00
10867776704,samiyah kitty,https://itunes.apple.com/us/reviews/id1247158210,300.0,5,So good!for me not my son 😒😒,I saw some terrible websites on his search..,https://itunes.apple.com/us/review?id=284815942&type=Purple%20Software,2024-01-26T15:46:08-07:00
10867242584,Angel bear1,https://itunes.apple.com/us/reviews/id1508633542,300.0,2,I hate myself now :(,"When I got this I decided to look up hisashi from mha because I like anime but I saw a guy with his skin burnt off instead and I am now traumatized and PLZ DONT search It UP so I expect 10 gallons of bleach because I’m soooooo traumatized now and I hate myself but like 5 YEAR OLDS USE THIS AND IF THEY SEE THAT ITS 1000% YOUR FAULT! Sooo plz delete it PLZZZ
Immediately! But I’m not trying to be a Karen so plz delete some of it.also do you guys know if you search up gacha you will find a lot of gacha heat if you don’t know what gatcha heat is search it up on YouTube ok. Thanks for reading this byeee! 🍪🍪🍪🍪🍪🍪🍪🍪🍪🍪.                                  1/26/2024",https://itunes.apple.com/us/review?id=284815942&type=Purple%20Software,2024-01-26T12:06:15-07:00
10866293284,Peelzlop,https://itunes.apple.com/us/reviews/id926151616,300.0,1,Widget,Why is the widget for the calendar gone,https://itunes.apple.com/us/review?id=284815942&type=Purple%20Software,2024-01-26T06:41:30-07:00
10866120059,KKHUSC,https://itunes.apple.com/us/reviews/id20614962,300.0,1,Will not open,I have downloaded this app several times and it will still not open. Very frustrating,https://itunes.apple.com/us/review?id=284815942&type=Purple%20Software,2024-01-26T05:49:31-07:00
10865059644,tonyxpajamas,https://itunes.apple.com/us/reviews/id136927846,300.0,4,Newsfeed | Audio from Ads??,"Love the app, sure. But the ads playing automatically- and having audio take over the experience? Don't love so much!!",https://itunes.apple.com/us/review?id=284815942&type=Purple%20Software,2024-01-25T23:01:57-07:00
10865014608,StrangerUrMomWarnedAbout,https://itunes.apple.com/us/reviews/id36452024,300.0,1,Latest update killed voice functionality,"Don’t know what Google did, but they’ve essentially rendered the app useless.  Very hopeful they’ll pull it together because it served as my browser & search engine all at once (never used safari)
Please, gods of Google, make it work again (I am talking about “ok google” and definitely NOT pressing the mic icon)",https://itunes.apple.com/us/review?id=284815942&type=Purple%20Software,2024-01-25T22:41:33-07:00
10864605079,irmias,https://itunes.apple.com/us/reviews/id669572000,300.0,5,Google 🗿,Google 🗿 Google 🗿 Google 🗿,https://itunes.apple.com/us/review?id=284815942&type=Purple%20Software,2024-01-25T19:37:20-07:00
10864567299,OneAngryDwarf,https://itunes.apple.com/us/reviews/id29621985,300.0,1,Requires full image access,I definitely don’t trust an app that requires me to provide full photos access. It didn’t previously but now it does. Shady stuff going on for sure.,https://itunes.apple.com/us/review?id=284815942&type=Purple%20Software,2024-01-25T19:21:42-07:00
10864368521,filthydemongodofheaviness,https://itunes.apple.com/us/reviews/id33122767,300.0,3,So much useless news,So you seriously don’t know how much useless news there is until you use this app. It does allow you to personalize your feed somewhat but I’m always getting useless stories from all around the world from sources I’ve never heard of. It would be great if I could only get stories from the sources I pick about subjects I’m interested in but alas….. Although it’s easy to skim through a handful of stories quickly and ignore the garbage,https://itunes.apple.com/us/review?id=284815942&type=Purple%20Software,2024-01-25T18:01:25-07:00