id,userName,userUrl,version,score,title,text,url,updated
3407503081,mlfeg,https://itunes.apple.com/us/reviews/id104283954,62.0,3,Temporarily Disappointed,"I LOVED Google App for News....
I used to have about 10-15 News Stories when I would open my Google App...it’s the only place I ever read News! Then I had the option of going to a 2nd page for more Stories... For almost 2 weeks now I have about 6 stories on the main page and none on the second-it tells me to try back. Makes me sad! 
Even though I didn’t care to read about video games (I had not found away to edit my News Feed if there was a way)-My News in the Google App has went to crap. What changed? Is there a fix? Or just use the Google News App? 
So sad.",https://itunes.apple.com/us/review?id=284815942&type=Purple%20Software,2018-11-11T13:54:15-07:00
3379445000,jhxgdhc,https://itunes.apple.com/us/reviews/id575872484,61.0,1,sSPEAK ALL ANWERES!!!!!!d@jn f+*     nmm.m,"Whenever I ask for somethine. trlln me whatever I ask for for the most part. 
And giver at least the highlights ...now it doesn’t do that so if I’m watching lexample medication if I seem medication not sure what it is it’s helpful to simply tell her a pill Shae 😟😟😟😟 I do not want to have to type questions. I want all the answers to be spoken to me clearly and directly the main answers that are important like he used to do and please for gods eyes change the keyboard with all the confusing but is that changes the fonts and numerals and symbols and letters were emojis all that is total BS
It usedlit so sometimes it works and sometimes l I try to use a different browser one I can search is Siri etc. I kdon’t  to work more on the voice text!!!",https://itunes.apple.com/us/review?id=284815942&type=Purple%20Software,2018-11-04T02:18:10-07:00
2669666869,LR Fadem,https://itunes.apple.com/us/reviews/id172538566,51.0,5,The greatest,"Nothing in the world like google.
Although they did not invent the internet. Thank you u.s navy 
They have made the single greatest 
Contribution  to the internet as we know it today, with there internet browser, and source of information 
That is produced in seconds at your fingertips, I could go on and on and you would think they are paying me millions of dollars  for saying the wonderful things coming out of my head. But not a dime offered. But they make life smarter every day and for that I say thank you,LR Fadem Tulsa ok.",https://itunes.apple.com/us/review?id=284815942&type=Purple%20Software,2018-06-09T22:08:57-07:00
2175639787,:{ Mustache 44,https://itunes.apple.com/us/reviews/id40831362,41.0,5,Why won’t it work?,"I really like google, except, I can’t get in it every time I look for it on my iPad, It says I have it, but when I look for it in Siri it says, ‘Sorry, I cannot find Google, What were you searching for anyway?’ I say whatever I wanted to, but it won’t work , it says ‘open’ so I try to open it, it completely ignores it, can you please fix this? May you please fix this, thank you, This isn’t supposed to be a negative review, I rated google 5 stars, but fix this please, thank you so much",https://itunes.apple.com/us/review?id=284815942&type=Purple%20Software,2018-02-06T17:08:55-07:00
1961278618,fggfgddb,https://itunes.apple.com/us/reviews/id512135602,40.0,5,I have an idea,"Yes granted this app is perfect and it have everything we need but theres one flaw and that flaw is that why have a camera take a picture of words and translate then to diffrent language words when when the app can ALSO translate what people are saying in foreign videos? Because i do not want siri to translate what the video is saying next to siris mic , i watch foreign videos and i need to know what they’re saying, so google, i hope you’ll see this and find this idea useful sincerely-your user",https://itunes.apple.com/us/review?id=284815942&type=Purple%20Software,2017-11-30T20:03:41-07:00
10437405705,Bonita Lou,https://itunes.apple.com/us/reviews/id1282715117,284.0,3,My Fitbit Watch,"I was very well satisfied with the way my Fitbit watch was until I allowed Google to take over and completely change the way my setup was. The old saying is, “If it Ain’t Broke then DON’T Fix It or Change It!!!” Seems as though Google is trying to control too much of everything which I have a problem with. Google maps has even gotten worse. Takes me to directions & places totally out of my way, SMH!🥺It also constantly add wrong places I’ve never been and I have to correct them manually myself.😤 Give me a break, will you??🥵",https://itunes.apple.com/us/review?id=284815942&type=Purple%20Software,2023-10-04T04:56:41-07:00
8925538302,bessie2005,https://itunes.apple.com/us/reviews/id1432774332,222.1,2,All my tabs disappeared for no reason.,"Hello can you guys pls reply quickly (respectfully) :) I don’t know how to restore all my recent tabs from years ago from now (today) I was really getting frustrated because I lost all of my important tabs and I know I can click on one of my old tabs one at a time that’s annoying I want to restore multiple tabs at once (pls in the next update add this ) I’m pretty sure EVERYBODY needs this feature :)

I’m really sad I won’t be able to see my old tabs again :( (pls see this review) 

(If anybody want to give me any advice or what to do in this situation pls comment so I can fix this). (I have iPhone SE 2020)",https://itunes.apple.com/us/review?id=284815942&type=Purple%20Software,2022-07-29T18:02:54-07:00
8901022109,"1947,1951",https://itunes.apple.com/us/reviews/id115093803,221.0,5,"Remnant Utilities, Pataskala, Ohio","If you are in need of excavation services for a sewer line repair, look no further than this company.  They did a wonderful job for us.  The owner was so fair and understanding and saw to it that the job was done in a timely manner and completed in the best way possible.   The people who work for him are outstanding.  We had never seen such hard workers who took such pride in what they did.  We found them friendly, knowledgeable, and trustworthy.  Great job.  

Steve and Linda Butler - Westerville, Ohio",https://itunes.apple.com/us/review?id=284815942&type=Purple%20Software,2022-07-22T11:11:26-07:00
8371280592,LittleWolf372,https://itunes.apple.com/us/reviews/id184826160,199.0,3,Frustrating experience,"It’s a decent news app, but frustrating to use. If you browse the list of articles and decide to actually read one, when you come back it will sometimes jump back to the top and lose track of where you were. It will also decide to randomly refresh sometimes and lose your place again. This might be okay if it had new articles to show you, but it tends to try pushing the same stories at you for a surprisingly long time, long after I am ready for some new content.",https://itunes.apple.com/us/review?id=284815942&type=Purple%20Software,2022-02-18T18:43:11-07:00
1975844865,@Phillies_Fever,https://itunes.apple.com/us/reviews/id35750942,40.0,5,"Nothing beats Google (well, maybe Chrome)",Google is the gold standard in search engines. Everyone knows that. Why would anyone use something else? Safari? Why? It cuts off  25% of the screen on my iPad. Internet Explorer? Do they make that anymore? In some cases I do use Google Chrome. One of my news sites can only be accessed with Chrome. I’m finding it loads slowly and I got to tap the screen a bunch of times to make it work. I’ll stick with Google. Need to find something on the Internet? Google it.,https://itunes.apple.com/us/review?id=284815942&type=Purple%20Software,2017-12-06T14:11:52-07:00
8059211407,Alymusic,https://itunes.apple.com/us/reviews/id104594948,187.0,4,Great Except a Photo Download Bug,"I’ve always used the Google app and absolutely loved it. However, once I updated my phone to iOS 15 and did an update of the app, I began having issues with downloading photos. Each time I try to download an image, the box disappears the second I lift my finger after pressing down on the photo to trigger the download option. I don’t know why it started doing this, but it has made it near impossible to download pictures now. Would love to see this get fixed.",https://itunes.apple.com/us/review?id=284815942&type=Purple%20Software,2021-11-24T11:59:03-07:00
10764127085,Sophia3first,https://itunes.apple.com/us/reviews/id1314811662,295.0,2,Safari is better,"I liked it at first, but then it said “you must confirm your age, or your account will be deleted” so I was on that for like an hour trying to figure out how to do the flipping thing, then I just decided to delete my  account, went back to make another one “sorry we can’t do this right now due to an error” I don’t like this or it’s dumb website that never lets you do crap, do it if your over 13, but I’m flipping 12, and I feel I should be able to have a dumb account without it having to not get any access to crap for the surveillance thing, like just let me have my account that is MINE.",https://itunes.apple.com/us/review?id=284815942&type=Purple%20Software,2023-12-30T12:56:16-07:00
8801774250,Super mom lover,https://itunes.apple.com/us/reviews/id169581109,217.0,1,Impossible to save images now,"I use google to look up images to reference, but need to save them to zoom in more or save for later in case I can’t find the image later, but the new update has destroyed that, and screenshots don’t suffice because of other icons blocking the image and a lower quality. Now I have to open them in a browser which takes away a lot of the convenience.
I also wish reverse image search could be implemented for mobile devices. Constantly have to request the desktop site on safari just to do it from my phone, but that is more of a long time request. I just want the old way of saving images back.",https://itunes.apple.com/us/review?id=284815942&type=Purple%20Software,2022-06-23T00:56:45-07:00
8370471087,niiccckknnaammee,https://itunes.apple.com/us/reviews/id1341534358,199.0,1,Highly disappointed,I sold an item last night. I received notice from eBay that the item was paid for to ship now. I shipped first thing this morning like a good seller. I received notice this afternoon that eBay canceled the order due to safety concerns with the buyer. Now I’m out my item and shipping cost. I’ve spent two hours with four different people at eBay to try to find out who was reimbursing me for my item and shipping. They said to contact the buyer and ask them to ship it back. Lol the person they just told me was a . What a joke. I’m taking my business to mercari. I guess I’m just out my item and all costs of bubble wrap packaging and shipping cost not to mention my item. Shame on eBay,https://itunes.apple.com/us/review?id=284815942&type=Purple%20Software,2022-02-18T13:03:59-07:00
8340843930,BrokeRoque,https://itunes.apple.com/us/reviews/id368374185,198.0,1,"""Shake to send feedback""","Here's my feedback: how about you put an option in settings to turn this stupid feature off? Since the recent update, every time I move my hand while scrolling this stupid notification pops up at the bottom of my screen even though I have the shake feature disabled for all apps on my iPhone 11 Pro. So explain how your app has access to my precise movements when my phone doesn't. Think I need to report this up the chain. So sick and tired of tech companies taking liberties like this. Fellow users, if you can't see the potential implications from a feature work-around like this, you're the reason privacy is dead in this country.",https://itunes.apple.com/us/review?id=284815942&type=Purple%20Software,2022-02-10T10:10:05-07:00
4351310191,Kasondra13,https://itunes.apple.com/us/reviews/id27327824,76.0,4,It’s very good but..,Google is a very good app you can use it to search up stuff that you don’t know and learn something new. Though google has some private information about people like their family. Do you think that is a little creepy. My mom doesn’t want people being able to search up her name and read stuff about her. It be cool if you didn’t have that there. If they stole something and are in jail then you could put some stuff about him / her. All in all I don’t really like it that people can just randomly search you up,https://itunes.apple.com/us/review?id=284815942&type=Purple%20Software,2019-06-21T23:27:14-07:00
8014117177,Allladypatti,https://itunes.apple.com/us/reviews/id111445328,185.1,2,Love hate relationship!,"I honestly have a hard time writing this review. The gmail app as while is great , very easy to use and has great features when it works. I often have to redownload or restart my phone in order to get my mail. I will often get a notification telling me I got a new email but when I go to the app it tell me I have no connection and the email won’t load. But if I had no connection how would I be able to get the notification. How would all of my other apps work just fine. When I restart my phone 9 out of 10 times I will then get my mail but it is short lived. Fix it!!!",https://itunes.apple.com/us/review?id=284815942&type=Purple%20Software,2021-11-11T17:04:25-07:00
4194859554,My baby girl!,https://itunes.apple.com/us/reviews/id1018282125,74.0,4,Googling,"I love to google things up. This app helps me to improve my knowledge and my learning on my interest of different topics. Also, if I wanna know anything of interest that comes to my mind. I find it very valuable when it comes to googling. When my husband has a question for me to answer and I can’t give him  answer. I always tell him to google it up. Now! His reply to me is the same. Which is hilarious! We both learn a lot from the google apps. I rate this app a 4.9 because nothing is perfect. Got be something else to google. Have fun with google. My baby girl!",https://itunes.apple.com/us/review?id=284815942&type=Purple%20Software,2019-05-23T01:44:11-07:00