id,userName,userUrl,version,score,title,text,url,updated
7845897134,ᐯIᐯᔕ,https://itunes.apple.com/us/reviews/id388363052,8.6.62,5,Where are the bug fixes?,"This is a really good app, I’ve been using for more than an year and I do recommend it but I just had so many problems during this time; lost playlists, glitches, lost an acc, can’t add some songs to playlists, no lyrics (I tried many songs and famous ones so literally no explanation) and right now it glitches and I tried logging in and out, reinstalled the app etc… the thing here is that I have no ‘help’, you won’t have a ‘report problem’ in the app, meaning that if there’s a bug, you gotta search stuff up because they just don’t help if there’s a problem… 
It is a good app, but this has been upsetting me for way too long now and I searched up how to fix the problems and like I said before, it didn’t work and I can’t ask the app or report a problem.",https://itunes.apple.com/us/review?id=324684580&type=Purple%20Software,2021-09-25T20:40:06-07:00
2445156425,L.I.L.,https://itunes.apple.com/us/reviews/id171369565,8.4.48,3,Good but it needs some work,"Now, I love this app. I can listen to my music in peace and I have countless songs to choose from. Except for the fact that I can't choose them. If I use my tablet or computer then I can pick what songs I want to listen to but if I'm using my iPhone then I'm stuck with whatever song they give me when I hit shuffle. That includes all the ""discover new songs"" that they play. I understand giving a few suggestions every now and then but it is ridiculous because if you have less than 10 songs in your playlist, odds are you won't even hear your songs, just music that doesn't relate to your playlist. I get how Premium would allow you to download and remove ads. I wouldn't even mind it if you had to get it to pick a specific track. But at least let me choose to go back a song or just let me play songs in my playlist. Also, they offer a 30 minute ad free thing every now and then but it doesn't work.",https://itunes.apple.com/us/review?id=324684580&type=Purple%20Software,2018-04-20T05:33:33-07:00
10657897085,Lioness121416,https://itunes.apple.com/us/reviews/id1380032383,8.8.92,4,Ads٫ Premium٫ Skips,I think this app is extremely convenient for collecting songs to add to your Apple music library in the future or to try and use the lyrics of a song to find a song but unless you want to get premium it's not great for streaming. The ads are constantly breaking up the stream advertising their premium plans sometimes playing the same ads 2-3 times in a row. Also shopify٫ college ads٫ and sometimes the ad breaks are longer then the block of music stream between the ads. Now on the free account you only get six skips per hour and if you're anything like me music choice is based on your mood and you want to skip every song you don't want to listen to but the skips are so frustrating in that it says six skips per hour but it seems to take more time than that to get back your skips on the general account.,https://itunes.apple.com/us/review?id=324684580&type=Purple%20Software,2023-12-04T14:37:44-07:00
6185519920,Femi Designs,https://itunes.apple.com/us/reviews/id226266344,8.5.66,5,Authenticity,Much needed redirection of what authenticity is- there’s no illusion of perfection- or that relatable is perfect - that’s always an opportunity to ask & learn more to be better connected- can’t sell self Love if that makes sense. Vulnerability is beautiful and not for the faint of heart even though at all times completely accessible and a choice available to all. Funs sellable- the journey isn’t a destination.. meaning even though free and available to all- don’t sell the stage to embrace the opportunity to join the show but as a collaborative partner only if invited. That’s not synonymous with a privileged stigma. There’s a lot of universal authenticity that unfortunately is often overlooked and stereotyped and stigmatized as if not universal despite more specific choices; Let’s redefine universal based in emotional health & wellness. Thanks for sharing Lovesitos Besitos abrazitos blessingsitos; would love to chat🤟🏻😘💯👍,https://itunes.apple.com/us/review?id=324684580&type=Purple%20Software,2020-07-11T07:46:35-07:00
5932581907,kat007x,https://itunes.apple.com/us/reviews/id1111945326,8.5.57,5,Good App but...,"I’ve been a long time user and imo, the is the best option in streaming music, especially with premium. I only have two small issues though, I think a re existing feature should be added back to where on an artists page, it shows songs that feature them, but now that isn’t there and it’s hard to find songs that feature them. Also when you add songs to que, the very first or very last would be blanked out to the point where you can’t see the song and and sometimes I would move songs up or down the playing next section and it would sometimes glitch out and sometimes when it does that, it crashes the app and resets everything I did with que and playing next. If I notice a change I will definitely make my review a 5 star.",https://itunes.apple.com/us/review?id=324684580&type=Purple%20Software,2020-05-11T11:24:56-07:00
5752273510,ginsengtea3,https://itunes.apple.com/us/reviews/id986436433,8.5.52,5,Steadily Worse,"This app is easy to navigate and good for making your own playlists, but in terms of discovering new music, this app does not know what’s up, and seems committed to getting worse and worse.  Every time it updates you will experience confusion, frustration, and eventually regret. There is no customizability to their “radio” function, and they are frequently so off the mark with their recommendations that you wonder if you are even logged into your own account. If it weren’t for the cross fade function they offer, I would have defected back to Pandora a long time ago. Still, I have gotten good use out of this app as long as I am willing to put effort into it like a part time job. Just do your research before choosing which music subscription service you want to shell out your money to; they all have pros and cons.",https://itunes.apple.com/us/review?id=324684580&type=Purple%20Software,2020-04-02T11:47:44-07:00
5439624149,XIIE3,https://itunes.apple.com/us/reviews/id692447620,8.5.41,5,Great,"I love this app and almost everything about it. I can only say that one change that would be greatly appreciated is having your artists and genres in a tab to click on. Say, if I want to shuffle all of my pop music, all I would have to do is click the genres tab, find pop and hit shuffle. Or if I wanted to shuffle songs by an artist in my library, then I could hit artists, and shuffle by artist. Right now the only way to do this is to create a playlist, and I don’t have the time...over all, great app, and highly recommend

Also, another thing I’d like to add is that I hate the new addition of album thumbnails in playlist view. I liked the sharp, clean look of just the song title. When you have the picture of the album next to the song title, it looks cheap and stupid. Just change back the UI to not show the album covers.",https://itunes.apple.com/us/review?id=324684580&type=Purple%20Software,2020-01-23T10:03:20-07:00
4696243314,yu_Fai,https://itunes.apple.com/us/reviews/id555703548,8.5.19,5,This needs to be changed,"So I've been using the app for a few years now and beforehand you could go into anyone of your daily mix playlists, pick a song, and the playlist would continue in the same order it was laid out. But as of this new update if you pick a song, the next song isn't the one that came after the first song you picked. Instead the next song is randomly picking, almost like the playlist is being shuffled. I know that this might not be a problem to some, but this really bugs me because sometimes in a playlist my favorite songs might be back to back to back. But when I finish listening to one I have to wait for the UI to shuffle through every other song in the playlist before I can listen to my favorites. Please just go back to the way it was before the last update.",https://itunes.apple.com/us/review?id=324684580&type=Purple%20Software,2019-08-30T07:11:12-07:00
4285636647,Yōrū,https://itunes.apple.com/us/reviews/id901155110,8.5.7,5,Can’t stop using it,"This app has literally anything you could be looking for in music, on top of making said music sound as good as it possibly can through whatever device you may be using. I’ve sat through countless train rides with this app on and my ear buds in. The app does have ads if you’re not using premium, but this is to be expected considering every company has to make money somehow. Even though paying for premium may sound like a pain, this method is vastly more cost-efficient than the alternative of paying for every album you want to listen to (apple music.) the app has a very simple and easy to use UI as well as having a system where you can download specific songs to listen to them without using wifi, making it very useful in almost any situation. Overall, the app deserves the ratings which it receives.",https://itunes.apple.com/us/review?id=324684580&type=Purple%20Software,2019-06-08T15:29:58-07:00
4633363229,Tiffany703,https://itunes.apple.com/us/reviews/id340750009,8.5.19,4,Good app but needs improvement,"There is a huge variety of songs and the great thing about getting premium is that you can download the songs and playlists for when you are offline, such as being underground on the train. However there are some small things that can be made for the convenience of the user. For example, providing the lyrics to every song by just tapping on the song’s album photo. There should also be an option for the user to request song lyrics if it is currently unavailable. Secondly, any song should be made deleted easier from a playlist. At the moment I am able to add any song to a playlist when the song’s album cover is shown on screen, but there is no option to delete it from this place. Instead i have to scroll through my entire playlist back and forth to find the song i want to remove from my playlist.",https://itunes.apple.com/us/review?id=324684580&type=Purple%20Software,2019-08-17T17:08:19-07:00
10682687437,Cari Bands,https://itunes.apple.com/us/reviews/id372225684,8.8.94,3,Slowly becoming worse,"I used to enjoy using the app way more than I do now. Previously you could see previous songs that played for you, like Apple Music currently does, so that if you wanted to know what it was you heard but was not around to read the title, It would be no problem to go back and see. Secondly, the podcasting section is getting atrocious. I can’t keep the shows I actually listen to in my Home Screen without it being crowded with ‘new episodes’ from shows I’ve never gave a listening to. I also can’t give said shows any kind unapproved/ not interested ratings or reviews, so it’s kind of forced on you to go and search for what you do keep up with in order to maintain a home page that actually functions how I need. 
I would prefer to be able to listen to my shows in an order I can enjoy versus hand picking each one to add in the queue to avoid random shows from autoplaying…",https://itunes.apple.com/us/review?id=324684580&type=Purple%20Software,2023-12-11T09:05:17-07:00
10277450418,Queen_les262,https://itunes.apple.com/us/reviews/id1239868498,8.8.62,3,Great app but..,"This app is great, you have different types of music and artist but if you don’t have premium it’s the WORST. for example if you listening to music and you come across an ad you have to listen to a 2 minute ad of some annoying product that most of the time you aren’t even interested in the ad. Second the skips, you only get not 15 not 13 not even 8 you get SIX ONLY SIX which it so annoying if you don’t even wanna listen to that music. I know it sounds kinda dumb coming from me but try to find another review that has the same complaint. And last you can’t even go through the music. For example if you wanna go back in the song you can’t because it “thinks” you gonna skip throughout the song when you don’t even care about that is so annoying. (P.S this review is if your gonna download it on mobile idk about the other electronics out there but for a phone it is like this.)",https://itunes.apple.com/us/review?id=324684580&type=Purple%20Software,2023-08-19T14:51:15-07:00
10118062854,alltimenickname,https://itunes.apple.com/us/reviews/id1500643970,8.8.50,2,what happened?,"this genuinely used to be my one and only music service for listening to songs i actually liked. now, i can’t even play playlists without having something ive never even listened to before or something i don’t remember adding into my playlist being played and it is so infuriating to be forced to listen to pure music that im basically getting FORCED to listen to. i could search up a very specific song and then get a completely different one that was just made by the same artist. it’s nothing that i want, and i get this probably won’t be taken into account, but why? what happened? am i just too dumb or is the app just too complex now for no reason? i don’t remember not being able to play songs i actually wanted to listen to with a pretty okay amount of ads that were regular now and then, here we’re stuck with music being given to us instead of us looking for it. please fix this, i would honestly rather have more ads",https://itunes.apple.com/us/review?id=324684580&type=Purple%20Software,2023-07-08T10:14:50-07:00
9723272256,Blackscorpio17,https://itunes.apple.com/us/reviews/id267227717,8.8.18,2,This is one of my favorite music service apps to use but there's a bug,I love this music service and use it everyday and there's an annoying bug occuring only on my iPad where when I press on the option to change device to play it on and the menu keeps going away automatically I go to click it multiple and it will stay up for about a second or so and automatically go away. I've only noticed this happening on my iPad currently and I've tried everything by unisntalling the app multiple times and reinstalling it and restarting my device a couple of times and updating the app to the most recent software and nothing see to resolve my issue this is so frustrating I stopped trying to controlling my speakers with my iPad as of right now and use my other devices because it won't this is on my other devices please fix this I would be giving you guys 5 stars I'm only giving you like 2 stars because this bug is frustrating to deal with.,https://itunes.apple.com/us/review?id=324684580&type=Purple%20Software,2023-03-17T10:06:50-07:00
7856134343,broney220,https://itunes.apple.com/us/reviews/id116927077,8.6.62,4,what did you do to this app?,"I understand that updates must be done regularly to squash bugs, improve performance and so forth. But with the latest update you ruined my enjoyment of using the app! specifically, I no longer can listen to individual songs off albums that are in my library and I have been a paying premium subscriber for well over a year. I can’t even read the titles to the traction they give an album instead I get a more options button where are the tracklist and should be. The only option I have for playing the album is to shuffle play. so if my subscription has not been canceled, there’s no reason that I should not be able to play the music. Somebody had better fix this because I’m sure I’m not the only one experiencing this massive issue. if you don’t fix it by your next update, buy buy subscription.",https://itunes.apple.com/us/review?id=324684580&type=Purple%20Software,2021-09-28T18:12:54-07:00
5257789121,Zzzzzzzz090,https://itunes.apple.com/us/reviews/id131988136,8.5.34,3,"Works OK, could be way better.","I download at home and listen all day at work where I have no wi-fi. Player functions work fine, and there are many options for playback quality, download quality, volume compression, and other behavior.. more so than is offered by some other services. Unfortunately playlist management functions are lacking. For instance, you can copy a playlist or station into one of your own playlists, but only if the source list is NOT your own; so if you want to merge one of your lists into another, you must do it one song at a time. Lastly, a significant problem can be downloads. I download at home for listening at work where I have no wi-fi. The problem is that most or all of my songs automatically delete and re-download when I get back on wi-fi and restart the app. Not just the stations — which are randomly generated each time — but also unchanged personal playlists. This takes needless time and megabytes.",https://itunes.apple.com/us/review?id=324684580&type=Purple%20Software,2019-12-10T18:14:38-07:00
8397106020,kalgal05,https://itunes.apple.com/us/reviews/id1101817851,8.7.8,5,Performance Issue,"it’s a wonderful app and i’ve been using it for as long as i can remember, and it’s the most convenient way for me to listen to my music while i do homework, clean, cook, whatever. As of lately however, i can’t play my music and it’s more inconvenient than it is helpful. the issue is i will try to play a song, and it will either freeze and won’t play, or it will play the first 9-12 seconds then stop. i’m mostly upset because i have all of my music downloaded, but i’ve found the only way to fix this is to exit the app and it will auto-pause, then it will work but it’s tedious doing this for every single song, some of which won’t even play. i don’t know what happened but since about a week and a half ago it’s been a hassle to listen to music :/",https://itunes.apple.com/us/review?id=324684580&type=Purple%20Software,2022-02-25T21:52:50-07:00
4249428093,5x5 crashes,https://itunes.apple.com/us/reviews/id378808648,8.5.7,3,Recovering deleted songs,"There are some minor issues with the app, such as some the variety of music the app contains. Another thing is when you pick a song for the radio it does not play songs related to the song you chose. The biggest thing about the app is the ui. I think the stupidest thing is that you can not recover a song you just mistakenly removed from your songs, and how easily it is to remove a song from just a swipe. Sometimes I accidentally remove song from my library and I have no idea what it is. There should be a way we can recover and find out what song you just recently removed. Or another solution would be giving you a confirmation screen if you really want to remove a song from your library. If you fix this issue, it causes less frustration and annoyed customers, because I would spend 30 mins trying to figure out what song I just removed. Thanks if you can fix this, that would be great!",https://itunes.apple.com/us/review?id=324684580&type=Purple%20Software,2019-06-01T21:26:21-07:00
8616666965,Angel1419!,https://itunes.apple.com/us/reviews/id1115392488,8.7.26,3,"Good but..,","I’d like to start off with this is AMAZING!!!

I took a star off for each of my major issues though. 
     At first it was great. Very very minimal commercials, and I could play anything I wanted. This was on a chrome book. I do not have premium but I could control where I was in the song and could play any song fully.  Then I downloaded it on my phone. The commercials suddenly tripled, and I couldn’t control what song I played nor could I skip parts. This was not a huge inconvenience but still irritating. 

      Next I have my huge problem. I made my playlist and it keeps playing songs I have not added. I look through what it has and it has a “we added” section. I do not like a good majority of these songs and there is no way for them not to play or to skip them without running out of skips. I want to listen to MY music.  This is also such a huge problem because I mainly listen when I am relaxing in a bath or showering. I try to relax in a bath and it plays a song not on my playlist I don’t like I have to sit up, skip it, and try to get back comfortable. If I am showering o can’t skip it and Siri doesn’t listen so I have to listen to it. This really is the main reason I gave 3 stars, as this pesters me SO MUCH. I made a playlist to hear songs I want to hear, not songs that are added without consent that I can not get rid of.",https://itunes.apple.com/us/review?id=324684580&type=Purple%20Software,2022-04-28T18:18:46-07:00
7194681866,Cordelia McCleary,https://itunes.apple.com/us/reviews/id689663279,8.6.14,5,Very Upset,"I used to love this app. I would use it every day. But today I noticed something weird. I don’t know if it’s a bug or something, but I kept clicking on a song, and it would play multiple different songs without even letting me listen to the one I wanted to. I tried skipping them, but then a notification popped up saying I was only aloud to skip six  songs every hour. I was very tempted to give this only one star because there’s no point on going on an app if you can’t use it. It may be something I have to fix on my end, and if it is, then I recommend the app. I will happily fix whatever it is and go back to listening to music on here. But until then, I want people to know about this. If it happened to someone else and you found a way to fix it, please tell me how.",https://itunes.apple.com/us/review?id=324684580&type=Purple%20Software,2021-04-07T08:41:27-07:00
5008230934,Reem_Oman,https://itunes.apple.com/us/reviews/id198469329,8.5.28,5,Quality and database,High quality music and a humongous database of music library in all genres. This is the best app I have used so far to play music. If you are not subscribing to premium though I don’t think it’s worth it because offline music to me is what makes a difference . Offline gives me access when there is no internet ( network and WiFi not available ) this its is perfect when I’m traveling or in areas with no network. Freedom to create my own playlist plus join the great playlists already out there . So if I have a gathering or going camping or having a toad trip. This applications is able to serve me at all times . All I need to do is access one I created it even if I didn’t have the time join one of the many created out there. The radio feature is amazing and so it’s the top hit list to keep you up to date,https://itunes.apple.com/us/review?id=324684580&type=Purple%20Software,2019-10-24T11:42:46-07:00
7089228461,annilizn,https://itunes.apple.com/us/reviews/id409304346,8.6.8,2,need improvement,"the radio and daily mix features are so BAD! I constantly have the same 20 or so songs being suggested to me, no matter the genre, playlist or what it’s always the same songs. sometimes the recommendations make zero sense but they just put the same songs that I used to love, (and now hate because I’ve heard them way way too many times). I have opened song radios only to find that I know every single one of the 50 songs in that song radio, and I know that none of them fit the same genre as a song that I was originally clicking to make the song radio for. Im beginning to hate all of the songs i listen to and I am STRUGGLING to find new music. FIX YOUR SONG SUGGESTIONS FEATURE.
the mobile app is pretty good but on the desktop app, it’s so slow and always struggles to connect to my speakers, it doesn’t crash but it does stop working to the point that i have to force quit it pretty often. also, i really don’t like that it reshuffles my playlist/queue when i switch the device i’m using.",https://itunes.apple.com/us/review?id=324684580&type=Purple%20Software,2021-03-10T19:38:21-07:00
6049966487,redrxsy,https://itunes.apple.com/us/reviews/id1108950578,8.5.60,4,a great app but has some flaws,"i recently switched over to this app a few months ago for no real reason just to have a refreshing new start on a music app. it is an amazing app! but i have to issues with it. 

1. the crashing. the apps seems to crash quite often. i’ll be listening to a song and then bam the app crushes and i have to go back to the app and play the song again but it’ll restart it which is very VERY annoying. and that doesn’t even fix the problem. it’ll happen over and over again (even closing out the app doesn’t help). it’s so so annoying and irritating because i just want to listen to my music smoothly and even a simple music app can’t do that. 

2. the shuffle. a good chunk of my playlists are fairly short (about 15-30 songs) i play them all on shuffle and because my playlists are short they end fairly quick. but whenever i go back to shuffle and play my playlist again it won’t change the shuffle list. it’ll play the songs in the same order again. which... defeats the whole purpose of shuffle and is quick upsetting when you want to listen to a completely new order of your songs. 

but overall this app is very very good! just those two cons make me rate it 4 stars because they are quick annoying and shouldn’t even be a problem with an amazing app like this!",https://itunes.apple.com/us/review?id=324684580&type=Purple%20Software,2020-06-08T01:45:22-07:00
