id,userName,userUrl,version,score,title,text,url,updated
10731882283,KBNabi,https://itunes.apple.com/us/reviews/id110580203,6.8.2,5,Saves me every day.,My info got on the wrong list forever ago. This is the only reason I still have my privacy today. Thank you.,https://itunes.apple.com/us/review?id=983156458&type=Purple%20Software,2023-12-22T09:36:28-07:00
10722940800,qwjjsunnyday,https://itunes.apple.com/us/reviews/id651237648,6.8.2,5,so far so good,good app,https://itunes.apple.com/us/review?id=983156458&type=Purple%20Software,2023-12-20T07:23:08-07:00
10720299320,tomaslarez,https://itunes.apple.com/us/reviews/id181488498,6.8.2,5,Excellent,Easy to use and it allows me setup my steps security,https://itunes.apple.com/us/review?id=983156458&type=Purple%20Software,2023-12-19T17:41:44-07:00
10717838953,SoNawFy,https://itunes.apple.com/us/reviews/id284830637,6.8.2,5,Great!,Great!,https://itunes.apple.com/us/review?id=983156458&type=Purple%20Software,2023-12-19T06:48:45-07:00
10668598982,JAKELENEFSKI,https://itunes.apple.com/us/reviews/id1059849547,6.8.1,5,Good,Good,https://itunes.apple.com/us/review?id=983156458&type=Purple%20Software,2023-12-07T17:14:18-07:00
10666527406,FNQuawn,https://itunes.apple.com/us/reviews/id973160490,6.8.1,5,Love this app,This app is real dope. I have never had anything wrong with it. I have a my system information on them and always keep it safe it’s a 10/10 app. I have had this app for 6 years now,https://itunes.apple.com/us/review?id=983156458&type=Purple%20Software,2023-12-07T03:56:56-07:00