id,userName,userUrl,version,score,title,text,url,updated
11103611679,Ash1$$,https://itunes.apple.com/us/reviews/id1061489743,2.149.0,5,Jacket,Thank you so much for my order I really love my jacket and I received it pretty fast good job yall Happy Customer 😊,https://itunes.apple.com/us/review?id=1223471316&type=Purple%20Software,2024-03-30T13:46:08-07:00
11103573289,Alandbri,https://itunes.apple.com/us/reviews/id1641251882,2.149.0,5,Love it,Thank you for having my unborn baby swing delivered with in few days ❤️love it,https://itunes.apple.com/us/review?id=1223471316&type=Purple%20Software,2024-03-30T13:30:39-07:00
11103529338,sameasygo,https://itunes.apple.com/us/reviews/id588342856,2.149.0,5,Best Decaf Coffee Ever,"I have to drink decaffeinated beverages. I read about this product on Truth Social and people loved it. I ordered it and I have to say, it is the best decaf coffee I’ve ever tasted. Please try it yourself you’ll love it! Shipping is very fast with this company too!",https://itunes.apple.com/us/review?id=1223471316&type=Purple%20Software,2024-03-30T13:12:58-07:00
11103498594,charlied7401,https://itunes.apple.com/us/reviews/id926726426,2.149.0,5,Great service,These guys never fail to keep you informed.,https://itunes.apple.com/us/review?id=1223471316&type=Purple%20Software,2024-03-30T13:01:00-07:00
11103427502,FavorMercy,https://itunes.apple.com/us/reviews/id574473364,2.149.0,5,Service,"Customer service is second to none!
Received my package on time.",https://itunes.apple.com/us/review?id=1223471316&type=Purple%20Software,2024-03-30T12:33:22-07:00
11103409148,Caretkow,https://itunes.apple.com/us/reviews/id991317459,2.149.0,5,Summer wedges,"I was so excited to try on my wedge sandals in cardamom! I got the right size, too!",https://itunes.apple.com/us/review?id=1223471316&type=Purple%20Software,2024-03-30T12:26:23-07:00
11103145149,To1kto,https://itunes.apple.com/us/reviews/id1611507852,2.149.0,5,It was good telling details about my my package,Jmwmwnej,https://itunes.apple.com/us/review?id=1223471316&type=Purple%20Software,2024-03-30T10:49:40-07:00
11103071601,yaboichase10,https://itunes.apple.com/us/reviews/id955837904,2.149.0,5,Perfect,Perfect for tracking and easy to checkout every time,https://itunes.apple.com/us/review?id=1223471316&type=Purple%20Software,2024-03-30T10:24:26-07:00
11103051452,maria5977,https://itunes.apple.com/us/reviews/id396243627,2.149.0,5,Packing was open:(,I glad the item still was there,https://itunes.apple.com/us/review?id=1223471316&type=Purple%20Software,2024-03-30T10:17:38-07:00
11102969350,kellyblur,https://itunes.apple.com/us/reviews/id882893235,2.149.0,5,Best,One of the best,https://itunes.apple.com/us/review?id=1223471316&type=Purple%20Software,2024-03-30T09:50:43-07:00
11102848956,Midwest hal,https://itunes.apple.com/us/reviews/id1299446554,2.149.0,5,Amazing!,I ordered a dimplex fireplace less than a week ago! It got here 2 days early! I was notified every step of the way!❤️,https://itunes.apple.com/us/review?id=1223471316&type=Purple%20Software,2024-03-30T09:12:03-07:00
11102774306,Iddy-biddy,https://itunes.apple.com/us/reviews/id837771022,2.149.0,5,Review,Thank you so much for sending my order.  It took longer than I expected but I feel it was worth the wait.  I will continue ordering from you guys because I was turn on by one of your client.  Again thank you I was waiting for it because I heard your herbs are worth it.,https://itunes.apple.com/us/review?id=1223471316&type=Purple%20Software,2024-03-30T08:48:36-07:00
11102700431,pklmzzr,https://itunes.apple.com/us/reviews/id1480043407,2.149.0,5,Information,I absolutely love the way Shop keeps you informed and up to date on you packages!,https://itunes.apple.com/us/review?id=1223471316&type=Purple%20Software,2024-03-30T08:25:44-07:00
11102630379,KayyDa1,https://itunes.apple.com/us/reviews/id1301958088,2.149.0,5,I Loves Everything,This is my second order and I LOVED EVERYTHING I Will Continue To Shop & Support 🩷,https://itunes.apple.com/us/review?id=1223471316&type=Purple%20Software,2024-03-30T08:04:24-07:00
11102599575,Allibless,https://itunes.apple.com/us/reviews/id1299300390,2.149.0,5,Fashion nova,Great tracking site 🔥🔥🔥,https://itunes.apple.com/us/review?id=1223471316&type=Purple%20Software,2024-03-30T07:55:09-07:00
11102543591,hhhfvjidscch,https://itunes.apple.com/us/reviews/id807656711,2.149.0,5,Best bras and panties,I love eby bras and panties so comfy best iv ever had!,https://itunes.apple.com/us/review?id=1223471316&type=Purple%20Software,2024-03-30T07:38:24-07:00
11102385205,SarahFain,https://itunes.apple.com/us/reviews/id641114887,2.149.0,5,Love this little ceramic frog.,I plan on installing in a powder room with the penny-round floor tile and Morris Frog wallpaper. We’ll see… still in fantasizing phase of the design.,https://itunes.apple.com/us/review?id=1223471316&type=Purple%20Software,2024-03-30T06:50:58-07:00
11101407697,Jay aus,https://itunes.apple.com/us/reviews/id177861939,2.149.0,5,Beautiful bags,The package came fast.loving it,https://itunes.apple.com/us/review?id=1223471316&type=Purple%20Software,2024-03-30T00:30:56-07:00
11101021886,trav terpytrav,https://itunes.apple.com/us/reviews/id1352065726,2.149.0,5,Disc,Never mind the disc was just in a different location of receiving mail it has landed,https://itunes.apple.com/us/review?id=1223471316&type=Purple%20Software,2024-03-29T21:29:12-07:00
11100714599,KKelley01,https://itunes.apple.com/us/reviews/id656626961,2.149.0,5,Wonderful Boutique,I just love everything I have gotten such good quality and such a pleasure to work work with in helping me with my order!,https://itunes.apple.com/us/review?id=1223471316&type=Purple%20Software,2024-03-29T19:20:45-07:00
11100324355,🅙🅞,https://itunes.apple.com/us/reviews/id1061541983,2.149.0,5,Really accurate,It’s pretty accurate tbh love it,https://itunes.apple.com/us/review?id=1223471316&type=Purple%20Software,2024-03-29T16:47:02-07:00
11100230017,peggy J LF,https://itunes.apple.com/us/reviews/id613414015,2.149.0,5,Perfect delivery,Package intact and delivery was successful! Perfect,https://itunes.apple.com/us/review?id=1223471316&type=Purple%20Software,2024-03-29T16:08:30-07:00
11100204023,4kkjaya,https://itunes.apple.com/us/reviews/id1562611857,2.149.0,5,Shipping,"This is the best site it tells you and lets you know when your product is getting shipped , delivered or anything",https://itunes.apple.com/us/review?id=1223471316&type=Purple%20Software,2024-03-29T15:58:00-07:00
11100171813,🙂🙂matias,https://itunes.apple.com/us/reviews/id1214615056,2.149.0,5,Yes 🙌,Yes me gusta 😉,https://itunes.apple.com/us/review?id=1223471316&type=Purple%20Software,2024-03-29T15:44:46-07:00
11100096507,Lildon_third,https://itunes.apple.com/us/reviews/id168878768,2.149.0,5,Shipping,Tracks my items nicely. No complaints.,https://itunes.apple.com/us/review?id=1223471316&type=Purple%20Software,2024-03-29T15:13:43-07:00
11100076078,Luis21musica,https://itunes.apple.com/us/reviews/id404518564,2.149.0,5,Love this app,Love this app,https://itunes.apple.com/us/review?id=1223471316&type=Purple%20Software,2024-03-29T15:05:21-07:00
11100005384,Hulldd945v,https://itunes.apple.com/us/reviews/id462665528,2.149.0,5,Bulbs,Got them today,https://itunes.apple.com/us/review?id=1223471316&type=Purple%20Software,2024-03-29T14:36:23-07:00
11099867614,DMnnp,https://itunes.apple.com/us/reviews/id202434155,2.149.0,5,Reefs for over 20 years,"I’m hoping this set of reefs will last 20 years, also.
They are comfortable, with absolutely no break in time",https://itunes.apple.com/us/review?id=1223471316&type=Purple%20Software,2024-03-29T13:41:06-07:00
11099848526,Mackinazztopcat,https://itunes.apple.com/us/reviews/id194155573,2.149.0,5,Game changing APP!!,"I ordered this some things a while ago and life, of course, sir it’s thing; got disruptive. SHOP app kept me on track with pick up, delivery and drop off. This is a staple for me whenever available 💪🏾",https://itunes.apple.com/us/review?id=1223471316&type=Purple%20Software,2024-03-29T13:33:28-07:00
11099730911,OG Durkk,https://itunes.apple.com/us/reviews/id77017508,2.149.0,5,Beautiful Dresses and Fabric,"So trusty brand! Bonanza is no.1 forever. We ordered dresses, all are so great. There colors are exactly how shown on the website. Came on time!!! Bonanza Pakistan Zindaabad",https://itunes.apple.com/us/review?id=1223471316&type=Purple%20Software,2024-03-29T12:47:54-07:00
11099693477,Troy-shady,https://itunes.apple.com/us/reviews/id926215672,2.149.0,5,Thank you,Very happy with my order did take a long time but they kept in touch when asked I might have been a little to in inpatient but it’s worth the wait thank you,https://itunes.apple.com/us/review?id=1223471316&type=Purple%20Software,2024-03-29T12:33:50-07:00
11099608995,Dirt Wrangler,https://itunes.apple.com/us/reviews/id696175526,2.149.0,5,Great App.,"At first, I had my doubts about this, but then I started using it because one of my suppliers forced it on me and now I’m hooked:-)",https://itunes.apple.com/us/review?id=1223471316&type=Purple%20Software,2024-03-29T12:02:12-07:00