id,userName,userUrl,version,score,title,text,url,updated
11062311554,sexygal50,https://itunes.apple.com/us/reviews/id651309033,2.51.1,5,Review,"I have not had any issues with my orders, I love the quality of the products,soon I will have time to do a lot of videos of all my products I have received from Temu",https://itunes.apple.com/us/review?id=1641486558&type=Purple%20Software,2024-03-19T09:39:34-07:00
11062298717,Aleeee💜,https://itunes.apple.com/us/reviews/id1637221724,2.51.1,5,Encantada con la app,Excelentes Productos y confiable🤍,https://itunes.apple.com/us/review?id=1641486558&type=Purple%20Software,2024-03-19T09:35:03-07:00
11062295353,Len2727!,https://itunes.apple.com/us/reviews/id1256451485,2.51.1,5,Review,Most definitely love shopping on here,https://itunes.apple.com/us/review?id=1641486558&type=Purple%20Software,2024-03-19T09:33:53-07:00
11062275152,jodilicious,https://itunes.apple.com/us/reviews/id1456269174,2.53.0,5,Great app!,Great app to use and very affordable! They have everything you need and very unique and useful products!,https://itunes.apple.com/us/review?id=1641486558&type=Purple%20Software,2024-03-19T09:26:51-07:00
11062273433,Everlylees,https://itunes.apple.com/us/reviews/id1278112528,2.51.1,4,in the UK and vastly different quality and not at all like USA quality. She’d sent it all back,Great quality in USA not so much in the Auk,https://itunes.apple.com/us/review?id=1641486558&type=Purple%20Software,2024-03-19T09:26:15-07:00
11062264147,The Temu shopper,https://itunes.apple.com/us/reviews/id208565969,2.51.1,5,Shopping,"Love/like everything I order and I  will place and order I have in my shopping cart right nowwwwww, price is worthy for what I gotten",https://itunes.apple.com/us/review?id=1641486558&type=Purple%20Software,2024-03-19T09:23:06-07:00
11062262085,ahmomo2004,https://itunes.apple.com/us/reviews/id731533448,2.53.0,1,0/10,"Customer support is AWFUL! Shipping is awful, package handling is even worse. Shein has never failed me, Temu has failed tremendously.",https://itunes.apple.com/us/review?id=1641486558&type=Purple%20Software,2024-03-19T09:22:23-07:00
11062261810,chefpeas,https://itunes.apple.com/us/reviews/id563304542,2.51.1,5,Ease of use,Love this easy to use app. I just gave to be careful. The prices are so good I’m buying too much. lol,https://itunes.apple.com/us/review?id=1641486558&type=Purple%20Software,2024-03-19T09:22:18-07:00
11062255603,bootytickler101,https://itunes.apple.com/us/reviews/id628709129,2.51.1,5,Excellent,I have bought numerous products and have not been disappointed only downside is you have to buy more than $15 to be able get certain deals,https://itunes.apple.com/us/review?id=1641486558&type=Purple%20Software,2024-03-19T09:20:13-07:00
11062195405,awilson 627,https://itunes.apple.com/us/reviews/id1274063060,2.51.1,5,Happy customer,"I rate the stars that I did, 5-star because I’ve been happy with majority of the items that I have purchased and I been pleased with everything this far with no complaints which says a lot especially when I order online purchases.",https://itunes.apple.com/us/review?id=1641486558&type=Purple%20Software,2024-03-19T08:59:55-07:00
11062178439,NanetteRdz,https://itunes.apple.com/us/reviews/id1298145179,2.51.1,5,Oye pue súper bueno la verdad,Súper bueno la verdad,https://itunes.apple.com/us/review?id=1641486558&type=Purple%20Software,2024-03-19T08:54:03-07:00
11062177718,Marinesgirl,https://itunes.apple.com/us/reviews/id111536001,2.51.1,5,Service,"Overall satisfied with purchases and if not, customer service will make it right. Highly recommend",https://itunes.apple.com/us/review?id=1641486558&type=Purple%20Software,2024-03-19T08:53:49-07:00
11062168136,42Dtech,https://itunes.apple.com/us/reviews/id1601134508,2.51.1,5,Review,"Keep doing good job, appreciate it but would prefer hand tools be priced in sets also.",https://itunes.apple.com/us/review?id=1641486558&type=Purple%20Software,2024-03-19T08:50:32-07:00
11062145142,my weightloss,https://itunes.apple.com/us/reviews/id588032178,2.51.1,5,Pleased,"I have been happy with everything I have ordered, I really enjoy the variety they offer and the prices",https://itunes.apple.com/us/review?id=1641486558&type=Purple%20Software,2024-03-19T08:42:44-07:00
11062110353,Iwcwcwc,https://itunes.apple.com/us/reviews/id256522883,2.51.1,5,Temu,"All items are great, fast delivery and great communication",https://itunes.apple.com/us/review?id=1641486558&type=Purple%20Software,2024-03-19T08:31:04-07:00
11062087173,Royal🦋,https://itunes.apple.com/us/reviews/id1431126323,2.51.1,5,I’m not disappointed at all,I love everything that I ordered,https://itunes.apple.com/us/review?id=1641486558&type=Purple%20Software,2024-03-19T08:23:18-07:00
11062019516,Lele1819,https://itunes.apple.com/us/reviews/id1634509781,2.53.0,5,GREAT SERVICE!!!!🥳,Super good service and is a very good business,https://itunes.apple.com/us/review?id=1641486558&type=Purple%20Software,2024-03-19T08:00:56-07:00
11061999322,Blahblahblah625,https://itunes.apple.com/us/reviews/id130328123,2.53.0,5,Great deals!,I get most of my crafting supplies at a MUCH cheaper cost now. Love this app!!,https://itunes.apple.com/us/review?id=1641486558&type=Purple%20Software,2024-03-19T07:54:21-07:00
11061989412,Hamp_16,https://itunes.apple.com/us/reviews/id387910081,2.51.1,5,Lo recomiendo,Excelente,https://itunes.apple.com/us/review?id=1641486558&type=Purple%20Software,2024-03-19T07:51:07-07:00
11061983920,Larssim,https://itunes.apple.com/us/reviews/id1637189239,2.53.0,1,Scammers,"I was trying to make my first purchase then I got an offer, I was supposed to send invitations in order to qualify for some items for free, I sent a bunch of invitations but they kept asking for more and more never ended, ppl don’t waste time here their special prices are more expensive than other Chinese and Indian apps",https://itunes.apple.com/us/review?id=1641486558&type=Purple%20Software,2024-03-19T07:49:20-07:00
11061983175,Jeron Winter,https://itunes.apple.com/us/reviews/id1048387214,2.53.0,5,Fun to shop,It is a great way to shop with the prices to be affordable. Awesome!!,https://itunes.apple.com/us/review?id=1641486558&type=Purple%20Software,2024-03-19T07:49:05-07:00
11061962634,Mdhsijeveisñsbsjdvv,https://itunes.apple.com/us/reviews/id1502653884,2.53.0,5,Temu,Esta muy buena la app y hay cosas muy interesantes,https://itunes.apple.com/us/review?id=1641486558&type=Purple%20Software,2024-03-19T07:42:22-07:00
11061940775,gee far,https://itunes.apple.com/us/reviews/id716568009,2.53.0,4,Response,So far so good. Have found all items as described. So have learned to BE SURE TO READ ALL DESCRIPTIONS.,https://itunes.apple.com/us/review?id=1641486558&type=Purple%20Software,2024-03-19T07:35:15-07:00
11061920826,Ebanistería,https://itunes.apple.com/us/reviews/id1508828717,2.51.1,5,Muy buena,Excelente todo me llega a tiempo,https://itunes.apple.com/us/review?id=1641486558&type=Purple%20Software,2024-03-19T07:28:52-07:00
11061887709,ravietafula,https://itunes.apple.com/us/reviews/id631140101,2.51.1,5,Me encanta temu,Exelente recomiendo temu a todos me encanta,https://itunes.apple.com/us/review?id=1641486558&type=Purple%20Software,2024-03-19T07:18:16-07:00
11061885377,Yoselyn33,https://itunes.apple.com/us/reviews/id1171661542,2.53.0,3,B,Esta bueno pero no mucho porque cuando estoy apunto de recibir cualquier regalo siempre me vuelven a un porciento y de ahi no paso,https://itunes.apple.com/us/review?id=1641486558&type=Purple%20Software,2024-03-19T07:17:32-07:00
11061875771,Babybluyblue,https://itunes.apple.com/us/reviews/id1559451525,2.51.1,5,Temu,Really recommend this app it’s very convenient and the prices are fairly affordable for what your buying and they also offer discounts and also give you free items when you purchase or get people to help you with the free items all you have to do is send a message and your friends reply and accept and they can even get free gifts there self so enjoy your shopping,https://itunes.apple.com/us/review?id=1641486558&type=Purple%20Software,2024-03-19T07:14:28-07:00
11061870740,Good but is it good?,https://itunes.apple.com/us/reviews/id1509833022,2.51.1,4,Shipping a little longer!,The stuff is amazing but yes the shipping does take a little longer but the price are amazing❤️,https://itunes.apple.com/us/review?id=1641486558&type=Purple%20Software,2024-03-19T07:12:53-07:00
11061806940,Gmckennedy,https://itunes.apple.com/us/reviews/id1530587823,2.51.1,5,Temu review,90% of the items I’ve purchased have been true to advertising. The prices are very low do to be dissatisfied with 10% is ok. Nothing on earth is perfect.,https://itunes.apple.com/us/review?id=1641486558&type=Purple%20Software,2024-03-19T06:52:15-07:00
11061769775,Tiny DOOG,https://itunes.apple.com/us/reviews/id573488179,2.53.0,5,Loving this app,Almost every time I order something from them I always get what it is but seem to be kinda cheaply made but great for the price,https://itunes.apple.com/us/review?id=1641486558&type=Purple%20Software,2024-03-19T06:40:12-07:00
11061765372,Dobby’s Thoughts,https://itunes.apple.com/us/reviews/id39273106,2.53.0,5,Cheap with good quality!,"As a photographer with mostly little kids as my models, I don’t want to spend a ton of money on toys and items that could get damaged as props. I’ve gotten some awesome stuff from Temu.",https://itunes.apple.com/us/review?id=1641486558&type=Purple%20Software,2024-03-19T06:38:46-07:00
11061739116,Fedex602,https://itunes.apple.com/us/reviews/id321789429,2.51.1,5,Great,Product is always on time,https://itunes.apple.com/us/review?id=1641486558&type=Purple%20Software,2024-03-19T06:30:14-07:00
11061738373,CeciliaDurkee,https://itunes.apple.com/us/reviews/id565122798,2.51.1,3,"Pretty good, for the most part","Well, it’s a buyer beware kind of market place, some great, some good, and some purchases are just a whhyyy??? 
The items I have purchased for the most part have been pretty decent, despite having been disappointed a few times. Usually boiled down to a sizing problem, or under site. However, if you look at pictures of the products themselves, read the reviews, you can stay out of the mess of it. Not great, but, not bad either.",https://itunes.apple.com/us/review?id=1641486558&type=Purple%20Software,2024-03-19T06:30:00-07:00
11061727046,Yanky Gal,https://itunes.apple.com/us/reviews/id549371336,2.53.0,5,Awesome prices,"This is a very unique web site that you can find just about everything you need plus more. you would never think you could find all the necessary and interesting, odd and unique gadgets that would be of great necessity to your everyday life.",https://itunes.apple.com/us/review?id=1641486558&type=Purple%20Software,2024-03-19T06:26:17-07:00
11061721798,Negra53,https://itunes.apple.com/us/reviews/id1461700284,2.51.1,5,Satisfied customer,I absolutely love Temu I definitely be shopping like a billionaire ❤️🥰,https://itunes.apple.com/us/review?id=1641486558&type=Purple%20Software,2024-03-19T06:24:32-07:00
11061720849,1 & 0nly,https://itunes.apple.com/us/reviews/id1506609826,2.53.0,5,Temu,I love getting temu packages.  It's like Xmas ever day,https://itunes.apple.com/us/review?id=1641486558&type=Purple%20Software,2024-03-19T06:24:12-07:00
11061669899,steph8373626,https://itunes.apple.com/us/reviews/id777866489,2.52.0,5,Love,Absolutely love this app I have found so many things for my daughter that she absolutely loves,https://itunes.apple.com/us/review?id=1641486558&type=Purple%20Software,2024-03-19T06:07:28-07:00
11061616776,Stingergracedesigns,https://itunes.apple.com/us/reviews/id37991889,2.51.1,5,Really have enjoyed using this app. No issues.,100% give it a try,https://itunes.apple.com/us/review?id=1641486558&type=Purple%20Software,2024-03-19T05:49:53-07:00
11061530766,TheSnake_991,https://itunes.apple.com/us/reviews/id1339292914,2.52.0,1,All scam,"Absolutely ridiculous. This app insists you invite others to receive a gift, but it’s all smoke and mirrors. No matter how many people you bring in, you never actually receive anything. Total scam",https://itunes.apple.com/us/review?id=1641486558&type=Purple%20Software,2024-03-19T05:20:32-07:00
11061480139,karmagadgets,https://itunes.apple.com/us/reviews/id42814975,2.51.1,5,Excellent value !!,Very happy with my first Temu Purchase. Very quick shipping and excellent value !! So many things I’m going to buy !!,https://itunes.apple.com/us/review?id=1641486558&type=Purple%20Software,2024-03-19T05:02:54-07:00
11061401830,heydbliss,https://itunes.apple.com/us/reviews/id1336935631,2.52.0,3,Great products/questionable billing,"There’s no arguing that Temu has some great products at good, affordable prices. The designs featured in a lot of departments are funkier than they a year or so ago, more modern and keeping with current design trends. There’s something here for everyone though regardless of your tastes. On the whole I’ve been very pleased with the quality of the products I have purchased. Great prices and well made clothing, etc. I expect the pieces I purchased to last, just be careful of any garments with a large percentage of polyester - they will pill after machine washing. I tried to stick with 100 percent cotton.

That said, despite their apparently meticulous receipts and records, it still results in some confusion and I was distressed to find some discrepancies between what they say I was charged for and what I actually paid. I have not broached this with Customer Service yet so I cannot comment on how they will handle this. However, I have had other issues like a lost package & they were very accommodating and helpful, giving me credit for one portion of the total order even though the box was eventually located.

The prices change rapidly so stay on top of that & get refunds for any price drops. Often there are multiple listings for items that will show them for different price points, do your due diligence! Some descriptions of items were not accurate(a bedspread that is definitely not a ‘quilt’), but on the whole I have been very pleased with the quality of the items I have purchased. The workmanship is not shoddy & I expect the items to last. And you can’t beat the prices! The designs are funky and fun. I always want more than I can afford!",https://itunes.apple.com/us/review?id=1641486558&type=Purple%20Software,2024-03-19T04:34:31-07:00
11061383186,fittrack,https://itunes.apple.com/us/reviews/id163498667,2.51.1,5,Temu,Doesn’t disappoint they have it all !!,https://itunes.apple.com/us/review?id=1641486558&type=Purple%20Software,2024-03-19T04:27:32-07:00
11061382680,BEAT_MASTER,https://itunes.apple.com/us/reviews/id160835082,2.52.0,5,The product,The service is great. Some products will not meet the description like this example “1200 Mbps WiFi Extender” it doesn’t reach to 25 Mbps even though I have high speed internet connection with 1Gbps (1000Mbps) Fiber Optics with Frontier Internet Provider.,https://itunes.apple.com/us/review?id=1641486558&type=Purple%20Software,2024-03-19T04:27:21-07:00
11061376783,Domsasuke32,https://itunes.apple.com/us/reviews/id1437732668,2.52.0,5,This app is awesome,I love how convient and supportive their customer service is as well as the time to get the product to you is perfect as well.,https://itunes.apple.com/us/review?id=1641486558&type=Purple%20Software,2024-03-19T04:25:11-07:00
11061339582,Learn me,https://itunes.apple.com/us/reviews/id1637120798,2.51.1,5,Good,Cheap,https://itunes.apple.com/us/review?id=1641486558&type=Purple%20Software,2024-03-19T04:11:04-07:00
11061237350,KynzeeB,https://itunes.apple.com/us/reviews/id1502141859,2.51.1,5,Temu,Love all their products and prices,https://itunes.apple.com/us/review?id=1641486558&type=Purple%20Software,2024-03-19T03:29:09-07:00
11061236218,614Jay,https://itunes.apple.com/us/reviews/id1560017068,2.51.1,4,Temu,I buy a lot of stufff here,https://itunes.apple.com/us/review?id=1641486558&type=Purple%20Software,2024-03-19T03:28:40-07:00
11061225666,Forget goodbyeeeeeyou,https://itunes.apple.com/us/reviews/id1637105665,2.52.0,4,Comment,"I love most of the things 
Was few poor quality 
Got things I didn’t order
You offer a lot of stuff
Wish return policy was easier",https://itunes.apple.com/us/review?id=1641486558&type=Purple%20Software,2024-03-19T03:24:08-07:00
11061225220,Mado 000,https://itunes.apple.com/us/reviews/id907868117,2.51.1,5,تطبيق رائع,حلو,https://itunes.apple.com/us/review?id=1641486558&type=Purple%20Software,2024-03-19T03:23:57-07:00
11061208982,duaqwe,https://itunes.apple.com/us/reviews/id1404221569,2.51.1,5,Impressive service and low prices,Temu always offers quality products at low prices and provide an excellent customer service with a quick responses.,https://itunes.apple.com/us/review?id=1641486558&type=Purple%20Software,2024-03-19T03:16:55-07:00