id,userName,userUrl,version,score,title,text,url,updated
7196661894,LTCCR,https://itunes.apple.com/us/reviews/id1265092791,2021.3.31.2,5,Needs a few tweaks,"This game is good it’s just that some parts are off and can ( and knowing that you guys work hard) will be fixed. I also looked at the negative reviews and see that they share the same issue quite a bit but I rated a five star because the only issue is that some people exploit the game. One such example is when your about to press the meeting button and you get killed in the meeting. I have seen it at the point of view and see that the ping of the game is slow and that keeps the person with low ping outside of the meeting. So while players are chatting, the person could walk around and if it was the imposter then they could kill you inside the meeting. This issue rarely occurs due to the newer update. One concern I have is with the banning/kicking in the servers. I was playing and people would be mad a kick you for playing the game. Could you maybe look into this and have a box where you had to type out the reason for banning/kicking. It might not work and people will still be people but overall it’s a good game and deserves more good attention.

Edit: so with the new update there is more issues. The chat is so messed up that people hate it. This isn’t good with the other issues from above.",https://itunes.apple.com/us/review?id=1351168404&type=Purple%20Software,2021-04-07T20:13:47-07:00
7172013923,GolfHound,https://itunes.apple.com/us/reviews/id108407797,2021.3.31.2,3,It was fun... until the update,"Before the update I used to play among us so much! I played it with my friend almost every day. But then the update happened. And it changed a lot. Before the update I couldn’t wait for the new map to come out. It wouldn’t come out so I deleted the app and reinstalled it. The reinstalled version had the update. First of all, it asks you to type in your birthday. And if you’re under 13 or whatever age it is, it won’t even let you chose your own name! What’s up with that? However it did have the new map. But with the new update I can only use the quick chat thingy which stinks. Anyway, I tried joining a game and when the game was about to tell if I’m crewmate or imposter or whatever the screen goes black and nothing happens. So I close out of the app and delete the app. When I re-downloaded it it didn’t let me chose my age again, so I was stuck with the non-custom name and the quick chat. Anyway I joined a game and my screen turned black when the game started again! So I deleted the app, reset my phone, and reinstalled it and the same things happened again! So, now I guess I can’t play among us anymore. It used to be so fun, but now I can’t even play it. 😡 so, I gave it more than 1 star because it’s fun, but no more than 3 stars because I can’t play it anymore.",https://itunes.apple.com/us/review?id=1351168404&type=Purple%20Software,2021-04-01T12:18:18-07:00
6568958290,EMILYBROWNNNNNNN,https://itunes.apple.com/us/reviews/id532211387,2020.9.9,4,AMONG US CREATORS PLEASE READ!!!,"I highly enjoy your game. I thinks it’s a clever, fun, and innovative way to bring people together through safe anonymity. You only allow a small quantity of characters for usernames so that a majority of people cannot use their full names. I also love the option to turn censor chat off or on. Here’s my issue that I hope you will consider adapting in future updates of your awesome game. Please find some way to stop people from sharing their personal information including social media profiles, phone numbers, etc... PLEASE!! I have been kicked out of so many rooms for simply reminding people to not share their personal information because of hackers and the potential risk of human traffickers and pedophiles. I’m not a Karen I promise you even though I’m sure I come a crossed as such. Please know I’m only in my early 20’s and I’m not by any means a justice warrior but I am very worried about these kids. I see host ask ages then kick anyone who isn’t 13 and a boy or “15 year old girls only” in the comments when you enter the room. I’m just very scared they could be luring them in with the game then turning the room private and taking advantage of these children or manipulating them into giving out personal information. Thank you for your time!!",https://itunes.apple.com/us/review?id=1351168404&type=Purple%20Software,2020-10-24T06:29:28-07:00
6620180244,flowergirl1s204,https://itunes.apple.com/us/reviews/id657980681,2020.10.22,5,Amazing game just a couple things though,Now let me tell you I absolutely love this game I play with my friends all the time but like all games there is always something about it that doesn’t quite make it perfect like for example I think that you should make it so you can follow people or follow your contacts you know so then you can see when they are online or not and make it so you can send games to the people you follow. Another thing is sometimes I will get kicked out because I have an old version of among us but I don’t have an update for among us it’s weird but it happens all the time it gets kind of annoying and I don’t think you guys can fix this but when a lot of people leave the game it makes an automatic win to the imposters but other than all that the game is so fun I play it every day all day!!!! Oh ya one more thing could you make it so after the game when it says waiting for host could you make a timer for that and if the host doesn’t come in that amount of time then it kicks out the host because so many times I have been sitting and waiting for the host for at least 5 minutes before I leave the game. Again this game is literally my favorite game ever!!!!!! 😁😁😁😁,https://itunes.apple.com/us/review?id=1351168404&type=Purple%20Software,2020-11-07T14:04:21-07:00
7172525095,Because_Meme,https://itunes.apple.com/us/reviews/id1130492697,2021.3.31.2,5,We all don’t like this one thing,"As you see from the title, we all know what this one thing is. The quick chat. It is quite annoying in everyone’s opinion and yes…everyone. I understand that y’all might not think the things that some people say but to the players, we can always just leave the game if we don’t like what others are saying. The game is great, but the fact that this feature was added will make everyone’s thoughts of the game go down and most will chose not to play. You can ask the people that are in the review section and anyone else who plays the game. This is a small change that will soon have a drastic change. I am not trying to seem like I have a strong sense of complaint because I still like the game. It’s just everyone’s opinion. One little thing I would have to add is the fact that we cannot change names. It’s just as annoying as the whole chat thing I’m not gonna go into the detail since I don’t want this to be to long. These 2 changes are what people want back the way it was. It’s only all the people that play that share the same opinion. We would love if you guys put remove this feature. If you read this review thank for the time you spent to read our opinion. Thank you",https://itunes.apple.com/us/review?id=1351168404&type=Purple%20Software,2021-04-01T15:42:11-07:00
6543697881,Elijah Gaston,https://itunes.apple.com/us/reviews/id1131354717,2020.9.9,4,Great game!! but buggy..,"Among us is a great game, it’s fun, intriguing, and it doesn’t get boring fast like other games. This game has great gameplay and is less laggy and more interactive than other games. I’ve been playing it for a few months now and I usually get bored over games quite fast, however, among us never gets old. Definitely one of the best games on the app store and quite simple to understand. However, with a game comes some bugs, and i’ve come across quite a few.

After being in the lobby, I encountered a game-breaking bug that makes the game unplayable. Once the round starts. the back of the ship (across from the seats)are at the spawn of the game, specifically the emergency meeting button in the skeld. the server stats that are on the left in the beginning are there too, which made it impossible to see tasks and you couldn’t even open and close task bar. It happened for other people because nobody could move by where the back of the ship, and everyone left. Though this is one of very little bugs, it is game-breaking and i’ve encountered it twice. I have screenshots of the bug, and i would be happy to share them in hopes it can be fixed. Other than that, among us is a great game, and definitely recommend it for anyone who likes action-packed gameplay.",https://itunes.apple.com/us/review?id=1351168404&type=Purple%20Software,2020-10-16T23:58:14-07:00
6560522031,jacobskiboi44,https://itunes.apple.com/us/reviews/id967310511,2020.9.9,5,I love this game,"This game is the best mobile detective game I have ever played but a few changes I would make is to add other positions other than crew and imposter. Then I would put more people in the lobby because the whole point and fun of being imposter is killing and getting away with it so at least add more players in the three imposter games and the two imposter games. This game needs more colors to choose from also and if people want to team then make a game that has teams like a duo match or squad match because teaming is annoying if you don’t want it in your game and this goes back to what I was saying about the more positions if you have more positions then the game will be more exciting because you know that most of the time you won’t be a crew mate because honestly how many games does it take to get imposter. I think if we don’t get more positions in the game then we should at least have something else for the crew to do other than tasks and getting killed. But honestly this game has changed my life because I have something to do in my free time now and plus this game is addicting so great job and keep up the good work and keep making the world happy. 

Thank you for your time please consider making some changes.",https://itunes.apple.com/us/review?id=1351168404&type=Purple%20Software,2020-10-21T19:26:16-07:00
7170499147,da fish 657,https://itunes.apple.com/us/reviews/id816929034,2021.3.31.2,4,Kinda dying,"I’ve been playing among us for a while and can say that the new updates aren’t that good. For starters, the quick chat update a few weeks ago wasn’t that good and made the game feel weird since a few of the other people were using it and it was pretty clunky. Then yesterday when they released the airship map and account system, you can’t add friends and it won’t let me free chat when I put my age as 23, which is how old I am. Not to mention that the new map is way to big for 10 people and has very slow animations to travel with the ladders and floating paths. I remember playing this with my friends back in November and now I don’t really want to play it. They should make more roles and bigger lobbies since that would make the game feel more fresh and fun again. I’ve seen YouTubers like Disgusted Toast and Corpse use mods like the morpher and the jester so the devs could use those with some minor adjustments to make them fit more in the game. They could also make the lobby size 12 or 15 just to keep the new map faster than it already is since games on that map take like ten minutes then the regular 3-5 minutes with any other map. All I’m saying is just try to make good updates that the community wants and please get rid of or change the quick chat please.",https://itunes.apple.com/us/review?id=1351168404&type=Purple%20Software,2021-04-01T04:51:32-07:00
6403196960,syy246,https://itunes.apple.com/us/reviews/id1144939521,2020.9.1,4,"Great game, but lots of bugs and others","This game is an amazing, fun, and a lot more good things, the people are most of the time, nice, interactive, and this is where one part comes. After meeting a nice person and play a few rounds with them, you can’t find a way to interact with them any other way, except by friending them on a social media app. I would love if you added friends to this game, and an invite button. Bugs are another problem. It takes me about 3 minutes to go on the online page, for some reason. Any other online game works perfectly fine, my WiFi fine, everything fine, but I can’t seem to go on the online page immediately. I would like for you guys to fix it, so I can easily go into a game without having much trouble. Another problem is HACKERS. They know who imposters are, literally making the game impossible for the imposters, them becoming imposters every round, never getting a turn to become an imposter. And there’s no kind of anti cheat system, playing the game and winning is impossible, and quite frustrating. This game is honestly really fun, and I never had much funnier with another game, it’s just these problems are quite irritating, and you should definitely fix these, because in game people complain about that a lot. Thanks, have a nice day!",https://itunes.apple.com/us/review?id=1351168404&type=Purple%20Software,2020-09-06T19:56:38-07:00
6818897788,Kindlesworm,https://itunes.apple.com/us/reviews/id6167799,2020.11.17,3,"A good concept, but very boring","I am not really into video  games, so I was very surprised to be into Amoung us. I mean of all the the video games, why did my first one have to be this? Well, I actually got introduced by my classmates , whom have recently discovered the game. When we would ask what did you do for the weekend Amoung us would be a popular game they all played. After a while, I found myself wanting to play the game more and more. I downloaded the app and found myself loving it! The game was relatively easy to play, and fun. 
While, I enjoyed the game their were still some downsides. One of the major cons was the gaming community in the app. People can have offensive name, and bully people without getting kicked out of the game. Many of the hosts do not seem bothered by this,  and don’t even think to ban or kick these people from the game.  
As time went by I found the game less entertaining and it became boring. Even with the different maps, which I have tried; all the game is finish task look off suspicion and repeat. I really thought it be more of a challenge. It is challenging in its own way though, like collaboration with people. It can be hard to reason with people. 
For the reasons above , I quite the game. I still, want to give a shout out to the game developers for providing some fun, and hope they pay attention to my complaints. Thank you!",https://itunes.apple.com/us/review?id=1351168404&type=Purple%20Software,2021-01-01T10:45:45-07:00
6809240633,CarbonKnight9,https://itunes.apple.com/us/reviews/id1243766207,2020.11.17,4,"Ok, it's pretty good...","So... Many problems that have been listed in reviews I barely experience, maybe I'm just lucky or people are exaggerating, but I noticed the top review talks about a game breaking bug. Now, there are game breaking bugs, but they are easily solved by quitting, closing the app, then opening it up again, and bugs like that are rare and are getting fixed constantly. It is a good game and concept, people are toxic sometimes, but that's every multiplayer game ever. This game works fine, and I actually strangely don't get adds, I didn't pay for no adds, but I just don't get them. This game has no reward system, so cheating is pointless, and if the settings are bad, leave before it begins. I have never had a problem with not being able to join for leaving to many games, and I think as long as you don't take offense at the dumb things people may say to you online, you'll be tine and there won't be much reason to leave. It's just a game, nothing anyone says or does matters, but still don't be a jerk. This game is pretty good, and even with all the normal dangers and downsides that normally come with online games, this one is pretty good. If something happens you don't like, or if there is a glitch, just leave the game and join another. Fixing your problem is that easy.",https://itunes.apple.com/us/review?id=1351168404&type=Purple%20Software,2020-12-29T20:42:59-07:00
9254137836,great agme for robux,https://itunes.apple.com/us/reviews/id1256747739,2022.10.25,5,"Well, now a lot worst. Edit: One year later this game is much more fun","This game was a little fun in the beginning. But than later on after 2 or 3 months it got kinda boring and I was not enjoying it for a month. So then I stopped playing for about 5 months. So one day I decided to go play among us and for some reason it felt better. So I kept on playing. Then there was a update. With new roles. And I love the update a It a fresh new among us but it’s really good and fun. Though the reason I gave 4 stars because it’s not amazing but it is good. Edit: Before I had gaven this game a 4 star rating but now it deserves a 5 I’m just starting to love the game even though the whole among us trend is over and not much YouTubers or people play the game as much as it used to be played the games just really good and fun but I have a suggestion, Since the game has 4 maps now I feel like innersloth should add a 5th one just to make it seem a lot more interesting and fun. The new map personally should have better tasks and some interesting things. Like for example maybe you add a task where you have to cook food or sweep a floor. Thanks for the game and I will write a report soon again on this very fun game.",https://itunes.apple.com/us/review?id=1351168404&type=Purple%20Software,2022-11-04T06:49:25-07:00
7076584542,ducttaped mouth,https://itunes.apple.com/us/reviews/id1151737963,2021.2.21,3,Massive Annoyance,"The new chat system is great and all, but it is also to confusing for kids like me who are used to the old one but are now FORCED to use the new one! I mean, it doesn’t even have a part where you can ask for people to watch you do a visual! I also feel like since people can lie about their age, and it isn’t fair to us as kids to let older people be able to say what they want when it seems like they do the most cursing, maybe people can report others that cuss so they would have to use the quick chat for a month or so, since another problem is that it only stops the kids from cursing and explicit stuff, they can still see what other people do if they don’t have censor chat on. As a result of this, in addition to the above suggestion, make it so that the quick chat is an option available, not an unfamiliar thing forced upon us kids. It really takes something away from the game when most of the people are stuck to a few sentences that doesn’t even include some vital stuff to the game, as mentioned before with the inability to ask for people to see them do a visual task. It is even at the point where I am considering deleting and reinstalling the game to be able to use the old chat system. It brought the rating down from a 7/5 to a 3/5. If this is changed, will change my rating.",https://itunes.apple.com/us/review?id=1351168404&type=Purple%20Software,2021-03-07T09:19:01-07:00
6794053499,Aubrelatsplay12345,https://itunes.apple.com/us/reviews/id1052924747,2020.11.17,5,SPECTACULAR,"Hi i am a user that plays your game Among Us! Here are some things that i think your should add! First can you please add more than three Imposters because three to me is not enough. Second could have more colors & could create your own unique colors that don’t have the same as another person. Thirdly could you please have more task. I think that there should also be more places or settings to play at. Also could do a little more monitoring on the usernames, kids have been using a lot of language but in creative ways in order to have them. I think there should also be more vents. Sorry if this is interrupting your doings, but could you also have a free giveaway almost if you been imposter five times or ten times you get a free accessory that you would like to choose from. 		Here are some incredible things about your game. One i love you can play online and have a language button to turn off and off for younger people, they don’t have too much blood, also children can build that skein figuring out stuff lets just say someone steals their cookie then by the skills from your game they could determine on which person stole it! This is an incredible game is love it so much!!!!! -Your incredible loving player.❤️",https://itunes.apple.com/us/review?id=1351168404&type=Purple%20Software,2020-12-25T19:16:49-07:00
6697820787,Wiley_48,https://itunes.apple.com/us/reviews/id1233639715,2020.11.17,5,Adding and updating suggestions: Among Us,"Among us is a Great game but there are some things it needs updating on and just needing to be added to the game. 1) Friend request: I mean do I even have to say? It needs to be added so that you can talk to people and actually be able to be friends with them besides just talking that one time you play with them. 2) Glitches: Yes, I know there are a lot of glitches but these are the ones I’ve encountered. 1st glitch) When it just randomly kicks you, I hate this I could be playing with a friend or family member and it will just randomly kick me (even if I’m the creator). 2nd glitch) when I can see ghosts chats and I’m not a ghost, I don't necessarily hate this it’s just kind of a spoiler on the game because most the time people who are dead say who the imposter(s). 3rd glitch) When you can’t move, like you starts the game and you can’t move at all, I hate this because I have to go the whole game without moving. 3) Imposter can see ghost chat: A lot of people want this, I think they should have two chats for imposter one that the player chat and the other is the ghost chat. I think this would be really cool because if your imposter and you want to apologize for killing them or just talk to the ghost.",https://itunes.apple.com/us/review?id=1351168404&type=Purple%20Software,2020-11-28T22:33:29-07:00
6650417321,chloe'06,https://itunes.apple.com/us/reviews/id971825852,2020.10.22,5,Amazing!! But here’s a few suggestions.,"Ok so I love this soooo much!! It’s amazing and so much fun to play with friends!! But no game is perfect and this one could definitely have some updates! 1.) Currently the highest amount of players that can play in one game is 10:( this is fine if you are playing online or with a small group of friends but when you have a group of more than 10 people it’s basically first come first serve. I know that if you had unlimited people the game would take a longggggg time but I also think that sometimes you figure it out so quickly it’s not very fun. I suggest making the player capacity 20 this would make the game more challenging and more fun especially when playing with a friend group. 2.) Right now there is 12 basic colors red, green, orange, yellow, etc. and a small section of hats. I really wish they would add more colors and hats!!! 3.) Currently there are very few tasks that people can watch you do and not everyone has the same tasks so you can’t always do visual. I think it would help if you added a few more visual tasks. 

I really love this game but definitely think that some things could be changed!!!!! Would definitely recommend!!!!!",https://itunes.apple.com/us/review?id=1351168404&type=Purple%20Software,2020-11-15T19:44:34-07:00
6557331789,HDSpeed,https://itunes.apple.com/us/reviews/id413595608,2020.9.9,5,1 tiny tiny issue,"Among us is awesome. 10/10 highly recommended. Me and my friends are having a blast and honestly I’ve met some amazing people playing as a random. That’s where the problem comes in. The game will end and I’m excited to go to chat to either celebrate with the crew or talk smack when I win as imposter. On iPhone, there is this Ad for the game“Episodes” that comes up every few games or so, there’s an x at the top left but nothing happens when u press it. If u sit through the whole ad trying to press the “x”, it ends up just taking u to the App Store to try and download this app. So basically I’m not trying to complain about the games ads (u guys are actually amazing with the ads, not excessive and easy to dismis if you aren’t interested) but u guys gotta get rid of that episodes one, every time I see this girl fall off her ladder Ik I lost all hope to get back into the lobby with the people I was just playing with. This has happened multiple times with the exact same ad (no problem with any other)And I promise u, no one will care about the episodes ad being removed. I will gladly watch any other ad that can be exited after without disconnecting from the server. Love the game tho ❤️idea- (friend requests?)",https://itunes.apple.com/us/review?id=1351168404&type=Purple%20Software,2020-10-20T21:32:49-07:00
