id,userName,userUrl,version,score,title,text,url,updated
7989307741,ToothpasteNarwhal,https://itunes.apple.com/us/reviews/id1310749180,3.18.0,3,Read before purchasing,"So yeah, we all sort of had to use this during the pandemic. Both for work, and for school. It’s a pretty good app, but if you can use zoom for the meetings that would be better. The meetings can be glitchy. Sometimes teams automatically kicks people out of the call, and also automatically mutes people. When you have a lot of people on the call sometimes you can’t hear anything. Either no sound comes out, or there is a really high pitched sound. The chats are pretty good though. Although I must admit, I do prefer the iMessage format to the Teams format. If your looking to use teams for a long term project with a lot of people I would suggest you look elsewhere, all though it is quite easy to use and set up group chats. The judgement of weather or not your going to use it is up to you, but know that there might be consequences despite Teams’s easy set up. Three star is an appropriate rating I’d say.",https://itunes.apple.com/us/review?id=1113153706&type=Purple%20Software,2021-11-04T15:27:20-07:00
10355149634,Angela 🦄,https://itunes.apple.com/us/reviews/id754528291,5.16.0,3,Could possibly be my fault,"So I got teams to be able to chat with my friend who has a PC that either does not support messages, or, my friend has no idea how to get messages. I’ve been using teams for almost a year, and I would give it five stars, but 
1) it is laggy, keeps freezing and messages come late
2) whenever I video call my friend and we want to, for example, play Minecraft together or something, the minute I open Minecraft (or any other app), the video call ends and I have to call my friend on another device or it won’t work.
     This is very annoying, but I’d like to say that my iPad is very old and fell into the sink when I was five (fell into the sink as in submerged underwater). With that being said, messages works perfectly fine and I use it on the same iPad. I have no idea if or how you can fix this, but I would really appreciate it because I’m basically stuck with this app to talk to my friend.",https://itunes.apple.com/us/review?id=1113153706&type=Purple%20Software,2023-09-10T12:38:51-07:00
8736974895,MattyRich845,https://itunes.apple.com/us/reviews/id129526726,4.9.0,3,App for professionals should do professional things,"In general, there is not a lot to complain about. Wish it was easier to go back to general chat window during a Teams call. Right now, I have to minimize and right click/long press on the Teams icon from the desktop to get back there without getting lost in menu maze. Most of all: I would like to multitask on my iPad without dropping off camera. I want to stay on camera if I do PnP, and I want to stay on camera if I minimize Teams so that I can do other things. I want to stay on camera if I pin teams to the half or third of the iPad. I want to stay on camera unless I turn the camera off. Offer settings for this behavior if this is not a broad default use case please. Please. Similarly, and perhaps I AM the problem here and have my settings wrong, but it would be great to see the a speaker’s presentation instead of the presenter when Teams is minimized/PNP. Thanks, Microsofters!",https://itunes.apple.com/us/review?id=1113153706&type=Purple%20Software,2022-06-03T07:00:21-07:00
5843965077,Gracie Leigh GBMS,https://itunes.apple.com/us/reviews/id1160010400,2.0.7,2,Needs some help!,"Overall, it’s a pretty great app! I had to download it for school, and for about the first week it worked great. I could chat with friends, turn my work in ( after 1 hour of trying to figure out how to do that ), and even call and FaceTime friends and teachers.

But about 2/3 weeks into using this app, the bugs started happening. I can’t call any people anymore without the app just giving out and kicking me back to home screen, or doing the same when I try to turn into assignments. Very disappointed, now I have to email my teachers instead of being able to properly turn it in ( which causes much more stress for them too! My school has 1,200 students! ). I really love the idea of the app, but the glitches have almost taken over the app for me, and makes it stressful to complete school work. 

Also, I feel as if the app should have a guide when you first download the app too! When I downloaded it, the app was very confusing and I didn’t know where everything was, and it took me almost an hour to find my  way into assignments and turning them in. It was like being in a maze! ( not a pleasant experience! ). 

I honestly hope this app can improve! COVID-19 will probably not end anytime soon, and I will be stuck using this app for at least a year. I don’t hate this app, but I think there are some large improvements that need to be made, so please take this as constructive criticism!",https://itunes.apple.com/us/review?id=1113153706&type=Purple%20Software,2020-04-21T08:13:36-07:00
6582773354,Kai not Karen,https://itunes.apple.com/us/reviews/id863127158,2.0.24,4,Baha,"Not all these 8th graders coming to try and dent the 4.8 customer review with their “I hate school” reviews. 
Anyways, this is a pretty cool app. It’s better than zoom, imo. It is tricky to get the hang of at first though, mostly because of the lack of training before the district had our school use this as our live classtime platform. 
The only issue I have is recently it’s been seriously bugging out. Yesterday classes had to be cancelled and due dates delayed (which is cool, yes, but not for when we still have to do the lessons crammed into time later.) today, most of the students could get on but this morning the app on my ipad stopped letting me in. I’m about to see if it let’s me in now that I’ve redownloaded it, but if not I’ve lost my backup plan for when the school’s *global protect* stops working again.

Edit: no it did not let me in. Microsoft, please fix this, or if there is a way to troubleshoot that would be cool.",https://itunes.apple.com/us/review?id=1113153706&type=Purple%20Software,2020-10-28T05:27:03-07:00
9162060609,HTXCatDad,https://itunes.apple.com/us/reviews/id1278383516,4.17.1,4,It grows on you  ... like ivy,"I have used Teams almost since it came out (Disclaimer: I am a contractor at Microsoft). For our team,  it replaced Skype for Business. It's better than Zoom for presenting PowetPoints (I want to say, ""Duh!"" here, though it's common knowledge that not all Microsoft products play nice with each other). This is true whether you are presenting or watching a presentation.  As a presenter,  you can see your notes on the same screen as your slide, and use a laser pointer to highlight.  You can also write/draw on the slide. I think the coolest presenter feature is the ability to insert yourself,  like a TV meteorologist. 

As an attendee, you can have content presented in high-contrast if you're taking the meeting from the beach. You can also enable captions, when take your meetings at the airport, for example. If the presenter allows, you can move forward and backward through the deck without affecting anyone else. 

The best part of the mobile app is the rainbow theme they call Pride. Most posts and chats are basically monochromatic.  The theme givea you rainbow tools. 

Everything is not rosy. It can be awkward to switch between a presentation and chat. Also there are sufficient differences between the mobile and desktop that sometimes finding what you need tap is challenging.",https://itunes.apple.com/us/review?id=1113153706&type=Purple%20Software,2022-10-07T18:07:19-07:00
10586378356,red r2d2,https://itunes.apple.com/us/reviews/id505694918,5.20.2,3,"Great capabilities, but needs UI improvements","Shifting to Teams for collaboration is an overall effective strategy, however the UI in teams needs to be improved to make collaborating and managing information fluid.  With more complex organizations where generally the information handled is both sensitive and ‘need to know’, the sheer amount of teams, channels, and chat groups to compartmentize information can become overwhelming.  Tack in business portals, support groups,  apps and workflows and the complexity grows.  
The UI need a better way to organize and present these.   The UI also needs to present what’s changing, being posted, and being mentioned better than a dot on an icon, or an activity stream, both of which are dated approaches.
It also needs to suggest best approach when sharing information to reuse existing teams, channels,  sites, chat groups, etc. and to help reduce the sheer number on new things from growing.",https://itunes.apple.com/us/review?id=1113153706&type=Purple%20Software,2023-11-14T16:50:30-07:00
7495325224,JayBoogieWitThaHoodie,https://itunes.apple.com/us/reviews/id1298452457,3.9.0,1,User experience is extremely stupid,"So first off there is no way to delete chats, so there is unnecessary and very annoying clutter that can't be removed. There isn't even an option to hide a chat despite it saying to do so online. There are no ""three dots"" with more options like it says. Second thing getting on my nerves is how the calendar is only accessible on your personal account, which renders it completely useless for the actual team channel where you'd need to make that information easily accessible to everyone. Same with tasks, also only available for your personal account. There is also no way to add your own personal account into your own business channels. So the features locked behind the personal account version, at that point, could have never been accessed by you or your team anyway.

I don't even understand how you could design an app this frustrating and think that it's okay to make it available for other people. I will be searching for other options now.",https://itunes.apple.com/us/review?id=1113153706&type=Purple%20Software,2021-06-22T19:17:08-07:00
6232974147,kelseykren,https://itunes.apple.com/us/reviews/id123893785,2.0.17,3,iOS App Needs Updating,"I’ve had major issues with my calendar section of the app never loading. It continually says it is “updating” but never finishes loading.

I would also really love to have more features that mirror the desktop app. I can’t initiate using the whiteboard from a video call, but I can participate if someone else starts it. As a teacher, I'd love to use this. It is also really difficult to use video conferencing for teaching because I cant keep the chat open with the video screen at the same time. Please consider adding a pop out where the chat can come up next to the video like the desktop app. 

I also find it difficult that I can only use one note if it launches the app (which also lack features that are available on the desktop version, like the math function) rather than being able to use OneNote directly from teams. 

Lastly, I want to be able to manage my teams from my iPad app because currently some of the manage features are only available on the desktop version. Otherwise, the platform itself isn’t bad and some parts of the app, such as assignments, are exactly the same as the desktop version if I have them side by side to compare. I’m not sure why the app has less functionality than the desktop version, but with so many people using tablets nowadays, especially to teach from, please make them the same with all functionality.",https://itunes.apple.com/us/review?id=1113153706&type=Purple%20Software,2020-07-23T09:55:32-07:00
10219028161,AbdulHameed_,https://itunes.apple.com/us/reviews/id347675654,5.14.0,3,Unable to make and receive calls in MS Teams (Free)?,"We had a Teams Org (Classic) account registered with Outlook personal email IDs (under one Group named xyz) and had 7 members, and the same members have been registered with free Teams Personal Account (under the same Group named as xyz). I’m an Admin for both accounts (Org and Personal Group). Earlier, the calls were working fine when we switch from Org to Personal and wise-versa, but currently the Teams (Classic) is no longer valid. So, we use Teams (Free) calls mainly to connect which was working fine earlier, however, suddenly, the calls stopped working for some members (within the Teams (Free) personal xyz group) and working for some (within the same Teams (Free) personal xyz group). The issue started recently, however, earlier it was working fine. We get an error message “we couldn’t complete the call”. Email IDs are the same in both accounts (Org and Personal).",https://itunes.apple.com/us/review?id=1113153706&type=Purple%20Software,2023-08-04T07:36:42-07:00
7649889683,Corpsman#1,https://itunes.apple.com/us/reviews/id1267583237,3.11.1,4,Solid Interface,"Only two criticisms is the fact when you delete channels, you can’t name a new channel the same name. When you delete a channel it should delete all data associated with it. Only being allowed to change the privacy setting on a channel during the creation of the channel is inefficient, especially when considering my first grievance. If you mistakenly forget to change the privacy setting upon creation, you are forced to delete the channel, but prior to doing so you’ll need to rename it, so you can use the same name when creating the new channel with appropriate privacy setting.

Suggestion 1: Make it to where a channel is deleted all data associated with the channel is deleted so you can reuse the name.

Suggestion 2: Add the capability to change the privacy setting during any point of the channels lifespan.",https://itunes.apple.com/us/review?id=1113153706&type=Purple%20Software,2021-08-03T03:56:53-07:00