id,userName,userUrl,version,score,title,text,url,updated
9014707137,Rookie McSportshatie,https://itunes.apple.com/us/reviews/id1407758548,8.7.60,4,"Good functionality, small and somewhat petty issue.","App works great; aside from a flaw where the screen sometimes shifts downwards when moving it to the background. Aside from that, the only issues I have are petty gripes with ad diversity where you get meta ads that have a loud and in-your-face choir of pigeons tied by their neck screaming at you when playing music to fall asleep to. That, or sports ad #687 where coach Manns McTestosterone (coach of team, from sport) reminds you (the rookie) that clothes get dirty (during sports day event), and if you want to be a cool and manly sports man (very cool, very manly) that you should remember to wash with heavy duty detergent for your manly sporting needs (man’s detergent).
I hate sports, and these type of ads get annoying, fast. So having a way of more directly curating ads aside from waiting until you get one that you don’t like, and selecting the reason you don’t like it from a list, pretending that it does something, would be very nice.",https://itunes.apple.com/us/review?id=324684580&type=Purple%20Software,2022-08-25T02:10:36-07:00
7925919738,AddictedtoAtomas,https://itunes.apple.com/us/reviews/id426282641,8.6.68,3,Multiple long standing bugs,"I love using this app, but there are many bugs that haven't been addressed in quite some time, with new ones stacking on top of them. The most recent one is when you filter to search for a song, when you queue it by swiping to the right, instead of queueing that song, it queues the overall first song in your library, which is very frustrating. Another is when you have the bar at the bottom and you try to swipe to the left to skip to the next song, it oftentimes glitches and either doesn't skip or sometimes even reverses to a previous song. Another is when you queue a song that you're listening to, it usually picks up from where you were in the song instead of the start. I'm sure there are others as well, and I feel like these are definitely solvable issues, and I don't know why they haven't been addressed yet. If it wasn't for the glaring bugs, this would be the best app on the app store by a long shot",https://itunes.apple.com/us/review?id=324684580&type=Purple%20Software,2021-10-17T14:35:52-07:00
7199558851,12731179,https://itunes.apple.com/us/reviews/id1088599853,8.6.14,4,"Few little things, but overall, perfect.","The app is great! I do wish that it were a bit more like Pandora in the way that you can have 1 song on replay for about 10 minutes. Also, the “only 6 skips an hour” rule is not great. Most of the time, I watch an add, and then I listen to my music, however it never plays the song that I want to listen to first thing. Which is why the 6 skips rule, doesn’t work. I do like that you can find all the music ever on here. But the last main thing is, apparently, there is no such thing as having a playlist of less than 15 songs that you chose. Because every time you make a new playlist, it adds songs that IT “thinks” you would like to fill it to 15 songs! That is not always a good move. I have just stopped trying to make playlists at this point because of this. I know it sounds like I’m ranting, but I’m just telling you how it is. Overall if and when these get fixed, the app would be perfect!!!",https://itunes.apple.com/us/review?id=324684580&type=Purple%20Software,2021-04-08T13:31:51-07:00
7125357830,The Shipping Queen,https://itunes.apple.com/us/reviews/id318522211,8.6.10,2,songs won't play,"i keep having this problem where some songs will play without sound, even if my volume is up and my headphones &/or speakers work perfectly fine, or just won't play at all. the songs aren't greyed out or anything, this just happens all the time and its infuriating with how often it happens. i usually restart the app and see of it plays and repeat that which will USUALLY eventually make the song work, but sometimes it just won't. right now i'm trying to play a podcast and ive been restarting the app several times with no luck. i got so annoyed that i ended up logging out of the app and logging back in, as i've seen some people suggest online, and IT STILL WONT WORK! at first this problem wasn't that annoying but it's been happening more and more frequently. also, in case you were wondering most of the songs i have are downloaded and this problem still happens to downloaded songs so i doubt it's a wifi problem, because this happens when i'm out driving in the forest with no connection just as often as it happens at home with wifi.",https://itunes.apple.com/us/review?id=324684580&type=Purple%20Software,2021-03-20T14:25:35-07:00
6708122837,J charlene,https://itunes.apple.com/us/reviews/id546660669,8.5.86,4,"Love, but...","Don’t get me wrong it is a great audio platform just the only issue I have is the recently played tab. I tend to accidentally hit play on random playlists or even a podcast. If you could bring back the option to edit your recently played on the mobile app that would be highly appreciated. It would save having many unnecessary playlists, albums, etc. just filling up the tab when they are not even being listened to. Another suggestion is maybe try and remove the older recently played if you could see how long it’s been based off of some sort of algorithm. For example I haven’t listened to the oldest thing on my recently played in many months maybe even a year. So please bring back the option to edit our recently played tabs on the mobile app and/or find a way to clear the other played audios based off of what is actually being listened to often. Please and thank you! Pleaseeeee",https://itunes.apple.com/us/review?id=324684580&type=Purple%20Software,2020-12-01T20:05:25-07:00
2522238299,riquilin,https://itunes.apple.com/us/reviews/id621285123,8.4.52,5,Review,"In my opinion, the app would be best served if I could create my own library of favourite music by simply using one simple touch, instead of offering what a computer program designates as a possibility of what I like. Music is probably one if the most important arts humans can interact with and therefore creating a computer who makes a designated library will most likely never create what the app needs to have the user fall in love with the app instantly. In other words is like you have to fight with the app searching and that feature is most likely issued once a person becomes a member. I think it should be offered for free. I wouldn’t mind paying to create a library that would find and play only the music I really care to listen to. Instead the app acts like elevator background sound and lacks passion due to the lack of personalisation of options that would speak to me.

Is much friendlier than Pandora and is ok",https://itunes.apple.com/us/review?id=324684580&type=Purple%20Software,2018-05-08T20:13:29-07:00
10424787720,Teamleader216,https://itunes.apple.com/us/reviews/id123810714,8.8.75,5,I am glad to be active as a verified artist,"This is a great way to get my friends music and my own music in front of people who are not local or in my community and a really cool community to have associated with and share their songs and support each other’s efforts to make it possible to get more listeners. I love the idea of sharing music with people from different countries and backgrounds. The music I hear is very good and it makes me happy because I know that people are so passionate about their own music and it helps me understand what new music is available on this platform that I am not able to listen to on other platforms. Thank you very kindly for your support, it means so much to me to be able to serve you as an ambassador for the world and as an advocate of our community. Thank you again for all the wonderful work you’ve done. Michael L Taylor-Fullilove aka Teamleader216_ :IG MIKEYMIKET83",https://itunes.apple.com/us/review?id=324684580&type=Purple%20Software,2023-09-30T15:37:49-07:00
10663491481,MelM44,https://itunes.apple.com/us/reviews/id480640836,8.8.94,4,Great app but stop with the random Spanish commercials!!,"App is great but I DO NOT like getting Spanish commercials. Yes I am bilingual however my biggest pet peeve with marketing is getting a random Spanish commercial on here or other streaming platforms. NONE of my phone settings or any other app/service has Spanish as a selected language, so why are you marketing to me in Spanish?!!!
Attention marketing people this makes me feel targeted with the assumption that you either think my English is not good enough or I’m going to buy a product simply because I heard a commercial in Spanish?!!! WRONG!
This in fact immediately leads me to disliking the company doing the advertising because it feels like you are trying to be manipulative by using language, I will also restart the app or just go listen to something else.  STOP with the random Spanish advertising to English speakers! We aren’t stupid, it just makes you less trustworthy as an advertiser.",https://itunes.apple.com/us/review?id=324684580&type=Purple%20Software,2023-12-06T06:15:13-07:00
9205167510,tqaer,https://itunes.apple.com/us/reviews/id1239310382,8.7.68,5,Good,Omg your right back up your job and you can do better job now you need your money and then your head will help your job as well you will have to let go to the next few weeks and get your own free job as a result your new needs help help your customers to assist in our business or your dynamic job as a customer your help for your hhhh job and your help and help you help your customers get your own help and your customers are doing well and we are both working your job and job you need help for your customers and help you help your help and your customers are very good with customers are not being treated as customers like the servers are very well prepared for the job customers help you help us help your job as your job help your help customers stop your help customers are you are going through the same thing to make you happy you can help your help and,https://itunes.apple.com/us/review?id=324684580&type=Purple%20Software,2022-10-20T16:27:08-07:00
9680316227,ayla_sky,https://itunes.apple.com/us/reviews/id1211681000,8.8.14,1,Have the devs lost their minds??,"What is with you guys using us as lab rats?? Put out a full update or leave us alone, nobody wants your buggy obnoxious unneeded UI “updates” really seems like you guys are TRYING to sabotage your own company! I’ve been a paying customer since 2016 and I’ve never been more annoyed with this app before.. anyways just to let you guys know the new profile update is unusable, even when using the ‘profile preview’ button I still cant see my full profile how my followers would see it because I cant click on anything! So am I really supposed to get on a laptop to see what order my playlists are in on my profile?? Why don’t you guys give us an ACTUAL update like making us able to make new folders on mobile and customize how they look as well?? Idk anything actually useful for once?? But no you guys are probably just gonna turn your app into another tiktok full of stupid videos and useless features so nobody with a shred of sanity will want anything to do with your app anymore.. so freaking close to canceling my premium account for the first time ever..",https://itunes.apple.com/us/review?id=324684580&type=Purple%20Software,2023-03-04T19:04:16-07:00
7237587550,XxDeathRosixX,https://itunes.apple.com/us/reviews/id1198978411,8.6.18,5,Lyrics,"I absolutely love this app, in fact,I’m using it right now! I love this app it’s completely amazing and very fun to use and discover new music but there’s really just one thing that I’m not a fan of, and that is that you removed the lyrics. I loved the app even more before the partnership (I believe its a partnership, correct me if incorrect.) with Genius, and you might be wondering why,well it’s because a lot of people including me, like to sing along to the music, don’t get me wrong! I respect your decision I just really liked the lyrics better, and yes, Genius helps us know more about the songs and backstory and stuff, but there’s a lot of people that don’t really pay attention to that, so all I’m really asking is to bring back the lyrics, maybe add a button to put the lyrics or completely remove the Genius feature. But overall this app is amazing! Thank you for listening.",https://itunes.apple.com/us/review?id=324684580&type=Purple%20Software,2021-04-18T13:43:10-07:00
9068019706,Jdbrougham,https://itunes.apple.com/us/reviews/id301903878,8.7.64,5,New ideas for enhance feature!,"Let me start by saying I LOVE the enhance feature. It’s allowed me to find so many new songs that I adore and also create some banger playlists. As someone who listens to music religiously, and especially in the car, I’ve come across a problem. When I’m driving and I have my playlist enhanced, if a new song starts playing, it’s quite difficult to find that song in the playlist so that I can click the + button to add it. So I propose two new ideas! 

1) a “quick add” feature so that you can add the enhanced song to your playlist directly while you’re viewing the song in full screen, which would also add the 3 recommended songs

2) a “show this song in playlist” feature that automatically scrolls to the right spot in your playlist, allowing you to click the + button and then see the 3 recommended songs after

This would drastically increase the quality of life for me and others who listen to music all the time, but aren’t always able to spend a minute scrolling through my 20 hour long playlist trying to carefully spot the song that’s playing. Obviously I could just use the 3 dots and click “add to playlist” but then I don’t get the 3 recommended songs!!! All in all this is such a good feature and I love this app- these are just suggestions:)",https://itunes.apple.com/us/review?id=324684580&type=Purple%20Software,2022-09-09T09:49:21-07:00
6904615175,Gacha_Wolfie999,https://itunes.apple.com/us/reviews/id1113811371,8.5.94,4,Good but a few annoying issues,"I love the app and I’ve been using it for a little over a year and a half and I’ve never had a problem until now. Recently I’ve been having problems with getting my songs to play. I’m able to get songs to play just fine on my phone but when I try and listen on my tablet it won’t play? My volume can be up and the song will be playing but there’s no sound. So I’ll start the song over and it won’t work. I’ll refresh the app and it won’t work. I’ll play a different song and it won’t work. So I’m wondering if it’s my tablet or if it’s the app. Also, on my phone, I’m having an issue too. I’ll be mid-song and it will just stop playing. And I have to start the song over again. Just recently it has stopped and I've had to reset the sing 6 times. to It, it usually stops at the same time every song. And it’s very annoying! I will have to stop using the app if this continues. Please fix the bugs.

Thank you.",https://itunes.apple.com/us/review?id=324684580&type=Purple%20Software,2021-01-23T08:47:34-07:00
6481252828,ubb_92,https://itunes.apple.com/us/reviews/id158175268,8.5.78,3,"Love it, but hate it 😩","Hi, I love you guys, like that your app doesn’t crash, and your playlist/song recommendations are top class. I love that you can create a queue! I switch from SoundCloud because of these things BUT there is an issue. When I’m putting songs on my queue and I go back because I missed a song or I forgot to like one, it doesn’t go back to the previous song. It goes to first song I put on queue. Then when I go to check the list of songs it removes them, so I can’t even see what songs I added. It makes me really sad, guys. It would be tight if there was a way to see all the songs you played, like a history. SC was dope cause of that. AND another thing that another comment mentioned. Is when you like an album it doesn’t out the songs of that album on the likes playlist, who have to like individually. Oh and I wish the likes was just a tab like albums is a tab and playlist are a tab. Also, SC was cool cause they had like a news feed of music that your followers posted, that would be cool too 🙃",https://itunes.apple.com/us/review?id=324684580&type=Purple%20Software,2020-09-29T08:09:11-07:00
4534126847,Jessi Needs a Nickname,https://itunes.apple.com/us/reviews/id612823892,8.5.16,3,Double Charged,"I’ve had premium for over a year, and I’ve loved it. However, it recently came to my attention that I’ve been charged twice a month for my subscription. I did a little digging and found that I somehow had a second account, which I’ve never used, that was created within four days of my primary account. I would not have started two free trials at the same time and then gotten premium on both. I wouldn’t have authorized payment on two accounts within four days of one another without thinking something was up.  I’m not sure if there was a glitch or what, but I’ve been charged for two accounts all this time. Customer service was nice, but I’m still out more than 150$ on a service I didn’t use. I decided to cancel my subscription all together and try a new music app. 

I know I should’ve caught it sooner, but surely there should’ve been something that noticed two accounts created by the same user with the same payment method within a week and sent me a notification or something.",https://itunes.apple.com/us/review?id=324684580&type=Purple%20Software,2019-07-28T16:48:48-07:00
10509087095,PotatoPresident,https://itunes.apple.com/us/reviews/id1362684142,8.8.81,1,Ridiculous,"So I’m trying to listen to the Nightmare before Christmas soundtrack. I pull up a playlist, first song is an overture, second song is a random Indian guy yodeling. That’s weird I think, and I skip it. Second and third song are good background music, but then this Indian guy comes on five times in a row and I keep skipping him until I give up and go to another playlist. Wasting all my skips. This second playlist shows me that they’ve added three songs that aren’t on the playlist. I think that’s okay so I play it. The first song is one that’s not on the playlist, okay I think. The second song is one that’s not on the playlist, I’m starting to get a little frustrated. Third one is one that’s not on the playlist. At this point I’m banging my head into my pillow. FOURTH SONG IS ONE THAT’S NOT ON THE PLAYLIST. At this point I’ve moved from my pillow to the wall. FIFTH SONG ISNT EITHER. *internally screaming* I just wanted to listen to Jack’s Lament and now im up at 10:00 writing a stupid review when I should be doing my homework. Do not give these greedy developers who value money more than a quality app pocket change.",https://itunes.apple.com/us/review?id=324684580&type=Purple%20Software,2023-10-23T21:09:19-07:00
8521054496,softie moon,https://itunes.apple.com/us/reviews/id1166606998,8.7.18,5,Not all bad,"The app is good, sure the adds are repetitive and annoying, and not everyone can get premium so they sometimes have this add you watch to get 30 minutes no adds, which is really cool. You can choose your playlist via it be one you make or another persons. The only problem I really have it buying premium it’s self, you guys acknowledged it’s not ideal that you can’t buy it in the app but only on website. I tried many times buy premium from the website, I did try to use a Visa gift card so that may have been a problem but I was still trying to give you guys money and it didn’t work through your app. You guys should really let people buy premium through the app like many other apps that have subscriptions. Other than that the apps good and I love the end of the year review, they have all the music I can think off.",https://itunes.apple.com/us/review?id=324684580&type=Purple%20Software,2022-04-01T16:04:25-07:00
5695566531,wildviolet99,https://itunes.apple.com/us/reviews/id345228613,8.5.49,5,Equalizer Improvements-Best music app around!,"By far my favorite music streaming service. However the equalizer function is important to me as I frequently adjust it in order to get the best sound quality. The function is overall good but a way to save custom equalizer settings would make it much more user friendly. Additionally, placing it in a more accessible location would be extremely helpful. Currently it is buried in Settings->Playback->Equalizer forcing one to exit whatever they are doing to adjust sound settings. I hope to see either Playback Settings added to the Now Playing screen’s “three dot” menu or an additional “Equalizer” button created—opening Spotify’s equalizer over the current screen. This would allow the user to return to where they were immediately and greatly improve the app’s sound customization ability.",https://itunes.apple.com/us/review?id=324684580&type=Purple%20Software,2020-03-22T01:38:29-07:00
2787479332,Uni_love11505,https://itunes.apple.com/us/reviews/id486606356,8.4.53,5,Please help,"Please help me. I downloaded the app but for some reason I can’t make an account. I got the button to do so and nothing happened. I tried to hit the button to log in to see if that one worked but it didn’t. If someone can help me, please do. Thank-you!

Edit: I finally got it to work ( lol ) and I love it!! I can listen to my music without needing a subscription like some other music apps I have downloaded. The ads are a little annoying but at least you CAN get rid of them :). The fact you can download any song you want is great! I can listen to my k-pop and then a 2018 hit right after and that’s amazing! The other folder things ( I don’t know what to call them ( sorry ) ) are good because you can listen to new music you haven’t heard before. Sure you listen to a lot of music you don’t like but you find songs you do like quite a bit :). All in all, I love the app even with its few cons. 🙃",https://itunes.apple.com/us/review?id=324684580&type=Purple%20Software,2018-06-28T02:44:05-07:00
10403244796,Joker's Crazy Wife!!🤪,https://itunes.apple.com/us/reviews/id690263293,8.8.72,5,My absolute favorite app,"This app is my number one most used app out of all my apps, even more than tiktok. Now I’m paying for premium duo with another person son i have nothing to say about adds anymore. I just have one suggestion. Now i make multiple playlists for different vibes, but i just basically recycle the same songs from this one super long playlist of my top faves. I think it would be super cool if we could select multiple songs from one playlist and transfer them over to another, that way we don’t have to click so many times. Maybe like a hold down and then tap on the ones you want to transfer to another singular playlist. But other than that, everything is amazing! The audio quality, the amount of songs (i just wish artists would release their unreleased songs). Everything just all in all is amazing!",https://itunes.apple.com/us/review?id=324684580&type=Purple%20Software,2023-09-24T11:45:54-07:00
2293288089,anon1946372,https://itunes.apple.com/us/reviews/id467142888,8.4.43,4,"Could use some work, otherwise good","As a music streaming app, it works great.
I can deal with ads and limited skips, or pay for premium. It isn't perfect and it has its issues but I want to specifically address this one. 
The way the playlist radio functions is absolute garbage unless you pay for premium. If you like a song, you can never undo that action and liked songs will repeatedly show up when you use the radio, thus forcing you to listen to it or waste one of your already limited skips. I have songs I liked months ago still showing up, regardless of whether they're in my playlist or not. Songs that I don't want to hear constantly. This makes it difficult to discover new music without wasting my time.
I understand that as a free user I shouldn't be able to skip everything, but making me deal with this is insult to injury. The least you could do is take these songs out of the queue, or allow us to ""unlike"" them.",https://itunes.apple.com/us/review?id=324684580&type=Purple%20Software,2018-03-10T20:50:00-07:00
9645397231,mick g the star,https://itunes.apple.com/us/reviews/id220106757,8.8.12,5,Miguel a ortiz rockstar,"Iim so rock it this song i love the nightmare somg i love it We all love The Musicals We Can Lip singe and We Are Can Have Fun And We Love Dancing All The Times So Just Like high school musical all the times so we are love the musical time's I what all my Favorite Stars my People to make new Songs remember we can make some fun everyone will fun and we should summer songs and spring songs just fan lets get new songs for fun The music it’s all lots of fun and we need a new summer Songs and spring new songs and fun songs that too just all the fun whatever they really what okay and all lots singing and dance and making with family and friends and with all love ones and brothers and sisters making a freinds to enjoying the all life time just have all Lots. Of fun thank you for your patience and we love music All the world and go music 

We Always Have All Lots Of Fun Songs
And Summer All New Songs",https://itunes.apple.com/us/review?id=324684580&type=Purple%20Software,2023-02-22T17:36:57-07:00
