id,userName,userUrl,version,score,title,text,url,updated
11064043902,Ghostcoco,https://itunes.apple.com/us/reviews/id243403975,4.2410.0,5,The best 🎉,"Very happy with the system , thank you very much 👍✌️☘️",https://itunes.apple.com/us/review?id=951937596&type=Purple%20Software,2024-03-19T21:31:41-07:00
11063776787,Aategr,https://itunes.apple.com/us/reviews/id606420621,4.2410.0,4,Flexible,Outlook is not user friendly,https://itunes.apple.com/us/review?id=951937596&type=Purple%20Software,2024-03-19T19:26:22-07:00
11063423399,Lovepeace1616,https://itunes.apple.com/us/reviews/id37386866,4.2410.0,5,Wonderful,Good site,https://itunes.apple.com/us/review?id=951937596&type=Purple%20Software,2024-03-19T16:59:26-07:00
11063170476,SabrToothSqrl,https://itunes.apple.com/us/reviews/id42856250,4.2410.0,1,Filter doesn't save,"Every time I load the app the filter resets?? 
It didn't used to!",https://itunes.apple.com/us/review?id=951937596&type=Purple%20Software,2024-03-19T15:13:40-07:00
11062877474,Barca Barca Barca!!!,https://itunes.apple.com/us/reviews/id154665724,4.2410.0,5,Oh how l love Outlook,"It is the best nothing to compare.I just love using it.
Love it,love it, love it love it love it.",https://itunes.apple.com/us/review?id=951937596&type=Purple%20Software,2024-03-19T13:13:20-07:00
11062829677,Carmina quintero,https://itunes.apple.com/us/reviews/id943883431,4.2410.0,5,Excelente.,Siempre lo uso. Recomendado 100%,https://itunes.apple.com/us/review?id=951937596&type=Purple%20Software,2024-03-19T12:54:42-07:00
11062582627,BuffaloFred,https://itunes.apple.com/us/reviews/id1452990598,4.2410.0,5,School!,School!,https://itunes.apple.com/us/review?id=951937596&type=Purple%20Software,2024-03-19T11:18:29-07:00
11062438417,VatCPA,https://itunes.apple.com/us/reviews/id34945425,4.2410.0,1,Focus broke again,The focus mailbox option not working again.,https://itunes.apple.com/us/review?id=951937596&type=Purple%20Software,2024-03-19T10:24:44-07:00
11062234253,Harleypopeye,https://itunes.apple.com/us/reviews/id219045789,4.2410.0,4,Conservatives,"Other than all the biased liberal news that has absolutely no credibility, would like to see you bring news max on so we can hear the real news that speaks truth 
Thanks
Eddie",https://itunes.apple.com/us/review?id=951937596&type=Purple%20Software,2024-03-19T09:12:57-07:00
11062184728,Reliable2012,https://itunes.apple.com/us/reviews/id72001268,4.2410.0,4,Great app,"Some limitations but for a mobile app, it does exactly what it should in the absence of a computer.",https://itunes.apple.com/us/review?id=951937596&type=Purple%20Software,2024-03-19T08:56:16-07:00
11061723670,MLMMcC,https://itunes.apple.com/us/reviews/id1478118477,4.2408.1,5,Ease of use,"The ease of use is amazing! Also, it’s a cinch finding old emails!",https://itunes.apple.com/us/review?id=951937596&type=Purple%20Software,2024-03-19T06:25:09-07:00
11061629361,markant22,https://itunes.apple.com/us/reviews/id690236982,4.2408.1,5,Love it!,"""Microsoft Outlook 365 is a game-changer! This app has revolutionized my productivity. With seamless email management, calendar integration, and easy collaboration features, it's a lifesaver. The clean interface and intuitive design make it a joy to use daily. Highly recommend for anyone looking to streamline their work and communication. Five stars all the way!""",https://itunes.apple.com/us/review?id=951937596&type=Purple%20Software,2024-03-19T05:54:08-07:00
11061587925,like the music & the fish!,https://itunes.apple.com/us/reviews/id1012118162,4.2408.1,4,New outlook!,I don’t like the confusion of the new layout!,https://itunes.apple.com/us/review?id=951937596&type=Purple%20Software,2024-03-19T05:40:13-07:00
11061349800,Samaria Epps,https://itunes.apple.com/us/reviews/id134400068,4.2408.1,5,Easy to Use,It is super easy to use and allows me to do a lot of things through my phone when I am not by a computer. It makes being out in the community for work easy.,https://itunes.apple.com/us/review?id=951937596&type=Purple%20Software,2024-03-19T04:15:00-07:00
11060486740,dughbfhhfbkh,https://itunes.apple.com/us/reviews/id8002211,4.2408.1,3,No,Junk e-mail,https://itunes.apple.com/us/review?id=951937596&type=Purple%20Software,2024-03-18T21:07:46-07:00
11060341602,CrakS,https://itunes.apple.com/us/reviews/id111567383,4.2408.1,1,Office 365,Great app ruined by Microsoft trying to push more of their products. I don’t want Office 365. Stop with the popups Microsoft. This is just going to push me into a different all ecosystem,https://itunes.apple.com/us/review?id=951937596&type=Purple%20Software,2024-03-18T19:58:36-07:00
11059694866,jirrafota,https://itunes.apple.com/us/reviews/id1297761181,4.2408.1,3,Error al abrir correos,Me llegan las notificaciones pero cuando abro la app para abrir el correo no aparece en recibidos,https://itunes.apple.com/us/review?id=951937596&type=Purple%20Software,2024-03-18T15:26:03-07:00
11059590239,kaywalala bear,https://itunes.apple.com/us/reviews/id1151791397,4.2408.1,5,Outlook is cool :),Me like outlook becau it is cool,https://itunes.apple.com/us/review?id=951937596&type=Purple%20Software,2024-03-18T14:42:59-07:00
11059292716,BKBuff,https://itunes.apple.com/us/reviews/id1225996112,4.2408.1,5,Works,Works well,https://itunes.apple.com/us/review?id=951937596&type=Purple%20Software,2024-03-18T12:46:14-07:00
11059225840,Suki yaki II,https://itunes.apple.com/us/reviews/id175590451,4.2408.1,2,Adding a new email address,"I am
Having such a difficult time trying to add a new email address. It just continues to want to use the email addresses that were previously used and or listed. It’s not giving me the option to delete it. It’s so frustrating.",https://itunes.apple.com/us/review?id=951937596&type=Purple%20Software,2024-03-18T12:20:48-07:00
11059181389,Attwater Loop,https://itunes.apple.com/us/reviews/id44030078,4.2408.1,5,Looking Good,My personal data always looks good in Microsoft Outlook. The performance level is ideal. I depend on Microsoft Outlook. It has never failed me.  Updating applications like Outlook is never easy. Good job to the team that makes the performance of this application great.,https://itunes.apple.com/us/review?id=951937596&type=Purple%20Software,2024-03-18T12:04:04-07:00
11058668823,Anitria.S,https://itunes.apple.com/us/reviews/id601209050,4.2408.1,5,Easy to use,"Organized , not a big hassle. Great for college students",https://itunes.apple.com/us/review?id=951937596&type=Purple%20Software,2024-03-18T09:00:21-07:00
11058161009,Rob Dek,https://itunes.apple.com/us/reviews/id659011288,4.2408.1,3,Calendar Functionality,"I hate the inability of viewing my calendar while scheduling a meeting and if I want to, I need to delete the meeting invite.",https://itunes.apple.com/us/review?id=951937596&type=Purple%20Software,2024-03-18T06:14:20-07:00
11058159324,Stop misinformation,https://itunes.apple.com/us/reviews/id1081850986,4.2408.1,1,Junk,Outlook keeps freezing on me. It takes 10 seconds to go between emails. When I was finally able to reply to an email it was making the type come out backwards. Zero online support. JUNK!!!!,https://itunes.apple.com/us/review?id=951937596&type=Purple%20Software,2024-03-18T06:13:48-07:00
11058154250,NereidaAlicea,https://itunes.apple.com/us/reviews/id1094886007,4.2408.1,5,Highly recommended,After all those updates this app is working for me. This is wonderful.,https://itunes.apple.com/us/review?id=951937596&type=Purple%20Software,2024-03-18T06:12:09-07:00
11057945929,u352,https://itunes.apple.com/us/reviews/id40690890,4.2408.1,4,Awesome.,"Mail apps typically don’t survive. I always go back to apple mail app but what the outlook team has accomplish is awesome. I can only find one thing that I dont like about it that apple mail has spoiled me on. When reading an email you hit the space bar and it scrolls the message down, hence the 4 star rating.",https://itunes.apple.com/us/review?id=951937596&type=Purple%20Software,2024-03-18T05:01:19-07:00
11057900884,Kevin Pal,https://itunes.apple.com/us/reviews/id581901879,4.2408.1,4,Unread Email Filter,The setting to only see unread has always saved if it was your last view when the app is closed but since the last update it now opens all messages in the inbox.,https://itunes.apple.com/us/review?id=951937596&type=Purple%20Software,2024-03-18T04:45:07-07:00
11057309010,Atoulloh,https://itunes.apple.com/us/reviews/id282990303,4.2408.1,5,Mr,Comfortable and fast,https://itunes.apple.com/us/review?id=951937596&type=Purple%20Software,2024-03-18T00:12:07-07:00
11057207694,gamaşa,https://itunes.apple.com/us/reviews/id1486805734,4.2408.1,5,Bildirim,Bu uygulama çok kullanışlı fakat zaman zaman bildirimler konusunda sıkıntı yaşıyorum.,https://itunes.apple.com/us/review?id=951937596&type=Purple%20Software,2024-03-17T23:18:10-07:00
11056864095,zsxdcfkmjnhb,https://itunes.apple.com/us/reviews/id258798817,4.2408.1,2,App is unusable,It freezes every few seconds.  I’ve tried updating but to no avail.  Just. Will. Not. Work.,https://itunes.apple.com/us/review?id=951937596&type=Purple%20Software,2024-03-17T20:14:45-07:00
11056018188,bizusa,https://itunes.apple.com/us/reviews/id120134160,4.2408.1,4,Outlook for iOS doesn’t have options to add live.com emails,"I have a Microsoft email that ends with live.com.

I was able to sign in with This live.com email address works on all Microsoft platforms and networks but 
Outlook for iOS doesn’t have options to add live.com emails.

When you click on Outlook for iOS and add email only drop-down options show 
hotmail.com
Outlook.com",https://itunes.apple.com/us/review?id=951937596&type=Purple%20Software,2024-03-17T14:09:22-07:00
11055067265,MarineWidow,https://itunes.apple.com/us/reviews/id708463292,4.2408.1,5,Outlook improvements,"Stop or reduce spam mail. It is intrusive and annoying.
I love outlook email and calendar. I use it daily.",https://itunes.apple.com/us/review?id=951937596&type=Purple%20Software,2024-03-17T08:39:38-07:00
11054820892,AwkwardKing,https://itunes.apple.com/us/reviews/id197983779,4.2408.1,1,Used to be good,Finally updated the app and now there’s ads automatically in my inbox? This product is not good enough to warrant a subscription. I won’t be using their services anymore.,https://itunes.apple.com/us/review?id=951937596&type=Purple%20Software,2024-03-17T07:25:54-07:00
11054795229,Seven-One,https://itunes.apple.com/us/reviews/id22538716,4.2408.1,2,Unread View,I like to keep my email uncluttered and see new messages that haven’t been read yet. So I prefer to leave the filtering on “unread only”. Since the update the app reverts to “show all” every time I close it. I understand this is a minor thing but to me it’s an important part of my workflow and efficiency in sifting through messages.,https://itunes.apple.com/us/review?id=951937596&type=Purple%20Software,2024-03-17T07:18:12-07:00
11054540437,WQ82Q86,https://itunes.apple.com/us/reviews/id274687004,4.2408.1,1,Emails never load.,"My emails will rarely load in the app, they load just fine on my computer and I get push notifications on my phone but the app will consistently not load my emails. I’ve tried all of the online fixes to no avail, the only reason I still keep this app is that my job requires it.",https://itunes.apple.com/us/review?id=951937596&type=Purple%20Software,2024-03-17T06:00:16-07:00
11053921431,Harvey Thomas,https://itunes.apple.com/us/reviews/id369879636,4.2408.1,5,Good app,"Very useful, easy to use. Recommend",https://itunes.apple.com/us/review?id=951937596&type=Purple%20Software,2024-03-17T02:08:06-07:00
11053241698,Noxema1982,https://itunes.apple.com/us/reviews/id415903693,4.2408.1,5,I’m a lifer,I’ve had this Hotmail email account for a long time and it has always been convenient for me.,https://itunes.apple.com/us/review?id=951937596&type=Purple%20Software,2024-03-16T21:05:30-07:00
11052489463,Shanster 3,https://itunes.apple.com/us/reviews/id286481790,4.2408.1,5,Great app!,"User friendly, great design, customizable. Great app!
Thank you!",https://itunes.apple.com/us/review?id=951937596&type=Purple%20Software,2024-03-16T16:02:51-07:00
11052438059,tomclearwater,https://itunes.apple.com/us/reviews/id536429571,4.2408.1,2,RAM hog,Why is this consuming 8 gigs even after deleting all emails? Second largest data hog after photos. Why?,https://itunes.apple.com/us/review?id=951937596&type=Purple%20Software,2024-03-16T15:40:47-07:00
11052078017,Axyf,https://itunes.apple.com/us/reviews/id468668133,4.2408.1,5,Awesome,Best,https://itunes.apple.com/us/review?id=951937596&type=Purple%20Software,2024-03-16T13:13:52-07:00
11051713481,im inhappy,https://itunes.apple.com/us/reviews/id1448262719,4.2408.1,1,Worst app,Worst app I have ever used BECUASE of the phone number verification,https://itunes.apple.com/us/review?id=951937596&type=Purple%20Software,2024-03-16T10:59:44-07:00
11051419368,Wrath47,https://itunes.apple.com/us/reviews/id208618039,4.2408.1,2,Older versions was better,The new version is full of all sorts of fun and interesting bugs and is probably the worst email app you can get. Try the Edison mail app it’s got a lot of great features that you will love and no bugs,https://itunes.apple.com/us/review?id=951937596&type=Purple%20Software,2024-03-16T09:24:45-07:00
11051397255,barriga de chocolate,https://itunes.apple.com/us/reviews/id1040808093,4.2408.1,5,Operar,Es fácil de usa,https://itunes.apple.com/us/review?id=951937596&type=Purple%20Software,2024-03-16T09:18:05-07:00
11050967635,Sm1leyBri,https://itunes.apple.com/us/reviews/id127857911,4.2408.1,5,Wonderful!,I love this app so much. It’s so easy to use!,https://itunes.apple.com/us/review?id=951937596&type=Purple%20Software,2024-03-16T07:13:20-07:00
11050785141,radangt15,https://itunes.apple.com/us/reviews/id565606776,4.2408.1,5,Easy and intuitive,"Provided all of the tools I need to manage and organize my workflow and my emails, which are a lot as per my career and it’s very easy to use very intuitive. I love it makes my life easier really. My absolute favorite is the calendar 😁",https://itunes.apple.com/us/review?id=951937596&type=Purple%20Software,2024-03-16T06:20:01-07:00
11048538029,IeshaD,https://itunes.apple.com/us/reviews/id36971066,4.2408.1,4,"Great APP, HOWEVER…","This app is great; however, it needs constant resetting.",https://itunes.apple.com/us/review?id=951937596&type=Purple%20Software,2024-03-15T15:25:07-07:00
11048380686,duceyk,https://itunes.apple.com/us/reviews/id473942115,4.2408.1,1,Must open Outlook to preview emails,No longer allowing email preview when drop down notification occurs.,https://itunes.apple.com/us/review?id=951937596&type=Purple%20Software,2024-03-15T14:21:56-07:00
11047916640,Michael 😁,https://itunes.apple.com/us/reviews/id283623682,4.2408.1,5,Functional,Love outlook and teams! It’s functional and responsive,https://itunes.apple.com/us/review?id=951937596&type=Purple%20Software,2024-03-15T11:25:42-07:00
11047566896,FugalCurve63,https://itunes.apple.com/us/reviews/id456513764,4.2408.1,2,Normally would be 5 star but….,Recently every single time for the past month that I’ve tried to use outlook I’ve had to wait hours at a time just to check one email because your app is constantly stuck on the “downloading new messages” screen and they take hours to download every day. This makes it impossible to use it for work and based on multiple people online complaining of the same issue I’m not the only one. if this doesn’t get fixed I’m going to have to switch services,https://itunes.apple.com/us/review?id=951937596&type=Purple%20Software,2024-03-15T09:28:28-07:00
11047497519,pantsofpoop,https://itunes.apple.com/us/reviews/id540206815,4.2408.1,1,iOS 16 requirement makes this useless to me,Some of us don’t throw away older phones that are still working fine,https://itunes.apple.com/us/review?id=951937596&type=Purple%20Software,2024-03-15T09:06:50-07:00