id,userName,userUrl,version,score,title,text,url,updated
11112448640,Wonrak,https://itunes.apple.com/us/reviews/id629199637,3.608.10000,5,Thank you,"I’m good, my first time and not my last it was a great!",https://itunes.apple.com/us/review?id=368677368&type=Purple%20Software,2024-04-02T00:59:29-07:00
11112374849,Nickli06,https://itunes.apple.com/us/reviews/id125156618,3.608.10000,5,Lifesaver  really late hour pickup when I was stranded by Lyft,Really came through after Lyft canceled on me four times will recomendable Uber to anyone,https://itunes.apple.com/us/review?id=368677368&type=Purple%20Software,2024-04-02T00:22:49-07:00
11112303099,Watts105,https://itunes.apple.com/us/reviews/id634500311,3.608.10000,5,The Man,“Thanks again bro for bringing my phone to my house “🫡,https://itunes.apple.com/us/review?id=368677368&type=Purple%20Software,2024-04-01T23:46:22-07:00
11112186964,AllisonAllred,https://itunes.apple.com/us/reviews/id415865085,3.608.10000,5,Fidel our Drive,"Fidel was great. On time, courteous, a safe driver, etc. Would ride with him again. 5 Stars!",https://itunes.apple.com/us/review?id=368677368&type=Purple%20Software,2024-04-01T22:46:33-07:00
11112113170,DNAhome,https://itunes.apple.com/us/reviews/id466180540,3.608.10000,5,A real gentleman,I appreciated the care on the road and his alertness! He was a real gentleman with my luggage. I would request him again if possible😊,https://itunes.apple.com/us/review?id=368677368&type=Purple%20Software,2024-04-01T22:09:00-07:00
11112039421,Dkoffman30,https://itunes.apple.com/us/reviews/id216561560,3.608.10000,5,Lost phone,"Please help Frank, I left my phone in your car",https://itunes.apple.com/us/review?id=368677368&type=Purple%20Software,2024-04-01T21:32:32-07:00
11111906600,Skipme12,https://itunes.apple.com/us/reviews/id663341207,3.608.10000,5,Gatlinburg…Shamrock,Our driver was great!!,https://itunes.apple.com/us/review?id=368677368&type=Purple%20Software,2024-04-01T20:30:03-07:00
11111799358,TheTroubled1,https://itunes.apple.com/us/reviews/id928174035,3.608.10000,5,Great service,"The driver was on time, very personable, and it was overall a good  experience",https://itunes.apple.com/us/review?id=368677368&type=Purple%20Software,2024-04-01T19:44:14-07:00
11111767433,Gizmo buddy,https://itunes.apple.com/us/reviews/id1080293841,3.608.10000,5,Nashville,He was wonderful! Very nice and thoughtful!!! Thank you for the ride my friend…. 👍,https://itunes.apple.com/us/review?id=368677368&type=Purple%20Software,2024-04-01T19:31:19-07:00
11111734096,Millie864,https://itunes.apple.com/us/reviews/id528947609,3.608.10000,5,Nice Driver,"Very professional, prompt, & friendly!",https://itunes.apple.com/us/review?id=368677368&type=Purple%20Software,2024-04-01T19:18:08-07:00
11111715222,Marymatch,https://itunes.apple.com/us/reviews/id922509734,3.608.10000,5,Nate,He was great!!!!!,https://itunes.apple.com/us/review?id=368677368&type=Purple%20Software,2024-04-01T19:10:57-07:00
11111704390,ragepro,https://itunes.apple.com/us/reviews/id40746074,3.608.10000,5,Nyc,Excellence driver!,https://itunes.apple.com/us/review?id=368677368&type=Purple%20Software,2024-04-01T19:06:44-07:00
11111685412,hassanlaiqkhan,https://itunes.apple.com/us/reviews/id577987566,3.608.10000,5,friendly,very friendly,https://itunes.apple.com/us/review?id=368677368&type=Purple%20Software,2024-04-01T18:59:10-07:00
11111679183,Cu de cavalinho,https://itunes.apple.com/us/reviews/id1483837553,3.608.10000,5,Porque sim krlh,5 stars,https://itunes.apple.com/us/review?id=368677368&type=Purple%20Software,2024-04-01T18:56:39-07:00
11111616671,kimChS,https://itunes.apple.com/us/reviews/id691718574,3.608.10000,5,Excelente,Gracias por tu servicio aprecio demasiado su amabilidad! 100% recomendado,https://itunes.apple.com/us/review?id=368677368&type=Purple%20Software,2024-04-01T18:31:18-07:00
11111610514,Balta Pineri,https://itunes.apple.com/us/reviews/id643249292,3.608.10000,5,Excelente servicio,Mario nos dio un excelente servicio con valor agregado.,https://itunes.apple.com/us/review?id=368677368&type=Purple%20Software,2024-04-01T18:28:48-07:00
11111597932,Gallego1967,https://itunes.apple.com/us/reviews/id31466669,3.608.10000,5,Great job,Excellent driver. Knowledgeable about the Houston Area.,https://itunes.apple.com/us/review?id=368677368&type=Purple%20Software,2024-04-01T18:23:42-07:00
11111587866,Chatham Matilda,https://itunes.apple.com/us/reviews/id165804236,3.608.10000,5,Great ride,"Super easy pickup at the airport. The driver, such a nice person, the car so comfortable and spotless.",https://itunes.apple.com/us/review?id=368677368&type=Purple%20Software,2024-04-01T18:19:38-07:00
11111458545,JonathanK0505,https://itunes.apple.com/us/reviews/id262786991,3.608.10000,5,So patient,We had an infant and this driver was kind virtuous and very understanding thank you,https://itunes.apple.com/us/review?id=368677368&type=Purple%20Software,2024-04-01T17:28:08-07:00
11111450824,Not happy for charge,https://itunes.apple.com/us/reviews/id1631445741,3.608.10000,5,Keep Uber,Pay driver more,https://itunes.apple.com/us/review?id=368677368&type=Purple%20Software,2024-04-01T17:25:01-07:00
11111445065,Yasham22,https://itunes.apple.com/us/reviews/id1082641027,3.608.10000,5,Great driver,He helped with my luggage’s through the airline thanks A lot he is very polite and helpful,https://itunes.apple.com/us/review?id=368677368&type=Purple%20Software,2024-04-01T17:22:42-07:00
11111380664,Quivers45,https://itunes.apple.com/us/reviews/id903142065,3.608.10000,5,The Best Driver,"She needs to be 5 star the ride was wonderful smell good, and a great personality",https://itunes.apple.com/us/review?id=368677368&type=Purple%20Software,2024-04-01T16:56:57-07:00
11111300072,W Lineberry,https://itunes.apple.com/us/reviews/id1274337642,3.608.10000,5,Driver was great,"Sorry, I got busy cooking food Easter and forgot to tip the driver. He was very polite and I appreciate him bringing dad to the house for Easter",https://itunes.apple.com/us/review?id=368677368&type=Purple%20Software,2024-04-01T16:23:37-07:00
11111277896,Shay -butter-Ming,https://itunes.apple.com/us/reviews/id1281627485,3.608.10000,5,Excellent,He was amazing,https://itunes.apple.com/us/review?id=368677368&type=Purple%20Software,2024-04-01T16:14:37-07:00
11111166975,J Tobey,https://itunes.apple.com/us/reviews/id292155390,3.608.10000,5,Kona,Great ride! Good conversation!,https://itunes.apple.com/us/review?id=368677368&type=Purple%20Software,2024-04-01T15:28:27-07:00
11111141897,Happndood,https://itunes.apple.com/us/reviews/id949842065,3.608.10000,5,Philip is great!,Philip is great!,https://itunes.apple.com/us/review?id=368677368&type=Purple%20Software,2024-04-01T15:17:57-07:00
11111131446,"Roy, the boy",https://itunes.apple.com/us/reviews/id803295407,3.608.10000,5,Great welcome,Excellent friendly driver who got us to our place while suggesting interesting things to do while in New Orleans,https://itunes.apple.com/us/review?id=368677368&type=Purple%20Software,2024-04-01T15:13:42-07:00
11111114858,Eddie 2205,https://itunes.apple.com/us/reviews/id944421906,3.608.10000,5,Good experience,I’m traveling for business and so far my  Uber drivers are so cool and nice. Keep this up Uber good job,https://itunes.apple.com/us/review?id=368677368&type=Purple%20Software,2024-04-01T15:06:56-07:00
11111107432,JohnDee429,https://itunes.apple.com/us/reviews/id1641972693,3.608.10000,5,Terrific Uber Experience,"Joao was on time, personable and a safe driver. Highly recommend!",https://itunes.apple.com/us/review?id=368677368&type=Purple%20Software,2024-04-01T15:03:52-07:00
11111085963,Omid£m,https://itunes.apple.com/us/reviews/id800977956,3.608.10000,5,Excellent driver,Great job,https://itunes.apple.com/us/review?id=368677368&type=Purple%20Software,2024-04-01T14:55:02-07:00
11111066995,Dontplay07,https://itunes.apple.com/us/reviews/id101469141,3.608.10000,5,Great Service,Nice relaxing ride. Courteous & prompt service.,https://itunes.apple.com/us/review?id=368677368&type=Purple%20Software,2024-04-01T14:47:05-07:00
11111047299,BOOM BOOM ARTILLERY,https://itunes.apple.com/us/reviews/id1214819310,3.608.10000,5,My first Uber,Clean  car.  Smelled fantastic— had a lovely conversation!  Would recommend highly!,https://itunes.apple.com/us/review?id=368677368&type=Purple%20Software,2024-04-01T14:38:58-07:00
11111009787,Jessenia Y,https://itunes.apple.com/us/reviews/id253992648,3.608.10000,5,Great expo,Our driver was outstanding on time. His car was clean. He driving was efficient. Great experience overall.,https://itunes.apple.com/us/review?id=368677368&type=Purple%20Software,2024-04-01T14:23:38-07:00
11110993310,DRico117,https://itunes.apple.com/us/reviews/id606718059,3.608.10000,5,Music,Great music/ careful driver,https://itunes.apple.com/us/review?id=368677368&type=Purple%20Software,2024-04-01T14:16:55-07:00
11110989097,Durán Tamayo,https://itunes.apple.com/us/reviews/id1131403859,3.608.10000,5,very kind and patient,"very kind and patient, he always communicated to know my exact location",https://itunes.apple.com/us/review?id=368677368&type=Purple%20Software,2024-04-01T14:15:10-07:00
11110986780,Happiest523,https://itunes.apple.com/us/reviews/id1035254260,3.608.10000,5,Ride,I had a nice enjoyable relaxing ride and conversation,https://itunes.apple.com/us/review?id=368677368&type=Purple%20Software,2024-04-01T14:14:13-07:00
11110951411,Doctor Arjuna,https://itunes.apple.com/us/reviews/id362275686,3.608.10000,5,Thank you,Wonderful driver-person. Great service.,https://itunes.apple.com/us/review?id=368677368&type=Purple%20Software,2024-04-01T14:00:05-07:00
11110948974,1 Cindy,https://itunes.apple.com/us/reviews/id49699644,3.608.10000,5,Our driver,"Claudio, our driver was great! Very pleasant. Driving was very good as well.",https://itunes.apple.com/us/review?id=368677368&type=Purple%20Software,2024-04-01T13:59:07-07:00
11110939875,Chronic 23,https://itunes.apple.com/us/reviews/id1436915605,3.608.10000,5,Recommend,Smooth ride good comversation,https://itunes.apple.com/us/review?id=368677368&type=Purple%20Software,2024-04-01T13:55:29-07:00