id,userName,userUrl,version,score,title,text,url,updated
9843157758,JoshTheKeith,https://itunes.apple.com/us/reviews/id969980095,260.0,4,I like this better than safari… just missing a few features…,"I almost never use safari now… only when i click on a link sent to me but that is automatic. The only things missing from the google app that would make it the perfect app for internet browsing are: 1) add a gesture similar to safari where you can just pinch in and see all your open tabs. 2) be able to swipe the tabs left to close them. 3) add a reader view, or something that can block ads/distractions. 4) add a “read later” option for articles in the discover feed.",https://itunes.apple.com/us/review?id=284815942&type=Purple%20Software,2023-04-20T14:48:34-07:00
1969031147,SBSUSVDMS,https://itunes.apple.com/us/reviews/id401812808,40.0,4,What happened to the swipe? 😬,This is probably one of the top 3 most used apps in my phone. Definitely at least top 5. I love the ease of access to be able to google anything I want within a matter of seconds. HOWEVER ... why did this latest version get rid of the ability to swipe away stories you’re not interested in? I didn’t realize how much I used that feature until it was gone and I must say I miss it dearly. Please bring it back! I keep accidentally opening stories I’m not interested in because I keep forgetting I can’t swipe them away. Please bring back the swipe! It was so convenient 😩,https://itunes.apple.com/us/review?id=284815942&type=Purple%20Software,2017-12-03T20:42:10-07:00
8474185318,Taylor pell,https://itunes.apple.com/us/reviews/id107307283,203.0,1,Developer response please,"Love this app, have been using it for years. Super handy and I recommend it often. It’s literally top left on my Home Screen. Only posting the 1* to get eyes on this message. 

Lately (last couple months) I’ve been having an issue where the app freezes for 10-20 seconds in the middle of usage. During this time, scroll doesn’t work, I can’t click buttons, typing “registers” but doesn’t actually show up until it finishes the freeze. 

After some time passes, the app works again as usual. Any letters I had typed will rapidly enter into the form, I’ll teleport to where I scrolled, etc. While it happens life is on pause. It’s pretty disruptive because I often use the app for quick search (it’s on my Home Screen).",https://itunes.apple.com/us/review?id=284815942&type=Purple%20Software,2022-03-19T16:40:51-07:00
8330393552,":--,)",https://itunes.apple.com/us/reviews/id1320067140,198.0,1,It keeps using my school account as my default account EVERY.. time😨,"and I’m so tired of it. It randomly switches me to my school account repeatedly , I no longer have privacy anymore, and this is a huge issue since my school can monitor what I look up. No matter how many times I’ve logged out, kept logging into and switching to my main, the same thing happens and I’m literally so tired. 
this seems to have been an issue for years and has tons of threads on Reddit for it , and why has nothing been done if you guys are billionaires.
just tried to switch to my main again since it went to my school account and as soon as I switched and tried to look something up it automatically went to my school account. This is a HUGE issue.",https://itunes.apple.com/us/review?id=284815942&type=Purple%20Software,2022-02-07T12:41:56-07:00
8285373270,Lightanddarklove,https://itunes.apple.com/us/reviews/id189939758,196.0,3,Tabs removed when I didn’t close them,"The past few months my tabs on my iPad and iPhone have randomly closed when I don’t look at them for a few days. This wasn’t an issue until late 2021, probably I noticed it around September or October. If I need to go back to them I have to scroll through my history, sometimes a few  days or weeks of history , just to get to an address of a doctor or something I was keeping an eye on the price of. If not for the fairly reliable history tracking this would be a disaster. Pleas fix this! I know from other reviews I’m not the only one with that issue.",https://itunes.apple.com/us/review?id=284815942&type=Purple%20Software,2022-01-26T08:40:57-07:00
8246097108,𝓐𝓵𝓮𝔁 𝓶𝓸𝓸𝓷𝓵𝓲𝓰𝓱𝓽,https://itunes.apple.com/us/reviews/id1252088409,194.0,5,Very Good app!,"I have had a lot of experience with Google, and I find it uncomplicated, and useful. I can easily type, and search what I would like, and images, locations, books, videos, etc. pop up, and I am able to find what I was looking for. You can use Google Lens, for homework, translating, and more! You can use the microphone feature, and easily find a song! Overall, the app is amazing! I do appreciate the effort your team puts into everything, and you are doing a great job! Keep up the great work!!",https://itunes.apple.com/us/review?id=284815942&type=Purple%20Software,2022-01-15T23:30:35-07:00
3956737959,blaakpilot,https://itunes.apple.com/us/reviews/id100920756,69.0,1,Image search: what the heck?!,"As others have complained, the simple image search feature has been ruined with overly complicated and unnecessary tabs, and you have to actually open the site the photo is on to save. Also, Google thinks I’m stupid and autocorrects my search unsolicited even though I didn’t select the “did you mean X?” hyperlink. Finally, I don’t know if the search algorithm itself has changed, but the search results are now wildly unrelated to what I’m looking for. I searched for an obituary of an old classmate of mine who passed away recently (searched their name and obituary) but the search results were reports on school shootings (my friend died of a heart attack and never shot up a school, and his name didn’t match any school shooters’ names from the articles). Throw away the update and start over.",https://itunes.apple.com/us/review?id=284815942&type=Purple%20Software,2019-04-01T11:34:18-07:00
3762418486,#;8,https://itunes.apple.com/us/reviews/id717545200,66.0,2,"Moderately helpful, but EXTREMELY INAPPROPRIATE!!!","Google was very peachy, helping me research stuff, and things like that. I was going about my business, looking things up on google. Everything was good. UNTIL...I stumbled across something very inappropriate! After that, I noticed that inappropriate things of all sorts pop up, including pictures, websites, and words! Children, very young children use google! You should be ashamed that you allow this xxx stuff on your app! I don’t know how google works, but You should go through all the things submitted to google, and check if they’re appropriate enough. You are disgustingly inappropriate and I feel extremely sorry for the kids and teens that use this site, and are exposed to that stuff. Please do something.",https://itunes.apple.com/us/review?id=284815942&type=Purple%20Software,2019-02-12T10:23:19-07:00
3335858150,maid for integrity,https://itunes.apple.com/us/reviews/id227883265,60.3,5,Bias of information,As much as I enjoyed being able to look up things on Google I have been very displeased by their bias by omission. Buy simply not offering some factual things that are happening in the world — they leave those who are interested in finding out the truth with only part of the equation. When it comes to connecting the dots it is irksome to find that many of the dots have been purposely removed so that the person looking at the picture trying to connect the dots — will not be able to come near finding what the truth actually is.,https://itunes.apple.com/us/review?id=284815942&type=Purple%20Software,2018-10-23T14:13:02-07:00
3810587911,Mageia D.,https://itunes.apple.com/us/reviews/id929235888,67.0,4,A Recurring Issue,"The app itself is fine. A few bugs here and there, but nothing they don’t fix within a reasonable time frame.

There is, however, an issue I’ve had to deal with time and time again for years since I’ve been using the app across multiple devices. When viewing images, the related images section beneath the selected image will show only the first few results of the original search and nothing else. Every image in the search does this and every image in the related images section yields the same result when selected. I’ve never seen ways to fix this.",https://itunes.apple.com/us/review?id=284815942&type=Purple%20Software,2019-02-24T12:23:42-07:00
4555347799,dadspunkin,https://itunes.apple.com/us/reviews/id1055267687,79.0,5,Google tinamoses,I am a 54 yr old grandma if 2 beautiful granddaughter s 1 handsome grandsons I’m not well educated I have a short turn memory ADHD ADDand I have turittiets syndrome I just learn a lot about my google experience it has really become my favorite app it has thought me things like google map took me place I never knew I could go I appreciate and apsilutly love all about my google maps drive also google helps me to fine information of places number helps with my whether report I have COPD and asmatic broncitus love google it takes care of all my need s thank google ur the greatest,https://itunes.apple.com/us/review?id=284815942&type=Purple%20Software,2019-08-02T04:29:23-07:00
10354417924,UMKC-Deb,https://itunes.apple.com/us/reviews/id536364979,280.1,4,Google for iPhones but not Mac computers,"I would have given 5 stars because of the efficiency in using all Google apps on my iPhone but there is no Google app for computers such as Macs. This is where Google is in need of improving. I absolutely love Google Scholar, Docs, calendars and maps in my professional career and education, need help being able to bounce from my iPhone to my Mac computer. It would be interesting to know how many people are Gmail and Google users who use Macs for personal, educational and work as we are all encountering this problem from reports on the internet.",https://itunes.apple.com/us/review?id=284815942&type=Purple%20Software,2023-09-10T08:27:11-07:00
3278665409,Evang. B. J.,https://itunes.apple.com/us/reviews/id252842311,59.0,5,Google,"To Whom this may concern, just a short text to say that Google is the best thing to ever happen to me. Google is my lifeline. It has the answer to all my questions. A great help in all my studies. Even my Bible Studies. Google saves me many trips to the library when it comes to research. It’s a School and College all by itself. Thank you so much for the Google apps, I could not make it with the Google Apps. Keep up with the knowledge especially for the Seniors, many of whom never had the opportunity to go to school. Again I say Thank you. 
                                                     Beverly Allen",https://itunes.apple.com/us/review?id=284815942&type=Purple%20Software,2018-10-08T09:17:58-07:00
10106667643,JSBLACKIII,https://itunes.apple.com/us/reviews/id681599055,271.1,5,Jaguar Land Rover Darien,"My initial dealings and subsequent relationship with Jaguar Darien have been much superior to those I’ve had with other dealerships (of this and other car companies) in Fairfield County. The gentleman I have worked with, Allen Johnson, has shown a high level of expertise and has developed a solid relationship with both myself and my wife. This applies not only to the purchase of our Jaguar but to his attentive follow up regarding our car and questions and concerns about future developments with Jaguar in this constantly evolving automotive environment. John Black Westport, CT

JSBLACKIII 
Westport, CT",https://itunes.apple.com/us/review?id=284815942&type=Purple%20Software,2023-07-05T07:27:34-07:00
8278986765,Judy 👍,https://itunes.apple.com/us/reviews/id1372146232,196.0,5,Performance 5 star 🌟 and more if I could give them 👍,"Vivie and Nick thank you thank you!

Vivie thank you so much for explaining  my bill it was getting really frustrating to understand why the bill kept going up and up! I will work on my husband on paper less bills Poor Trees! You are an asset to Verizon and their customers.  I wish we would have come to this location from the beginning of our experience in upgrading to new phone’s and iPads.  From now on this is the store we will really on !👍😄",https://itunes.apple.com/us/review?id=284815942&type=Purple%20Software,2022-01-24T15:28:19-07:00
8113457358,eddie rucks,https://itunes.apple.com/us/reviews/id1348146631,189,5,Mine owner,Fort drum crystal mine in  okeechobee county Florida  I was thinking about getting an attorney the woman on the phone was very helpful  and compassionate I have the only crystal mine in our state don’t have a. huge bissnese but peaple count on me I was haveing serious problems with out of control local government and a. Utility company I was up against the wall with no real answers in sight and was put at ease and told they would be able to help me get back to normal thanks guys Eddie rucks I own the fort drum crystal mine in okeechobee and have for25 years now they really came to my rescue,https://itunes.apple.com/us/review?id=284815942&type=Purple%20Software,2021-12-09T18:36:09-07:00
5048176479,geekstinkbreath223,https://itunes.apple.com/us/reviews/id422578474,85.0,3,Keyboard typing lag while using search bar,"I don’t know if anyone else has this issue, but my iPhone 8 running iOS 13 is lagging while typing in the search bar. Only happens when using this Google app, no other apps have this issue. Not entirely conclusive as to whether it’s my iOS or the app, since my app was updated almost in conjunction with my iOS 13. However, it’s still very frustrating considering how fluid typing used to be before the recent revision to the app’s interface. Even the Google suggestions aren’t loading as fast as they’re supposed to. Altogether, pretty disappointing. Usually this app is pretty solid and concise. Not anymore, evidently.",https://itunes.apple.com/us/review?id=284815942&type=Purple%20Software,2019-10-29T17:48:22-07:00
6292598856,Apt0929,https://itunes.apple.com/us/reviews/id35217002,119.0,4,Bad New Update,"Edit - they put the “more stories” button back, but now it’s harder to edit interests and the stories are much less tailored to me. Hide this story is helpful but I feel like it was still better a few updates back. At least now it’s heading in the right direction. 

Original review - The most recent update is awful. I used to love that I could click more and get a ton of news stories tailored to my interested. The option to click more is gone and now I get maybe 10 stories. Fairly useless to me now.. will switch over to Apple News until this is put back.",https://itunes.apple.com/us/review?id=284815942&type=Purple%20Software,2020-08-07T16:11:57-07:00
8204494490,zone 344,https://itunes.apple.com/us/reviews/id1260928398,190.1,5,All about Google because Google is the best best best best best best,Google is the best I love you so much google is my best friend google is my best friend Google is my best friend Google Google Google Google Google when I download it I was like why did I download that I downloaded by accident but I love it Google Google Google Google and it downloads very quick I literally just downloaded it 10 minutes ago wait five minutes ago it literally is the best the best thing ever I can scream I love it so much oh my God google made my life easier I love it the end,https://itunes.apple.com/us/review?id=284815942&type=Purple%20Software,2022-01-04T12:29:02-07:00
6499299667,plz FIX this! 🥺🥺🥺,https://itunes.apple.com/us/reviews/id1165676621,127.0,5,I like it but...,"I really like google! It helps me search things I need, and what I need to know. There’s some problems though. On google, you can basically search ANYTHING. And that’s a BIG problem. It’s ok to search things like, what is an adverb, but kids can just search anything!!! Some kids just like to search things that are not for them. And that’s just horrible. Some kids just don’t ask permission to search something, and that could affect there LIFE. I like google, but children just must be safe using it.",https://itunes.apple.com/us/review?id=284815942&type=Purple%20Software,2020-10-04T04:43:25-07:00
5881002031,Mr. Yowza,https://itunes.apple.com/us/reviews/id646209768,105.0,5,Fantastic typically,The app typically functions flawlessly but I am now having an issue with crashing. I open the app on my iPhone 11 running IOS 13.5 Beta 3 (Build: 17F5054h) and after less than a minute of the app being open the app crashes. Now this by no means is a complaint just a bug that I would like to be known so it can get taken care of at some point. I understand that running beta software comes with issues like this so it would be completely idiotic give me to be angry. I hope this helps the bug get taken care of. 👍🏼,https://itunes.apple.com/us/review?id=284815942&type=Purple%20Software,2020-04-29T14:52:25-07:00
10373239152,N•O!,https://itunes.apple.com/us/reviews/id107254112,281.0,3,Sister app?,"Could you make an app where you can open it up and search the internet for anything or to ask for an answer to a question? 

Right now when I have a question I open Google to search for an answer but before I can do that there’s a tab that looks like it might be interesting, then I think well lets scroll down and see if anything else is something I need to know about? Then I think, wait I was here for a reason, I wanted to find out something specific. What was it? I can’t remember. I guess I’ll just shut down the app then. 

I understand this was what the app was designed for and it is very good at that but sometimes it’s what I don’t like about it. Other times I go on Google just to see what other people have discovered or are writing about but sometimes they are a distraction from what I am really curious about. 

I would like it if you made a search engine that is dedicated to searches and not a distraction from my curiosity. 

Thank you for your time.",https://itunes.apple.com/us/review?id=284815942&type=Purple%20Software,2023-09-15T23:49:23-07:00
9550035454,ccs_1982,https://itunes.apple.com/us/reviews/id630918999,248.1,3,New Updates = Unavailable Webpage,"Not sure what (or why) y’all decided to butcher the app but around 80% of the time I search for something on my iPhone 11, I get the ‘webpage is not available’ message. Please get moving on fixing this issue because it’s been going on for at least a week now. Other Google apps seem to be working fine but the most important one that the company’s foundation was built on should be working first and foremost. I tried to uninstall and reinstall; nothing. I tried to disconnect from Wi-Fi and search; nothing. Ironically, I can’t even Google how to fix this issue. Get it straightened out, G-men. Thanks.",https://itunes.apple.com/us/review?id=284815942&type=Purple%20Software,2023-01-26T10:29:35-07:00
7483273759,kitsune :),https://itunes.apple.com/us/reviews/id1293076131,164.0,1,Why? Don’t download this. IM GETTING SO TIRED OF THIS!!!!!!!!,"I deleted this app for a total reason. It makes no sense, and changes the answers that don’t change. The 13 zodiac sign would rather be fake, because I don’t see it anywhere, except for here. Like, it’s not on the keyboard, not on anything except on google. Plus there’s 12 months!! Why would there be 13 zodiac signs?! Also, it has viruses. Thank you very much. You LIE to much. I can use safari anyways!! Plus how wou- okay what I’m trying to say is that the 13th zodiac sign and our zodiacs changing, haha- you cant do that. We can’t change our personalities, friendship, and all of that. You aren’t useful at all. This ain’t to be rude, it’s just my opinion. AND STOP CHANGING ANSWERS!!! I have the luckiest sign in the zodiac!!!!!!!! I’m Aries!!!!!!!!!!!!",https://itunes.apple.com/us/review?id=284815942&type=Purple%20Software,2021-06-19T12:03:48-07:00
7010564127,NothingHereForNow,https://itunes.apple.com/us/reviews/id1168272945,137.2,3,Too annoying and slow.,The app takes too long to load up and takes about two minutes to actually start and even then it is slow. Google takes way too long to respond and they need to do something about the response time for this app since it is in 1# utilities. They do not let me somehow turn off the seven day feature when the app takes off previous tabs that you have not visited in seven days which I think you should be able to take off. Although I hate this app I still need the internet so I give this app three stars for its services. Thank you Google team.,https://itunes.apple.com/us/review?id=284815942&type=Purple%20Software,2021-02-18T11:41:35-07:00
10658346572,UNKOWN3427,https://itunes.apple.com/us/reviews/id168312668,293.0,4,Recommend,"I mean it’s a pretty good app, it’s just that the search feature isn’t helpful!  It just bases the results of the color or pattern or whatever.   There are also inappropriate results sometimes.  If you search up things it’ll probably give you the answer you’re looking for.  But I really hope there will be a feature where you can search up things without internet.  Maybe you can add more google doodles/games.  Overall, it it better than a lot of searching apps.  It’s a pretty good one!  Really recommend it!  😁

XOXO,
frogXturtle 🐸🐢",https://itunes.apple.com/us/review?id=284815942&type=Purple%20Software,2023-12-04T18:00:06-07:00
5043324895,Rcchi,https://itunes.apple.com/us/reviews/id38864845,85.0,1,Too many bugs,"Since the last update, typing is a nightmare with ridiculous lag times. In addition I see the same stories over and over agin in my newsfeed even those I’ve told Google not to show me anymore. And finally, every other time I use the app, there seems to be a loading issue and I only get a check back later message. This used to be a very good  app and my go to for searching and reading the news. Now webpages won’t load and the newsfeed has become pointless. It either doesn’t load stories or gives me the same stories it’s been giving me for months. It used to be the place I went to for any basic internet search but no longer. I’ll stick with searching via a Mobile browser and rely on Apple News for my newsfeed.",https://itunes.apple.com/us/review?id=284815942&type=Purple%20Software,2019-10-28T15:56:36-07:00
8492423572,Musiclova190,https://itunes.apple.com/us/reviews/id270304401,204.1,4,"Love the app, just one glaring issue","So I’ve been using this app for about 2 years, and I consider it night and day with safari, a better option for me. Well integrated and very intuitive. My only issue with the app is that recently, I’ve been using the large widget. Whenever I hit the search button, it takes about 11 seconds for any of my initial    touch-strokes to register. If I leave the app and reenter the same issue applies. If I turn off my phone and reenter the same happens. Please fix! Otherwise, the new integrations are great and match my style!",https://itunes.apple.com/us/review?id=284815942&type=Purple%20Software,2022-03-24T20:38:16-07:00
10572512082,Beandon04,https://itunes.apple.com/us/reviews/id1485748914,289.0,1,Horrible fix IMMEDIATELY,If ur a business man and u hav multiple accounts good luck cuz google don’t care and they restrict u from using your number from having as many accounts that u need for work. Coming from me that I need for work and business and for needing for helping newcomers to my job I can’t even after trying to create 1 new email it says (phone number has been used to many times) and there is no way to fix this so after 10 accounts they say which it’s a lie cuz I don’t hav 10 accounts they lock your phone number from ever making new Gmails EVER and basically u hav to use a WHOLE new number and it’s like I don’t hav another number or landline and I’m not gonna use my friends number for my business plz fix this pathetic BS😡🤬,https://itunes.apple.com/us/review?id=284815942&type=Purple%20Software,2023-11-10T18:47:51-07:00
9158222533,Drumfred2,https://itunes.apple.com/us/reviews/id263171267,232.0,5,Midway rules!!!!🤪🤪🤪🤪🎶,"My wife, Cindy and I have been buying Nissans from Midway for many many years, we just purchased a new 2022 Nissan Altima, SL, and like always, they treat us like royalty. Emily, the customer service manager, was absolutely awesome. Terry in  Finance was not pushy, he was very thorough, and took care of us on warranty and kept our payment where we wanted it to be. New car manager, Julio, was very professional along with Golda took very good care of us, and they did it in a timely fashion. I recommend Midway Nissan highly, they are definitely the best in Phoenix.",https://itunes.apple.com/us/review?id=284815942&type=Purple%20Software,2022-10-06T14:06:39-07:00
6607169537,jrksiskeitkek,https://itunes.apple.com/us/reviews/id485806136,132.0,3,I'm very annoyed.,"Usually, when i try to click the app, Google, it glitches me out. It Shows a black screen, furthermore my home screen. Please fix this! I've been having a problem with this a lot, i've been having to re-download and shut down my device more then 3 times. This has happened on my other device, (iPad). It has done the same thing. I am also writing this because whenever i click something it brings me to the link it's from! I just want to see the photo, following another problem; not letting me save photos! It usually says ""cannot save"" so I have to screenshot. Google, please fix this! Thank you for your time. 🙂❤️",https://itunes.apple.com/us/review?id=284815942&type=Purple%20Software,2020-11-03T23:39:59-07:00
