id,userName,userUrl,version,score,title,text,url,updated
11111908796,Listentothisnow,https://itunes.apple.com/us/reviews/id767412721,24.3.0,5,Much for little,"My two dinners, alone, lasted for 4 meals - not to mention the other goodies packed in my surprise bag. This Morton Williams gives you freshly made and flavorable foods!",https://itunes.apple.com/us/review?id=1060683933&type=Purple%20Software,2024-04-01T20:31:02-07:00
11111499772,Milay mom,https://itunes.apple.com/us/reviews/id1272230452,24.3.0,5,Great deal,It was really great deal!,https://itunes.apple.com/us/review?id=1060683933&type=Purple%20Software,2024-04-01T17:44:32-07:00
11111485269,MeauxGeaux,https://itunes.apple.com/us/reviews/id14883868,24.3.0,5,Such a great idea for an app!!,"So often throughout the day, I get these creative ideas for a small business or an app or even ideas to solve a really big problem but the second I saw this app, I thought great idea, all the way around.  Downloaded it and used it today.  Works beautifully!  Thank you for making it a win-win!",https://itunes.apple.com/us/review?id=1060683933&type=Purple%20Software,2024-04-01T17:38:46-07:00
11111023179,Crazy girl64,https://itunes.apple.com/us/reviews/id414171453,24.3.0,5,slayyyy team,love yall,https://itunes.apple.com/us/review?id=1060683933&type=Purple%20Software,2024-04-01T14:29:05-07:00
11110646323,@Lukia7,https://itunes.apple.com/us/reviews/id782733294,24.3.0,5,Brilliant Concept,This app is lovely and I hope it’s beneficial to patrons as well as providers!,https://itunes.apple.com/us/review?id=1060683933&type=Purple%20Software,2024-04-01T12:02:18-07:00
11106247727,Baby maker J,https://itunes.apple.com/us/reviews/id1328794628,24.3.0,5,Feedback,Great app! Better not let your Pres get wind of these great discounts!!,https://itunes.apple.com/us/review?id=1060683933&type=Purple%20Software,2024-03-31T07:46:52-07:00
11104528886,Papy-Chui,https://itunes.apple.com/us/reviews/id588479229,24.3.0,5,🙇🏽‍♂️,"I really Ike the concept of the app. Not only does it address the issue that we have with food going to waste, but it additionally it helps businesses to make sure that they don’t lose profits by throwing all their unsold items. 🙌🏼",https://itunes.apple.com/us/review?id=1060683933&type=Purple%20Software,2024-03-30T20:03:36-07:00
11104253151,Caytroy,https://itunes.apple.com/us/reviews/id487759980,24.3.0,5,Great deal,"3 going cha drinks for just $6. I was amazed. I've always wanted to try their drinks but it was on a pricey side for me so to get 3 different drinks, nothing beats that.",https://itunes.apple.com/us/review?id=1060683933&type=Purple%20Software,2024-03-30T18:14:12-07:00
11103954966,Ms.purple world,https://itunes.apple.com/us/reviews/id1166778518,24.3.0,5,Best app I ever came across,Best app I ever came across,https://itunes.apple.com/us/review?id=1060683933&type=Purple%20Software,2024-03-30T16:11:09-07:00
11102483607,Lifeguard5,https://itunes.apple.com/us/reviews/id1447965549,24.3.0,5,Gratitude,Thank you for providing something so wonderful for everyone.  We are so grateful.  We ate like royalty yesterday with a heaping serving of love and gratitude!,https://itunes.apple.com/us/review?id=1060683933&type=Purple%20Software,2024-03-30T07:20:24-07:00
11100366146,cg lelabo,https://itunes.apple.com/us/reviews/id698203932,24.3.0,5,Sweet Temptation!,"The baked goods were very fresh and tasty!
So much stuff I was thrilled!",https://itunes.apple.com/us/review?id=1060683933&type=Purple%20Software,2024-03-29T17:04:03-07:00
11100319812,Praaz,https://itunes.apple.com/us/reviews/id272775411,24.3.0,5,Awesome app!!,The app that we all need because it feeds! A delicious reduction in waste!!,https://itunes.apple.com/us/review?id=1060683933&type=Purple%20Software,2024-03-29T16:45:11-07:00
11096867828,cherylclee,https://itunes.apple.com/us/reviews/id108870179,24.3.0,5,Great Apple turnover!,"This is my first time getting a surprise box. The boss was very generous when giving out pastries. After coming back home, I putted two in the oven to heat up. They were very good. I especially enjoyed the Apple turnover. It was not too sweet and tasted excellent!",https://itunes.apple.com/us/review?id=1060683933&type=Purple%20Software,2024-03-28T18:34:50-07:00
11093543907,Mr.LaBamba,https://itunes.apple.com/us/reviews/id523228465,24.3.0,5,Great food for a great deal!,Quite fresh for day old bagels. I was impressed…and were from N.J.👍🏻👍🏻,https://itunes.apple.com/us/review?id=1060683933&type=Purple%20Software,2024-03-27T21:10:28-07:00
11093522343,100011101011011010101,https://itunes.apple.com/us/reviews/id430902630,24.3.0,5,Great market solution to a societal problem,Love the app and think it’s a great idea! Telling all my friendsabout its,https://itunes.apple.com/us/review?id=1060683933&type=Purple%20Software,2024-03-27T21:00:44-07:00
11093176811,heatherkens,https://itunes.apple.com/us/reviews/id1146408791,24.3.0,5,Awesome experience,This,https://itunes.apple.com/us/review?id=1060683933&type=Purple%20Software,2024-03-27T18:38:51-07:00
11092224087,Crimson bear,https://itunes.apple.com/us/reviews/id171300303,24.3.0,5,Love It!!,What a fantastic concept and helpful to save money.,https://itunes.apple.com/us/review?id=1060683933&type=Purple%20Software,2024-03-27T12:23:36-07:00
11085907792,Killa1128,https://itunes.apple.com/us/reviews/id1176174135,24.3.0,5,ONE OF THE BEST APPS,I’m so pleased with this app. It has quickly became one of my favorite apps. The deals are amazing and it’s a plus to know that we’re are helping businesses not throw food away.,https://itunes.apple.com/us/review?id=1060683933&type=Purple%20Software,2024-03-25T18:20:24-07:00
11082860266,Sexxy Green,https://itunes.apple.com/us/reviews/id597129010,24.3.0,5,Keep This Going!!!,I appreciate the creators and developers of their it really does help help when your in a pinch. I so grateful and happy that this app exists.,https://itunes.apple.com/us/review?id=1060683933&type=Purple%20Software,2024-03-24T22:35:11-07:00
11082188091,MaribelDiehl,https://itunes.apple.com/us/reviews/id374044425,24.3.0,5,Great savings app highly recommend!,I got this app and I just used it today and got a box of donuts for half the price for $5.99 great deal! It was a surprise box filled with donuts. I love this,https://itunes.apple.com/us/review?id=1060683933&type=Purple%20Software,2024-03-24T17:29:08-07:00
11081148939,jozen1234,https://itunes.apple.com/us/reviews/id601268354,24.3.0,5,Excellent money saver,Allot of options for saving money with great deals on food that would have otherwise been tosssed. Even in my somewhat suburban area there were plenty of places to choose from.,https://itunes.apple.com/us/review?id=1060683933&type=Purple%20Software,2024-03-24T10:52:06-07:00
11078905685,Donna and Kyng,https://itunes.apple.com/us/reviews/id521305688,24.3.0,5,Win win,"I recently tried out this food rescue app for the first time, and I must say, it was a delightful experience! I ordered two bags, each brimming with about seven delicious bagels and a delightful treat—a choice between a flaky croissant or two scrumptious scones. To top it off, I received a complimentary coffee with cream and sugar. The staff were exceptionally friendly and expressed genuine gratitude for my effort in rescuing food. Overall, it was a wonderful first encounter with the app, and I felt it offered great value for the price. Highly recommended for anyone looking to prevent food waste while enjoying tasty treats!",https://itunes.apple.com/us/review?id=1060683933&type=Purple%20Software,2024-03-23T21:20:35-07:00
11078013764,AngPit,https://itunes.apple.com/us/reviews/id1181310054,24.3.0,5,Try something new,"Due to this app, I have tried a lot of businesses that I normally would not have tried, and I’ve actually gone back to some. The majority, have been great deals.",https://itunes.apple.com/us/review?id=1060683933&type=Purple%20Software,2024-03-23T15:34:51-07:00
11072886760,Happyhoofr,https://itunes.apple.com/us/reviews/id1630399662,24.3.0,5,Great app,What a nice way to reduce waste.,https://itunes.apple.com/us/review?id=1060683933&type=Purple%20Software,2024-03-22T08:04:06-07:00
11071348856,AG tasty,https://itunes.apple.com/us/reviews/id1080651961,24.3.0,5,Very good experience- 9 fresh good doughnuts for only $3.99,This was an excellent and quick transaction and the doughnuts were very good.,https://itunes.apple.com/us/review?id=1060683933&type=Purple%20Software,2024-03-21T21:43:12-07:00
11069488259,Hail Korea,https://itunes.apple.com/us/reviews/id459006061,24.3.0,5,Great to save money and expand your palate,"This app has gotten so much better since it first started.
The variety and ease of searching makes it really easy to explore all the great restaurants available on it and the money saved can be be a bit addictive, i sometimes buy 2-3 different ones a day just because of the great deal you can sometimes get",https://itunes.apple.com/us/review?id=1060683933&type=Purple%20Software,2024-03-21T09:31:28-07:00