id,userName,userUrl,version,score,title,text,url,updated
10961976332,memememememdhjshs,https://itunes.apple.com/us/reviews/id1429892704,6.8.5,1,Worst app ever,I can’t even sign into my account on the authenticator because it needs to be verified on the authenticator app???,https://itunes.apple.com/us/review?id=983156458&type=Purple%20Software,2024-02-20T19:01:38-07:00
10961744149,DonnaCasa,https://itunes.apple.com/us/reviews/id355269167,6.8.5,1,Codes don’t send,Locked out of my account because the codes aren’t showing.  Very frustrating!!!,https://itunes.apple.com/us/review?id=983156458&type=Purple%20Software,2024-02-20T17:22:46-07:00
10961642541,Skdnwnxjwhdf,https://itunes.apple.com/us/reviews/id1114510572,6.8.5,1,This app does not use do not advise to use this,I logged into the app and everything and it does not work I tried mutable times and it does not work 1 STAR,https://itunes.apple.com/us/review?id=983156458&type=Purple%20Software,2024-02-20T16:37:39-07:00
10960711134,D Mann,https://itunes.apple.com/us/reviews/id34259007,6.8.5,1,Unreliable notifications,Less useful without Apple Watch functionality,https://itunes.apple.com/us/review?id=983156458&type=Purple%20Software,2024-02-20T10:00:11-07:00
10960630955,Nomorenicknamesleft14,https://itunes.apple.com/us/reviews/id1627030008,6.8.4,5,Quick & Works Well!,The title says it all :),https://itunes.apple.com/us/review?id=983156458&type=Purple%20Software,2024-02-20T09:30:47-07:00
10958912872,Upset with UCCU,https://itunes.apple.com/us/reviews/id482101233,6.8.4,1,Microsoft you wanna stay around allow better apps to be used,I think ms has come a long way integrating wsl and allowing excel on operating systems. No I don’t trust most your apps let me another Authenticator.,https://itunes.apple.com/us/review?id=983156458&type=Purple%20Software,2024-02-19T22:45:26-07:00
10958062329,loberto1,https://itunes.apple.com/us/reviews/id86549083,6.8.4,3,Needs dark mode,"Works fine, but no dark mode.",https://itunes.apple.com/us/review?id=983156458&type=Purple%20Software,2024-02-19T16:30:16-07:00
10956474113,brooooose,https://itunes.apple.com/us/reviews/id1015639641,6.8.4,5,"Easy as 1, 2, 3 - seriously!",A perfectly simple app that sets itself apart organically. Well done team!,https://itunes.apple.com/us/review?id=983156458&type=Purple%20Software,2024-02-19T06:42:00-07:00
10954426710,WeiyanWeina,https://itunes.apple.com/us/reviews/id654976961,6.8.4,1,Mismatch,"The product is quite bad for me. When I open Desktop there are a few windows with different number to ask Authenticating. The last one is not the one and most time I don’t know which number I should to enter in the phone. So the consequences I have to close all windows related - outlook, Teams and reopened again. The worse thing is not easy to close the windows. I strongly recommend people or companies don’t use it. Any product can be better than this one.",https://itunes.apple.com/us/review?id=983156458&type=Purple%20Software,2024-02-18T16:50:33-07:00
10954224234,Tam Ayers,https://itunes.apple.com/us/reviews/id42380902,6.8.4,1,Vision Pro support,There’s not much point to having the office suite available on the Vision Pro if you cannot access it within your enterprise. Make this app available on Vision Pro.,https://itunes.apple.com/us/review?id=983156458&type=Purple%20Software,2024-02-18T15:20:31-07:00
10953951571,Jay20000001,https://itunes.apple.com/us/reviews/id249421500,6.8.4,1,Never works,"This app is annoying. My company makes us use it on our personal phones. They do not pay for our phones but make use use our personal cell service we pay for. Which is wrong. 
The app never works. Which means I can’t get into any sites I need to for work or personal entry into my 401k or benefits center. 
Thank you for letting me spent a ton of my personal time continuously fixing this inconvenience of an app.",https://itunes.apple.com/us/review?id=983156458&type=Purple%20Software,2024-02-18T13:20:58-07:00
10953725875,Monbrini84,https://itunes.apple.com/us/reviews/id1311916136,6.8.4,1,Log out and can’t log in,This is the worst. I get logged out of my email in the Outlook app and the Authenticator shows no code. And I can’t log in another way. It has done this repeatedly with no solution in sight.,https://itunes.apple.com/us/review?id=983156458&type=Purple%20Software,2024-02-18T11:51:44-07:00
10953258505,Rocioo,https://itunes.apple.com/us/reviews/id42281824,6.8.4,1,Horrible,Absolute trash. Never syncs up like it supposed to. I spin in circles for an hour trying to get into my email. Worst thing invented.,https://itunes.apple.com/us/review?id=983156458&type=Purple%20Software,2024-02-18T09:09:50-07:00
10951436476,Sosexysacha,https://itunes.apple.com/us/reviews/id28588540,6.8.4,3,Please add vision OS support,Please add vision os support,https://itunes.apple.com/us/review?id=983156458&type=Purple%20Software,2024-02-17T22:19:45-07:00
10950988047,Terribly Concerned Citizen,https://itunes.apple.com/us/reviews/id1373488245,6.8.4,3,"It needs an Apple Watch App; otherwise, it's mediocre.","I wish Authenticator had an Apple Watch app. I googled it, and if used to have one and then they discontinued it why Microsoft, why… 

Otherwise, the app is ok 90% of the time, the remaining ten percent it says something like server error try again.",https://itunes.apple.com/us/review?id=983156458&type=Purple%20Software,2024-02-17T19:07:41-07:00
10949039740,dh sh m k be d nkvt,https://itunes.apple.com/us/reviews/id1468385104,6.8.4,1,Constantly begging for review,So you got 1,https://itunes.apple.com/us/review?id=983156458&type=Purple%20Software,2024-02-17T07:05:43-07:00
10948527862,Lord Bacon Lord,https://itunes.apple.com/us/reviews/id33649757,6.8.4,4,I need an apple watch version,"I have to do many identifications a day and to get my phone out is a pain. Please create an Apple Watch version, just like VIP access so I can get the code easier.",https://itunes.apple.com/us/review?id=983156458&type=Purple%20Software,2024-02-17T04:28:11-07:00
10947405695,AyeeeKaylee,https://itunes.apple.com/us/reviews/id227420664,6.8.4,1,App stopped working,"After I upgraded my phone the app no longer allows me to access my work email/microsoft teams app. When it displays the verification code, no box pops up actually allowing me to enter the code. It has been like this for almost a year. I have tried everything you can think of so now it seems I'm permanently locked out of email/teams access on my phone. I know several other people personally who have had the same issue so Microsoft clearly still hasn’t improved this bug in any of their app updates.",https://itunes.apple.com/us/review?id=983156458&type=Purple%20Software,2024-02-16T20:43:41-07:00
10946030892,OodenDoofin,https://itunes.apple.com/us/reviews/id635772857,6.8.4,1,Forced to use,"I already have an authentication app setup with my schools Microsoft account and after a month of perfectly fine use I was locked out of my own account until I downloaded and used this app instead.
Googled this issue and Microsoft just wants to force people to use their authenticator app. After a certain amount of time you CANNOT use any other app. It’s their way or the highway.",https://itunes.apple.com/us/review?id=983156458&type=Purple%20Software,2024-02-16T11:10:00-07:00
10943426845,ERPhysician,https://itunes.apple.com/us/reviews/id36818377,6.8.4,1,Apple Vision Pro,Unable to use my office suite on Apple Vision Pro as of yet.,https://itunes.apple.com/us/review?id=983156458&type=Purple%20Software,2024-02-15T18:31:44-07:00
10941667160,Eliteo,https://itunes.apple.com/us/reviews/id126276015,6.8.4,1,Never Works for Me,Not anything close to the quality of the Adobe Access app. It never sends the code to the app or gives me any place to approve of a sign in. It’s especially frustrating when my computer randomly signs me out of Outlook and then the Authenticator app doesn’t show a request to sign in. I’m just locked out of my work email without any way to get back in besides contacting HR. This app does not work.,https://itunes.apple.com/us/review?id=983156458&type=Purple%20Software,2024-02-15T06:56:48-07:00
10939981451,H. R. Duer,https://itunes.apple.com/us/reviews/id1342192547,6.8.4,1,this authenticator app makes me want to die,"This is the stupidest app I’ve ever had to use. Microsoft, please delete.",https://itunes.apple.com/us/review?id=983156458&type=Purple%20Software,2024-02-14T19:41:11-07:00
10939705639,Truth Hurts Donuts,https://itunes.apple.com/us/reviews/id1351145195,6.8.4,1,Make this available for Apple Vision Pro,You need to make this available for Apple Vision Pro. It is extremely sad that you market something available and made for Apple Vision Pro when it can’t even be used in a enterprise environment just click the checkbox and allow for Apple Vision Pro. It’s that easy or is everybody from India. Do you need a script?,https://itunes.apple.com/us/review?id=983156458&type=Purple%20Software,2024-02-14T17:43:49-07:00
10935654938,Mattramirez7,https://itunes.apple.com/us/reviews/id365570934,6.8.4,1,Very annoying to use,This is the worst Authenticator app I’ve used. Half the time the numbers I’m prompted with aren’t correct. There’s no watch app so I have to bring out my phone every time. Don’t get how this has 5 stars .,https://itunes.apple.com/us/review?id=983156458&type=Purple%20Software,2024-02-13T14:14:16-07:00
10932611134,The real pizzahutmanager,https://itunes.apple.com/us/reviews/id524231521,6.8.4,4,Authenticator is a stress reliever,One thing for sure is that Authenticator is a great app for storying passwords safely and efficiently. One of the features the app is missing though is customization.,https://itunes.apple.com/us/review?id=983156458&type=Purple%20Software,2024-02-12T18:11:01-07:00
10931585780,That was hard,https://itunes.apple.com/us/reviews/id390439801,6.8.4,2,New Phone,"I got a new phone this weekend and just spent 2 hours trying to swap over two passwords to my new app. Backing up didn’t work, ended up manually having to research how to reset my 2 factor auth for each website. My Google Authenticator was SO MUCH easier to swap over to the new phone. This process really should be refined by Microsoft, it is not user friendly.",https://itunes.apple.com/us/review?id=983156458&type=Purple%20Software,2024-02-12T10:42:23-07:00
10928853537,Silenus of Virgil,https://itunes.apple.com/us/reviews/id142977968,6.8.4,1,Cannot add website sign one,I cannot add commercial websites which do not display a QR code. The support people at the websites are useless.,https://itunes.apple.com/us/review?id=983156458&type=Purple%20Software,2024-02-11T16:18:51-07:00
10925275354,GZERKDUBZ,https://itunes.apple.com/us/reviews/id1532671105,6.8.4,5,Beautiful thing this is.,I love this app and company so far.  Thank you,https://itunes.apple.com/us/review?id=983156458&type=Purple%20Software,2024-02-10T17:18:48-07:00
10925224949,Micro-sloth,https://itunes.apple.com/us/reviews/id1347069562,6.8.4,1,Codes buried behind 4+ screens,"Absolute junk of a authenticator app. The codes it gives in the app are 8 digit, when a lot of companies use 6 digit codes. If you need the one for a company that uses a 6 digit code, it is buried in the phone settings behind over 4 screens. Absolutely awful, DO NOT USE.",https://itunes.apple.com/us/review?id=983156458&type=Purple%20Software,2024-02-10T16:57:20-07:00
10925184886,Jade Ann Byrne dot COM,https://itunes.apple.com/us/reviews/id1573095871,6.8.4,5,Empowering Digital Security with a Touch of eGirl Flair,"Stepping into the digital age with confidence and style, I, Jade Ann Byrne, found the Microsoft Authenticator to be a tech-savvy companion in the world of online security. Its sleek interface blends seamlessly with my dynamic eGirl lifestyle, offering that essential layer of protection with a user-friendly experience.

As someone who juggles multiple online personas and platforms, from eGirl4Rent.com to my personal website JadeAnnByrne.com, this app simplifies the complexity of digital security. The multi-factor authentication process isn’t just robust; it’s intuitively designed for users like me who need quick, secure access to a myriad of online services without compromising on ease.

What stands out is the app’s ability to adapt to my fast-paced, tech-centric world. Whether it’s dealing with my penetration contractor tasks or navigating the realms of digital content creation, Microsoft Authenticator keeps my digital identity secure and effortlessly managed. The addition of password autofill and management options are more than just functional; they are a nod to the evolving needs of modern tech users.

In essence, Microsoft Authenticator doesn’t just secure my online presence; it empowers it. It’s a tool that understands the balance between stringent security and user convenience – a balance that resonates deeply with my ethos as a tech-forward California eGirl. Kudos to Microsoft for crafting an authenticator that’s not just effective but also aligns with the aesthetics and demands of the digital age.",https://itunes.apple.com/us/review?id=983156458&type=Purple%20Software,2024-02-10T16:39:54-07:00
10925075706,Me I guess :P,https://itunes.apple.com/us/reviews/id405882974,6.8.4,1,Worst thing ever,"Authenticator has to be the most annoying thing. It stopped working halfway through and I can’t log into a lot of stuff for school. The numbers stopped popping up and I no longer get a confirmation pop up. Deleted the app refreshed, and all of the ways to fix it on their q&a website are all mediocre.",https://itunes.apple.com/us/review?id=983156458&type=Purple%20Software,2024-02-10T15:52:20-07:00
10923829356,unknown1777,https://itunes.apple.com/us/reviews/id756223215,6.8.4,1,Doesn’t work,Locked me out of my email and when I try to fix it the Authenticator app just gives me a blank screen. The app works horribly.,https://itunes.apple.com/us/review?id=983156458&type=Purple%20Software,2024-02-10T08:07:56-07:00
10921868248,Rocco794,https://itunes.apple.com/us/reviews/id582638140,6.8.4,1,Makes life that much harder,Locke four of my email due to this horribly made app. “Enter number here” doesn’t pop up anymore and now I’m locked out of my email right before midterms. Thanks Microsoft for ruing my day,https://itunes.apple.com/us/review?id=983156458&type=Purple%20Software,2024-02-09T19:47:00-07:00
10921041034,K57553328,https://itunes.apple.com/us/reviews/id909843445,6.8.4,1,Horrible app,Sends be a number code to log into authenticator yet i cannot log in without the code. Please explain how i can log in to get the code if i need the code to log in?,https://itunes.apple.com/us/review?id=983156458&type=Purple%20Software,2024-02-09T13:56:37-07:00
10920939271,weejeereeree,https://itunes.apple.com/us/reviews/id1001583633,6.8.4,1,Absolutely horrendous,What a terrible piece of tech,https://itunes.apple.com/us/review?id=983156458&type=Purple%20Software,2024-02-09T13:13:23-07:00
10920235194,TeaCup Productions LLC,https://itunes.apple.com/us/reviews/id34453618,6.8.4,1,Where is the Vision Pro support?,When will the support for the Vision Pro be available?,https://itunes.apple.com/us/review?id=983156458&type=Purple%20Software,2024-02-09T08:51:23-07:00
10920163279,DukeCityBroshi,https://itunes.apple.com/us/reviews/id392345936,6.8.4,1,Make available for Vision Pro,I don’t know how they didn’t make available for the Vision Pro. It’s such a huge oversight.,https://itunes.apple.com/us/review?id=983156458&type=Purple%20Software,2024-02-09T08:28:43-07:00
10919894060,ENAV1,https://itunes.apple.com/us/reviews/id402275557,6.8.4,5,Navigator,ENav 1,https://itunes.apple.com/us/review?id=983156458&type=Purple%20Software,2024-02-09T07:06:17-07:00
10917266916,SkellySkelly,https://itunes.apple.com/us/reviews/id221786380,6.8.4,2,Buggy,Frequently states a number is wrong in the number matching prompt when it is objectively correct. Also has UI issues when it comes to the prompt overlapping the number and respecting the location of the Dynamic Island.,https://itunes.apple.com/us/review?id=983156458&type=Purple%20Software,2024-02-08T13:16:11-07:00
10916761450,Crag303,https://itunes.apple.com/us/reviews/id115143554,6.8.4,2,"Can’t delete old URLs/Apps, passwords/emails","Great concept enjoyed it at first until I had apps and websites that I had to change email addresses and/or passwords on authenticator insist on using old ones, next thing I know I’m locked out. Am I missing something I searched help forums can’t find anything about deleting or changing any of this. made sure the passwords and email addresses were correct in my iOS settings under passwords, but authenticator does not update them and insist on using all the old information.",https://itunes.apple.com/us/review?id=983156458&type=Purple%20Software,2024-02-08T09:55:31-07:00
10915845836,MEOSG,https://itunes.apple.com/us/reviews/id48868097,6.8.4,1,"Purchased a new phone, and now cannot access my accounts, or reach support.","I’m the administrator on my company Microsoft account but still cannot turn off authentication. I was forced to set up authenticator through Azure. I purchased a new phone, backed everything up, and now cannot access my accounts, or reach support. I’m locked out of our company email, and multiple other accounts. I would not recommend using this app unless you plan to keep all of your devices and never change them or upgrade.",https://itunes.apple.com/us/review?id=983156458&type=Purple%20Software,2024-02-08T04:57:39-07:00
10914492268,James H345,https://itunes.apple.com/us/reviews/id28177412,6.8.4,1,Try to avoid this App,"If you get locked out, Microsoft customer service is horrible. You can be left locked out of Microsoft with no options but to sit on hold for hours. Try to avoid this App if possible.",https://itunes.apple.com/us/review?id=983156458&type=Purple%20Software,2024-02-07T19:26:08-07:00
10914175700,asjdaskjdh23421343,https://itunes.apple.com/us/reviews/id650964158,6.8.4,1,Vision Pro support,Why delay,https://itunes.apple.com/us/review?id=983156458&type=Purple%20Software,2024-02-07T17:18:03-07:00
10913582281,LeahLee881906,https://itunes.apple.com/us/reviews/id380075150,6.8.4,2,Don't Not Reliable,Doesn't save all accounts when i sign in there is only one. I have to send a old phone back and erase everything. How is people going to transfer their data if its not backed up. I regret using this. Just like google don't save your accounts don't use.,https://itunes.apple.com/us/review?id=983156458&type=Purple%20Software,2024-02-07T13:06:10-07:00
10910477433,Dylan Hurdsman,https://itunes.apple.com/us/reviews/id554213204,6.8.4,1,Useless for the last few weeks,Can’t even use the Authenticator anymore. Asks for a code from my phone. Then I open the app and it also asks for a code but never gives one. This app used to work flawlessly and now I can’t access my school account to do homework.,https://itunes.apple.com/us/review?id=983156458&type=Purple%20Software,2024-02-06T17:47:18-07:00
10910335564,Octa Pool,https://itunes.apple.com/us/reviews/id480900207,6.8.4,5,New Applicant,"Getting the Microsoft Authenticator is more difficult than brushing the teeth of an elephant.

Does it have to be this difficult?",https://itunes.apple.com/us/review?id=983156458&type=Purple%20Software,2024-02-06T16:50:46-07:00
10910206941,RussNRach,https://itunes.apple.com/us/reviews/id40762247,6.8.4,1,Apple Vision Pro,"Microsoft authenticator needs to be compatible with the Apple vision, pro in order for many of the applications from Microsoft, such as Excel, PowerPoint and Teams, to actually work for enterprises.",https://itunes.apple.com/us/review?id=983156458&type=Purple%20Software,2024-02-06T15:57:40-07:00
10909420674,BOO2MICROSOFT,https://itunes.apple.com/us/reviews/id386998324,6.8.4,1,THIS IS AWFUL,"I CAN’T EVEN ORDER A PIZZA WITHOUT HAVING TWO DEVICES. THIS IS A NIGHTMARE. THIS IS A SCAM TO FORCE MICROSOFT TO HAVE MORE CONTROL ON MORE PLATFORMS IT IS NOT USER FRIENDLY. NO EMPLOYEE WANTS TO BE FORCED TO DOWNLOAD AN APP TO GET INTO THEIR WORK EMAIL. NO EMPLOYER IS GOING TO BUY NEW PHONES FOR THEIR EMPLOYEES NOR PAY FOR ADDITIONAL CLOUD STORAGE.

I hate it here.",https://itunes.apple.com/us/review?id=983156458&type=Purple%20Software,2024-02-06T10:42:09-07:00
10909123516,OmegaSnow10,https://itunes.apple.com/us/reviews/id224295672,6.8.4,1,Doesn’t work when you switch phones,Title,https://itunes.apple.com/us/review?id=983156458&type=Purple%20Software,2024-02-06T09:00:19-07:00
10908462313,Shutterfly products,https://itunes.apple.com/us/reviews/id567209658,6.8.4,3,Authenticator review,I find this annoying. All my devices already have password in icloud and have thumb print access.  Authenticator requests to go thru this process every few weeks to login again! At least I can see that there are new messages via notifications without the authenticator login which tips me off that I need to do it again.,https://itunes.apple.com/us/review?id=983156458&type=Purple%20Software,2024-02-06T05:38:50-07:00