id,userName,userUrl,version,score,title,text,url,updated
7534433043,T.C Carlisle,https://itunes.apple.com/us/reviews/id1165592529,2021.6.29,1,Quick Chat Has to Go,"Used to play this almost daily with some little kids that I know. It was an amazing way to do something together during the pandemic without being together in the same room. It spanned ages and was fun for everyone. Then the quick chat came. We never play at all anymore. It’s too hard to communicate. The choices are too limited and we’ve found it just takes too long to get your point across and it’s almost never exactly right. You can’t say why you think something and can’t defend yourself. It’s obvious who is playing on a computer and typing and who is hunting for the broken up quick chat phrases. You get voted out for being too quiet, or lose a game because you can’t say what you want. For example if you see Red kill Blue, but Blue leaves after they are killed you can’t say Blue anymore. Also for the younger kids they don’t always know all of the words, whereas when they type they can spell out words they know and at least get their point across in simple phrases. I get why quick chat is a thing, too many people were cursing or using foul language; but it doesn’t seem right to overhaul the game because of bad operators. Why not just make it easier to report and ban players for bad language like bigger name games do? Suspend accounts for repeat off offenders. Either way I, and the people I played with, will not be back until quick chat is gone.",https://itunes.apple.com/us/review?id=1351168404&type=Purple%20Software,2021-07-03T05:30:11-07:00
7450374939,Ava Juliana Bratsch,https://itunes.apple.com/us/reviews/id459902458,2021.5.25,5,Love this game but . . .,"I used to love this game, it entertained me for hours. On road trips and flights, I would play among us until we got to where we were going. And I love the new airship map, but I feel like there’s something that caused this game to become a little less popular. You cant customize your name or type your own words in the chat. I feel like if they changed that, and just blocked certain words, (for example, if a person were to put in a curse word, it would automatically delete the word and say, “this word is not allowed”) than a lot more people would play again. I know most of my friends kinda stopped playing for a while just because they can’t explain what they saw, or did in the chat. Yes, I understand that the reason why they blocked off chat is because people were using this app as a way to give unnecessary/inappropriate information, but it still took some of the fun away from the game. But hopefully they find a way to open the chat back up (and custom names) again. But other than the chat and custom names being blocked off, this is an overall great game. I think this game deserves a 5 stars. 
(Please get rid of quick chat!!)",https://itunes.apple.com/us/review?id=1351168404&type=Purple%20Software,2021-06-10T16:58:18-07:00
7194621826,"Fire,Earth,Water,Air,Ice,rock,",https://itunes.apple.com/us/reviews/id1272796531,2021.3.31.2,5,Issues,"I agree that it is hard to chat, but I do also understand like everyone said there might be inappropriate things but at least maybe you can tag it out if you say something bad I will still give it a 5 rate, but I wish you could type whatever you want in the chat because now no one is discussing when  I play the game they are just all silent so they randomly vote and say nothing its just a quiet game. And another thing is that we cant choose our own names like I know again there might be an inappropriate name but cant you make that tag out too just like I thought in the chat. But if you cant add that to the chat at-least let there be more options to use when you chat but otherwise I really love the game and the new maps and all. I just don't understand why you have a chat bar when you just have the option to put something in the chat. I hope you can understand what is an issue for me and others. But Among us would be really awesome if it just went back to when the game was first made so you could chat whatever you want and make your name whatever you want and stuff like that. I still really enjoy it though. I hope you can help. I really appreciate it. Thanks,Bye",https://itunes.apple.com/us/review?id=1351168404&type=Purple%20Software,2021-04-07T08:24:01-07:00
10646326491,slinkystudios,https://itunes.apple.com/us/reviews/id1263099088,2023.11.28,4,I hate this game now ( now edited for a better review),"I am a among us “veteran” who started playing back when the game first released and I really used to like this game then I stoped playing it for a while then I come back to it and it got messed up, first free chat goes away and u need to log into ur account and put in card info or something, then I can’t even access the hats I bought when the airship came out or something, and no refund, now I enjoy playing the roblox version of among us more. 

Edit : Though as I’m now editing this in 2023, inersloth or someone else has taken all of the roblox versions down. But again I’m editing in 2023 and sparked new interest in the game again. They have fixed most of the things I hated about the game. I can chat freely again, I finally was able to redeem some of my purchases, and they’ve even added a new map. There is 1 thing I do have a slight problem with but it can be overlooked if you look at fact. That problem is the micro transactions, they are mostly unfair to other players of how you can’t afford the purchases. But roblox does the same thing, and this game is free, so they have to make some sort of income from this. A great and fun game again, is what I’m trying to say.",https://itunes.apple.com/us/review?id=1351168404&type=Purple%20Software,2023-12-01T10:11:17-07:00
6687979232,cupcake cake brownie,https://itunes.apple.com/us/reviews/id1173833963,2020.11.17,5,We love among us ELLIE SEGREST,We all love among us but there might be some glitches but at the end it’s always fun to play when quarantine struck this was the best game to play so download it it might have some problems but at the end it’s not that bad it’s amazing game and I think you should download it there is a hack to be the imposter you change your name and you change your color and that’s all you need to do to be the imposter to win a game it will be fun kill people but make sure that your business will be doneSo download among us and we all are among us we all love you too and your friends probably are begging you to download it to are your parents saying no like mine are just download it and keep it a secret like anything that any kid would do So don’t give it a fuss don’t give it a was so don’t give it a fuss don’t give A little bit of thinking just download among us is the best game to playWhen quarantine struck what is the best game to play and we all said hooray among us is finally here so download it and you have a blast of your life have you ever went on a Disney cruise like me have you ever had a blast take a risk I have a time of your life trust me and join my game well I have to go I’ll write another one of these on another game well ELLIE Out,https://itunes.apple.com/us/review?id=1351168404&type=Purple%20Software,2020-11-26T06:54:00-07:00
6630023271,TacoCruncher11,https://itunes.apple.com/us/reviews/id846729744,2020.10.22,5,Everything is amazing except for a couple things,"Everything in this game is amazing, it’s a game that can have infinite amount of replay-ability with the constant changes in how you play.  Also with the 3 different maps you can change between makes it hard to get bored.  There is only a couple things that I don’t like about this game which include hacking which ruins the game outright, but because of its insane popularity I can understand that there will be a few hackers.  However, the devs are doing a amazing job with banning hackers and I recently have been in no games that had hackers.  Another thing is the server list, with the games constant player count when you open the server list some servers that load onto your screen that say they are 9/10 are already full, this just sends you back to the main menu with a message saying you can’t join that server.  However, this is easy to get around by just picking the servers are 4-5 down the list, they normally only have 6/10, but by the time you join they will mostly have a full server ready to play.  Other than those couple complaints everything about this game is great and I love it.",https://itunes.apple.com/us/review?id=1351168404&type=Purple%20Software,2020-11-10T08:39:37-07:00
6624496501,Jolene Castillo,https://itunes.apple.com/us/reviews/id1213927590,2020.10.22,5,I love this game,"I love Among Us so much. The first time I played it I thought it was boring but as I kept playing it just kept getting so much more fun! I have some request that I hope you can add to the game. First of all, I really want a way to like friend people so you can play with them all the time because I meet people that I enjoy playing with, but then I never get to play with them again. Second, I wish there was a way to report people when they ask for personal information. Lot’s of people ask for my number or my name and I really don’t like it. It scares me and I don’t ever know what to say. Third, I think that if it’s possible, can you add another map? I don’t know why I want another map because the only one that I play good on is the skeld. Fourth, can you please add more hats and colors because there’s not a lot of colors, and when you join a game sometimes a person already has the color you want. I play with my name as Strawberry and lots of times I don’t get to be red. I’m not saying I don’t like Among Us I love it, but I think you could add some things to it. Basically what I’m trying to say is thank you for creating Among Us I really enjoy playing it and I can’t wait to get back on and keep playing! LOL!!!🤣",https://itunes.apple.com/us/review?id=1351168404&type=Purple%20Software,2020-11-08T18:55:42-07:00
6556453050,im playing this everyday,https://itunes.apple.com/us/reviews/id514791736,2020.9.9,5,"Amazing game, but I need help..","I just have to say this game is great and addicting. It’s a great game to play with friends and a great way to entertain yourself. I would like more features like coins, more colors, friend system, etc. (Which I know the developers can’t do everything, just some ideas) Anyways I wanted to report an issue I have with the game. I am on a iPad mini 2. Now I would absolutely love to get a new iPad but I can’t get it at this time. My iPad has 11.9 GB to 16 GB at this moment, though my game keeps crashing. I don’t know if it’s because of the type of iPad or whatever but it’s very annoying. This same thing happens to my brother and we both have the same type of iPad. I’ve tried shutting down my iPad, deleting stuff, deleting the app and reinstalling, but it doesn’t seem to work. The crashes happen while I’m doing a task, just walking, but it usually happens when I try to use the chat. I just wanted to put this out there so someone can investigate this, I don’t know if this happens regularly to other people but my friends don’t have this problem. But apart from that, this game is sooo good if only I didn’t crash that much I would be playing non-stop. Well that’s all I have to say, Have a blessed day!",https://itunes.apple.com/us/review?id=1351168404&type=Purple%20Software,2020-10-20T14:41:46-07:00
7294850125,very trusting,https://itunes.apple.com/us/reviews/id1193328970,2021.4.12,4,Pls delete the quick chat!,"I absolutely LOVED Among Us before the update, I would always play it but since the quick chat that comes with the update I rarely play it, here is why: I can’t type what I feel! I feel very restricted by the quick chat I have been reading a lot of reviews and people also feel like me, like by the time I finally find what I was going to say everyone already voted me because I wasn’t saying anything I I feel like it’s unfair cause I come across people who can actually type and they just sus me cause I wasn’t contributing information CAUSE I COULDN’T! Also sometimes when I play we cannot even find the imposter cause we can’t say a lot like if I saw someone vent and host a meeting it would take me so long to find what I wanted to say that everyone already voted me off! Like UGH! 😤And it’s really unfair that I cannot change my name, like  when the update first happened I just pressed “randomize name” joking and thinking I could change my name again but then I couldn’t like they give me names that I would never in my life use. And I know that you can sign but when I try to sign in I can’t cause it says that my ID isn’t valid! So I would really appreciate if you could change that, thank you! 😁",https://itunes.apple.com/us/review?id=1351168404&type=Purple%20Software,2021-05-03T16:15:33-07:00
7895651133,jekdjdnmijsdu duid,https://itunes.apple.com/us/reviews/id1140134456,2021.6.30,5,BEST GAME...but,"This is a god game a good one a AWESOME ONE! but for some reason every time I try to get mini crewmate it doesn’t work like when I buy something it says I have it pls fix it thx! 😀 Ok so back again I am here because can there be more hats? I mean we have cool hats just want more like more food and animal hats like bunny hats or a apple also more pets too pls that’s all P.S this is for the new update ok ;) Hey so I just made a lobby in among us I was doing hide and seek and the players I played with were noobs. They didn’t know what to do so pls hurry with the hide and seek update soon Ok so this is bad. There are some cheaters I just played with. They looking on there screens and telling who. There names are King gang. Anya, And kilya. They are so rude! :( Hey again it’s me :)! I had some problems so had to delete game then get it back. Then after that all of the Halloween hats were gone for me. Everyone else had them. Can u restart the Halloween hats then bring them back for me pls! Hey! Love the new airship but for real I need help, we can’t change names now and I didn’t know so now I am sad, please change this
I’m back and I really wanna sign in but won’t work please fix it I’m tired of this stupid quick chat :(",https://itunes.apple.com/us/review?id=1351168404&type=Purple%20Software,2021-10-09T08:15:32-07:00
6602335270,spooky boi 101,https://itunes.apple.com/us/reviews/id1090996831,2020.9.9,5,Awesome game but a few suggestions,This is an awesome game I would rate it a lot higher if I could but there are a few things I would like to see either gotten rid of or added like getting rid of the message that kicks you because there’s supposedly an update when there’s not but I would love to see the following added like being able to move a dead body which would be useful to imposters or like a special vent that only crewmates can use to go to a different level but imposters can’t use it or when you go into the vents as an imposter you can see what’s inside and have like an admin table screen in it that would help them see what’s inside a room like the entire room and able to sabotage in it and being able to solely sabotage the cams for 15-30 seconds and it can’t be fixed till the timer runs out which is helpful to imposters or a new role that is a crewmate who can vent but can’t kill or sabotage to mess with the crewmates but will say the role to the imposters but not crew and an option that has a 60 second cool down where you can go invisible so I would be so happy if these features could be added at least one and yeah awesome if these existed thanks so much for reading thank you have a great day bye :),https://itunes.apple.com/us/review?id=1351168404&type=Purple%20Software,2020-11-02T13:35:05-07:00
8131068325,spookycookies,https://itunes.apple.com/us/reviews/id28541818,2021.12.14,4,"Used to be fun, but now it’s boring","I played the game ever since it got all its hype, before people used “sus.” I enjoyed the game. It was fun and simple. I used to play it with my friends way back. Recently, I went on the app, and found a place that was nothing like the app it was before. First of all, there are new colors. Can’t the classic cyan and the infamous red be enough? Why do we need these extra colors? I don’t get it. And then there’s a new map. It’s very confusing. The tasks are random, and there are way too many roles. Why in the WORLD do we need extra roles? Can’t it just be imposter and crew-mate? It makes the game too confusing. And additionally, my friends stopped playing your game. We all bought the outfit pack where you get a mini among us character following us. And guess what? On my friends’ devices, it didn’t even save! And they never deleted the app. And finally, there is a horrible issue that made my friends quit. What happened to the chat? Before, you could chat like a normal chat would. You type in words and it sends. But now, you have to choose from PRESET MESSAGES. The game is ruined. I don’t know why you developers changed it all, but I don’t support any of this changing. It’s ruined the concept of your game.",https://itunes.apple.com/us/review?id=1351168404&type=Purple%20Software,2021-12-14T18:21:31-07:00
6575051231,Stealthkiller606,https://itunes.apple.com/us/reviews/id980591349,2020.9.9,5,Amazing,"The game is just S+ tier so simple yet so fun, the best part is that the fair of everyone doesn’t depend on one person it is a vote so everyone has input there is no reveal your self and still win so you have to be stealthy and precise and the game really tests your brain power. The vent system is amazing and I love getting away with kills when someone walks in as soon as I get them cause the vent, I have even gone on rampages and still won the fact that it isn’t given a base set up that can’t be changed and host can change is amazing. I love being able to have a challenge either as imposter with high cool down and low range  to help spice it up and love being Crewmate with low vision and good amount of tasks, being able to beat the imposter by completing a series of challenges (the tasks) is so fun I love going and finishing five tasks before a body is found. The sabotage method is also cool cause you can trap people with door shutting insta win with o2 reactor and stabilizers and get rid of there field of vision by hitting lights I have even mad lights my kill zone on Skeld. So fun to be able to detective a win as crew and murder and lie myself to the W as imposter, over all a 10/10 game with such fun ways to play that makes people fall in love with it.",https://itunes.apple.com/us/review?id=1351168404&type=Purple%20Software,2020-10-26T00:10:29-07:00
5979195302,Lil Shrimp06,https://itunes.apple.com/us/reviews/id596705309,2020.5.9,5,Every other reviews are wrong.,"Hello, lately I’ve been seeing horrible reviews for this fantastic game. People saying this game is overloaded with ads are wrong. When it does give you an ad you can skip it the second it starts! If anything that is an amazing plus to the game. People that say it’s lagging are probably playing on an older phone. There is no lag in this game. There are plenty of different matches to join with many settings to choose from to matchmake a kind of match you want. There is a speech censor which make the interactions make the game seem more appropriate for everyone! The people saying I played 30 matches and still haven’t been imposters are lying. I calculated the chances to be an imposter with 1 imposter in a game. It is a 10 percent chance. So every 10 games you are definitely going to be it. But you can still be imposter before that. And if the chances are too small then customize a match to 2 imposters or 3! There isn’t anything wrong with this game! I don’t see anything wrong. A few purchases are in the game but isn’t pay to win so that’s a big plus. In the end this is an amazing and is is worthy of anywhere from a 4.8 to a 5.0 game! I’m sorry this review is so long. Keep up the good work.",https://itunes.apple.com/us/review?id=1351168404&type=Purple%20Software,2020-05-22T06:31:21-07:00
8449479302,Rosesforlife,https://itunes.apple.com/us/reviews/id688352549,2021.12.15,5,I love among us!!,"I cannot begin to express how much Among Us has fundamentally changed my life for the better in every aspect. Before Among Us became popular I was a normal guy, I played Geometry Dash and Mario Maker 2 competitively and everything was fine, but then it happened. I was looking around on steam out of boredom and I saw it; Among Us. I read the premise and was immediately impressed, as it sounded like a grand time, but this was only the beginning of my absolute wholehearted adoration for the masterpiece of a game that Among Us truly is. I downloaded the game, eagerly waiting for it to finish downloading. I opened it and was blasted with the coolest logo, best music and greatest menu I’ve ever seen. Everything about it was perfect, and my mind was blown. Ever since I’ve lived for among us, I have among us themed birthdays, porn, devices, masks, shirts, haircuts, pants, scarves, wallpaper, rugs, bath bombs, bowls, spoons, forks, plates, sex toys, and many, many more. I also met my wife and pastor in Among Us. I play for upwards of 20 hours a day and I only plan on increasing that number. God bless Innersloth and their incredible creation, it’s truly a miracle that something so purely special could grace us with its majesty. SussyJarvis345 out ☮️",https://itunes.apple.com/us/review?id=1351168404&type=Purple%20Software,2022-03-12T18:21:43-07:00
8162181541,just add magic girl,https://itunes.apple.com/us/reviews/id996095525,2021.12.15,3,"Oh, Among Us 😐","At first, the game was really fun. Until the updates happened… first of all, i hate quick chat. Its incredibly stupid and meaningless. I understand why you wanted to add it, but its not like that method is going to stop bullies. The fact that you have to log in with email to not use it is stupid too. That means i cant play with a lot of people i used to play with because people who have to use quick chat cant play with people who dont have to. Plus, people who have to play with quick chat cant even play the game the proper way. You cant even give proper information like “red locked me in medbay and i think he was going to kill me.” So you cant play the game and give the proper information in order to win. The next problem is the game wont let me play. Sometimes, the game wont let me in. When i click on the app it kicks me out right away, before i can even do anything! And the days it actually lets me in, i cant even complete a game! It randomly kicks me out in the middle of the game. Its VERY rare that i can finish a game without getting kicked out. That also means its harder to get the things to get rewards on the cosmicubes. I really enjoyed playing this game, and i think i would have continued to enjoy it if these stupid updates never happened.",https://itunes.apple.com/us/review?id=1351168404&type=Purple%20Software,2021-12-23T17:07:54-07:00