id,userName,userUrl,version,score,title,text,url,updated
11092781278,Review whrighter,https://itunes.apple.com/us/reviews/id1307078096,55.4.3,5,8 ball pool,"I’m a 13 year old girl who loves to play this game because, It is super fun gets you mind off of things and if your board it helps it super relaxing and helps me out like when I’m board or not feeling anything I play it so I would highly recommend this game thank you",https://itunes.apple.com/us/review?id=543186831&type=Purple%20Software,2024-03-27T16:03:12-07:00
11092521963,Theadore guttom,https://itunes.apple.com/us/reviews/id1036610917,55.4.3,5,Cool,Very cool,https://itunes.apple.com/us/review?id=543186831&type=Purple%20Software,2024-03-27T14:18:49-07:00
11092447028,Juju thi,https://itunes.apple.com/us/reviews/id1178937043,55.4.3,5,Upgrade,Upgrade the program so that combination shots give you more minutes,https://itunes.apple.com/us/review?id=543186831&type=Purple%20Software,2024-03-27T13:49:12-07:00
11092277562,Jzjsjsndbhxid,https://itunes.apple.com/us/reviews/id1616985555,55.4.3,5,Amazing,So much fun to play pool and since I don’t have a pool table I can play on my phone,https://itunes.apple.com/us/review?id=543186831&type=Purple%20Software,2024-03-27T12:43:57-07:00
11091998898,Sator1111,https://itunes.apple.com/us/reviews/id137656310,55.4.3,5,8 ball pool,I love it! It’s always my go to,https://itunes.apple.com/us/review?id=543186831&type=Purple%20Software,2024-03-27T11:00:08-07:00
11091394789,Hope for peace is me,https://itunes.apple.com/us/reviews/id1640056161,55.4.3,5,Love this game!,"🥰 win or lose I just enjoy the game, keeps me entertained🥰",https://itunes.apple.com/us/review?id=543186831&type=Purple%20Software,2024-03-27T07:38:38-07:00
11090773373,ZackPrince21,https://itunes.apple.com/us/reviews/id757116503,55.4.3,5,8 Ball Pool,Great game.,https://itunes.apple.com/us/review?id=543186831&type=Purple%20Software,2024-03-27T04:15:38-07:00
11090664125,Melodiclpoiybngfdr,https://itunes.apple.com/us/reviews/id1490127781,55.4.3,5,Lady joker queen on jokers wild,"I really enjoy the competition of my team. I have lots of fun playing against some very high-quality players. I’m having an excellent time. And enjoying myself thank you, 8 Ball Pool",https://itunes.apple.com/us/review?id=543186831&type=Purple%20Software,2024-03-27T03:32:48-07:00
11090639753,Bobsisjbfhr,https://itunes.apple.com/us/reviews/id486766900,55.4.3,5,8 ball,Good game lots of fun,https://itunes.apple.com/us/review?id=543186831&type=Purple%20Software,2024-03-27T03:22:44-07:00
11090238944,Peace fully,https://itunes.apple.com/us/reviews/id1104377197,55.4.3,5,Amazing entertainment whoever is paying 8 ball,I love 8 ball,https://itunes.apple.com/us/review?id=543186831&type=Purple%20Software,2024-03-27T00:16:45-07:00
11090231468,Fortyluck,https://itunes.apple.com/us/reviews/id1507404712,55.4.3,5,Great,It teaches how and where you want to hit the ball you want to pocket. Making it a great tool to perfect your real life skill and ability.,https://itunes.apple.com/us/review?id=543186831&type=Purple%20Software,2024-03-27T00:13:03-07:00
11090185206,Shadam97850,https://itunes.apple.com/us/reviews/id232070023,55.4.3,5,Pool review,This is the one app I found where I didn’t have a commercial between every game. Responsive. Only drawback is you have to call your pocket before you get your cute line and that on the 8 can be challenging. Best one yet!,https://itunes.apple.com/us/review?id=543186831&type=Purple%20Software,2024-03-26T23:49:51-07:00
11089918747,Rabatiii18018,https://itunes.apple.com/us/reviews/id1372459456,55.4.3,5,Best game of biliard ever,8ball pool,https://itunes.apple.com/us/review?id=543186831&type=Purple%20Software,2024-03-26T21:32:16-07:00
11089889979,Gilsell,https://itunes.apple.com/us/reviews/id1599399109,55.4.3,5,Muy bueno el juego,Me ah gustado mucho,https://itunes.apple.com/us/review?id=543186831&type=Purple%20Software,2024-03-26T21:18:13-07:00
11089728733,Darrin Craig,https://itunes.apple.com/us/reviews/id1639885936,55.4.3,5,Make it worth wild,Make where you can win actual cash wins in the tournament and as well as winning the rings and trophies,https://itunes.apple.com/us/review?id=543186831&type=Purple%20Software,2024-03-26T20:03:34-07:00
11089677801,SA3A FETNESS,https://itunes.apple.com/us/reviews/id1639881314,55.4.3,5,Thes is a good game,Sa3a,https://itunes.apple.com/us/review?id=543186831&type=Purple%20Software,2024-03-26T19:41:54-07:00
11089613357,Teeler97,https://itunes.apple.com/us/reviews/id1510967498,55.4.3,5,Addictive,"It is a very good game, but it’s very addicting lol",https://itunes.apple.com/us/review?id=543186831&type=Purple%20Software,2024-03-26T19:14:56-07:00
11089302776,Ex no b b,https://itunes.apple.com/us/reviews/id1470597808,55.4.3,5,Good,It is the best you can have so much fun a there's good deals,https://itunes.apple.com/us/review?id=543186831&type=Purple%20Software,2024-03-26T17:08:08-07:00
11089216254,Dustincashking,https://itunes.apple.com/us/reviews/id1639838556,55.4.3,5,I like this game a little t,What can I get for doing this,https://itunes.apple.com/us/review?id=543186831&type=Purple%20Software,2024-03-26T16:32:26-07:00
11088920902,slaw439,https://itunes.apple.com/us/reviews/id1162943956,55.4.3,5,Awesome,Love it! Don’t change anything since it is perfect the way it is!!!!,https://itunes.apple.com/us/review?id=543186831&type=Purple%20Software,2024-03-26T14:32:29-07:00
11088642913,???™️,https://itunes.apple.com/us/reviews/id1588535246,55.4.3,5,Yes,I like it,https://itunes.apple.com/us/review?id=543186831&type=Purple%20Software,2024-03-26T12:43:33-07:00
11088456225,Deez nutts on yo chin,https://itunes.apple.com/us/reviews/id1509503465,55.4.3,5,Spin win,"The spin win never pays out high
Remove it. It wastes time",https://itunes.apple.com/us/review?id=543186831&type=Purple%20Software,2024-03-26T11:32:58-07:00
11088094057,kaely whaley,https://itunes.apple.com/us/reviews/id1431666045,55.4.3,5,w,wwwww,https://itunes.apple.com/us/review?id=543186831&type=Purple%20Software,2024-03-26T09:24:45-07:00
11087451672,Rob-oj,https://itunes.apple.com/us/reviews/id364755658,55.4.3,5,Great game!!  As good as you want to make it!,"A great game where it depends on who you get to play. I like the computer assigned opponents are generally in your level of skill, but not always. Don't think you could ask more of a free game!  Can be a little buggy at times, especially when trying to pair with “friends”",https://itunes.apple.com/us/review?id=543186831&type=Purple%20Software,2024-03-26T05:55:51-07:00
11086552293,U❤️me frrrrrrr,https://itunes.apple.com/us/reviews/id1431261266,55.4.3,5,This is great,I play pool irl so this is a great way to practice when I don’t feel like going downstairs to play,https://itunes.apple.com/us/review?id=543186831&type=Purple%20Software,2024-03-25T23:27:23-07:00
11086438415,Ji norm us,https://itunes.apple.com/us/reviews/id1474003635,55.4.3,5,Has,In my opinion this is the best pool game hands down.,https://itunes.apple.com/us/review?id=543186831&type=Purple%20Software,2024-03-25T22:26:24-07:00