id,userName,userUrl,version,score,title,text,url,updated
4014290945,rudyrudolph,https://itunes.apple.com/us/reviews/id42690315,71.0,5,Missing Searches,"I love this app. I use it multiple times every single day. My only complaint, and I’m not sure if I’m the only one, but when I tap on the search bar to start typing, I no longer have my last searches show up as a list under the search bar. That’s really unfortunate because I’d use that all the time to quickly go back to a previous search. Google, if this was removed, please put it back!! Everything else is amazing with the app, but the loss of that is very frustrating. Thank you for what you do!",https://itunes.apple.com/us/review?id=284815942&type=Purple%20Software,2019-04-14T21:37:01-07:00
3059622821,Jen.FG,https://itunes.apple.com/us/reviews/id679304370,55.0,3,Usually love but freezes too much lately,"I love Google so much I have both the Google app and the chrome app. I love the Google one because it has a quick search bar and all of my news, agenda etc. But lately it will freeze after a search. I can't go back, refresh, retype. Nothing. My only option is to close the app and do it again after every search. So lately I've been using the chrome app much more. It's super annoying because although I love chrome, I like how fast a search can be made on the Google app and I can't do that currently. I've looked for updates and updated my phone and still havening the same problem. Please fix it!",https://itunes.apple.com/us/review?id=284815942&type=Purple%20Software,2018-08-13T10:23:54-07:00
2172270069,Shayyyynnaaaasaa,https://itunes.apple.com/us/reviews/id101678198,41.0,5,Won’t use anymore. HATE the front page.,"EDIT: changed my review because now you can turn off the feed of suggestions!

THANK YOU GOOGLE!

The reason I loved google on desktop and mobile was because how simple the site was. No nonsense, just a search bar. I didn’t have to look at any part of the internet I didn’t want to see.

I’ve had to stop using because it is spoiling all my favorite tv shows for me. If I open the app before I’ve seen an episode of something, it’s spoiled immediately because the app uses my interests to put relevant articles below the search bar.

Also sometimes I need a break from all the upsetting things that go on and I never know what I’m going to see when I open google. It gives me anxiety!

I’ve tried to delete these subjects and they only come back with time.

Such a silly reason to not use an app, but I can just use my browser to search, that’s what’s happened.",https://itunes.apple.com/us/review?id=284815942&type=Purple%20Software,2018-02-05T19:36:47-07:00
9765643848,Z.G. Financial Solutions,https://itunes.apple.com/us/reviews/id608477814,257.0,5,The best way how to answer your questions!,Google is the best way how to search up something that your curiosity wants to wonder and the funny thing about Google is that there is secrets in it and if you search up do a barrel roll it will actually do it and it’s really really funny it made my day when I searched it up and I consider for you doing that it’s so funny no kidding anyway there is some false answers about NASA it put like the earth is round but I love this app in my opinion you really should download thus,https://itunes.apple.com/us/review?id=284815942&type=Purple%20Software,2023-03-29T13:47:52-07:00
9763082100,always tryfor a triple,https://itunes.apple.com/us/reviews/id636981948,257.0,5,Great meal,"Tonight I decided I needed red meat so called Outback in Glendale, AZ.  This is not usually my go to place because it is rather pricey for my budget.  Carry out waitress Natalie helped me decide on what steak would be best and I ordered the 9 oz filet, a baked potato and French Onion Soup.  Every bite of my meal was impeccable, seasoned and cooked to perfection. I called Manager Ted and he told me Fayla was the chef tonight and expressed that he should be proud of his team.  I ate every bite!  Now I know where to go to get a great steak.  My chi-Weinstein loved what little I would share too.  Delicious.  Hats off.  Standing ovation",https://itunes.apple.com/us/review?id=284815942&type=Purple%20Software,2023-03-28T20:23:07-07:00
9148177058,SoOWTtheBox,https://itunes.apple.com/us/reviews/id206634643,232.0,4,NEW UI,"Just so we level set, everything that we’re expressing in the reviews are first world problems and in the grand scheme of things none if it really matters. but since we’re here …. 

I actually like the new UI that was implemented with the search bar, being round and a little bit larger, and I understand that it may not be for everyone, but I think the aesthetic is very pleasing. 

It was a nice surprise to align with iOS16 + dynamic island vibes. 

I will, however, express that I do not like there is no option to remove some of the features directly below the search bar. some of those features are not useful to everyone and it would be ideal if we could pick and choose which ones we would like to have under the search bar if this is going to be a permanent implementation.  

Example: I don’t see to see the option of search homework, but I do like the option for search song.",https://itunes.apple.com/us/review?id=284815942&type=Purple%20Software,2022-10-03T13:51:36-07:00
3627931842,JayR2Point0,https://itunes.apple.com/us/reviews/id585484673,65.0,1,Devs are completely ignoring reviews,"The app has fallen apart. People are reporting very similar issues, and haven't even got a reply stating that the issue is being looked into. I guess once you get to a certain level consumer issues don't matter, but what does matter is the numbers. The issue with the app is that it will not load new content, and when it does it is content you have already seen, or content from two months ago that is no longer relevant to the user. Google and Apple have both completely forgotten about the having a quality product. Each and every day the more users they get the less they see them as people, and the more they see them as numbers. Resolve the common issues before making the product ""better""",https://itunes.apple.com/us/review?id=284815942&type=Purple%20Software,2019-01-08T15:15:51-07:00
10450766684,florencerus,https://itunes.apple.com/us/reviews/id19125252,284.0,1,No way to get help!,"When I got IPhone 15  issues with you tube began.  Can’t remember password, must sign in to get. Match the number on you tube only you tube app only showing videos. An acct I forgot I had from 2007 was brought up where I was allowed to change PW but could not delete, could not retrieve my & subscriptions library;finally told to try later, too many attempts. Tried to look for number to call, could not find.  Went to chat, said can not sign up on You tube app. Told to use fewer words, . Typed “Password Help”. Again told to try fewer words! Trying to delete & start over; having issues.  Now I am 72 years old, pretty good on computers but  I need some help.  I really would like to use a cuss word but I won’t!",https://itunes.apple.com/us/review?id=284815942&type=Purple%20Software,2023-10-07T20:07:09-07:00
9532412203,charliechocolate9970,https://itunes.apple.com/us/reviews/id34469010,247.0,3,Please Stop Refreshing!,"I used to really like the app to read news and blogs about my favorite topics. Something changed in a recent update that causes my feed or an article I have open to refresh when I switch between apps. I’d understand if I hadn’t had the app open in a while, but this can happen in as little as 30 seconds between apps. It’s very frustrating to have a news article open, get a phone call, and then come back to the Google app and the content is gone because the app refreshed. I know there’s a tab option, but the content doesn’t always save there.",https://itunes.apple.com/us/review?id=284815942&type=Purple%20Software,2023-01-21T11:19:44-07:00
9300245991,Cjdujxbhddbfb,https://itunes.apple.com/us/reviews/id359973539,238.1,1,Pictures,"This new update is terrible. Previous versions, if I cut and paste a link, or did a search, it would remember it until I deleted it manually.  Now, it doesn’t retain anything.  AND, it is nearly impossible to trigger the web address to be copied, as I have to drag it and place it back on the url bar in order to be able to manipulate it, which then allows me to select all.  I used to just have to click on the address bar anywhere, and it gave the copy option.

Also, pasting is a pain too.  Now I have to hold my finger there for several seconds after a double tap in order to paste.  Which it no longer remembers the address when I leave.

Please fix this for the iPhone.",https://itunes.apple.com/us/review?id=284815942&type=Purple%20Software,2022-11-17T15:37:42-07:00
5584338579,emyers7519,https://itunes.apple.com/us/reviews/id1135779237,95.0,4,Good,"My go to search engine. It pulls up articles from everywhere so I know I’m getting information from multiple different places, not just one, and that they are easy-to-navigate. There are some things I don’t like, for instance, when you search not all the websites that are listed are relevant to what you’re searching. Also, the websites sometimes don’t answer your question or give you the information you need. For the most part though, Google is an extremely good source and I recommend it. I don’t have a lot of problems with it and its pretty simple to navigate.",https://itunes.apple.com/us/review?id=284815942&type=Purple%20Software,2020-02-26T13:00:33-07:00
8017370078,YankeesMike,https://itunes.apple.com/us/reviews/id399006865,185.1,5,App crashing constantly after latest update,"UPDATE: There was an update to the app a few hours after I submitted this review that solved the problem! And I received an email letting me know the issue was fixed!  Excellent customer service!  

I updated the app on my iPhone yesterday and tried using it today. It froze the first time I opened it so I closed the app. It crashed immediately the next 6-12 times I tried opening it. Never had this problem before this update.",https://itunes.apple.com/us/review?id=284815942&type=Purple%20Software,2021-11-12T15:04:28-07:00
7115112196,JillianLuvPsych,https://itunes.apple.com/us/reviews/id113039320,149.0,2,I get spam phone calls every time I stay in app,"I’ve always used Google app as my primary search engine but starting last year just before elections, every time I opened the app and stayed in it for more than 5 mins immediately after I closed the app I’d receive a phone call (and texts I can’t block) from unidentifiable numbers. Just recently at 7AM on a Saturday morning! I barely ever use the phone part and my contacts are kept at a minimum. This is a huge security breach and has made me wary that my searches or movements within Google apps have been tracked by unknown parties. I won’t be using Google apps as much anymore till I find another search engine app that doesn’t sell out my information.",https://itunes.apple.com/us/review?id=284815942&type=Purple%20Software,2021-03-17T19:07:47-07:00
6738403001,TrvlBlgr,https://itunes.apple.com/us/reviews/id318224812,137.2,1,Not impressed,"Since becoming aware of this app my gmail will refuse to open anything in Chrome (defaults to Safari even though Chrome is set at the default in the app and on my phone settings). 
The suggested reading simply provides spoilers to shows I’m watching, or suggests articles that it knows I’ve already read. 
Additionally, the “people also viewed” suggestion that shows up at the bottom of my screen is horrible. It takes up so much reading space and essentially acts as an extension of the ads already on my screen. The bouncing it causes on my screen provides a horrible user experience. 
I’m giving it one star because I don’t prefer it over safari and am frustrated that it interferes with my use of Chrome (which by far is my app of choice).",https://itunes.apple.com/us/review?id=284815942&type=Purple%20Software,2020-12-10T09:45:50-07:00
6225488257,IcePrincess66,https://itunes.apple.com/us/reviews/id835270251,117.0,1,"There are gory videos and images of CARTOONS!!! Remove them ALL please, Google","Cartoons nowadays are targeted to KIDS! Users disrespect cartoons by creating gory images and videos of them! Google, this is getting ridiculous. Please remove all the gory images and videos and websites of cartoons OFF of your search results! I looked up Looney Tunes stuff and I saw a gory video and some gory images! Please remove them all from your app and the website! I’m disgusted, sad and scared at the same time! SafeSearch doesn’t work for NOTHING! It doesn’t filter gory images and videos! You have lost a website and app visitor! Here’s what I feel rn: 🤭😨😢🤢😱

Do something please, Google! I’m desperate for this to go away! Please don’t ruin our childhood! PLEASE HELP US ALL! PLEASE!!!😭😢🥺 Since this wasn’t resolved, I am no longer trusting Google. Shameful.",https://itunes.apple.com/us/review?id=284815942&type=Purple%20Software,2020-07-21T14:37:19-07:00
5701505838,blue 4 stars,https://itunes.apple.com/us/reviews/id1104724426,98.0,3,"Great, but...","This app is nice but when you type half the word I get something very inappropriate. Then I start dozing off and accidentally press it, and I literally see disgusting images. WHY YOU PUT THIS ON THE INTERNET???!!!! 
Please keep privacy to the people, in the photos, and also delete these!

I know in your terms of services you are not liable to the content, but who knows, this content can snap a child’s brain
Remove those uncovered photos permanently! 
And also, remove the word to because someone small can find and see these!

YOU guys should make a SEPARATE APP called: GOOGLE FOR KIDS, which only shows content that is age- appropriate. Now kids can’t see these photos anymore with google kids! 
The content for kids includes educational/school websites, prayers, everything but curse words-inappropriate content, and private photos!

Also by the way, I don’t know if I am in trouble or not.  

Google please tell me I am not because it was an accident please help.
I am sorry if I am bothering you.

Anyways this is a nice app 

Thank You",https://itunes.apple.com/us/review?id=284815942&type=Purple%20Software,2020-03-23T07:07:50-07:00
2123211779,Armijoorlando,https://itunes.apple.com/us/reviews/id211480439,41.0,4,Google review,"Who moves really good juice some days it doesn’t work problems trying to have a a word  upload with the info though I have problems with different medications that I’m Trying to find out about and address  I’m looking for or how to get to them  leads me to wrong address and it was close but wrong direction it was a right not a left turn three houses not five  it was my aunts house looking for a a movie and it gave me the wrong information it was crazy I had never got this write a review otherwise I would have took pics or even screen shots but next time 
I’ll do so thank u and GOD BLESS",https://itunes.apple.com/us/review?id=284815942&type=Purple%20Software,2018-01-24T15:51:48-07:00
3990370828,Puzzlegameaddict,https://itunes.apple.com/us/reviews/id325079858,69.0,1,Bring back the old image format!,"I never leave reviews but now I will. I used the google app specifically so I wouldn’t have to deal with the image format that google had when I chose to google something through Safari on iPhone, now the google app has the same layout/format as when using Safari, I used the google app cause it seemed more convenient and I was able to be very quick with it, now it’s not worth having the app, does nothing for me when I can just open safari, which now all together isn’t even worth using google at all anymore, for my research. Or at least just for images, and as I can tell by the recent reviews, I’m not the only one unhappy with this! At least somehow make it an option or setting to have it the old way.",https://itunes.apple.com/us/review?id=284815942&type=Purple%20Software,2019-04-09T05:10:56-07:00
2078765194,kleervt887,https://itunes.apple.com/us/reviews/id634085882,41.0,5,Information  Central...,"Google has been a fascinating source of information for me. It makes no difference who, what, when or where you are searching to fill in the blanks the answer is always there. Being a woman of age I marvel at this opportunity to tap into this endless knowledge. It has been life saving to me being of health that has kept me housebound as of late...As a child I was told,” it isn’t important how much you know. What matters is knowing how to find out what you need to know!”
I have found this to be true and now it’s at my fingertips!",https://itunes.apple.com/us/review?id=284815942&type=Purple%20Software,2018-01-11T06:56:37-07:00