id,userName,userUrl,version,score,title,text,url,updated
11012266855,TomandJaz,https://itunes.apple.com/us/reviews/id1394384187,24.09,1,Change your ways.,"I don’t understand why everyone is writing such great reviews. They claim that they’re pet friendly. I have never found one that you can leave your animals in their kennel in the house or out of it. They also claim that it is less expensive than a hotel. The last time I traveled I stayed in a hotels, I spent less than 100 dollars a night, and I was able to leave my animals in the room. I just looked up places they offer right now 109 dollars a night… but there’s no hot water 😱 okay.",https://itunes.apple.com/us/review?id=401626263&type=Purple%20Software,2024-03-05T13:27:08-07:00
11012119636,B1892669277,https://itunes.apple.com/us/reviews/id481741128,24.09,2,Logging in is very difficult,Every time I go to get on my app it has logged me out and I go to log back in but I can’t use my phone number because it never actually sends me the verification code. Then this time I accidentally selected my business email instead of my account email and now I can’t log in to my actual account because every time I click log in with email it takes me to a page where it is trying to make me create a new account with my business email and I can’t delete it to type in the email I actually use.,https://itunes.apple.com/us/review?id=401626263&type=Purple%20Software,2024-03-05T12:28:22-07:00
11012010369,KellBell11237526466,https://itunes.apple.com/us/reviews/id411831618,24.09,1,Don’t Trust AirBnb,"DONT TRUST AIRBNB. We just had a host send us a link outside of AirBnb to sign a contract to pay the host the full amount of “rent” up front directly to them. We refused since this is clearly against guidelines. The host refuses to refund us even though we sent the request within one hour of booking, due to their lack of abiding by the rules. Airbnb won’t help us even though the host is trying to go around them to make money. We’ve used AirBnb countless times & now they won’t help us even when the host is clearly in the wrong and we have screenshots as proof. Now we are out $3400… Make it make sense. USERS BEWARE!!!",https://itunes.apple.com/us/review?id=401626263&type=Purple%20Software,2024-03-05T11:46:19-07:00
11011990302,Co3lin,https://itunes.apple.com/us/reviews/id193287753,24.09,1,Airbnb protecting hosts not guests,Company now over protects hosts. Will easily allow serial bad hosters to remove reviews. Too many bad host experiences and not a good mechanism to account for it.,https://itunes.apple.com/us/review?id=401626263&type=Purple%20Software,2024-03-05T11:38:37-07:00
11011239986,airbnbhater,https://itunes.apple.com/us/reviews/id1632106438,24.09,1,No one to contact when you need help,"Planned a trip out for weeks, went to go book an airbnb and they restricted my account for an unauthorized party when I had under the limit of guests attending. They then sent me to a support team who could not help, then I got an automated email saying they were upholding their decision meaning I could not book. Completely ruined my plans because of their dumb system.",https://itunes.apple.com/us/review?id=401626263&type=Purple%20Software,2024-03-05T07:57:25-07:00
11010102641,Soniastew,https://itunes.apple.com/us/reviews/id1030400324,24.09,1,Robbery,"How is this possible ?? I was hosting and due to hurricane damage in FL , I had to cancel a $4,000.
Reservation . After place repaired and started hosting again- they took $900. from my first reservation. Unbelievable… I do not recommend",https://itunes.apple.com/us/review?id=401626263&type=Purple%20Software,2024-03-05T01:19:12-07:00
11009021011,LilMartin,https://itunes.apple.com/us/reviews/id221396335,24.09,3,Limited Funtionality,Still cannot get a custom promotion to save in the app,https://itunes.apple.com/us/review?id=401626263&type=Purple%20Software,2024-03-04T16:46:17-07:00
11008812872,Nitin Ntini,https://itunes.apple.com/us/reviews/id184877304,24.09,1,Annoying Human Verification,"Annoying human verification feature, designed by someone with too much free time on their hands",https://itunes.apple.com/us/review?id=401626263&type=Purple%20Software,2024-03-04T15:14:50-07:00
11008405728,Hetvreudgsit,https://itunes.apple.com/us/reviews/id86767188,24.09,1,This app has really gone downhill,"I’ve been using airbnb for quite some time now. I used to have great experiences with it but in the past year or two I have had some really bad hosts. Dirty sheets and blankets, other cleaning issues, inconvenient and unclear check-in instructions, hosts trying to charge extra fees off platform. The customer support team has generally been helpful but the company needs to do a better job weeding out bad hosts. In the future I’ll be doing most of my bookings with hotels or VRBO",https://itunes.apple.com/us/review?id=401626263&type=Purple%20Software,2024-03-04T12:19:11-07:00
11007746104,adrian dash,https://itunes.apple.com/us/reviews/id1271573669,24.09,1,Host customer service,Customer service for hosts is terrible. I had a guest wreck my home and burned my couches and tables with her cigarettes even after I have a no smoking policy. She also left drugs lying around and caused extensive damage from water leakage due to the fact she left the windows open during a storm when she left. It’s been days since my reimbursement request and the guys declined it. Airbnb has not been any help I’ve been bounced around to multiple people and they keep telling me all these different things. I’m supposed to be protected worh air cover but it doesn’t seem they want to help at all. This is awful!,https://itunes.apple.com/us/review?id=401626263&type=Purple%20Software,2024-03-04T08:12:09-07:00
11004465474,Txsonshine,https://itunes.apple.com/us/reviews/id1631422143,24.09,1,Webpage complicated,"I do not have internet/wifi reception at my geographic location but I do have cellular capabilities, however, finding a phone number to call or text is next to impossible on your site - if it’s there, it’s buried deep!  Frustrating to pay for lack of communication support!",https://itunes.apple.com/us/review?id=401626263&type=Purple%20Software,2024-03-03T09:35:31-07:00
11004136493,swat7130,https://itunes.apple.com/us/reviews/id282928567,22.24,1,Cannot Updat,I cannot update the app because of the iOS version it demands. Not everyone has a current phone nor can everyone afford one. How do I check in and communicate with my host? You should have an older version available.,https://itunes.apple.com/us/review?id=401626263&type=Purple%20Software,2024-03-03T07:50:49-07:00
11002485731,cammmmmmmmmbbbb,https://itunes.apple.com/us/reviews/id1325738912,24.09,1,Bad experience,"We booked an Airbnb and we couldn’t even stay there because we needed a 25yr old. This was not known to us, and we drove 23 hours to Florida thinking we had a place to stay and when we arrived we were informed we had to leave. We tried to get another Airbnb, but we were labeled as “scammers” to any other house we tried to book. We were stranded in FL and Airbnb was not accommodating at all. After long conversations with representatives we came to no solution. It was not accommodating to us after their mistake. It put us all through a tremendous amount of unneeded stress.",https://itunes.apple.com/us/review?id=401626263&type=Purple%20Software,2024-03-02T21:39:01-07:00
11002371396,j c james,https://itunes.apple.com/us/reviews/id3647751,24.09,1,Customer service not available…,"My wife, our two young daughters and I visited Hawaii for the first time. We rented an Airbnb at the Monarch Hotel which we had though was going to be good. When we arrive it was hot and turned the air conditioner on which was small and set in the far bottom corner of the room. I checked the view on the very small and uncomfortable balcony. I look over and see that a pigeon had nested there as the was an excessive amount of feces all over the air conditioning unit. We also noticed the bed sheets had stains on them and the small plastic dining tablr was broken, as well as scuffs all over the baseboard of the wall. When I contacted Airbnb the opened a complaint and within a day the complaint was closed. No response just stating they won’t continue with my complaint. Then I opened another complaint to speak to a manager and that complaint was closed. Not even a moment to talk. As a nurse I understand the severity of potential diseases that inhaled but feces can cause and the health of their customers seemed trivial to Airbnb especially my children’s health. I will never use Airbnb again. The DO NOT care about you.",https://itunes.apple.com/us/review?id=401626263&type=Purple%20Software,2024-03-02T20:49:06-07:00
11001511604,Sami_3590,https://itunes.apple.com/us/reviews/id441969599,24.09,2,Consistent quality,"I love AirBNb, but my biggest complaint is consistency in quality. As someone who prefers higher end travel, I can’t get behind Airbnb as a solid option. 
Issue number one is the quality of the bed, it’s not controlled and I have slept on a mattress that felt over 10 years old on multiple occasions. And I mean a bed that saags to the point you and your significant other roll into one another. Marked as a plus location. 
The next issue, is the bath products. Never have I ever (lol) been at an airbnb with bath products that reflect the quality of the property. If you’re a plus location, tres seme and herbal essence are not on par. Even holiday inn has better products than this, just say you have nothing would be better.",https://itunes.apple.com/us/review?id=401626263&type=Purple%20Software,2024-03-02T14:59:01-07:00
11001028507,evan paul Navarro,https://itunes.apple.com/us/reviews/id1278447694,23.47,1,Stuck without a place to stay abroad,"Always have loved air bnb. Obviously a platform for third party use but the fist issue I encountered has left me stuck in London(I’m from Kansas) with no ability to book a new place and the support team is beyond rude and unhelpful. Cost me hours of my trip and significant cost due to the back and forth. Now sitting at a pub hoping they fix it. Frankly if nothing else hope this post convinces you to use Virgo. 

Btw funds are locked up and not only am I now “restricted” from booking again but embarrassed to say short on funds.

Please never use this app when abroad.",https://itunes.apple.com/us/review?id=401626263&type=Purple%20Software,2024-03-02T11:43:32-07:00
11000923247,You know me.,https://itunes.apple.com/us/reviews/id31570795,24.09,3,Messages Blank,"When I click on a message, the app only displays a blank screen. I’ve tried closing the app, restarting my phone, etc. This is going to make it very hard (impossible) to communicate with hosts during my trip. Please fix!",https://itunes.apple.com/us/review?id=401626263&type=Purple%20Software,2024-03-02T11:05:27-07:00
11000467901,BakedShoppe,https://itunes.apple.com/us/reviews/id1256440653,24.09,1,Don’t Book With Airbnb,"They seem to like to pick and choose who they want to ban with no logical explanation other than “You seem to be associated with someone who isn’t allowed to use Airbnb” despite multiple good reviews of character, loyalty to a, what I thought to be a good service. They will just randomly pull a background check on people who have excellent stay reviews and then claim without any sort of reasoning that you can’t use this app. Whoever runs this company seems to think cannabis is evil and is now disregarding anyone who was part of the war on cannabis. Hope you get rid of all the places who claim to be 420-friendly since you wanna discriminate people who have been tragically affected by that.",https://itunes.apple.com/us/review?id=401626263&type=Purple%20Software,2024-03-02T08:36:24-07:00