id,userName,userUrl,version,score,title,text,url,updated
11026762887,Kelsey Drozd,https://itunes.apple.com/us/reviews/id404251810,6.105.2,5,"Great location, clean and easy to work with",Great location. Super clean professional staff. Easy to schedule and great experience 😁,https://itunes.apple.com/us/review?id=585027354&type=Purple%20Software,2024-03-09T13:06:12-07:00
11026051918,Caligrl73,https://itunes.apple.com/us/reviews/id107359381,6.105.2,5,Michael Campbell,Michael Campbell was amazing he noticed that I had lan issue that I was not aware of and fixed it with no charge. Thank you Michael!!’,https://itunes.apple.com/us/review?id=585027354&type=Purple%20Software,2024-03-09T08:54:40-07:00
11026002289,Anonimos frustration,https://itunes.apple.com/us/reviews/id338934565,6.105.2,5,I can’t see Ai interface,I have tried reinstalling the app but it doesn’t work.  I can’t get the ai version.,https://itunes.apple.com/us/review?id=585027354&type=Purple%20Software,2024-03-09T08:39:16-07:00
11025922386,Bentley123!$0 fun,https://itunes.apple.com/us/reviews/id1548566539,6.105.2,5,Mom,Your mom,https://itunes.apple.com/us/review?id=585027354&type=Purple%20Software,2024-03-09T08:15:02-07:00
11025877593,Greg RiffRaff,https://itunes.apple.com/us/reviews/id342713547,6.105.2,5,Everglades Swamp Tours,I highly recommend Gary at evergladesswamptours.com. I throughly enjoyed the trip and the educational info he provided about the swamp and all the wild life. I would definitely go again! Thanks again Gary for the great trip!,https://itunes.apple.com/us/review?id=585027354&type=Purple%20Software,2024-03-09T08:01:52-07:00
11025723166,Glen Pierre,https://itunes.apple.com/us/reviews/id1421791457,6.105.2,5,Good you are so welcome blessing,Okay,https://itunes.apple.com/us/review?id=585027354&type=Purple%20Software,2024-03-09T07:15:57-07:00
11024672703,chuchch jj. j j kk,https://itunes.apple.com/us/reviews/id1632004392,6.105.2,5,Shag,Wfx,https://itunes.apple.com/us/review?id=585027354&type=Purple%20Software,2024-03-09T01:22:26-07:00
11024229727,sunsetnightmares,https://itunes.apple.com/us/reviews/id236103632,6.105.2,5,Bueno,Good,https://itunes.apple.com/us/review?id=585027354&type=Purple%20Software,2024-03-08T22:16:11-07:00
11022950268,Hjbjal,https://itunes.apple.com/us/reviews/id1231417035,6.105.2,5,‘N,Gracias sheila,https://itunes.apple.com/us/review?id=585027354&type=Purple%20Software,2024-03-08T13:20:48-07:00
11022908178,Karma1983,https://itunes.apple.com/us/reviews/id501999110,6.105.2,5,Hair cut,Sam is awesome,https://itunes.apple.com/us/review?id=585027354&type=Purple%20Software,2024-03-08T13:03:03-07:00
11022880032,Nobatia,https://itunes.apple.com/us/reviews/id843774198,6.105.2,5,Great Service,"Dealt with a sale rep named Omar Elshaikh he was very courteous, understanding and knowledgeable. Highly recommend.",https://itunes.apple.com/us/review?id=585027354&type=Purple%20Software,2024-03-08T12:51:07-07:00
11022519309,ToyotaFirst,https://itunes.apple.com/us/reviews/id325444428,6.105.2,5,Awesome Service!,"The service department, especially Alex and Sonni are outstanding!",https://itunes.apple.com/us/review?id=585027354&type=Purple%20Software,2024-03-08T10:26:53-07:00
11022381992,Karen is smiling,https://itunes.apple.com/us/reviews/id175435591,6.105.2,5,Demartino Dental Group P. C.,"I was very pleased with my last visit to this dentist! I received professional and thorough care from Caitlin & Dr. Demartino. Also, thanks to Allison, who answered some questions that I had in relation to insurance.",https://itunes.apple.com/us/review?id=585027354&type=Purple%20Software,2024-03-08T09:36:26-07:00
11022370696,Da Smart Comments,https://itunes.apple.com/us/reviews/id1632616741,6.105.2,5,McLaren Wound & Hyperbaric Clinic,EXCELLENT STAFF,https://itunes.apple.com/us/review?id=585027354&type=Purple%20Software,2024-03-08T09:32:24-07:00
11021097274,THEINTERNETISHOLY,https://itunes.apple.com/us/reviews/id1627760893,6.105.2,5,HOLYGOOGLEMAPSINALLLAW  HOLYGoogleMapsINALLLAW  HOLYgooglemapsINALLLAW,HOLYGOOGLEMAPSINALLLAW  HOLYGoogleMapsINALLLAW  HOLYgooglemapsINALLLAW,https://itunes.apple.com/us/review?id=585027354&type=Purple%20Software,2024-03-08T02:23:49-07:00
11020702707,jwardhooper22,https://itunes.apple.com/us/reviews/id805716255,6.105.2,5,Love google maps,I’d like Google maps. All the locations are on point. It is a smooth app that has everything in place. I do food reviews on here and the process is much easier than any other app I have done food reviews on. It’s the point and nothing extra that you have to do. This is my number one source now for food reviews and being a local Google guide to help others in finding good food spots. Keep up the great work Google up🤪.  #google,https://itunes.apple.com/us/review?id=585027354&type=Purple%20Software,2024-03-07T23:26:11-07:00
11019566698,King Kory,https://itunes.apple.com/us/reviews/id256746395,6.105.2,5,Serves it purpose,Great for searching and connecting me to what I need.  I love to travel and go places and the guides definitely help me !,https://itunes.apple.com/us/review?id=585027354&type=Purple%20Software,2024-03-07T14:42:18-07:00
11019543524,rheneas1959,https://itunes.apple.com/us/reviews/id213240003,6.105.2,5,Service Experts—- Rhea,"Rhea came out for our semiannual check. It was great to have him back, and he did a wonderful and thorough job. Thanks, Rhea!",https://itunes.apple.com/us/review?id=585027354&type=Purple%20Software,2024-03-07T14:32:01-07:00
11019082668,Fj gf set in bc s u b tax,https://itunes.apple.com/us/reviews/id1601696785,6.105.2,5,Excellent Service,"I can’t say enough positive things about Venom’ service and parts departments.
I had an unusual situation which is too long to share.
Bottom line is everyone I spoke to at Venom was very nice, patient, and extremely helpful. To help me resolve my issue I was asked to send pictures. To help me understand what I needed to do, Venom sent me pictures and they called me to further help me. 
Their whole team was very friendly, very polite, very prompt, and very helpful.
They did exactly what they said they were going to do and promised to help me, which they did.
I received the parts I needed in a timely fashion, but more important I feel I received good old fashioned customer service.
Hats off to Venom!!!!",https://itunes.apple.com/us/review?id=585027354&type=Purple%20Software,2024-03-07T11:18:20-07:00
11018961886,Tennesse Newcomers,https://itunes.apple.com/us/reviews/id619277482,6.105.2,5,Ketchum Roofing & Windows,"Just had our home and garage roofed by Ketchum.  We are new to the area having lived here only a few months.  Chase took charge when he discovered wind and hail damage. He contacted State Farm and handle everything.  We had to do very little and all the work only cost us was our deductible.  The work was great, the crew great, they cleaned everything up like they had never been here. They came back twice the day after they finished to check and make sure we were happy and satisfied.  If you need roofing, call these folks you want be sorry.",https://itunes.apple.com/us/review?id=585027354&type=Purple%20Software,2024-03-07T10:31:38-07:00
11018908037,Rmack64,https://itunes.apple.com/us/reviews/id277401030,6.105.2,5,D john agent,D. John was informative and knowledgeable.  I appreciate his help and great personality.,https://itunes.apple.com/us/review?id=585027354&type=Purple%20Software,2024-03-07T10:11:21-07:00