id,userName,userUrl,version,score,title,text,url,updated
11028441335,Melena0622,https://itunes.apple.com/us/reviews/id181802837,24.10,1,"Bans without explanation, vague messages","I’ve been using Airbnb for the past 8 years and although I’ve had some questionable airbnbs here and there, I generally liked it. However recently, I’ve had the most difficult time with Airbnb due to sudden reservation cancelations from Airbnb, and then getting banned for the vague reason of “someone associated with my account cannot use Airbnb”. After contacting them multiple times, I still get no clear answer as to why the ban occurred and they have yet to compensate me for the reservation they cancelled 3 days before the reservation date! I would expect customer service to get better over the years, not worse! Better take your business elsewhere since you’ll never know when you’ll get banned out of nowhere. It happens to hosts as well.",https://itunes.apple.com/us/review?id=401626263&type=Purple%20Software,2024-03-10T00:39:12-07:00
11027951633,monsterkush79,https://itunes.apple.com/us/reviews/id222203377,24.10,1,Ruined my daughter’s prom,This site is ran by computers not people. I have perfect history and several rental’s over several years all excellent reviews. Recently when trying to make a reservation I was flagged as party risk . They deleted my account causing me to lose the reservation I had just made and a reservation I had for months for my daughters prom . I emailed them and they immediately reinstated account but property for prom was gone . Next I rebooked the house the caused the original issue . They then closed my account again and now say they will not reinstate. Please boycott this site my daughter is devestated along with all her friends,https://itunes.apple.com/us/review?id=401626263&type=Purple%20Software,2024-03-09T21:10:37-07:00
11027600797,Griffin Stewart,https://itunes.apple.com/us/reviews/id35029498,24.10,1,Scam Listings Everywhere,"This platform has gone down the drain.  We used to love using it but the last four listings we have tried to book have turned out to be scam listings that did not actually exist!

We have move on to VRBO and will never be back!",https://itunes.apple.com/us/review?id=401626263&type=Purple%20Software,2024-03-09T18:48:46-07:00
11026508740,Play4fun33243,https://itunes.apple.com/us/reviews/id248270850,24.10,1,Sketchy refund policy,I had booked my bachelorette trip in Nashville several months in advanced to when I was going. When we did we book it we payed an extra to make sure we would be able to cancel if needed because this was going to be a lot of money. Fast forward to our plans changing in a big way and now we won’t be able to make this trip happen. It’s still three months before the trip was scheduled and we have paid half(2780$) and we were told we weren’t eligible for the refund. Super frustrating because we were even led to believe that we would be able to get that refund and it was 3 months ahead of time.,https://itunes.apple.com/us/review?id=401626263&type=Purple%20Software,2024-03-09T11:28:31-07:00
11023551022,Ash isClay,https://itunes.apple.com/us/reviews/id203164556,24.10,1,Getting worse,"What they’re doing to the hosting side is despicable. It is getting harder to host with the new interface, please fix.",https://itunes.apple.com/us/review?id=401626263&type=Purple%20Software,2024-03-08T17:31:20-07:00
11022385591,Melakh84Neri,https://itunes.apple.com/us/reviews/id1368131548,24.10,1,Airbnb is a scam,"The host didn't tell me that I needed to sign a short term lease agreement so I declined to sign it and according to the policy if I host does not tell you that you have to sign a short term lease agreement before booking, the host has to refound all money without penalties so these scam company didn't make the host to return my money. I lost a total of $2000 beware and protect your money book at the hotel.",https://itunes.apple.com/us/review?id=401626263&type=Purple%20Software,2024-03-08T09:37:46-07:00
11022384510,Bdog1998,https://itunes.apple.com/us/reviews/id114201584,24.10,1,Terrible customer service,"I was clearly in an illegal airbnb, and customer support sided with the host. Once I confronted the host, I received a full refund once I threatened to report it to a government agency. Customer support was NO help. Going back to hotels. DONT WASTE YOUR TIME",https://itunes.apple.com/us/review?id=401626263&type=Purple%20Software,2024-03-08T09:37:22-07:00
11022305523,K03#,https://itunes.apple.com/us/reviews/id920157110,24.10,1,Worst Customer Support Ever,I was lied to repeatedly. When I was having issues with support I had over 15 cases over the same thing and no one called me back they always promised they cared and I would get a call back but I NEVER DID I pray anyone who uses this app consistently because eventually the will make up something on your account and stop u from booking with no help or resolution.,https://itunes.apple.com/us/review?id=401626263&type=Purple%20Software,2024-03-08T09:09:32-07:00
11022257904,Zoehyk,https://itunes.apple.com/us/reviews/id306009359,24.10,1,The app is getting worse by the day,"The IT people that are starting to revise the app are beginners. They have no idea what the host goes through and they have made it so difficult and the Airbnb app used to be such a breeze and now it’s become such a drag so I don’t know who hired this new IT person who is ruining the Airbnb app I have given feedback I have given them recommendations, but they keep ruining the app every day more and more they have taken the price per night out of the listing and have put it in the calendar. It’s very difficult to find out what the listed prices how much we’re gonna get paid and all that information I hope the CEO of the company is going to read my review and is going to make changes, please do if you read it",https://itunes.apple.com/us/review?id=401626263&type=Purple%20Software,2024-03-08T08:53:15-07:00
11020948855,YESC,https://itunes.apple.com/us/reviews/id20784611,24.10,1,Disappointed,I booked a place informed the host my flight was delayed. Then my flight got cancelled informed the host the next day. They wouldn’t cancel the trip charged me full price wouldn’t even give me half of the 5 day stay. Customer service said they can’t do anything because the host doesn’t want to give a refund. So hopefully you never have a flight cancellation because you’ll still have to pay full price for the whole stay. Horrible terms and customer service.,https://itunes.apple.com/us/review?id=401626263&type=Purple%20Software,2024-03-08T01:19:32-07:00
11020573665,Sollegiato,https://itunes.apple.com/us/reviews/id557459794,24.10,2,Ways to improve,"I use Airbnb from 2014. I and my spouse together had more than 50 stays. I appreciate for the service provided. But I really miss few features:

Family account. I don’t understand why you didn’t make it so far. My wife is often looking for places where we’ll be staying. Then send it to me over WhatsApp. After some time I look over them or maybe I forget about it and when I come to it again, some of them could be unavailable already. And we have 2 profiles, so our reviews are there and there. It’ll be more convenient to have family profile with shared payment methods and reviews.
Almost all our bookings made for our family. And every time I have to type guests coming with me, it’s frustrating and easy to fix. 
Refund policies aren’t guests friendly. I understand you solved issues for the hosts to bring them to your platform, but I believe you’re big enough to turn ur face to guests now. In case I have to cancel my booking (in case of emergency and not because I changed my mind), I’ll get most likely partial refund and host will get full or partial amount for the cancelled nights. At the same time the host could get new reservation for these dates and get more money without actually losses. In this case host will get 1.5-2x for rebooked nights. It’ll be much more friendly for me as guest if you’ll refund rebooked nights in full (and you can do this easily, you hold money, so you can manage it). It’s easy, friendly and good for hosts too. And you can promote listings with cancelled nights in your search. And may be guests would love to pay some money (to you) to get it promoted so most likely rebooked. Is it nice? I think so. 

Hope you got my points.",https://itunes.apple.com/us/review?id=401626263&type=Purple%20Software,2024-03-07T22:23:50-07:00
11020314631,Raven8S,https://itunes.apple.com/us/reviews/id1458858850,24.10,1,Random Account Restrictions,"I went to use Airbnb for the first time ever, and was restricted because they thought I was having an “unauthorized party”. I contacted the host of the home prior to booking, asked her permission to have my sons get together for his first birthday there & gave her all the details she asked for- she approved it! She even said she’s accept my invitation to come. Tried to book, and although she confirmed my stay, Airbnb restricted it. I had friends & family try to book the home from their accounts & they were also restricted. I got an automated email every time I reached customer service that said they were upholding their decision. Completely disappointing & inconvenienced as an almost first time user of Airbnb. I will never recommend this to anyone.",https://itunes.apple.com/us/review?id=401626263&type=Purple%20Software,2024-03-07T20:16:03-07:00
11018904373,Jeremylanis,https://itunes.apple.com/us/reviews/id86289803,24.10,1,Terrible,"They let you book then let the host cancel on you close to your date.  then everything has sky rocketed in price and there’s quote nothing that can do. So what’s the point of booking early to get a good deal if they allow this? 
Went from 200 a night to 700 🙄
Will never use this sight again.",https://itunes.apple.com/us/review?id=401626263&type=Purple%20Software,2024-03-07T10:09:59-07:00
11018664223,Natethegreat100,https://itunes.apple.com/us/reviews/id1462037123,24.10,1,Terrible terrible experience,"I was going to put an air Bnb on my credit card, and I did but I selected the wrong dates. I cancelled that RSVP and decided to put that money in the app so there was no lag time to access that money, since I thought I was going to book another one very soon. Well, plans changed and now AirBnB won’t give me that money back! $380 dollars! I need that money. AirBnb customer service provided no help, and I am left very upset and out $380 dollars. I will not be using AirBnB ever again. They stole my money because they won’t take it out of the their account and put it back on my card. Thieves. This has gone on since Nov ‘23 and it’s March ‘24. Airbnb is a billion dollar company and they can’t help someone in financial need for their money back? Jeepers Creepers",https://itunes.apple.com/us/review?id=401626263&type=Purple%20Software,2024-03-07T08:43:22-07:00
11017865543,Jacey6770,https://itunes.apple.com/us/reviews/id1587017410,24.09,1,Racial profiling,"There were very judgmental when I uploaded my I.D for them to scan it, Once they seen I was African American they’ve declined my approval. I am very disappointed. 0/10 customers service.",https://itunes.apple.com/us/review?id=401626263&type=Purple%20Software,2024-03-07T04:20:59-07:00
11017713464,Cameron🍌,https://itunes.apple.com/us/reviews/id505949498,24.09,5,User Friendly,The best site to try to find a last-minute hotel accommodation,https://itunes.apple.com/us/review?id=401626263&type=Purple%20Software,2024-03-07T03:25:33-07:00
11017707001,Sgdjdkskhdsk,https://itunes.apple.com/us/reviews/id253278509,24.09,1,Worst customer support,"The hosts can accuse you of stealing random things that weren’t even in the apartment you rented, and Airbnb will automatically charge you for those items. Customer support gave me conflicting information about how to deal with the issue, and in the end the host admitted to me that he wasn’t sure if I took his items but still I got charged $200 for them and never refunded. I opened about 10 support cases and each one gave me bad information and closed the case without my approval. I’ll never use Airbnb again.",https://itunes.apple.com/us/review?id=401626263&type=Purple%20Software,2024-03-07T03:23:05-07:00
11017328137,TSL8R,https://itunes.apple.com/us/reviews/id1575282960,24.09,1,Bad Customer Service and Crooked Hosts,"I think my reviews keep being deleted. So here i am again. Made a review on a place in Peoplestown, Georgia. Host neglected a couple details including a bullet hole in a bathroom window that he removed after i made my review on airbnb so now airbnb thinks i was lying. Anyways, spent almost 500 on 4 nights, didn’t feel safe and it was so loud from the highway plus neighbors above and there was a mildew smell, or it was fresh paint smell so didn’t stay more than 20mins on the property. Asked for a refund and only received 70. AND review was removed. I did agree to do a solid for the host by keeping the review as a good one but he was greedy so i gave full honesty. Apparently airbnb does not stand by that but more by the crooked hosts.",https://itunes.apple.com/us/review?id=401626263&type=Purple%20Software,2024-03-07T00:31:37-07:00
11016864159,ྀིྀིAbByKaE ྀིྀི,https://itunes.apple.com/us/reviews/id1594086613,24.09,4,PLEASE ADD CASH APP,"please add cash app for an option for payment!!!! so for people that don’t have PayPal have access! please add cash app and also there would be more options  for payment, thank you!",https://itunes.apple.com/us/review?id=401626263&type=Purple%20Software,2024-03-06T20:38:40-07:00
11016714552,Chinadollbaby83,https://itunes.apple.com/us/reviews/id1586419344,24.09,1,This company is trash,"First I would like to start with I never can send it to a background check on this app so I’ll start with that then let me state that I paid $586 for a room for almost 2 weeks in Oregon. I scheduled this earlier today around one or 2 o’clock, I just now got the notification that they’re not going to accept my stay because almost 20 years ago I had gotten in trouble but it’s been 20 years now. Almost not only that but now I’ve gotta wait 10 days to get my $586 back from this company because they decided to cancel my reservations six hours after I already paid it and now I’ve gotta wait 10 days just to get my $586 back that’s absolutely ridiculous what I wanna know is how this company is going to take $586 from me tell me that my reservation is good to go and then six hours later tell me that my reservation was canceled because of an offense that I did when I was in my late 20s and now I’m 40 years oldand have not been in trouble since that day and then tell me that it’s gonna take 10 days for me to get my money back",https://itunes.apple.com/us/review?id=401626263&type=Purple%20Software,2024-03-06T19:27:35-07:00
11016441699,Juanseman,https://itunes.apple.com/us/reviews/id200419101,24.09,5,Awesome,"Easy, practical and straightforward.",https://itunes.apple.com/us/review?id=401626263&type=Purple%20Software,2024-03-06T17:29:13-07:00
11016151224,new random citizen,https://itunes.apple.com/us/reviews/id638536834,24.09,1,Terrible App,"The company itself is honestly not caring about its customers. The customer service is awful and do nothing to help people who have been seriously mislead by Airbnb hosts. I’ve used Airbnb a few times and only have a couple of good experiences. For the peace of mind, save yourself the trouble and use a hotel.

Fix your customer service. Update your app.",https://itunes.apple.com/us/review?id=401626263&type=Purple%20Software,2024-03-06T15:22:00-07:00
11015800802,Koewler,https://itunes.apple.com/us/reviews/id164230501,24.09,1,Terrible Customer Service,"Absolutely terrible business. We booked a condo through Airbnb. We get a notice the booking has been cancelled. I called and they said Alabama Getaway had the wrong pricing and they do not wish to honor it. They said there was a software update and they didn’t inform them so pricing wasn’t accurate. Instead of honoring it, they cancelled our reservation. Airbnb said it was not them, it was Alabama Getaway and theres nothing they can do about Alabama cancelling, it was out of their hands. Then that was it. No, let’s look for another condo, here’s a credit, promo code absolutely nothing. I called Alabama and said so because you guys had miscommunication with Airbnb and messed up we get screwed by it, they said and I quote “yes you do”. I would never book with someone who doesn’t care about their customers. Basically saying we'll book this condo for more money and we don't need you.",https://itunes.apple.com/us/review?id=401626263&type=Purple%20Software,2024-03-06T12:51:04-07:00
11015781111,abhfkkdkvorjebnf,https://itunes.apple.com/us/reviews/id792743850,24.09,1,Biggest joke,"Airbnb is the biggest joke for booking, just because someone is associated with someone doesn’t mean they are going to be there. Funny thing is yall no problem booking me in the past and no issues but now it’s different. Screw yall AIRBNB!!!",https://itunes.apple.com/us/review?id=401626263&type=Purple%20Software,2024-03-06T12:42:51-07:00
11015131244,🤞🏾!,https://itunes.apple.com/us/reviews/id841516545,24.09,5,2639 Observatory,"Really nice/ clean, quiet place to visit.. I’ll always have this place in mind, when considering a place to stay. You should too. Great job. 2639 observatory unit 2.",https://itunes.apple.com/us/review?id=401626263&type=Purple%20Software,2024-03-06T08:37:23-07:00
11015055286,Traveler 1090,https://itunes.apple.com/us/reviews/id19780419,24.09,2,"App is great, Air BnB not so much","The actual app works well and easy to navigate. However, buyer beware. Air BnB takes the position it is only there to connect property owners and renters. You are not their customer and they don’t care about you. I had a safety issue at a property and Air BnB opened and closed the case while I explained the issue (security door didn’t open when electricity cut out). They said they would email the owner. But the case is closed, so zero follow-up on a fire/life-safety issue. 

In a separate incident Air BnB did not want to refund its fee when a landlord wasn’t responsive and I rebooked a different, more expensive place through Air BnB. They finally capitulated, but only after 30 minutes of arguing with their staff. 

Air BnB is often cheaper than a hotel and many people have a great experience. But that has nothing to do with Air BnB. Just know that when you book through them you’re really on your own and I hope you’re lucky enough to work with a good property owner.",https://itunes.apple.com/us/review?id=401626263&type=Purple%20Software,2024-03-06T08:11:59-07:00
11014426740,Terry and Renae,https://itunes.apple.com/us/reviews/id196059139,24.09,5,Victoria Drive,"Just left 3 weeks at this amazing house! Andy the host was the best. So responsive and helpful. Just booked for 2025. Thank you for making our get away so pleasant. House is in a quiet secluded area, no neighbors behind is a huge plus.",https://itunes.apple.com/us/review?id=401626263&type=Purple%20Software,2024-03-06T04:53:47-07:00
11013352862,S S 123,https://itunes.apple.com/us/reviews/id671024246,24.09,1,Auto LLM chats is annoying,"I understand that the default chat would involve AI and is very automated. But despite providing details and asking for an agent, the systems keeping looping with automated chats and gets a long time to get to a human. Super annoying.",https://itunes.apple.com/us/review?id=401626263&type=Purple%20Software,2024-03-05T21:05:34-07:00
11013282679,Shutterfly products,https://itunes.apple.com/us/reviews/id567209658,23.43.2,1,Up until now I loved Airbnb,"I have been a host and a guest using Airbnb for years before they even started advertising publicly, before dynamic pricing and cleaning fees. I loved it. 
But as of recent it has been brought to my attention that Airbnb rents places in Isreali occupied settlements of stolen Palestinian property. Until this is no longer true, I cannot support anything that is not taking a stand against ethnic cleansing. This does not fit with the image that Airbnb was founded on nor with their goodwill to help those displaced from disasters.",https://itunes.apple.com/us/review?id=401626263&type=Purple%20Software,2024-03-05T20:32:32-07:00
11013088641,@hebertojose,https://itunes.apple.com/us/reviews/id305688911,24.09,1,Houses are not hotels,"I get it, people want some extra cash when they have an empty or have a spare room. But what developers are doing, flipping houses that used to be for long time tenants for short term rentals is screwing up everything. I’m all for options when booking a place to stay and love the idea of getting to know new houses because I like architecture, history behind it and the neighborhood, but that doesn’t mean that I should pay a $500 rent increase because my area has 10 new airbnbs",https://itunes.apple.com/us/review?id=401626263&type=Purple%20Software,2024-03-05T19:06:01-07:00
11012614578,Frumtript,https://itunes.apple.com/us/reviews/id108300971,24.09,1,You are not the customer,"Recently I’ve had some issues with bookings on Airbnb.  And it’s just been a stark reminder that the guests are not airbnbs customers.  The hosts are.

I had an issue with booking a trip for some employees of mine.  I was the name on the reservation, and had tried to get it corrected to be under my employees name, because the host made it clear they would not allow my employee to stay there if they weren’t the name on the reservation.   The host was also less than willing to communicate with me while I tried to trouble shoot. I tried as many ways as possible to resolve the issue in the ways the host would ask, but for the most part the host would just insist I talk to Airbnb support when I would ask them clarifying questions about how to fix the reservation.

In talking to support, they kept ensuring me that it’s up to the host how things are handled.  I let them know the host wasn’t really working with me on the issue.  To which they pretty much responded “well, this is all at their discretion, so you need to work things out with them.”

This was an expensive booking, too.  And all I wanted was to ensure that my employees could use the booking.  The only option I was being given by the host was to cancel and rebook.  However, there was a no cancellation policy.  And I really didn’t want to have to pay twice, just to resolve a technicality.  After hours of the host dancing around it, I finally got the host to say they would refund me if I cancelled and rebooked it differently.  But ONLY if and after my second payment went through.  So only after I paid for it twice.  When I (very respectfully) pointed out to the host that this puts me in a position of having to TRUST that they are going to refund me nearly $1000, they simply responded with “LOL”.

Keep in mind, I had been told by support that we didn’t have to do it this way.  That the host could call and they could just switch the reservation to the right names. So me having to trust this host with all of my money is something that could have and should have been avoided.  Either way, I decided to call Airbnb support again before doing it the way the host had asked.  I asked them, “if I have in writing from the host that they will refund me if I cancel and rebook, and they have told me this over the chat on your platform, are you able to help me in anyway to hold the host accountable and ensure I receive he refund?”  His answer “No.  I can call the host and ask them if they want to do it, but it’s their choice entirely.”  I asked if they would be willing to call the host to help work this out since the host was not responding to me, and kept insisting that I reach out to support.  Support said they would, and that they would CALL me back.  I asked them to clarify that they would call back, not email or message me on Airbnb.  Support agreed to call me back.

Several minutes later, I got an automated message from Airbnb simply saying that they had resolved my ticket, and that they suggested I cancel and rebook, and that I work with the host to do that.  They did not mention if I would recieve a refund for doing so.  There was, however, a signature at the bottom of the email that said “We will promptly pay attention and address you if you respond to this message.  I responded to the message.  I recieved an automated reply stating that the representative was out of the office, and that they would address my concern within two days.   The reservation was for the following day.

Anyways.  I cancelled and rebooked.  The host has still yet to refund me for the original booking.  And Airbnb doesn’t care, because the host is their customer.  Not me.

Will be using Expedia and booking at hotels from now on.",https://itunes.apple.com/us/review?id=401626263&type=Purple%20Software,2024-03-05T15:52:33-07:00
11012493809,Calvin1988:),https://itunes.apple.com/us/reviews/id214780433,24.09,1,Wish I could rate 0 stars,"Airbnb is the worst, we got reported for damages that we did not cause, we had photographic evidence, they sided with the host. We will never use their service again, and you shouldn’t either, but if you do I recommend taking thorough videos and photos of every inch of the house you rent right at the time you check in so you don’t get scammed, but even that may not help your case.",https://itunes.apple.com/us/review?id=401626263&type=Purple%20Software,2024-03-05T15:01:55-07:00
