id,userName,userUrl,version,score,title,text,url,updated
11056003529,Mattguynes,https://itunes.apple.com/us/reviews/id265439982,455.0.0,1,Garbage,App is only good for videos. Can’t use marketplace without people trying to hack you. Fake profiles everywhere. Oh yeah and mark z sells all our info to any company for a price. Scum,https://itunes.apple.com/us/review?id=284882215&type=Purple%20Software,2024-03-17T14:03:43-07:00
11055998606,Mamdouh777,https://itunes.apple.com/us/reviews/id678538149,455.0.0,1,Not working,Facebook not working for I phone 6s Plus,https://itunes.apple.com/us/review?id=284882215&type=Purple%20Software,2024-03-17T14:01:47-07:00
11055989246,jurado matthew jaeden,https://itunes.apple.com/us/reviews/id930537969,455.0.0,1,marketplace,for some reason it won’t let me access marketplace fix it.,https://itunes.apple.com/us/review?id=284882215&type=Purple%20Software,2024-03-17T13:58:06-07:00
11055911822,aviatoralligator,https://itunes.apple.com/us/reviews/id800194645,455.0.0,1,Algorithm is AWFUL,There is no way I should see posts from people I don’t know based on “popular” posts. There is no point in having Facebook to come t with people if your timeline is going to be showing literal strangers???,https://itunes.apple.com/us/review?id=284882215&type=Purple%20Software,2024-03-17T13:27:25-07:00
11055883756,Open borders,https://itunes.apple.com/us/reviews/id1636570442,455.0.0,1,Facebook is run by the far left,Time to move on from facebook,https://itunes.apple.com/us/review?id=284882215&type=Purple%20Software,2024-03-17T13:16:29-07:00
11055876944,Gailbakery,https://itunes.apple.com/us/reviews/id1571128987,455.0.0,5,Thanks for letting me spread love here,So thankful for people in my life here how we stay connect family friends,https://itunes.apple.com/us/review?id=284882215&type=Purple%20Software,2024-03-17T13:13:52-07:00
11055871002,Beefydude68,https://itunes.apple.com/us/reviews/id254403777,455.0.0,1,not updating ?? message directly from fb,"Facebook app is out of date We've made some updates to the app to improve your experience. Please download the latest version and try again. 

i literally just downloaded it . how is this possible ??",https://itunes.apple.com/us/review?id=284882215&type=Purple%20Software,2024-03-17T13:11:37-07:00
11055842392,Lonny2001,https://itunes.apple.com/us/reviews/id1599018802,455.0.0,1,Why is Facebook market place so annoying?,Every time looking for things to buy off Facebook marketplace it ALWAYS glitches!!!! It’s so annoying how they making so much money but haven’t been able to fix a simple stupid little thing..,https://itunes.apple.com/us/review?id=284882215&type=Purple%20Software,2024-03-17T13:00:54-07:00
11055838584,busyguy14,https://itunes.apple.com/us/reviews/id101793557,455.0.0,2,2 Stars,"Between the bots, racists and random arbitrary restrictions with zero recourse , Facebook is less and less fun everyday.",https://itunes.apple.com/us/review?id=284882215&type=Purple%20Software,2024-03-17T12:59:28-07:00
11055836544,Tdxjjfft,https://itunes.apple.com/us/reviews/id1534229558,455.0.0,5,Gfeerrrt,Rrfguyyy,https://itunes.apple.com/us/review?id=284882215&type=Purple%20Software,2024-03-17T12:58:41-07:00
11055803200,atlantacigarcrawl,https://itunes.apple.com/us/reviews/id833777283,455.0.0,1,No help from Meta at all,"I’ve had my FB account since you had to have a college email to log on. Someone hacked my account and change my email and password info. It’s impossible to get any help from anyone on facebook. Pics of my family, deceased college friends, everything is gone! I can’t reach no a soul from thi company to assist me. I’m very disappointed at the lack of customer support from someone who has supported you since day one.",https://itunes.apple.com/us/review?id=284882215&type=Purple%20Software,2024-03-17T12:46:12-07:00
11055792229,AngelMori19,https://itunes.apple.com/us/reviews/id1207626211,455.0.0,1,1 star,"This is the sad agenda pushing app that needs to be banned. This app purposely promotes division, racism, sexism, abuse, and political discourse. This app does nothing but cause division in the community and world and is a laughing stock. Steals information and bans anything and everything doesn’t matter the POV of the person. Terrible App, Facebook is the worst platform and the most corrupt and useless and purposely spreads false information to the masses. Congress where is the ban on this sad sack of rubbish app????",https://itunes.apple.com/us/review?id=284882215&type=Purple%20Software,2024-03-17T12:42:06-07:00
11055784535,Abrald,https://itunes.apple.com/us/reviews/id1636561512,455.0.0,5,I love facebook,"Facebook is the best app ever, Marketplace is the best way for me to sell my products. Am enjoying using Facebook!",https://itunes.apple.com/us/review?id=284882215&type=Purple%20Software,2024-03-17T12:39:14-07:00
11055783185,asmray,https://itunes.apple.com/us/reviews/id397609994,455.0.0,1,0 stars,"Stop deleting my reviews! I’ve had my review removed dozens of times in the last few years. They keep removing the bad reviews to try to increase their ratings to make the app look like people like it.

Enough with the sponsored ads and posts. I literally had over 20 sponsored posts in a row, all of which I reported as spam and blocked. I will NEVER purchase or follow anyone because of a sponsored post. I never have and I never will. If you want to spam people with ads and junk posts, make a new app and call it spambook.",https://itunes.apple.com/us/review?id=284882215&type=Purple%20Software,2024-03-17T12:38:44-07:00
11055753467,Sashabluesky4713,https://itunes.apple.com/us/reviews/id1472916983,455.0.0,4,Facebook,Every time I post it tell me I am using an older version and also won’t let me post a new cover. I looked and it has been updated so not sure what is going on.,https://itunes.apple.com/us/review?id=284882215&type=Purple%20Software,2024-03-17T12:27:38-07:00
11055705799,SwApRobaa,https://itunes.apple.com/us/reviews/id582158467,455.0.0,1,Facebook marketplace not working,"It’s been about 3 months without Facebook marketplace. I’m 19 live in the U.S and it says my Facebook is unavailable, this is unacceptable. FIX THIS FACEBOOK",https://itunes.apple.com/us/review?id=284882215&type=Purple%20Software,2024-03-17T12:10:07-07:00
11055696406,amesnbeebs4life,https://itunes.apple.com/us/reviews/id1636552376,455.0.0,5,Facebook,Yes when I was asked if I would like to write a review for Facebook and about my experience with Facebook today I realized how very much I didn’t want to I don’t think a lot of people say it but we had become fundamentally and let’s just a minute extremely reliant upon social media and more specifically Facebook and messenger for most of our knees really I mean heck who doesn’t look on Messenger to see who’s birthday it is anymore and while I’m saying it hacked remember important dates of our own anyways what I’m trying to say is thatI’m so very grateful that I get to be a part of this great big Facebook messenger and social media thing because it’s enriched my life so much thank you I can I can absolutely say this Facebook has enriched my life and I’m grateful,https://itunes.apple.com/us/review?id=284882215&type=Purple%20Software,2024-03-17T12:06:43-07:00
11055584040,jarleae654,https://itunes.apple.com/us/reviews/id698154063,455.0.0,1,Send me my code?!,"I have been trying to create an account for a while and the first time it would not send my code to my phone and proceed to disable my account then I tried again and it again would not send me the code to sign up for my account, facebook need to fix this problem it’s very annoying",https://itunes.apple.com/us/review?id=284882215&type=Purple%20Software,2024-03-17T11:26:46-07:00
11055567944,heinmattke,https://itunes.apple.com/us/reviews/id1154544602,455.0.0,5,2 Facebook accounts,How do I get rid of the other one?,https://itunes.apple.com/us/review?id=284882215&type=Purple%20Software,2024-03-17T11:21:11-07:00
11055530031,Invictus7885,https://itunes.apple.com/us/reviews/id1636538666,455.0.0,1,Hacked,I know who hacked me,https://itunes.apple.com/us/review?id=284882215&type=Purple%20Software,2024-03-17T11:08:04-07:00
11055529590,la-clery,https://itunes.apple.com/us/reviews/id1044183969,455.0.0,5,Improved,You can bring back the feature where you are able to add more than eight people to group,https://itunes.apple.com/us/review?id=284882215&type=Purple%20Software,2024-03-17T11:07:55-07:00
11055484942,grizzly petersen,https://itunes.apple.com/us/reviews/id1165155825,455.0.0,5,Facebook,I fell in love with Facebook when I was working my last couple of years preparing to move to Missoula and I’ve loved it ever since. It has provided peoples with the needed communication to actually topple dictatorships. ♥️💪🏾,https://itunes.apple.com/us/review?id=284882215&type=Purple%20Software,2024-03-17T10:52:30-07:00
11055407327,Jawad2003,https://itunes.apple.com/us/reviews/id1515623284,455.0.0,3,Dark mode,Please try to add Facebook dark mode in iPad version,https://itunes.apple.com/us/review?id=284882215&type=Purple%20Software,2024-03-17T10:26:29-07:00
11055362107,wtjong,https://itunes.apple.com/us/reviews/id35291362,455.0.0,1,Fix vulnerability to malicious code,"There’s an alleged video link to an alleged news story about someone who died in a car wreck, or at least that is the implication. When you click on it because one of your friends (apparently) posted it, somehow it posts itself from your account as though you have lost someone in a car wreck, which makes the viewer repost it as though they lost someone, etc. Not sure if this is password security related but it seems more so a vulnerability on the app code. This should be fixed ASAP",https://itunes.apple.com/us/review?id=284882215&type=Purple%20Software,2024-03-17T10:11:40-07:00
11055313268,Mom2mx2,https://itunes.apple.com/us/reviews/id102364907,455.0.0,1,No way to ever get help with this app,"I am not receiving birthday notifications on FB. When I go to switch between different FB accounts that I have the app crashes, repeatedly and I thought the update might fix both issues, but no, it hasn’t. It’s always something with this app. Never a way to reach someone to get help.",https://itunes.apple.com/us/review?id=284882215&type=Purple%20Software,2024-03-17T09:55:57-07:00
11055279787,Mamaw Neva,https://itunes.apple.com/us/reviews/id1078669306,455.0.0,1,Update,Don’t like the new update! Don’t like people being able to see my stuff and follow me when I have NO idea who they are! Thank you,https://itunes.apple.com/us/review?id=284882215&type=Purple%20Software,2024-03-17T09:45:16-07:00
11055273598,Christy215,https://itunes.apple.com/us/reviews/id34963377,455.0.0,4,"Bot, spamming idsues","Love facebook, but they need work on getting rid of the bots or people who constantly spam public pages and peoples public comments with annoying spam, false information or what ever it is. Also need to work there reporting system as seconds after i report these comments they say its closed and not delt with. Totally defeats the reporting system if you ask me",https://itunes.apple.com/us/review?id=284882215&type=Purple%20Software,2024-03-17T09:43:19-07:00
11055264347,"C,T,M",https://itunes.apple.com/us/reviews/id1593894749,455.0.0,5,De mi corazón,nunca lo cierren dios los mantenga por toda la vida,https://itunes.apple.com/us/review?id=284882215&type=Purple%20Software,2024-03-17T09:40:24-07:00
11055245777,UnitMontana,https://itunes.apple.com/us/reviews/id672907738,455.0.0,1,Really?,"Posted a picture of the St Patrick’s Day celebration in Dublin, Ireland, and you jerks labeled it as hate speech. This truly is a communist-run platform.",https://itunes.apple.com/us/review?id=284882215&type=Purple%20Software,2024-03-17T09:34:40-07:00
11055226700,supabadcash,https://itunes.apple.com/us/reviews/id333472674,455.0.0,1,Why did I come back,Awful sentiment and too many ads,https://itunes.apple.com/us/review?id=284882215&type=Purple%20Software,2024-03-17T09:28:49-07:00
11055219429,Bammmbbiii,https://itunes.apple.com/us/reviews/id120889740,455.0.0,2,Update did nothing,The so called update you did 3 days ago has now made my Facebook crash every 2 minutes. Cannot even scroll without having to restart it multiple times,https://itunes.apple.com/us/review?id=284882215&type=Purple%20Software,2024-03-17T09:26:32-07:00
11055124622,ranger143,https://itunes.apple.com/us/reviews/id202185287,455.0.0,1,iPad FB user,FACEBOOK HAS RESTRICTED MY ACCESS TO MESSENGER UNLESS I DOWNLOAD IT TO MY PHONE. I ONLY USE IT ON MY IPAD. IF I HAD WANTED IT ON MY PHONE I WOULD HAVE PUT IT THERE.  EXTREME OVERREACH IN MY OPINION.  MY DAYS ON FB ARE NUMBERED,https://itunes.apple.com/us/review?id=284882215&type=Purple%20Software,2024-03-17T08:57:16-07:00
11055118525,iPad for Daylite user,https://itunes.apple.com/us/reviews/id10363305,455.0.0,3,Mute needed on Reels,"Since Facebook does not offer a mute button, perhaps Apple could give us a setting to deny Facebook use of the iPad / iPhone speakers?",https://itunes.apple.com/us/review?id=284882215&type=Purple%20Software,2024-03-17T08:55:25-07:00
11055109471,TheRealityofit,https://itunes.apple.com/us/reviews/id32169872,455.0.0,1,Terrible ui,I couldn’t think of a worse user interface when trying to deal with searching Facebook marketplace and returning to Facebook marketplace messenger in order to talk to different buyers or sellers. Using the Facebook app is designed so poorly. I really don’t know how to express myself. It’s time to rehire new individuals that actually use the app.,https://itunes.apple.com/us/review?id=284882215&type=Purple%20Software,2024-03-17T08:52:42-07:00
11055101104,Mr Kitt,https://itunes.apple.com/us/reviews/id665049327,455.0.0,1,Porn,"You show porn every day when I open Facebook 
It’s sickening and disgusting 
You are exposing children to porn but that’s your way 
You want to fact check my facts about plants but allow porn 
Your pedophiles are enjoying your sickening ways",https://itunes.apple.com/us/review?id=284882215&type=Purple%20Software,2024-03-17T08:50:06-07:00
11055087579,Inez Jo,https://itunes.apple.com/us/reviews/id1636305772,455.0.0,2,FB,Someone hacked my account. I’m going to have to delete and leave FB,https://itunes.apple.com/us/review?id=284882215&type=Purple%20Software,2024-03-17T08:45:55-07:00
11055087411,Nikkiludy,https://itunes.apple.com/us/reviews/id131806653,455.0.0,1,Market place is a joke.,You are kicking people off  marketplace who haven't even done anything. You should think about your glitch.  I've heard from 5 people in the past day that have been kicked off for no reason! Yet you say we aren't following your rules!,https://itunes.apple.com/us/review?id=284882215&type=Purple%20Software,2024-03-17T08:45:51-07:00
11055083763,Truth!11,https://itunes.apple.com/us/reviews/id1230325388,455.0.0,1,Bruno Groening Circle of Friend,"Fakebook is the worst social media on the planet.
Only here because of Bruno Groening Circle of Friends.",https://itunes.apple.com/us/review?id=284882215&type=Purple%20Software,2024-03-17T08:44:43-07:00
11055066725,mariam atom,https://itunes.apple.com/us/reviews/id1120864930,455.0.0,5,Thank you so much,Thank you so much,https://itunes.apple.com/us/review?id=284882215&type=Purple%20Software,2024-03-17T08:39:28-07:00
11055065624,Heatmiser73,https://itunes.apple.com/us/reviews/id145892141,455.0.0,1,Garbage app,Ads every third friends post. Absolute trash app with no value. And how about the domestic terrorist all over this app. Facebook is Instagrams Boomer friend that is always angry. Hope you guys are getting your money’s worth from Congress.,https://itunes.apple.com/us/review?id=284882215&type=Purple%20Software,2024-03-17T08:39:07-07:00
11054987590,abigail281a,https://itunes.apple.com/us/reviews/id1072794450,455.0.0,1,New TikTok look alike  update,"Just bc the oldies in the government are working hard to ban TikTok does not mean with we will all switch to Facebook and the more they try to be like TikTok, making it look seamless with the new update. I’ve never wanted to delete my account more.",https://itunes.apple.com/us/review?id=284882215&type=Purple%20Software,2024-03-17T08:15:35-07:00
11054913980,Stick Man 1$,https://itunes.apple.com/us/reviews/id1564193367,455.0.0,1,Facebook shutting off,My Facebook shuts off every 5 minutes or so. Have to restart every time. Not satisfied right now.,https://itunes.apple.com/us/review?id=284882215&type=Purple%20Software,2024-03-17T07:53:41-07:00
11054886932,Tk524,https://itunes.apple.com/us/reviews/id374766325,455.0.0,5,Ok,"I love using it for keeping in touch with family and friends, but some of  censorship is just plain stupid. I shared a post about Danny Kaye with facts about his life. They took it down for some reason. They said I was trying to get too many likes. If they are using artificial intelligence to monitor their AI has no intelligence at all.",https://itunes.apple.com/us/review?id=284882215&type=Purple%20Software,2024-03-17T07:45:37-07:00
11054827726,no one but the blood of Jesus,https://itunes.apple.com/us/reviews/id1021812222,455.0.0,3,Tech issues,Facebook has issues keeping up with notifications of my groups or if I am watching a live stream it will sometimes start over from the beginning even though it is halfway through,https://itunes.apple.com/us/review?id=284882215&type=Purple%20Software,2024-03-17T07:27:57-07:00
11054825420,cjonesmcse,https://itunes.apple.com/us/reviews/id420042798,455.0.0,2,Bugs Bunny is “sexually exploitative”?,Just logged on this AM and got a note about a post being removed. Only showed the URL and not the image. Copied down the URL and visited it to find a meme of Bugs Bunny saying NO. Seriously FB. Get your algorithms under control. Last time it was an album cover for Green Day’s American Idiot. You let so much slide for so many ACTUAL offenders and slap others for NOTHING.,https://itunes.apple.com/us/review?id=284882215&type=Purple%20Software,2024-03-17T07:27:16-07:00
11054697149,TiannaDaGOAT,https://itunes.apple.com/us/reviews/id716415617,455.0.0,1,Horrible,"Filled with inappropriate Ads, false information, violence and ignorance that’s being shared with the world including the younger generations.",https://itunes.apple.com/us/review?id=284882215&type=Purple%20Software,2024-03-17T06:48:39-07:00
11054644964,Clowdchasr,https://itunes.apple.com/us/reviews/id1498538715,455.0.0,2,Facebook account on laptop…,"I just spent two hours trying to open my full Facebook account on my laptop. I can access it on my iPhone, but only get my public page on my laptop. I have searched Google for answers to no avail.
I am very unhappy at the difficulty in performing this seemingly simple function!",https://itunes.apple.com/us/review?id=284882215&type=Purple%20Software,2024-03-17T06:32:43-07:00
11054608207,pmeoff,https://itunes.apple.com/us/reviews/id178831878,455.0.0,1,Censoring is an issue!,"Facebook has made it very clear they are censoring and preventing users from using their freedom of speech! The Fact Checkers are ridiculous! Leaving for another social media platform! Enough is enough!

Do not like the newest version of FB.  Not user friendly at all.  Trying to edit a post is now difficult (the pop-up menu disappears before you can make a selection).   The look, layout and user-friendliness is terrible.  Please go back to how it looked and was used previously!",https://itunes.apple.com/us/review?id=284882215&type=Purple%20Software,2024-03-17T06:21:29-07:00
11054570973,2000jw,https://itunes.apple.com/us/reviews/id1365687783,455.0.0,1,Bad for adds,I like Facebook because it allows me to connect with my family and friends but I dislike all the adds and no way to stop them.,https://itunes.apple.com/us/review?id=284882215&type=Purple%20Software,2024-03-17T06:09:53-07:00
11054548487,Reels tab,https://itunes.apple.com/us/reviews/id474310228,455.0.0,1,Reels,"My reels tab completely disappeared from my page. Also, I stopped receiving suggested reels in my newspaper. I have reached out to Facebook help multiple times with no response.",https://itunes.apple.com/us/review?id=284882215&type=Purple%20Software,2024-03-17T06:02:49-07:00