id,userName,userUrl,version,score,title,text,url,updated
8430754971,Carthagenjj,https://itunes.apple.com/us/reviews/id425402750,9.1.258,1,I can’t believe it after many years,"After I have LinkedIn account for many years, LinkedIn closed my account because of their policy.

I have blog for my own personal shop and it will automatic following to my LinkedIn account. I have done that for few years. Last night LinkedIn sent a email to me to close my account. I went to website and sent them my personal ID to appear the case and reopen my account. No luck, they just reply said I violated their policy and closed my account temporarily. I didn’t spam my blog postings to anyone in LinkedIn, it’s only post on my own LinkedIn page.",https://itunes.apple.com/us/review?id=288429040&type=Purple%20Software,2022-03-07T08:48:36-07:00
6202886776,GenuineBuyer,https://itunes.apple.com/us/reviews/id355545537,9.1.184,5,Loved the new push notification changes,"Loved the new changes on push notification related to job postings. It used to just notify that a company posted a new job. But now it says xyz posted a new abc role and we think you are a good fit! 
Would love to see if this is personalized based on the profile % match to a job or a general messaging change that appears for all the job suggestions.",https://itunes.apple.com/us/review?id=288429040&type=Purple%20Software,2020-07-15T18:46:38-07:00
5903196879,Rafsusa,https://itunes.apple.com/us/reviews/id613454812,9.1.177,5,Certified Cardiac Perfusionist,"As a RNFA in Cardiac Surgery, now retired, I have a very high regard to my Team Perfusionist as a member of the Cardiac Team. I am blessed to have worked and known Mr. Timothy Baker CCP for his dedication and beautiful personality and work ethics when I used to work. They are very knowledgeable in what their job entailed, very focus for it is the lives of a patient on the surgical table. Bring heart back to work again During Bypass Surgery. My hats off to this special people. God loves you guys!.❤️❤️❤️
Very respectfully yours,
Susan Esguerra  RN/BSN/RNFA",https://itunes.apple.com/us/review?id=288429040&type=Purple%20Software,2020-05-04T14:03:16-07:00
2018798598,dallas61,https://itunes.apple.com/us/reviews/id34444366,9.1.59,2,Problem with feed,There are definitely problems with the feed since the previous update. One story continues to get “stuck” at the top and will stay there (for days) until I go into the options to hide that post. Once I do that another story gets stuck there. I used to use this app for the feed all the time in those times when I had a few minutes to review and would get caught up in all of the interesting and timely posts.  That isn’t the case any longer. I now find it frustrating. I am hoping this can be fixed.,https://itunes.apple.com/us/review?id=288429040&type=Purple%20Software,2017-12-22T15:55:54-07:00
1965015808,Albinus,https://itunes.apple.com/us/reviews/id7867535,9.1.58,2,"Used to be great, now, not so much.","Six months ago, I would’ve given the LinkedIn app a four or five star rating. Now since Microsoft has tried to monetize it in a (sadly annoying) traditional way, it is difficult for me to use the app because of the constant video pop-ups and advertisements that I get. LinkedIn used to be a great tool for business networking and searching for work. Now, since I have to dodge so many ads and pop-ups (a pop up video 4-5x in the middle of watching a video? C’mon!! Horrible UX.) I’m looking elsewhere like Glassdoor, Indeed, etc. for my job searches and networking.",https://itunes.apple.com/us/review?id=288429040&type=Purple%20Software,2017-12-02T07:33:09-07:00
8650664125,bgc3000,https://itunes.apple.com/us/reviews/id397588287,9.1.267,3,Poor feed algorithm,"Deleting app because it doesn’t afford for the feed to be set to “most recent” like I can on a desk/laptop. In general, there should be refined controls to adjust the types of posts you see from a person/business you follow. I.e. I am interested in seeing business updates/article posts from a company but don’t want my feed inundated with the myriad of random peoples “So happy to announce I’ve accepted a job with [said company]..!” posts that same company has “liked”",https://itunes.apple.com/us/review?id=288429040&type=Purple%20Software,2022-05-08T09:58:22-07:00
7444961006,Steel Drums,https://itunes.apple.com/us/reviews/id109486849,9.1.224,1,Notifications no longer working,"For the last several weeks, after I set my iOS settings for LinkedIn to send all notifications directly to Notification Center (no Banners, no Lock Screen) and with no sounds or badges, ALL of LinkedIn’s push notifications ceased on my iPhone [And they are correctly turned on in LinkedIn app settings]. The Developer responded inside the App Store app - with a short link that I can neither copy into a browser nor click. The problem is still not solved. But if they don’t want to give me reason to go into this app, that just gives me more free time 👍.",https://itunes.apple.com/us/review?id=288429040&type=Purple%20Software,2021-06-09T06:50:04-07:00
2370945066,Historyguy00,https://itunes.apple.com/us/reviews/id85197358,9.1.72,3,More upload options,"As oppose to just being able to upload media ( projects, presentations, and such) there should be an option on both the desktop and mobile platforms to upload a full resume. I work with the federal government and my resume does not fit into your little blocks. Users should be able to upload a word or pdf document of their resume for recruiters to look at. This will make it better for the job seekers as well as the hiring officials.",https://itunes.apple.com/us/review?id=288429040&type=Purple%20Software,2018-04-01T05:16:17-07:00
2669645533,strykercgi,https://itunes.apple.com/us/reviews/id41168102,9.1.83,2,Spammy,"I appreciate the networking opportunities, but it's gotten so spammy. I don't need a 5+ minute checkup on why I'm using the app, what additional career changes I might have had, what LinkedIn celebrities I want to follow, and who else I might know every time I use the app. It's out of hand!

The website is the same. If you add or accept a friend request it forwards you to another dead-end page asking you to add 50 more friends. No, I don't want to do that, I want to accept a friend and get to my feed.

People don't want to be spammed out of their minds on a professional social network; it's unprofessional.",https://itunes.apple.com/us/review?id=288429040&type=Purple%20Software,2018-06-09T22:03:00-07:00
2379709852,Chuckles324,https://itunes.apple.com/us/reviews/id145692037,9.1.72,1,Bugs need to be fixed ASAP,"This app used to work great until the most recent update 5 days ago. I am currently running iOS 11.3 and have the app up to date. But every time I receive a notification and go to the app to check it out, the app will crash as soon as I touch to view what new comment was left on my post or article. If I delete the app and re-install it, it will work for me to view the notifications one time. Then next time I go into the app to view my notifications, it will crash again. No one has time to delete and re-install the app every time they need to view the notifications.",https://itunes.apple.com/us/review?id=288429040&type=Purple%20Software,2018-04-03T11:19:07-07:00
6971070235,JJWhite1975,https://itunes.apple.com/us/reviews/id290941062,9.1.206,2,Don’t like the forceful downloads,"I personally do no appreciate any app, biz or website that forces you to download. All I wanted to do was change a setting on my linked in profile to remove that in open to job openings and it forced me to download to do that on my phone if I wanted to change it on a mobile device. When a company does that it feels like entrapment and that they want that access to the information and stats they pull from your phone to their app. I immediately removed it. It may not matter to others but I feel it’s pretty sketchy.",https://itunes.apple.com/us/review?id=288429040&type=Purple%20Software,2021-02-08T14:34:35-07:00
10651579923,Jester Jake,https://itunes.apple.com/us/reviews/id163640254,9.1.344,1,Latest Update Broke Everything,"I was logged in -  but the recent update logged me out. No big deal. But now the app will not let me sign in. It thinks I haven’t downloaded the app, takes me to the App Store, I sign in, and it takes me back to the App Store to download the app. I’m ALREADY using the app to sign in - and it wants me to download it again? I click to open the app once I’m in the App Store (because I have already downloaded it) and it asks me to sign in once the app is open. Once I do - it sends me back to the App Store to download something that is already on my phone. I am stuck in an endless loop.",https://itunes.apple.com/us/review?id=288429040&type=Purple%20Software,2023-12-02T20:22:12-07:00
8979807265,MitraA42,https://itunes.apple.com/us/reviews/id123017021,9.1.281,1,Confusing and incomplete,"Confusing interface designed to get you to send (spam) email to people not already on LinkedIn. * Imports contacts into Linkedin but doesn’t give you a way to see just which of those aren’t on linkedIn without throwing other random people into the list. * Won’t let you import contacts from LinkedIn to AddressBook - for that you need 3rd party apps. Ironic that a site that makes such a big deal about protecting privacy generates more incoming spam for me than just about anything else, and now using its app I see why, (I just sent some unintentionally).",https://itunes.apple.com/us/review?id=288429040&type=Purple%20Software,2022-08-14T20:22:48-07:00
3974601312,Luisito1984,https://itunes.apple.com/us/reviews/id124747885,9.1.126,1,Unnecessary security check,"I have tried to log in several times from the app itself, but every time I log in it takes me to a security page when I have to verify I am not a robot. Then after I pass with a 100% accuracy it takes me to another unnecessary step in which they have to send a security link to my email, then I will open this email with the SECURITY CHECK  which it will take me to the mobile site which I don’t need to be taken to. Then i will go back to the app, and try to log in ONCE AGAIN, and guess what?...............it freaking happens again. Software Team please address this and fix it.",https://itunes.apple.com/us/review?id=288429040&type=Purple%20Software,2019-04-05T16:11:57-07:00