id,userName,userUrl,version,score,title,text,url,updated
10686457697,180,https://itunes.apple.com/us/reviews/id31842529,2023.48.0,5,Top Notch,I hate this app. My favorite parts of Reddit are 1) the reposts to different communities so I get to see the same posts all the time for days to weeks at a time 2) all the different rules each subreddits has which delete my posts/comments after I post it because I didn’t follow the niche rules of the subreddit. I find this to be really engaging and make me want yo use Reddit more. 3)the bots that downvote real user posts/comments and upvote their own accounts. Reddit feels very fake this days. What was once a community allowing you to interact with other people has turned into a structured community that deletes everything outside its agenda. These changes have opened the door for AI to fill the void of real users leaving Reddit.,https://itunes.apple.com/us/review?id=1064216828&type=Purple%20Software,2023-12-12T09:06:16-07:00
10252884987,WebGem2002,https://itunes.apple.com/us/reviews/id684276503,2023.31.0,5,The Good Part of the Internet,"Yes, there are bad aspects of Reddit that many memes like fun at, but overall this is a good corner of the internet, especially subreddits pertaining to human struggles such as pornography, loneliness, and more. It’s what the internet was made for; to allow humans to connect with fellow humans across the globe and share in our suffering. To be heard. To connect with people who understand your struggles. It brings a tear to my eye. Just this morning I was reading posts  from fellow college students petrified about leaving for college in a few days. I feel the same exact way, yet I have not spoken to a single person in my life about it. They just don’t get it. But the people on Reddit do. It’s a great blessing if used in this way ❤️",https://itunes.apple.com/us/review?id=1064216828&type=Purple%20Software,2023-08-13T06:13:11-07:00
7918733687,ray is that you,https://itunes.apple.com/us/reviews/id496016028,2021.40.0,5,Underground community is a hidden gem,"I have to praise the people more than the app itself. You know there’s not a lot of apps like this with a community that can be so embarrassing but so many people come to this app anyway and you come across really interesting people who know how to get their point across, make you laugh, teach you something new, help you, support you, etc. all kinds of people are to be found here. And I’d say the community overall is great because of that. Reddit in itself is a good app and not difficult to navigate unless you’re just starting (give it time in that case) but the real treasure is the friends we made along the way. As long as Reddit has this community then it’s a 5 stars for me.",https://itunes.apple.com/us/review?id=1064216828&type=Purple%20Software,2021-10-15T15:49:02-07:00
10014185322,Matt Robertson,https://itunes.apple.com/us/reviews/id37351215,2023.22.0,1,"Disappointing, Buggy, and Killing Third-Party Gems - Skip the Official Reddit App!","The official Reddit app is an immense disappointment. It's riddled with bugs, frequently crashes, and falls far short of the superior functionality offered by third-party apps. Adding insult to injury, Reddit is actively phasing out the very apps that provide a better user experience. The app's clunky interface and limited customization options make navigating a hassle, while the lack of advanced features leaves much to be desired.

To make matters worse, the official Reddit app lacks the smoothness and intuitive design that make third-party apps shine. It feels like a step backward in terms of user experience. With Reddit's decision to stifle the competition, it's clear that they prioritize control over user satisfaction. Save yourself the frustration and seek out one of the many third-party Reddit apps that offer a superior browsing experience without the bugs, crashes, and limitations imposed by the official app.",https://itunes.apple.com/us/review?id=1064216828&type=Purple%20Software,2023-06-08T20:31:39-07:00
9377443483,Lordenki40,https://itunes.apple.com/us/reviews/id158907473,2022.45.0,1,"It’s better in my browser, but still bad",You wanted to force me to get the app and here I am. A new low that I can’t watch PG videos on your webpage. You try to force me into your app. Medical questions marked as NSFW can’t be viewed unless I use your awful advertisement ridden app. Nah bro. I see all of these people in the reviews complain about censorship and I wonder what truly awful things they wrongly believe they have a right to say. There is almost no moderation from Reddit itself. I have reported undeniable goose stepping racism and 4Chan wannabe Reddit says it doesn’t violate their hate speech rules. Individual communities are your only hope for actual moderation. I guess that’s what all the boohooing hate spewing cuckservatives are mad about. So funny they say everything is an echo chamber that doesn’t want to echo their opinion. Reddit is a neckbeard’s paradise. It’s the last sinking ship in the death of social media and a great example of how corporatism and capitalism has ruined the internet.,https://itunes.apple.com/us/review?id=1064216828&type=Purple%20Software,2022-12-09T05:50:19-07:00
6538311761,Xiagax,https://itunes.apple.com/us/reviews/id476586413,2020.39.0,5,Tired of the liberal bias,"I use reddit regularly and it can be a good place to share memes and enjoy specific communities. However I’m quite tired liberal bias with this site. The app just updated change its logo back to its normal orange after months of it being black to support Black Lives Matter. While I believe that Black lives DO matter, the organization BLM is nothing but a hateful organization tearing down anything they perceive to be racist when it’s not. It’s so ridiculous that a company doesn’t research the core values of an organization. George Floyd was not a hero, he was a career criminal. And celebrating him through update notes is disgusting. Seriously Reddit, get your head on straight and stop giving these hateful organizations your support.",https://itunes.apple.com/us/review?id=1064216828&type=Purple%20Software,2020-10-15T09:55:45-07:00
4468409796,RainyCrap,https://itunes.apple.com/us/reviews/id534701099,4.38.0,3,"Great social networking app, just one little irk","Reddit is a very diverse and good app for a vast mix of different topics and people. You download it, make an account if you feel like it, and find the communities that appeal to you. I enjoyed Reddit a lot because I could post questions and get answers from different people, I could also throw in my opinions and advice. 

The only problem I really have with it is that I have to wait so long between comments. Once I comment on something, I can’t just move onto the next thing. I have to wait at least 8 minutes before I can say anything. I understand the worry about spam, it is completely understandable, but it would be nicer if I could post 4 or 5 comments/questions before getting restricted.

Otherwise, this is a nice community and wonderful place to answer/ask questions or make statements. I hope Reddit continues to improve.",https://itunes.apple.com/us/review?id=1064216828&type=Purple%20Software,2019-07-15T22:29:47-07:00
10511726742,ThisIsBa,https://itunes.apple.com/us/reviews/id75000057,2023.42.0,1,How do you replace talent? Just kill the competition!,"This buggy app is a miserable experience to use. It poorly adjusts to mini screen sizes, text fields everywhere are buggy, touch targets are unintuitive. It feels like a corporate afterthought. Which is a shame because a year ago, Reddit had some of the best social media apps ever. Because they were made by people who care. Rather than keep up, Reddit just killed those apps and now we’re stuck with the literal worst Reddit experience on the internet. Thank you spez for ruining everything you touch! Especially when what you’re ruining isn’t something YOU built. It’s what your COMMUNITY built.

Edit: it keeps getting worse! The new update removes the capability to get notifications IN APP based on your iOS settings. You’re literally not allowed to get notifications unless you allow Reddit to spam your Notification Center. One more example of how this app is designed for Spez and not users.",https://itunes.apple.com/us/review?id=1064216828&type=Purple%20Software,2023-10-24T14:38:01-07:00
10182000918,Yogurt1234567,https://itunes.apple.com/us/reviews/id395580200,2023.29.0,2,This is just garbage,"Do you want to open this comment in the Reddit app? Where we will take you to the Home Screen and not what you were looking for? HELPFUL. How about we put up a video that for some reason you can’t back out of and have to close the app, that’s a cool feature. And then when you log back in, randomly and without reason you’re going to ONLY see Pokémon cards, Pokémon card fakes, Pokémon card values, and every other card out there? Isn’t that great?! Every single post a different Pokémon card game community. And when you mute those communities and re-open the app we will just select one of the other thousand Pokémon trading card game communities. Isn’t that a fantastic algorithm? 

I saw one Pokémon post go by me and was interested to see what the story was. I didn’t like it, I didn’t do anything more. Somehow that’s all the home screen will show me now. It’s mind-boggling.",https://itunes.apple.com/us/review?id=1064216828&type=Purple%20Software,2023-07-25T17:15:07-07:00
8476360469,reyrosa,https://itunes.apple.com/us/reviews/id40665696,2022.10.0,1,I’d give it zero stars if I could,"This app used to be great. However, they changed the UI a couple of versions ago and now you can’t access the community list. When I open the list, it looks like that communities are loading, but after a short while, I receive an error that tells me the communities can’t be loaded. This bug pretty much makes the app useless. I’ve pointed this out on the Mobile Reddit subreddit, but have heard nothing back from the developers.

What’s annoying about this is that this isn’t the first time they’ve tried out this UI. They’ve tried using it in previous versions, but always wound up going back to the old UI, which worked. I don’t know why they’re trying to use this buggy version of the app again. This is one of those times where the old saying, “If it ain’t broke, don’t fix it” applies.

Save yourself the trouble and skip the app until they can work out all the issues.",https://itunes.apple.com/us/review?id=1064216828&type=Purple%20Software,2022-03-20T06:47:43-07:00
2930930340,Bignlo,https://itunes.apple.com/us/reviews/id191386197,4.14.0,5,"Below average app, very clunky and lots of bugs","Reddit is an incredible platform on which to discuss media/entertainment/information, but this app is pretty poorly built in my honest opinion. There are often bugs I come across in my everyday use, and makes it difficult to use. For instance, the hyperlinks within the app that link to another reddit page open in the “Reddit browser” rather than just opening themselves within the app, and makes it difficult to follow multiple mappings of links. Finally, I notice the front page often bugging out and being unable to refresh itself despite having a strong internet connection and no other issues. Please fix these very blatant errors and I’d be more than happy to give 5 stars.",https://itunes.apple.com/us/review?id=1064216828&type=Purple%20Software,2018-07-18T14:16:00-07:00
6454065579,Sir Bigglesworth,https://itunes.apple.com/us/reviews/id100523653,2020.35.0,2,Sad,"Most moderators of reddit seem very-much to be biased, ignorant, uninformed/uneducated, and just plain disheartening people.  If reddit moderators could remove themselves from the idea of being arbitrators of morality and just allow people to talk and share their thoughts and ideas (differing ideas are good, - damning people’s ideas/posts because they’re different than yours/what has been deemed as “acceptable” when there’s actually nothing wrong with the idea except that it’s different than yours/is not deemed “acceptable,” is horrible) then the idea of Reddit could continue to enjoy it’s success and avoid withering away on the vine.

Keep Reddit and it’s potential pure,  avoid any role in ‘political’ moderation and only screen for statements that are TRULY hate-filled (not just different from your views).  There CAN be the complete absence of hate or anything along those lines while simultaneously having differing ideas/viewpoints - just think about it for a bit.",https://itunes.apple.com/us/review?id=1064216828&type=Purple%20Software,2020-09-21T14:35:26-07:00
5652978006,Bjbraboy,https://itunes.apple.com/us/reviews/id1113993478,2020.8.1,5,Reddit Everything!!!! 🥳👌🏾😍,"Have you ever heard someone say the term “I read it on Reddit”. That’s me since I started using Reddit at the beginning of the year. Originally I got it in 2017 and didn’t truly understand how it worked. I redone loaded the app because I wanted to increase my motivation /get better mental health with a likeminded group of people AWAY from standard social media and this app DELIVERED and more. I get everything I want. I can be entertained and learn something in the same feed and I actually LOVE what I see EVERY time. I have no regrets. I love Reddit. They have a channel for everything and the people are (usually) really supportive, informative and hilarious. I love that I can go there to interact with real people all over the world and it’s not weird. I love it. 10/10 recommend!",https://itunes.apple.com/us/review?id=1064216828&type=Purple%20Software,2020-03-12T20:49:20-07:00
10057298690,MattBDev,https://itunes.apple.com/us/reviews/id485099246,2023.24.0,3,Terrible admins but great content,"The Reddit app leaves much to be desired in 2023. The ads have significantly increased over the years. Moderation tools are still very poor in the app compared to third-party apps such as Apollo. The app is also not very accessible.
The Reddit CEO and other admins seem to be ignoring users, moderators, and developers in order to make a profit. They are changing the API terms and pricing in a way that will kill third-party apps and make this app the only way to access Reddit on iOS devices. They are saying one thing in public but another in private. In addition they are trying to remove mods in the biggest communities on Reddit.
Other than the big issues with the app and admins, the content on Reddit is always great and I have found a bunch of communities to join. I also enjoy the news feed option in the app.",https://itunes.apple.com/us/review?id=1064216828&type=Purple%20Software,2023-06-21T08:07:47-07:00
10009299587,Disappointed app user 9999,https://itunes.apple.com/us/reviews/id474076978,2023.22.0,1,Reddit is a disgusting company,"The fools in suits over at Reddit have decided that they think they’re so so smart and want to price out fair competition to their horrible app experience. For everyone that doesn’t know, they are trying to charge over $100,000 a year (for popular third party apps like Apollo here on the App Store) because they themselves can’t fathom making an app that the people who rakes the money in for them to actually want to use this ugly as sin and frankly useless app. I highly recommend you try Apollo or any other third part app that catches your eye so you can see how predatory Reddit is being. Having options is never a bad thing, and I find it hilarious that Reddit is acting like a little child and just saying, “No. you can’t make an app better than our app. That’s not fair! :(“ instead of just acknowledging the better app and working to make their app better. Grow up! Big babies in suits trying to act like adults.",https://itunes.apple.com/us/review?id=1064216828&type=Purple%20Software,2023-06-07T09:49:40-07:00
9167470898,Don jefe 777,https://itunes.apple.com/us/reviews/id887696640,2022.37.0,2,Easily banned and downvoted for having an opinion,"While the app is good for keeping updates on a much of topics, music, artists, celebrities, relationship advice, or any other type of advice. You can get banned or downvoted for having a different opinion or saying something true that the group might now want to hear. Most groups are centered around uplifting women, women always being right and being victims, and not taking responsibility for themselves. There’s was a question a user asked do I deserve this. I said yes and got banned. I didn’t insult the person or anything.
Don’t ever talk back to an OP saying something isn’t fair. The majority of users are just immature people who go on the app to get support from strangers because they don’t have any real support in the real world. Remember Reddit is an online world so it does get better weird on there. It best to stay anomalous and not to feed into an argument.",https://itunes.apple.com/us/review?id=1064216828&type=Purple%20Software,2022-10-09T08:25:33-07:00
8366244352,pukyvito,https://itunes.apple.com/us/reviews/id389116653,2022.06.0,3,Something is wrong with whatever you guys did with the last update,"Alright, there’s something wrong with how the app is behaving since recently. I ove Reddit and the app has never been an issue for me. The iPad app has been, however, giving me a ton of issues when it comes to watching videos. I tap on a video on my feed and the video will go full screen with no way to be able to see the comments unless I swipe to go back to the feed. If I tap the comments section, it won’t show them at all and will do the whole full screen video all over again. This is super frustrating and is killing the experience to the point I might as well just open reddit on Safari.
Not sure what went wrong. I’ll gladly fix my rating once this issue is fixed. Until then, I’ll use a browser.",https://itunes.apple.com/us/review?id=1064216828&type=Purple%20Software,2022-02-17T09:08:57-07:00
6229440519,appleororanges,https://itunes.apple.com/us/reviews/id437365250,2020.26.1,1,Censorship,"This app is terrible for free speech. Do not use reddit if you want to talk about anything different from the mainstream narrative. Orange man bad, BLM, abortion good, transgender children good, LGBTQ+ good, etc. are the only opinions allowed on this app. You can get banned from subreddits you’ve never been on because the moderator of them doesn’t like your political stance, it’s ridiculous. You also can’t support the Hong Kong protesters or talk negatively about China in any way because daddy spez got funded by them.

It has good communities for games that have nothing to do with politics or social issues, e.g., Minecraft or DND, but it’s an awful place for trying to have a civil debate with someone. Most likely any attempt at civil discussion with the users of this platform will end up with you getting called a bigot, homophobe, transphobe, etc. or even banned from the subreddit if a moderator doesn’t like your beliefs.

The bottom line is: do not get this app or use this platform unless you don’t care about your opinions being censored.",https://itunes.apple.com/us/review?id=1064216828&type=Purple%20Software,2020-07-22T13:19:22-07:00
9108344388,Freshest76mix$$,https://itunes.apple.com/us/reviews/id132657266,2022.35.0,5,Scam notifications,"Love Reddit, but why rely on scam notifications for click bait and juicing app open numbers? With notifications on, I get a permanent fake notification count on my Home Screen. As soon as I open the app I realize there are no actual notifications. It’s frustrating because when I actually want notifications I can’t tell. It’s especially bad with chat. Once I turned notis on for chat, I now have a permanent red dot on the chat icon that never goes away. You therefore still have to manually check for new chats repeatedly because the actual notification dot is fake. It makes me feel like the only reason for this is to goose the usage numbers, not provide actual value.",https://itunes.apple.com/us/review?id=1064216828&type=Purple%20Software,2022-09-21T16:52:57-07:00
3933568514,A disatisfied user,https://itunes.apple.com/us/reviews/id723396573,4.30.0,2,Performance of the App,"Recently, the reddit app has been lagging, which greatly affects the performance of my phone and other apps I would be using at the time (like listening to music.) The app has greatly escalated in terms of uselessness where it would not load under wifi (reddit on browser is unaffected under the same wifi), lag out my other apps causing my phone to lag, force closing the app somehow makes my phone laggy and the app reappears to not be closed after the lag disappears, despite the app not connecting/reloading I am able to access specific subreddit but I can't see the front page which is very weird, and overall a frustrating experience. I do not know what is wrong nor do I think the problem resides in my phone as the other apps work well and does not lag/ does all of the problems that reddit app has given me. I hope this will review assists further improvements on the reddit app.",https://itunes.apple.com/us/review?id=1064216828&type=Purple%20Software,2019-03-27T09:04:23-07:00
10229045359,nropAddict,https://itunes.apple.com/us/reviews/id599023780,2023.30.0,1,Awful community,"Reddit is an app that is bad for your mental health. You ask meaningful questions and all you get are downvotes and snarky replies. You are rewarded by the community for saying things you might not necessarily agree with or believe and and you are ostracized by the community for genuinely wanting help with something, asking a question that you can’t find an answer to on google, among other stuff. It makes you not even want to participate in community discussions. Even though my opinion is unpopular and meaningless, i will not be using reddit ever again unless the downvote part of the karma system is completely removed and i have the ability to delete comments. Sure if I’m talking about something that’s a hot take and i can expect differing opinions that’s all good. But if I’m asking a question that is meaningful and would not only help me but help others I’d rather not be ostracized for even asking the question to begin with.",https://itunes.apple.com/us/review?id=1064216828&type=Purple%20Software,2023-08-07T01:35:42-07:00
9987856625,Prash1912,https://itunes.apple.com/us/reviews/id203592622,2023.21.0,1,Unintuitive and poorly designed app filled with deceptive ads,"With the recent news that Reddit is killing third party apps, I decided to check out their official app and then I remembered why I hated it in the first place. Moving beyond the interface, which could have only been designed by elementary school level app designers (seriously Reddit, those designers need to be fired. They’re stealing a living and your post IPO investors will not be happy), the app interweaves advertising between posts, disguising them as another post. While you can catch these on closer inspection, I do feel like a dirty trick was pulled on me.

Reddit exists as a social media because it’s convenient, you network with who you want and once you’re done with a community, you can just move on - no strings attached. I would happily drop Reddit, as I’m just another anonymous guy on the internet here, if I’m forced to use this garbage app.

Good luck on your speed run to Twittering yourself.",https://itunes.apple.com/us/review?id=1064216828&type=Purple%20Software,2023-06-01T07:06:20-07:00
5962878769,3koolboys,https://itunes.apple.com/us/reviews/id32174546,2020.17.0,5,A story of reddit,One day in my future you are going to read this and by then the war between revenge of the Sith (which by now is the United States national movie) and the original trilogy. All the odds were against r/prequelmemes (the army of the prequels (revenge of the Sith)) 3 movies to 1 but what the OTs (original trilogy) didn’t know is the power of r/prequelmemes was beyond theirs. Though the OT aided r/prequelmemes in their battle against avengers endgame (which we came out victorious) r/prequelmemes needed to fight back against the OT because they had surrounded us but since we were r/prequelmemes we knew the power of cloning we had cloned ourselfs and overwhelmed the OT coming out on top. What I’m trying to say is the war between r/prequelmemes and the OT was won by us due to reddit. (PS the future may very depending on Russia’s actions.),https://itunes.apple.com/us/review?id=1064216828&type=Purple%20Software,2020-05-18T14:54:10-07:00
6353123886,pumom11,https://itunes.apple.com/us/reviews/id300871806,2020.31.1,1,Always lose where I was in a sub,"I used to read my favorite subs on my phone in the browser, sort by top post of all time and start reading one by one. And the browser of course always remembers where I am in the sub so I can go back to it later and just continue reading where I left off.

Now I HAVE to install the app to read reddit subs on my phone and the app always resets my position in the sub so the next time I open the app I am just on the homepage so I have to again look for the sub I was reading, sort the posts and scroll forever to try and find where I was. Not to mention sometimes I leave the app while I’m inside a post and still the next time I open the app I’m on the homepage so I don’t even know which post I was reading. This is a ridiculously bad experience for an app whose primary purpose is reading!!! Imagine if every time you open a book you’re reading you have to start from the beginning and look for the page you were on. Insane.",https://itunes.apple.com/us/review?id=1064216828&type=Purple%20Software,2020-08-23T12:00:28-07:00
