id,userName,userUrl,version,score,title,text,url,updated
10089747920,renegadesoundsystem,https://itunes.apple.com/us/reviews/id103442069,2023.25.0,1,Each update strips away the features that make the app functional,"Over the past couple years, the official app has downgraded to a husk of its former self.  It has become more and more difficult to navigate even with settings changes.  The news tab can no longer be categorized, multireddits and custom feeds are tucked away in hard to find areas within the app.

And worst of all, the home page is can no longer be set to any style of sorting.  No “best”, no “hot”, no customizable “top”.  It is all randomized, and pulling down to refresh the page just shuffles all posts at random.  It is almost as if those in charge just want to tank their own app as much as the third party apps.

They have given no intention to undo the problematic changes and are putting in zero effort to make any worthwhile improvements.  And the company’s handling of the API changes and their dismissiveness towards 3rd party apps and moderators is very poor",https://itunes.apple.com/us/review?id=1064216828&type=Purple%20Software,2023-06-30T12:28:34-07:00
4903125955,gsriikkkkkkoooooooooooooooo,https://itunes.apple.com/us/reviews/id212094068,4.43.1,5,"Best social media, worst social media.","I deleted all the apps, Instagram, Twitter, Facebook, you know. The ones where everyone is always arguing and are entirely drama and click ran. I was immediately happier checking it through Safari occasionally to check on friends and not having to look at it constantly. But alas, a life without media is almost impossible in this day and age. I downloaded this app, where you curate the exact kind of content you want to see, you unsub to what begins to annoy you, find something new every day. You sort it by “top,” “hot,” or “new” and the like. It’s amazing. Pure entertainment, some thoughtful discussion, some trolling, but an overall lighter experience than what you find through other media experiences. A great app.",https://itunes.apple.com/us/review?id=1064216828&type=Purple%20Software,2019-10-06T22:46:14-07:00
6856471289,Proteus846,https://itunes.apple.com/us/reviews/id40211277,2020.48.0,3,Cannot comment when using external keyboard,"When an external keyboard is connected to my iPad (I’m using the Smart Keyboard case for the 12.9” iPad Pro) the on-screen touch target for sending a reply is hidden beneath the touch target to scroll down through comments. In order to submit what I’ve typed, I need to undock my iPad or use the slim banner at the bottom of the screen to either switch to the on-screen keyboard or exit typing mode in order to be able to tap the reply touch target.

Other than that, the only problems with this app are issues with Reddit itself, which are not directly applicable to the app. Most of those are caused by the community, which shouldn’t surprise anyone. Other than the aforementioned keyboard issue, I don’t recall having any issues with the app that are specific to the app itself and not Reddit as a whole.",https://itunes.apple.com/us/review?id=1064216828&type=Purple%20Software,2021-01-11T02:11:01-07:00
5996499952,TheEpic Grizly,https://itunes.apple.com/us/reviews/id329630632,2020.17.0,3,It’s okay.,"I had my account and was gaining a fair amount of subs. One day I went to do my daily uploads and I was logged out. I tried using my password but couldn’t get it to work so I tried resetting it. I reset the password and tried using the new password and it was still saying wrong password. So I contacted support and never received an email back. I’m very displeased with how there system treats a password reset. I should of at least got a response by now. I’ve also tried resetting the password after contacting them and completely did something different with no luck. I would not recommend reddit because I can’t access my account. Besides that the app works great that’s why they get 3 out of 5 stars. But if you have the chance to loosing your account what’s the point of spending 100 days posting, so you can just loose everything...",https://itunes.apple.com/us/review?id=1064216828&type=Purple%20Software,2020-05-26T07:36:37-07:00