id,userName,userUrl,version,score,title,text,url,updated
10856286971,jenkweb,https://itunes.apple.com/us/reviews/id17026064,6.8.3,1,Authenticator needs authenticator to authenticate with authenticator,You need authenticator to authenticate authenticator but authenticator is not authenticated so stuck in an authetication loop the developers never bothered to test. Broken.,https://itunes.apple.com/us/review?id=983156458&type=Purple%20Software,2024-01-23T13:56:52-07:00
10853398041,Snb444444,https://itunes.apple.com/us/reviews/id1425335694,6.8.3,1,Terrible app,I got a new phone and I am not longer able to access my email because Authenticator won’t let me log in. There’s no way around this and Microsoft has truly given no assistance to this issue that many seem to face. Should have a better recovery plan. Very disappointed,https://itunes.apple.com/us/review?id=983156458&type=Purple%20Software,2024-01-22T19:21:05-07:00
10852700135,NameTaken!,https://itunes.apple.com/us/reviews/id456222624,6.8.3,3,Restoring Work Accounts,Need a better way to restore work accounts,https://itunes.apple.com/us/review?id=983156458&type=Purple%20Software,2024-01-22T14:33:33-07:00
10851705617,abbbnnn1,https://itunes.apple.com/us/reviews/id1616511554,6.8.3,1,doesn’t work,"I need authenticator for every aspect of college. I cant even access my email without it so i cant ask anyone for help. My old phone broke so i got a new one. Tried signing in.  Tells me i need a code from the authenticator app, in order to sign into the authenticator.  This is obviously impossible.  It says use other options so i try that, but the two other options are to 1. use the authenticator and 2. use a code from the authenticator.   Why cant there just be an option to send the code to my phone number or something?",https://itunes.apple.com/us/review?id=983156458&type=Purple%20Software,2024-01-22T08:25:00-07:00
10851238802,wilbe04,https://itunes.apple.com/us/reviews/id1016504739,6.8.3,1,This is so useless,Not working ando I can access to my university account,https://itunes.apple.com/us/review?id=983156458&type=Purple%20Software,2024-01-22T06:00:45-07:00
10848323786,Jackiekmoon,https://itunes.apple.com/us/reviews/id20953944,6.8.3,1,Horrible App,This App is horrible and has causes so much stress. My Microsoft email constantly signs me out and makes me us the authenticated. The catch is it opens the authenticated app and shows a number and tells me to open my authenticated app to enter it. This makes no sense since I’m already in the authenticated app! I have seen many forums where this happens to people and they can not use it. Most of the positive reviews on here must be fake.,https://itunes.apple.com/us/review?id=983156458&type=Purple%20Software,2024-01-21T10:45:19-07:00
10845985351,Soon-to-be-pilot,https://itunes.apple.com/us/reviews/id159416609,6.8.3,1,STOP Asking for Autofill,"The “skip” button is not functioning and wont allow you to pass.  

Fix this",https://itunes.apple.com/us/review?id=983156458&type=Purple%20Software,2024-01-20T21:18:26-07:00
10844858358,tai232;,https://itunes.apple.com/us/reviews/id824063498,6.8.3,1,Haven’t been able to access my email??,"After I was logged out from my email on all my devices, I was told to download authenticator to put in a access code. Not only does it not give me somewhere to even put a code, it even tells me to open authenticator app WHILE in the app??",https://itunes.apple.com/us/review?id=983156458&type=Purple%20Software,2024-01-20T13:59:42-07:00
10844541443,tfailauga,https://itunes.apple.com/us/reviews/id442458586,6.8.3,1,bugging out,not working with my new iphone,https://itunes.apple.com/us/review?id=983156458&type=Purple%20Software,2024-01-20T12:01:23-07:00
10844240533,Noooooshhsuah,https://itunes.apple.com/us/reviews/id467490502,6.8.3,1,Doesn’t work,Will send the code on the app and tells you to open the app and input the code. Very useless and can’t login,https://itunes.apple.com/us/review?id=983156458&type=Purple%20Software,2024-01-20T10:20:01-07:00
10842909646,Sam0ooo1998,https://itunes.apple.com/us/reviews/id1508969706,6.8.3,1,Can’t login,"It takes me to the Authenticator app and then says to open the Authenticator app and enter the code shown, but, I’m already in the app and I can’t type anywhere. Just frustrating, hopefully it’ll get fixed",https://itunes.apple.com/us/review?id=983156458&type=Purple%20Software,2024-01-20T03:34:33-07:00
10841637653,smirf88,https://itunes.apple.com/us/reviews/id310161772,6.8.3,1,Horrible,"It sends a code to my phone. I enter that code on the same phone and click “yes it’s me”. Can repeat that scenario again and again with each new code it sends over and over, and it still won’t let me into my account. It does not seem  to recognize the  codes it sent as being legit. Bizarre that this is an app from Microsoft, the richest company on the planet, and yet is so awful.",https://itunes.apple.com/us/review?id=983156458&type=Purple%20Software,2024-01-19T18:49:40-07:00
10841577726,.*Legend.*,https://itunes.apple.com/us/reviews/id882374800,6.8.3,1,Faulty recovery loop,"Got a new phone and when I try to reconnect to the app it needs to verify my sign in again…through the app. What kind of chicanery is this design?!? My phone cannot have 2 Authenticator screens open at once, so I cannot recover anything with this stupid construct.

My start to 2024 has been ruined, and I don’t know a way around it. There probably is a solution, but everything in the app leads me to the same dead-ends. What an F’ing joke.",https://itunes.apple.com/us/review?id=983156458&type=Purple%20Software,2024-01-19T18:26:15-07:00
10839831497,大胃王7683,https://itunes.apple.com/us/reviews/id1524370920,6.8.3,5,很好,很好很强大,https://itunes.apple.com/us/review?id=983156458&type=Purple%20Software,2024-01-19T07:30:35-07:00
10838007741,jheller3156,https://itunes.apple.com/us/reviews/id581545844,6.8.3,1,Dont get a new phone,If you use the app regularly dont get a new phone it wont work no matter how many fixes you try and the verification is horrible because if i can you my authenticator app why is the only other option to get another code from the authenticator app which you cannot use,https://itunes.apple.com/us/review?id=983156458&type=Purple%20Software,2024-01-18T19:39:57-07:00
10837948770,MollBryy,https://itunes.apple.com/us/reviews/id1338319394,6.8.3,1,Useless app,"I need this app to log into my college email but the it literally refuses to work. I don’t receive a notification to enter a number on the app or anything in that regard. There’s no verification code for me to use as an alternative. I can’t log into my Microsoft account through the app because I have to use the authenticator app to log onto the authenticator app but how can I do that when I’m literally logging onto via the same app. I’ve tried deleting my account, deleting the app, turning in notifications for the app etc. but nothing seems to work. Terrible app",https://itunes.apple.com/us/review?id=983156458&type=Purple%20Software,2024-01-18T19:14:54-07:00
10837657833,badappforme,https://itunes.apple.com/us/reviews/id450500293,6.8.3,1,TERRIBLE,this is the worst app i have ever used. it straight up tells me to open my authentication app WHILE IM IN THE AUTHENTICATION APP!!!!! HOW IS THIS POSSIBLE!!!!,https://itunes.apple.com/us/review?id=983156458&type=Purple%20Software,2024-01-18T17:14:04-07:00
10837140703,Docstens,https://itunes.apple.com/us/reviews/id30338786,6.8.3,1,It’s certainly secure…,"“Sign on to Office”….the Dreaded Words appear. 

Dutifully, I tap the designated spot. I am am to authenticate, with the ironically named Authenticator, you’ll understand the irony in a moment. A code is supplied, which I am to enter into Authenticator…except I am magically already in Authenticator. All I see is the code…with no place to enter it. It’s been like this since I’ve installed the thrice-damned app. Another call to the help desk, I guess.

Congratulations, Microsoft. You have made your products secure from being accessed….by everybody, including the account holder. Good job.

It’s easy if you have a second device, just open Authenticator there. But, I only have the one device; so I’m not worth Microsoft’s time.",https://itunes.apple.com/us/review?id=983156458&type=Purple%20Software,2024-01-18T13:33:13-07:00
10837018151,olivoarroba1803,https://itunes.apple.com/us/reviews/id115700062,6.8.3,2,It works fine until it doesn’t,"I’ve used Microsoft Authenticator for 3 years now without a problem. But it seems it underwent some facelifting and the new version LOST MY ACCOUNTS!! so now I’ve lost access to Microsoft accounts, and all the other accounts I had setup. 
Unacceptable error from Microsoft.",https://itunes.apple.com/us/review?id=983156458&type=Purple%20Software,2024-01-18T12:43:20-07:00
10836508293,Shawn Anthony Hollva,https://itunes.apple.com/us/reviews/id1518595688,6.8.3,5,Good work Spectrum,Ty Microsoft Bill Gates Smart Program  thanks for all the help for identifying me,https://itunes.apple.com/us/review?id=983156458&type=Purple%20Software,2024-01-18T09:28:42-07:00
10833549112,$hitshow,https://itunes.apple.com/us/reviews/id110093163,6.8.3,1,Horrible!,Horrible squared,https://itunes.apple.com/us/review?id=983156458&type=Purple%20Software,2024-01-17T13:55:53-07:00
10832930876,Avion Vector Cloud,https://itunes.apple.com/us/reviews/id1596648400,6.8.3,5,Well done,I think it’s great let’s pray it don’t go against me,https://itunes.apple.com/us/review?id=983156458&type=Purple%20Software,2024-01-17T09:55:28-07:00
10832674721,Coolout,https://itunes.apple.com/us/reviews/id37247155,6.8.3,1,HUGE bug - no longer usable,"So I try to get on Teams through my phone and Authenticator sends me a code *on its own app* and tells me to enter it in the app and of course there’s no way to enter a number where the number already is. So I try to do the phone authentication and it calls my phone and tells me I failed to answer correctly?? How the heck does one answer a phone “correctly” for this?  So I can just no longer use Teams on my phone for the rest of my life?! This is insane , which I guess sums MS up perfectly.",https://itunes.apple.com/us/review?id=983156458&type=Purple%20Software,2024-01-17T08:28:30-07:00
10832578930,Ashley G.😋😂,https://itunes.apple.com/us/reviews/id534216096,6.8.3,1,Annoying,This whole app is absolutely useless. Everytime I need the app to confirm the code it just doesn’t do it. Not to mention they make it incredibly difficult to access your accounts.,https://itunes.apple.com/us/review?id=983156458&type=Purple%20Software,2024-01-17T07:57:53-07:00
10832382085,Valor918,https://itunes.apple.com/us/reviews/id1023256555,6.8.3,3,Access denied,"I’ve been trying to access my email for college but in order for me to do so it’s asking for a pin that’ll pop up in the app, so I make sure that I’m signed in and go to check yet nothing comes through. I unadded and readded my email on the app to see if anything different and it requires on there as well the 6 digit code and I can’t access that unless I back out the current page.",https://itunes.apple.com/us/review?id=983156458&type=Purple%20Software,2024-01-17T06:55:47-07:00
10832306972,itzspider,https://itunes.apple.com/us/reviews/id262602453,6.8.3,1,Error account not found,I been having problems with one of my accounts receiving the code to log in. This is a business account and i been calling microsoft everyday to fix it but they keep telling me to wait 24 hours. I waited many days and still no call back and when i call them they give me the same answer to wait 24 hours. This is disrupting my business! HORRIBLE APP!,https://itunes.apple.com/us/review?id=983156458&type=Purple%20Software,2024-01-17T06:32:28-07:00
10831840899,,https://itunes.apple.com/us/reviews/id9386358,6.8.3,1,Yikes,Another Authenticator app because Google didn’t already have this figured out. When the app sends the push notification asking you to type in the one time password the box to enter hovers over and eclipses the one time password. Great UI,https://itunes.apple.com/us/review?id=983156458&type=Purple%20Software,2024-01-17T04:02:05-07:00
10830604132,IsabelleCuteHeart,https://itunes.apple.com/us/reviews/id1058131178,6.8.3,1,I use this app regularly and it only works 50% of the time,"I use this app for school for my school email and I’m only able to get verified 50% of the time, leaving me stranded the other 59% and even though I have a back up linked to my phone number I can’t always use my phone number and I don’t want to constantly change it this for it being buggy in sending authenticator requests is why I give it 1 star. I am extremely dissatisfied.",https://itunes.apple.com/us/review?id=983156458&type=Purple%20Software,2024-01-16T18:50:16-07:00
10830458467,Retrø-Ghøst,https://itunes.apple.com/us/reviews/id904625586,6.8.3,1,Software development,Poorly developed software,https://itunes.apple.com/us/review?id=983156458&type=Purple%20Software,2024-01-16T17:49:55-07:00
10829507213,TheLocalDr3amer,https://itunes.apple.com/us/reviews/id77007103,6.8.3,1,Horrible,This is a horrible app. I got a new phone a few months ago and I haven’t been able to access the app ever since. It’s makes it almost impossible to access my school account.,https://itunes.apple.com/us/review?id=983156458&type=Purple%20Software,2024-01-16T11:21:09-07:00
10829191957,withdrawallyourmoneyfrom,https://itunes.apple.com/us/reviews/id667761428,6.8.3,1,signed up by employer,"please Apple remove Microsoft Authenticator from the app store. it is mitm attacking users' work and school and personal accounts. people are not given a choice to use this app or to opt out of the very intrusive terms of service. Microsoft Authenticator does not improve security whatsoever, only annoy and harass millions of people several times every day",https://itunes.apple.com/us/review?id=983156458&type=Purple%20Software,2024-01-16T09:29:52-07:00
10829186766,Fabionond,https://itunes.apple.com/us/reviews/id1594603443,6.8.3,5,Muito bom,Utilizo bastante muito bom,https://itunes.apple.com/us/review?id=983156458&type=Purple%20Software,2024-01-16T09:28:07-07:00
10827417316,Johnpaw98,https://itunes.apple.com/us/reviews/id1270122546,6.8.3,1,Organization,God forbid your university uses this app and forces you to use something you don’t want to use. Then have the app lock you out and force you to sign in on the app.. oh wait you’re locked out of it!!,https://itunes.apple.com/us/review?id=983156458&type=Purple%20Software,2024-01-15T22:12:19-07:00
10826671700,RoyGlen,https://itunes.apple.com/us/reviews/id257735082,6.8.3,1,Authentication app is worthless,Have downloaded and installed many times. Freezes up every time. No help from Microsoft.,https://itunes.apple.com/us/review?id=983156458&type=Purple%20Software,2024-01-15T16:43:50-07:00
10826611827,Loveglowww,https://itunes.apple.com/us/reviews/id1501876812,6.8.3,1,App is terrible,This app is terrible. I’m trying to log into my work email that needs authentication and it sends a code to the authenticatior app but the app pops up a code as well and it’s not working at all.,https://itunes.apple.com/us/review?id=983156458&type=Purple%20Software,2024-01-15T16:18:29-07:00
10826506811,Mxbrown,https://itunes.apple.com/us/reviews/id143465382,6.8.3,1,Intrusion,I do not like how every piece of technology requires a download. My job asks me to check emails off duty then the “system” requires this download. Now another app has ALL my info for sale. There is no escaping the perpetual intrusion.,https://itunes.apple.com/us/review?id=983156458&type=Purple%20Software,2024-01-15T15:33:32-07:00
10826304483,Chrobrego,https://itunes.apple.com/us/reviews/id113884016,6.8.3,1,Never works reliably with my school district,"Since our county switched to Microsoft Authenticator to verify our teacher accounts, I’m no longer able to log in reliably at home — hit our miss at best.",https://itunes.apple.com/us/review?id=983156458&type=Purple%20Software,2024-01-15T14:08:30-07:00
10826010645,quacknana,https://itunes.apple.com/us/reviews/id1507200186,6.8.3,1,Frustrating,"This is so unnecessarily difficult to get rid off!!! I decided to unlink my account because of how many grievous steps it requires to simply let me sign in to my email, but now a strange loop has been created where I unlinked it yet it still asks me to use this stupid app!!! I click that I can’t use it to sign in at the moment, yet it still asks me to use the app?  Frustratingly too long of a process👎",https://itunes.apple.com/us/review?id=983156458&type=Purple%20Software,2024-01-15T12:15:43-07:00
10825552642,goldeneagle skyraisers,https://itunes.apple.com/us/reviews/id142951983,6.8.3,5,Ease-of-use,Very easy and straightforward to use. Saves a tremendous amount of time.very,https://itunes.apple.com/us/review?id=983156458&type=Purple%20Software,2024-01-15T09:38:15-07:00
10822738764,Khaslor,https://itunes.apple.com/us/reviews/id852723614,6.8.3,1,Don’t Prompt for Ratings,Please stop prompting for ratings. I’ll rate and review your app if I feel like it. The prompts are annoying.,https://itunes.apple.com/us/review?id=983156458&type=Purple%20Software,2024-01-14T15:01:07-07:00
10822030904,AETravel,https://itunes.apple.com/us/reviews/id48802797,6.8.3,5,Multi-Use Authenticator,"From Microsoft to student loans, this is a useful and easy authentication app.",https://itunes.apple.com/us/review?id=983156458&type=Purple%20Software,2024-01-14T10:36:22-07:00
10821776087,Yo626,https://itunes.apple.com/us/reviews/id424431012,6.8.3,5,Confused,It is so difficult to set these new systems up. You are also adding fees. I’m very disappointed and this is expensive.,https://itunes.apple.com/us/review?id=983156458&type=Purple%20Software,2024-01-14T09:13:53-07:00
10818663259,Har III,https://itunes.apple.com/us/reviews/id433657980,6.8.3,1,Not User Friendly,Not User Friendly,https://itunes.apple.com/us/review?id=983156458&type=Purple%20Software,2024-01-13T13:38:21-07:00
10818658137,YogiO1,https://itunes.apple.com/us/reviews/id1612629249,6.8.3,5,Great but,Great quick but it would be better if MS Authenticator was able to swap login from Android to IOS. I have to reconnect all of my logins in IOS again.,https://itunes.apple.com/us/review?id=983156458&type=Purple%20Software,2024-01-13T13:36:17-07:00
10818175486,Columbusohmm,https://itunes.apple.com/us/reviews/id239333230,6.8.3,1,Terrible verification,I had my cell phone number attached. I was sent a code. I entered the code but I was told it was incorrect. I’m locked out of my computer because of the same issue. I changed my password but the password doesn’t work. I followed the instructions. Now I have requested codes to many times. They have issues that need to be fixed.,https://itunes.apple.com/us/review?id=983156458&type=Purple%20Software,2024-01-13T10:43:05-07:00
10817904124,0review0101,https://itunes.apple.com/us/reviews/id464593430,6.8.3,1,This app is awful,Microsoft just has to make everything harder for the sake of “security” as if they really need me to get a whole new app on my phone just to log into my school email. You’re telling me I can’t even check emails or submit homework unless I download this pile of garbage app that is so user unfriendly you can barely navigate it? Microsoft makes me want to regress to the stone ages,https://itunes.apple.com/us/review?id=983156458&type=Purple%20Software,2024-01-13T09:16:26-07:00
10815873083,ssrudick,https://itunes.apple.com/us/reviews/id745690888,6.8.3,1,So freaking frustrating!,Authenticator won't accept the code from laptop and laptop won't accept code from authenticator. And Microsoft assumes everyone automatically knows it uses same password across all it's platforms and further assumes we all know all of its platforms. How about a user friendly sheet listing all MS platforms and explaining how they all work together separately?,https://itunes.apple.com/us/review?id=983156458&type=Purple%20Software,2024-01-12T21:15:36-07:00
10815684504,rightsidelogic,https://itunes.apple.com/us/reviews/id1157601349,6.8.3,1,locked and cant unlock,smh,https://itunes.apple.com/us/review?id=983156458&type=Purple%20Software,2024-01-12T19:55:09-07:00
10814619432,Redbird0905,https://itunes.apple.com/us/reviews/id33520429,6.8.3,1,Worthless garbage,I hate this app.  It doesn’t work. It’s impossible to access anything I need.,https://itunes.apple.com/us/review?id=983156458&type=Purple%20Software,2024-01-12T12:48:46-07:00
10814064503,jharve17493,https://itunes.apple.com/us/reviews/id339225663,6.8.3,1,DOES NOT WORK,"This authenticator is TRASH. Definitely half-baked and Microsoft released it anyway. I get a Teams notification on my phone. I open Teams. Teams forces me to the Authenticator app. It gives me a number and tells me to open the Authenticator app and enter that number. Uh… WHAT? I’m already in the Authenticator app! The first time this happened to me I genuinely cried. TRASH app, TRASH two factor system that made my incredibly stressful job even more stressful. Thanks Microsoft!",https://itunes.apple.com/us/review?id=983156458&type=Purple%20Software,2024-01-12T09:25:09-07:00