id,userName,userUrl,version,score,title,text,url,updated
4119534773,omghibird,https://itunes.apple.com/us/reviews/id508815546,4.32.0,4,"Amazing format, nearly no bugs, but indeed it has some flaws.","Reddit is an amazing format. It has subreddits that are frankly hilarious, stupidly hilarious, ridiculously interesting, or just exposing trashy people. I loved this subreddit a lot and I felt as if I can connect to it, the people are fairly kind too, and civilized. You can even post on any subreddit and get upvotes, this leads to Karma which is like Instagrams Follower’s count but nearly 800x better. However, there is a very big hive mind vibe I get from the people there, in certain subreddits you can’t really express your opinion if it’s unpopular. There is a subreddit for that though, one where you can get Karma! Another error is that when you have a stable WiFi connection, the app refuses to connect. However, restarting the app may work, it’s still a very annoying bug.",https://itunes.apple.com/us/review?id=1064216828&type=Purple%20Software,2019-05-08T08:48:20-07:00
2590039390,JoeyMG49,https://itunes.apple.com/us/reviews/id39063748,4.10.0,1,Took Alien-Blue and changed it into garbage.,"Seriously you had a perfectly good app that worked very well with minor bugs. Now with all the updates and UI changes, the app has become more difficult to use. 

List of problems created because of changes 

- Ads pop up every other post to every 3 posts. 
- videos sometimes load improperly or if you rewind on a video you loose all sound. 
- gifs load improperly if at all also you guys took away the length bar of the gif to see how long it was. 
- commenting UI pretty much died. If I reply to a comment and need I look at the comment I’m replying to for reference, I can no longer do it. 
- account information disappears and I need to relogin sometimes. 
- using my location for to find post near me? Why? If I’m not interested in a certain subreddit I don’t need to see the post just because someone within a mile posted it. 
- suggested subreddits based on other subreddits I’m subscribed to? If your taking my location you should know I’m not going to subscribe to another’s cities sports team. 

So today was the final straw. I went to watch a movie trailer on the app and of course no sound. I tried it on the mobile website and works fine. 

When your app underperforms compared to its mobile site you’re doing things wrong. I am moving to another app to try to find something that resembled the Alien Blue platform that worked so well.",https://itunes.apple.com/us/review?id=1064216828&type=Purple%20Software,2018-05-24T07:10:32-07:00
10381206550,Bryan0339,https://itunes.apple.com/us/reviews/id380162738,2023.36.0,3,Horrible video player.,"The built-in video player has to be one of the buggiest video players I’ve ever used. The sound is almost never unmuted even though I have my video settings set to automatically play videos on Wi-Fi with sound. Even after I unmute, the video is always remuting; sometimes every 10 seconds. Or sometimes it starts playing audio from the next video in my feed despite me having the current video in full screen. When I’m scrolling, the video it decides to play audio for (if it plays anything at all or only a single video) is usually something that’s partially offscreen or at least at the very bottom instead of the middle to top of the screen. I could honestly list 100 different scenarios of the video player being junk and half of those are audio related.",https://itunes.apple.com/us/review?id=1064216828&type=Purple%20Software,2023-09-18T06:21:16-07:00
10313181722,afry87,https://itunes.apple.com/us/reviews/id21300777,2023.34.0,3,UI is getting uglier??,"The new reply UI change is making the app experience clunky and the layout uglier. Not really a nice way to put it, but the most succinct description I have for it currently. The new “sidebar” to the left of replies adds an unnecessary amount of spacing above and below comments, which makes replies to a comment look like they’re unrelated. Also, it’s somehow messing with the automatic ordering of comments compared to before. Every reply looks nearly twice as “tall” as it was before updating, and the gray bar looks out of place in dark mode. If it looked more like the mobile website, where it essentially links the replies below it and continues downwards, then this wouldn’t be an issue to complain about, but it’s just disjointed and distracting while detracting from the UX as it spaces things out too much.",https://itunes.apple.com/us/review?id=1064216828&type=Purple%20Software,2023-08-29T13:03:30-07:00
10089545988,Mr noital,https://itunes.apple.com/us/reviews/id192778785,2023.25.0,1,"Unusable app, spam positive reviews","Putting aside the problems with the company ungracefully killing off third-party apps, this app itself is unusable to both power users and casual users alike. Features offered by other (now dead) apps and the old website are missing, and frequent UI changes are consistently for the worse.

Now, a bad app is just a bad app, and perhaps there is the chance for positive change in the future. That being said, if the past app changes are telling of the future, I highly doubt it, and I won’t be a user of it anyway to find out for myself.

What is truly despicable, however, is the spam positive reviews with broken nonsensical sentences for this app inflating the total rating. I simply cannot believe that allowing 5-star bot reviews on an app is permissible under the App Store TOS. Reddit clearly benefits from these bot reviews, so at a minimum the Reddit app should be delisted, and Apple should try to implement a more thorough and stringent filter for fake accounts and reviews. I am pessimistic of if these two things will ever happen, but anything less erodes trust in the App Store.

If this bot review practice is permissible and is even as regular across apps as it appears, then we users must understand that App Store reviews are meaningless, not reflecting the quality of the app but instead measuring how deep the pockets of the app developer are.",https://itunes.apple.com/us/review?id=1064216828&type=Purple%20Software,2023-06-30T11:09:44-07:00
10069007566,Agbghdgxg16253,https://itunes.apple.com/us/reviews/id196563254,2023.24.0,1,Killed Third Party Apps Despite Community Backlash,"I used this app primarily but it makes me incredibly sad to see not only the company shut down third party apps that had many accessibility features they don’t but the nail in the coffin was how much outcry there was about it and the company did not care. They will profit off of hope and spread messages like “We can do anything if we try!” until it comes to change their community wants. Nothing changes no matter how many people rise up, the world feels hopeless and one would think the internet might be a safe haven away from the helplessness of the real world but no. Petitions mean nothing, blackouts mean nothing, the only way to change something is to have more money than they can ignore. All this was was just another cold reminder that no matter how much we protest, nothing will happen. It doesn’t matter how big of a sea of voices we have. Corporations win. Politicians win.",https://itunes.apple.com/us/review?id=1064216828&type=Purple%20Software,2023-06-24T15:34:24-07:00
10033453990,Kyle the Person,https://itunes.apple.com/us/reviews/id1469811720,2023.23.0,1,Screw the Users,"Over the last few years, Reddit has been destroying countless features and changing user interface making it more and more inaccessible and irritating to the users. Now they are destroying third party apps so that this app is used more and they have more power over the user base. This is still ignoring the fact that by banning third party apps, they are actively blocking people with disabilities and impairments from using Reddit. It has never been cleared that Reddit and u/spez (The Reddit CEO) don’t think of their users as people, but as assets. I used to love Reddit, but I have been watching it be destroyed for the last few years in disbelief, but I can’t do this anymore. If anyone reading this thinks Reddit won’t go further than it has, you are wrong. Now that people are forced to use their app, there is nothing stopping them from adjusting it to milk as much money out of its “assets” as possible. Goodbye Reddit, you apathetic void of disparity.",https://itunes.apple.com/us/review?id=1064216828&type=Purple%20Software,2023-06-14T09:50:50-07:00
4615770787,Stephen Kahlig,https://itunes.apple.com/us/reviews/id460123793,4.40.0,5,Reddit Saves,"I absolutely love being able to communicate and share things with like minded people.  The “Karma” system doesn’t make sense for the platform sometimes because some people have unpopular opinions and that gets translated into bad karma on Reddit.  This gets in the way of people’s individualism, I think.  Also, I can’t respond to more than one post inside of the same few minutes, sometimes.  Reddit reject my response and send me a message saying, “You’re doing that too much.”  What am I doing too much?  Giving advice to people who need and have asked for it?  Answering questions that I happen to know the answers to?  It’s a great idea with a problematic execution.  I use it every day because it’s the community that makes it all worth while.",https://itunes.apple.com/us/review?id=1064216828&type=Purple%20Software,2019-08-14T08:22:48-07:00
8458049218,ReezyScott,https://itunes.apple.com/us/reviews/id310654761,2022.09.0,5,Why I don’t click the “use the app” pop up when I’m on the Reddit website.,"Love the website and the app just giving some feedback. Whenever I go to the app first to use it everything works fine. However, if I am searching the web and end up clicking a link that takes me to Reddit, I prefer to stay on the website versus letting it take me to the app. The only reason I don’t do this is because when you click the link to open the app it takes you away from the forum that you were reading completely. It’s a small thing that I think you guys should fix. When I click the app option it should take me to the same form that I am already on. 

Cheers! :)",https://itunes.apple.com/us/review?id=1064216828&type=Purple%20Software,2022-03-15T05:45:02-07:00
9404519292,herpderpderpyderpherpderp,https://itunes.apple.com/us/reviews/id200715615,2022.45.0,1,"Removed ""Sort By Rising"" | Losing Interest","Now I am not against business making changes to their apps and modus operandi. But if a company removes the main service that was beneficial to me, then I will disagree vocally and if nothing changes then I will leave. I owe my allegiance to not a single corporation.

Such is what is currently happening with Reddit. They completely removed the main feature that was the sole reason why I used the app. Reddit removed the ability to sort the home feed. You can still see ""popular"", ""hot"", and ""new"" under different categories now. But there is no way to filter by ""rising""

""Rising"" was the only thing that kept my attention. I liked to join in on comment threads early on and possibly have short conversations with real people. WITHOUT having to shovel through the utter garbage that is ""new/latest"".

So with this recent update I can only see posts that have either thousands of upvotes, or zero upvotes. Nothing in between.

This is not the first time they've tried this. A few months ago they tested removing this option. I got so frustrated with reddit that ended up deleting the app until they reverted the change.

If they don't revert this change and will no longer provide the option to sort by ""rising"" then I will have lost all interest in Reddit and they will be losing this once-prolific user.",https://itunes.apple.com/us/review?id=1064216828&type=Purple%20Software,2022-12-16T21:03:51-07:00
8881342334,jojo373626,https://itunes.apple.com/us/reviews/id1348018116,2022.26.0,5,Reddit is no longer NSFW / 18+ / SWer friendly,"After almost 3 years of using Reddit, they shadow banned me along with countless others who post NSFW content. 

When we appealed, we received no response whatsoever. We did not break the rules and Reddit refuses to respond to us to let us know what we did wrong. 

No warning, no explanation, just an instant shadow ban despite not breaking the rules. We can view our accounts but others can’t, we no longer show up in search, we can no longer interact with other users at all. This “shadow ban” is the same as a regular permanent ban the only difference is a typical permanent ban explains why and what you did wrong and notifies you of your ban, whereas shadow bans do not. 

Reddit is slowly trying to get rid of NSFW content in order to win over investors. They started by mass banning lots of less popular NSFW subreddits and now they are outright banning loyal users who post NSFW content. This is a slow and gradual process that Reddit is doing, whilst ignoring appeals. 

This is a huge slap in the face considering all the money we’ve spent on Reddit Premium memberships. 

Very disappointing and upsetting.",https://itunes.apple.com/us/review?id=1064216828&type=Purple%20Software,2022-07-16T16:38:40-07:00
5134906725,Bee70653,https://itunes.apple.com/us/reviews/id276231716,4.46.1,4,I like it,"I think reddit is a great way to broaden horizons and see what other people think, like, and come up with. It’s a great place for new ideas and also is the only social media I know of where people can actually discuss opposing view points without being mean or disrespectful. Many of the people who comment and share are educated and actually know a bit of what they are talking about. MUCH better than people sharing opinions on Facebook. My only complaint is that the news associated groups are definitely biased in one direction. Particularly r/news. It’s clear if you disagree with something on there and even state it respectfully the individual monitoring or all won’t approve your post if it doesn’t follow their agenda. That I don’t like and therefore I don’t rely on reddit for news updates.",https://itunes.apple.com/us/review?id=1064216828&type=Purple%20Software,2019-11-13T20:19:53-07:00
10470121273,Coach Ota,https://itunes.apple.com/us/reviews/id40579597,2023.39.0,2,Works but constant UX issues,"It works well enough but there are ongoing issues. The UI is often laggy for up voting and freezes. If you press multiple times you can see it catch up after a couple of seconds of waiting for visual feedback. The back ""<"" button to get out of a thread often doesn't respond to presses and you need to swipe to get back. Increasing text size previously caused formatting problems so some text was under a thumbnail for the post.  Now that text size is set under system Accessibility, you can't get the display font as big as before. It doesn't seem to fully honor the setting as system dialogs in the app reflect the text size correctly. At this point, the app should be really polished, not the ongoing one step forward, two steps back experience it is. Too bad Reddit got rid of better, 3rd party options!",https://itunes.apple.com/us/review?id=1064216828&type=Purple%20Software,2023-10-13T09:32:02-07:00
10118134951,Sorcerer Al,https://itunes.apple.com/us/reviews/id129109013,2023.26.0,1,"Unusable mess, despicable and horrendous leadership","Reddit killed off third party apps and then the CEO falsely (there are tapes) claimed that the dev for one of the third party apps (Apollo) threatened/blackmailed them. /u/spez (the CEO) should have been removed a long time ago when he changed other user’s comments. Reddit leadership knows and understands NOTHING about how to run their website or app. I have used Reddit for over 10 years and they try to force stupid new “ideas” on their users (like NFT integration with profile pictures, changing the entire design of the website wasting so much more white space, etc.). I used this app before Reddit bought it, when it was known as Alien Blue. Immediately after purchase, Reddit did what it’s been doing best for years now, ruined the entire experience. Reddit would never have gotten to be the “front page of the internet” without third party support, and yet there is NO SUPPORT for the Reddit community from Reddit admin.",https://itunes.apple.com/us/review?id=1064216828&type=Purple%20Software,2023-07-08T10:40:54-07:00
10112791728,Jebaily,https://itunes.apple.com/us/reviews/id131675295,2023.26.0,1,Don’t pay attention to the reviews here,"Genuinely. I Iove Reddit, and so do sooo many other people. It’s awesome, but only because it’s literally just a bulletin board that everyone has access to. People love reddit because they love social interaction and keeping up with what’s funny and interesting in the overall discourse. 

And that’s what people are reviewing this app based on… not the app itself, but the actual concept of community. Obviously it’s good to interact with people and to feel a part of something. But like. That’s not what this review page is for..

This app is absolutely terrible. Abysmal. Don’t get me wrong, I love Reddit - but obviously not for the company. Who cares about a company? I’m here for the community. And everything was fine until the company decided to shut down every positive outlet of its own community. They killed every third party all and this absolute monstrosity of a clustered ad-filled ugly cesspool of an app is all that’s left.

Seriously, Reddit. Fix your app. How is a community of millions of people supposed to just accept that the most world renowned outlet of genuine human interaction is irrevocably incapable of even hiring one person smart enough to understand how an iphone app is supposed to work???

This is a disgrace to every person that believes time moves forward. Because y’all just biked yourselves back to the stone age.",https://itunes.apple.com/us/review?id=1064216828&type=Purple%20Software,2023-07-07T00:26:05-07:00
10020961592,wendig4,https://itunes.apple.com/us/reviews/id101254025,2023.22.0,1,The example of what not to do when creating an app,"The official Reddit app is atrocious. From the awful video player to being shown content I don’t want to see, the experience on this app is sub par. Ads are rampant and even when you ask the app to stop showing a certain ad, it will continue like it never received the request. It spams notifications for irrelevant subreddits that I’ve never even visited, and the mod tools are an actual handicap - you could never successfully moderate a sub from mobile using THIS app. Third party apps addressed all of these issues and had additional functions that included accessibility for the visually impaired - and no, the official app is not even capable of the most basic accessibility. 

I would give zero stars if I could. Save yourself the frustration and just go outside. Find a hobby. Do anything else with your time. Accessing Reddit from this app is a nightmare, and now there’s no alternatives!",https://itunes.apple.com/us/review?id=1064216828&type=Purple%20Software,2023-06-10T18:57:40-07:00
10016271364,CCH623,https://itunes.apple.com/us/reviews/id33956233,2023.22.0,1,Greed will be your downfall,"I’ve been a Reddit user for 14 years, and have used the Apollo app for the last 10 years. In Reddit’s decision to charge third-party apps (TPAs), and thus forcing many to shutdown, you have alienated a large segment of Reddit fans who specifically learned to love Reddit THROUGH THOSE APPS. Apollo developer, Christian Selig, has a loyal following because he worked collaboratively with the Apollo community to continually make the app better. He LISTENED to the community. Reddit is not listening. Losing our beloved TPAs is even worse when considering how clunky and bloated the official Reddit app is. Browsing Reddit on Apollo was a smooth and enjoyable experience. The official Reddit app comes nowhere close to Apollo’s user experience, as I have used the official app occasionally as a point of comparison.  Your greed will be your downfall, Reddit. Apollo is signing off and so am I.  I am deleting my account on Jun 30.  I know, by far, I am not the only user who is saying goodbye.",https://itunes.apple.com/us/review?id=1064216828&type=Purple%20Software,2023-06-09T10:25:03-07:00
9780903669,Greenman0352;),https://itunes.apple.com/us/reviews/id375693199,2023.12.0,1,Can be frustrating,"So Reddit is definitely a two edged sword. The great is that you can find subjects about almost anything and can find some great communities. The bad is most of these communities and moderators are radical leftists. I understand if you want to stick to your beliefs as I’m religious and I stick to mine. The problem arises when you suppress one group because of their beliefs. I’m not a Republican I’m actually libertarian, but the hardcore leftist mindset is so woke that they’re consuming their own. I continue to use it specifically for a few business related subreddits. If those ever went away I would have no use for this app anymore. 

It wasn’t always this way I’ve been a member since 2015 but you could definitely see it begin to go that way around 2019 and by 2020 it was so bad that I don’t even join conversations. I observe and feel bad seeing the one sided propaganda. It’s sad that social media has become this.",https://itunes.apple.com/us/review?id=1064216828&type=Purple%20Software,2023-04-02T19:27:02-07:00
9500452185,ElectricMango,https://itunes.apple.com/us/reviews/id314080065,2023.01,1,Intentionally Crippled + Full of Incels,"Reddit breaks the website from working on Safari / Mobile and forces you to use the app.  The major issue is, even if you use the app, 90% of the time it takes you to an AppStore download link. It’s a huge mess. You have to manually enter what you were looking up in safari and enter it in again in the app. Most of the time the app doesn’t provide any benefits to the experience, it takes benefits away, such as no ability to open multiple tabs of related questions and skim them super quick.  Reddit loves to add “18+” warnings to things which are not inappropriate or explicit, solely to get you to use the app. This is horrifically annoying and makes me sick whenever I use this dumpster fire of a website. The grossest thing is, it’s all avoidable. This company would rather ruin their product to be able to track users and make more ad revenue than to have a good product.",https://itunes.apple.com/us/review?id=1064216828&type=Purple%20Software,2023-01-12T13:40:22-07:00
6736132431,nhsdanks,https://itunes.apple.com/us/reviews/id1204360943,2020.47.0,5,"Deserves a full 5 stars, for this exact reason;","From an objective standpoint, Reddit is an undeniably useful and interesting platform. It’s entire basis revolves around the basic ideals of the communal sharing of human knowledge and experience. This much can be said about many forums, yes... But what sets Reddit apart is it’s expansive demographic appeal  that is only limited by that which is not yet available and unknown to mankind. Most negative/low-star reviews I see are based upon a personal, foul personal experience that stemmed from some kind of conflict with a sub’s moderator. While there’s no denying that Reddit has some room for improvement in areas such as the moderator vetting process and things of that nature... It hardly justifies overlooking the quality of this platform as a whole.",https://itunes.apple.com/us/review?id=1064216828&type=Purple%20Software,2020-12-09T18:56:33-07:00
8111690125,ilovemydaughgter,https://itunes.apple.com/us/reviews/id1336015182,2021.47.0,4,banned for being honest,"i don’t have a problem with reddit; it’s been good to me over the past few years. but they don’t have the best track record with establishing fair rules across the board. i was hit with an account suspension for violating inappropriate content rules. but ive seen people get just as honest as me and still stand. i understand the algorithm isn’t perfect, and more than likely they depend on other users to police the site. but Reddit was built on people like me being overly honest. this is what you came to see right, someone out there doing things society will disagree with publicly but do just that behind closed doors. ill be back on the app soon enough, i rarely post reviews but this opted me to speak up. still four stars though",https://itunes.apple.com/us/review?id=1064216828&type=Purple%20Software,2021-12-09T06:25:11-07:00
9381509691,bsudmartinez,https://itunes.apple.com/us/reviews/id437419266,2022.45.0,5,Best Social Media App Ever!,"Waaayyy better than Facebook, Instagram Twitter, Snapchat, TikTok by a long shot. I used other social media apps throughout the years but deleted them because I was tired of all the drama and unauthentic behaviors that people display. I would get off those apps and feel crappy or on edge. When i discovered Reddit it was completely opposite. I’ve learned so much and feel accomplished when I’m on there. YOU get to choose what info you want to digest which is a awesome! Don’t want to hear politics? Don’t follow political subreddits! That simple. Unlike other apps where you have to scroll through EVERYTHING that people talk about. Do yourself a favor and delete every social media app except Reddit!",https://itunes.apple.com/us/review?id=1064216828&type=Purple%20Software,2022-12-10T08:01:54-07:00
