id,userName,userUrl,version,score,title,text,url,updated
11098498487,AliceYoung 134,https://itunes.apple.com/us/reviews/id113801666,3.607.10000,5,Very smooth drive on tone thanks so much for your hard works!,Very smooth drive thanks so much ! Great appreciated!,https://itunes.apple.com/us/review?id=368677368&type=Purple%20Software,2024-03-29T06:14:07-07:00
11098437410,Reddawg12,https://itunes.apple.com/us/reviews/id784326954,3.607.10000,5,Driver,Very nice,https://itunes.apple.com/us/review?id=368677368&type=Purple%20Software,2024-03-29T05:55:33-07:00
11098349538,DNY PIZZERIA,https://itunes.apple.com/us/reviews/id775408683,3.607.10000,5,John L,Deseree was awesome. You are lucky to have her as a driver,https://itunes.apple.com/us/review?id=368677368&type=Purple%20Software,2024-03-29T05:28:04-07:00
11098171675,Jdadsr,https://itunes.apple.com/us/reviews/id259137495,3.607.10000,5,Awsome driver,Was very nice and took me home safe great music and I would definitely ride with him again,https://itunes.apple.com/us/review?id=368677368&type=Purple%20Software,2024-03-29T04:26:57-07:00
11098129124,RichieOblaDeeOblaDo,https://itunes.apple.com/us/reviews/id383751928,3.607.10000,5,My driver,Was very helpful.   Thanks,https://itunes.apple.com/us/review?id=368677368&type=Purple%20Software,2024-03-29T04:11:00-07:00
11098062326,Sawdahluv,https://itunes.apple.com/us/reviews/id296996925,3.607.10000,5,Great experience,Nice smooth ride,https://itunes.apple.com/us/review?id=368677368&type=Purple%20Software,2024-03-29T03:45:04-07:00
11098023944,VT Skylanders,https://itunes.apple.com/us/reviews/id1627813044,3.607.10000,5,1st time Uber user,"I driver was on time. Vehicle was clean. He was very friendly, even though he is a NY Yankee fan!!!   😉
Let’s go Red Sox",https://itunes.apple.com/us/review?id=368677368&type=Purple%20Software,2024-03-29T03:29:52-07:00
11097980462,Manchild_52,https://itunes.apple.com/us/reviews/id606761644,3.607.10000,5,AMAZING,"One of the best drivers I have ever had. Super nice guy and very knowledgeable. After a long stressful flight, talking him was like talking to a best friend.",https://itunes.apple.com/us/review?id=368677368&type=Purple%20Software,2024-03-29T03:11:59-07:00
11097957909,GabbyCreations,https://itunes.apple.com/us/reviews/id1220624469,3.607.10000,5,Review,My driver was bet patient with me spoke with and made me feel very comfortable I really appreciate and thank my service I had this was so refilling. 💕☀️🌞💯❤️,https://itunes.apple.com/us/review?id=368677368&type=Purple%20Software,2024-03-29T03:02:35-07:00
11097931257,asianlubelle,https://itunes.apple.com/us/reviews/id117183556,3.607.10000,5,5 star,arrive on time and respectful,https://itunes.apple.com/us/review?id=368677368&type=Purple%20Software,2024-03-29T02:51:19-07:00
11097718621,Kellycomp,https://itunes.apple.com/us/reviews/id915444207,3.607.10000,5,Great trip,Our driver was very good ! And punctual !! And fast!!,https://itunes.apple.com/us/review?id=368677368&type=Purple%20Software,2024-03-29T01:15:51-07:00
11097704697,Quannze,https://itunes.apple.com/us/reviews/id1640504401,3.607.10000,5,GREAT DRIVER,Good Conversation And Awesome Driver,https://itunes.apple.com/us/review?id=368677368&type=Purple%20Software,2024-03-29T01:09:21-07:00
11097549911,BIG E !!!!,https://itunes.apple.com/us/reviews/id1596962962,3.607.10000,5,MARTINA IS THE BEST !!!!,MARTINA IS MOST DEFINITELY THE BEST UBER DRIVER EVER !!! I’M SUPER HAPPY THAT I HAD THE PLEASURE OF MEETING HER !!!  👍🏽👍🏽,https://itunes.apple.com/us/review?id=368677368&type=Purple%20Software,2024-03-28T23:53:27-07:00
11097528834,RD172,https://itunes.apple.com/us/reviews/id407321897,3.607.10000,5,Ride from JFK - Driver Khuspreet,"Called for Uber from JFK terminal 8. Hurried picked the ride. Came within 2 minutes. Very pleasant, soft spoken young man, loaded my 3 suit cases and got on our way to my home.
He drove very carefully, within speed limits, conversed pleasantly. 
I won,t mind riding with him again. 
R.s. Dhaliwal
3-29-2024… AM",https://itunes.apple.com/us/review?id=368677368&type=Purple%20Software,2024-03-28T23:42:49-07:00
11097511651,Tita95arr,https://itunes.apple.com/us/reviews/id537015047,3.607.10000,5,Very nice,Víctor was really nice and gave out good information during my ride. I really recommend this person.,https://itunes.apple.com/us/review?id=368677368&type=Purple%20Software,2024-03-28T23:34:05-07:00
11097485717,Otm1206,https://itunes.apple.com/us/reviews/id27748294,3.607.10000,5,Ron was nice,"We enjoyed our conversation about the island, traffic, pizza, and local bakeries.",https://itunes.apple.com/us/review?id=368677368&type=Purple%20Software,2024-03-28T23:20:31-07:00
11097440626,Doc Rao,https://itunes.apple.com/us/reviews/id182617375,3.607.10000,5,Great service,Uber uses the local yellow taxis. It’s a great collaboration. Works like the regular Uber service,https://itunes.apple.com/us/review?id=368677368&type=Purple%20Software,2024-03-28T22:56:51-07:00
11097367241,Jad foods,https://itunes.apple.com/us/reviews/id23502161,3.607.10000,5,Perfect,I’ll drive was exactly on time as posted by the app. He was helpful with our luggage. He was incredibly polite and everything went well and we are back home safe and sound bravo.,https://itunes.apple.com/us/review?id=368677368&type=Purple%20Software,2024-03-28T22:18:18-07:00
11097077222,Sharin’ Rubens ride,https://itunes.apple.com/us/reviews/id189898746,3.607.10000,5,Rueben,Best NASCAR driver ever got to ride with!,https://itunes.apple.com/us/review?id=368677368&type=Purple%20Software,2024-03-28T20:01:10-07:00
11096995067,RyG6,https://itunes.apple.com/us/reviews/id294241278,3.607.10000,5,Great Guy,He  went above and beyond to help me out and was very kind. Definitely one of the best drivers I’ve had.,https://itunes.apple.com/us/review?id=368677368&type=Purple%20Software,2024-03-28T19:26:32-07:00
11096993525,momma2k2,https://itunes.apple.com/us/reviews/id960165468,3.607.10000,5,Junior,Junior has amazing customer service!!,https://itunes.apple.com/us/review?id=368677368&type=Purple%20Software,2024-03-28T19:25:55-07:00
11096921475,alishaforlkfe,https://itunes.apple.com/us/reviews/id793860276,3.607.10000,5,Awesome guy,Your awesome thanks again!,https://itunes.apple.com/us/review?id=368677368&type=Purple%20Software,2024-03-28T18:56:44-07:00
11096893598,Bill's Pay Pal,https://itunes.apple.com/us/reviews/id101577181,3.607.10000,5,Sally’s the best!,Thank you Sal ❤️‼️,https://itunes.apple.com/us/review?id=368677368&type=Purple%20Software,2024-03-28T18:45:21-07:00
11096892629,Review Mich,https://itunes.apple.com/us/reviews/id135359772,3.607.10000,5,Comment,"Driver was amazing, great greeting, conversation and customer service. Thank you",https://itunes.apple.com/us/review?id=368677368&type=Purple%20Software,2024-03-28T18:44:57-07:00
11096879029,79Nattlie,https://itunes.apple.com/us/reviews/id621785543,3.607.10000,5,Safe and professional Driver,Thank you,https://itunes.apple.com/us/review?id=368677368&type=Purple%20Software,2024-03-28T18:39:22-07:00
11096871585,MamaMaria24,https://itunes.apple.com/us/reviews/id1541611829,3.607.10000,5,Amazing service,He was prompt and polite.  Highly recommend!,https://itunes.apple.com/us/review?id=368677368&type=Purple%20Software,2024-03-28T18:36:20-07:00
11096854145,Carlosltg,https://itunes.apple.com/us/reviews/id6239125,3.607.10000,5,Great guy,Very nice person!!,https://itunes.apple.com/us/review?id=368677368&type=Purple%20Software,2024-03-28T18:29:16-07:00
11096847450,bigtojomo,https://itunes.apple.com/us/reviews/id1083423970,3.607.10000,5,Brandon was great,That is it enjoyed ride,https://itunes.apple.com/us/review?id=368677368&type=Purple%20Software,2024-03-28T18:26:30-07:00
11096837411,Touwangmeng,https://itunes.apple.com/us/reviews/id459769839,3.607.10000,5,5*,Chainsaw Charles was the man. A blessing.,https://itunes.apple.com/us/review?id=368677368&type=Purple%20Software,2024-03-28T18:22:28-07:00
11096835069,Eads 380,https://itunes.apple.com/us/reviews/id19744564,3.607.10000,5,Today’s ride,Very professional and kind. Excellent.,https://itunes.apple.com/us/review?id=368677368&type=Purple%20Software,2024-03-28T18:21:33-07:00
11096815322,converger,https://itunes.apple.com/us/reviews/id40212928,3.607.10000,5,"Great Driver! Prompt, Professional And Personable",Highly Recommended.,https://itunes.apple.com/us/review?id=368677368&type=Purple%20Software,2024-03-28T18:13:27-07:00
11096717768,CcAaEeMm,https://itunes.apple.com/us/reviews/id698836560,3.607.10000,5,Unhappy customer,"We were waiting for the Uber driver and we were at the location by the flyover and the driver was nowhere to be found 
We texted him and told him our location at that time he cancelled our ride and we still had to pay a cancellation fee when it was the driver that cancelled. 
This is poor customer service and I would like my money refunded due to your drivers negligence",https://itunes.apple.com/us/review?id=368677368&type=Purple%20Software,2024-03-28T17:33:25-07:00
11096709502,Cibola guy,https://itunes.apple.com/us/reviews/id542975452,3.607.10000,5,Great conversation,Enjoyed the ride and conversation. Very safe driver,https://itunes.apple.com/us/review?id=368677368&type=Purple%20Software,2024-03-28T17:30:01-07:00