id,userName,userUrl,version,score,title,text,url,updated
7623189105,pls read this is inportant!,https://itunes.apple.com/us/reviews/id1306817946,8.6.46,5,Too many ads!,"Hi who ever is viewing. Well I just want to get straight to the point. So the app is AMAZINGG the only thing that I have against it is that just bcuz we (referring to the don’t have premium)don’t have premium, does NOT mean u keep have to spam ads. Idk if it is just me, but every time I skip a song or it just finishes, it plays an ad. At first it wasn’t like this, it played an ad or two here and there. But I really didn’t think it would get this bad.( plus some of them r kinda 
inappropriate sometimes)Not to mention that we can’t play a certain song that fits the vibe and cannot go back to the previous song. (I am truly sorry if I am complaining rn but I had to say something about it that’s just how I am.) Listen, all I am really trying to say is that you should give more to the non-premium users. Well that all for now I think thank u to the people who read it this far. Gtg bye! ✌️",https://itunes.apple.com/us/review?id=324684580&type=Purple%20Software,2021-07-27T02:54:27-07:00
9583535165,PxmpkinP1e,https://itunes.apple.com/us/reviews/id1469321633,8.8.6,4,Update Ruins EVERYTHING,"So first of all, I’d like to start off with a a compliment. Yes, I love how this app has practically EVERY song and genre, and nor do u have to pay to get just a single song to listen to! Now, I’ve been using this app for a few years now and the new update that they NOT recently released pretty much ruined it. For example: Whenever I search up a song that I would like to just simple listen to from the search bar, it plays a completely different one! Please PLEASE fix this!! It is so irritating. Another thing is that you guys removed the “repeat” button for when you want to listen to a song on repeat. Help! Lastly; before his update, whenever I opened for clicked on a playlist, it would open the playlist and show you all the songs, top to bottom, BUT NOW.. it doesn’t even do that! It just shows empty space and the title and info of the playlist and lists but doesn’t show the songs involved! Please please fix!!!",https://itunes.apple.com/us/review?id=324684580&type=Purple%20Software,2023-02-04T13:15:46-07:00
6499903495,mia luck,https://itunes.apple.com/us/reviews/id1154970962,8.5.78,5,Thanks,I love this app and I has help my friends and family is the way to do not have to be friends with me haha is the way I am not going to be home for a while haha is the way to do not have to be a good friend to me haha is the way I can go f r I am not going to be home today I am going to be home and I will be home in a few minutes I love you so much and yes you are going home and then you have a nice time with me I wanna was the way you got to go get me a little help and get my car back to my phone I can go home now so you have a lot going be home in your yard and I’ll talk about the car I will be there tomorrow and then you will have a car for lunch and I can pick it tomorrow and then go home I wanna is a way I wanna is a time to come over tomorrow and then go to the bus and I can come home in the afternoon or you come over here I wanna was the way you want to me I love ya so I wanna is a time I am not going to be home I can come.,https://itunes.apple.com/us/review?id=324684580&type=Purple%20Software,2020-10-04T08:00:18-07:00
6832090351,AwesomeApp!!❤❤,https://itunes.apple.com/us/reviews/id324031673,8.5.86,5,Cant stand this app,"You literally can’t do anything without paying. So many people have talked so highly about this app and i have been nothing but disappointed. You only get 6 skips a day which is the most ridiculous thing I’ve ever heard, you cant play a specific song you literally can only shuffle your playlist (which, don’t forget, you only get 6 skips so if you want to listen to a specific song, you cant.) and i got 3 full ads before i even had a chance to listen to a single song. This app is completely useless without paying, which is just gross. It is 100% obvious you only care about money and not at all about the listeners, as you take every basic function of a music app and make it so it HAS to be paid for. I just don’t understand who in their right mind would pay money for the functions of an app that any other app in the app store does for FREE.",https://itunes.apple.com/us/review?id=324684580&type=Purple%20Software,2021-01-04T18:32:15-07:00
5832948297,Bre lysosomes,https://itunes.apple.com/us/reviews/id270942680,8.5.53,3,Please Read,"Ok, so yes this app is amazing with all of the music playlists and stuff. But this one thing is keeping me from rating this app any higher than 3 stars. I love whenever I can play my music in order, sometimes I just don’t like when it plays in shuffle mode. But the last update has changed so I cannot choose if I want it in shuffle mode or not. And before the update if I slid right it would put that song in queue. And if I slid left then it would favorite the song, but not anymore. 

This last update has really gotten on my nerves and I rarely listen to music anymore. If you would just let us choose if we’d like it in shuffle or not, I believe many people would be happy. I say that we should click ‘play’ then it should ask “How would you like your music to play?” Then underneath that it should have two buttons, one says ‘shuffle’ and the other says ‘in order’. This would make life much more happier for me.

Please consider using my idea, if you do this my rating will go up to 5 stars! Just please make me and many others happy!",https://itunes.apple.com/us/review?id=324684580&type=Purple%20Software,2020-04-18T23:05:30-07:00
4435607566,Hezlo!,https://itunes.apple.com/us/reviews/id396196193,8.5.7,1,keep playlists in alphabetical order!!!,"i’m very frustrated with this update. please keep the playlists sorted the way we set them to be sorted. i chose to have my playlists sorted in alphabetical order. however, when i go to add a song to an older playlist, i have to search for so long to find the right one because my playlists are now sorted by the date that i made them. i think it’s pretty common to add a newer song to an older playlist, and i know i’m not the only one who finds alphabetical order easier. i was able to put up with this on desktop, but now that you’ve moved this re-sorting to mobile, i needed to write a review. this is the most annoying feature of the app now and i get so frustrated that I have left several bad reviews in hopes that SOMETHING will happen to return the app to its former glory without this and other exceedingly frustrating features.

there should also be a way to separate the playlists that i have made from the ones i have followed. and PLEASE let us easily access how many songs we have on each playlist. it’s a small thing, but it’s so helpful to see the number of songs next to the playlist name.",https://itunes.apple.com/us/review?id=324684580&type=Purple%20Software,2019-07-09T15:01:45-07:00
3679266282,Love156,https://itunes.apple.com/us/reviews/id221315045,8.4.89,4,Changes,"When the app was updated they got rid of some the best thing. I would love to see them come back. How many songs are in the playlist, how many followers they have and the search system. I would love to see new changes like putting your playlist in a certain order. With ocd this is very bothersome. I want to put playlist in an order that I use them and move them all around To an order I like not of how they were made. I can’t keep organized. I would also like to see ways to access the radios. When I get tired of my songs and want to find new ones I want to listen to the playlist radio. I have no idea how to get to them. I also think for organizational purposes I would love to see a select button where you can select multiple songs to add them, take away or move to a different playlist. The old features I would love to see come back. I love the app and I’m on it all the time but I would love to see changes to make the experience over all more appealing.",https://itunes.apple.com/us/review?id=324684580&type=Purple%20Software,2019-01-21T15:27:02-07:00
8435339759,LaurenLorenzo3,https://itunes.apple.com/us/reviews/id201877841,8.7.10,1,Songs will play for two seconds and then stop for no reason.,"I’m really annoyed, because so many songs in my playlists just play two seconds of a song and then completely stop for absolutely no reason. (NOT pause, but literally STOPS and won’t let me play the song at ALL). I have no idea why this started happening but it is not anything on my end, it seems to be a bug with playlists. The songs play just fine on my computer desktop, but on my phone, this continues to happen where I’ll play a song in a playlist and it just either won’t play at all, or two seconds of it will play and then it stops. Is anyone else having this problem?? It started happening a few months ago and I’ve been waiting for whatever bug this is to get fixed, and it hasn’t. Not every single song does it, but most of them do, and it’s not a particular artist, it’s just random. Note: If I look up that song by that artist, the song will play just fine. It’s only when I go into my playlists to play a song that this will happen. Anyone else having this experience? It’s the most irritating thing.",https://itunes.apple.com/us/review?id=324684580&type=Purple%20Software,2022-03-08T17:43:49-07:00
7293028440,blaakpilot,https://itunes.apple.com/us/reviews/id100920756,8.6.22,3,Some annoying glitches,"Overall the app has some cool features, but there are a couple glitches that prevent a five star rating. First, if you’re connected to a Bluetooth device, you cannot remove podcasts from a playlist, nor can you remove podcast downloads from your phone. Doesn’t make sense that I should have to  disconnect from external devices to use normal functions within the app. Second, concerning podcasts, I created a playlist of one of my favorite podcasts because I want to listen to only a few select shows. Instead of auto playing the individual podcasts that I’ve added to my playlist, the app will either play ALL of the podcasts in numerical order (even ones I did not add to my playlist), or play random podcasts, including ones I’ve already listened to and are labeled “played”. What’s the point of allowing us to create playlists for podcasts if the app ignores them? Why label a podcast “played” if the app is going to just play it again anyways? Please fix.",https://itunes.apple.com/us/review?id=324684580&type=Purple%20Software,2021-05-03T06:08:26-07:00
10547429830,Annamcdonna,https://itunes.apple.com/us/reviews/id514610159,8.8.82,5,IM BEGGING YOU,"PLEASE PLEASE PLEASE! Make a way for me to group my playlists like a Pinterest board. I have so many different genres I listen too and so many moods within each genre and my library page is so cluttered that I end up listening to the same stuff a lot without intending to. I have used this app for years now and will probably always use this app for so many years to come but with how long I’ve had it my profile feels messy. Please make a way for me to organize playlists into groups so I can keep all of my playlists pertaining to one thing (sad music, slow music, a certain genre, female artists, holidays, etc.) in one place so it feels less like I’m weeding through the same stuff I always listen too. You do it in the search page so I was hoping there was a way to make it so we could do it in our libraries or on our personal pages, or both. Thanks for such an amazing app!",https://itunes.apple.com/us/review?id=324684580&type=Purple%20Software,2023-11-03T18:42:59-07:00
8783750819,Pitckey27,https://itunes.apple.com/us/reviews/id1191546335,8.7.40,5,Make the free plan have more features!!!,"So I would’ve gave this app a five if it wasn’t for the very limited features with the free plan, this app is great but the problem I have is that with the free plan if I go to my playlist I can’t just have the list of my songs I have to go into the shuffle and I only have 6 skips an hour so if in the six times I skip I don’t get the song I wait I ether will have to wait for an in predictable amount of time or I have to wait an hour til I get more skips. So the weird thing is that on my iPad this does not happen but on my phone it does so I don’t know what is up with that. So all I ask is that you either make the free plan have more features like being able to freely play any song in a playlist without having to go in shuffle, or you can give us unlimited skips. Thank you for reading this I would really appreciate you doing this.”",https://itunes.apple.com/us/review?id=324684580&type=Purple%20Software,2022-06-17T11:54:01-07:00
9275390635,abunnynamed.b.b,https://itunes.apple.com/us/reviews/id955668740,8.7.78,4,Stops randomly,"This app is really good. Had a variety of different music choices and podcasts. This app also makes a playlist of songs based on what your favorite artists are and what you listen too. The app only always six skips every hour (which is normal). You can buy premium and don’t have to worry about limited skips and handpick the songs you want to listen at that moment. The main problem with this app is that it randomly stops playing music at 9-11 seconds. At first I thought I let was a connection issue but when I connected to the Wi-Fi at my home it also stops. I tried to restart the app but that didn’t work. The only way I was able to get the songs to start playing again was deleting and downloading the app back. This is extremely annoying especially when I’m working out and my music randomly stops. Even after all that, this app is still really good and I would recommend it.",https://itunes.apple.com/us/review?id=324684580&type=Purple%20Software,2022-11-10T09:53:06-07:00
9047044262,Chloe🎵,https://itunes.apple.com/us/reviews/id1444273679,8.7.62,2,Being non-premium,"In my opinion, it feels like people that are non-premium barely get any freedom in the app. Ever since my free trial ended, my playlist has been stuck on shuffle mode. I can’t choose a specific song or play anything on repeat. And when I search for a certain song, all that pops up is the album the song is from. And even then I can’t pick the song I want or skip to it, I have to listen to the album until it gets to the song I’m looking for. I’m allowed ONLY 6 skips and then I have to wait a whole HOUR to get more. Usually it takes more than 6 skips to get to the song I want. Referring back to the ‘stuck on shuffle’ issue.. when my playlist “ends” it doesn’t actually end. It starts playing random songs. I feel like once the playlist ends it shouldn’t start playing random songs, it should just stop playing songs all together until you start playing another song or restart the playlist. Using this app while not being on premium just feels very, very restricting. Way more restricting than it should be.",https://itunes.apple.com/us/review?id=324684580&type=Purple%20Software,2022-09-02T23:59:33-07:00
8230845862,minecrafter_673,https://itunes.apple.com/us/reviews/id1241885628,8.6.94,5,Great music app! 🎵🎶🎼 ⭐️⭐️⭐️⭐️⭐️ 👍,"I love all of the music that is available and the fact that you can download the music and listen to it without can be so useful and even being able to make playlists is also something useful and the music experience has been really good,🎵🎶🎼 and being able to filter out the music that has swear words is useful however I will point out that there is only one big flaw with the app which is that for parents who allow their their kids to use the app is that the explicit content filter can be turned off without entering and I would suggest that you make it so that a password would have to entered in order to turn off the explicit content that way parents who allow their kids to use the app will be able to make sure that their kids are not listening to bad content, but besides that the app is great. 👍",https://itunes.apple.com/us/review?id=324684580&type=Purple%20Software,2022-01-11T20:18:27-07:00
5408515962,Cmbsax5917Starwarsfan,https://itunes.apple.com/us/reviews/id498681124,8.5.40,1,Why not higher?,This app used to be the highest of my phone but with every update the layout of the app gets worse and worse. The current layout of just playlist is so inconvenient as opposed to the previous one where it would have your most recently played music laid out. The moving of the settings to the home screen makes changing the EQ and sound quality such a burden in comparison to what it was. Also I used to be able to go under the artist tab and even able to listen to all the songs I have saved from the artist specifically but now if I go I see ALL of the songs instead of the the saved despite being able to do that before. These last few updates have been rather reductive and if they continue to degrade I WILL find another app to use for my music. I highly recommend the company roll back some of its cosmetic changes to the app because they ARENT good changes. And also return some of the practical functions the app used to have like being able to listen and shuffle to specific saved song by artist instead of having to make an entire playlist just to be able to listen To one artist or one album.,https://itunes.apple.com/us/review?id=324684580&type=Purple%20Software,2020-01-15T16:27:00-07:00
4381167756,middlenameray,https://itunes.apple.com/us/reviews/id24224783,8.5.7,2,Please fix how saved music works,"Edit: the new update has made things worse, unfortunately. Songs from a saved album continue to be “liked” when you remove the album from your library. Still no way to download individual songs from an album without adding to a playlist or downloading all liked songs. Was holding out for better but this needs to be fixed please.

Previously, when I only saved select songs from an album those were the only songs that showed in my library. Now, when I go to the albums in my library every track on an album will show in my library, regardless of what songs I actually saved—even if I only saved one song from the album the whole thing is there. This really complicates my playback flow and makes it hard to download only portions of an album for offline listening. I hate this change and I’m not sure if it’s an intentional update or just a bug. This app was practically perfect before all the tinkering started a couple months ago. Please at least change this functionality back to how it was before.",https://itunes.apple.com/us/review?id=324684580&type=Purple%20Software,2019-06-28T05:47:15-07:00
7533555148,princess peachhhhhhh🤪🍑,https://itunes.apple.com/us/reviews/id1114081417,8.6.40,5,how good but also bad the app is,"the app is amazing and great but also not because sometimes it randomly stops playing is so annoying because all i want to do is listen to music without any interruptions. i have to restart my whole phone or sometimes delete the app and reinstall it again and it starts working perfectly. But i can’t keep doing that every time is takes to much time. My second reason is only 6 skips per hour?!?!?!!! at least make that 8 or 10 skips per hour that be a little better than 6 skips. 6 skips is to little because i play albums that play all the time but some songs are annoying and bad and when i skip a bad song another bad song comes on so i skip it and eventually i waste my skips. 

The app in general is amazing but please fix some of these things it can make everyone’s experience on the app more better.",https://itunes.apple.com/us/review?id=324684580&type=Purple%20Software,2021-07-02T23:54:06-07:00
5520337786,Nickname Face McGee,https://itunes.apple.com/us/reviews/id441627512,8.5.44,5,"Fantastic app, one suggestion","I really love this app and how it all works. I’ve made a playlist with tons of songs I like, and the shuffle play is great. Though I sometimes like to fall asleep with some music playing (I’m a white noise guy,) and since the app runs with the phone off, (which is a GREAT feature,) it would be cool if there was some sort of timer. On my iPhone, you can set a timer for how long the phone can stay on before it falls asleep if you don’t click for five minutes or so. Since the app stays running when the phone is off, I’d like some sort of system like that. Maybe you can just have a menu where you click, “play for 15 minutes before stopping” or whatever. If this isn’t possible, that’s fine, the app is still great.

Also if this ends up being added, obviously don’t make the timer mandatory, so the user can still have the “play indefinitely while the phone is off” option.",https://itunes.apple.com/us/review?id=324684580&type=Purple%20Software,2020-02-12T00:14:42-07:00
3581107359,SpicyPeaches,https://itunes.apple.com/us/reviews/id861939859,8.4.79,3,All songs?,"It’s an awesome app to listen to music, but you can’t see all the songs by an artist. Only the most popular and latest release. That makes it almost impossible to find some songs. You should be able to search songs from an artist.
            Also, it reset my entire app! I went on to play some music and then it made me log in. Apparently, it didn’t save my account. Now I have none of my saved songs or any playlists.
            I also wish there was diversity all the recommended songs are immediately rap and pop music. I myself am NOT a fan of rap or pop. I know there a lot of other types of music and people who feel how I feel about those genres, there should be a mix. Like instead of always making it Ariana Grande, XXX, Drake, e.t.c (I swear I learned pop and rap music from your recommendations.)there could be some Vance Joy, Alt-J (Δ), The Lumineers. That would be nice. Also having a page to access queue easier would be great. 
              Lastly, there should be a page where lesser known artists could get known.",https://itunes.apple.com/us/review?id=324684580&type=Purple%20Software,2018-12-27T13:23:04-07:00
8046032723,Mcatttty,https://itunes.apple.com/us/reviews/id171920240,8.6.80,4,It keeps pausing randomly,"Whenever im listening to my liked songs on shuffle, like every other song that plays pauses at 10 seconds and when i press it to unpause, it doesnt work so i have to skip that song. And sometimes when i skip the song and it goes to the next song, that song doesnt even play and it gets stuck on paused too. Its been like this for like a few months now and everything ive tried to fix it hasnt worked. The only way im able to listen to music without the songs randomly pausing is if i search up an artist and play one of the songs it recommends to me when i search their name, then after the song that i chose from that artist ends, it plays other random music thats kind of like that song or in that genre. Overall Its really annoying and makes me rage a little on the inside whenever it happens so hopefully that stops soon or else im gonna have to start seeing a therapist.",https://itunes.apple.com/us/review?id=324684580&type=Purple%20Software,2021-11-20T18:32:13-07:00
4178904454,Matthew Simmons,https://itunes.apple.com/us/reviews/id554031539,8.5.6,1,Blatant lies,"Don’t list your features as shuffle play when you’ve established a set playlist. I tested your forces “shuffle play” mode and when I switched between stations and then switched back it was the same song and not only that but it was the same place in the song. Shuffle is a lie if you keep playing the same song in the same position every time it’s a set playlist not a shuffle play. If you really want people to spend money on your app it had to work for free in order to entice people to spend money on it, a broken app doesn’t entice paid followers. Please don’t lie to me and then try to sell me a premium service that is the same service minus you dicking me and all other potential customers over. Shuffle means something as does every other word in the English language. I would not describe myself as a paid subscriber if I had not “paid” because in English words have set meanings that society only sustainably exists because we all agree on the definitions. If I tell you I’m going to touch you in a shuffled position, and every time I punch you in the face, it’s not really shuffled is it....don’t lie to me and then try to charge me money.",https://itunes.apple.com/us/review?id=324684580&type=Purple%20Software,2019-05-19T21:45:11-07:00
9117112590,Just/g a b b y,https://itunes.apple.com/us/reviews/id1432198173,8.7.68,4,Suggested songs,"Yeah the app is nice, I like the fact that it’s not just the originals that they show. But I would deeply appreciate it if they'd stop playing suggested songs. Idc if my playlists is short, maybe I want it that way. Maybe they could have a list of suggested songs we could listen to if we wanted to but not automatically play it right after the playlist is over. I just want to listen to my playlist on repeat without getting irritated 24/7. ALSO, when I look up a song, I’m not looking for the playlist it’s in, I don’t want to hear all that. Like when that happens it makes me wanna delete the app, wait a few weeks and then download it again when I’m not upset, which has happened multiple times. And when I do find just the song, I CANT EVEN PLAY IT. It’s absurd to me. I think if this was changed that it could really better the app and people would like it more. This is just my take on the app 👍",https://itunes.apple.com/us/review?id=324684580&type=Purple%20Software,2022-09-24T07:54:54-07:00
