id,userName,userUrl,version,score,title,text,url,updated
7510331756,Norlanor,https://itunes.apple.com/us/reviews/id602985137,2021.6.15,4,I like the game but can’t play it anymore,"I’ve been a player since October or November in 2020. I was constantly playing with my friends and I had a lot of fun with it. It was always highly enjoyable to stab my friends in electrical, or nervously run around doing tasks while you suspect everyone. And even when I stopped playing as often, I would still revisit it quite a bit for two more months before I had to focus on school.

Well, now that it’s summer, I wanted to play again. Especially after the updates with the new map and new colors. And I tried to play. But the chat feature doesn’t work at all. Every time I tap it, nothing comes up. I can’t talk to the other players at all, and I end up getting voted out as a result. It’s not fun that way at all. I want to talk and tell them what I see. I’m not malicious towards other players unless they say something rude first. But my chat doesn’t work in any of the maps. I can’t play it anymore because of this chat issue, and I don’t have it downloaded anywhere else. 

I tried to join the discord server to fix it. I waited for ten minutes and agreed to the rules but it didn’t work, so I’m not sure what to do. I really like this game and want to keep playing it, but can’t if I can’t talk to the other players.",https://itunes.apple.com/us/review?id=1351168404&type=Purple%20Software,2021-06-26T20:41:08-07:00
6624314637,meat dorito,https://itunes.apple.com/us/reviews/id1148848803,2020.10.22,3,GAME FOR GODS OF MYSTERY (or a big fat toxic community),"This is legit one of my fave games. I am not rating it based on gameplay, because that would mean that it would be five stars. My  2 star review is because of the community. Now, the reason it’s not 1 Star is because I met some really good people. Like IJevI, they were kind, friendly, and nice. They wouldn’t even kill me if he was the impostor. He would legit kill everyone else and leave me be. So I did the same. But on the other hand, ITS RADIOACTIVE ☢️ X TOXIC X 1,000,000. I’ve seen people being racist, trolls, hackers, cheaters, discord tryhards (people who cheat by letting their friend get killed and their friend tells them who it is), and more. That is absolutely unacceptable. I am not giving up among us, just warning y’all of the murky waters ahead if you get this. Add friend system!!! I want friend system!!! Don’t do so in the next update, and I am telling my friends it’s a bad game, it is sparse in terms of account management (cuz there is no account managements or accounts at all) it has a toxic community, and can have bad connections sometimes. Edit: well, thanks for adding anonymous options! It will help a lot in games. I also appreciate you adding symbols to the wires for those colorblind people. Still, add a friend system. I really want to add my friends. You need to fix this. I meet new and kind people. Develop friendship. They only last a day. 😞😞😞",https://itunes.apple.com/us/review?id=1351168404&type=Purple%20Software,2020-11-08T17:35:53-07:00
6555852725,tumbleJess,https://itunes.apple.com/us/reviews/id666309157,2020.9.9,5,"Great, but.....","Honestly I would give this game like 3/5 stars, but I’m not, simply because I want my review to be seen. I love this game. I love the concept, the fact that you can play with friends, and of course the cute little characters. However, recently I’ve been having quit a few issues with the game that is causing me to not want to play. First of all, I have probably played around 10-15 games today. I was not an imposter in a single game! To me, that is just not right. I understand that the imposter is probably chosen by random, but there has to be a better system. Let’s be honest, most people really want to play the imposter, so when every single game you join, your assigned a crew mate it can become extremely frustrating. My second problem with this game is even more frustrating. Whenever I purposely log out of a game I’m not allowed to join another game for 15 minutes!! That is extremely annoying because I obviously logged out the game for a reason. Like today I logged out because I had to go to a class, and I didn’t have enough time to finish the game. It’s like their punishing me for playing their own game. So I don’t know how much longer this game will stay on my Home Screen, but from experience it probably won’t be much longer.",https://itunes.apple.com/us/review?id=1351168404&type=Purple%20Software,2020-10-20T10:48:22-07:00
7200976047,Ch!cken Wingz,https://itunes.apple.com/us/reviews/id1001325037,2021.3.31.2,4,A little too much?,"i don’t write reviews, especially if i know that i’m just going to delete it but for this i’m not, i’ll give you a chance. I really like playing this game to pass some free time or when i’m bored and i’ve met many amazing people on here. One thing i’m not really sure on is why we can’t chat regularly anymore? I understand that you want to have your game more kid friendly but the quick chat system is very confusing and not much could be said. For example, I was playing a game once and it was super funny on how it ended so i wanted to express how i felt about and congratulate the people who won but i couldn’t, didn’t find anything that’d fit what i wanted so i gave up. 

A way to better this is by making it how it was before? I think that was better than right now because it feels like you either make the choice to struggle with finding what you want or just or respond. Yes, i know the will inappropriate, immature, rude people (mainly early teens/tweens) will still be messing up the game in their ways but do you have to bring it down to this? Isn’t there a way to block out the words that aren’t so kid friendly? I’m just giving you my opinion and ideas about the game but overall i don’t really see a problem with anything else..",https://itunes.apple.com/us/review?id=1351168404&type=Purple%20Software,2021-04-08T23:23:28-07:00
7434774461,SegunTheRollingSkyMaster,https://itunes.apple.com/us/reviews/id1039144731,2021.5.25,4,Good game! But... BUG REPORT.,"This game is pretty good with the addition of the quick chat isn’t really that good, especially if your parents don’t really know what to do for the clarification either way, this is mainly about a bug that I’ve been dealing with it for a month for now. I called is glitch/bug loading bug/glitch this is basically went around starts, then it takes long to load. Then a meeting starts and you can’t chat, or you get Spohn killed because you couldn’t load on time but then everyone suspects you to since you are near a body basically let’s say you’re in the situation i just talked about.  should I just put it out that this glitch is really annoying and frustrating to deal with I need to be fixed ASAP. So basically the imposter meant to kill you but then he had nearly killed someone else then we will load in everyone suspects you when when you lower it and like an emergency meeting just start everyone suspects you you have nothing else to say but I didn’t wanna time they don’t believe you I said I just want you out in like when I say it’s not the imposter he may just say ""wow hacker""but I wanna make this with you too long because you couldn’t get the idea please and a sloth another report as well please. thank you goodbye!!!",https://itunes.apple.com/us/review?id=1351168404&type=Purple%20Software,2021-06-06T13:54:30-07:00
7590918881,SavageWolfGamet,https://itunes.apple.com/us/reviews/id862109664,2021.6.30,5,Good but a few problems…,"First of all, I think that this is a really good game and it’s fun to play. I’ve always liked murder mystery types of games so I really enjoyed playing this. However, the new update sorta ruined it for me. You can’t chat freely unless you log in to your account, give an email address, or if your under the age of 13. And yeah, I understand why they did that; there were lots of people cursing, saying terrible words, cyber bullying, online dating, etc. But it’s still annoying. You can only say certain things and I can’t ask “why” when someone accuses someone of being imposter. Plus, you can’t change your name freely either unless your logged in or at least 13. Again, I get why they did that, but I’d like it if you could just censor inappropriate names or tell that player that the name is inappropriate (same for the chat; you could just censor what the player is saying). To avoid the chat problem, you could just play with friends in a voice call. But some people (like me) don’t have many friends who play Among Us or video games in general. I would really appreciate it if you could just censor inappropriate stuff instead of not letting players say what they want :]",https://itunes.apple.com/us/review?id=1351168404&type=Purple%20Software,2021-07-18T08:14:46-07:00
6607411697,jennaand norma,https://itunes.apple.com/us/reviews/id1048450562,2020.10.22,4,"Awesome game, some issues tho",Among us is a very addicting game that you can’t stop playing. Although people always team on among us and it’s get kinda annoying. If you can make something to give them a warning that would be great! sometimes when I’m impostor or just a crew mate I get kicked out for no reason. It says “kicked out game due to issue” or “you need to update among us” but when I go to see if I need to update it it’s false information. People also flirt on among us or say they will track you down. I know you can’t do anything about the flirting but can you maybe ban or kick the people that say they will track you down. Don’t get me wrong I know they can actually track you done but it’s scary when people say that you. Overall this game is very very fun. I recommend maybe adding a free pack for like a baby. The pack costs 4$ I think. I don’t wanna waste money on a game I’m not gonna play forever. Can you make a free pack? Maybe it can just be a baby or even just a stickman! Maybe you can add new colors. You can also add more cams? Not in rooms but maybe add a cam in weapons and cafeteria and communications. You can also add at least 2 more rooms. Maybe a restroom and the task is to put toilets next to eachother. This game is overall one of the funnest game to play with friends and family. Keep it up!,https://itunes.apple.com/us/review?id=1351168404&type=Purple%20Software,2020-11-04T01:37:59-07:00
7196631743,Tosho player 0ne,https://itunes.apple.com/us/reviews/id1095753601,2021.3.31.2,3,Bad update,"Ok, I really love this game and was looking forward for the new air ship map, but unfortunately with the other stuff that came in the update I couldn’t even bare to finish a game. In the new update it makes you have to put an age! Which 99.9% of kids just put older ages.  Instead of doing this you should have made players have to put in some information, meaning young kids would have to have there parents sign in for them. And now that in the hypothetical situation only parents and older teens can log in there should be an option to have the quick chat on or off, and if you have it on you will ONLY be able to play with others that have it on so it will be age appropriate, meanwhile teens are teens so yea... also I would like to address the random name situation. I HATE the random name since I was “sonic the hedgehog” and now I’m Fredrick!!!!!!! (not even my name IRL-) so I think if you during the time you put information you are allowed to put a custom name, therefore adults can make there children’s name and teens can make there own name. (And if you need to change these settings you have to do the log in process again) These are just my suggestions but I think because of the new update I really dislike among us and I feel like not playing it any more, but if you make these improvements then I will be happy to give it a 5 star!",https://itunes.apple.com/us/review?id=1351168404&type=Purple%20Software,2021-04-07T20:01:42-07:00
6803785261,xXx_SkyL0ve_Roblox,https://itunes.apple.com/us/reviews/id1189653871,2020.11.17,5,"Among Us Is Great, But I have a few suggestions to make the game better!","Among us is really fun but sometimes it gets boring, the murderer sometimes refuses to kill so everyone is standing around and it gets boring. Also some people refuse to do tasks. And I was in a game and one of the imposters told EVERYONE who was the imposters and they were even wrong because they weren’t the imposter but it was really unfair because that person was right. Some ideas would be if you could figure out some way to A. Make it so the imposter cannot say who the other imposters are ( provided if there is more than one ) and I think two other things would be great, the first is make there other game modes, what I mean by this is like where you can do hide n seek, or tag or something like that, people have been getting creative and making the games into that but it would be fun if people could choose modes another thing that would be really really amazing would be if the imposter could get special knifes and you could also rank and you can build maps, I think being able for us to build maps would be sooo cool! These are just suggestions, I just think the game would be even better if we could do some of those things, bye! -Sincerely, An Among Us Player C=",https://itunes.apple.com/us/review?id=1351168404&type=Purple%20Software,2020-12-28T09:39:30-07:00
7166633932,Lazysloth123,https://itunes.apple.com/us/reviews/id629480857,2021.3.5,4,"Excellent Game, But Has Some Issues","This game is incredibly addicting. I always have a good time with my friends or online with strangers. The work done in this game by the four staff members of InnerSloth blows my mind. I'm posting this review prior to the release of the Airship update, which I've heard will release later today. I can only hope they resolve some issues, especially with Polus. The cameras on Polus are extremely glitchy. As you may have seen in other reviews, anything that moves makes a trail of itself across the screen. Another problem with Polus is for mobile players, like myself. When outside, the ground layer glitches out, hiding names and the edges of the map. This helps in no way when I'm playing as the impostor. A frustrating glitch on any map occurs when people leave. It upsets the algorithm, and when the game ends, it just shows a black screen. You then have to restart your game to play again. There is also a glitch with mid-game kicking. It seems one players kick vote may not register to another. This has only occurred a few times for me, but I just wanted to put it out there. Again, I hope that the developers fix this in the next update that drops today. Thank you, InnerSloth, for this wonderful game. And thank you, reader, for reading this extremely long review.",https://itunes.apple.com/us/review?id=1351168404&type=Purple%20Software,2021-03-31T06:46:48-07:00
8170902645,dmangamingformula1,https://itunes.apple.com/us/reviews/id506236670,2021.12.15,5,Hackers and stupid ping UPDATE: hackers are gone this review was written in January 2021,"So.... first time played. Loved it! Got Impostor, got the victory. That was 2019. Listen... in 2020, this game grew. But midway through 2020, hackers like Eris Loris have found their way into the game. And hackers like mod people have been using auto impostor, no kill cooldown, and noclip. I am mad. Now with the quick chat feature? Stupid. (not anymore I fixed my account ignore that) And the names? YOU BANNED THE BLANK NAME. Why? Why? Whyyyyy? Also, the people call emergency meetings (people as in the modders) and say “This guy is the impostor I saw him vent” AT THE START OF THE GAME! and, people cheating? OHHH YES THERE IS! People are on discord, and they are on a call. So when a impostor kills one of the people on their call? THEY CALL A EMERGENCY MEETING AND SAY “It’s (this color) my friend on discord told me.” It’s stupid. Also people are dating. Thats unfair. And another thing is the ping. When I play on a iPhone 13 pro with full 5G, it kicks me out and banned me for 5 min for “intentionally disconnecting”, but I don’t. Please fix that. Thank you.

UPDATE: I am currently banned for 2 hours for “intentionally disconnecting” when my ping has kicked me out so many times. Hopefully you get this fixed thanks.",https://itunes.apple.com/us/review?id=1351168404&type=Purple%20Software,2021-12-26T07:07:04-07:00
7366860611,arterinapiklechuna,https://itunes.apple.com/us/reviews/id180143196,2021.5.14,3,Some changes,"I used to play among us everyday whether I would play alone or with friends. Overall it was a fun time and one of my favorite games. After a while of not playing I deleted the app thinking I would never play again due to just loss of interest. But just a couple of days ago a friends requested we play Among Us together and I thought it was a great idea as I used to enjoy the game so much. After reinstalling the app I soon noticed some changes. I’m not sure if I am just not tech savvy but the game now choses your name and I am unable to change it. Also there is not more freedom to type anything in the game chat. What I liked so much about this game was the ability to make friends, communicate, and create almost a bond with your teammates that would help you win the game. Because of the new update I find it hard to enjoy the game as much as I use to as some aspect of freedom has been taken out of the game. I don’t understand this update at all and I don’t know who prefers this version. I feel that it is very difficult now to play and the old version of the game was much better. Now every time I play I feel a negative aspect if because I can no longer create bonds with the people in my party. I hope you take my review into consideration as I feel I am not the only one that feels like this.",https://itunes.apple.com/us/review?id=1351168404&type=Purple%20Software,2021-05-20T11:45:32-07:00
7217233520,kelsea clarke,https://itunes.apple.com/us/reviews/id1238901815,2021.4.12,3,I don’t like the update,I don’t like the update I am on this because I should be able to write my own name and make up my own name and I also think that it’s not fair that I should have an account I play I would guest that myself but I think that it would be more fun when you could just play by yourself and I think you should change it I want to give you guys five stars because there’s not like a lot of bad things on among us but that is the most seen a lot of bad things but because of the new update I don’t like it also I know that people are are using games to like do bad things are like say bad things but honestly it’s like you could just add a filter actually like in roblox do you have this thing where you can’t say that bad word in the chat or something like that so you can like do that instead and so just do that and just put back the typing everyone needs typing and you could just put the typing there and have that stupid filter on the side where everyone has the chat or is it and also not to be greedy or anything but I was wondering if you could give free skins out because not a lot of people are able to buy the skins and I know that’s how you might be able to make money but not a lot of people could add some people might could set up on my want to like me so yeah bye,https://itunes.apple.com/us/review?id=1351168404&type=Purple%20Software,2021-04-13T04:19:32-07:00
6513132580,charlie👋,https://itunes.apple.com/us/reviews/id958625223,2020.9.9,2,It was fun until...,"I found this game through pewdiepie and was super excited to find that it was on mobile so I could try it for myself. The first few weeks were great until....it became popular. The community with in the game itself is very racist, homophobic, and just toxic in general. Also because of how popular it has become their are more hackers. I feel that their should be forbidden words that will prevent you from joining games for one hour if you use them more than 5 times. I try to spread positivity in the chat reassuring people that it’s just a game no need to get mad. But... when I do I just get called racial slurs, homophobic slurs, and horrible names in general. When joining a game on WiFi it will keep saying unable to connect. And it is too hard to kick people from games especially when everyone has to vote for them to leave. Teaming is a HUGE issue in the game with entire groups of friends outing the imposters as soon as the game starts. The emergency button is used too often... or often use it to SAY HI!!! I find it frustrating when trying to play the game. PLEASE ADD A VOICE CHAT OPTION!!! This would make the game so much easier and I feel that it would defer toxic language because you can hear a person’s voice. Also, many bugs ranging from, game connection error to animation glitches. PLEASE FIX THIS!!!! 

P.S : Sorry for the long paragraph I just love this game but hate the negativity surrounding the gameplay!",https://itunes.apple.com/us/review?id=1351168404&type=Purple%20Software,2020-10-08T04:00:04-07:00
6422382648,Coco1666,https://itunes.apple.com/us/reviews/id601158548,2020.9.1,3,Add a party and friends system,"I absolutely love this game and have been playing it for 3 months before it blew up like crazy I found it after the Henry stickmen collection came out on steam, a game that I also really loved. But my main criticism so far with this game is that there no friend list , party options or native voice chat instead of typing everything down it’s hard to get your meaning across through typing and since I’ve been playing it on mobile it’s even worse since it takes forever to type on my small phone. If you’ve ever seen the game paladins  or games like it , that’s the type of friend / party system I think would be the easiest to implement. It would automatically put in 10 random people in too ever round/ game you would make your party before the round starts one of your friends in the group party would be the leader and pick which game the group wants to be in all of them would get automatically placed in with a game that needs like 4 or more people or however many people you have in you’re party. And you could have the friends lists through steam connect into among us like other games do so if you’re friend also has they will automatically be you’re friend in the game. I hope this makes since and helps I think it would be a wonderful addition to add native voice chat and friend groups in number two.",https://itunes.apple.com/us/review?id=1351168404&type=Purple%20Software,2020-09-12T11:34:09-07:00
8045621252,Tesork,https://itunes.apple.com/us/reviews/id1202952470,2021.11.10,5,One of the best online games ever! A few suggestions.,"Dear Innersloth,
I love your guy’s games Im a really big fan of the Henry Stickmin Collection too. So I have been playing this game since it got really popular last year, and I absolutely love it! I am so obsessed with Murder Mystery’s, so this game is perfect for people like me. I love the new role and Cosmicube update too, I really think this will bring it back. I have a few request though, Could we possibly get a hide n seek mode? I really like playing Hide n Seek on among us, it’s good for when you are playing privately with friends and their aren’t a lot of people. But is also quite annoying when I join a server and people are playing hide n seek without letting me know. I feel like if there was a section for hide n seek in the map section it would be easier for people to find/stay way from. Next, when I was on the shop, I saw a new pets section, I know we already have the Airship and PLENTY of Henry Stickmin outfits, But could we PLEASE get a Charles Calvin, Burt Curtis, and Reginald Copperbottom pet? I feel like more people would buy the Stickmin Bundle if some more characters were added. Anyways those are my thoughts thanks if you read it :3  

- Lucy The Imposter >:)",https://itunes.apple.com/us/review?id=1351168404&type=Purple%20Software,2021-11-20T15:42:24-07:00
7652180320,Pesron2e9r8458e9434m,https://itunes.apple.com/us/reviews/id570726846,2021.6.30,3,Pls Read This,"Ok so, the game used to be 1 of the greatest, but since the new update, a lot of people hate it. But, 1of the reasons they made this update and took out free chat is… there are A LOT of toxic, beyond inappropriate people on this game. Yes, there have been hackers, spammers, but… I’ve seen a lot of creeps on it. I’ve seen people giving out there Snapchat or phone numbers to people they just met and only through this game. It’s extremely dangerous, in so many ways, and in ways that truly terrify me. People get stalked, sexually assaulted, raped, killed, and sometimes, it happens bc people give this info to people they just don’t know, they meet through this game, but honestly, you don’t know who they are, you don’t know if they’re telling the truth, giving this info could put you in extreme danger. Also, many people on the app like to role play. I understand that, I love role playing, pretending you’re in a different world, but some people have sex role play. It’s the truth. I’ve seen it. The game will never be the same as it used to be, but the truth is, it’s so much more safer than I could ever explain. I don’t care about the other updates, but they can’t put free chat back in. It’ll put so many people in danger. Thank u for taking free chat out. Pls don’t ever bring it back, it could save many people. Thank you.",https://itunes.apple.com/us/review?id=1351168404&type=Purple%20Software,2021-08-03T18:16:00-07:00
