id,userName,userUrl,version,score,title,text,url,updated
7415382290,Geared up with fun,https://itunes.apple.com/us/reviews/id149369317,8.6.30,5,Ads ads ads ads (music) ads ads ads ads,"I'm not gonna pay premium for yet another thing, so I get it, ads are my ""payment"" to choose using this app for free. And before it was fine. Ad plays, listen to music for AWHILE, ad plays again. Now, even when it says, ""enjoy the next 30 minutes of ad free music"" after listening/watching a particularly long ad, it'll only play one or two songs MAYBE before another ad is played. And sometimes it stops playback in the middle of a series of ads, so when you go to ""continue,"" it plays the ads AGAIN before going back to the music. I might as well listen to terrestrial radio if I'm gonna be listening to this many ads. Not that anything will come of this review right? I'm not paying for the app so screw my opinion/experience.",https://itunes.apple.com/us/review?id=324684580&type=Purple%20Software,2021-06-01T15:07:23-07:00
9458798842,Mike bis,https://itunes.apple.com/us/reviews/id217034706,8.7.94,2,Great app But.,"I like being a premium because with it you get add free music and you can listen to any song you want to. No matter what  kind you like. You can go from Rock to Oldies to classical. Or my sister loveEngelbert   Humperdinck. I know I spelled that wrong. But I think most people know who I’m talking about. Or the Brady Bunch Christmas album. The bad part is I have it on my iPad. I couldn’t pay one month because I had some big expenses thst month. I  have been batting Cancer for six years now. I went to see my doctor and found out it’s  stronger and has spread more . So I’m kinda bedridden. I can walk around my house. To use the restroom and the kitchen to get foos . But I have trouble walking out of my house. Iypts not fear, it my back and knees. I am not asking for anything. I don’t need money. I ask for prayers, nothing  more.  The problem is I went to free . I want to go back to premium? But I can’t using the app?  How do I get the premium that’s $9.99.?  If anyone can help me, I would be thankful..",https://itunes.apple.com/us/review?id=324684580&type=Purple%20Software,2023-01-01T06:20:15-07:00
6828036177,Jaypeeez,https://itunes.apple.com/us/reviews/id23191824,8.5.86,5,I love it!!! But a few changes.,"It’s so good!! First, you don’t have to do pay about like what? 14$ a month. Second, off it has nice audio. Third off there’s are some things I would like to change it’s that please stop adding on songs that people don’t want to hear just keep the songs that the real person put. It would be really helpful. Also, I would like it if you did let the person who skips A song you should let the person go back if they accidentally missed clicked. Also, l would love it if you gave people more skips because I have to wait 6 whole hours. It’s annoying please fix that also can we have 10 skips. Also please let people change their icons whenever they want. Otherwise, it’s a good app. I hope you can fix the changes that I requested! Thank you if you are getting this message/ review",https://itunes.apple.com/us/review?id=324684580&type=Purple%20Software,2021-01-03T17:22:14-07:00
7182584614,annoyed.anon.,https://itunes.apple.com/us/reviews/id1232036211,8.6.12,4,Just one thought.,"My last review was a complaint about how you guys repeat the same ads over and over, and you fixed it. Mostly. Thank you; that was considerate. 

What I would like to bring to your attention this time is that when you make promises, you have to keep them. This issue is beginning to happen with the “watch this video to get thirty minutes of add-free music!...(yes, really!)” 

So I click on the add, watch the add, sometimes even enjoy the add...and then six minutes later I’m getting the same thing. I don’t know if it’s a glitch or not, but it may become a problem if it is happening with more than just me. If you tell people that they can get thirty add-free minutes of music if they do something, and then they DO that stuff, and you don’t give them the 30 minutes...it’s like shorting someone on a payment. Nobody likes that.",https://itunes.apple.com/us/review?id=324684580&type=Purple%20Software,2021-04-04T05:36:06-07:00
6957557605,111111111111111111111111----1,https://itunes.apple.com/us/reviews/id364746149,8.5.96,1,Shockingly bad app,"I love this service and have used this app for years, but this app runs so badly that I am starting to consider swapping to Apple Music. The download music function is a joke. Music that I have had downloaded for months will randomly not be available whenever I leave service. Entire playlists will decide they need to re-download on a whim. It is impossible to access downloaded albums without service, it will just attempt to load indefinitely. The only way to actually have radios download is to open the app and go to the radio everyday after they update (sometimes they never update at all!). Another great feature is how the app will randomly close itself mid-song, this is awesome whenever you’re in the middle of an activity and have to stop to reopen the app. The crashing has been much worse than ever for the last 2 updates. 
I’ve been putting up with the quirks of this app for years but now I’m wondering why I’m paying $10 a month for an app that I constantly have issues with.",https://itunes.apple.com/us/review?id=324684580&type=Purple%20Software,2021-02-05T08:12:39-07:00
6553182364,FarmGirl7003,https://itunes.apple.com/us/reviews/id413980115,8.5.80,5,Only a couple problems,"Like the app. It’s pretty straightforward and makes it easier to find new music. I’ve had problems with it glitching or something lately though. When I tried to play my liked songs it started playing random music. I checked and it was because none of my liked songs were there anymore. The songs were still liked when I looked them up but I had to relike them to put them back in the liked album. Problem is, I don’t know the names of most of the songs I had in there. Kind of inconvenient. 
The second problem is that whenever I watch the ad for 30 minutes of free listening, it never gives me more than 4-6 songs before it starts playing a series of ads. It’s a little bit annoying so I hope it’s fixed soon.",https://itunes.apple.com/us/review?id=324684580&type=Purple%20Software,2020-10-19T17:25:36-07:00
6701471104,Crockhat,https://itunes.apple.com/us/reviews/id841473030,8.5.86,3,so many songs i dont like and dont listen to,so yknow listening to some music like legends never die and others then i song i dont like pops up so i dont think we should have the songs you guys added because i cant listen to any of my songs execpt your guys songs its making me annoyed how i have to listen to a random song that pops up that i dont like so can you guys remove the songs you added feature please i dont want it sorry if this makes you sad:edit and i have to listen to a track that YOU guys suggested like oh yeah lets make a child listen to random music i got so annoyed i wanted to delete the app like why suggest tracks people dont like you guys need to fix that like i would probably get a african jungle song thats sugg so you guys need to fix that i cant listen to the song mama just becuae you guys listen to your own music doesnt mean we like it if you guys like something maybe we dont so can you guys fix that feature and remove it,https://itunes.apple.com/us/review?id=324684580&type=Purple%20Software,2020-11-29T23:11:18-07:00
6628525302,Faint366,https://itunes.apple.com/us/reviews/id977213390,8.5.83,1,Progressively worse,"About a year ago there was an update that made it so to search your library for a specific artist you had to be following them like this is discount Twitter. Annoying but fine, I’ll just follow my artists and then I can still search my library for a specific one and play them when I want. Now that’s not even possible. Searching YOUR LIBRARY for an artists will show you that artists ENTIRE catalog, regardless of how many of those songs you’ve actually saved. Why even have an artists tab in your library if that tab takes you to music that isn’t in your library? The artists tab takes you to the same place that a regular search takes you. If the goal was to “streamline” the app then you just made two routes to the same destination, while removing a vital feature.
Now, if you turn off data and click on the artist you’re given a “downloaded songs” option. Was it really too difficult to give this option when data is turned on as well? Why do I have to cripple my phone to make the app usable?",https://itunes.apple.com/us/review?id=324684580&type=Purple%20Software,2020-11-09T23:23:41-07:00
4484903499,Richierod,https://itunes.apple.com/us/reviews/id553307476,8.5.15,5,Only problem,"I really love this app, tons of music and podcasts. I love the download capability for days when I’m going to be away from signal or just want to save data. However I do have one problem with it and it’s kind of a big problem for me. Whenever I stream over data podcasts don’t always save my spots or they’ll stop all together and jump to the next episode which is super inconvenient because lots of times I’m working where I can’t just go back to the last episode. When these two combine I’m stuck either relistening to majority of the podcast or even all the way from the beginning! Especially since I can’t just fast forward for some reason I’d have to sit there and listen to the entire thing in 15s blips or at x3 speed. I really hope they fix this soon as lots of my friends complained about it as well",https://itunes.apple.com/us/review?id=324684580&type=Purple%20Software,2019-07-19T04:13:41-07:00
8992080115,Everything2381,https://itunes.apple.com/us/reviews/id1397393806,8.7.56,5,I’m angry!! 🤬🤬🤬,"So I used to love this app! I had it for about a year on two devices with two accounts! I could skip any songs and Liston to any song I wanted to! There were still adds and I couldn’t Liston off line but I was ok with that. Suddenly, during a song, it wouldn’t let me skip a song and didn’t even let me see my list. I could only play about ten seconds of a song!! I’m furious! I deleted Musi today because this app seemed to be better and now I realized my mistake. I want you to fix this Because I’m going to spears the app with in a week if you don’t even say something about it. If this is a glitch, please fix. I turned my phone on and off and nothing worked meaning that this was purposeful! I’m so angry, fix this app and make it the lovely music app it once was!!",https://itunes.apple.com/us/review?id=324684580&type=Purple%20Software,2022-08-18T10:27:06-07:00
3950971392,yoshihitoismydad,https://itunes.apple.com/us/reviews/id423512149,8.4.98,2,Can’t restart playlist,"So, the app is great, yeah. Good music, doesn’t drain my battery like some other music apps. However, the user interface is pretty bad, meaning you can’t restart your playlist. Once it’s done with your songs, it plays some recommended songs, aka songs that aren’t in my playlist, aka songs I don’t want to listen to. I know some people appreciate this feature, but not me. I only want to listen to the songs in my playlist and nothing but, however there is no way I can restart my playlist. I’ve googled it and everything to no avail. I’ve seen people say “there is no easy way to restart your playlist” but I can’t find any way whatsoever. Please, just please change this so I don’t have to use some other bad app that crashes every three songs. Also, what’s the point of shuffling when it plays your songs in the same order anyway? Yeah, it plays it in a random order, but it’s that same random order every time. Mix it up! Overall, good as an app, good idea, bad execution.",https://itunes.apple.com/us/review?id=324684580&type=Purple%20Software,2019-03-31T04:36:47-07:00
9867469135,President Joe Mama,https://itunes.apple.com/us/reviews/id614928584,8.8.30,2,Terrible Update,"Remember how easy it was like to like and unlike songs by pressing the heart button once? Well now you have to press a plus button and press a couple more buttons to add it to your “liked playlist”. Then you have to do that all over again just to remove it from your “liked playlist”. Remember how easy it was to find what songs you liked because they had a heart next to them? Well now that’s gone with this new update. You have to play every song individually to see which ones you liked which is not convenient when listening to playlists.

Also they added features that make it look like tiktok. As a premium member I’m not paying for a second version of tiktok I’m paying for the music app I’ve known and loved for the past several years. 

Bring back the well known user friendly perfect music app please. I’m convinced the people whose job it is to test new UI layouts really hate convenience and efficiency.",https://itunes.apple.com/us/review?id=324684580&type=Purple%20Software,2023-04-27T10:54:56-07:00
9741384360,ItsNotColton,https://itunes.apple.com/us/reviews/id1100934801,8.8.20,4,Stop changing the UI so much,"Edit: they fixed my issue by changing the behavior of the checkmark button, but these UI changes have just been nonstop lately. I’m fine with an improved experience, IF it improves the experience. 

This new method of “liking songs” is awful. 1) you can’t see what songs you have saved to your liked songs in a playlist anymore 2) adding songs to your liked playlist takes longer now (additional menu) 3) in car view, saving a song is now more dangerous because of the additional menu It really is not that hard to just make a “heart” button and a “playlist” button on the same screen. These buttons serve different purposes. Bring back the old method, this new one is garbage and I really hoped the developers would’ve realized it sucked when they were beta testing it.",https://itunes.apple.com/us/review?id=324684580&type=Purple%20Software,2023-03-22T15:55:54-07:00
8298199279,Chrismyster1,https://itunes.apple.com/us/reviews/id942870458,8.6.98,5,My reason to keep going on.,"This app has been here sitting on my phone for some years now. It has helped me through many steps in my life wether it be marriage, divorce, work, unemployment, etc. and if it weren’t for this app then I don’t know how I would make it through it. It has helped introduce me to a plethora of different artists that I have come to love and see grow in their careers. It has been so easy and compatible to use and rely on when you have your turn to play music with friends or even for yourself. The option to have music offline is also a blessing as it has given me the ability to keep my music even when I am for example camping or far away in the sticks. Overall this app is a phenomenal treasure and I wish I could give it a better score than 5 stars!!",https://itunes.apple.com/us/review?id=324684580&type=Purple%20Software,2022-01-29T19:46:21-07:00
7535319761,Dani.Tea,https://itunes.apple.com/us/reviews/id86409630,8.6.40,5,Plz fix the adds on JRE,This is my favorite app for music/ podcasts.  I’m fine listening to ads (even though I shouldn’t because I’m paying for a premium membership) but unfortunately once the ads start on the JRE podcast they literally don’t stop. I’ve tested this out and At some point I’ll just give up.  I’ll just shut the app down and go back to the podcast to find my place and just skip over the ad break.  However it’s very frustrating to do this while driving or exercising. I’m not sure if other people are having this problem with this specific podcast but it’s really irritating to deal with when you’re driving and all of a sudden your podcast is now playing like 10 minutes of ads…. It will NOT go back to the podcast after the ad breaks. Thanks  😎,https://itunes.apple.com/us/review?id=324684580&type=Purple%20Software,2021-07-03T10:12:10-07:00
8127246532,Emma Veliz,https://itunes.apple.com/us/reviews/id1149390767,8.6.84,4,Mostly Good,"Everything about the app is amazing, I am listing to it right now actually. My playlist has over 100 songs on it, and I can find most of the songs I want to add to it. There are also clean versions of most songs that have foul language. Also, they have added lyrics now that moves with the song, which is amazing as well! But the is one thing that is sooo annoying There are SO MUCH adds. And like I said it’s really annoying. Example, right now I have been listing to music for about 30 minutes straight, and there has been AT LEAST 13 adds. Probably over. I’m not joking. There isn’t even an option to skip it! (I think. If I’m wrong very sorry) So that is one suggestion I have for the app, is that there is a skip option on the adds. Then it wouldn’t be as bad. Otherwise, the app is great, I love it! Thanks for your time! 😁",https://itunes.apple.com/us/review?id=324684580&type=Purple%20Software,2021-12-13T15:09:14-07:00
7859698874,Ab1223445,https://itunes.apple.com/us/reviews/id106123821,8.6.62,4,The only app I’ve been using for music since 2015,Has every song I’ve ever wanted to listen to. The “radio” feature is great for discovering new music. Things that could be better - it seems that the “radio” feature tends to favor artists’ hits and there’s less popular songs from an artist won’t come up unless you go to the artist page and listen to all songs from the artist. Also I don’t like using shuffle in listening to my library of liked songs bc it will overly favor some songs and rarely ever play others. I’ve had to unlike some songs just so that they would stop coming up so often when using shuffle. I have 1405 songs on my list. I’ll instead just scroll to a random song on the liked songs list and play them in sequential order to get more diversity of songs (vs hearing the same ones too often).,https://itunes.apple.com/us/review?id=324684580&type=Purple%20Software,2021-09-29T17:17:43-07:00
5571458788,link15ink,https://itunes.apple.com/us/reviews/id923348883,8.5.46,5,Not bad but not good,The quality on my music is real good with my headphones my music sounds even better but what makes this app from keeping it from being perfect is the inclusion of limited skips witch makes this app makes me run out of skips before I get to the song I wanna get what I recommend for this app is to just let us listen to the song we want to listen to with out making us lose all our skips. Plus the inclusion of a premium hurt this app a bit the premium gives you unlimited skips and the ability to download songs but what I don’t understand is why I can not Download music from the beginning. Overall this music app is. It perfect but not bad if you want quality  music this is the app but warned you we’ll have to skip a lot to get the song you want.,https://itunes.apple.com/us/review?id=324684580&type=Purple%20Software,2020-02-23T13:28:53-07:00
8189571105,Pepper Onella,https://itunes.apple.com/us/reviews/id1359633557,8.6.84,5,Almost perfect,"Spotify’s almost perfect, but I feel like the fact that there are so many things that are added in the premium that you’re missing in the free version is kind of crazy. (Though it does make people want to buy it more so credit to them on that.) Also, I think the algorithm that shows songs that are similar to each other could be improved, because I end up seeing songs that I’ve already heard or know, and I think it would be better if it showed songs that are similar, but that I have not heard. (So that there’s not so many repeats, especially in the daily mixes. Usually it’s things I’ve already liked or listened to multiple times. Which can be good or bad.)

Overall, it’s a great app I just think there could be some improvements.",https://itunes.apple.com/us/review?id=324684580&type=Purple%20Software,2021-12-31T12:48:19-07:00
10053849457,TianBear,https://itunes.apple.com/us/reviews/id1190314567,8.8.44,1,smart shuffle is crap,the worst possible decision you could have ever made was ro force us to listen to your suggestions ever since adding smart shuffle my app has been so buggy to the point where i have had mental breakdowns and broke my phone because MOST PEOPLE USE MUSIC TO CALM DOWN. but now i cant use the shuffle button to refresh my playlist when you guys only play the popular music even though it says shuffle or else the app will bug and crash. i cant create a playlist in the queue to listen to because when it starts or if i press shuffle it will just skip the song im listening to and it is infuriating. its starting to look more worth the work of switching my thousands of liked songs to a new app then dealing with the amount of bugs smart shuffling brought please put in an option to completely turn it off AND I DO NOT MEAN ON THE CURRENT SHUFFLE BUTTON. THAT IS NOT ACCEPTABLE ON ACCOUNT OF WAITING FOR IT TO LOAD AND IT CRASHES MY APP. you already had weekly discover this was so unnecessary and im about to stop my subscription,https://itunes.apple.com/us/review?id=324684580&type=Purple%20Software,2023-06-20T08:25:30-07:00
8312128116,skfirehawk,https://itunes.apple.com/us/reviews/id1171965740,8.6.99,3,Not the best,"Well first of all, when I’m in a playlist or album it won’t let me see what songs are in there. In my IPad on the other hand; it lets me play any song and lets me skip as many times as I want (and I don’t have premium). On my phone it’s the complete opposite. That’s really annoying. I don’t get why being able to play any song in a playlist or album is a premium feature. If I’m trying to choose a certain song from a playlist or album; I can’t because it won’t let me see the songs. If it does (which is rare), it only lets me see a preview of the song or piece. I feel like some of the non-premium features are just unfair. It’s hard when you’re trying to listen to a piece you like but you can’t because without premium you can’t choose certain songs. Although, the app does have some good quality. It’s not that bad but it needs some improvement.",https://itunes.apple.com/us/review?id=324684580&type=Purple%20Software,2022-02-02T14:39:24-07:00
6693687296,Runnerchik7,https://itunes.apple.com/us/reviews/id290900272,8.5.86,5,Awful!!!!!! Don’t waste your money!!!,"After multiple days of trying to fix my account. Music just starts playing across all my devices in the middle of the night or if I’m listening to music it will just stop or start another song from a random playlist I have never heard of before mid song! It’s starting to get annoying when I have deleted the app, re-downloaded it, changed my password,  restarted my device, looked up solutions on line and people just wrote that it has happened to them and no solution has helped. After about 5 days now, I’ve had enough of the random music playing in the middle of the night across different devices in my home and the constant stopping of actual music I want to hear. I’m stopping my payments and going elsewhere for my music! Don’t waste your money!",https://itunes.apple.com/us/review?id=324684580&type=Purple%20Software,2020-11-27T19:32:26-07:00
7499297192,LukewarmThursday,https://itunes.apple.com/us/reviews/id532312653,8.6.30,4,Encouraging bait,"The music selection is good and there are some concepts that are good but there are some major issues with it that I cannot respect.

The immense amount of ads that play one after another are absolutely baffling, just now I got 5 straight, 30 second, unskippable ads. This alongside things like not being able to directly chose what song you want to listen to, instead having to shuffle a playlist; or the 6 skips per hour rule, really only have one purpose. There is no rational reason why these limitations would be put in place other than to siphon money out of its users that want to listen to their favorite artists. It’s scummy and it’s not even trying to hide it, they are essentially saying, “Yeah you can try and bare with these restrictions we set in place, OR you could pay us money to get rid of the issues we made.”",https://itunes.apple.com/us/review?id=324684580&type=Purple%20Software,2021-06-23T20:56:30-07:00
2197626579,Kim.m.1868,https://itunes.apple.com/us/reviews/id520070217,8.4.38,5,Could have some improvements,"I’ve been using this app for a few years and I loved it until recently. I hate making a playlist and not even hearing any of the music on it. I, personally, love musicals and try to listen to my favorites but I can’t. I don’t want to hear music from rappers when I’m listening to the music I was hoping I could hear. Also, I don’t appreciate getting false advertisement. I can’t be told to listen to an ad and get 30 minutes of ad-free music but have to sit through 5 ads, listen to three songs and get another 4 ads. I would really love to see a listen history. I don’t have premium and I usually leave my music playing off my speaker and phone when I leave the room so if I come back at the end of the song, and I like it, I want to be able to come back and find the song.",https://itunes.apple.com/us/review?id=324684580&type=Purple%20Software,2018-02-11T19:18:40-07:00
