id,userName,userUrl,version,score,title,text,url,updated
11059886583,Rich thokmey,https://itunes.apple.com/us/reviews/id1511889900,455.0.0,1,Very very expensive hospital,One microchip $109 😇👎🏼,https://itunes.apple.com/us/review?id=284882215&type=Purple%20Software,2024-03-18T16:46:26-07:00
11059851556,howhack,https://itunes.apple.com/us/reviews/id599721351,455.0.0,5,Just learned tagging,"I just learned how to tag. The

wife liked my pictures of her husbands birthday party.",https://itunes.apple.com/us/review?id=284882215&type=Purple%20Software,2024-03-18T16:31:24-07:00
11059846862,Zuck.puts.ketchup.on.steak,https://itunes.apple.com/us/reviews/id1553555960,455.0.0,1,Business Owners Beware!,"FB/Meta is a Stalinist regime. When they don’t like something, it “violates community standards”…when we’re abiding by the community standards to the letter. If it goes against the leftist narrative, you’re a target. Plain and simple!",https://itunes.apple.com/us/review?id=284882215&type=Purple%20Software,2024-03-18T16:29:28-07:00
11059799927,GGnop,https://itunes.apple.com/us/reviews/id494566811,455.0.0,3,Avatar,Eyebrow function is not working. Won’t let me add eyebrows.,https://itunes.apple.com/us/review?id=284882215&type=Purple%20Software,2024-03-18T16:09:55-07:00
11059711588,Vizcarras jumping,https://itunes.apple.com/us/reviews/id1311716310,455.0.0,5,Market place not working,Market place not workingggg!!!!,https://itunes.apple.com/us/review?id=284882215&type=Purple%20Software,2024-03-18T15:32:57-07:00
11059642766,Shadowbanned 2021,https://itunes.apple.com/us/reviews/id1628162731,455.0.0,1,Useless,Been shadowbanned for several years now by Facebook’s censorship team. So I can’t say I enjoy it. Plus we are inundated with commercials and stupid videos to keep us hooked. Wondering everyday what I even need it for anymore… it is useless if my friends can’t see my posts.,https://itunes.apple.com/us/review?id=284882215&type=Purple%20Software,2024-03-18T15:04:27-07:00
11059573499,Nea P,https://itunes.apple.com/us/reviews/id1059192563,455.0.0,1,Fakebook,There is no free speech on here. They listen to everything you say..,https://itunes.apple.com/us/review?id=284882215&type=Purple%20Software,2024-03-18T14:36:15-07:00
11059535020,Brandon’s real reviews!,https://itunes.apple.com/us/reviews/id1636934804,455.0.0,5,It’s ok,It’s ok,https://itunes.apple.com/us/review?id=284882215&type=Purple%20Software,2024-03-18T14:20:46-07:00
11059529279,penncro,https://itunes.apple.com/us/reviews/id768845281,455.0.0,5,Free speech,We need to have free speech on this plat form,https://itunes.apple.com/us/review?id=284882215&type=Purple%20Software,2024-03-18T14:18:32-07:00
11059513792,Someone74594@,https://itunes.apple.com/us/reviews/id1621038272,455.0.0,2,Can’t sell stuff any more,I’m trying to sell stuff and I can’t even do it y do you guys take my market place away,https://itunes.apple.com/us/review?id=284882215&type=Purple%20Software,2024-03-18T14:12:23-07:00
11059489095,TWAGNER777!!!,https://itunes.apple.com/us/reviews/id26806791,455.0.0,1,Too many ads,FB is littered with so many ads now that it destroys the whole user experience - the ads aren’t even targeted to the user. FB had lost its way sadly…,https://itunes.apple.com/us/review?id=284882215&type=Purple%20Software,2024-03-18T14:02:32-07:00
11059474519,Mckenleylol,https://itunes.apple.com/us/reviews/id1568893789,455.0.0,1,Mckenley,Fix marketplace it’s not working,https://itunes.apple.com/us/review?id=284882215&type=Purple%20Software,2024-03-18T13:56:50-07:00
11059329483,Modena Ward,https://itunes.apple.com/us/reviews/id1265751899,455.0.0,5,Facebook Review,❤️❤️❤️❤️,https://itunes.apple.com/us/review?id=284882215&type=Purple%20Software,2024-03-18T13:00:23-07:00
11059327112,GreaseCork,https://itunes.apple.com/us/reviews/id1257477372,455.0.0,5,ARJ upper receiver,"The holy grail of uppers and lowers!  Won’t find a nicer set.  Quality, craftsmanship, and communication is top tier!
Highly reccomend!",https://itunes.apple.com/us/review?id=284882215&type=Purple%20Software,2024-03-18T12:59:27-07:00
11059273340,cftucjjfhvnn v,https://itunes.apple.com/us/reviews/id1015465373,455.0.0,5,"Facebook you are amazing, keep up the sweet memories of bringing people together.","Amazing Facebook! I don’t live on it but I love to see good memories that makes me smile, thank you Facebook, you will always get a 5 star from me. I love it when you bring the joy of my favorite photo into a collage. I absolutely adore it and you put it with music. What a way to make my day, you win all day in my book.",https://itunes.apple.com/us/review?id=284882215&type=Purple%20Software,2024-03-18T12:38:48-07:00
11059245562,mondale pringle,https://itunes.apple.com/us/reviews/id1089148372,455.0.0,1,The death of privacy,"Facebook is a data miner disguised as a social media company, and has so much money and info that it is working to buy and take down other, safer social media apps. It’s invested in Congress and other bigger corporations to destroy your personal life.",https://itunes.apple.com/us/review?id=284882215&type=Purple%20Software,2024-03-18T12:28:14-07:00
11059206890,Old dog looking for help,https://itunes.apple.com/us/reviews/id1636904486,455.0.0,1,Poorest customer service,"Marketplace has the Poorest customer service I have experienced in a long time. 

Not user friendly at all!!!

Please show me you can do better!!!",https://itunes.apple.com/us/review?id=284882215&type=Purple%20Software,2024-03-18T12:13:40-07:00
11059194585,Mrs. Kenny,https://itunes.apple.com/us/reviews/id452750372,455.0.0,3,New Backgrounds,"I really like all the new colors but wish some of the old backgrounds were still available. 

Now, the updated BG’s are on my iPhone but not my iPad. There is no update to download. Why don’t I have the new stuff on the iPad as well as my phone?",https://itunes.apple.com/us/review?id=284882215&type=Purple%20Software,2024-03-18T12:09:02-07:00
11059165258,BvgccfZ d,https://itunes.apple.com/us/reviews/id1356755800,455.0.0,5,Quítale la restricción a mi cuenta,".,,",https://itunes.apple.com/us/review?id=284882215&type=Purple%20Software,2024-03-18T11:58:00-07:00
11059121946,Vicente Sss,https://itunes.apple.com/us/reviews/id1636896992,455.0.0,4,Lost N found,Lost Facebook for awhile but have since gotten it back. Really missed it.,https://itunes.apple.com/us/review?id=284882215&type=Purple%20Software,2024-03-18T11:41:24-07:00
11059121547,OceanBlueBullies,https://itunes.apple.com/us/reviews/id1370381700,455.0.0,1,FB,After having my personal page since 2012 Facebook suspended my account an I lost everything without even getting a notice or away to talk to someone to show them it was hacked so that I could regain access to all my stuff I had on my page!!!,https://itunes.apple.com/us/review?id=284882215&type=Purple%20Software,2024-03-18T11:41:15-07:00
11059120341,northernnola11,https://itunes.apple.com/us/reviews/id584619785,455.0.0,2,Facebook could be better,I enjoy interacting with friends and family but unfortunately spamming/hackin has become widespread and bullying as well as too much censorship of non violent religion. It’s become a place of very violent and dangerous behavior. I am saddened by this.,https://itunes.apple.com/us/review?id=284882215&type=Purple%20Software,2024-03-18T11:40:48-07:00
11059080581,ehevbs,https://itunes.apple.com/us/reviews/id1212971397,455.0.0,1,Took market place away,Hate the app now,https://itunes.apple.com/us/review?id=284882215&type=Purple%20Software,2024-03-18T11:25:39-07:00
11059066183,Redeye 2020,https://itunes.apple.com/us/reviews/id133361911,455.0.0,5,Useful for elderly (me) !,"Keeps me in touch with friends, relatives, kids and grandkids!",https://itunes.apple.com/us/review?id=284882215&type=Purple%20Software,2024-03-18T11:20:08-07:00
11058974312,Alena dinora alfaro,https://itunes.apple.com/us/reviews/id1636883406,455.0.0,5,Me encanta,Lo recomiendo al full,https://itunes.apple.com/us/review?id=284882215&type=Purple%20Software,2024-03-18T10:45:51-07:00
11058937923,Residential paint company,https://itunes.apple.com/us/reviews/id1476857891,455.0.0,5,Good for business,"Whenever I do not have Painting work, I always make a post saying I am free this week and somebody will always hit me up for some work",https://itunes.apple.com/us/review?id=284882215&type=Purple%20Software,2024-03-18T10:32:39-07:00
11058921938,Picture Pawn LLC,https://itunes.apple.com/us/reviews/id1308147707,455.0.0,5,PICTURE PAWN LLC,European government,https://itunes.apple.com/us/review?id=284882215&type=Purple%20Software,2024-03-18T10:26:52-07:00
11058899385,The “Lightning “,https://itunes.apple.com/us/reviews/id1636876313,455.0.0,5,The “Lightning “,The Lightning “,https://itunes.apple.com/us/review?id=284882215&type=Purple%20Software,2024-03-18T10:18:48-07:00
11058851614,DrewT248,https://itunes.apple.com/us/reviews/id1106878474,455.0.0,1,Marketplace Doesn’t Work,What’s the point of even having Facebook if marketplace doesn’t work?,https://itunes.apple.com/us/review?id=284882215&type=Purple%20Software,2024-03-18T10:01:59-07:00
11058848078,Swanyj,https://itunes.apple.com/us/reviews/id180490096,455.0.0,1,Hacked,"Difficult to handle this hack. Stole my email and 
I am unable to change passwords and even with a new page, I cannot refrained friends. It IS a mess.",https://itunes.apple.com/us/review?id=284882215&type=Purple%20Software,2024-03-18T10:00:46-07:00
11058790791,Zizo 2109,https://itunes.apple.com/us/reviews/id882163300,455.0.0,1,Forcing people to see what facebook wants us to see,Forcing people to see what facebook wants us to see,https://itunes.apple.com/us/review?id=284882215&type=Purple%20Software,2024-03-18T09:41:12-07:00
11058768118,777Marshall777,https://itunes.apple.com/us/reviews/id1526778646,455.0.0,5,Be you!,I think my favorite thing about FB is just being able to unapologetically be ME! I love that I can chat with family & friends and flip thru pix n posts on the recent events in their lives. I’m also able to reconnect with old friends & classmates from high school. I appreciate the platform to just be myself & I encourage you to just BE YOU today!,https://itunes.apple.com/us/review?id=284882215&type=Purple%20Software,2024-03-18T09:33:29-07:00
11058682352,Black Gemini Filmz,https://itunes.apple.com/us/reviews/id1402874097,455.0.0,5,Pay more FB,It’s time for Facebook to pay us more money,https://itunes.apple.com/us/review?id=284882215&type=Purple%20Software,2024-03-18T09:04:45-07:00
11058625825,Jsnsieklrlgj,https://itunes.apple.com/us/reviews/id435091625,455.0.0,1,Bookface,*{•_•}* Robot Wants Your Soul…,https://itunes.apple.com/us/review?id=284882215&type=Purple%20Software,2024-03-18T08:45:59-07:00
11058585184,DWR1000,https://itunes.apple.com/us/reviews/id144123356,455.0.0,2,Annoying Adds,To many unwanted adds,https://itunes.apple.com/us/review?id=284882215&type=Purple%20Software,2024-03-18T08:32:26-07:00
11058574257,gGumshoe3,https://itunes.apple.com/us/reviews/id1108023571,455.0.0,3,I’m only here for marketplace,Facebook holds real men back from holding fake men accountable. I’m only here for marketplace.,https://itunes.apple.com/us/review?id=284882215&type=Purple%20Software,2024-03-18T08:28:52-07:00
11058444665,Monaenay,https://itunes.apple.com/us/reviews/id1598989196,455.0.0,1,Issue,I can’t like or comment on anything! And I don’t know why,https://itunes.apple.com/us/review?id=284882215&type=Purple%20Software,2024-03-18T07:46:11-07:00
11058440250,Jc Canady,https://itunes.apple.com/us/reviews/id1121512787,455.0.0,1,MARKETPLACE BUG,"Hello, I’m one of many that have had issues with marketplace no longer being available. we reach out for support and no one ever returns our support ticket. gone on for months absolutely irking. please fix the app fb",https://itunes.apple.com/us/review?id=284882215&type=Purple%20Software,2024-03-18T07:44:43-07:00
11058403637,Who all so so odd,https://itunes.apple.com/us/reviews/id151912835,455.0.0,1,Algorithm,Whatever system is flooding my feed is ruining my Facebook experience.  Likely to just turn it off,https://itunes.apple.com/us/review?id=284882215&type=Purple%20Software,2024-03-18T07:32:55-07:00
11058383586,Robloxfan59,https://itunes.apple.com/us/reviews/id1317143799,455.0.0,4,FIX FACEBOOK,My Facebook marketplace will not work it says login to access marketplace but I login and it won’t work so please fix it,https://itunes.apple.com/us/review?id=284882215&type=Purple%20Software,2024-03-18T07:26:27-07:00
11058171205,Wad & poe,https://itunes.apple.com/us/reviews/id950771803,455.0.0,1,Ads,Too many sponsored ads!  Not getting all the posts from some of my friends.,https://itunes.apple.com/us/review?id=284882215&type=Purple%20Software,2024-03-18T06:17:37-07:00
11058161483,wowiahsvs,https://itunes.apple.com/us/reviews/id1164537559,455.0.0,5,Corrupt app. Boycott it,"Facebook use to be good, but the owners and team have become politically motivated to remove content that is against their investors, they will give you fake reasons for why your post was removed, but they don’t remove hate comments.

Israel is evil. The news won’t tell you the truth. But social media will.",https://itunes.apple.com/us/review?id=284882215&type=Purple%20Software,2024-03-18T06:14:30-07:00
11058139366,karenpro123,https://itunes.apple.com/us/reviews/id620447068,455.0.0,2,Weird things happen,"Here’s a few weird things that happen on the FB app over and over and over and over again…
1. Notifications just disappear!! ??? One minute  you see them and right before your very eyes they just disappear before you can click on them. What the heck for? This happens sporadically but at least every other day!
2. When you join a group, you can click on your profile photo while in that group and see everything that you posted since day one in that group. Now, for the past 3-4 months, all my postings have been duplicated and triplicated, so when I want to look back and see, for instance, how I described a certain doll in a prior posting, I have to scroll thru multiple images of the same postings just to get to the one I’m looking for. This can take up a lot of unnecessary scrolling! Totally ridiculous!
3. A firewall preventing scammers just doesn’t exist on the billion dollar making FB company app. I’ve been kicked outta groups because scammers have posted crooked posts to some of my groups that make it look like I’m sending them!",https://itunes.apple.com/us/review?id=284882215&type=Purple%20Software,2024-03-18T06:07:17-07:00
11058106123,LJester08,https://itunes.apple.com/us/reviews/id1417621270,455.0.0,1,Marketplace,My market place was taken away for no reason and I am annoyed that it hasn’t been fixed in almost 2 months,https://itunes.apple.com/us/review?id=284882215&type=Purple%20Software,2024-03-18T05:56:21-07:00
11058070383,Nicknamejustchooseone,https://itunes.apple.com/us/reviews/id134848190,455.0.0,2,Stop filtering and show me my feed,"Why does FB decide whose post appears on my feed?  If I’m friends with someone, I should be able to have all of their posts appear on my feed. Also, just because FB doesn’t believe in God or have a personal relationship with God doesn’t give them the right to not distribute biblical truths or to hide them.",https://itunes.apple.com/us/review?id=284882215&type=Purple%20Software,2024-03-18T05:44:21-07:00
11058030765,Dominique Pruitt,https://itunes.apple.com/us/reviews/id1635207210,455.0.0,1,Did like,I made a new Facebook account and tried to message someone on marketplace and when I went back on there they blocked me from marketplace place and I didn’t even do anything,https://itunes.apple.com/us/review?id=284882215&type=Purple%20Software,2024-03-18T05:30:58-07:00
11057905083,มิวมิวเอง,https://itunes.apple.com/us/reviews/id318163853,455.0.0,5,ดี,ดีดี,https://itunes.apple.com/us/review?id=284882215&type=Purple%20Software,2024-03-18T04:46:35-07:00
11057756942,kobeheli,https://itunes.apple.com/us/reviews/id551303200,455.0.0,4,Mark zuckerberg,Would be 5 stars but dudes eyes are to big for head,https://itunes.apple.com/us/review?id=284882215&type=Purple%20Software,2024-03-18T03:49:13-07:00
11057686843,Dill pickle 🥒,https://itunes.apple.com/us/reviews/id1629630241,455.0.0,5,Facebook,Great App,https://itunes.apple.com/us/review?id=284882215&type=Purple%20Software,2024-03-18T03:19:13-07:00
11057316921,maddrat1,https://itunes.apple.com/us/reviews/id600767950,455.0.0,2,FBScams,Disappointed with facebook due to offering scam advertising.,https://itunes.apple.com/us/review?id=284882215&type=Purple%20Software,2024-03-18T00:16:21-07:00