id,userName,userUrl,version,score,title,text,url,updated
6482765405,lil happy liv,https://itunes.apple.com/us/reviews/id1134112094,2.0.22,5,I love this app!,"We went virtual over the last quarter of school and teams was awesome! It gave me notifications and the calendar was an awesome tool. I like how if you forget about a class it gives you a notification that tells you the class has started. And how the messages work like, well normal text messages. I also like how you can message your teachers about class work or anything! Maybe even just a thank you, and how you can message class mates but not strangers from other schools. I have never had a single lag! Oh and I like the new feature of being able to see more than four people on your screen. This works great as a collaboration app, an app for virtual meetings, even school! I am trying so hard to think of any criticism or something back right now, I am searching every inch of my brain. It’s like when you ask Siri and she doesn’t give you an answer. Well since there’s nothing bad to say, thank you for reading my “constructive criticism” comment.

-Liv",https://itunes.apple.com/us/review?id=1113153706&type=Purple%20Software,2020-09-29T18:30:39-07:00
7942037121,devinwbrisson,https://itunes.apple.com/us/reviews/id428234356,3.17.0,5,Best app for web meetings…,"Teams blows Skype out of the water! It’s 100% better, very clear with no delays or voice with video synchronization problems. No snow, and I’ve been in meetings with over 75 people logged in to Teams without a glitch or delays! It truly is an amazing app for web meetings. We tried to utilize Skype for our platform with NC DEQ, but it never went anywhere, people just quit using it. There was problems just trying to do a small group of maybe 3 to 4 people, and Skype could not handle it. Most times we just defaulted to audio because video was a nightmare! Going from Skype to Teams was like going from old dialup internet to fiber optics speed and quality, no joking! I really can’t see an app for web based meetings working any better, plus it’s very user friendly. I know there are other apps out there, but these are the two NC State has tried as far as our agency goes. Thanks…                           -Devin Brisson",https://itunes.apple.com/us/review?id=1113153706&type=Purple%20Software,2021-10-22T08:28:39-07:00
7352118488,historyceiling,https://itunes.apple.com/us/reviews/id659808321,3.6.0,2,Never works well,"I’ve been using Microsoft Teams for over a year since this is the only platform my university uses (and would pay for). 1) it doesn’t sync well with their desktop app, I could never predict where the calls are going. 2) it always crashes on my laptop as soon as I attempt to turn on my camera or mic, doesn’t matter how many times I update or restart. 3) the iPad version is a tad more stable, but I can’t multitask on the same screen AND keep my camera on (which is one of the iPad features). 4) it can be really hard to find the tab/button to join a meeting, even if it’s scheduled. 5) it’s even harder to find a specific recording file unless the host goes through each recording to rename. 6) the document editing interface isn’t intuitive. 7) there is an iPhone version, but it’s difficult to turn on the speaker when I don’t have earbuds with me for a call. 

On the other hand, Zoom has been incredibly stable with an easy to use interface. Plus Teams stole the breakout room feature from Zoom. I could not in good conscience to recommend this to anybody.",https://itunes.apple.com/us/review?id=1113153706&type=Purple%20Software,2021-05-17T12:21:36-07:00
6002064561,stagevi,https://itunes.apple.com/us/reviews/id31627598,2.0.10,5,Love Teams! Needs a few things to be perfect!,"Teams has been an excellent communication tool as all coworkers are working remote now. Very easy to collaborate, create team calls, screen shares, etc. A few updates would be the cherry on top.

1. As a creative team we are always dropping files into the chat function to share progress shots, inspiration images and comps. I, and a lot of my team uses the same file naming structure for these images - so there are multiple files with the same name. Teams will not let you upload 2 files with the same name without a pop up window asking if you want to keep both files...and if I click yes it renames them xxxxxx(1), xxxxxx(2) and so on. Please make it so it either let’s me keep both files with the same name without asking or renames them automatically without asking. 

2. When an audio call comes in via Teams it only shows the person initiating the call. If John Doe is calling through a multi-user group it only shows up as John Doe making team calls vs a single user call indistinguishable. A “John Doe via Project xxxxxx Group” would be all it needs.

3. More customizability within chat groups. We use chat groups 99% of the time vs broader team group windows. Would be nice to be able to change sounds, chat group avatar, background image, etc. 

Other than that love the app and it’s integration into Outlook calendar and contacts!",https://itunes.apple.com/us/review?id=1113153706&type=Purple%20Software,2020-05-27T14:05:18-07:00
7038158160,Khloe Vargas,https://itunes.apple.com/us/reviews/id582232625,2.4.0,1,glitchy.,"i’ve had this problem where i can’t delete messages, i’ll click delete yet they will stay in the chat and just won’t go away. when i say this i mean in private chats i create with other people like classmates. my saved messages won’t work either, i press the purple bookmark to un-save them but all i have to do is refresh the page and they’re back. i think it might be because i deleted those messages, and so now they’re just stuck in this weird loop. i’m confused and i want to be able to use the chat normally again. also, sometimes when my teachers are trying to let the students into the meeting, it will not show us in the lobby. it’s happened twice and it takes time away from our lessons. PLEASE get this fixed. it’s so annoying and also i beg of you to add a feature to be able to permanently clear all chats with other people. like private chats that you create. the ones to talk with other students or mutuals. i understand that you could use other platforms but i have some student mutuals who i know only in school and intend to keep it that way, so please make that an option. there’s lots that needs to be done to fix this app and i’m very dissatisfied.",https://itunes.apple.com/us/review?id=1113153706&type=Purple%20Software,2021-02-25T12:29:12-07:00
7678542179,nevaehSpirakes,https://itunes.apple.com/us/reviews/id969523495,3.12.1,4,I have to write this for school 😕,To be honest this app isn’t great because when I try to join a meeting it kicks me out immediately and if somebody calls me into I press join and it kicks me out it allows students to mute and kick out whoever is in the meeting my younger sister uses this and it always says somebody in the meeting removed you and I wish it said who. This app is not great but I have to write this for school which isn’t great either. Also when I write a message to my friends or teacher it autocorrects to something completely different like if I say hi did you get the answers for question 2 I’m stuck on that then it would say hey I want the answers for 2. I don’t understand this app. Also it drains you battery like if I have to use my phone for school if my laptop is dead then I use my phone but if I have it at 100 then like 5 minutes later it’s at  1 and it’s annoying. That’s all I really have to say about this app 😕 I wish I could give 2 stars,https://itunes.apple.com/us/review?id=1113153706&type=Purple%20Software,2021-08-10T17:15:08-07:00
9180965555,listen Closely Now,https://itunes.apple.com/us/reviews/id475254800,4.17.2,5,App is very intuitive an easy,"What’s nice about the app is that it seems to work even better than the desktop version. I can’t think of one time that I’ve had this app on my phone. Give me any kind of issue with locking up or shutting down however, with the desktop version, at least once a month, I find myself somehow in a situation that will require me to reboot my PC! I do know that this could be so many things that it may not even be the program itself. I would be a great tester because the feedback I’d provide I think would be very helpful again not on this app but on the PC I don’t like to try and start a recording of a meeting finding the button is opinion I feel like I have to search for each and every time I go to start a meeting and I don’t understand why it’s not more prominent, the start button that is for recording.",https://itunes.apple.com/us/review?id=1113153706&type=Purple%20Software,2022-10-13T10:49:06-07:00
2054350643,Jeratain,https://itunes.apple.com/us/reviews/id190839578,1.0.27,3,Nice start; needs polish,"Overall Teams is a decent collaboration tool. When using it without being used to other competitors’ methods of working then Teams is intuitive and nice. When comparing it to Slack, then Teams takes one step forward and two backwards. But not all is hopeless! The service simply needs a handful of features and UI enhancements to improve. In terms of the iOS app, here’s some quick updates:
1. When I get notifications on multiple devices, they should dismiss from all devices once I’ve acknowledged it on any of the devices. Right now when I read something on my phone, the Mac app keeps the badge notifications. The inverse is also true. This is rather annoying.
2. More granular notifications. I don’t want to see a notification for certain channels in a team, even if a channel command is used. The lack of a mute function is unbearable.
3. Dark Mode. It’s 2018 and I don’t want to stare at a bright background in the evenings. Please give the option to enable a dark mode to save our eyesight and battery life (for OLED screens).",https://itunes.apple.com/us/review?id=1113153706&type=Purple%20Software,2018-01-03T15:05:50-07:00
6309330971,Romit..,https://itunes.apple.com/us/reviews/id206757209,2.0.18,5,Best app for video conferencing,"Really , this app deserves 10 stars . Very good app , I have installed both in my IPad and computer . It has many features like you can add background effects in your background, share your screen , record the call , add subtitles and invite participants and even guests! In chat , you can not only write messages but edit it like a champ! You can post in multiple groups , not allow people to reply and much more . You can also attach files and give praises and create a poll! in files column , you can upload files , make folders , download them , sync them ,  you can also make assignments and give grades ! and the new features just made me drive off ! The opening in new windows and together mode , raise hand , and quick meet option are just great! I don’t know why the foolish people are disliking this app , but I like it very very very very very very very very much.",https://itunes.apple.com/us/review?id=1113153706&type=Purple%20Software,2020-08-12T00:00:17-07:00
7370117964,E.k:),https://itunes.apple.com/us/reviews/id371565254,3.7.0,1,"Horrible App, do not use","As an educator I am constantly looking for innovative programs and applications that allow me and my students to strive within our current academic setting that has been hindered by the virus. I initially downloaded this app expecting a better way to connect with my students, but I was horribly mistaken. Throughout the school year there was one student who failed to turn in any assignments or tests. He was here on an academic scholarship from North Korea and depended on the scholarship money to survive. I worked with him to resolve this troubling issue, yet the issue persisted and by the end of the semester he had not turned in any assignments and was failing. This meant his scholarship was officially revoked. Without the scholarship he had no other choice to return to his home country of North Korea. When he entered North Korea he was immediately arrested as a “traitor to the nation” for leaving his home country to attend college in the U.S. To this day he is serving life in a brutal prison in North Korea. A couple days ago I found out the he actually turned in all the assignments, Teams just didn’t notify me.",https://itunes.apple.com/us/review?id=1113153706&type=Purple%20Software,2021-05-21T06:42:35-07:00
3755009671,DougNdenver,https://itunes.apple.com/us/reviews/id192367212,1.0.65,5,Best Microsoft app in a decade,"In a world where young innovative companies having been running circles around time-honored giants like Microsoft, IBM, Oracle and SAP, it is rare to see one of the “80’s companies” produce an application that is (to put it bluntly) - relevant.
Microsoft Teams puts Microsoft back on the ‘must-have’ software map, and could become the bridge the connects the old world with the new world.
Unlike past product offerings, Microsoft Teams has made it easy to integrate newer (non-Microsoft) apps side-by-side with trusted enterprise apps like Office365 and SharePoint.
Imagine a team collaboration “home page” where topic-based chat rooms, instant webcam meetings, private cloud file storage, mobile productivity apps and trusted office documents, live side by side in perfect harmony.
For companies who are trying to make the transition from old to new; from Gen-X to Millenials and Gen-Z, Microsoft Teams provides an easy and intuitive way to get there. (Five stars)",https://itunes.apple.com/us/review?id=1113153706&type=Purple%20Software,2019-02-10T10:30:43-07:00
9020894192,Mosha sand,https://itunes.apple.com/us/reviews/id370050667,4.15.0,5,Great app for communicating,"So after Covid started, my school started using zoom at first but then once everyone found out that this pandemic was not going to last a few weeks, but more like a few years, everyone went to teams because these reasons: 1) You have more virtual backgrounds (which many of my classmates and me enjoyed playing around with) 2) There is a schedule that can sync with outlook calendar so if you get this app, it’s best you also get outlook with it. 3) Teams is more like academically based so you can get literal assignments from your teacher with a deadline that you have to meet, and your teacher/whoever is giving you the assignment to complete can give you feedback and you can undo hand in if you have a few mistakes to correct. 

Overall, I think this is a wonderful app to use and I highly recomend it!",https://itunes.apple.com/us/review?id=1113153706&type=Purple%20Software,2022-08-26T17:25:04-07:00
9332690080,Sack tickle,https://itunes.apple.com/us/reviews/id87428861,4.21.3,4,A list of problems,"This app could be just as good as Slack but I’m constantly annoyed by many things: (note! I frequently swap between the desktop and iOS version, this is my experience using Teams in that way) 
No Download progress bar, no button to open recently downloaded files, no list of recently downloaded files
Teams renames uploaded / downloaded files
When changing status the icon doesn't immediately reflect new status color--this is confusing
Not nearly enough notification options
Notifications disappear, if you're not looking at the screen at the right time they won't be visible which makes them pretty useless a lot of the time
Notifications will blow up the mobile version of teams even when you're actively using the desktop version of the app. This makes no sense. Why would I need all those mobile notifications if I'm active in that discussion on the desktop client.
More notification stuff. Sometimes the desktop app will keep sending my notifications of chat messages when I'm actively engaged in the chat on that same desktop app. For example: you're in a meeting. Typing in chat. But every reply / message is still triggering a notification. Even when that chat is on screen, even when you're typing in that chat. This feels so incredible sloppy and redundant.",https://itunes.apple.com/us/review?id=1113153706&type=Purple%20Software,2022-11-26T16:33:47-07:00
5902822333,BT 1000,https://itunes.apple.com/us/reviews/id785263061,2.0.8,4,iOS improvements,"The iOS version of Teams isn’t great. There are too many places all over the screen to click on, and everyone sees your arm moving around the screen until you turn the camera off (which requires you to move your arm around the screen). 

Just put all the controls in one strip, which a user could move to either the top, bottom, or either side depending on preference. And keep the strip up all the time - having to tap on the screen to activate controls is super annoying. Additionally, one should be able see whoever is talking while looking at other things, so just put in a “half-screen slider “ that lets you scroll over to the attendee list or comments or files or whatever. And then make it so you could continue sliding either direction so you can either go back to a full video screen, or forward to a full screen of “other”.

Doing this would make the app much better to use!",https://itunes.apple.com/us/review?id=1113153706&type=Purple%20Software,2020-05-04T11:47:15-07:00
5961408558,Alallen01,https://itunes.apple.com/us/reviews/id262267885,2.0.10,3,No notifications,"This app has a lot of potential, but can be very frustrating. 

My main issue by far is the lack of notifications on my phone. I have both the desktop and mobile apps, but can’t get a single notification on my phone. I’ve turned all notifications off and back on both in the app and in my phone settings. I made sure there are no quiet hours, turned on notifications even when I’m active on desktop, turned on all notification styles in my phone settings, went through each team and chat to turn notifications on, and nothing. I get nothing. If I want to step away from my desk for a few minutes I have to bring my phone with me and constantly check it. I’ve done every troubleshooting tip, even though it’s all the things I already tried. Please fix this, it’s a big problem to not get notifications. 

Other than that, there’s sometimes a noticeable lag in getting messages or statuses updating. I for some reason don’t get calls on my phone, but I used to so I think that may be connected to the lack of notifications. No ability to put that your out of office as a status without putting an event in the calendar. How is there not an “off” status? The closest you can put is “away,” which is frustrating when you need to chat w someone and don’t know if they’re away for a few minutes or the rest of the day. 

Overall, it’s a decent app but several improvements are desperately needed.",https://itunes.apple.com/us/review?id=1113153706&type=Purple%20Software,2020-05-18T07:16:49-07:00
6503437522,Dancinut,https://itunes.apple.com/us/reviews/id196324803,2.0.22,4,Teams is great and the app is mostly great.,"When my computer died and I started working from my iPad , I was worried I would loose a lot of my functionality in Teams as my organization works almost exclusively in Teams. I’ve been pleased to find that for the most part, the app offers the same functionality and even has a couple advantages. In a multi person call, the app will automatically shift from a multi view to a main speaker (talks more than 30-60 seconds without interruption) and back as needed. The down sides are mainly small such as you can’t have chat open and see the video feeds of others in the meeting at the same time. The only major piece of functionality that is missing is the ability to start a video call in a channel or a chat with yourself (which we use to record and share presentations.) 

Developers: Please add this function to the app and you’ll have a 5 star rating from me. :)",https://itunes.apple.com/us/review?id=1113153706&type=Purple%20Software,2020-10-05T08:05:44-07:00
8101453625,HADI9493,https://itunes.apple.com/us/reviews/id147223886,3.20.0,4,:),"Ok,so I like teams and all but I have the 12.5.5 iOS and I putted a cloud on it(cuz it was vacation) and I tried to reinstall it but.. it didn’t work so I don’t know what happened i clear(ed) all of my memory but still no luck,BUT I heard something when I was in teams ‘please update this iPad we will no longer support 12 iOS’
And I ignored it-(DONT ask) and I went to google wrote ‘does teams support 12 iOS?’ But I found nothing(useless google) and when I always reinstall it always said ‘unable to download item please try again’ so I hope some one will tell me about this ;-;
Yea so I hope they will respond cuz I’m scared Bc my mother is gonna kill me I am PRAYING FOR SCHOOL TO BE GONE- cuz I’m still doing this “reinstall” thing (this is a story now... ;-;) PEACE!:D (Tell me if I did something wrong ;-; cuz I don’t know!)
👆old message...:^ uhm it works now BUT ITS STILL 4 STARS I mean.. if it still didn’t work heh- Well it’s a 3 stars... :)",https://itunes.apple.com/us/review?id=1113153706&type=Purple%20Software,2021-12-06T06:30:02-07:00
6981443527,leftykiller,https://itunes.apple.com/us/reviews/id133059705,2.3.1,1,"App crashes, no customer support.","I use it everyday as part of my job. Since Monday, 07FEB2021, it has frozen and crashed everyday. I have to uninstall and reinstall the app, and then it works fine. I’m forced to write this bad review because Microsoft has zero customer support. I went through the phone number, which led me to a website. Went through the bot assistant (which is worthless), and it said, “click here to talk to a real person.” I thought, “Great! Now I can get a trouble ticket in with the company.” I was very disappointed when it sent me to their public online forum, that they even warn you could have scammers posing as agents. This is extremely frustrating and I have given up. Once Microsoft fixes the bugs with their app, I will change my review. This is making me wonder why I pay a yearly subscription to Office 365 though, especially since it used to be that you could just outright buy the Office software suite, and you had better support where you could talk to a live person. Where is all of my money going Microsoft, if it’s not going to take care of your customers?",https://itunes.apple.com/us/review?id=1113153706&type=Purple%20Software,2021-02-11T05:49:46-07:00
8473479891,sooniceofagamer1234,https://itunes.apple.com/us/reviews/id1113647795,4.4.0,4,This app is great but I have a slight suggestion,"Ok so since the 2020 incident, or sixth grade year, or last year (we had to use zoom in fifth grade) I’ve had teams, and I really enjoyed it! Except for the fact that we had like 2 months straight of quarantine, anyway, one of my friends had some friends they knew from a different town, and was good friends with one of them and I decided to become friends, eventually they started being really rude, which is a big NO NO , so my point is I wish you could block them, BUT this also runs into a new problem: teachers. There should be an option to NOT be able to block teachers, as I don’t really like school, but I feel it’s so important to learn. Anyway you could give an option to teachers to have a different email so the teachers pets can’t act as teachers. Thanks for reading this and I hope you fix this!",https://itunes.apple.com/us/review?id=1113153706&type=Purple%20Software,2022-03-19T11:36:35-07:00
6628427887,BrianKy123,https://itunes.apple.com/us/reviews/id1066443599,2.0.25,3,Teams doesn’t work for me most of the time,"Since august, I’ve been using teams for quite a while cause I have school. But when it doesn’t work, I get mad because I’m gonna be marked tardy for not showing up to a meeting on time. The problem is that the loading bar doesn’t stop, and when I tap to switch to a different chat, or the calendar or the teams, it freezes. And it freezes for a long time. I’ve tried to clear app data, I’ve tried deleting the app and reinstalling it, but nothing seems to work. I’ve looked up many ways on how to fix it, but it just doesn’t cooperate. I believe that I’m the only person having this problem since everyone else seems fine. But can I get some more suggestions on how to fix this? Overall, when I did use the app before, it was great. There were some minor problems, but those were fixed shortly after. Please tell me how to fix this, I can’t stand having to go to the website just to use teams.",https://itunes.apple.com/us/review?id=1113153706&type=Purple%20Software,2020-11-09T22:34:07-07:00
7458150194,Donatoo,https://itunes.apple.com/us/reviews/id28647788,3.8.1,4,Good but can be better,"I use this as a volunteer. Several training sessions and meetings that I get invited to each month. I have used it on my iPhone and and laptop. Thanks to a mistake on my part the laptop that I use now takes several minutes to load teams. I prefer the laptop because it is easier to see shared information on screen. I can not setup any groups on my iPhone unless I send an invitation immediately. As the team lead, I wanted to have everyone in a group before setting up an event. I prefer to organize things so I just click on a group, send the invite, and then work on other things. If there is a way to do this, the app is not very forthcoming with the info. This also why I do not like being hounded to do a review when I have only just started to work with the app for myself instead of clicking the invites sent by others.",https://itunes.apple.com/us/review?id=1113153706&type=Purple%20Software,2021-06-12T18:22:26-07:00
