id,userName,userUrl,version,score,title,text,url,updated
7794236390,Sohrab Parsa,https://itunes.apple.com/us/reviews/id1108757038,9.1.234,4,App doesn’t work with some iPhones,"Unfortunately, I have been redirected to the Linkedin website whenever I opened the app for the past couple of days. This is because the latest app update requires IOS 13 or later which is not supported by Apple for many iPhone devices, such as iPhone 6. Is there anything you guys can do about it? You know the Linkedin website is not as user-friendly as the app for sure!",https://itunes.apple.com/us/review?id=288429040&type=Purple%20Software,2021-09-11T03:13:25-07:00
3760763714,InformedCOreader,https://itunes.apple.com/us/reviews/id260510952,9.1.88,1,Still unusable,"Useless bloatware.  Back to unbelievably slow and essentially useless.  I refuse to wait 2-3 minutes just to view a current connection.  Neither is it reasonable for me to have to periodically delete and reinstall the app. Enough!
------
After my review below, I received a note from app support to uninstall and reinstall the app.  Indeed, LinkedIn is much more responsive now ( though still very laggy about loading articles and during app start-up)
------
So unbelievably slow, an exercise in futility.  I had falsely assumed this app would let me access LinkedIn easily, but that is not so.  I should not be able to pull espresso shots between page loads.",https://itunes.apple.com/us/review?id=288429040&type=Purple%20Software,2019-02-12T00:17:43-07:00
3283970707,Sac59345934,https://itunes.apple.com/us/reviews/id348690082,9.1.102,1,Feedback: One star for visibility,"Hello LinkedIn dev team,

I used to not use LinkedIn as much as I do now. Thanks to you for providing us with so many new features that are being added. This is how a real social network should have always been.

The reason for 1 star is:
I am an ardent follower of the daily rundowns. But, I wouldn’t read all the content in a single go. Instead, I take multiple turns throughout the day to read all of it. Here’s the problem. 

When I open LinkedIn and say, read two paragraphs and went on to read an email and then do my chores and then come back to LinkedIn after, say, an hour, to pick up where I left off. This is where LinkedIn redirects me to its home page. No, I didn’t close the app, it’s running in the background. I would love to continue with the content where I left it off earlier. 

I have seen no other app does this except LinkedIn.

TL;DR I want LinkedIn to show me the content where I left off earlier than always redirecting me to homepage.",https://itunes.apple.com/us/review?id=288429040&type=Purple%20Software,2018-10-09T20:17:30-07:00
9320454264,Guy 7 billion,https://itunes.apple.com/us/reviews/id497389150,9.1.292,2,Comments not working,LinkedIn app appears to have a bug or a new setting that doesn’t allow comments on certain posts — since the past 2 updates. You click on “comment” and your phone’s keyboard pops up and allows you to type but you can’t see what you are typing (just shows older comments) and there is no button to post what you blindly typed. LinkedIn also makes it virtually impossible to provide feedback or report a bug. They clearly do NOT want to hear from their platform users. Thus this review.,https://itunes.apple.com/us/review?id=288429040&type=Purple%20Software,2022-11-23T07:06:00-07:00
8748377636,Papi_Chulo_Dale_Duro,https://itunes.apple.com/us/reviews/id136369981,9.1.271,1,Mobile Data,I am not sure why but it’s been about a month and a half  but the app doesn’t recognize mobile data. When connected to WiFi it works fine. This is the only app that does it on my phone. I called AT&T and we r east my network services and reset my phone. Problem still exists. At first I thought it was signal related because I was at work and I don’t always have the best signal in the building. Then it happened everywhere when I wasn’t connected to wifi.  I also installed the app on another iPhone and the problem still existed. Both phones where iPhone 13 pro max.,https://itunes.apple.com/us/review?id=288429040&type=Purple%20Software,2022-06-06T15:32:11-07:00
3585262480,Rockstar2325,https://itunes.apple.com/us/reviews/id414470310,9.1.111,4,Can’t even create an account,"I know this is a great platform, however the app for the iPhone won’t even let me create an account, due to the robot security feature. I tried several, like 30 times clicking the pictures, girlfriend tried as well. I imagine the system is messed up; however, I do recommend swapping out the picture clicking with typing in the letters feature. I will just go on my laptop when I have free time to create an account.",https://itunes.apple.com/us/review?id=288429040&type=Purple%20Software,2018-12-28T14:47:52-07:00
6754324121,erikspooner,https://itunes.apple.com/us/reviews/id31337015,9.1.200,1,Latest update is bad news,"I have to re login on every. Single. Launch. FIX IT NOW! Also, I think you people highly overestimate how much people want your platform for content. Right now, all the sections (notifications, jobs, people) are telling me “something went wrong” and it isn’t functional. But the feed—the thing I neither want nor need—is working just fine. This is garbage. The new interface is cleaner. I applaud your UX designers for bringing you forward from 2013. But I’d gladly take the old UI working again over this horrible update. I get you’re working on it but c’mon—this is basic stuff. This release never should have made it out of the gate.",https://itunes.apple.com/us/review?id=288429040&type=Purple%20Software,2020-12-14T18:34:48-07:00
5011396829,movie watcher 2694,https://itunes.apple.com/us/reviews/id187034983,9.1.152,5,Annoying notifications,"Badge notifications are so common, they’re useless. I only want numbered badge notifications for messages. Instead, the app gives notifications on everything—-whenever any of my 500+ contacts posts anything, which is all the time.  Very very annoying.  This makes notifications effectively useless.  Maybe someone should send the LinkedIn app dev team a copy of The Boy Who Cried Wolf.",https://itunes.apple.com/us/review?id=288429040&type=Purple%20Software,2019-10-25T01:34:09-07:00
2526147727,shravanSP,https://itunes.apple.com/us/reviews/id523798846,9.1.78,5,App force closes,"I am on iOS 11.3.1. Each time I open the app and navigate to an inmail and click on the text box to start typing a response, the app force closes. I read a couple of the developer response to uninstall and reinstall the app. I did that but it didn’t solve the problem. You guys need to fix this bug.
————
Update:
I just updated to the latest version and I don’t see the app close. I guess it’s fixed. Thanks!",https://itunes.apple.com/us/review?id=288429040&type=Purple%20Software,2018-05-09T18:49:25-07:00
1891730596,CoachKJ,https://itunes.apple.com/us/reviews/id201623014,9.1.53,5,LinkedIn,"I’ve been using LinkedIn regularly for about 5-6 years. I found and applied for my current job thru the app and I’m a big fan of LinkedIn because of it. I love that all my work and volunteer history is saved and is easily found and read by others seeking talent. How nice to be found vs. always looking. I recommend LinkedIn to everyone, it’s the present and future of recruitment and job search. Thank you!",https://itunes.apple.com/us/review?id=288429040&type=Purple%20Software,2017-11-02T02:45:41-07:00
10287877704,KristenLeonaMiller,https://itunes.apple.com/us/reviews/id1394288218,9.1.331,5,Issues resolved,"Something was glitchy and I was locked out of my account. An email was sent saying my account violated the policies and it was permanently restricted. After several days and a reply email from me - another email came and the issue was resolved. My account is again in good standing and I can access it, again. Patience paid off.",https://itunes.apple.com/us/review?id=288429040&type=Purple%20Software,2023-08-22T11:33:04-07:00
8921260137,Bubba 1992,https://itunes.apple.com/us/reviews/id280361382,9.1.279,2,Horrible Update,"Won’t save job postings all of the time; have to click multiple times and this was for each posting I wanted to save. 

I try to enter in a “mileage filter,” and it doesn’t work EVER. I pick 5 or 10 miles and I still get results for 30 miles away (into the city which can be a 60 minute to a 3 hour drive), not to mention hundreds to THOUSANDS of miles away. 🙄 And yes I know how to use the app. You just rolled out a horrible update. This is by far the worst update ever. At this point, it’s looking as pitiful as Carrerbuilder was 20 years ago.",https://itunes.apple.com/us/review?id=288429040&type=Purple%20Software,2022-07-28T11:29:39-07:00
8060998956,Dragon5647382910,https://itunes.apple.com/us/reviews/id112409660,9.1.245,3,No accessibility for older generation iPhones and iOS,"Hi, I am with iPhone 6 iOS 12.5.5. When opening your app there is a message coming in the middle of the screen and it always says “Taking you to our mobile site” and it doesn’t allow me to proceed further. I have already tried to uninstall and installation of an older version has been requested by the phone but still the same message comes. Can you please make accessibility for older generation iPhones and iOS? Thank you!",https://itunes.apple.com/us/review?id=288429040&type=Purple%20Software,2021-11-25T01:42:08-07:00
7492701741,xMimi76x,https://itunes.apple.com/us/reviews/id38975151,9.1.225,1,Tech issues,"Every time I hit the back button after viewing a job posting, it resets the search parameters. Very annoying and inconvenient. I don’t see how that would ever be a useful feature. 

When I clicked the unsubscribe link at the bottom of the emails they were sending me, instead of taking me to a page I could unsubscribe from email notifications, it took me to the homepage of the app. I had to navigate to this page myself. 

The app itself also is not user friendly. It’s hard to find the information you were just editing after you hit save.",https://itunes.apple.com/us/review?id=288429040&type=Purple%20Software,2021-06-22T03:21:30-07:00
5234904031,RebeccaB123,https://itunes.apple.com/us/reviews/id108254101,9.1.158,3,Need improvements,"I appreciate the app however I'd like to be able to multi-select various options.   I'd also like to be able to scroll to the bottom and automatically get more jobs rather than having to click the button. The recent update seems to have removed the ability to select the category such at technology and healthcare.   The recent update has also created an annoying ""get alerts"" message at the bottom that pops up and disappears each time you scroll.",https://itunes.apple.com/us/review?id=288429040&type=Purple%20Software,2019-12-04T21:43:33-07:00
1938921867,GinaKitty57,https://itunes.apple.com/us/reviews/id441010217,9.1.55,4,LinkedIn App is making it easier,I think the App has improved a lot. The changes with LI some months ago were hard to swallow and frustrating. The App continues to add features that exist on the desktop and in some cases even more benefits. I've noticed most recently that it is making it easier to communicate and also find contacts. Sometimes even providing topics for the conversation -- like to comment on their recent post. This can enhance the conversation.,https://itunes.apple.com/us/review?id=288429040&type=Purple%20Software,2017-11-21T19:09:13-07:00
2962025018,kojomojoh,https://itunes.apple.com/us/reviews/id130196183,9.1.89,4,It’s a great app but...,"LinkedIn really needs to start vetting the companies they allow to post job listings. I got a call from a job post I replied to only to go look up information  about the company and to discover it was nothing more than a glorified pyramid scheme. Same thing happened to my friend, I expect these things on Monster or Indeed but LinkedIn is supposed to be better than this. Please vet the companies you allow to post jobs otherwise there’s this app is pointless.",https://itunes.apple.com/us/review?id=288429040&type=Purple%20Software,2018-07-24T09:41:19-07:00
1823954336,Mikshayne,https://itunes.apple.com/us/reviews/id390419669,9.1.47,1,Offensive.,Do I want to sync????  Are the developers really that stupid that they don’t remember they’ve gotten answer to that question each and every time I’ve tried to use your intrusive app. Or - do they all suffer from untreated narcissistic personality disorder and not give two flying flips  about the privacy wishes of their users and the rights of those contacts not to have their personal information crowd sourced.  What could be an invaluable tool...an app built to create a worldwide professional community instead is an insufferable sham...an app that Commoditize contact information that has been shared with individuals for  personal use...Not to be shared or crowd sourced by a corporation!,https://itunes.apple.com/us/review?id=288429040&type=Purple%20Software,2017-10-02T21:38:47-07:00
5811219076,"Not bad, but not good either",https://itunes.apple.com/us/reviews/id25111672,9.1.175,2,Needs significant improvement,"I keep this app because it has so many people and jobs in one place. However, Indeed is far superior in terms of actually managing job applications. I want to be able to archive jobs I’ve applied to through LinkedIn and am no longer in consideration for, as well as keep track of those I’m interviewing for in the app. I feel like this data would be helpful to LinkedIn as well? Right now it’s really difficult to find a job description when someone contacts me for an interview and all the jobs I’ve ever applied to can’t be searched/sorted AT ALL.",https://itunes.apple.com/us/review?id=288429040&type=Purple%20Software,2020-04-14T10:38:56-07:00
3827989940,Cynimoxus1,https://itunes.apple.com/us/reviews/id260690355,9.1.121,1,Poor functioning application.,"I don’t understand. For a website, that focuses, and emphasizes professionalism, their app is terrible to use. Continuously, when I try to apply to jobs, the app crashes, and can’t even handle me putting in an email, or a simple data entry. I’ll try to open it again, after successfully closing it, and the app CRASHES again. My phone isn’t even old. Then when the app does work, I have to find that job again, and try to re apply. Certain features such as importing your profile for a job employer to see, don’t work. This application is poor, for those of us who work on the move.",https://itunes.apple.com/us/review?id=288429040&type=Purple%20Software,2019-03-01T04:17:11-07:00
2070732776,Damo Baby,https://itunes.apple.com/us/reviews/id118443168,910.110,4,Great Networking Site,This is a great way to network business wise. I think I have used  this more to get to know people and businesses that I want to work for. But I just wish the same way you connect with people on the desktop with the small short message should be incorporated with the mobile as well. Its more professional and you get to let the person know why you want to connect with them. This gives more connections to be accepted.,https://itunes.apple.com/us/review?id=288429040&type=Purple%20Software,2018-01-08T18:31:56-07:00
9033828558,CammieLG,https://itunes.apple.com/us/reviews/id249763705,9.1.283,5,Experiencing glitches. Love the app.,I like LinkedIn! I’m experiencing glitches right now when editing my posts from my iPhone and from my iPad. When I try to back space it jumps to the end of the post. I’ve been writing my post outside of LinkedIn and copying and pasting. Also the issue makes tagging difficult. The issue is the same for both devices.,https://itunes.apple.com/us/review?id=288429040&type=Purple%20Software,2022-08-30T05:25:42-07:00
9027647021,grizzly bur,https://itunes.apple.com/us/reviews/id591261636,9.1.283,5,I’m a little torn as to what to think,This hole internet and web three thing I’ve been on. well it’s been greatest thing that ever happened to me but at the same time it’s been the worst year of my life. I have been self teaching myself internet safety with the help of Ai as well I have quite a story to tell but I need some more time gather facts to explain but I like this site it’s the humans that get to me lol,https://itunes.apple.com/us/review?id=288429040&type=Purple%20Software,2022-08-28T13:35:22-07:00
8911531037,tommygebani,https://itunes.apple.com/us/reviews/id685301372,9.1.278,1,No Customer Support,"I work for a company that posts regularly on LinkedIn. I decided to merge my personal account to my business account for the sake of efficiency. My business account had access to the company page & allowed me to post. However, I didn't know that when merging accounts you lose access. It didnt say that when I merged accounts. I went to get customer service but the help page is useless. Most of the advice was outdated & there was no answer for this. There is no chat box or service agent either (unless you pay the fee). LinkedIn has been a huge pain for this.",https://itunes.apple.com/us/review?id=288429040&type=Purple%20Software,2022-07-25T15:18:36-07:00
8100774835,MuslimMan01,https://itunes.apple.com/us/reviews/id214775021,9.1.246,1,They make money by selling your info,So this platform is making more money by selling your info to a third-party company that they use your own info and resell them again plus that they asking you to be premium to pay fees as well they will keep selling your information to make more money either you paying them or not it’s untrusted and I don’t believe that they say it’s number one platform on social media it’s all fake and they always I always get many scammers who called me trying to do a social engineering on me by steeling my information because they got my info from this app :/,https://itunes.apple.com/us/review?id=288429040&type=Purple%20Software,2021-12-06T02:25:33-07:00
7704499664,PinkDreamz,https://itunes.apple.com/us/reviews/id398978539,9.1.231,3,A little unorganized,"It would be great if there was a way to sort out the jobs you’ve already applied for. That way the jobs you have an interview for you can mark them for that category. Jobs that have passed on you, maybe you can move to another location or mark as not selected by employer. When you’re really job hunting and putting in lots of applications it’s all jumbled and keeping track of who’s reached out, who’s passed on you gets frustrating.",https://itunes.apple.com/us/review?id=288429040&type=Purple%20Software,2021-08-17T13:48:29-07:00
7318523882,Mijuto82,https://itunes.apple.com/us/reviews/id453765507,9.1.219,3,Good resource,"I use this through my local library account. I like the content and found the switch from Lynda to linked-in learning was easy. The main issue I notice is when I log in. There is no way to remember my credentials? I have to enter the portal invitation and then my library card information each time I enter. This is extremely annoying, especially on mobile. Hopefully this is fixed soon. I will update review and rating once this is fixed.",https://itunes.apple.com/us/review?id=288429040&type=Purple%20Software,2021-05-09T11:20:45-07:00
6900632022,Bleh bleh 9_3,https://itunes.apple.com/us/reviews/id470337374,9.1.204,3,App rating,"LinkedIn is a great website/concept, HOWEVER this app could be WAY better. There are many tiny flaws that makes the experience poor. It takes forever to update information, and sometimes to navigate through the app. Notifications on phone, apparently aren’t sound notifications so it’s hard to keep updated if your preoccupied with other tasks. Again, I love LinkedIn however the app and its technological features could use some tweaking for a more efficient and stress free experience.",https://itunes.apple.com/us/review?id=288429040&type=Purple%20Software,2021-01-22T08:28:49-07:00
5866847275,Shutitdown,https://itunes.apple.com/us/reviews/id346943171,9.1.176,5,Amazingly Professional,Incredibly professional. He was able to get our stuff done under very adverse circumstances. He was able to get everything done as quickly as possible and he was very accommodating. I cannot Think of one detail that was missed or one way that this office did not tend to every single thing we needed. I would recommend this place to anybody for anything.,https://itunes.apple.com/us/review?id=288429040&type=Purple%20Software,2020-04-26T08:07:34-07:00
5487161247,funnymustard,https://itunes.apple.com/us/reviews/id415174417,9.1.164,1,"So slow, unreliable (iOS user)","Am I the only one? LinkedIn is probably the least reliable app I have...it takes an insane amount of time to load. I rarely will use the app anymore and save any searches for when I’m on my desktop. I’m not sure if it has to do w my settings or what, but LinkedIn is by far the most frustrating app on my phone. I’ve deleted and reinstalled several times.

 I have to resort to removing the app from my phone and using LinkedIn on chrome...but why should I have to do that especially when I’m paying for an expensive LinkedIn premium account? Makes no sense!",https://itunes.apple.com/us/review?id=288429040&type=Purple%20Software,2020-02-04T06:30:34-07:00
3977051694,peacefulpink,https://itunes.apple.com/us/reviews/id528676875,9.1.126,2,"Great website, great content, terrible app","You’d think for a company that thrives on networking for other companies would at least have the technical support to upkeep an app in the modern times. 

Unfortunately, the LinkedIn app is laced with bugs and it’s slower than most social media apps. I find the lagging leads to repeated postings, information isn’t saving, and I just realized I’ve wasted 15 minutes trying to update one component of my profile. Total waste of time. 

I’m new to LinkedIn in a sense, but I appreciate its efforts. Still, I think I’ll be sticking to their website version, not this poorly run app.",https://itunes.apple.com/us/review?id=288429040&type=Purple%20Software,2019-04-06T05:04:55-07:00
3639531235,Joelamos,https://itunes.apple.com/us/reviews/id298111676,9.1.113,5,Linked In,"What is happening???  I’m trying to click the X on individuals I don’t know or want to connect with, and when I click the X it SENDS AN INVITE TO CONNECT????   Hitting the X was supposed to delete NOW IT SENDS AN INVITE....nuts!!!

Glad I’m not a premium subscriber....I’d REALLY BE GOOFED UP! So many sneaky app’s, so many trying to get their hand in your wallet😐🙄😒

And another thing, your app asks me if I know a person, I click DISMISS...SEVERAL TIMES BEFORE IT ACTUALLY DISMISSES😳 

Apple updates, YOU UPDATE, Verizon UPDATES, Microsoft updates, N O N E OF YOU E V E R COMMUNICATE WITH EACH OTHER......NO WONDER APPS ARE SO CONFUSED....PITIFUL!!

    HANG ON....WHILE I ....UPDATE🙄

Got a reply to this review, forgot about the frustration because I believe you’ve handled the issues with an apparent update...so all is good.....sorry about the frustraions😌😊😉👍 adjusted your Star level😁",https://itunes.apple.com/us/review?id=288429040&type=Purple%20Software,2019-01-11T18:11:59-07:00
5680331642,itsroseeey,https://itunes.apple.com/us/reviews/id1136832820,9.1.172,4,Issues with Uploading Profile Photo,"I’ve recently had an issue where when I try to upload a new profile photo, it puts a really dark “filter” essentially over my photo. I don’t want to have a filter on the image but I tried to delete the app and upload a photo again and it still does the same thing. Not really sure what to do to prevent this from happening! With my old profile image, this wasn’t an issue!",https://itunes.apple.com/us/review?id=288429040&type=Purple%20Software,2020-03-18T21:47:55-07:00
1913893394,Drewsicle69,https://itunes.apple.com/us/reviews/id228918154,9.1.55,5,More important than Facebook,"LinkedIn is a platform similar to Facebook, except in LinkedIn you build connections with people in industries that you are interested in. You also connect with a diverse group of people. Sharing ideas, learning about jobs, and applying for jobs are a few of the pros to the app. 
I have no doubt that the global job market will pivot on LinkedIn in a matter of a few years",https://itunes.apple.com/us/review?id=288429040&type=Purple%20Software,2017-11-11T11:29:13-07:00
10581586642,Bbk_High standards,https://itunes.apple.com/us/reviews/id23462284,9.1.342,1,Sadly one of the worst IPad experiences out there,"This is ridiculous in 2023, frankly.

The interface as you can see above wastes 60% of available space with grey useless sidebars.  The chat interface uses 100% the phone buttons, and even the floating keyboard from Apple covers the send or attachement buttons all the time.   Sending a reply and taping a tiny 16x16 px button that’s millimeters from the expand button and edge is horrific.    Being unable to enlarge the conversation and fill the interface window is just inexcusable.  Do better. Your users deserve better than this from the top Job site in the industry.",https://itunes.apple.com/us/review?id=288429040&type=Purple%20Software,2023-11-13T06:52:14-07:00
10378428282,AdmiralAckbar03,https://itunes.apple.com/us/reviews/id435433383,9.1.334,3,"Good opportunities, with glitches","Linked in has been great in searching for jobs or having employers reach out to me.   But there have always been glitches that the company seems to know about but doesn’t do anything to fix them.   I have a very common glitch where it says I have notifications, but when I log in and click the notifications button there is nothing.      It’s hard to know if I actually have a job opportunity or a bug.",https://itunes.apple.com/us/review?id=288429040&type=Purple%20Software,2023-09-17T09:33:14-07:00
