id,userName,userUrl,version,score,title,text,url,updated
10001943507,ppbuxeelxj,https://itunes.apple.com/us/reviews/id1267924603,23.22.0,5,Air Max,Ekspresowa wysyłka. Stan butów jeszcze lepszy niż na foto. Paczka dobrze zabezpieczona. Wszystko Ok,https://itunes.apple.com/us/review?id=632064380&type=Purple%20Software,2023-06-05T07:15:47-07:00
10000587900,Barbie85111,https://itunes.apple.com/us/reviews/id1533247300,23.21.0,5,Great,Shipped fast cheap prices and good quality,https://itunes.apple.com/us/review?id=632064380&type=Purple%20Software,2023-06-04T21:32:08-07:00
9998744781,Foofer11,https://itunes.apple.com/us/reviews/id154824708,23.21.0,1,Vinted profits off fake items!!! AVOID,"I received a counterfeit purse from an account that had already been suspended by Vinted for selling fakes. I received two items the same day and accidentally marked the fake one as “received” instead of the first parcel I’d opened. But upon opening the purse seconds later, I realized it was fake and that in fact, VINTED HAD ALREADY SUSPENDED THE SELLER’S ACOUNT. Vinted’s customer service is terrible, you can only contact support via messaging in the app, and you receive mostly automated responses. I have explained the situation countless times and they refuse to even continue the conversation with me, saying simply that the payment has already been released to the seller. Obviously this is not possible because the account was already suspended by Vinted. This means that Vinted is pocketing the $100 I was just ripped off and keeping it for themselves! I keep asking them to amend their refund policy for this type of situation and they won’t even respond! In other words, Vinted is knowingly profiting off the sale of counterfeit items on the app. Completely unethical and counter to all of Vinted’s other policies",https://itunes.apple.com/us/review?id=632064380&type=Purple%20Software,2023-06-04T08:27:25-07:00
9996662833,lmf25!,https://itunes.apple.com/us/reviews/id1535063896,23.21.0,5,Excellent place to buy and sell great pre-owned clothes’,I love selling on Vinted and buying great pre-owned clothes.  The app is very easy to use.  Highly recommend ❤️,https://itunes.apple.com/us/review?id=632064380&type=Purple%20Software,2023-06-03T18:20:48-07:00
9993824031,Angieptru,https://itunes.apple.com/us/reviews/id458259159,23.21.0,3,Be careful!,"Be careful and be mindful of the seller you’re buying from. About half of my packages never came, and you only have two days to report an issue. So if you’re leaving or out of town, get someone to check your delivery. Other than that, it’s easy and fine.",https://itunes.apple.com/us/review?id=632064380&type=Purple%20Software,2023-06-02T23:30:53-07:00
9992510374,AnnieBananie29,https://itunes.apple.com/us/reviews/id222028556,23.21.0,2,Can’t change location or create new profile,"Vinted worked well when I was in the US, but I’ve since moved to Spain and the app doesn’t allow me to change my location so that I can get local items. I thought deleting my profile and making a new one would work, but Vinted still thinks my email is already attached to a profile. So the app has become useless for me. ARGH.",https://itunes.apple.com/us/review?id=632064380&type=Purple%20Software,2023-06-02T13:43:07-07:00
9987520785,hnsxoxo,https://itunes.apple.com/us/reviews/id1217602844,23.21.0,5,Leaving all other apps for this one,"I love this app!!!!!! For both buying and selling, I came from other apps like Poshmark and Mercari and for buying and selling this is the MOST reasonable one! I love offering my buyers a good deal and this app doesn’t take fees, the shipping is also the most reasonable rate of ALL the apps I have bought and sold on. Also customer service is absolutely wonderful!",https://itunes.apple.com/us/review?id=632064380&type=Purple%20Software,2023-06-01T05:19:45-07:00
9984317925,tvantic,https://itunes.apple.com/us/reviews/id609655503,23.21.0,5,Awesome seller,This is my first purchase so I am not sure this is review about the site or seller. About the seller nightly recommended . A  Amazing  communication and goes above and beyond. Thanks 🙏🙏🥰🥰💓💓,https://itunes.apple.com/us/review?id=632064380&type=Purple%20Software,2023-05-31T07:12:25-07:00
9983393365,Someone don't ask,https://itunes.apple.com/us/reviews/id432051230,23.21.0,5,Excellent,Thank you so much,https://itunes.apple.com/us/review?id=632064380&type=Purple%20Software,2023-05-31T01:20:57-07:00
9977829272,B Shaw21,https://itunes.apple.com/us/reviews/id1065210849,23.21.0,1,Blocked account,They blocked my account permanently for no reason.  They said it was for illegal activity but never stated what activity.  I didn’t do a single thing wrong.,https://itunes.apple.com/us/review?id=632064380&type=Purple%20Software,2023-05-29T08:39:23-07:00
9972327659,Kimattamoon,https://itunes.apple.com/us/reviews/id1417365852,23.20.0,5,Cute,She was so sweet and the clothes and packaging were so cute def buying from here again,https://itunes.apple.com/us/review?id=632064380&type=Purple%20Software,2023-05-27T17:32:55-07:00
9968388083,Haromaritza,https://itunes.apple.com/us/reviews/id292905496,23.20.0,5,Good Stuff,"Received my order 
Item as described",https://itunes.apple.com/us/review?id=632064380&type=Purple%20Software,2023-05-26T13:47:32-07:00
9967249504,Wh#%€,https://itunes.apple.com/us/reviews/id1370999241,23.20.0,5,Ty!!🙏,Trusted seller👍 appreciate it!!💯,https://itunes.apple.com/us/review?id=632064380&type=Purple%20Software,2023-05-26T06:42:38-07:00
9966946805,Onspared,https://itunes.apple.com/us/reviews/id138619383,23.20.0,5,It’s convenient to save money,I like the idea of buying used/unused products on a discounted price. I like the part that it’s very convenient to buy/sell and pay using the app.,https://itunes.apple.com/us/review?id=632064380&type=Purple%20Software,2023-05-26T05:01:31-07:00
9963904582,Chichiemoa,https://itunes.apple.com/us/reviews/id500866333,23.20.0,5,Super,"Package received in a few days! The shoes were perfect, clean and basically new! Great experience and highly recommended 🥰",https://itunes.apple.com/us/review?id=632064380&type=Purple%20Software,2023-05-25T06:36:24-07:00
9963608222,Sammy Jasmine,https://itunes.apple.com/us/reviews/id1518890472,23.20.0,1,Scam,As soon as I brought something from this app I was logged out of my account and I am not able to get into it. Please help,https://itunes.apple.com/us/review?id=632064380&type=Purple%20Software,2023-05-25T04:55:33-07:00
9963588857,sdfhhtsxgs,https://itunes.apple.com/us/reviews/id617069256,23.20.0,1,Overall the worst selling app,"I have too many complaints about Vinted to list them all. Customer service is incompetent at best, spiteful jerks at worst. Now their app doesn’t even function. Since their latest update, I’m no longer able to sign in on my phone and can only access my account through a computer. No point in contacting them about it though because they resolve nothing.",https://itunes.apple.com/us/review?id=632064380&type=Purple%20Software,2023-05-25T04:48:28-07:00
9963579261,the vampaneze lord,https://itunes.apple.com/us/reviews/id820780291,23.20.0,5,Log in,"Won’t let me log back into the app! It kicked me out and even though I Sign in with Apple, it just doesn’t understand. But I could log in perfectly to the website, make it make sense.",https://itunes.apple.com/us/review?id=632064380&type=Purple%20Software,2023-05-25T04:44:55-07:00
9958577349,nogi75,https://itunes.apple.com/us/reviews/id240517395,23.20.0,3,Great seller!,"Fast shipper!! 
Thank you for the purse. I didn’t realize it was a small bag. I thought it was a big tote but it’s a tiny one. It’s cute and it will be well loved. Thank",https://itunes.apple.com/us/review?id=632064380&type=Purple%20Software,2023-05-23T16:03:17-07:00
9958557581,Melissa2111111111,https://itunes.apple.com/us/reviews/id121111248,23.20.0,2,So many fake sellers and scams,"There are so many fake sellers on here it is hard to search for bags. Juicy Couture bags - most of the listings are from fake sellers / scammers you can tell by their names and if they don’t accept payment

Solution: make sellers upload a photo of their ID (2-3 forms) ; make funds unavailable until buyer approves the item and hold the buyers funds until then. 

Deleting this app for now; I was able to buy one shirt on here that came in the mail from a seller with good reviews. There are too many fake listings to sift through. If a buyer doesn’t have great reviews and their user name is a bunch of numbers or gibberish; don’t buy.",https://itunes.apple.com/us/review?id=632064380&type=Purple%20Software,2023-05-23T15:53:48-07:00
9957838758,viv4248,https://itunes.apple.com/us/reviews/id796262493,23.20.0,1,Terrible customer service,I’ve lost so much money to vinted. I had a seller suspend their order because they sent me the wrong item. We tried to resolve the issue ourselves as she was trying to get my item back from the other girl she accidentally shipped it to(which go out surprise that girl decided to not ship it back. Love that for us) and I had already shipped back the wrong item that was sent to me. It’s be approximately 20 days and nothing has been resolved and vinted immediately released those funds to the seller without the issue having been resolved. When I asked for help about my money that I just lost they told me it was basically my fault for not clicking the “everything is not okay button” within the two day period. The reason why I didn’t is because the seller had already suspended the order and there wasn’t a BUTTON TO PRESS. The seller wants to refund me the full amount but vinted refused. They’re customer service is terrible. They give attitude and on top of all this they also keep deleting my posts saying it’s not allowed and I’m using pictures from outside sources. Which I’m not at all. It’s my bedroom floor. It’s annoying how this has not happened one. Not twice. But minimum 7 times. I wish there was a help center we could complain to because that’s how frustrated this app makes me. And this is the only review I have ever written for an app,https://itunes.apple.com/us/review?id=632064380&type=Purple%20Software,2023-05-23T10:37:39-07:00
9953627621,s050m3,https://itunes.apple.com/us/reviews/id1320109340,23.19.1,2,Search results limited to your region,I browsed Vinted before making an account. Could see loads of stuff from all around Europe but when I made an account (in Romania) the only search results showing are from Romania and Poland . Wish I could select by country / region and also to sell to a wider market than my own country,https://itunes.apple.com/us/review?id=632064380&type=Purple%20Software,2023-05-22T05:32:49-07:00
9953182758,Apotheker81,https://itunes.apple.com/us/reviews/id34146106,23.19.1,5,Great Seller and great communication,This was my first purchase using Vinted and I am so happy! Everything worked out so easily. I also want to thank der_graf_von_h for his great communication with me and direct photo of the shipping label. I am new here and will be back. Thank you again so much! The product I received was in great condition and exactly as described. Top!,https://itunes.apple.com/us/review?id=632064380&type=Purple%20Software,2023-05-22T02:30:57-07:00
9947508219,Maellys04,https://itunes.apple.com/us/reviews/id1336311640,23.19.1,5,Excellent,Je recommande!,https://itunes.apple.com/us/review?id=632064380&type=Purple%20Software,2023-05-20T10:17:54-07:00
9944984254,Katietlynn,https://itunes.apple.com/us/reviews/id1530262257,23.19.1,5,Clothes,"Fast shipping, the seller was very nice and communicative and I loved all 3 of my clothes 🥰",https://itunes.apple.com/us/review?id=632064380&type=Purple%20Software,2023-05-19T18:02:49-07:00
9944068753,Blue293,https://itunes.apple.com/us/reviews/id110077047,23.19.1,5,Loving Vinted,"So far this has been a wonderful experience. The sellers and buyers have been easy to work with. The products have been very good. They pay relatively fast, no issues, no worries, no stress.
Everyone is friendly. Customer service has been easy and worry free. But haven’t really had to use it.",https://itunes.apple.com/us/review?id=632064380&type=Purple%20Software,2023-05-19T11:18:32-07:00
9944046359,Franci84mi,https://itunes.apple.com/us/reviews/id28649561,23.19.1,5,"Tutto bene, stivali come da descrizione 👍🏻",Ordine ok! Grazie ancora,https://itunes.apple.com/us/review?id=632064380&type=Purple%20Software,2023-05-19T11:09:32-07:00
9942124292,doggo girly,https://itunes.apple.com/us/reviews/id163176542,23.19.1,5,Very nice and easy👍,Great place to sell your stuff,https://itunes.apple.com/us/review?id=632064380&type=Purple%20Software,2023-05-18T23:03:55-07:00
9938707384,Sammyroseo,https://itunes.apple.com/us/reviews/id622490066,23.19.1,5,Love it,"Thank you so much, I absolutely love my necklace and was delivered so fast just in time for my birthday 💕",https://itunes.apple.com/us/review?id=632064380&type=Purple%20Software,2023-05-17T23:28:09-07:00
9938366367,Ape.Real,https://itunes.apple.com/us/reviews/id1115312655,23.19.1,5,Thank you!,Very cute dress! Great customer service and adorable sticker,https://itunes.apple.com/us/review?id=632064380&type=Purple%20Software,2023-05-17T20:36:34-07:00
9933294685,Capsiuk,https://itunes.apple.com/us/reviews/id1423241901,23.19.1,5,Guess tašė,Viskas super!,https://itunes.apple.com/us/review?id=632064380&type=Purple%20Software,2023-05-16T09:14:24-07:00
9931882982,Abcdhanah,https://itunes.apple.com/us/reviews/id408366509,23.18.0,5,Men’s joggers,I received my order with no issues and my son was very happy with the product. Thank you!,https://itunes.apple.com/us/review?id=632064380&type=Purple%20Software,2023-05-16T00:03:27-07:00
9930986922,Brutal_Slam_,https://itunes.apple.com/us/reviews/id1208889725,23.18.0,5,Happy customer,Item came in exactly as promised. Extremely well packaged with fast shipping. Very content with everything. Thank you!!!,https://itunes.apple.com/us/review?id=632064380&type=Purple%20Software,2023-05-15T16:39:44-07:00
9924542686,poision.mushroom,https://itunes.apple.com/us/reviews/id1176144209,23.18.0,1,"horrible errors, unfixable.","i wouldve given the app a greater review if it wasn’t for the constant pop up of “sign in/up.” i couldnt even scroll 15 seconds without the constant agonizing pop up. the “skip” shouldn’t even be an option because it’s technically a forced conduct. that’s not the main reason of my horrid review, not at all. the most horrible reason this app is genuinely awful and non-user friendly is because of the invalid username or not ‘real’ username glitch. i tried around 30 unique combinations of names, some including letters or not including letters. each time i was greeted with “please enter a valid or real name!” what? i did enter username suggestions, many many times! i even looked on the internet how to fix this problem. your app is atrocious. pleas fix this horrendous problem because it makes your app awful and awkward.",https://itunes.apple.com/us/review?id=632064380&type=Purple%20Software,2023-05-13T19:37:39-07:00
9923161694,Mishiiiiiiiiiiiii,https://itunes.apple.com/us/reviews/id463157838,23.18.0,5,Satisfied,"I really like this app;
Trustworthy, easy to work with , delivery, money withdrawal and …",https://itunes.apple.com/us/review?id=632064380&type=Purple%20Software,2023-05-13T09:44:23-07:00
9919688531,pribemi,https://itunes.apple.com/us/reviews/id1101439582,23.18.0,5,Súper!,Todo llego perfecto!! :),https://itunes.apple.com/us/review?id=632064380&type=Purple%20Software,2023-05-12T10:11:21-07:00
9919401788,twoshoes_,https://itunes.apple.com/us/reviews/id360847025,23.18.0,1,Free items,If you want items for free then just mark them as not delivered and they’ll take the money back from the seller. I loved this app until they brushed me off and stole money and items from me. A seller reported the items I sold as not delivered even though the tracking number said they were. I even called their local post office who said the package was delivered. But customer service just decided they would stop responding to me and answering their messages from me. I won’t be selling through this app anymore.,https://itunes.apple.com/us/review?id=632064380&type=Purple%20Software,2023-05-12T08:30:53-07:00
9917996054,myfavthriftedfinds,https://itunes.apple.com/us/reviews/id389649751,23.18.0,5,amazing!!!,shipped quickly & was so communicative! Thank you! 🤍,https://itunes.apple.com/us/review?id=632064380&type=Purple%20Software,2023-05-11T23:12:05-07:00
9917501425,ᴡᴀᴄᴋʏʙᴜɴɴʏ,https://itunes.apple.com/us/reviews/id898927147,23.18.0,5,Amazing seller.,I bought 2 things from this seller and they both came in less than a week which i am thankful for. Seller was very nice and even let me by the items for a cheaper amount than the regular price. Def would buy from them again I loved everything that i bought from them ❤️❤️,https://itunes.apple.com/us/review?id=632064380&type=Purple%20Software,2023-05-11T18:56:21-07:00
9915310942,olatundun1,https://itunes.apple.com/us/reviews/id1301822470,23.18.0,5,Good,"Package great, exactly as seen",https://itunes.apple.com/us/review?id=632064380&type=Purple%20Software,2023-05-11T04:19:00-07:00
9912686322,Catycy,https://itunes.apple.com/us/reviews/id168739160,23.18.0,5,Bring it to Cyprus !!!,We NEED Vinted Cyprus,https://itunes.apple.com/us/review?id=632064380&type=Purple%20Software,2023-05-10T08:35:06-07:00
9909909674,Susacru,https://itunes.apple.com/us/reviews/id274508252,23.18.0,5,Thanks ❤️love it!,👏🏻👏🏻👏🏻,https://itunes.apple.com/us/review?id=632064380&type=Purple%20Software,2023-05-09T12:15:39-07:00
9907421353,hadestavern,https://itunes.apple.com/us/reviews/id1526760563,23.18.0,5,Love it!!,The shirt fits exactly as I wanted it to and it came in reasonable time. Very nice customer service and cute stickers that come along with your order :),https://itunes.apple.com/us/review?id=632064380&type=Purple%20Software,2023-05-08T18:45:39-07:00
9906640162,m viking fan,https://itunes.apple.com/us/reviews/id118562398,23.18.0,5,Love my items.,Five stars  even sent my a gift top. I will enjoy  my new items. Thank you so much.,https://itunes.apple.com/us/review?id=632064380&type=Purple%20Software,2023-05-08T12:46:19-07:00
9902970191,Gierzy,https://itunes.apple.com/us/reviews/id120824184,23.17.1,1,Horrible!!,"They’re clueless on authenticity. I’ve been selling/buying on vinted for almost 10 years. Never once posted an item that wasn’t authentic. They keep taking down my authentic items and say that I’m posting fake items. Why don’t they consider my history or make sure they’re NOT authentic before blocking my account. I made a sale that I can’t even ship out now cause they blocked my account. They need better customer support and find someone that knows the difference between real and fake items. I was just sold a fake Fendi and they did nothing about it. People
Make a living off of these apps and they’re screwing with my income because they’re clueless… Poshmark is so much better. They actually know what they’re doing. they should really make sure they know what they’re doing before they mess with peoples livelihood. They’ve taken down so many items that I sold somewhere else. So they’re actually losing…",https://itunes.apple.com/us/review?id=632064380&type=Purple%20Software,2023-05-07T10:45:15-07:00
9897001515,blahxb,https://itunes.apple.com/us/reviews/id231794526,23.17.1,5,purchase,Thank you!,https://itunes.apple.com/us/review?id=632064380&type=Purple%20Software,2023-05-05T18:38:45-07:00
9894071537,B3II4,https://itunes.apple.com/us/reviews/id1325702932,23.17.1,1,Bad app keeps banning my account,I downloaded this app and it was good but I purchased one thing and they said my account was sketchy and they would ban me unless o emailed them. I emailed them and they never got back to me and i tried to create a new one and they banned that one within 3 hours. Bad customer service will not be back,https://itunes.apple.com/us/review?id=632064380&type=Purple%20Software,2023-05-04T22:45:05-07:00
9893039825,Gomezvanes6851,https://itunes.apple.com/us/reviews/id184964483,23.17.1,5,Books,"Well packaged, thank you very much!",https://itunes.apple.com/us/review?id=632064380&type=Purple%20Software,2023-05-04T14:36:57-07:00
9892271166,Ghisley5,https://itunes.apple.com/us/reviews/id964619941,23.17.1,5,Blouson fin jersey de coton,Très joli blouson. Comme neuf! J’en suis très contente.,https://itunes.apple.com/us/review?id=632064380&type=Purple%20Software,2023-05-04T09:26:49-07:00
9888785328,Reseller18,https://itunes.apple.com/us/reviews/id303652819,23.17.1,1,No actual seller support,"I’m an experienced online reseller, and Vinted is by far the worst site I’ve tried for reselling. They have absolutely no seller support: as in you can’t even contact them directly and receive a response. It clearly says after submitting feedback or requesting assistance that the comment will be reviewed but not responded to. I use the site occasionally for some “last chance” items that haven’t been moving elsewhere because if something goes wrong during the sale I'm not out too much, but I most definitely don’t attempt to sell high-interest items here. It’s too bad because initially I had hopes Vinted would be a great way to reach more buyers, but it definitely isn’t. Vinted is very much missing the mark when it comes to seller support and that ruins the selling experience.",https://itunes.apple.com/us/review?id=632064380&type=Purple%20Software,2023-05-03T08:57:45-07:00