id,userName,userUrl,version,score,title,text,url,updated
10457898295,shinobi00013,https://itunes.apple.com/us/reviews/id1226147201,23.20.79,3,Message delivery,In the past week and a half it is went from where my messages with deliver right after I send them. And now I have to force them to deliver by calling the number.  This is not acceptable because there are times that I don’t have time to call someone to get WhatsApps to force the messages through. And I messaged my fiancé that lives in the Philippines and I live in the United States. It’s a 12 hour difference.  And if I need to message him about something so I don’t forget. So he would see it when he woke up I don’t want to be calling and chance waking him up. So this needs to be fixed.,https://itunes.apple.com/us/review?id=310633997&type=Purple%20Software,2023-10-09T21:14:46-07:00
10306503557,sona saleh ahmad,https://itunes.apple.com/us/reviews/id1148679174,23.17.0,4,Iraq,"On WhatsApp, when a person deletes a message for everyone, or I delete a message for me or for everyone, when deleting a message in which he writes / This message has been deleted, or this person has deleted the message, this thing is annoying in WhatsApp. Please change this so that it becomes beautiful. Whenever a message is deleted, it is deleted without mentioning No deletion of it. Please change this thing in WhatsApp because WhatsApp is a very great program, but this is the only thing in it that is not good 🥺🤍",https://itunes.apple.com/us/review?id=310633997&type=Purple%20Software,2023-08-27T16:42:38-07:00
9909902618,Buck Flicks,https://itunes.apple.com/us/reviews/id25779219,23.9.77,3,Great messenger app but loses the call feature.,"I love WhatsApp. It’s the best group message app I’ve found. If it was ONLY that, it would be perfect.

Nobody needs the call feature. That’s what we have phones for. The only people who use the call feature are spammer/scammers. 

If you’re not going to remove the call feature, for the love of God, give us the option to turn it off. Or at the least, give us the option to only accept calls from contacts. I get 5 robo calls a day from out of the country. Blocking those numbers after the fact is useless. Let us block them all beforehand.",https://itunes.apple.com/us/review?id=310633997&type=Purple%20Software,2023-05-09T12:12:43-07:00
3085714674,flycles,https://itunes.apple.com/us/reviews/id889474391,2.18.81,5,Jay on the beat,WhatsApp has been one of the communication platforms that has changed the way I approach a lot of my communication. Very convenient to use and most effective even more than texting on regular text messaging now a days. The voice and video calling is superb and mostly gives you a 5 star quality calling. It makes for international calling easy without having to go through these most expensive phone companies to make such calls. On the whole it’s been most useful.,https://itunes.apple.com/us/review?id=310633997&type=Purple%20Software,2018-08-19T02:53:45-07:00
7553374465,sf player,https://itunes.apple.com/us/reviews/id641446653,2.21.130,2,Well I don’t know why you would get this if it weren’t for the encryption,"This app was built to be an easier messaging app over iMessage…this is no longer the case.  This app is very cluttered when you view your messages, it doesn’t have anything fun like stickers or iMessage gigs in it, and it is not any better at sending messages than iMessage. Sure it does have its perks like unloading and downloading videos and photos, but if it doesn’t work as well as iMessage it really is not worth it. Sure people use this but idk why you would use it over your messages app. P.S. phone plans all call with WiFi now… you don’t need an app for that it is a setting in settings.",https://itunes.apple.com/us/review?id=310633997&type=Purple%20Software,2021-07-08T07:06:29-07:00
6507306852,d.tous,https://itunes.apple.com/us/reviews/id635999076,2.20.102,4,"Great, but","I love WhatsApp, but there’s a glitch that has been going for a while, I thought it might be my phone, but I just replaced it and I still have the same issue. Sometimes when I play voice messages, they only play for a second, then stop. This also happens sometimes while recording voice messages, it only lets me record for a second, then automatically stops and cancels the recording. And the only way to solve it, is by restarting the phone, then it keeps working fine, but this happens to me at least 1-2 times a week. It’s annoying 😬",https://itunes.apple.com/us/review?id=310633997&type=Purple%20Software,2020-10-06T10:19:49-07:00
5467620894,fffhhhaaa52,https://itunes.apple.com/us/reviews/id970941018,2.20.11,4,Update suggestion,"The app is great overall, but I wish group chats would allow the admin the ability to delete posts/comments from others so no one else in the group can see it. Some groups are made for specific things like advertising but some people don’t go by the rules, and will post random things that don’t have anything to do with the group’s purpose. If the admin is able to delete posts and control what people can send in that specific group, it would help specific groups achieve their purpose better. This is just an example.",https://itunes.apple.com/us/review?id=310633997&type=Purple%20Software,2020-01-30T13:51:44-07:00
3750602003,Chris Gallego,https://itunes.apple.com/us/reviews/id81003465,2.19.20,4,Read receipts,"Please add individual option for Read Receipts ! I know you can set it globally for all messages, but not individually . And I know the workaround is to open a group chat with that one person and rad receipts will enable. But how about adding this option individually to avoid having a bunch of group chats?  Lord knows everyone has too many group chats in today's day in age. To clarify, I am just requesting that individually, one on one texting can have read receipts enabled. Please add this feature ! Thank you guys. Amazing app!!! You guys have set the standard of instant messaging and the world appreciates it!!",https://itunes.apple.com/us/review?id=310633997&type=Purple%20Software,2019-02-09T06:51:27-07:00
10575580590,Old Vet (disabled),https://itunes.apple.com/us/reviews/id1358945155,23.23.79,5,Using Whatsapp to manage my activities >,"I’m 75 and disabled (fell down a flight of stairs 26 years ago).

I rely on communicating with service providers through this app.  I use it daily to confirm upcoming appointments- AND GETTING TO THEM; Getting my RX’s delivered by CVS; Hearing about Test results (Blood & other results… Colonoscopy, Cancer screenings/other AGE related highlights!

I even use this to create my shopping lists (both to see if someone is able to get some items for me & to read what I need and go to get the stuff myself providing someone drives me there).

I use it as a ‘social’ networking tool / And yes I’m 75 and these online tools help to keep my mind (sig. brain) functioning as well as it can. It will also alert caregivers if I’m not doing well . They can alert me to that fact; and get help. So it’s a creative tool that I have incorporated into a ‘lifestyle’ framework.",https://itunes.apple.com/us/review?id=310633997&type=Purple%20Software,2023-11-11T13:55:34-07:00
10037044999,britkaz,https://itunes.apple.com/us/reviews/id678247567,23.12.71,5,🇬🇧 Traveler,"A must when traveling, this app, not even disapproved of by my mobile carrier, is a lifesaver when it comes to communicating with family and friends anywhere in the world and I’ve been using it since it was founded!  
Whether sending photos, videos, helpful links or just text messages it is fantastic.  I frequently use it for phone or video calls to single folks or groups of people.  
Best of all:
ITS FREE!!!!!
So to Meta or whoever now owns What’s App, please do not start charging your consumer's!",https://itunes.apple.com/us/review?id=310633997&type=Purple%20Software,2023-06-15T10:41:01-07:00
10050260771,whalesta,https://itunes.apple.com/us/reviews/id1215528254,23.12.71,3,I like the privacy but….,"The app itself is very simple and reliable. I just wish it can be more customizable like Messenger. I miss all the fun features of Messenger like setting up themes, filters, games, watching videos together, etc. but due to privacy concerns I recently switched over to WhatsApp. The video call quality and reception is not as great as Messenger also. I was expecting a lot more from WhatsApp since this app has been around for more than a decade. I’m pretty surprised and disappointed of how lacking this app is compared to Messenger! I’m very tempted to switch back to Messenger because of these reasons…",https://itunes.apple.com/us/review?id=310633997&type=Purple%20Software,2023-06-19T07:35:48-07:00
6773690960,chizzy.nova97,https://itunes.apple.com/us/reviews/id1192197116,2.20.132,5,I can’t search for a friend status to view,"Why does the last upgrade doesn’t allow me to search for a person name to view his/her status update. It’s very bad 
I got a lot of contact and I don’t view all status updates. I only search for a name and view. But this time around, the update will make me scroll up and down searching for a person name whereas it’s something that could be done so easily by just searching the name of the person to view. 
It’s very bad !",https://itunes.apple.com/us/review?id=310633997&type=Purple%20Software,2020-12-20T02:42:51-07:00
7950376840,bobwe38,https://itunes.apple.com/us/reviews/id194706472,2.21.200,4,New to WhatsApp,"As I gain experience I am certain that my proficiency will improve.  In the meantime, I have found a few things less than intuitive to me, a much older user.
I have two friends out of the country who prefer WhatsApp.  Fortunately they are both very understanding and are putting up with my learning curve.
I have not attempted voice communications, largely due to a significant time difference, but I am certain the opportunity will come to gain that experience in addition to sending text and photos.
It just takes patience and practice.",https://itunes.apple.com/us/review?id=310633997&type=Purple%20Software,2021-10-24T14:44:30-07:00
6940141157,zeidsolh,https://itunes.apple.com/us/reviews/id169442747,2.21.20,2,PLEASE MAKE WHATSAPP LOGIN APP,This is my first review for an app. I love whatsapp it’s one of the best apps. But the backup is such a pain. It always tells me to free up space when I have over 100gb free space on my phone. I have 1.8tb available in iCloud. I had to restore my phone once because of what’s app. It told me to exit whatsapp and then my phone went on a bootloop. This issue happened twice with my sister where she had to restore her phone. I hate restoring my phone always because of whatsapp. Please make the app login with a password like facebook messenger groupme... we won’t have to worry about whatsapp space issue. I have lots of friends who all prefer if whatsapp was a login app.,https://itunes.apple.com/us/review?id=310633997&type=Purple%20Software,2021-02-01T04:08:10-07:00
5678319082,HaffedHaffyTaffy,https://itunes.apple.com/us/reviews/id506255513,2.20.31,5,New update needs fixing,"The custom background wallpaper for my chats was removed after updating, I know it can be set from my camera roll, but ends up stretched out and it looks very very unappealing. Also, dark mode should be switchable from within the app... I don’t really like the colors that dark mode offers in WhatsApp, but I do like the ones in the rest of the apps in dark mode. Pleeeease make dark mode switchable from the app itself so that it’s independent of the phone’s dark mode. Thank you!",https://itunes.apple.com/us/review?id=310633997&type=Purple%20Software,2020-03-18T10:51:07-07:00
5612084667,minty333333,https://itunes.apple.com/us/reviews/id109535532,2.20.30,5,Dark mode,"I love having my iOS in dark mode but I don’t want my whatsapp in dark mode! I hate the way it looks! We need an option within whatsapp to change from light to dark mode. Also need an option to change text bubble colors!! In dark mode, the text bubbles I send are in a dark teal color and I can’t change it!! Hate this new update!!!!!!!!!!! Please fix this, I use it everyday! Also, I don’t want to change the dark mode on my whole phone JUST for whatsapp!! Ugh!!",https://itunes.apple.com/us/review?id=310633997&type=Purple%20Software,2020-03-03T12:56:26-07:00
5083191454,schiwendita,https://itunes.apple.com/us/reviews/id704557686,2.19.112,5,Need search button,"Hi There, 

It would be really helpful to have search button(ctrl+f functionality with iPhone key board). Specially when we have family or friends group chat. There are 150 or 290 messages. No one has time to go through all those messages. So one can’t figure out what is the chat going on about. But if there is a search button, we can actually go to the exact message line and find out. That way it’s easy to catch up with what’s going on.... it will save a lot of time as well. 

Thanks a lot.",https://itunes.apple.com/us/review?id=310633997&type=Purple%20Software,2019-11-03T21:02:51-07:00
4950834888,megacookie,https://itunes.apple.com/us/reviews/id86262415,2.19.92,5,Inconvenient,"Why did you got payed or FB payed 19 billion dollars when every time i need or want to send something to various chats groups or people, you only allow 5 at at time. 

Don’t you know the technology that that Apple uses for selling music, videos, IM’s. 

They don’t have 4 Billion times the same title of a song. They sell it 4 Billion times but with only one file. 

Are you so poor that you cannot afford to buy servers with tons and tons and tons of terabytes that You make the use of your app a nightmare but FB not only allow but dedicates and promotes the invasion of privacy?

Next time( (which I believe it will be soon) Mr. Z should respond to this in committee. 

Boy, I really love you. And by the way, if he us such a “genius” how come he cannot or doesn’t know how to monetize WA. Ahhhhh?

Sorry for being a little bit rude but he did the same when he stole FB from its creators. I belive he can take a few punches.",https://itunes.apple.com/us/review?id=310633997&type=Purple%20Software,2019-10-15T05:45:39-07:00
3654157207,about:WhatsApp from:Katie,https://itunes.apple.com/us/reviews/id964586217,2.19.11,5,So much more than just texting.,"I love WhatsApp because you can do so much more than just texting. I wouldn’t want any other app. 
It is very secure and lets u do everything where u could possibly even be control. 
STATUS: WhatsApp lets u actually decide who can or can’t look at ur status. U can also see other people’s* status’ and see who of them saw urs. * Only ur contacts on WhatsApp. 
TEXTING: WhatsApp allows u to of course, see when someone wrote something, it allows u to delete messages, maybe only for ur self, or for both of you. It allows you to do much more that I honestly can’t exactly explain. 
SETTINGS: You can always change your picture next to your name, you can always change the background of your texting page, you can look at all your starred messages, etc... 
WhatsApp is a great texting app that I’m sure you would like to use.  
Have fun with WhatsApp!!😍✌️🥳📱",https://itunes.apple.com/us/review?id=310633997&type=Purple%20Software,2019-01-15T12:59:47-07:00