id,userName,userUrl,version,score,title,text,url,updated
4284278642,jakerzk92,https://itunes.apple.com/us/reviews/id253797659,2.19.51,5,Success! 👍,"I downloaded the WhatsApp a few days ago, and I’m very impressed on how simple and easy it is to use and set up! The interface is easy to navigate, and it works just like any modern-day Apple/Android text layout! This app also has some useful features that informs you on who’s online and who’s away from their device, as well as setting up your own small profile! I would highly recommend this app to anyone who would rather use the internet to send text, images, video, and/or audio, oppose to a cellular network!",https://itunes.apple.com/us/review?id=310633997&type=Purple%20Software,2019-06-08T08:42:42-07:00
9863033469,LosHerreras,https://itunes.apple.com/us/reviews/id134604923,23.8.75,5,Suggestion for Status post,"I love every feature you have added to the app. However I’ve been waiting on a possible feature that I will recommend; when posting a message on my status, I would like to have control on replies. Could this be set up that people DON’T reply, just SEE the post on my status?

I know I can program WHO sees it, but having the feature of “NO REPLIES” will be great.  At times I just want to share information and not have 50 people reply with emojis. 

Thank you.",https://itunes.apple.com/us/review?id=310633997&type=Purple%20Software,2023-04-26T05:42:01-07:00
10342059779,oil artist,https://itunes.apple.com/us/reviews/id110555862,23.17.78,1,Proceed with caution,"I downloaded this app because a good friend was going to Europe and we wanted to keep in touch.
After i downloaded it i sent her a text message to test it out. Then i sent my sister a text message because she was in London so I texted her to say hi and let her know i had whatsapp. I sent no other messages. 
One week later i tried to send a message to my friend and i could not. I was locked out because supposedly i broke rules and was spamming people. There is no way that happened. Is whatsapp so undependable that someone was able to easily get into my account and use it? Thats scary. I dont see anywhere that i can send in a request to find out what this spam is that i supposedly sent.
I no longer trust whatsspp.",https://itunes.apple.com/us/review?id=310633997&type=Purple%20Software,2023-09-06T20:46:30-07:00
6015180795,g khcoycoydydjfglxig,https://itunes.apple.com/us/reviews/id955629168,2.20.52,5,It’s the best messenger app out there,"It’s very reliable and user friendly. Unlike other messaging apps you can send 30 minute long voice messages, which is great to have for some people. I also do believe that video and picture quality are better, but that could also just be me. I would like more sticker options like on the Apple messaging app were it’s possible to buy stickers from the App Store. All in all I would recommend if possible to move all your chats to this app and delete the others.👍",https://itunes.apple.com/us/review?id=310633997&type=Purple%20Software,2020-05-30T15:07:36-07:00
9022773341,pata2001,https://itunes.apple.com/us/reviews/id30674646,22.17.77,2,Getting less and less reliable by the day,"WhatsApp used to be reliable for text and voice communication. Now, it’s getting less and less reliable. Calls frequently don’t ring on the other end, the other party simply gets a missed call notification. Sometimes you have to open the WhatsApp app for calls to actually ring and go through. Ongoing calls frequently disconnects, even with less data option enabled. No watchOS app means no call notification on Apple Watch, making it very annoying to miss calls. I don’t need pointless features like stories or disappearing messages. Get your core functions work flawlessly first.",https://itunes.apple.com/us/review?id=310633997&type=Purple%20Software,2022-08-27T05:38:46-07:00
8685289372,SophiaSinitsa,https://itunes.apple.com/us/reviews/id1311929835,22.10.76,4,I like but,I like all things but some of them are not too good like 1 I want to send a video but I can’t 2 some times it doesn’t work 3 not all people can have it because it doesn’t install 4 when there is no internet it doesn’t work at all 5 all the time after a call it shows how much stars will you give it and that’s annoying 6 you can’t share your screen like an phone 7 there is no cool stuff.                                                                                  Thank you for reading this.                                              By Sinitsa,https://itunes.apple.com/us/review?id=310633997&type=Purple%20Software,2022-05-18T20:13:16-07:00
7516632138,Mzrog,https://itunes.apple.com/us/reviews/id414712347,2.21.120,3,Great for reaching people but not enough features,"I like that I can connect with people using various devices over individual and group chats. 

I dislike that there isn’t a like/reaction feature to conversations. The interface feels very outdated - it’s a classic internet aesthetic in a new age of technology, so it has a clunky vibe. 

Also, as people move away from Facebook, it may be a good idea to separate yourself from that organization. I am actively looking for a WhatsApp alternative, personally, but it’s still one of the best products for its purpose. I just wish it was a better product (with better corporate affiliations).",https://itunes.apple.com/us/review?id=310633997&type=Purple%20Software,2021-06-28T12:48:36-07:00
5894251643,betterInformed,https://itunes.apple.com/us/reviews/id551003953,2.20.50,5,Limiting msg forwarding to one group if the msg was already forwarded multiple times,"Why is the new update change log not talking about this?

Whatsapp doesn’t allow you to forward a msg to multiple groups if the msg has already been forwarded multiple times before reaching you.

The reason whatsapp could have done this is to track who sent the msg in the first place and to avoid spreading rumors/misinformation during uncertain times like this. So if you think about doing the below mentioned workarounds, please be aware of what you are forwarding. If you are forwarding something that’s not right using the below workarounds, whatsapp can find you easily now than ever.

A easy way to get around this is,
1. If it is a msg, copy and paste it and create a new msg Id to it and then you can forward it multiple times.
2. If it is a media, download and forward it to multiple groups. This will create a new msg id.",https://itunes.apple.com/us/review?id=310633997&type=Purple%20Software,2020-05-02T11:43:58-07:00
5712195747,sucarf,https://itunes.apple.com/us/reviews/id630859282,2.20.31,5,Communicate around the world regardless of which cell you own!,"WhatsApp lets you freely communicate with any cell phone around the world regardless of what cell they own using Wifi, and it has its own WhatsApp FaceTime. No overseas charges, all you have to do is, to ask your friend or family to download it for free, no more International charges. Did you know that when the big earthquakes hit Chile or the hurricane in Puerto Rico, this was the way ppl were communicating. Now with a Pandemic, it’s so comforting to be with loved ones near by and yet so far away in another country.",https://itunes.apple.com/us/review?id=310633997&type=Purple%20Software,2020-03-25T10:32:11-07:00
2341590103,heidiibb,https://itunes.apple.com/us/reviews/id749219577,2.18.31,5,WhatsApp,"I LOVE the WhatsApp app, since I discovered it I’ve never stopped using it! It’s one of the most easiest ways to communicate with friends and loved ones as long as they have the app as well. Easier way to send messages, videos, and photos. The part I find even more interesting is it doesn’t matter if your phone is shut off since WhatsApp uses your real number when you sigh up you can still text people through WhatsApp with your number as long as you have access to WiFi. Hey I’ll take that!! 👍🏽😁",https://itunes.apple.com/us/review?id=310633997&type=Purple%20Software,2018-03-24T08:33:38-07:00
5080168383,Jen--H,https://itunes.apple.com/us/reviews/id166619068,2.19.112,1,Support is not helpful - problem resetting my two step verification PIN,"Am utterly disappointed in WhatsApp support’s ability to provide help. Having forgotten my PIN for the two step verification, I requested the reset email from the app many times but still did not receive it (FYI, my email is registered as I have received that email before). Upon contacting support, most times I received the FAQ response, and a few times, an actual person (Meg) would reply. But a solution was never provided. 
It’s been a week and the option to reset the account is now available, but this means all pending messages will be deleted - impacting both personal and work correspondence. Can anyone at WhatsApp send me the reset PIN email instead? I do not wish to reset the account if possible.",https://itunes.apple.com/us/review?id=310633997&type=Purple%20Software,2019-11-03T08:30:06-07:00
4072361314,MADBOXING,https://itunes.apple.com/us/reviews/id150049615,2.19.42,1,Does nothing to protect your #,"I used to like WhatsApp. Used it lots no problem. Until I got contacted by suspicious numbers. Sending me death threats and gruesome cartel murders trying to extort money from me. WhatsApp uses your number. So I thought I was safe to just block and delete those numbers. I was wrong, the scammers use my number and the search for my info and text my number directly. It’s very scary, had me panicking.
All that cause they got my number after sending a WhatsApp message to someone from on online dating app. Can’t blame WhatsApp totally, just saying user beware!
If you get contacted on WhatsApp, it’s your own direct like that is used. That said your number can easily be searched online, and your private information revealed. 

I did click on the block and report button on all the numbers which the death threats , extortion messages, and gruesome videos were being sent. I really hope that WhatsApp does get alerted by that, that it just isn’t a button, it should be investigated and reported to the proper authorities. 

Can WhatsApp numbers be spoofed? If not, then they can crackdown right away on people who abuse their service.",https://itunes.apple.com/us/review?id=310633997&type=Purple%20Software,2019-04-28T08:00:55-07:00
9793090425,Horrorguy34,https://itunes.apple.com/us/reviews/id1350225310,23.5.78,5,Feature Request,"Hello, I have no bad review about WhatsApp. They are the most proficient texting app we’d ever have. But I want WhatsApp to introduce a new feature. When you block a contact. There should be an option if you want the number to stay on your blocked list and remain blocked  or not. It can be blocked and removed. And if I don’t want the number removed its my choice. I’m struggling with drugs and everytime I block the dealers number I go back to the list to unblock him. Please review this terms. Thanks",https://itunes.apple.com/us/review?id=310633997&type=Purple%20Software,2023-04-06T06:51:14-07:00
7501021198,CHAMBALAI,https://itunes.apple.com/us/reviews/id115305552,2.21.110,5,What’APP,"I think that what’s up is one of the best things that can happen to all of us. He help us to recharge the ones in do you do it without charging which I think you for that. What’APP is the only application that I use to talk to my family and friends overseas. It is an excellent application that very few problems with, but I understand because it doesn’t matter how good is and that they always have their little problems sometimes is because of the Internet. But this is to me the best app",https://itunes.apple.com/us/review?id=310633997&type=Purple%20Software,2021-06-24T08:04:19-07:00
9008430504,_ unknown,https://itunes.apple.com/us/reviews/id1168825843,22.16.77,1,Good to bad,I don’t know what going on but WhatsApp y’all need to upgrade y’all security and how to keep people stuff safe and private but don’t get me wrong I love the app and everything but for some reason my WhatsApp got hacked and I’m pretty sure that there are some more people too and that they WhatsApp got hacked too and I don’t know how that is even possible people getting their WhatsApp hacked but please get that fixed and solved ASAP and I’m trying to be mean or rude about it just please figure it out…. So to everybody that has WhatsApp please be careful with what you send to a friend because there’s might be someone watching. And  you’re WhatsApp might get hacked next that all I have to say stay safe everybody have a blessed day and a wonderful day,https://itunes.apple.com/us/review?id=310633997&type=Purple%20Software,2022-08-23T05:52:27-07:00
8843826039,LennyS,https://itunes.apple.com/us/reviews/id24382060,22.13.74,1,Voice Messages Need Help,"On multiple iPhones, multiple versions of iOS and WhatsApp voice messages stop playing. I press the play button, lift to my ear and nothing. I look at the screen and see that it’s not playing. I connect AirPods and it looks like it’s playing, but there’s no sound (yes, the volume is up and even the mute switch is off). Usually I have to restart and it will work, but 1. That shouldn’t be the case and 2. Lately even that’s not working and I have to wait like a day for it to work. Besides the absurdity of not being able to have WhatsApp on multiple phones or easily switch between platforms without losing all message history, this makes it so difficult to use with my contacts.",https://itunes.apple.com/us/review?id=310633997&type=Purple%20Software,2022-07-05T11:22:36-07:00
8003716335,Dacosta007,https://itunes.apple.com/us/reviews/id1205376643,2.21.220,1,Wish I could give it a five stars but it’s a boring same old app.,"WhatsApp is really a global socializing app and it’s kinda cool tho but i think it’s lacking a lot features unlike Telegram app there’s animated emojis that makes the app and its conversations with other people very fun and interesting because I love emojis more than stickers and so are many people. We would want more features of telegram on WhatsApp. Animated emojis, chat bubble colors, animated profile picture, saved sections and so many more. I really wish you would get my words serious and see things into it and make some new changes with more features of telegram because we are tired of WhatsApp because we see it to be a one way boring app same old stuff. Thank you.",https://itunes.apple.com/us/review?id=310633997&type=Purple%20Software,2021-11-08T16:48:05-07:00
2366516204,DeeSh0uT,https://itunes.apple.com/us/reviews/id518741437,2.18.31,5,No trouble no fuss,"I know why, I wanna see my wifeys message twice..  WhatsApp is where I go to get my fix of her without getting bothered by others say if when we use Facebook messenger... She lives half a world away right now and it helps us keep in touch.. It’s our own little realm.

Also helps me keep in touch with fam and friends in Canada, Europe and other places. Again without having to use Facebook something I try to use as little as possible.

Shoutout to those who recognize what song I slightly paraphrased in the beginning lol.",https://itunes.apple.com/us/review?id=310633997&type=Purple%20Software,2018-03-31T00:33:23-07:00
3647460768,SAMs99,https://itunes.apple.com/us/reviews/id467786151,2.19.11,4,Need video call through WhatsApp Web,"I like WhatsApp to talk to friends that aren’t in America. I recently started using WhatsApp app on windows laptop and realized that not having video call option through laptop is a bit of a miss. Considering I save a lot of phone battery by using WhatsApp on laptop, I would’ve loved to see video call option through laptop. I just drained about 15-20 percent of my phone battery because of video call and bet my laptop would’ve been better at battery management. Hopefully an update to laptop app can add this feature soon",https://itunes.apple.com/us/review?id=310633997&type=Purple%20Software,2019-01-13T17:54:43-07:00
4717664711,187StrikeKing,https://itunes.apple.com/us/reviews/id535207687,2.19.80,5,Sweet App,I love app because it doesn’t shrink videos or photos especially if someone doesn’t have the same high end cell phone or operating system your using . The call feature needs dramatic improvements but one can’t complain for using a free . I noticed it’s way faster to send photos all at one time especially adding videos prior to sending photos together . Love the face time style feature . Love you don’t get stupid advertisements like other free apps . Excellent block options. It’s a solid app with small things to improve.,https://itunes.apple.com/us/review?id=310633997&type=Purple%20Software,2019-09-02T18:31:02-07:00
10679400975,UditaDas,https://itunes.apple.com/us/reviews/id1600015869,23.25.6,1,Whatsapp keeps blocking my account everyday for no reason,My WhatsApp account has been blocked since 3 hours. I don't understand why. This has happened yesterday also and was restored back after almost 8 hours. I am clueless what is wrong. I have checked with apple and my service provider. I have been using WhatsApp since ages. Never faced anything like this before. I have NEVER violated any WhatsApp policy terms and conditions. They are saying contact WhatsApp as it is 100% WhatsApp issue. GIVE ME THE REASON WHY IT IS BANNING AND PROVIDE A PERMANENT SOLUTION FOR THE SAME. I CANNOT TOLERATE THIS UNETHICAL BEHAVIOR WHICH IS MAKING MY LIFE VERY INCONVENIENT DUE TO THIS PROBLEM. WHATSAPP ALSO DOES NOT RESPOND BACK TO ANY EMAILS WHICH IS COMPLETELY UNFAIR AND REALLY FRUSTRATING. THERE IS NO CUSTOMER SERVICE PHONE NUMBER  THAT I CAN REACH OUT TO. I NEED RESOLUTION RIGHT NOW. PLEASE DO TAKE THIS SERIOUSLY.,https://itunes.apple.com/us/review?id=310633997&type=Purple%20Software,2023-12-10T10:57:36-07:00
10404088629,jennifer22samsuel,https://itunes.apple.com/us/reviews/id1348901691,23.19.76,1,The updated on the app makes undesirable to use,"The recent update to WhatsApp has left me feeling rather disappointed. The new layout for status updates is not user-friendly. Deleting each status individually is a time-consuming process that could have been simplified. Removing the search bar for status updates seems like an unnecessary step backward.

The overall redesign of the status page has made the app less intuitive and more of a hassle to use. It would be great if WhatsApp could consider reverting to the previous layout, as this update has diminished my enthusiasm for using the app. It used to be my most frequently used app, but now, I find myself losing interest in it.",https://itunes.apple.com/us/review?id=310633997&type=Purple%20Software,2023-09-24T18:05:00-07:00
9872014910,eminentgiovanni,https://itunes.apple.com/us/reviews/id321971466,23.8.78,4,PiP on iPhone 14 pro max,"I live using WhatsApp is my number one go to app for communicating and specially video calls I love using it. I noticed that my girlfriend when she is on a video call she can multitask and still see on the screen the person she’s talking to just like FaceTime so I tried it myself but it dose y work I don’t know why I deleted the app and re downloaded it but still didn’t work, I tried every single thing i could think off but it didn’t work, with that sed Meta Can you please fix Picture in Picture ( PiP ) on iPhone 14 pro max pleeeeeeaaaasss 🙌🙌🙌🙌🙌🙌🙌🙌",https://itunes.apple.com/us/review?id=310633997&type=Purple%20Software,2023-04-28T18:04:08-07:00
9805031206,"Life is Life, Get Over It",https://itunes.apple.com/us/reviews/id121801455,23.5.78,1,Constant issues with video calls,"I have had to delete and reinstall the app multiple times due to the notifications and calls not coming through on iPhone 14. Video calls don’t ring, you don’t get a notification of the missed call until you log in and find out you missed a call. I received a missed video call and the date and time was one minute difference between the missed call and my returned call (USA), however the recipients call log showed nearly a 2 hour difference (Europe). When you have a short window to be able to communicate with your family and friends and you have nothing but issues, it makes it really hard to recommend this app to others.",https://itunes.apple.com/us/review?id=310633997&type=Purple%20Software,2023-04-09T16:09:03-07:00
8566661632,Bonividi,https://itunes.apple.com/us/reviews/id117614400,22.8.75,1,Funky design,"If they fix one, out jumps another bug. It’s like a great Benz with a baaaad engine. Bugs galore and then there is an expectation of belief in privacy and secrecy. If they can’t get basic stuff right, you don’t have to be CISO to understand that the conversations are compromised too. Now ads are on the way too, in India. Now you click on a chat and the chat below opens 🙄. Then they want to increase conversations and people to chat with each other and put ever increasing restrictions on share; not for business people and people who pay, of course. Disingenuous all the way. Is signal harkening and telegrams typing to attract. All I see on WhatsApp is more posts about people wanting to join their Telegram group. WhatsApp are you listening? 😡",https://itunes.apple.com/us/review?id=310633997&type=Purple%20Software,2022-04-14T07:38:49-07:00
8432127618,ZombieDMS,https://itunes.apple.com/us/reviews/id27593234,22.5.71,3,Customer service needs improvement,"Currently my messages don’t send or we’ll they send but are not delivered for several hours. I tried everything they suggested in the help section. Didn’t help. Sent a message using the in app contact us, amazingly that can be delivered right away. What’sapp response? Auto response of Everything in their FAQ section which is what I did before. I even decided to delete the app and reinstall it, still no good. I don’t expect to get an answer or a fix. And stuck with this because everyone I know in other countries use this app and it works for them fine.",https://itunes.apple.com/us/review?id=310633997&type=Purple%20Software,2022-03-07T18:49:39-07:00
7985738155,fghhddss,https://itunes.apple.com/us/reviews/id641531109,2.21.211,4,Backup issue,"Pls fix this problem , the progress stuck in same percentage every time and we need to clear last backup data every day if we chose every day plan of backup 
And another problem is the connection distributed when we using cellular for getting back up and notice up that “waiting for wifi connection “ and after 2-3 minutes it resume getting back up with out any change of connection with previous cellular 
Theses are bugs that should be fix if u wanna be the #1 in social media",https://itunes.apple.com/us/review?id=310633997&type=Purple%20Software,2021-11-03T14:18:19-07:00
6055284799,G.A.L.A.X.Y:),https://itunes.apple.com/us/reviews/id482212768,2.20.61,1,Good but scary,"I like this app and I can talk to my friends but there so many unknown number that’s keep troubling me and making different account to talk that’s I have to keep blocking so I would like if some unknown number comes I would prefer that it send a request and when we block them I wish you ask why we would to block them so that, that person doesn’t keep talking to you and I wish it is more private that way I won’t have a hard time with these strangers and I don’t want any random number to come to your WhatsApp though you don’t have their number in your contract so I would love have it if you would put it on private and only the contract you have you can talk to them no unknown numbers or strangers",https://itunes.apple.com/us/review?id=310633997&type=Purple%20Software,2020-06-09T08:36:50-07:00
3430751401,Debbie.Ruiz.G,https://itunes.apple.com/us/reviews/id537645715,2.18.102,5,"Loved it completely, till last update","Love the app, but this last update made it so that when you go back to your starred messages and click the arrow to the right, it goes right to your current conversation. I want it to be how it was, going back to THAT point in the conversation. Otherwise, what’s the point of starring things, other than keeping those parts as highlights. I like going back to a specific point in my conversations, Incase I need to look over some details that I’ve missed. Please fix this!",https://itunes.apple.com/us/review?id=310633997&type=Purple%20Software,2018-11-17T20:31:28-07:00
3873511267,DiTanya G,https://itunes.apple.com/us/reviews/id789885518,2.19.30,1,Confusión,"I am a SmartLine Customer because I do not want to entertain calls from clients on my personal number. I’ve been a customer for a little under 6 months and I am (was) enjoying until a few annoying issues surfaced. First, the phone rang and I could receive calls; now it barely rings before just going to voicemail. Most times, it doesn’t ring at all; I just notice voicemails. With the Do Not Disturb activated in the app during non-business hours, calls go to voicemail. That’s great!! When Do Not Disturb is off, during business hours callers get my personal voicemail when I don’t answer. This  is NOW fine that I removed the standard greeting which was announcing my cell phone number. So, the only issue now is the phone not ringing at all and going to voicemail. Ughhhh!!!",https://itunes.apple.com/us/review?id=310633997&type=Purple%20Software,2019-03-12T09:13:16-07:00
9305684654,Cynjo1,https://itunes.apple.com/us/reviews/id1023601871,22.23.76,5,Overall Experience,"I have always loved Whattsap and all that it offers . The ability to write and call, without having to pay tons of cash for call time.
I however hope that the quality can be improved in certain parts of the world as they do not enjoy great network and call quality when making international calls.
Other than that , I appreciate WhatsApp because it is a great way to communicate especially with regards to privacy !",https://itunes.apple.com/us/review?id=310633997&type=Purple%20Software,2022-11-19T05:04:59-07:00
