id,userName,userUrl,version,score,title,text,url,updated
5954951146,SarahGTravels,https://itunes.apple.com/us/reviews/id952156914,20.20,5,An Affordable and Safe Travel Option!,"Personally, I love AirBNB. It’s a great way to save money, travel and SAFELY stay in other people’s homes. Thanks to AirBNB’s review system, guests and hosts give each other feedback, which is a great way to have accountability and in turn means that if someone is remotely shady it will be public news. Also, they have the Super Host rating which hosts earn through providing excellent service. From my experience, I never stay with anyone who doesn’t have really great feedback or is already a Super Host. The best way to avoid weird situations (like one review mentioned a spider invasion!) is to always choose a Super Host and read the reviews carefully. 

I know there are a lot of negative reviews recently, but AirBnB is actually a great app that’s just trying to handle the virus situation as best as they can. Don’t give up on affordable travel and opportunities to meet locals just because someone else wrote a crabby, entitled review of them.",https://itunes.apple.com/us/review?id=401626263&type=Purple%20Software,2020-05-16T16:50:28-07:00
5811264088,helps users,https://itunes.apple.com/us/reviews/id1067974381,20.15,1,The Positive Reviews are Paid Actors,"I feel like this app is secretly some garage project. I lack confidence in the app’s capability. They:
Have had many instances of canceling your reservations without asking your permission, which results in a partial refund and requires you to go through the whole process over again; and, if you’re lucky to get the same reservation, it will cost 150% the actual cost.
They asked me to take a photo of the back of my ID. I have never had anyone ask for that side, not even for employment or government documentation. That’s the side with all the bar codes, btw.
I have seen many reviews complaining that representatives from the app do not respond well to inquiries or needs of customers. Requests for complete refunds in emergency circumstances (especially during the COVID-19 outbreak) went ignored. Requests for refunds in cases where the app automatically canceled a reservation without user permission (see above) also went ignored.
I am highly skeptical about the security and privacy of this app. If the program developed by this company runs like it’s employees or it’s financial system, I wouldn’t be surprised if this app were the target of a massive privacy leak.",https://itunes.apple.com/us/review?id=401626263&type=Purple%20Software,2020-04-14T10:51:14-07:00
5692590462,Jalyssa.a,https://itunes.apple.com/us/reviews/id961845607,20.12.1,1,Don’t use this service. USE VRBO,"I think this company is extremely unreliable. The cancellation policy is not even close to being as good as vrbo’s cancellation policy, and I don’t think that the cancellation policy that is in place due to corona virus is fair at all. (Airbnb gives 50% MINUS the service fee, after you cancel 48 hours from booking) they have changed their policy to offer 100% refunds for reservations made before March 14th, and for the bookings that are before mid-April. It is not certain that the pandemic will be continue after mid-April and it will most likely be continuing in the summer. With that being said, those families who will have no choice but to go out of town to their reservations in the summer to avoid losing their money will be put in danger of the virus by this very company. I wish I had booked through Vrbo, who has an extremely flexible cancellation policy and lower prices. (They give a full refund of the booking if you cancel by a closer date before the reservation, and their prices are lower for the SAME quality of places to stay) I will not be recommending this app to anyone traveling and I will never be using this service again for my future travels. 🤠",https://itunes.apple.com/us/review?id=401626263&type=Purple%20Software,2020-03-21T09:32:11-07:00
5545465330,uwishuknew1972,https://itunes.apple.com/us/reviews/id1071891705,20.07.1,1,Not my favorite thing,"I was always hesitant to use this app because of all the extra fees hosts would impose. Booking fees, cleaning fees, etc. More than 1 location has extra fees themselves out of my business. I’m used to staying in hotels where CLEANING is included with the rate and it’s just been simpler and cheaper to book a hotel room. However, when I started doing more international travel and interested in experiencing these countries similar to what the locals experience, I’ve tried booking through the Airbnb app. My main criticism at this point is how quickly they take funds versus how slowly they release refunds. And the issue is not with my bank. Airbnb is holding my money. Nevermind that, by them doing this, might prevent someone from booking another place. Just ridiculous for them to keep funds for so long. I can’t recommend them or this app to anyone. Stick with hotels. I’ve had to cancel hotel reservations before and didn’t lose anything. Funds not even taken until the day of check-in. I booked the Airbnb a month before scheduled check-in and cancelled immediately. Almost 3 weeks later and I’m still waiting for my refunded money. A whole mess.",https://itunes.apple.com/us/review?id=401626263&type=Purple%20Software,2020-02-17T15:57:18-07:00
8213489914,christina2181497,https://itunes.apple.com/us/reviews/id1365961849,21.49,1,Poor customer service,"I had an awful experience with a host who told us we weren’t allowed to stay at their location after we had already flown into the city, leaving us stranded but refusing to cancel our reservation, leaving us with no refund. We called Airbnb customer service multiple times, speaking to multiple representatives who promised to get back in touch with us or who kept us on the line for over an hour with no result. We ended up booking a place two hours before we needed it, still with no reimbursement, rebooking, or refund as Airbnb specialists had promised us. And now two days after the trip has ended we have heard nothing from Airbnb even though we were promised they would reach out to amend this situation, and are now struggling to pay for the initial stay as well as the last minute booking which was obviously more expensive. Shocked by how this company handles their customers as I’ve stayed at multiple airbnbs with no issues, but nothing is being resolved and I’m very discouraged. Hoping Airbnb sees this comment and follows up with the multiple support requests I’ve made.",https://itunes.apple.com/us/review?id=401626263&type=Purple%20Software,2022-01-07T00:53:31-07:00
4825681375,Glenn from Hawaii,https://itunes.apple.com/us/reviews/id691080342,19.38.1,5,Katija Tour to Sintra,"Katija gave our group  tour of Sintra, picking us up in Lisbon. She was genuinely friendly, honest, knowledgeable. Katija was interested in who we were and what we wanted to see.  She demonstrated flexibility in options for our tour based on our feedback.  A number of us were not quick walkers, and Katija made sure that the pace was tailored to our needs.  As a result, the tour took a bit longer than scheduled, which was entirely agreeable to us. She adjusted to our needs. 
Katija was very knowledgeable of Sintra, and esp. the history and features of Quinta da Regaleira (well worth the visit). She patiently answered all the questions we had.  Katija is a lovely person and every one of our group of seven bonded with her and we all felt that having her guide us around Sintra was a very worthwhile experience.  We highly recommend having Katija guide you through a unique tour of this interesting special site. Along the way, you may just make a wonderful new friend.",https://itunes.apple.com/us/review?id=401626263&type=Purple%20Software,2019-09-22T16:53:40-07:00
3246385368,Mark of The Mountain,https://itunes.apple.com/us/reviews/id382785360,18.39,5,AirBnB Rocks,"We love almost everything about AirBnB. The app is so easy to use. They have thought about everything. Time does not permit me to list everything I love about the app and the service. Let me just say easy is the biggest thing. We are currently in a 16 night trip across Europe. Having the itinerary with all nights on one interactive screen is so nice.  However, I wish I had longer after the stay to give my reviews and I wish I could edit them once I have entered the review. I travel only with a phone and the deadline for completing the reviews is before I get back. Editing a review once you have entered it can only be done within 48 hours and it must be done from a desktop computer. So be thoughtful and careful with every detail when entering a review for your host and for your accommodation.  We have had 100 percent positive experiences with all of our stays with Airbnb. This will be our third trip using Airbnb.",https://itunes.apple.com/us/review?id=401626263&type=Purple%20Software,2018-09-29T22:24:30-07:00
1825559806,Spazzfx,https://itunes.apple.com/us/reviews/id20449050,17.39,4,"Great service, not so great app","Air bnb has been extremely helpful for us over the past few months. We have an extra room in our house and we rent it out through Air bnb which has been very successful and making us some much needed extra money in tight times. It was also very helpful while we were traveling overseas. It saved us a large amount of money booking rooms not in an expensive hotel. There are some risks using the service since you never know what kind of person you are booking from and the space where you will be staying isn’t always as nice as it’s presented in the listing. 

As for the app, I’ve encountered multiple problems with guests changing their booking. We were unable to have a guest add a third person to one booking, we had a guest request to stay an extra night but was unable to change the booking through the app. There are some major bugs that need to be fixed for the app to get 5 stars but overall it gets the job done.",https://itunes.apple.com/us/review?id=401626263&type=Purple%20Software,2017-10-03T16:51:54-07:00
8809270436,Sharpie28495,https://itunes.apple.com/us/reviews/id120113483,22.25,1,Counterfeit Money,"While staying at an airbnb my friend noticed something under the carpet. We investigated further and found 4 envelops (under different parts of the carpet) filled with counterfeit cash (we know it was counterfeit because it wasn’t cut all the way- paper was still at the end of the bills). Terrified and confused we called Airbnb to let them know we felt we were in danger and did not feel comfortable staying here. They said there was nothing they could do without talking to the host first. We told them NOT to contact the host because we didn’t know how they were involved, and that would make things even more dangerous. They said they’d call us back. They called back and told us THEY CALLED THE HOST. Panicked, we fled immediately. The host responded to Airbnb saying they were not willing to assist us and did not want to comment. I am horrified, confused, and so frustrated. We had to pay to get a hotel room for our own safety and neither the host nor Airbnb is willing to refund the airbnb stay, fees, or cleaning fee. We weren’t in the unit for more than an hour because our literal lives were in danger. Do better.",https://itunes.apple.com/us/review?id=401626263&type=Purple%20Software,2022-06-25T07:21:18-07:00
4908725231,csayers89,https://itunes.apple.com/us/reviews/id766916768,19.40,1,Left us stranded,"Me and my girlfriend have used this app exclusively while traveling for the last 8 years. Recently we rented a place near manhattan for a week. When we got there and were ready to check in, the host decided to let us know that the bathroom hasn’t been working and they weren’t home to fix it. We called Airbnb and they gave us a refund, and began to help us find another bnb in the area. 4 hrs later we have nowhere to go, a car full of our belongings and the person responsible for “helping us” left for the day without even letting us know she was leaving or providing an additional place to stay. Now 3 days later the host hasn’t been flagged and is still allowed to rent out their space with no bathroom, and the people working for Airbnb are acting all of this time wasted and inconvenience isn’t their problem. Luckily we were only a state away from our home and could figure it out, but we’ve used this company multiple times out of the country, and the thought of this happening in a setting like that and their staff talking down to us like us being inconvenienced is a burden on them is why I will never use them again",https://itunes.apple.com/us/review?id=401626263&type=Purple%20Software,2019-10-08T04:29:10-07:00
10048511867,Seen234,https://itunes.apple.com/us/reviews/id344285046,23.24,1,DONT USE Airbnb NOT SAFE ANYMORE,"I recently experienced a safety concern.I’d recommend staying at a hotel. I was never told a men would be outside my unit from the host. For my safety, I decided to leave ASAP. I tried to called the host number. To try explain why another person was staying there? Since they claim they have cameras . Instead they ignored my issue and kept the refund. RIP OFF! Needless to say Airbnb customer service did not care to take care of my situation to get a refund. I had talked to two agents because first one didn’t want to cooperate. They said I needed to provide a photo. Clearly, being a woman alone. I did not want to be near a man who might do something to me. If anything the host probably erase the evidence to try to seem they were cooperating.

PLEASE STAY AWAY from using this Airbnb. I hope they go out of business for the safety concerns they can’t handle. I had to personally pay out of pocket $290 for the nights I didn’t stay. They only refunded me $30 which is STUPID! So if you’re in Azusa California. Please don’t stay there with host name “David Wai/Tammy” they claimed to be commutative but did nothing regarding my concern.",https://itunes.apple.com/us/review?id=401626263&type=Purple%20Software,2023-06-18T18:38:46-07:00
7152394279,Bh12345€,https://itunes.apple.com/us/reviews/id32281860,21.12,1,SF Smugness at its Worst,"For some reason Brian Chesky CEO of AirBNB feels entitled to push his San Francisco politics on everyone who uses this app.  The app sends you updates of Chesky’s opinion on all the news.  AirBNB is clearly capitalist, extremely corporate, and totally brutal when it comes to protecting its own dollars, but like most things pseudo liberal they feel compelled to make a big show of how much the rich white San Franciscans who own and run this thing hate themselves and like everyone else (as long as it’s cheap or free).  AirBNB’s app sent you nauseating messages about how wonderful BLM was/is even as BLM was burning down Minneapolis and other cities including La Mesa California.  Now they’ve taken to narrating the news.  The latest smarmy we know better than you story AirBNB keeps pushing through its app (literally every time you open it) is that the insane man who killed prostitutes in Atlanta because he blamed them for his sex addiction must have actually done it out of racism.  He must have actually blamed Asians for COVID according to Air BNB.  They then go on to apologize for Asians being a “model minority” and “aligned with white people”.  It’s nauseatingly and actually racist but thinly disguised as pseudo liberal.",https://itunes.apple.com/us/review?id=401626263&type=Purple%20Software,2021-03-27T16:01:54-07:00
6824775731,ARay0228,https://itunes.apple.com/us/reviews/id120938252,20.50.1,1,Not worth the headache,"Honestly, Airbnb is not worth the headache. Seems like a great platform however they do not have the best interests of their travelers at heart, instead it’s the hosts they care about. Seems backwards to me if you want to keep your business up and running. I had to change plans due to covid and a medical condition, which could be documented by a doctor and both the host and Airbnb directly are refusing to work with me. Has just been a complete nightmare since day 1. ( originally booked a different place to stay- and paid in full- then the host messaged me saying they “accidentally listed the property for too low of a price and had to cancel the reservation” What?! Have you ever heard of such a thing? Of course Airbnb support did not help and instead sided with the host. Then we booked a new property and now cannot travel due to being high risk during the pandemic. I have been trying to get in touch with support for months because the host does not want to refund me even a dollar of the money we paid and it’s just a disaster. Use a credit card so you can try and dispute the charges if you get screwed!",https://itunes.apple.com/us/review?id=401626263&type=Purple%20Software,2021-01-02T21:45:36-07:00
4613569428,UkMate,https://itunes.apple.com/us/reviews/id742464648,19.32.2,1,Money and hosts are more important than you!,"They care more about your money and pleasing the host than you, literally the worst costumer service, worst policy. If you don’t know anything about the place your going to in a vacation, I suggest you not to use this app. They will not solve any issue with the hosts, as long they take your money and give to the host. Costumers are not worth the time, even the team doesn’t care about your issues. I took vacation to Miami and I booked a house, however the location of the house was in the worst neighborhood in Miami, me and my family didn’t feel comfortable, the house was never opened and I immediately cancelled the reservation and asked for refund. They refused my request even the host him self ignored it. I made contact with the team and they cared less for my issue instead they helped the host to take the money. I never got refund and I will never use this app again. If you go on a vacation and don’t know anything about the areas don’t use this app they won’t help you, you can’t see the locations of the property until you book them and when you do you can cancel but you won’t be refunded.",https://itunes.apple.com/us/review?id=401626263&type=Purple%20Software,2019-08-13T21:11:07-07:00
3762367331,Tvykm,https://itunes.apple.com/us/reviews/id480644670,19.06,1,Horrific experience,"I’ve never used this app till yesterday when I booked a house, the guys add was misleading and the air bnb rep agreed, it stated “entire house” was available, so I booked, then the host proceeded to try and charge me more money.. I wanted to cancel and he would not give me a full refund for SAME DAY cancelation because of his stupid strict policy that only gives me 50% back of what I paid.. I asked him nicely and he started insulting me and being rude and unprofessional! I reached out to air bnb customer service and they agreed it was absurd but they told me I needed to deal with the host myself.. I ask him to return all my money and he declined, I spoke to another rep and she said she would call the host to find an agreement and said she would call back in 10-15 mins and never called me back.  For my first time using this app it’s been nothing but a headache and has given me so much stress.. so now I’m out $180 that they won’t refund for a misleading listing and a host that is disrespectful keeps my money. I will never use this app again and I suggest if you ever stay in slc Utah to never book with a host named Daniel, because he’s a dirty human being with no compassion, just money hungry!",https://itunes.apple.com/us/review?id=401626263&type=Purple%20Software,2019-02-12T10:01:00-07:00
2939158850,Footloose adventure,https://itunes.apple.com/us/reviews/id5870940,18.29,5,Unexpected surprise,"I’ve been traveling from San Francisco, through Canada, to the east coast with my wife and our large dog for two months now and are heading to Europe for 3 months.   We are pretty much exclusively staying in Airbnb’s.   Before we departed for this road trip we stayed in a few Airbnb’s and were surprised to discover something we did not expect.  
     Before our first Airbnb experience we thought it may be a bit awkward to stay in someone’s home and to have them so close in some cases.   We quickly discovered that having a host is very much a positive morning, and that the type of person that would like to be a host is a naturally friendly, personable, helpful person.   Every host we have experienced has been great, making us feel warm and welcome.  We developed a quick friendship with few them and continue to stay in touch and plan to return to visit it them as much as to enjoy their home.",https://itunes.apple.com/us/review?id=401626263&type=Purple%20Software,2018-07-20T04:09:06-07:00
5715718738,devon a bennett,https://itunes.apple.com/us/reviews/id708146203,20.13,1,Greed over the health of the consumers,"Some friends and I where going to attend South By South West in Austin Texas and we decided the best way to book was through Airbnb. Worst decision ever made! We planned to attend March 19-22nd, but it was canceled do to the Coronavirus. So we had to cancel our trip, but I have been trying to fight them on their refund policy since the day I canceled of March 10th! The policy they had stated said you may receive a full refund, but when I finally got in contact with one of the agents I was told they could do nothing, because I canceled before they put out another policy stating if you canceled before March 14th you are no longer covered. If I am not mistaken they have to honor the policy they had up currently which was a full refund as long as you booked before March 14. 
Overall this had to be the worst experience with any company I have ever had. Don’t bother messaging them for a response took an entire week, so I called an even then it was an 1-3hour wait for a response. They disregarded the current policy that they have up and make up new policy’s on the spot. Anything so they can keep your money. I will never be use this greedy company again.",https://itunes.apple.com/us/review?id=401626263&type=Purple%20Software,2020-03-26T04:17:30-07:00
10525283497,BeazerCat1,https://itunes.apple.com/us/reviews/id1323735280,23.43.1,1,Denied booking,"I book with Airbnb all the time. Until today I’ve never had an issue. However, this morning I went to book a place found one that was in my price range in the area I wanted and tried to book it, and I was denied booking even though I have a five star rating and I’ve never had an issue. I was denied looking because the apps algorithm apparently tells them that I’m going to have a party. I am beyond offended and more than a little upset. I worked very hard to keep my rating five stars and not have a problem. I’ve never had a problem and all of a sudden because of some algorithm I’m denied a booking and a regular customer service agent cannot fix the issue. It has to be escalated to their specialist who don’t get back to you right away so I’m going to miss out on booking this place because their customer service representative can’t do anything to fix it. I’m so disappointed in Airbnb today. I’m about to call them for the third time today. I cannot believe that they denied my attempt to book a place when I spend so much money booking through them every month.",https://itunes.apple.com/us/review?id=401626263&type=Purple%20Software,2023-10-28T10:56:49-07:00
8829727056,GoodLuckNatalie,https://itunes.apple.com/us/reviews/id49486965,22.26,1,AirBnB took my money and didn’t house me,"I had a reservation for a really cool place with a really nice host, and on the day I was supposed to stay there, the AC broke and the host contacted me to let me know as early as she did and she was really nice. She couldn’t get a technician out that day - which
Is normal for Texas. So I contacted Airbnb and not only can they not get me into another Airbnb using the funds they already have in their greedy hands, but they are keeping my money for 10-15 days, marking the host down with a “violation” and offered me a 20% coupon if I wanted to stay somewhere else. I guess other people must have money that grows on trees but I can’t pay for a reservation when I don’t have the money back from the one I already paid for. They said they can’t use the money they already have to pay for a different reservation. So instead of staying somewhere really cool this weekend, I have to cancel my plans and be broke for the weekend. I am so surprised Airbnb has policies like this. Also I think they are being pretty mean to the host marking her with a “violation” for something that is basically an act of god.",https://itunes.apple.com/us/review?id=401626263&type=Purple%20Software,2022-07-01T07:48:48-07:00
