id,userName,userUrl,version,score,title,text,url,updated
10775515415,GSUNation1,https://itunes.apple.com/us/reviews/id484051504,9.1.346,4,Reporting Profile Page Bug,"Hey Developer Team,

I just have a few possible bugs to report about this version of the app. I love the LinkedIn app. Great features. Quality user experience and interface. The app mirrors the desktop app very well.

Here are my concerns to report

• The LinkedIn app freezes when I go to my profile page regardless of how I try. I’ve swiped right on the screen and I’ve pressed my profile image in the top left corner to get to my profile. The app then freezes on the LinkedIn feed page.

• I’ve been invited to provide responses as an expert on a few LinkedIn led marketing articles or conversations. The articles mention receiving a “Top Voice in {Insert Industry}” badge when more than a few of these expert sourced articles are responded on. I haven’t received a badge for either of the industry categories I’ve been responding on.",https://itunes.apple.com/us/review?id=288429040&type=Purple%20Software,2024-01-02T09:40:11-07:00
1925754854,FeliceNavidad',https://itunes.apple.com/us/reviews/id358419035,9.1.56,5,"Tesla, The Un-Contested Leaderof Electric Vehicles","Having been a legal driver for over 30 years and having personally owned magnificent automobiles, I had the absolute test drive of perhaps anyone ever experienced.
After having been hospitalized from a car accident and having not had the opportunity to drive, I was taken to a Tesla dealership and once I started up the S model, the car spoke to me, ""Relax Reggie, because I am going to drive you"".
Needless to say, that's exactly the experience I had and as a result I'll be purchasing the Model X in 2018.",https://itunes.apple.com/us/review?id=288429040&type=Purple%20Software,2017-11-16T11:10:16-07:00
1806123551,shmarda,https://itunes.apple.com/us/reviews/id200486376,9.1.46,3,"Good Enough, but some poor implementations","Sending an invite to someone in your network doesn’t seem like it works: if I leave and re-open the app, I’m again presented with the same option of adding the same exact contact as before.

The “Your invitation to ____ is on it’s way” is incredibly slow and intrusive. It also covers the top of the screen which means you can’t close a profile, close a photo, use the search, etc. You have to wait for the notification to go away. Very poorly designed.

Remember how Gamecenter says “Welcome Back _____” on the games you play? Same experience.",https://itunes.apple.com/us/review?id=288429040&type=Purple%20Software,2017-09-23T14:13:50-07:00
7943247280,CaptEddy,https://itunes.apple.com/us/reviews/id932307696,9.1.239,4,IOS 13 + requirements for LinkedIn,"As a user spanning more than a decade, am a little disappointed that Linked In only supports IOS 13 and later for the App.

There are many users around the world that do not purchase the latest iPhone rendering their experience quite frustrating when having to use Linked In web site instead of the App.

Although I do have IOS 15.2 on one of my phones, I also use Linked In on two other older phones for different accounts.",https://itunes.apple.com/us/review?id=288429040&type=Purple%20Software,2021-10-22T16:55:11-07:00
10562968323,Andreiuta,https://itunes.apple.com/us/reviews/id31097832,9.1.342,1,Suspicious activity? Really?…,"I opened an account and started filling my profile. A couple of days later, I get a notification that there was suspicious activity on my account and now I have to submit my drivers license… I am literally just creating my profile and using the platform exactly as it was intended! If you want your users’ personal info say so and provide a justification why you need it, don’t lie about suspicious activity. 

Also, I said that I am not interested in finding a new job but I already drawn  in ads (?) for jobs. Which part of I am not interested wasn’t clear? I wouldn’t even mind if it was one or two, but you’re pushing so many ads that’s getting taxing.",https://itunes.apple.com/us/review?id=288429040&type=Purple%20Software,2023-11-08T04:05:39-07:00
9088120643,Prkr485,https://itunes.apple.com/us/reviews/id19876970,9.1.285,1,Behind the curve and broken support interface,"I have a premium account and have recently started to try to utilize the service more. Like most people these days, I use mobile devices such as my phone and tablet much more than I do an actual computer. I have very sensitive eyes. I’ve looked everywhere for a dark mode, which apparently does not exist on the iOS app. I attempted to utilize the Help section in the app, but could not get the live chat to connect. I continuously encountered an error saying a connection to the server could not be made. For a company that brought in $6.8 billion in revenue last year, is it too much to ask for an update to allow a dark mode option?",https://itunes.apple.com/us/review?id=288429040&type=Purple%20Software,2022-09-15T12:02:09-07:00
6589501326,BetaStat,https://itunes.apple.com/us/reviews/id414000551,9.1.197,4,Notifications Issue,"Will get a push notification on the app symbol, but upon opening the app itself, no notifications are apparent.  You have to go hunting through the app menus and play hide n seek.   Was it a message?  A notification?  Check my profile??  Who knows.  It takes 3 or 4 random menu selections to make the push notification go away on the phone.   App also has some other buggy issues, like getting stuck on a page or menu within the app.  

Overall great work.  Notification paths need some tending to.",https://itunes.apple.com/us/review?id=288429040&type=Purple%20Software,2020-10-30T03:15:12-07:00
3620023800,Divadmonroe,https://itunes.apple.com/us/reviews/id31706058,9.1.112,3,1/6/19 Update,"This recent update is SUPER glitchy. Trying to apply for positions through the app and the app freezes and force closes during application. That is really an inconvenience when you’ve scrolled through hundreds of jobs and the job poster has been alerted of your interest. When you can’t find the job posting anymore because it wasn’t saved to your saved jobs, is a bad look when the job poster looks to see if you applied... I thought that by having premium, navigating the app would be better but it’s just gotten worse. A new update needs to be rolled out.",https://itunes.apple.com/us/review?id=288429040&type=Purple%20Software,2019-01-06T10:41:51-07:00
2577827199,Janet 0246,https://itunes.apple.com/us/reviews/id505909116,9.1.79,3,Dreadfully buggy,"On a slow satellite connection, uploads of posts don’t always go through. Sometimes I have to click send multiple times before it finally “catches”. This is a general linkedin bug - not just the app.

The app crashes at unfortunate moments. It has crashed several times as I’ve been writing posts (and it has lost them). It has crashed as I’ve been filling in applications for positions. It did that on me today. Now I have no idea which vacancy I was applying to.

The chat room (news discussion, postings discussions) are way too much of a zoo. In fact, so much of a zoo, I wonder whether people on are really professionals or children. 

Looking at the lists of names I see many fake names, names of cartoon characters etc being used. Since that’s acceptable, I’d rather like a feature that allows me to change my name when I get bored with it. Maybe one day I might be Ermintrude another day, Dylan or Brian or perhaps Zebedee. Maybe even Florence.",https://itunes.apple.com/us/review?id=288429040&type=Purple%20Software,2018-05-21T09:36:25-07:00
9312092106,Liz S 88,https://itunes.apple.com/us/reviews/id20208810,9.1.292,1,horrible algorithm and awful people,"i don’t understand what it takes to get my feed to just show me posts by my network. i missed a friends post from 2 weeks ago, but just saw it when he liked another accounts repost of his post. i don’t get what i have to do to just see posts from my connections. stop it with the reactions.

this app is also full of constant junk messages from temp job recruiters in india, my profile doesn’t even say i’m open to work. there’s also a disturbing amount of tracking that this app does, and it takes 20+ clicks to turn it all off within 5 different menus. and linkedin had a data breech and they didn’t contact anyone and when i asked a support agent about it they stopped answering me. i open this awful app now and i’m attacked by 500 awful pro life posts talking about how companies are “killing babies” to keep the workforce “more productive”. like what? i even check marked your dumb “don’t give me political content” box and i’m still seeing these absolute lunatics on my feed.",https://itunes.apple.com/us/review?id=288429040&type=Purple%20Software,2022-11-20T20:41:48-07:00
8619015324,RobG_TN,https://itunes.apple.com/us/reviews/id899397167,9.1.266,3,"If Premium, Don’t Buy It","LinkedIn via iTunes has less capabilities than buying online. It is fine to download the free app, but if you plan to upgrade, ONLY buy that or upgrade to Premium on LinkedIn’s website via your account settings. 

You can’t buy additional services in Premium if you bought via Apple. The app is limited. They will make you cancel and re-subscribe via LinkedIn and the two companies do not talk.

So, it becomes a customer service nightmare to make things right. Save time and a huge headache by NOT upgrading to Premium via the App.",https://itunes.apple.com/us/review?id=288429040&type=Purple%20Software,2022-04-29T09:55:54-07:00
6964248595,EvNChris,https://itunes.apple.com/us/reviews/id102451335,9.1.206,1,LinkedIn has mediocre support,I recently opened a support case with LinkedIn as I found a defect within the App. If you try to remove a connection and then re-launch the App the connection re-appears. No errors are given. However this isn’t an issue via a regular internet browser. Support keeps asking me for the connection to repro however I already deleted this person via the UI. What does support do? Close my case yet I found a legitimate bug. The level of customer satisfaction I was given was extremely lacking. I really hope I can fill out a survey to provide feedback from a consumer perspective. My message to LinkedIn go above and beyond for your customers. Try just a little bit. Have accountability!,https://itunes.apple.com/us/review?id=288429040&type=Purple%20Software,2021-02-06T23:27:10-07:00
6503848477,Invernesshouse,https://itunes.apple.com/us/reviews/id86393076,9.1.194,4,Posts on home page,"I’ve been using LinkedIn for a long time. It’s a great app for networking, reference materials, job postings, etc.  I would offer one suggestion. I have added myself to several groups and unless you specifically go into those groups, you never see any postings on your home page. Can you update the app so any postings submitted for the groups I am a member show in my main feed?  I have seen this feedback in numerous comments on the site.  It would be really helpful and then posts get read timely.  Thank you.",https://itunes.apple.com/us/review?id=288429040&type=Purple%20Software,2020-10-05T10:26:34-07:00
2158199210,noellossie,https://itunes.apple.com/us/reviews/id17434865,9.1.64,4,"Nice app, should connect to email","This app is designed well and does what it’s supposed to do...biggest drawback is that when I get an email notification in my inbox, whether it’s a message or just letting me know how many people have viewed my profile, it doesn’t connect to the app if I click on the email message, it takes me to Safari browser and tries to have me log in from Safari. It should auto open the app, where I am already signed in. Seems like a small thing but is eternally frustrating.",https://itunes.apple.com/us/review?id=288429040&type=Purple%20Software,2018-02-02T06:28:05-07:00
1914614247,Cristal0622,https://itunes.apple.com/us/reviews/id206084665,9.1.55,5,Convenient+++,"Well designed similar to other social apps like Facebook so effort is with ease to conduct modifications on the profile, browse thru the stream, post updates, and - most importantly for me - communicate with contacts including business prospects. The ability to make some changes is inactive on the app and therefore a computer is required but once it’s set up you’re pretty much good to go mobile. I wish there was an option to opt out of read receipts for messages.",https://itunes.apple.com/us/review?id=288429040&type=Purple%20Software,2017-11-11T18:55:31-07:00
8762533867,les payly 57,https://itunes.apple.com/us/reviews/id1244110977,9.1.272,3,Access,"You have to be on wifi to receive information related to anything where your information is available to be stolen, hijacked or allow fraudulent use of data( your name, birthdate, job status, employment experience and so on otherwise you are just creating a well organized individual an opportunity to STEAL
Your information ( no matter how trivial you think it is)! Even with being on WiFi you still risk being compromised ), unless you have an encrypted network connection that scrambles your information!",https://itunes.apple.com/us/review?id=288429040&type=Purple%20Software,2022-06-11T00:43:48-07:00
8352624302,Barbatus Unum,https://itunes.apple.com/us/reviews/id521329065,9.1.255,1,Bring Back Pinch-to-Zoom!,"I fully regret updating this app. On my iPad Pro, posts are tiny with tons of white space on both sides in landscape mode — which is how I use my iPad Pro 95% of the time.  This is all wasted space that could be used for zooming in to make text and posts larger and more readable. A prior version of this app allowed zooming in on the content for readability.  Really dislike the direction this app has been taking. Makes me conclude that Microsoft (LI’s owner) doesn’t care about accessibility one bit.  Devs, please reincorporate pinch-to-zoom ASAP, as not everyone has perfect eyesight — we need to be able to make the posts larger for readability.  Until then, this app’s usability is unacceptable.",https://itunes.apple.com/us/review?id=288429040&type=Purple%20Software,2022-02-13T13:51:59-07:00
7888189515,akalois_lane,https://itunes.apple.com/us/reviews/id43326953,9.1.237,3,Recent Issues Lately,Lately I’ve been noticing alot of glitches on your guys updated app. When it comes to messaging it will no longer give me the options to edit stuff and is on some limited time. Sometimes I’ll be in the middle of messaging someone and the screen or app will just disappear. You guys seriously need to fix this as it is very annoying and inconvenient esp when using on mobile. Because I have lack of faith on the app sometimes I have to just use my laptop to make sure messages r going through properly.,https://itunes.apple.com/us/review?id=288429040&type=Purple%20Software,2021-10-07T07:19:17-07:00
7473360535,Techchick23,https://itunes.apple.com/us/reviews/id875536562,9.1.225,5,Very Useful!  Wish it had this one feature…,"I use the LinkedIn app almost daily and find is simple and practical for me to stay in contact with people in my industry.  The only ask I have is the ability to reorder or highlight recommendations on your profile.  I have a few that were written earlier in my career that I would like to put on the top of the list, similar to how we are able to reorder current positions/roles.",https://itunes.apple.com/us/review?id=288429040&type=Purple%20Software,2021-06-16T20:54:21-07:00
6010534243,Ukeduke98,https://itunes.apple.com/us/reviews/id527138384,9.1.179,3,Major keyboard issues on iPhone.,"I love LinkedIn, but for some reason, swiping to type on iPhone is absolutely atrocious in LinkedIn. This is certainly a LinkedIn problem because it works everywhere else. When I swipe to type in the app, it skips words that I’m typing, ignores spacing, and capitalizes randomly. This isn’t only sometimes. It doesn’t work 100% of the time. Love the platform, love the app, please fix this issue. This isn’t a recent issue, it has been an issue for a long time, and it isn’t only on the default Apple keyboard. I’ve also had major issues using Gboard.",https://itunes.apple.com/us/review?id=288429040&type=Purple%20Software,2020-05-29T12:52:36-07:00
4989404972,Ericka_I,https://itunes.apple.com/us/reviews/id328290161,9.1.151,1,New Member would love to use for internship,"Nothing loads at all on this app. A month ago I used this app just fine. Then two weeks ago and now, all it says no matter what I click says “Sorry, weren’t able to load your feed. Let’s try again...”
Update: Now when I tried to sign in after awhile of not being on from the earlier glitch, it says my account has been temporarily restricted after I was resetting my password thinking maybe I typed in the wrong password.
So far I have had a bad experience with LinkedIn. I don’t know if anyone from customer support or app developers will help or not, but I wouldn’t be surprised if they don’t fix this like everything else that has happened.",https://itunes.apple.com/us/review?id=288429040&type=Purple%20Software,2019-10-20T16:56:30-07:00
4926492326,Sintactic,https://itunes.apple.com/us/reviews/id102021273,9.1.150,1,Shady,"“Welcome back!” Would you like to sell out your friends by giving up their contact information? We’ll make it really difficult to use our app unless you do!

Got a new phone and had to navigate through about six screens of asking for contact info from me with the obnoxious “skip for now” before I could respond to the content-free email they sent me to tell me someone I know sent me a message.

Hey, did you guys realize that email can be used to send messages? Yes, but they wanted to drive visits to their site to inflate their metrics. LinkedIn is a great example of the new age of companies that don’t give a hoot about you, the user, and only care about their metrics and whoever is paying for access to your data.",https://itunes.apple.com/us/review?id=288429040&type=Purple%20Software,2019-10-11T19:53:48-07:00
3103226208,HankRearden67,https://itunes.apple.com/us/reviews/id85332006,9.1.95,1,Another half-baked app,"Do you ever wonder if anyone attempted to use an app for its intended purpose before they released it?  I hope they didn’t pay to develop this. First, you can’t use it in landscape. However, the most irritating thing is that when you search for a job it gives you a list of related results, but you can only pick one. To add another you must retype your entire search term—every time!  This is infuriating because it doesn’t even save your previous term. Adding insult to injury, you CAN tick off terms from their initial list of suggestions based on your work history, but not for your own searches. Just use the desktop version, or better yet, a different job search app.",https://itunes.apple.com/us/review?id=288429040&type=Purple%20Software,2018-08-23T03:50:39-07:00
7602792601,jorgemaeson,https://itunes.apple.com/us/reviews/id356645774,9.1.228,4,Need more features that reduce useless posts,"I am excited to announce.....

ABSOLUTELY NOTHING

I don’t care that you got into faang or that you got promoted. I am on LinkedIn to look for opportunities and to stay informed on business news, not see that a 2nd level or even 3rd level connection is changing careers. Please if there are LinkedIn developers reading this, please add more posts that help to filter out the garbage that is new personal career announcements especially if they are not even my direct connections!",https://itunes.apple.com/us/review?id=288429040&type=Purple%20Software,2021-07-21T13:35:33-07:00
1982467080,PatCinKC,https://itunes.apple.com/us/reviews/id211258362,9.1.57,5,Bug Report: Current Audio Interrupted when App opens,"UPDATING to 5 stars because I received a workaround directly from LinkedIn. Great Job!

Issue:  If listening to something on my iPhone and open LinkedIn App my audio stops when scrolling LinkedIn and a video appears.

Expected: As a user I would expect to initiate audio inside the linked in app as opposed to the app automatically hijacking my audio feed.  Facebook and Twitter and IG do not interrupt my current audio unless I tap unmute or go into theater mode.",https://itunes.apple.com/us/review?id=288429040&type=Purple%20Software,2017-12-09T03:52:13-07:00
10577739580,lovekebabworld,https://itunes.apple.com/us/reviews/id658327333,9.1.342,1,Lost it’s real purpose!,"LinkedIn feels cluttered with ads, news bits, politically motivated posts, and users being spammed relentlessly by useless “trainers” and “resume writers.” Job searches are difficult because promoted jobs are usually irrelevant for the search and sorting by “entry level” is pointless because highly experienced results are coming up by the hundreds! Filter’s don’t work because of bad data feeds from external job applicants systems. User cannot message themselves which is a helpful feature when trying to send or house job related files. When searching for a job, it’s much easier and quicker to use other straight forward job boards.",https://itunes.apple.com/us/review?id=288429040&type=Purple%20Software,2023-11-12T05:02:17-07:00
10436592741,CJ-Cyber,https://itunes.apple.com/us/reviews/id1317279275,9.1.336,3,Education History,"The LinkedIn app/site does not properly order people’s education history. As a result, you will often see their highest degrees at the bottom, instead of them being on top,  because the way the system aligns them. For example, their Master’s or Ph.D will be at the bottom and while their bachelor is on top. I think the user should be given total control to move their qualifications up or down as they see appropriate. The system should not be deciding that because it does not always align them correctly.",https://itunes.apple.com/us/review?id=288429040&type=Purple%20Software,2023-10-03T23:27:51-07:00
9743799572,Mike.BBb,https://itunes.apple.com/us/reviews/id1438172814,9.1.306,1,LinkedIn 1984,"LinkedIn’s new privacy policy where they don’t allow to create accounts under nickname is ridiculous.  I don’t use my legal name for safety and privacy reason, and I usually go by my nickname. However, LinkedIn’s new policy mandates you to use your legal name and they demand to send you government issued ID or they suspend your account. So I lost my account which I used for 10 years because my legal name doesn’t  match my legal name. When I tried to create a new account, again  they suspended my account and demanded to verify my account. To sum it up, LinkedIn lost it and I’ll happily move to it’s new alternative which respect privacy and doesn’t collect information it doesn’t need.",https://itunes.apple.com/us/review?id=288429040&type=Purple%20Software,2023-03-23T09:09:17-07:00
5553085187,Foodhurtsme,https://itunes.apple.com/us/reviews/id470601786,9.1.167,1,LinkedIn app does not work with LTE network,"The link in the app does not work with the LTE network of most phones. It requires an actual ethernet network connection in order for it to function. This agree just error has been present in this app for months on end. I figured the programmers have just not gotten around to fixing it. But it seems more likely that they don’t even know it exists. Of course nowadays most everyone has access to WiFi connections, but there are times where there are power outages and it would be just peachy if this app actually functioned without WiFi and only LTE available. How is it possible the MS engineers not find this error during their rigorous testing?",https://itunes.apple.com/us/review?id=288429040&type=Purple%20Software,2020-02-19T09:13:56-07:00
4888425431,privyetman,https://itunes.apple.com/us/reviews/id34735516,9.1.149,2,Navigation issues and inconsistencies...,"An app should not show big inconsistencies between users. My girlfriend also uses linkedin, and certain navigations such as the “dashboard” differ significantly from mine. For one, I can’t even access “career interests” from my dashboard like she can. Also, the help center is completely oblivious. I looked up how to update career interests and it only said to: go to your profile dashboard to do this. I CAN’T DO THIS IF IT’S NOT THERE!? I can reach the career interests page through a link on the help center, but this makes it very inefficient. This part of linkedin has been fairly frustrating, though everything else functions well.",https://itunes.apple.com/us/review?id=288429040&type=Purple%20Software,2019-10-04T20:49:43-07:00
8764145885,Reviewer839274728273628374,https://itunes.apple.com/us/reviews/id484830389,9.1.272,1,Not helpful and predatory subscription practices,"I wish I could say this app has helped in my job search, but all the connections I attempt to make never get me anywhere. Their subscription plans are predatory. They lure you into a free month and I take it thinking it will help my job search. It doesn’t. Then they charge you out of the blue with no warning for the subscription at the end of the month. The least they could do is send me an email warning. I had cancelled my subscription, but somehow was still charged.

When I tried to reach out to support, I was dropped 3 separate times from the chat option both on my phone and my laptop.",https://itunes.apple.com/us/review?id=288429040&type=Purple%20Software,2022-06-11T11:03:22-07:00
