id,userName,userUrl,version,score,title,text,url,updated
7775008908,Amgamerog,https://itunes.apple.com/us/reviews/id448253381,21.35,1,Horrible experience involving break ins and police,"Airbnb does not vet its hosts at all. After hours of the host being unresponsive, another resident of the unit let me in the apartment, then BROKE INTO the room through the window AC to let me in (this guest does work for Zulu). The room was double booked. When the other guest arrived he was belligerent and said he’d call the cops on the host (and presumably also me). All the host ever said was “can I call you back later?” via text message. I had to extricate myself from the situation and get a very expensive hotel room at the last minute. The phone support agent did not help me with this but simply gave me a coupon, which was borderline offensive; the refund itself might take 3 weeks to arrive. This host also has a long history of plain awful and unsafe behavior and you still allow them on your platform. I’ve used Airbnb for many years, and this year alone I’ve spent $12,000 on the platform. But I’ve had enough. I WILL stop using Airbnb because of this incident (other than during my confirmed, upcoming reservations which I can no longer cancel, unfortunately).",https://itunes.apple.com/us/review?id=401626263&type=Purple%20Software,2021-09-05T12:22:50-07:00
9684553301,Sketchy service-sketchy host,https://itunes.apple.com/us/reviews/id1226753917,23.09,1,Scammed,"Help! This app has really taken a downward turn. I booked an air bnb only to find there was no heat and I was forced to sleep in a 55 degree damp apartment. I left the next day. After 36 hours on hold and dealing with tech support and the host I was only able to get a $700 refund on a $1200 stay.

The host was willing to give me a $980 refund it was the air bnb customer service staff that was relentlessly rude. I was passed around to 8 different reps, dropped calls, and attempts to continue the issue. Endless phone calls of “we’ll now it’s two days so we’ll have to charge you for two days” even when my host only agreed to one. On the third day at midnight I tearfully called and was completely disrespected. They attempted to get me to continue this issue for another night and charge me even though the host had agreed to a one day cancellation.

I will be booking through local agencies and hotels from here on out. 10 years ago this wouldn’t have been a problem. Air bnb is in its flop era/cash grab era. We live in a dystopia where you can book an apartment with no heat and still be charged over $500 for one night.",https://itunes.apple.com/us/review?id=401626263&type=Purple%20Software,2023-03-06T00:19:00-07:00
8861030975,savvy_soccergirl,https://itunes.apple.com/us/reviews/id690303766,22.26,2,"Pricey, Hidden Addresses, and Terrible Stays","AirBNB, this is the last time we are getting a property. We have had countless bad experiences through AirBNB and the idea of hosts being allowed to hide the address causes experiences such as these. Hosts don’t have to expose the exact address but at least the street the property is on. We are tired of having these experiences. My kid shouldn’t have to hear gunshots from her bedroom because hosts are trying to hide where their property is located. The hosts are protected but families don’t actually know where they are staying. Someone confirming and then the address being shown doesn’t protect the guest, this information needs to be know so families can make an informed decision. 

Also why am I paying cleaning fees when 90% of the AirBNBs I have stayed at have been dirty. Vents covered in dust, floors are sticky or dirty, cobwebs and bugs, nasty showers, and nasty microwaves. I am then told to run towels, make beds, and run the dishwashers; per hosts instructions. So please explain why am I paying cleaning fees then, I’m literally cleaning everything by myself.",https://itunes.apple.com/us/review?id=401626263&type=Purple%20Software,2022-07-10T14:40:54-07:00
6199512419,KylieBoyCA,https://itunes.apple.com/us/reviews/id33502687,20.28,1,Boycott AirBnB ...for expecting donations to “landlords”,"In response to AirBnB adding a “donation button” for “landlords...I am DELETING this app and will boycott this company.  This is a company that is at least PARTLY responsible for driving up housing costs and reducing inventory of affordable housing in many parts of the world, while financially benefiting many who rent out second, third or multiple “investment” properties...and now users are supposed to feel guilt-tripped into “donating” even MORE money to these profiting capitalist opportunists....excuse me, I mean...”landlords”. Sorry, but someone renting out any property SHORT-TERM with no lease agreement at over inflated prices is NOT a “landlord”.... they’re a for-profit-corporation. Could this socially irresponsible company BE any MORE out of touch at a time like this? Do yourself (and society) a favor... delete this app, use hotels where you not only earn loyalty program rewards toward free stays, but can be assured of an expected standard of cleanliness, have full service hospitality (should you want it) and be financially stimulating an economy that employees multiple people while not reducing affordable rental housing in that particular housing market. #BoycottAirBnB #CorporateGreed #ToneDeaf",https://itunes.apple.com/us/review?id=401626263&type=Purple%20Software,2020-07-14T22:41:48-07:00
4846381203,kpretto,https://itunes.apple.com/us/reviews/id33780238,19.39,1,Wish I could give 0 stars,"This company is an actual joke. They allowed a booking company to cancel our reservation with less than 24 hours in advance. They failed to provide any type of customer service through 6 phone calls, over 12 hours, and countless attempts to resolve this through messaging. I will continue to tell my friends and family what kind of poor service we have been provided and will cancel every account I have with this disgraceful company. We drove 10 hours, had 4 people flying in from all across the country and have not been helped whatsoever. We have been given fake coupon codes, hung up on, assigned 4 different “case managers”, and told that we will not be reimbursed any money but rather charged more for last minute booking on a new place. While I understand things happen, the fact that such a large and well known company doesn’t have the ability nor the want to help their guests when THEY put us out last second is baffling and unacceptable. I will never be using Airbnb again, and I highly recommend anyone else considering them to think twice before they do, too.",https://itunes.apple.com/us/review?id=401626263&type=Purple%20Software,2019-09-27T06:14:25-07:00
3864418976,jmyers1867,https://itunes.apple.com/us/reviews/id789908103,19.09,5,Horrible company,"I have used Airbnb three times.  The first was great without any issues. The Econ’s booking, I arrived to find the beds covered in bed bugs.  I had to leave at midnight and could not find a place to stay for less than $200 because of demand that night. Airbnb refunded the money from the bed bug infested house that they certified after 6 weeks. They never offered to cover any other expenses.  I decided to try them one more time.  After the third time, I rented a house that offered WiFi and TV. These are basic amenities for any house. The WiFi never worked and the TVs were Internet TVs so none of the televisions worked.  I had brought this to the attention of the host 12 hours before.  She would not do anything about so I complained to Airbnb.  Their solution was for me to leave the last night around 10 PM. Again they did nothing to resolve any issue except sent pictures",https://itunes.apple.com/us/review?id=401626263&type=Purple%20Software,2019-03-09T23:34:31-07:00
9045589637,melita1311,https://itunes.apple.com/us/reviews/id643043146,22.35,1,The WORST experience … STAY AWAY from this app,"We booked a place in NYC a month or so in advance and did not have any communication other than accepting the request. We planned our whole trip around this stay in the upper east side of Manhattan. We received an automated check in instructions the morning of check in. We showed up at the Airbnb and entered as instructed only to be greeted but a strong cat smell, extremely dirty place and disorganized apartment. We walked around not knowing which room would be ours only to be greeted by someone who lived there. That individual informed us that the host was out of town and there were no available rooms for us. We left the apartment and contacted Airbnb support and they were not able to help us with a comparable stay, so we had to go book a hotel on our own. We were very disappointed with the over all experience and were very upset about the inconvenience. I wouldn’t recommend this place, this host nor AIRBNB. So disappointed about AIRBNB they did NOTHING to resolve this issue.  We ended up over paying for a hotel since we booked a last minute hotel.",https://itunes.apple.com/us/review?id=401626263&type=Purple%20Software,2022-09-02T12:46:11-07:00
8560663266,Bigt725,https://itunes.apple.com/us/reviews/id407761310,22.14,1,Bunch of scam artists,So I’m completely verified with their system did everything else supposed to do on my part I try to rent a one bedroom two person maximum apartment and got denied nobody custom split tongue weight try to get the next day same thing I was told it’s my it’s my payment method so I add my PayPal and I buy $400 worth of gift cards I try again same thing I’m told I’m not verified with PayPal I call PayPal Cortana been verified since 2005 so then I try a different place and get told that I can’t rent it for suspicious activity or something like that great idea it was a three bedroom and I was gonna be there by myself OK but now that’s the best escape now to not let me rent a room or anything he’s stuck with this for hotels with gift cards nothing all day can’t go back Wednesday they made a decision it’s funny nobody can figure out why but now they made a decision in the squad and “Supervisors that I couldn’t talk to you on the phone and I talk to you through email because I was a bunch of college kids that work at home long story short watch your money I can afford to lose one another but again,https://itunes.apple.com/us/review?id=401626263&type=Purple%20Software,2022-04-12T15:04:39-07:00
8351589111,IZacz,https://itunes.apple.com/us/reviews/id27080534,22.05,1,I used to love Airbnb,"This service could be amazing.  I had a trip planned to watch my son out of town.  The calendar wouldn’t function properly and the cohost misinformed me that the space was in fact available when it was double booked.  The cohost sent me to Google to find her boss and when we connected he wouldn’t let me explain he just shouted at me and blamed me.  He gave me different information then the cohost and said they have a strick cancelation policy.  I had to find a place to stay last minute.  The app calendar malfunctioned and the cohost misinformed me and then I got shouted down by the host. I understand the cancelation policy but when you are told two nights are reserved and then when it’s to late to cancel they tell you it was double booked all a long does that really qualify.  

I have had wonderful experiences until now.  I guess the evolution of Airbnb to be involved with larger property managers is hurting the whole experience.   The Airbnb representative had canned answers and just went through the motions.  This “super host” wanted me to pay the host off app which I felt uncomfortable with.",https://itunes.apple.com/us/review?id=401626263&type=Purple%20Software,2022-02-13T07:43:07-07:00
6507152693,Ddee2690,https://itunes.apple.com/us/reviews/id306296567,20.40,1,Sided with Racist & deactivated my account,Me and some friends were using an Airbnb in Dallas to over the summer. The owners of the house continuously harassed us while there by setting off their alarms while we were there. Then upcharged us $1500 more dollars to continue to be there only for them to have us kick out everybody after we paid. We tried calling customer service that night for some resolve and they were no help at all. We are a group of young African Americans and the neighborhood and house owners were white and halfway through our time there the neighbors were also harassing our guests. We cleaned up the house and made it spotless. They then complained we damaged a granite counter in the kitchen. So our deposit was taken away. It wasn’t on my account but Airbnb cancelled my account due to “affiliation and location” . I’ve been using Airbnb for 5 years now with all outstanding guest reviews on my behalf. It took them 4months to finally come to this conclusion with absolutely no contact to me or my friends after our complaint. Extremely disappointed and disgusted by Airbnb and will be telling everyone I know not to use the app.,https://itunes.apple.com/us/review?id=401626263&type=Purple%20Software,2020-10-06T09:28:56-07:00
5966399840,edezey,https://itunes.apple.com/us/reviews/id468037688,20.20,1,Cares about guests but doesn’t care one bit about hosts,"I loved Airbnb back when I was a guest and the first year of hosting was seamless. I never had any issues or bad guests during that first year, so Airbnb seemed like a great place to host. Little did I know that Airbnb doesn’t doesn’t take care of their hosts when there are bad guests. They especially didn’t take care of us during the pandemic and most certainly have been keeping even tighter fists about handling bad situations since. The app is very slow, always glitching and seems to be behind the times. I have a list of at least 10 things they could improve, and so do probably every other host on the platform who have had to deal with them directly. 
They also provide guest checkin info BEFORE they’re checkin time...I’m talking our door code...which led to me having guests walked in on due to a guest showing up before their booked dates and Airbnb completely denied responsibility. When I asked for them to refund the guests who were walked in on they told me I could refund my portion but they wouldn’t be refunding theirs. Airbnb’s days are numbered when a newer, better app comes out.",https://itunes.apple.com/us/review?id=401626263&type=Purple%20Software,2020-05-19T09:21:15-07:00
4967632378,lacey304vegas,https://itunes.apple.com/us/reviews/id472563090,19.42,1,Discrimination experience,"I loved Airbnb until they showed us their true colors and banned my husband and I because HE has a criminal record from 15+ years ago.. MY record is sparkly clean but since he is traveling with me they banned my account to. After thousands of dollars we have spent staying across the country using Airbnb.. we couldn’t believe how they treated us. MAYBE the background checks should be done prior to letting guests stay in peoples homes.. We are on a 7 week long road trip and are now forced to stay in hotels because we travel with our dog. This experience with Airbnb is ridiculous, and I will from now on advise everyone who uses this app to STOP spending their money on such a rude company. Banning guests without a warning by email, or phone call. Airbnb should have more consideration for others, and they should have a proper customer service phone number with representatives that actually can give you a straight answer and solve your problem the first time without giving you a runaround. One VERY unhappy customer with good lawyers is all it takes for a booming company like this to be.. haha

Good luck Airbnb.",https://itunes.apple.com/us/review?id=401626263&type=Purple%20Software,2019-10-18T09:22:47-07:00
3504526126,#salma,https://itunes.apple.com/us/reviews/id524136498,18.47,1,Worse service ever,"Couldn’t find 0/5, if i found i will give it to this service, they don’t give or help woth the rights of the clients. My boyfriend wanted to book an apartment for few days and he asked the owner of it for a discount if it possible and she said YES!!! Then tricked him by giving him another one woth the same location and apartment but only to book a room and she didn’t months that or anything she just said ( i will give you discount use this link and book it ) then he did book it because he trusted the lady and especially the airbnb because even if something went wrong he thought  that they have something called give the person their right and what they’re asking for as far as they are paying for it . But NO . Because when he found out after few days that it’s not an apartment and she tricked him with only one room in an apartment with other 3 rooms . He called airbnb and asked for his rights but they didn’t give him back his money even 10% even they saw what’s everything happened and talk t oother lady but in the final didn’t do anything!!!
This is the worst app and service i’ve ever seen",https://itunes.apple.com/us/review?id=401626263&type=Purple%20Software,2018-12-07T09:15:36-07:00
10382373204,Newlyvasquez,https://itunes.apple.com/us/reviews/id168299924,23.37,1,Garbage service,"I rented a place for two nights for almost 1300
I stressed to the owner that we needed a fenced in space where our dogs could play safe.. the fence was not complete at the back of the property and my dog escaped… leading the neighbor to be furious and get aggressive with us and call the cops even though my dog didn’t do anything to anyone or his property … my dog was not even there for 2 minutes… neighbor said AIRBNB was not allowed in their area and the place we were renting had been shutdown multiple times.. the cops came but didnt approach us and left. We left shortly after… It took weeks for me to get a refund from the owner and only gave me 150 ! Are you telling me out of 650 a night 500 was in taxes and fees?… and airbnb customer service was ZERO HELP even though i had photos, and and our weekend was ruined. They said it was up to the host to refund us. Airbnb should be verifying that the places being rented out are in areas permitted to run short term rentals. They should also have more control on refunds and issues especially if they are charging people so much i I fees. THE LITERAL AUDACITY",https://itunes.apple.com/us/review?id=401626263&type=Purple%20Software,2023-09-18T13:34:14-07:00
8683714798,hailey262,https://itunes.apple.com/us/reviews/id717599334,22.18.3,1,unauthorized party restrictions???,"I’m unhappy with my experience to say the least. I tried to rent an Airbnb for a one night stay for some quality family time. I work 6 days a week 10 hour days and I took time off to rent an Airbnb. I found one I like and pressed request to book. It declined my request so I contacted the host and asked him personally if I could rent it. He sent me an invite and still I got the declined request notification. So I took the liberty of looking up why this is happening, and airbnb put in a bunch of restrictions to keep guests from partying, while I understand this as a 21 year old ADULT who’s trying to spend quality time with her family the restrictions they have are ridiculous. You have to be 25 and older, you have to book no lesser then 1 night, you have to not be in your same city, the more last minute you try and book is a red flag, the closer you are to you’re home the more it books it as a red flag. And a lot of other restrictions, at this point it’s impossible to find a good getaway home. I will be taking my business elsewhere.",https://itunes.apple.com/us/review?id=401626263&type=Purple%20Software,2022-05-18T08:26:04-07:00
7919153239,Trenski01,https://itunes.apple.com/us/reviews/id715134073,21.41,1,Banned because of a criminal past,"I went to make a reservation last year and I gave them card information and everything. I got an email shortly after saying that I was banned because of my criminal background. Let me give you a bit of my background, I was young and involved in a party scene that eventually led to me being charged with a felony possession charge, that was over 7 years ago. Since then I’ve been to rehab successfully completed probation and am living the life of dreams sober. What jerks me the wrong way is that they assume that I am still the same person. Why I am writing this a year later is that I just realized I am not even allowed to look up properties when family members refer me to look at a property they might book. Airbnb is absolutely convinced that I am such a bad person that I am not even allowed to access the app. I have worked extremely hard to get to where I am at today and I seriously feel like I have been discriminated against. So if you have a record, think twice before making any last minute plans in case of an emergency trip.",https://itunes.apple.com/us/review?id=401626263&type=Purple%20Software,2021-10-15T18:49:10-07:00
7295277674,Def34,https://itunes.apple.com/us/reviews/id150380332,21.17,1,Unreliable app,"I recently tried to book a place and the app wanted to verify my phone number. It took for three of text messages before the app verified my phone number. So three texts from the app with confirmation numbers that did not work.  Third time was the charm. On the final step to reserve a place, it says it needs my phone number while displaying my phone number in the phone number block.  I tried multiple times and no joy. I deleted and reinstalled the app. I went through the same steps and it says I have reached the max confirmation attempts, I need to wait 24 hrs.  Tried again 24 hrs later and had the same issues. I had to use a PC and go to the Airbnb website to make my reservation. Then, I get am email from the host, I opened this email on phone which defaults to the app. I get “something went wrong with your request, please try again later.” I go back to the PC and it opens. I don’t know why people leave terrible reviews about their experience with host. This software is garbage. PS, I have used this app years ago and didn’t have any issues.",https://itunes.apple.com/us/review?id=401626263&type=Purple%20Software,2021-05-03T18:51:43-07:00
6739066544,dgbfkjkiopsl,https://itunes.apple.com/us/reviews/id499237791,20.49,3,This app needs improvement.,"There needs to be an option for searching private Airbnb’s. Not many people like going on a vacation or romantic getaway with some random stranger right next door in another house. There should be an option to search secluded homes for a peaceful getaway. Also when you click “entire home” it should only pull up places where you get access to the whole house. Instead, it shows houses where the owners live on or inside the property, or apartments or private rooms which is not considered “entire home.” There should be options to enter in and search using key words and not just a search bar for location only. It would make this app a whole lot easier to use. There is also not an option to find houses with bath tubs, which should be included in the amenities category. It takes me days to look on Airbnb and actually find a place to go because of the way this app is set up. Definitely needs improvement and more options added to the app.",https://itunes.apple.com/us/review?id=401626263&type=Purple%20Software,2020-12-10T14:09:28-07:00
8396377819,Deroc101,https://itunes.apple.com/us/reviews/id487421445,22.08,1,Company is scam and does not respect the customer,"I would like to share the unbelievable experience my Fiancé Gretchen Wade and her bridal party are having with Airbnb. The groups had flights scheduled today and tomorrow to fly in Boston, MA. Due to weather conditions the flights were all canceled making it impossible to make the trip. Airbnb customer support canceled the booking and afterwards said they were withholding the cancellation policy and no refund would be given. The owner has already rebooked and they are still offering no help. No sort of refund. I am disgusted by airbnbs customer service. No one is willing to help solve the situation. I’ve been hung up by 3 times. Every time I asked for a supervisor they refused to provide one. If they would have been refunded they could of rebooked and got there flights routed to somewhere they could actually fly into. Airbnb I thought you would have treated your customers better.

They decided to stop responding. Promised me a call with a supervisor and no surprise I have not received one. This company has now scammed me twice and I will no longer be using this app.",https://itunes.apple.com/us/review?id=401626263&type=Purple%20Software,2022-02-25T16:55:25-07:00
