id,userName,userUrl,version,score,title,text,url,updated
6363841508,Missrunaway,https://itunes.apple.com/us/reviews/id1103475535,17.4.0,5,This is a fun app but the hate and racist people are ridiculous,"I’m a furry And I really enjoy the app, but it’s really sad that TikTok deosnt do anything about death threats and inappropriate content ect. Furrys have killed themselves due to this hate. Then the “gamers” are happy about it and saying “one done more two go” it’s a HOBBY I think TikTok should get banned if that’s all it’s about hate all I see. Young furries getting death threats racist people, people who do nothing wrong getting their videos deleted but then TikTok deosnt do ANYTHING about the hate. Yes I’ll be sad if TikTok gets banned but then again I’ll be happy since no more hate racism and sexism ect. Are gone on this app I get there is hate on other apps but this is a problem. I’m only one person but popular creators have been hated on and just leave like the ratata guy left because of hate people JUDGE you for who you are it’s insane... I get this won’t be seen by TikTok but please do something about this you should filter comments and more videos that actually need to get banned I also would love for you to ban “Thatveganteacher” since she’s racist and sorta homophobic she’s also very very rude and doesn’t deserve to be on this app please look into it.",https://itunes.apple.com/us/review?id=835599320&type=Purple%20Software,2020-08-26T11:32:51-07:00
3222067301,Makenzie Hill,https://itunes.apple.com/us/reviews/id698205194,8.5.0,5,Duet Glitches,"hi, my name is makenzie hill. And i’m having some problems with the duets. For example when i want to make a duet with my favorite Creator Jayden Croes, i’ll make the duet then when i look to see how it turned out, it’s like the video will be fine for a bit then it’s like mine goes faster or something, and not in sync in Jayden’s like how i first made it. I noticed it only happens when, i do duets with someone who has a lot of transitions in it. But still, can you fix it, because i’m known for making in sync videos with my favorite creator Jayden Croes, and when i make them on sync it’s like my video will go ahead of his therefore messing the video up, and i keep redoing it but it still happens. next i would love you to add a feature were because i like doing duets with Jayden, he has videos were he records with no hands, and then sets the timers to a certain point for it to end. why, is it that if you want to do a duet with that person you can’t  hear were they stopped it at and the second they stopped the music at??? but if you don’t duet the video you can here the sound, and the second but if you duet the video you don’t??? i really hope you fix it because i really love making videos with him❤️ thank you.",https://itunes.apple.com/us/review?id=835599320&type=Purple%20Software,2018-09-23T10:05:36-07:00
10474698298,Film Fanatic NYC,https://itunes.apple.com/us/reviews/id144542166,31.5.0,5,"Laugh, Learn , Cry. That’s what TikTok does, no more, no less 🥰","The best app of all time. I learn, laugh and cry every time. It’s better than Cats. Wasn’t it made in Japan? Stop trying to ban it - it’s awesome! Plus now that they are launching Legal Drinking Age TV at the first mainstream Know Your Customet technology that allows consumers to trade their customer personalization experience preferences with brands who are looking to get to know them better. With Loyalty Reward TV I’ve never been so motivated to watch branded content to receive cash and prizes. I especially love that LDATV grants me access to all of the legalized gambling operations and other legal drinking/substance according to federal and state laws. And I love that I get paid to create the work I love instead of not getting paid yo do a job I hate. Lets face it, kill your ego for the YourFace App Championship, the FreedomChallenge the Together Challenge to Live for the Challenge of Becoming an Adult. You are worth the wait. #Create Your Dreams for your Dreams to come True in Anaheim, Ca at Disney Parks, Paramount, Universal Pictures, Warner Brosr for the birth of the created revolution . You are worth the wait. You are a super hero doing social good. Be careful and be good! Creator Revolution starts now!",https://itunes.apple.com/us/review?id=835599320&type=Purple%20Software,2023-10-14T12:07:05-07:00
7013184496,mr ummm,https://itunes.apple.com/us/reviews/id1155868194,18.5.0,5,Inappropriate content,"Hi TikTok! I just want to let you know that there has been this trend going around on this app where mostly people with the app “Roblox” post there 🍒🍑 🍆I’m pretty sure you may know what that might resemble, anyways they are showing there avatar first and saying “ so now where showing our ‘n00ds’ for clout?” Then they either post there avatar with a penis or something saying “no you nasty” but in the other hand there are people who actually do this then other people duetting the people who actually show there n00ds saying “how wrong it is” and I totally agree with how wrong it is but I feel like it DOES NOT have to be shared across this app. Another on that I have been seeing on my fyp is mostly fan pages saying “ OMG GUYS I JUST SAW  PEACHES _____!!! COMMENT IF YOU WANT TO BE TAGGED IN IT” or something like “ OMG GUYS I JUST SAW THIS GIRL DO _______ TO HER _____THE LINK IS IN MY BIO”  and yes they do actually tag you or have the link in there bio and the one that they have the link in there bio usually leads to something bad on Twitter.  I’m really sorry for the long message but I really hope if your still reading and that you can help to get this fixed thank you so much for taking your time and reading this!",https://itunes.apple.com/us/review?id=835599320&type=Purple%20Software,2021-02-19T04:41:08-07:00
9993287108,GanethLey,https://itunes.apple.com/us/reviews/id232687872,29.6.0,2,***** to most of the users,"I actually really love TikTok; it has helped me a lot and I’ve learned so much from the creators. I think it has a ton of potential and is a great way to build community. That said, I have seen a decline in the short two years I’ve been a user and I will list them (some of them are annoyances and some are serious problems) and then explain: ads, poor pay for creators, content suppression and censorship, increasing number of violent and hateful comments and videos. The number of advertisements has increased dramatically; why can’t we ever get a break from being sold to? I feel like I’m in that episode of Black Mirror where you can’t turn away from the ads. Marginalized communities are having their content suppressed with certain topics they address being shown to less followers than others. On the flip side, videos promoting hate against marginalized communities, violence against anyone, and other concerning topics do not seem to experience this problem. Often, reports for clear community violations are ignored by TikTok. You need to lose the ads, pay your content creators fairly, uplift your creators making a space for their community while educating those outside it, and promote the creators that are not advocating for more oppression and conflict while making it clear that those who are will not be tolerated.",https://itunes.apple.com/us/review?id=835599320&type=Purple%20Software,2023-06-02T19:26:03-07:00
8172090776,Jeane ;33,https://itunes.apple.com/us/reviews/id983336989,22.5.0,4,Cool but please read:,"Alright, so first off it’s pretty addicting. I’m on it all the time even my parents haha. But it’s not the best environment. It’s very toxic. Lots of people sexualize things, they are rude to other people like maybe body shaming or age shaming, which I completely understand that isn’t in your control but I’m just saying maybe look into that. The app is 12+ but SO SO many kids are on the app. Like, LITTLE kids. You guys need to be a little more aware of who’s joining your app. I cannot number the amount of inappropriate Tiktok I’ve seen. Now I’ve had the app since I was 8. And sadly, it changed me a lot. I’ve seen some things I didn’t need to see, learned about some things I didn’t need to know at the time. I know I’m not the only one, a lot of people say the same thing. Also, I’d like if you’d make it where people with under 1k followers can go live. I’ve had an acc with 5k+ but for whatever reason Tiktok glitched and logged me out, I was never able to log back in. I was super frustrated at the time! It takes time and hard work to even gain 100 followers. Also id like it if there was NOT a text limit. I hope you consider putting a-lot of deep thought into this review pretty soon, thanks! Overall it’s a 4/5 for me.",https://itunes.apple.com/us/review?id=835599320&type=Purple%20Software,2021-12-26T15:02:46-07:00
9631920731,thatgirlkelis,https://itunes.apple.com/us/reviews/id1478239856,27.9.0,5,The TikTok,TikTok is the best you can see funny videos and laugh all day I support the person who made this app you deserve 5 million thousand stars not just five whoever made this app y’all made me laugh as soon as I download this app and now I’m addicted to it you made everybody’s day when you made TikTok i’m about to cry because this is the best app ever I’m not addicted to it but I just love it my family is on TikTok my friends are on the app I told everybody about this app this app is better than likely The old TikTok so I hope everybody Supports you and this app I love TikTok I bet you make a lot of money if I’m sad TikTok if I’m bored TikTok if I’m doing my homework and I’m done I have nothing to do TikTok so that’s why it’s the best and is so funny so I hope you get a lot of money I support you take care and that’s all I have to say but I have a lot more every time when I go on my bus early in the morning I go on TikTok and I watch videos people wants to hold my phone and so I say no sometimes because they want to just watch TikTok but TikTok if you’re saying this I hope I just hope you get a lot of money because so much videos on this TikTok app you can finish school dance the last video,https://itunes.apple.com/us/review?id=835599320&type=Purple%20Software,2023-02-18T16:37:57-07:00
6229324419,bae_lexi,https://itunes.apple.com/us/reviews/id1146106100,16.6.5,3,Please read!,"Tiktok is a wonderful app. It’s takes up most of my day. It’s also probably the most entertaining thing I’ve ever been on. Although it does have some down falls. Like videos can be taken down for no reason, videos that clearly do have a reason to be taken down stay up. For example, I made a video doing a dance and my grandma came in and hugged me. Guess what it got taken down?! I was wearing pajamas and she was wearing a baggy shirt with joggers, so it wasn’t clothing related. Here’s where it’s weird bc that got taken down but videos showing inappropriate content gets to stay up. Another thing is that people get told to kill them selfs on a daily basis but they don’t get in trouble. People get body shamed and bullied on this app but nothing gets done about it. Randomly tiktoks get deleted for absolutely no reason. It’s like tiktok is picking and choosing. It’s not fair to the ones to follow the rules in this app and still get deleted. Also live shouldn’t be debated on how much followers you have. Tiktok is an app that everyone has grown to love but it’s not always a place for everyone bc of all the hate and picking and choosing. I love tiktok and thousands of others do too. So please take what I had to say into thought to make tiktok a place for everyone! 

                              Thank you. 🙂",https://itunes.apple.com/us/review?id=835599320&type=Purple%20Software,2020-07-22T12:35:39-07:00
5931293398,💜Rose is my middle name💜,https://itunes.apple.com/us/reviews/id584956140,16.0.0,5,Please control whats been created,"This app used to be fun I'm not kidding I loved it. However everybody on this app has gotten out of hand very few people haven't. I’ve seen so many people telling others to kill themselves which I find unacceptable. One of the worst things is I'm not an adult but even I notice whats going on in this app. People in fandoms have been told to die for being in that fandom. Theres little kids on this app even if they aren’t supposed to be they are and thats close to impossible to stop. Theres creators that are terrible influences and theres predictors on this app. People are being bullied, people are being terrible to each other.  We need this to stop people are joking about things that shouldn’t be messed with. Currently theres a trend that makes fun of autistic people which how is that even close to being okay? Why would someone think they can make fun of people? I know why its cause tiktok isn't being monitored, the only videos I see that get taken down aren’t even the ones that are doing harm to people. This app isn't safe anymore and its not fun anymore. I could honestly say I hate it with out thinking and I know I'm not the only one.",https://itunes.apple.com/us/review?id=835599320&type=Purple%20Software,2020-05-11T04:45:52-07:00
9162413082,BANNASBGAUAMANAAIAI,https://itunes.apple.com/us/reviews/id1170923460,26.4.0,3,Account issues,"I had problems with tiktok before, whether if I was a new feature I didn’t like, or something like that. That’s fine, although I don’t like changes unless it’s feature I wanted, I would just adjust to it. Something that I’m not fine with is my account getting PERMANENTLY BANNED being of “community guidelines” THAT I DIDN’T EVEN BREAK BECAUSE IT’S IMPOSSIBLE FOR ME TO: I don’t comment on videos, I don’t post any videos, I just watch, like, and follow people on tiktok. I want my account back. This is really annoying and unacceptable since I have seen accounts that have went against these community guidelines but still being up (and most of them were about nsfw etc). The fact that they are so many of these accounts of tiktok yet you guys do nothing, and when you guys do it takes a good month unless a video about goes viral, but then you ban random people that haven’t done anything wrong. I have also noticed people that I follow, who posts normals things, and nothing that goes against community guidelines get ban. Please fix this immediately, tiktok is my #1 past time and before this my favorite and most used app like most of the people who uses this app. GIVE ME BACK MY ACCOUNT👹 I AM REALLY UPSET BOUT THIS I REFUSE TO LET THAT ACCOUNT JUST DISAPPEAR SINCE I HAD IT SINCE 2020 I HAVE EMOTIONAL ATTACHMENT ISSUES",https://itunes.apple.com/us/review?id=835599320&type=Purple%20Software,2022-10-07T20:53:58-07:00
8567718317,WtfDudeEveythingIsTakenOmg,https://itunes.apple.com/us/reviews/id909191422,23.9.1,1,Audio Issues,"This app is super addicting as a viewer. As for being a creator, it is very very irritating. Tiktok constantly shadow bans the creators just because haters report the video for total nonsense. They will ban you from Live just because viewers will report you over and over so that the other viewers will go to other people to rank higher.. I bought ads on purpose just to see who they are showing my content to and my content is intended for adults over 21 and they were showing my content to children 13-17 years old and won't give me a refund for the ads or say anything about it showing to them. No wonder I get shadow banned... It is not appropriate for children so yeah it should be reported but I should not be in trouble for it. This is a them problem with their algorithm and not my fault as I am not doing anything wrong. I bought ads and targeted them.. I had 6k views, 1k new followers and 1k likes. After the ad ended, it is now crickets because I'm either shadow banned or they are trying to get me to buy more ads by not giving me viewers in it anymore. All my new videos are not showing on FYP so I'm def shadow banned. The one I did was me dancing to country music fully clothed so it shouldn't be penalized. There's women on there almost naked and they don't do anything about it. They really need to hire better ppl to handle bans or use a human instead of a computer. We are all sick of it as creators..",https://itunes.apple.com/us/review?id=835599320&type=Purple%20Software,2022-04-14T14:50:54-07:00
7573249356,jonathankhay,https://itunes.apple.com/us/reviews/id885837404,20.2.0,1,tiktoks ridiculous band,"my videos keep getting banned and i keep getting banned from posting because i “violate community guidelines under minor safety” but i am 22 years old born february 2nd 1999. i sent in my ID multiple times because you guys keep asking for it yet i still keep getting banned and my videos keep getting taken down under minor safety even though i’m well above the age of 18. i am 22 years old yet my videos keep getting taken down because tiktok believes i’m a minor and i violate the community guidelines even tho i am a male. all these popular male tiktokers keep making tiktoks with their shirt off flexing or working out and i can’t even show my collarbones without even being banned. and i am banned from posting for more than a day. this is incredibly unfair and all you do is ban me for ridiculous reasons. i don’t see underaged girls being banned when they’re in their bikini but if i show my collarbones, i get banned. even when i try to repeal it, you still say it violates even tho 22 years old. i don’t see you taking down minors when they’re half naked on the app yet i can’t comb my hair with my collar bones showing without getting banned. this is ridiculous, i’m banned from posting until the 15th and this is the second video you’ve taken down for “minor safety” minus all the other videos you’ve taken down that you never let me repeal NOR TRY TO PROVE MY CASE. this is ridiculous",https://itunes.apple.com/us/review?id=835599320&type=Purple%20Software,2021-07-13T15:37:26-07:00
10486844729,peen in the but,https://itunes.apple.com/us/reviews/id602188738,31.5.0,5,Feature ability in the future,"I absolutely love tik tok and maybe even too much to the point where it’s addicting and probably harmful for my mental health but who cares right when you’re having fun. The app is very enjoyable all around but one of the main directives for your expression is through reposts and favorites. They added a favorites collection board but I’d like to see something similar such as a profile collection board ( adding accounts to favorites). As in it would be wiser to only favorite an account that makes millions of edits rather then add those millions of edits individually for people to see. Simple features mean a lot to us as a consumer but maybe even a feature to change the algorithm by choice, allow us to get a fixed feed of endless similar videos or on the flip side by selecting an option of random and unfixed or focused videos to make the experience more appealing and not boring( there’s been times where my feed would just be guitarist video after video with no change of topic and simply made me turn of the tok and just read ). Not saying tik tok should become Pinterest but… maybe I am with videos instead of photos !",https://itunes.apple.com/us/review?id=835599320&type=Purple%20Software,2023-10-17T19:45:23-07:00
2638898675,Imasoccer_girl2,https://itunes.apple.com/us/reviews/id630304043,7.3,2,Love the app but I want the old Version back,I love musically lots but the new update just makes me hate the app. When you try to type in your bio you have a maximum of 20 letters. It is horrible. Sometimes with my bio I tried to change it and it won’t let me I even counted my letters and numbers and it wasn’t even 20 sooo..Another thing is when your scrolling through your feed it goes “Your typing to fast slow down and take a break”. What is that supposed to mean. Transitions are hard to do with the new one and I’m confused with a lot of it. If you do update the app all of your privates go into Drafts. Which you can’t use the audio you saved to your privates anymore. There is an option where you can save your videos private but they fill up your whole feed like on the old musically you could just click on your privates and they would all be together under one thing. One thing that is really making me mad tho is I can’t see how many people have seen my musically when I click on it. It only shows the number of likes but who knows if those are the exact number of likes. The only way you can see how many views is on your main profile page. There is only one good thing about this new update the new filters but other than that that’s it. So for those of you thinking about getting the new update don’t get it. I love musically just want the old version back.,https://itunes.apple.com/us/review?id=835599320&type=Purple%20Software,2018-06-03T22:00:50-07:00
9989705449,wyldtame,https://itunes.apple.com/us/reviews/id108293492,29.7.0,5,Tik Tok saved my life,"Just a quick shoutout that a few years ago when I first got on here under a diff account Tik Tok quite truly changed my life. I was in a pretty isolated period with 3 young kids and a full time job. While it felt silly at first, I was inspired to learn the dances and and make some random videos and it helped me remember my fun goofy side. It was a breath of fresh air to see people being people, weird, authentic, wild, poorly dressed and with regular homes and surroundings. The other more presentable side is great for us all too, but we get enough of that and I felt like for the first time in forever I could express a creative side that had been dormant so long. It also taught me a lot about personality types, trauma, toxic relationships and traits, and healing which I unfortunately didn’t have a good understanding of until this app. I was inspired by the brave people who share the depths of their lives and  relationships, and are so vulnerable on here. This was helpful in so many ways including getting the courage to leave a rough marriage. As I move forward I hope I can help in some way like those who have unknowingly helped me. Thank you for this app. It’s everything ❤️",https://itunes.apple.com/us/review?id=835599320&type=Purple%20Software,2023-06-01T19:19:11-07:00
9065316806,ejwndnwjak,https://itunes.apple.com/us/reviews/id633015107,25.9.0,3,"App is great, guidelines are there for show","I am nineteen years old, therefore I am not a minor, yet my account was banned. Many other woman of my age have had their content/accounts taken down for violating minor safety although they are not minors. There's no email to contact, the appeals are always denied, age verification does not gaurantee anything, and strikes/bans have been put against my account even though I am of legal age and can show my body if I please to. I'm an adult and it's my body. I've also seen many people on the app do the same, it just seems to be a problem when *certain* people do it. TikTok, you need to readjust your guidelines so that they ACTUALLY protect children on the app. There are people attacking and assaulting young children in comment sections, posts, duets, stitches, etc, and a nineteen year old in a crop top is where you draw the line.... Makes no sense. This is the UNsafest app ever based off of what I've seen take place on there, doesn't matter if there is great content. Please reconsider your priorities in these regards, this app is becoming less and less enjoyable to use and a greater platform for ACTUAL child abusers. If you claim to prioritize the safety of children, then do so. Brushing people off and deleting their account is not protecting anyone, it's dismissive and tactless.",https://itunes.apple.com/us/review?id=835599320&type=Purple%20Software,2022-09-08T13:40:14-07:00