id,userName,userUrl,version,score,title,text,url,updated
1917745416,JTS006.5,https://itunes.apple.com/us/reviews/id42152166,9.1.54,4,I want a roll back!,"I would very much like to return to the version I previously had where I could:
* see how many connections I had and
* send a customized invitation instead of a generic one where I can't remind or explain the recipient of the context of the connect request. Then I get a ""speeding ticket"" or warning to slow down. I wrote LinkedIn via snail mail to explain and provided backup on how I know the latest 15 people invited and requested that the warning be rescinded So far no known response.

My letter was copied to Apple to disallow aps to eviscerate such useful functions.

The Apple store person I consulted with in person offered no easy answer to rollback to previous version.

Didn't mean this to be a whinging session but when I got another review request, I thought I should share.

One colleague skips the ap and just uses Safari. That doesn't fit my m.o.

Any ideas to optimize?",https://itunes.apple.com/us/review?id=288429040&type=Purple%20Software,2017-11-13T02:44:03-07:00
7424798896,1PandaMatt,https://itunes.apple.com/us/reviews/id189833978,9.1.223,1,Putting you last.,"I liked the LinkedIn app and would normally give them a 4 star review as I believe they should miss only 1 star for overcharging for premium. 

I would give negative stars if possible now. The big problem is LinkedIn is now censoring things at the request of the chinese communist party. Censoring viewable access on things like the 1989 Tiananmen Square Protest Massacre, as well as other content not approved by the chinese government. With LinkedIn now willing to serve the interest of China over you and me its users, I’d give them negative stars with a negative rating if possible. Sad how a once good app has become another chinese tool against truth and freedom. I’m very disappointed!!! 😠",https://itunes.apple.com/us/review?id=288429040&type=Purple%20Software,2021-06-04T02:17:21-07:00
10459550124,RealKingTino1,https://itunes.apple.com/us/reviews/id1509690116,9.1.337,4,Slow video Upload,"I have been attempting to upload a 70MB video file since 7 AM, but I'm encountering a persistent issue. The upload process consistently reaches 90% completion, only to suddenly revert to 20% and start uploading from the beginning again. Despite my efforts, including updating the app, the problem persists, and now the app seems stuck at the ""preparing file"" stage. I'm uncertain whether the issue is on my end or if there might be a problem with the app itself.",https://itunes.apple.com/us/review?id=288429040&type=Purple%20Software,2023-10-10T08:30:38-07:00
10407714070,reservoir honey badger,https://itunes.apple.com/us/reviews/id1318607264,9.1.334,4,Why are notifications so complicated,One major flaw with this app is that if I want to turn off email notifications I need to go to every notification category and sub category to do so. Instead of receiving the notifications through the app I now have turned them all off because it was easier to do they for 10 categories than it was to turn off email notifications for a lot more sun categories. Way over complicated.,https://itunes.apple.com/us/review?id=288429040&type=Purple%20Software,2023-09-25T20:11:13-07:00
8337546392,Tia_🙏,https://itunes.apple.com/us/reviews/id294520304,9.1.255,4,Update Editing Features,"Linkedin is great and dandy. It does an amazing job of connecting and leveraging networks. However, I do think it need to be more up to date when it come to being able to make post edits. Unlike Instagram, linkedin doesn’t allow you to edit photos in a post and that makes it really hard when a post is doing well and you just want to delete one picture from the post without getting rid of everything.",https://itunes.apple.com/us/review?id=288429040&type=Purple%20Software,2022-02-09T12:34:17-07:00
6253158599,jaydubelew,https://itunes.apple.com/us/reviews/id24905759,9.1.186,1,stop changing things,"Every time there’s an update, you give the same stock text. You don’t tell users what you’re really doing. You say that all ur doing are bug fixes, but really you constantly add and change functionality. Some of your change decisions are poor (from a user’s perspective) and before choosing to update an app, since the app belongs to the users, we should know what changes you’re actually doing to decide if we accept your changes, since you don’t enable us to roll back to a previous version. 

Plainly put - stop giving us the same BS stock text about bug fixes, and tell us what you’re really doing!!",https://itunes.apple.com/us/review?id=288429040&type=Purple%20Software,2020-07-28T15:58:11-07:00
10453852887,Skdunn,https://itunes.apple.com/us/reviews/id234384117,9.1.337,1,Horrible!!,"I’ve been a happy customer for years now, then out of nowhere about a month ago, I wasn’t able to login.  My app and site online said due to security reasons, my account has been locked.  Which is great, I appreciate the company protecting my identity, after all I work in the cyber security field…but the company in no way allows me to verify my identity or an option to connect with a customer service representative.  I’ve supplied my drivers license TWICE now and still unable to login.  At this point I am just happy I’ve never become a premium member because this is a complete joke.  The amount of time I’ve spent messing with this is laughable.",https://itunes.apple.com/us/review?id=288429040&type=Purple%20Software,2023-10-08T16:32:49-07:00
9623102035,KDGS IPHONE,https://itunes.apple.com/us/reviews/id154823345,9.1.302,3,App not functioning…,"I been using LinkedIn for over 6 years. I was premium for 4, today the new update came out for Apple. I updated and as soon as I came to my apps page and click to open linkedIn, it shows the initial startup screen for literally a second and it fades away. I’ve done it repeatedly and it still goes away.

I tried login in through a computer and laptop and I was able to get in just fine. I have the latest iphone but for some reason I can’t use the app anymore after the update.
I contacted the developer and they can’t do anything because they don’t know why it’s doing that. 
If they don’t know, and I don’t know now, then I’m basically screwed and can only use it on the web??? This is ridiculous and it’s caused me a massive inconvenience.
Please have this checked and reviewed… please!
Thanks so much. God bless and I pray this gets fixed soon.",https://itunes.apple.com/us/review?id=288429040&type=Purple%20Software,2023-02-16T04:12:34-07:00
9736378759,monkeygirl61597,https://itunes.apple.com/us/reviews/id176102009,9.1.306,4,Bug fixes needed,"Just got an update for supposed bug fixes. Hoped it would fix the problem where I have a notification icon when I close the app, yet I have no new notifications. LinkedIn has been one of the ways that I stay in touch with previous coworkers, as well as potential new employers. Not knowing when I actually have a notification kinda makes me want to completely turn them off and end up missing something",https://itunes.apple.com/us/review?id=288429040&type=Purple%20Software,2023-03-21T05:08:18-07:00
3829012674,Rajeevthereay,https://itunes.apple.com/us/reviews/id127510869,9.1.121,1,Hangs in ios 12.1.4,"Generally I don't write reviews but with this instance I am forced to write it because of 2 reasons

1.  Linkedin is not a single developer app where app hang issue could not have been caught in QA cycle before releasing it to public.

2. There are large number of users who use it so such a basic issue in app before releasing to millions of users is unacceptable.

Linkedin app starts fine but as soon as I scroll 2 or 3 pages down, it immediately hangs and never responds back.  This is not some small bug,  it completely makes app unusable.

This kind of basic issue is reflective of Linkedin QA and dev quality or probably because as someone said, with ad based Free service you are not consumer who comes first for company, but you are the product.  This is probably why app was released to general public with such basic issue.  it is not simply your post disappearing or not showing up which I have seen in past which I accepted as part of free service deal, but app simply hanging is not acceptable even for free service.",https://itunes.apple.com/us/review?id=288429040&type=Purple%20Software,2019-03-01T09:08:20-07:00
9281261287,Nonicknamesareavailabl,https://itunes.apple.com/us/reviews/id231296264,9.1.291,4,No bug reporting,"Whenever I get a message that requests a response and a résumé, if I write the response, and then attach the résumé, it deletes my response. This is extremely frustrating because it has happened a couple times now and I see that it is not a fluke. Apparently this is just a manner in which the app operates and I'd like you to try and fix that.
*update*
The reinstall the devs recommended fixed the immediate problem, but I'm still requesting they add bug reporting somewhere accessible.",https://itunes.apple.com/us/review?id=288429040&type=Purple%20Software,2022-11-12T02:38:31-07:00
6741174210,dizzyzonk,https://itunes.apple.com/us/reviews/id37771061,9.1.200,4,So un-usable at the moment,"Updated: deleting and re-downloading the app fixed this bug. Now it is very helpful when looking at professional updates and responding to messages. 

For some reason, the app auto-logs out and now requires signing back in even if you reopen it after 10 minutes. Kind of defeats the purpose of being able to keep up in real time with professional news and alerts, if you have to re-enter email and password so often. Didn’t use to do this.",https://itunes.apple.com/us/review?id=288429040&type=Purple%20Software,2020-12-11T05:12:52-07:00
6950129849,daveduffy,https://itunes.apple.com/us/reviews/id186126808,9.1.206,5,Lauren Servideo,Karen worked for a group of 4 managers and efficiently served all.  Quality and speed to complete always met expectations.  Work responsibilities included meetings with agenda including invites and document distribution.  Client contact was also part of assigned responsibilities and her dialogues were better than might have been anticipated given many product offerings requiring good working knowledge of products.  Client dialogue helped maintain good customer relations.  I would rehire without question.,https://itunes.apple.com/us/review?id=288429040&type=Purple%20Software,2021-02-03T13:11:13-07:00
4450272430,UMAppleMan,https://itunes.apple.com/us/reviews/id35331901,9.1.138,2,Cannot save my location- error,I moved from a major population area a year ago. My wife has been pushing me to find a job. This app refuses to save MY preferences or location information which would make it easier for me to use this app. I keep getting recommendations for areas nowhere near to where I live. I am retired and would prefer to NOT travel more than 30 minutes from our home. We are a ONE car family because that is all we have needed for the last 10 years. So fix this app so I can save my location and driving Preferences. This is required and I cannot be the only one with this issue.,https://itunes.apple.com/us/review?id=288429040&type=Purple%20Software,2019-07-12T16:31:18-07:00
2152192391,zfowler,https://itunes.apple.com/us/reviews/id158549394,9.1.63,5,"Great app, great experience!","Great app. I use it every day over the desktop website. Keeps all my professional network within reach and keeps me current with industry trends and news. 

Product team... you guys do need to fix the “x” close button for when you click in to view videos hosted on another site for iPhone X. The close “x” overlays on top of my iPhone X clock (top left hand corner of viewport). It forced me to kill the app and reopen which is less than ideal.",https://itunes.apple.com/us/review?id=288429040&type=Purple%20Software,2018-01-31T21:16:11-07:00
10082977509,J__Fox,https://itunes.apple.com/us/reviews/id13118627,9.1.322,2,Identity crisis,"Is it just me or has linked in really started to tank? I want to use linked in for job hunting, and secondarily to network. Between the laggy and not good search bar, the freezing slow chat, the gobs of irrelevant posts and notifications, and rather challenging interface options, I struggle to think if you all actually know what you’re doing. It feels like y’all have too many cooks in the kitchen with a restaurant menu larger than Cheesecake Factory. Do a few things, and do them the best. This should be a helpful professionally defining tool, not a dumpster fire social media network.",https://itunes.apple.com/us/review?id=288429040&type=Purple%20Software,2023-06-28T14:53:45-07:00
9666054251,Int jobs bad search,https://itunes.apple.com/us/reviews/id497516861,9.1.304,2,Can’t search international jobs,"I literally type in a country name and it shows me random physics jobs in the U.S.

Keywords doesn’t work, and I can’t change location from US to another country. Searching jobs is the only purpose I have for this app. The website I can search countries but then if I try to sign in it opens the app without connecting to the page I was on in the browser. This is rookie level. LinkedIn is big enough that web browser content should load into app when you connect, and the app isn’t easy to use to search jobs outside of US.",https://itunes.apple.com/us/review?id=288429040&type=Purple%20Software,2023-02-28T16:32:39-07:00
7839393585,blisster72,https://itunes.apple.com/us/reviews/id16401255,9.1.236,1,"Used to be great, now it’s horrible","Whenever you see a job listed, and click “apply”, many employers give you the option to upload your résumé (and good luck with their parsing system reading your résumé correctly) OR…. they show an option “APLY WITH LINKEDIN”.  You think “why not? My profile is accurate and updated” 
Well, here come the issues :
1.- the link to use LinkedIn takes you to…. A LinkedIn sign in page.  Why ?! If you’re already signed on. 

Ok let’s assume it’s for added privacy or any story along those lines: here comes the worst issue:

2.- you sign in with your LinkedIn credentials, and INEVITABLY that takes you to a LinkedIn page with a drawing of two construction workers and a brief message that says “page doesn’t exist”.  Or shows you the infamous 404 http error.   

This happens EVERY. SINGLE.  TIME. !!!! 

And same goes for the “easy apply” button sometimes.   

Developers :  huge fail, on a point in time when there are millions of people looking for a job.   Measure up !!!",https://itunes.apple.com/us/review?id=288429040&type=Purple%20Software,2021-09-24T02:02:51-07:00
5746640146,Bob 0904,https://itunes.apple.com/us/reviews/id135000672,9.1.174,4,Can't update your app anymore,"??Impossible to download, because of iTunes glitch that Apple is not fixing

Dear developer, it's impossible for us to download your app or buy new ones from iTunes Enterprise MAC that is used both by businesses, schools and individuals who can't afford to download the same app several times for each device.

Please let Apple know about this issue. For the time being till the issue is going to be resolved, we will not be able to update your apps. Thanks for your support!",https://itunes.apple.com/us/review?id=288429040&type=Purple%20Software,2020-04-01T08:57:09-07:00