id,userName,userUrl,version,score,title,text,url,updated
9194367393,pizzapril,https://itunes.apple.com/us/reviews/id544783215,2.77.0,5,"Unable to track all packages, but great nevertheless","This app is a perfect tool for young people who love to shop (like me!!), really simple to use for purchasing or just tracking packages. As a buyer and seller myself, I use this app to track my customers packages AND my personal packages! It keeps me updated and there are sometimes deals exclusive to the Shop app, which is cool. My only complaint is that this app seems to get more glitchy with each update, yes, the new features are awesome/convenient, but at times I will not get a tracking number under an order, making the apps main objective (tracking packages) not very useful. 

I also believe there should be points or a reward program for buying through the app! Just my opinion though :)",https://itunes.apple.com/us/review?id=1223471316&type=Purple%20Software,2022-10-17T08:58:31-07:00
7841496789,Iphoneuser123456789012345,https://itunes.apple.com/us/reviews/id22501103,2.34.0,3,Only as good as the shipping company integrations.,"It would be generous to say this app is on par with uspo or ups tracking pages. I ordered from a medium sized business sept 22, yet after 2 days, Shop app has no information on the order other than “is shipped”. No when, or from what location. However, my vendor also provided a link to the shipping provider (gls). The GLS page does provide some basic info about the shipment. The Shop app also encourages users to register. Registering provides no advantages since again, the order is trackable via the unauthenticated shipping service website. I’ll just be volunteering to leave my identity in yet another random app database I’ll never use again.

[Edit] - and it’s too late. By installing the app and navigating to my (empty) order tracking page, my vendor passed shop my email and name AND Shop created an account based on my email.",https://itunes.apple.com/us/review?id=1223471316&type=Purple%20Software,2021-09-24T15:11:14-07:00
5772057083,Bluefinger200,https://itunes.apple.com/us/reviews/id317521249,1.11.0,4,"Works wonderfully, but. . .","I love this app, I use it all the time because I order packages very often. I have noticed that the location on the map of the item being tracked doesn’t always update, and that I get notifications late. I check the app often so I typically see a change before the notification comes. The app notifies me hours late that a package has come even after I received it and marked it as delivered. There are times I manually have to mark a package delivered as well. Which isn’t a big deal but it is slightly annoying. I really do love this app tho, and at least 8 times out of 10 it works flawlessly. There is room for improvement, but over all I’ve had a great experience with this app and I love it a lot! I highly recommend the app, especially if you order packages a lot like I do.",https://itunes.apple.com/us/review?id=1223471316&type=Purple%20Software,2020-04-06T10:50:47-07:00
10442388285,Timo U,https://itunes.apple.com/us/reviews/id298732522,2.128.1,1,Mysterious app without rules or guidance,"I started noticing this Shop Pay while placing some online orders several years ago (most of the products affiliated with it were cheap and bad and several I was able to return). Mysteriously I received an email any now having Shop Cash in my account - of course that’s exciting and I thought I would look into it soon when I have time.  Only a few days later I received notice that my Shop Cash is expiring - but when I opened that email and looked at the dates, one had already expired and the other (which is set to expire next week) but my Account Balance is 0 so apparently that one has expired early.  To top it off, in trying to learn what this is all about, the #10 Disclaimer literally says Shop Rewards or any of its features may be unavailable, inaccurate or interrupted from time to time for a variety of reasons. We are not responsible for any unavailability, interruptions or errors of Shop Rewards or its features.",https://itunes.apple.com/us/review?id=1223471316&type=Purple%20Software,2023-10-05T11:23:49-07:00
9297046939,LCSelf,https://itunes.apple.com/us/reviews/id433411635,2.82.0,1,Used to be great,"I have loved Shop from the beginning. Being able to track all my purchases one one app is fantastic. However, I don’t like all the changes over the last year and the push notifications are getting out of control. I don’t want to shop through this app and I definitely don’t want to review companies or purchases. That is super annoying and inconvenient. I like the push notifications to tell me my package is out for delivery, but I get so many now saying so many various things that it makes me want to turn them off. If I turn them off, the app becomes basically useless. Some sort of setting would be nice to where I could choose which push notifications I could have turned on would be nice. I only want to use this for tracking packages. Anything else is irritating. I used to recommend this app to everyone and now of someone brings it up, I talk about terrible it is now. Fix it or you will see people start deleting the app!",https://itunes.apple.com/us/review?id=1223471316&type=Purple%20Software,2022-11-16T16:54:59-07:00
5767211810,Glamaries,https://itunes.apple.com/us/reviews/id505824714,1.11.0,5,Arrive??? Yes YOU Must!,"I am an online shopping fanatic! But was always having trouble finding the email from buying BUT only when ordering from “Ads” online. Well I got a notification while purchasing something the other day threw an ad on FB and it was for Arrive, I downloaded, didn’t notice anything special or that it has AUTOMATICALLY synced my purchase,but  I have the FedEx app and thought hmm 🤔 Na, don’t need it. Well a couple days into my purchase I realized I hadn’t received a purchase confirmation that I had remembered, so I go to the dreaded email box to start searching, and my first email shown when searched was ARRIVE’s notifications!!  I hadn’t set up my notifications to sound or show a banner! I now can literally track ANYTHING I purchase! And I get Arrives notifications before I get company emails!!!",https://itunes.apple.com/us/review?id=1223471316&type=Purple%20Software,2020-04-05T10:37:35-07:00
7727661941,tankerace,https://itunes.apple.com/us/reviews/id19562226,2.32.0,1,Racist bent and pushy shopping experience,"I initially tried this app because I thought it would be a good package tracker. The tracking functionality without letting the service access my email account was ok. However, the layout of this app is clearly meant to push people to shop more and spend more. While I don’t fault Shopify for leveraging this service to promote more relevant options for a consumer, it’s a bit too pushy. 

The aspect that really turned me off was when the first thing pushed in my face was an offer to shop from businesses only owned by people of one certain color group. That’s called racism and I won’t have any part of it. What a horrible thing to do when so many have worked so long and hard to curb racist practices. 

I hope this company didn’t mean to exclude other races or promote one color as superior to others. But that’s what the marketing looks like. The only way to defeat systemic racism is to deny racist behavior and it’s supporters. So I deleted this app.",https://itunes.apple.com/us/review?id=1223471316&type=Purple%20Software,2021-08-23T20:43:28-07:00
4005179249,adhdaf,https://itunes.apple.com/us/reviews/id33961614,1.2.10,5,Junk!,"I just ordered a product from a website that i haven’t shopped before. When they displayed my order confirmation info, they listed ways to track package. One of the ways listed was Arrive so i figured id try this app since it was supposed to b automated. Got it all set up and it registered past packages that i ordered from other websites before but it didn’t register package i had just got a confirmation email for. So i tried to enter it manually but couldn’t do that either bc it requires u to copy the order number from the text inside the email. Problem was the order number for that package was only listed in the email header title not in the body of the email. So i have no way to add that package to Arrive package tracking which was the whole purpose of downloading the app.",https://itunes.apple.com/us/review?id=1223471316&type=Purple%20Software,2019-04-12T18:35:19-07:00
9039787333,bbjokijugyfrxedtjik,https://itunes.apple.com/us/reviews/id1273790910,2.71.0,5,Order not moving on the map?,Hello shop I recently bought an item and when it was getting shipped after a few days the order suddenly stopped near In-N-Out-Burger and never moved for 4 hours and it’s still not moving on the map and I tried refreshing the app or deleting it and re installing it and it was still in the same place and I’m thinking the person who is shipping accidentally left the box there when they went to eat or either when they were passing by there they didn’t close the door properly and the door opened and probably flew out or they are slacking it but the app is still very easy to use and if u like looking at your orders getting shipped it’s the best place I will start shopping at.,https://itunes.apple.com/us/review?id=1223471316&type=Purple%20Software,2022-08-31T20:27:56-07:00
10678792784,Yejsowtbd,https://itunes.apple.com/us/reviews/id1365510144,2.135.0,1,Track My Package?,"I ordered a gift for my granddaughter from an online vendor. Evidently it was shipped from China. The online vendor gave me a tracking number from Yum Shipping Co. They provided updates on my package’s progress from the warehouse to the airport in China. Yum also informed me when my package arrived at the airport in New York. But that’s as far as their tracking went. The online vendor said if I wanted further updates I would have to download the app “Shop”. So I did. And the only info you can provide is that my package is in transit. Let’s see. Yum informed me two weeks ago that my package had left the warehouse. And since I haven’t received it yet I can only assume that it’s in transit. So why do I need you to tell me what anyone with half a brain can already assume. Where is my package currently? What shipping company has my package: FedEx? UPS? The US Postal Service? What is their tracking number? When can I expect delivery? If the Shop app can’t provide at least some of this info, what good are you?",https://itunes.apple.com/us/review?id=1223471316&type=Purple%20Software,2023-12-10T07:43:11-07:00
5006818711,allenprice,https://itunes.apple.com/us/reviews/id32190797,1.4.3,1,Not updating from carrier feed,"I don’t understand why people are so thrilled with an app that doesn’t update delivery status often enough. The carrier has had multiple updates yet the app still has the initial shipment status and its’s been over a day. For a package that is supposed to arrive in less than 48 hours from the time it was shipped, not updating means the app provides me with zero information. It is essentially a list of tracking numbers vs a shipment tracker. I could do this in Notes or even Notepad. Unless you’ve got hundreds of shipments going to your gmail that you want the app to list automatically, this app is fairly useless as once it lists them it doesn’t update the status. Suggest they come up with some method to make some money to get funding for the development team. The UI is really good, but with the basic functionality essentially non-existent I can’t rate it low enough. Was really hoping to use Arrive over Deliveries as the app looked great, but I got fooled by the looks. Headed back to Deliveries.",https://itunes.apple.com/us/review?id=1223471316&type=Purple%20Software,2019-10-24T06:44:37-07:00
4755580531,Blakaraknyd,https://itunes.apple.com/us/reviews/id15093978,1.4.0,5,Keep track!,"I was a little wary of this app at first. I didn’t think that I’d be using it very often but to my surprise, I order online more than I thought I did! Using this app to keep track of my shipments is actually rather useful. If it doesn’t show up on the app automatically, I input the tracking number and as easy as it sounds, I know the status of my products. I order from multiple different websites and they don’t all deliver using the same service so being able to just put my tracking number in and not having to go search through my emails to constantly find the status is a major plus. I don’t always remember to flag the emails so maybe that’s my fault but this app just simplifies it all so it doesn’t really need to be a concern of mine anymore.",https://itunes.apple.com/us/review?id=1223471316&type=Purple%20Software,2019-09-09T19:58:12-07:00
5793461509,Beldragon,https://itunes.apple.com/us/reviews/id143365085,1.11.0,2,Inadequate information,"The tracking doesn’t keep track of all the senders. It also doesn’t track when a package is transferred fro one carrier to another these transfers make for multiple tracking numbers showing on Arrive equalling multiple delivery notifications for the same package with no way to know that it isn’t more than one package. If you have a lot of packages delivered then many of the Arrive notifications do not show what package each notification represents or if it’s multiple notifications for the same package. 
When you get two notifications with two different tracking numbers saying the two packages have been delivered it is very frustrating. Especially after you waist hours trying to track down the missing package. I spent one hour and forty two minutes on the phone today trying to find a package that was supposed to be delivered. Now I think it could be the situation I mentioned above. 
I’m very frustrated.",https://itunes.apple.com/us/review?id=1223471316&type=Purple%20Software,2020-04-10T17:31:13-07:00
4085955699,Coloradokayla58,https://itunes.apple.com/us/reviews/id455848830,1.2.10,5,How Can I Delete Tracking?,"I have two orders that I cancelled because the company was horrible and never shipped. Because they never shipped, there’s never been a tracking number so these two orders just say waiting for details and no location details. There’s no option for me to delete them because there’s no information. So for a month now I’ve have these two orders just chillin on my shipments, I sent screenshots into the feedback section which hopefully will help. 

Other than that I would give this five stars. I sell on Ebay and Poshmark and linked that email to this app as well. So I can make sure the things I ship out get delivered and I use it for my own personal things that are being shipped to me. Super easy to use, everything just comes straight from your email!!",https://itunes.apple.com/us/review?id=1223471316&type=Purple%20Software,2019-05-01T09:21:45-07:00
6307533684,MpennDesigns,https://itunes.apple.com/us/reviews/id473504111,2.8.0,5,Trust and Patience,"Initially I ordered the wrong item and they quickly refunded my money. Now my choosing the wrong item may have been the way their site is set up and that took my next order a considerable amount of time to arrive. All of my notes to either the company or the delivery service were ignored, okay not responded to but I could see it was in route. By today I had given up hope on it and was worried when I would ask for my money back that would take at least six weeks to happen but as I stepped into the vestibule there it was, my so wanted package. Well, I set it up quickly and right away made my first two recordings for my show Artitude, a weekly show which will air soon. Thanks to Alsopro! Well, no news proved to be good news as I have always believed.",https://itunes.apple.com/us/review?id=1223471316&type=Purple%20Software,2020-08-11T12:10:20-07:00
10338372816,Dntstaley,https://itunes.apple.com/us/reviews/id253505418,2.124.1,1,Not reputable,"So I downloaded this app because some of the stores I frequent and know are in it.  I thought it would be a good fit for my shopping needs.  Well I ordered and it was working great.  Tracking and getting my orders.  I decided to shop through the actual app. I figured the stores had to be backed. No. Not at all. 2 shops I ordered from have to be from china.  They were ordered on 7/27 and I am writing this review on 9/05. I have not received the order. I contacted the stores.  Nothing. They want me to email my card number for a refund. Who does that. They see my order.  It shows landed in US and that is it. Just went to put a complaint in shop app and guess what, they don’t back their stores. It is the stores responsibility to fix.  Well that is ridiculous. So be very aware. I have now lost over $100 and won’t get it back. I will give them a week to get fix and then I will disable this app and my friends I encouraged…will as well. I suggest you do too!!",https://itunes.apple.com/us/review?id=1223471316&type=Purple%20Software,2023-09-05T18:07:16-07:00
8398902222,Wordy mama,https://itunes.apple.com/us/reviews/id232519497,2.45.0,1,MAJOR security concerns,"I have purchased from various retailers using this app in the past without a problem. However, yesterday I decided to save my new credit card information and went ahead and downloaded the app. This morning I started receiving verification codes sent to my phone-obviously fraud since I was asleep. I checked my credit card and had two purchases totaling over $400. Fortunately there IS order information available on the app so I was able to give that information to my credit card company and use it to file fraud charges with the police department. Obviously something is amiss with the security on this app if someone WHO ISN’T ME is able to successfully retrieve the verification codes from a phone that is IN MY HAND. I have emailed the app today with this information, but haven’t heard back (it is Saturday-so maybe I’ll hear from them on Monday). I will no longer use this app nor will I shop with retailers who use this method of checkout.",https://itunes.apple.com/us/review?id=1223471316&type=Purple%20Software,2022-02-26T08:47:46-07:00
7575747031,Nuniestar,https://itunes.apple.com/us/reviews/id130042040,2.29.0,4,Great app! Still needs work though.,"I love that I can track all of my shipments in one place. The only thing that I think needs work is sometimes the status of the package is incorrect. For instance, I can put the tracking number into the USPS website and it will say “out for delivery” or “arrives today” and the Shop app will show “arrives tomorrow”. Or I could track a FEdEx package and on the FedEx site it will say “package accepted at facility” but the Shop app will still say “Waiting for details”. Then some hours later it will finally alert me that the package was accepted at the facility. So it’s almost like the app is just slow or late to update.  Kind of defeats the purpose if I have to go the actual shipment site for real-time updates. So that’s why I deducted a star. If that can get fixed, I would give it 5.",https://itunes.apple.com/us/review?id=1223471316&type=Purple%20Software,2021-07-14T07:21:06-07:00
10379120582,Lilreadheadedgirl,https://itunes.apple.com/us/reviews/id81034821,2.125.0,5,The best app!,"I love Shop! I don’t remember how I found out about it, but it is honestly the best app I have ever used. I can be an impulsive buyer, and can forget about products only remembering months later when nothing actually showed up. Shop keeps everything I’ve ever ordered in one place. Tells me all the information I need to know about the order - like order numbers, shipping details, how to contact the company if needed. It’s so helpful and so convenient and has probably saved me so much money! Also, it has suggestions of things you’ll enjoy and has a little shopping area in the app. It also keeps track of your favorite shops and products. It’s just so helpful! I honestly couldn’t imagine not having this app!",https://itunes.apple.com/us/review?id=1223471316&type=Purple%20Software,2023-09-17T14:01:13-07:00
5950370178,Jennafhdhj,https://itunes.apple.com/us/reviews/id216318941,2.1.0,1,trash,"Wrong product, they have a online help “bot” that gives you literally no information just sends unnecessary messages that you already know. Medaykity is the website i ordered from. They sent me the wrong product over a month ago; i finally received it today. I didn’t open it due to to their return policy’s and have emailed them for 3 weeks now, the only thing they say is “the product you ordered is a different style then the original” i ordered a ELITE SERIES 2 XBOX CONTROLLER and they sent me a blue tooth controller for switch NINTENDO!!!!! They will not answer. Once i have sent them images of the product they were advertising compared to the product they sent me after they asked for it they won’t respond because they know they are in the wrong. I still haven’t heard anything back once i called them out on their bull crap. It’s been over a month now. The product is delivered, unopened, and ready to be returned. Let’s see if they send me their return address along with a refund as their “return policy” states.",https://itunes.apple.com/us/review?id=1223471316&type=Purple%20Software,2020-05-15T15:15:19-07:00
8513445368,Ikey412,https://itunes.apple.com/us/reviews/id955431194,2.49.1,5,The app is useless,"Everytime I order for somewhere and it haves me download this app for it I know I’m not receiving my item that I paid money for the 1st time I used this I ordered from a clothing catalog it said it was being delivered and I’ve never received it, second thing I ordered was a teddy bear for Valentine’s Day last year I’ve never received but it states it was delivered I never got a refund or knew what happened to that package, now I’m onto my final straw I ordered 2 gold chains for 400 bucks and it’s Marked as delivered and never received them I had to open a case with usps meanwhile someone else must be stealing, or sending them to the wrong address I hate this app with a passion and everytime I order something that involves this place I’m canceling for now on!",https://itunes.apple.com/us/review?id=1223471316&type=Purple%20Software,2022-03-30T14:44:47-07:00
8060139501,Eric Madrid,https://itunes.apple.com/us/reviews/id33503380,2.38.1,2,"Great, except often delayed. So what’s the point?","As much as I appreciate the UI and want to centralize my shipping updates in one place, it seems almost pointless to use this app for any current updates. I’ve found myself using the app, just as a means to access the delivery company’s updates. Because SHOP almost always shows me very outdated information. And this is with manually entered tracking numbers for DHL, FedEX or UPS. The app will be 1 or 2 updates behind, always. Manually refreshing doesn’t update the tracking info… but the tracking link directs me to the page with the current information.

For this app to really serve it’s purpose, the tracking notifications should at least mirror the delivery company’s currently available information. I’m sure it’s obvious, but I see it’s been an ongoing issue since the start. That gap in time with notification makes this app almost pointless.",https://itunes.apple.com/us/review?id=1223471316&type=Purple%20Software,2021-11-24T19:04:15-07:00
6294597348,Nomical,https://itunes.apple.com/us/reviews/id219222969,2.8.0,2,Used to be Great 5/5...now....,"I’ve had this app for at least a year. When I first got it I believe it was called something else. However, the shipping,tracking, notification, and delivery system were all very accurate and I loved it. Now not so much. Let’s first start with the fact that it now requires a gmail account for tracking? Not everyone uses gmail. And it worked perfectly fine without the use of a gmail account for tracking before hand. On top of that-if you try to add a gmail account (like I have on several occasions) no updates to tracking are done. I shop at small boutiques, and they don’t always send tracking information directly to the customer-they rely on apps like these to connect the dots. But it’s gotten to the point that both small boutiques and larger online retailers I am having to reach out and directly ask for my tracking information as the app no longer supplies it/updates orders regularly.",https://itunes.apple.com/us/review?id=1223471316&type=Purple%20Software,2020-08-08T04:54:51-07:00
6760220296,Snowleopard1995,https://itunes.apple.com/us/reviews/id86767260,2.15.4,1,TERRIBLE TRACKING AND FRUSTRATING TO USE,"I have never had more problems with a tracking app then I do with this one. I only ever seem to get things that track through this when I order something that is coming from overseas. Usually taking extremely long to get here so I am always curious as to see where it is and for how long. 
The tracking usually stops after “arrived at sorting facility” and then I may never get an update until it arrives.
 My most recent purchase gave me a number and the same thing happened. After it’s sitting at the sorting center for 20 days(omg whyyy!!!)I got a new tracking number from the company I had ordered my items from. I went to edit the purchase in the app with the new number so it would track the right one and it keeps reverting back to the original number. Or when I press update it never finishes loading.
 Extremely frustrating since I ordered my package nearly a month ago and I am still waiting for it and now can’t even see where it’s at.",https://itunes.apple.com/us/review?id=1223471316&type=Purple%20Software,2020-12-16T10:25:40-07:00
