id,userName,userUrl,version,score,title,text,url,updated
4879293089,Jim D4w6,https://itunes.apple.com/us/reviews/id501003599,1.4.2,5,Review regarding the App!,This app is awesome for the simple fact that if you’re a person that orders practically everything needed off the internet which most likely means there’s times you have multiple orders being shipped from different stores at the same time you can track them all by simply opening this app and adding the tracking number. Very straight forward app layout an very easy to navigate. Another great feature about this app is when I enter the tracking number it knows the store the order was purchased from and saves them for you so if you want to shop them stores again you can by the press of a button. All in all it’s a great app for someone that orders off the internet and the packages have the option to be tracked it can all be done in one place an that’s this app. 👍🏼👍🏼👍🏼😎,https://itunes.apple.com/us/review?id=1223471316&type=Purple%20Software,2019-10-03T12:07:42-07:00
10455783261,Kelthee,https://itunes.apple.com/us/reviews/id1486315382,2.128.2,2,Going down hill,"I’ve used this app for about two years I think? I just got off the phone with customer service because I was unable to use the four payment option due to my number not being up-to-date… Which doesn’t make any sense because it clearly is on my end. I humored them and “updated” it on the website and they told me that my old phone number is still on the screen. I’m not mad at them because they only did what they could but I’m mad at the developers of this app because lately it seems like this is becoming more of a hassle to use than a convenience. not only that, but I have made purchases continuously with the Shop pay option on websites with my card attached and when I go on the app and go to the Wallet section, my card is nowhere to be found. I don’t understand what’s going on. but I do know I will have to go download Afterpay because there’s no other way for me to do what I want to do now.",https://itunes.apple.com/us/review?id=1223471316&type=Purple%20Software,2023-10-09T06:51:03-07:00
7273257437,ougrad1764,https://itunes.apple.com/us/reviews/id19194850,2.24.0,5,"Great app, continues getting better","Tried a few delivery tracking apps over the years. This wasn’t my go-to at first, but now is the only one I use. I like that many of the online stores I frequent integrate with this app, and it seems quick to load and update. A few suggestions: toggle on/off map view with deliveries, as these take up screen space and not always useful; sort by real-time delivery date so easier to know at a glance what’s pending delivery for a given day; add share to Shop option from within Safari, such as sharing a page with tracking info and have Shop automatically detect and add to list (rather than manually copying and pasting). 

Keep up the great work, dev team. Thanks for making a solid app that continues getting better.",https://itunes.apple.com/us/review?id=1223471316&type=Purple%20Software,2021-04-28T04:54:09-07:00
5807605208,DM3524,https://itunes.apple.com/us/reviews/id501818587,1.11.0,5,amazing,"this app is THE APP for deliveries. way back when, i used to download so many different tracking apps, as one wouldnt have a feature that the other had (notifications, map, etc.). i tried this app and it was the tracking app to kill tracking apps. the interface is just beautiful. the layout isnt boring and its fun in its own way. the fact that it can detect deliveries on its own is just a breeze. its built-in map feature lets me keep track on where my packages are. the notifications are up to date and fun. when the packages deliver, the best part is the little confetti that the app gives you 💫. the only “problem” i have with the app is the colors. before, the app’s main color was blue. now its purple. it would be nice if the Arrive lets you choose between colors. besides that, everything is perfect",https://itunes.apple.com/us/review?id=1223471316&type=Purple%20Software,2020-04-13T16:36:54-07:00
6329799733,BabyBlue1718,https://itunes.apple.com/us/reviews/id279548222,2.8.0,1,More frustrating than helpful,"One of the sites I ordered from told me to use this app to track my delivery. Of course, it linked all of my incoming orders from other places which in theory sounds amazing! However, if you order more than 2 things max good luck trying to figure out which tracking number belongs to which order. My 2 biggest complaints with this app are as follows:
1. Only lists the tracking number, no other corresponding information about which package it is so I have to go to the original shop just to figure out what they are
2. The tracking is out of date. As of current it shows I have 4 packages; 1 delivered and 3 of which are in transit. This is annoying considering I should only have 2 so now I have to dig through all the orders to figure out which ones are accurate and relevant to me. 

Gave this app 1 star because as soon as my package arrives from the shop that required me to use this app I’m deleting it. Easier to track from each individual site and use their projected delivery date than use this app",https://itunes.apple.com/us/review?id=1223471316&type=Purple%20Software,2020-08-17T05:50:51-07:00
2713487012,Zacshann,https://itunes.apple.com/us/reviews/id208654064,1.1.5,5,A really beautiful package tracker,"This is a really great app. The UI is fluid and beautiful. It’s simple to pickup and use. I like that it pulls in shipments on its own and lets you add them manually in a pretty simple way. I really don’t have any outright complaints for the app especially with it being free. 

For the future (and I know in your FAQ you mention adding other mail providers) but I would like to be able to add multiple gmail accounts to search for shipments through. For example I have a primary and secondary gmail account and I buy products through each. So it would be nice to have Arrive see both accounts and either show all in one list or break them out (or both!) I don’t mind adding the less used accounts shipments manually as is. Just something to think about. 

Thanks for the fantastic app regardless! :)",https://itunes.apple.com/us/review?id=1223471316&type=Purple%20Software,2018-06-17T11:22:16-07:00
8824394826,n1883pino,https://itunes.apple.com/us/reviews/id41305723,2.62.0,5,So there I was,"It was 4 am in Las Vegas, I had been partying with a bunch of Japanese business men.  During this time all the pain killers wore off.  Mr. Nagasaki and I where playing Russian roulette with our business ties wrapped around our heads.  He wore red for good fortune.  I had my Oxford navy blue on that night.  It was my turn and I was not feeling lucky.  Click!  Not today Mr. Reaper.  Mr Nagasaki respected that I went 10 full rounds with him and didn’t show fear.  He claimed I had a warriors spirit.  We closed on the deal by sun rise we flew in a helicopter to Philadelphia to go and get some bagels that morning.  I then remembered I need to purchase an item and they asked me to download this app.  To be honest I really haven’t given it a try yet.  However,  I’m sure everybody at the company is proud of their product and so am I.  Five stars homies!",https://itunes.apple.com/us/review?id=1223471316&type=Purple%20Software,2022-06-29T19:38:30-07:00
6692537932,Liv_Luvs_BTS,https://itunes.apple.com/us/reviews/id994651737,2.15.1,5,absolutely perfect!!,"as an impatient kpop collecter, this app is so useful to me, not only do I get multiple notifications per day, but I also get to see exactly where my package is at any moment of the day!! I also love how shop automatically adds packages for you if you sign in with gmail!! you can also follow different shops near you, weather its online or in person!! sometimes notifications are delayed, but when your package arrives, shop makes sure that you get your notification as soon as it enters your house ( multiple occasions I went out to get my package and the mail lady was still there). I definetly would reccommend this app to anyone who orders a lot online, especially if you are impatient, because it is definetly reassuring to see how close your package is!!",https://itunes.apple.com/us/review?id=1223471316&type=Purple%20Software,2020-11-27T12:03:34-07:00
7439484031,kpc905,https://itunes.apple.com/us/reviews/id1254268794,2.26.0,1,App is useless,This app does the same thing that just have a tracking number from the shipping company does. Only difference is the shipping company is accurate within 24hrs normally. I have an order in this app that was delivered over 8 months ago the app finally updated saying it was delivered about a week ago. Also pretty apparent that you are collecting info for 3rd parties why do I need to give you permission to all my emails why not just allow me to enter an order number instead of giving the app permission to access all my emails and contacts stored in my email. This app does exactly what was already available with tracking numbers for packages now I just have to let you have access to my emails instead actual rating is 0 stars but apparently that is to mean in society today or so you get a 1 star participation trophy that I hope your dad immediately takes and throws in the trash and tells you how you don’t deserve it cause you didn’t do anything to improve on the world.,https://itunes.apple.com/us/review?id=1223471316&type=Purple%20Software,2021-06-07T20:22:32-07:00
5692899316,Pinkkarr,https://itunes.apple.com/us/reviews/id42825232,1.11.0,5,They Insist on Access to Your Email!! NO!,"I saw all the great reviews, downloaded it and the very first thing it is making me approve to move forward are three VERY DISTURBING things (this is EXACTLY word for word): 1) View your email messages and settings 2) Manage mailbox labels 3) Manage your basic mail settings. They are absolutely psychotic if they think they need to access your mailbox to the point where they can read your messages and even go as far as to change your settings!! I don’t see how this has ANYTHING to do with tracking my orders, and I don’t see how so many people have granted them this access either!! I scrolled thru some of the reviews and not one mention of this.. very odd and disturbing. This is WRONG on so many levels. If I could give them zero stars, I would. DO NOT GIVE ANY APP THIS TYPE OF ACCESS!!!",https://itunes.apple.com/us/review?id=1223471316&type=Purple%20Software,2020-03-21T10:56:51-07:00
4650094341,bryanmac111,https://itunes.apple.com/us/reviews/id121522379,1.4.0,5,Wonderful App with seamless interaction!!,"I downloaded Arrive about a year ago and have used it to track many items and it has performed amazingly. It was such a hassle to have to download the USPS, UPS, and other external apps to track my shipments. Also I hated having to type in that long tracking number. All of those problems were gone when I downloaded Arrive. It is synced up with my email so any orders with tracking numbers that are sent to me are automatically scanned by Arrive and put into a tracking format for me to view. I also love how the app shows where your shipment is located with the location list and the map. A must download for anyone who enjoys tracking their shipments or enjoys a seamless interface without having to manually do anything on their part (only pressing download)!!!!",https://itunes.apple.com/us/review?id=1223471316&type=Purple%20Software,2019-08-21T06:55:25-07:00
6791278604,SEA134035,https://itunes.apple.com/us/reviews/id108562108,2.15.4,1,Not accurate and mostly just ads?,"I was invited to download this app by another company to track the progress of an item. After downloading this app I still have zero information about the status of the item, and was mostly directed to buy more stuff from the company who hadn’t filled/delivered/lost (unclear) the item in the first place. 

But this could be the problem of the initial company who just hasn’t been able to fill orders so there is nothing to track - the reason I actually deleted the app was that I poked around to ses the information related to OTHER orders that had already been filled or I already was aware of their progress.  In those circumstances (not every purchase automatically appeared I don’t know why some did some didn’t) ever single status seemed be wrong. Etsy deliveries that I got months ago showed undelivered, “ordered on” dates were actually in the future (and, also strangely, showing as delivered).

The piece that seemed to work seamlessly was the interaction with other sites to buy products.

Perhaps by playing around and linking more information into this system things would get more accurate - however it’s difficult for me to justify investing that time when most companies are forthright about shipping delays (in the event you don’t have a tracking number) and entering a tracking number through USPS / FedEX / UPS is simple and straightforward and provides all the info you need.",https://itunes.apple.com/us/review?id=1223471316&type=Purple%20Software,2020-12-25T01:41:26-07:00
9638576281,yncyal2,https://itunes.apple.com/us/reviews/id135424967,2.92.0,5,30 Days to Receive My Order!,"I did not realize that I was placing an order from a merchant outside of the United States.  If I had known I would have never ordered.  It took exactly 30 Days to receive my order, which were (2) pairs of shoes. I received them today.  When I opened the bag both pairs of shoes smelled had a very strong smell of chemicals like the smell of gasoline. I am very concerned about the damage from these chemicals and what harm they could do to me if I tried to wear them.  They will be going to the nearest trash dump.  What a rip off!!!!  I  am surprised they cleared customs!  

I won’t bother trying to return them or request a refund.  I will however write a review on Google and notify the U. S Better Business Bureau that this merchants products are a rip off and a health hazard.",https://itunes.apple.com/us/review?id=1223471316&type=Purple%20Software,2023-02-20T15:42:58-07:00
7880304039,Erin Cocoa,https://itunes.apple.com/us/reviews/id855145765,2.35.1,5,Great app!,"I really like this app. When I otherwise wouldn’t have a way to see the status of my packages, the shop app is there so I can ensure everything is going smoothly. It’s very easy to use and I have had zero problems to date. I like scrolling through all my successfully delivered packages and feeling accomplished for buying things that make me happy. Whenever there’s any shipping issue, I know about it very soon after. I was surprised the other day when I bought something off of a very small website that had a weird way of paying that I’ve never used before and it pulled the information and found the shipping info! So if you’re wondering about getting the app, what are you doing? It’s a very useful tool, and you can help plant trees!",https://itunes.apple.com/us/review?id=1223471316&type=Purple%20Software,2021-10-05T03:31:32-07:00
10298872023,jennefier76,https://itunes.apple.com/us/reviews/id917769317,2.122.0,5,A great place to shop,"I have to say that first when I got this app I didn’t think it was gonna be much of anything! But right away I was amazed to see that you can find wonderful quality products and unique items that not everybody has. There’s many shops to shop through and many varieties of different things. My daughter has her own nail shop, and I find the most unique charms for the nails and the most unique possibilities for her shop for her and she is thrilled to see everything I get from SHOP! When I tell her, I got her new charm she’s always excited and Sesn are they from shop mom are they from shop because she loves the charm for unique designs I get from the house thank you shop for helping me by encouraging my daughter to stay an entrepreneur!",https://itunes.apple.com/us/review?id=1223471316&type=Purple%20Software,2023-08-25T12:55:39-07:00
10508349353,stefanoni123,https://itunes.apple.com/us/reviews/id638164255,2.131.0,1,Scam and waste of time for customers,I order from a website and to get tracking they said I needed to download this app. Then I have to create a login and provide access to my emails for some reason  (data mining). Most if not all email providers have automated package tracking. Every web based business is required to provide tracking details but this website that I guess uses Shopify in the background is telling you to go through this separate app to get updates. Then wants access to your email but gives no updates on tracking.  Like why do you need access to my email when you won’t even give me tracking information?? There is nothing in my email that they need. Just data mining people’s personal emails now.  Waste and a scam. Maybe other have reasons for using this app but for the purpose of what I think a lot of people want which is just tracking this is something that steals your data and try’s to up sell you additional products.,https://itunes.apple.com/us/review?id=1223471316&type=Purple%20Software,2023-10-23T15:22:47-07:00
9296298512,Jaxx0212,https://itunes.apple.com/us/reviews/id535223722,2.82.0,5,INFORMATIVE!! 👌,"I’ve had this app for a couple of years now and I love it. From the second I purchase anything online I get a notification from SHOP, about a package being prepared for me from wherever I ordered it from. I think that’s pretty decent! Once the company prints out the Shipping label to it being mailed out I’m informed on every move which is all I the information I wanted. Once it’s mailed out you can see in the map we’re your package is, so this way it’s impossible to have it go missing. I sell online and for me to have packages go MIA and it’s happened is just ridiculous and it’s all costly, but not with SHOP! I no longer have to worry about we’re my packages, and that’s exactly what I was looking for in an app. Thank you SHOP for putting my mind at ease!",https://itunes.apple.com/us/review?id=1223471316&type=Purple%20Software,2022-11-16T11:05:46-07:00
6231915514,Crystal at,https://itunes.apple.com/us/reviews/id459736553,2.6.0,5,Unexpected!,"When I first got this app I thought it was gonna be something was slow and complicated. It was not at all! This app allows you to SEE where your packages is on the map. It also throws glitter when you have received your item! I find that little detail delightful, with how the world is today a little confetti goes a long way! The app also allows you to turn off the confetti if you wish! Some of the deliveries may take a while but it’s not the apps fault it’s the handler of your package! So don’t blame SHOP. This app shows you when your packages has been shipped and also an estimated time for it to arrive. It’s as if you have a real time tracer on your package! I high recommend this app! I have only had it for a few days but I feel wonderful about it. It’s changed the way I see shipping!",https://itunes.apple.com/us/review?id=1223471316&type=Purple%20Software,2020-07-23T04:36:32-07:00
6643102834,DApple50000,https://itunes.apple.com/us/reviews/id29178189,2.14.0,1,"I just want to track my package, why do I need an account?","This app hassles your to create a sign in and sign up for notifications (both are unnecessary and can be skipped) before you can even see your tracking info. I don’t know who thought this was a good idea. It’d be better if sellers just linked to the delivery company’s package tracking page.

Edit: Shop claims in their response to this review: “The reason we ask you to sign up as Shop is much more than just a tracking app. It is also you're shopping companion to help you discover new brands.” This is laughable - nobody wants to discover new brands in a package tracking app. This is a blatant attempt to cash in on referral fees. My best guess is that the business model is that there is an exchange of value to the business using Shop for package tracking so that Shop can monetize you, the consumer, by collecting the information on all of the items you’ve purchased and using it to profile you. Seems like you should stay away from this app if you value your privacy.",https://itunes.apple.com/us/review?id=1223471316&type=Purple%20Software,2020-11-13T22:52:17-07:00
8416216495,Jmxcias,https://itunes.apple.com/us/reviews/id450172949,2.46.0,5,"Easy to use, great app","I’ve never gone out of my way to write a review for an app, but I genuinely appreciate the hard work these developers put into this app. The interface is very user friendly, everything is organized and easy to use. I’ve also been impressed with the accuracy and quality of the tracking system. 

As well as their quality tracking, I use the Shop Payment system as well. It is highly affordable and easy to use. I can make payments whenever I want, and the due dates for them do not change. We’ve all been tight on money before, but Shop makes it easy for me purchase gifts for my loved ones while still being a reliable and quality oriented app. If I could give it a 6 out of 5, I would.",https://itunes.apple.com/us/review?id=1223471316&type=Purple%20Software,2022-03-03T07:43:01-07:00
5225693770,23rtr23,https://itunes.apple.com/us/reviews/id238926852,1.6,3,Not as accurate as it needs to be on delivery status,"The updates on package status are about 24hrs behind. I’ll have received a package at my door at some point during the day, but when I check the app it says the package is still in a different  state in transit? I also wish it would show a picture of the item being delivered to be able to organize my end better to know what is coming to me at a quick glance. I also do not understand how it knows when I have a package coming since it doesn’t have me enter the info into the app. It does not always give me updates on every item I have coming to me? For example, I ordered something at a market fair with my credit card, and I have no idea when I will be receiving the item and the app doesn’t have it listed either? I think some things need to be worked out to more accurate and time efficient for users. Thank you for your time.",https://itunes.apple.com/us/review?id=1223471316&type=Purple%20Software,2019-12-02T10:04:47-07:00
9056503997,Jay_MP,https://itunes.apple.com/us/reviews/id524509667,2.72.0,1,Weakest payment installment option app,"I don’t usually write reviews, but stay away from this app. I have had countless times where I’ve tried to purchase an item by installment format, saw it was this app and it completely changed my mind on buying the item. I’d rather pay full price or not at all. It comes down to the simple fact it won’t even let you pay for it and scrambles to deny you a reason let you fix the reason to then repurchase, but as soon as you’re denied it won’t let you buy again. I’ve used Afterpay and Klarna - neither give me this problem, not as steadily as Shop. I’ve followed the issues whether it could be card, billing, or just account issues, but knowing I can do it any other application except for this one using those same aforementioned variables let’s me know the service is the only common problem. I wish retailers wouldn’t partner with them because it’s a shame there’s better options and they are using one that will repel buyers.",https://itunes.apple.com/us/review?id=1223471316&type=Purple%20Software,2022-09-05T18:23:26-07:00
8134201548,dajakaro,https://itunes.apple.com/us/reviews/id721927415,2.40.0,5,Denture Fit,"This product is the very best if you have to wear dentures. It makes wearing dentures a lot more comfortable because it is a soft liner and there is no need to use any of the paste products out there. It’s easy to use and if for some reason you have a problem there customer service is absolutely the very best I have ever worked with. They will put you in touch with a representative that will call you in the comfort of your own home and help you with any problems you have. The service representative that helped me was so kind and patient, his name was Bill and he was so easy to work with. Believe me when I tell you they have the very best customer service ever. At least try this product, you will not be sorry. And never hesitate to reach out for help.",https://itunes.apple.com/us/review?id=1223471316&type=Purple%20Software,2021-12-15T15:54:17-07:00
8059119202,mguelito8121,https://itunes.apple.com/us/reviews/id783826757,2.38.1,5,Everything,"This app is such a time saver . I used to order a lot more stuff before and it was a hassle figuring out when they would come etc . Now as soon as I order anything it goes through this app within a couple mins to at most a day . And gives you estimates every time you refresh instead of having to find a tracking number and then going to the carrier and wasting time when shop does it all for you . And for those people that are saying “ ohhhh it doesn’t give me a good estimate on when your package is coming “ ,Well it doesn’t  hurt to just check it how you would check it if this app didn’t exist . But this app is a time saver and I will continue on using this app for the long run . Highly recommended.",https://itunes.apple.com/us/review?id=1223471316&type=Purple%20Software,2021-11-24T11:21:36-07:00
