id,userName,userUrl,version,score,title,text,url,updated
5720999713,Ensray,https://itunes.apple.com/us/reviews/id316388405,20.13,1,Trash corporate monsters,"So they started off as a way to make some cash if you had a spare bedroom. Chill and low key. Then you start noticing in your trending neighborhood entire duplexes and apartments having a different guest every night. Then your cool little low key spot starts to have developers come in a remodel homes specifically for Airbnb homes but online the adds claim these developers lived in our hood for years and love the bodega on the corner. I don’t know who you Karen, I’ve never seen your high class here before. Then you try one of these new remodeled homes to put your parents up since you live in a barely affordable 600 sq ft home with spouse and two kids. When you help Gigi get her luggage into the 400$ a night swanky modern bungalow you notice an ant infestation. You call the SUPER host who doesn’t return call. You call Airbnb who tells you to contact host. Gigi goes to a hotel because of the ants infestation and Airbnb refuses to refund and the host blatantly lies. I live across the street Karen I saw you didn’t clean or check anything. I will not use them ever again. They’re ruining neighborhoods and lowering the standards of hospitality.",https://itunes.apple.com/us/review?id=401626263&type=Purple%20Software,2020-03-27T05:43:06-07:00
9201563877,sophiapyper,https://itunes.apple.com/us/reviews/id523742549,22.41,2,Losing Transparency to the Detriment of Guests,"The app used to indicate in the reviews when hosts cancelled reservations. No longer. My reservation was cancelled a week before my stay - no reason was given and I had to scramble to find an expensive backup. The app did not note this in the reviews so it is possible this host does this every time - it would be very valuable to know this as a guest as we had been planning this trip months in advanced and we would have booked with someone more reliable.

Cleaning costs have also gotten insane. These remain hidden until checkout, there is no way to filter for total price. Many hosts will still expect you to clean when charging $100 on top of the accommodation costs.

Used to love this app. May be open to it again if they fix some of the issues. But it is now full of unreliable hosts and costs as much if not more than hotels, while offering less consistency of quality and no amenities like cleaning. I’ll probably be switching back to hotels going forwards.",https://itunes.apple.com/us/review?id=401626263&type=Purple%20Software,2022-10-19T14:04:43-07:00
9019324154,R&R85,https://itunes.apple.com/us/reviews/id231156488,22.34,1,"Roaches infested rental with proof, no refund!","Drove 6 hours to get to a beach rental and after leaving to get groceries and returning to put them away, immediately noticed hundreds of baby roaches on kitchen counter, in drawers and in cabinets of rental. Adult roaches on walls and on floor and crawling on our room service we had just ordered on dining table. We immediately took photos and video of the infestation and called air bnb. Lady from India said we had two options.. leave that night for a FULL refund, or leave the next day for 20% off that nights stay. At this point it was 11 pm and we felt stranded with nowhere to go but after watching the bugs crawl through the plates and paper towels, we decided we had no choice. We packed up and left at 11 at night and left the condo looking for a hotel for an entire family. Reached out to let Air BNB know we had left and needed refund issued, they then decided to change their mind and said they will NOT refund money!? It’s the most insane thing I’ve ever heard and can’t wait to turn the evidence and proof of phone conversation in to my legal team. Unreal.",https://itunes.apple.com/us/review?id=401626263&type=Purple%20Software,2022-08-26T07:56:43-07:00
7569322590,Baylor98,https://itunes.apple.com/us/reviews/id162636814,21.27,1,This company condones extortion.,"Recently stayed in an Airbnb for the first time when we traveled outside the country. We had a great stay until we checked out and made our way to the airport for our return. We received a message from our host stating that there was additional cleaning needed and that there was damage to the apartment.  They requested $50usd in return they said they wouldn’t leave a bad review. I denied their request on the grounds that there was no damage when we left and that they didn’t send any physical evidence for such other than a receipt for 12,000cop which is about 3-4usd. The receipt had nothing on it that showed the cost of cleaning let alone 50usd worth. When I contacted support they informed me that until they write a review that there’s nothing they can do. It’s ridiculous that while the company has a written policy against this type of extortion it seems that it isn’t enforced and seems it isn’t taken seriously. I definitely would not recommend using them you’d be better off staying in a hotel. Definitely not a good first impression.",https://itunes.apple.com/us/review?id=401626263&type=Purple%20Software,2021-07-12T14:10:13-07:00
3060149917,Framly Disney Vacation,https://itunes.apple.com/us/reviews/id267809008,18.32,4,Amazing House! Great location!,"The home was awesome. Great location. Near absolutely everything i.e Disney, shopping, grocery and food. The house was very clean and comfortable. We felt really at home during our stay. The bed was comfortable and the carpet felt very good in between my toes 😊.  The kitchen was very clean. New appliances and clean refrigerator.  Easy to access with the smart lock. Absolutely loved that feature.  Every now and then you may run into an unwanted 4 legged guest but it’s hard not too because they’re everywhere in Florida....lol. 

Note to potential renters:  the house sleeps 🛏 10, however there aren’t enough towels for 10 people and absolutely no wash cloths are provided so bring your own because it’s not stated that they’re not provided.  Don’t forget toilet paper because there’s only one roll provided and you’ll go through that pretty quick with a house full.  It would also be nice if they provided dish soap because there are still some of us that actually washes dishes instead of using the dishwasher (soap provided for that). 

Overall the house was amazing and I’d definitely stay here again. The host is great!!! Very attentive and responds very quickly to questions and concerns. This place definitely get 2 thumbs up 👍🏽 from me and my framily (friends and family).

Items NOT to forget:
Trash bags
Paper towels
Extra towels
Wash cloths
Soap

Enjoy your stay because we did.",https://itunes.apple.com/us/review?id=401626263&type=Purple%20Software,2018-08-13T13:57:09-07:00
3173113191,emma13975,https://itunes.apple.com/us/reviews/id408467041,18.36.1,1,"Bad Customer Service, Only Avoids Responsibility","Reputation of a company is earned in crisis management.  Been a super host for a long time, and recently had a guest who left early and had reservation shortened.  We agreed with case manager to refund guest the rest of days the guest did not stay, yet somehow the case manager later cancelled the entire reservation and refunded the guest fully.  Now I’m left with no pay out for hosting this guest for days.  I’ve been contacting Airbnb customer service for quite a while, and the only response I got is that the case is being handled and they will reach out to me.  However, I never hear back from Airbnb within the time frames they promised.  I could never get in touch with the case manager who is working on this issue, and every time I called, representative on the call didn’t know what was happening.  I could only assume Airbnb does not want to pay host for hosting after Airbnb has mistakenly refunded guest in full.  If this is the way Airbnb chooses to treat hosts, I could only suggest other hosts to have a plan B, because once you run into a problem with any guest or with Airbnb, you are in it on your own.",https://itunes.apple.com/us/review?id=401626263&type=Purple%20Software,2018-09-09T18:31:31-07:00
3651303484,rrrripppedoff,https://itunes.apple.com/us/reviews/id593929985,19.02,1,Allows people to steal your money.,"I booked on a Saturday night for a week in Asheville. I got normal acceptance and thought I was done. Oh no, I get communication from the host that now I must go through their approval process. Very long drawn out list of rules and some where I was supposed to send them lots of personal info. They have already said I had the room and they have my money. I was confused because I am a senior and was trying to do this on my phone and was tired. I have never been asked anything like this before. I just asked them if I had the room or not and told them I did not not understand what they wanted. I told them I wanted to cancel and they said I still had a legal obligation to pay them even though they had never once said that I was “approved"" for the room. I complained to Airbnb and was told they would investigate. Nothing from them but the host has since messaged me and accused me of being drunk, insulted and berated me all because I said I would not sign their additional paper work agreeing to all kinds of stuff I have never been asked before. I think this is fraud and misrepresentation.",https://itunes.apple.com/us/review?id=401626263&type=Purple%20Software,2019-01-14T19:15:21-07:00
8009626345,emskeeeeet,https://itunes.apple.com/us/reviews/id125816621,21.44,1,I wish I could could ZERO stars.,"Would not recommend to anyone with even a little bit of a record. I’ve been using this app for years, stayed in plenty of homes and had wonderful experiences, had plenty of great reviews in result of these stays! Until recently when I arranged a reservation that had been confirmed, money was taken out of my account on top of a pet fee that was demanded while it was never mentioned.. which was also paid immediately. A couple hours later I get an email saying my account has been permanently terminated because of my “criminal record.” I have a petty misdemeanor from 2015 on my record, one more year and it’s OFF of my record. I understand if a background check had been performed BEFORE I’ve stayed in peoples homes and THEN being denied but that’s not how this went. I’ve stayed in several homes with no issues and hosts welcoming me back for future stays. I wish I could make sense of this all but sadly I won’t even waste my energy trying to appeal because this is just downright WRONG. Will take my business elsewhere.",https://itunes.apple.com/us/review?id=401626263&type=Purple%20Software,2021-11-10T10:20:23-07:00
6512148695,Mr. Facts Only,https://itunes.apple.com/us/reviews/id777124183,20.40,1,They don’t care about you,"I used this app twice to book reservations. First time 3 years ago for a place in Chicago. The place was filthy and did not at all look like the photos. I immediately left and cancelled the reservation. The week long battle with the renter that ensued was terrible. 0 support from airbnb resulted in me getting 10% back. That’s it, 10%. This obviously proves most people’s sentiment that Airbnb support only cares about the property owners and could care less about the people renting. The second time I used it I created a new account (I forgot about my previous one) and booked a reservation. I then was unable to find it and had to contact support to explain I created a new account because I forgot about my old one. They helped me deactivate the old account and all was well, or so I thought. I got an email and text notification 8 hours later saying my reservation had been cancelled and a refund would be issued. I then tried to log into Airbnb and my new account and my old account had both been deactivated. I’m never using this company again in my life. I’d give zero stars if I could.",https://itunes.apple.com/us/review?id=401626263&type=Purple%20Software,2020-10-07T19:55:38-07:00
5449507107,xxinfinity,https://itunes.apple.com/us/reviews/id23912193,20.04,1,Doesn’t care about sexual assault,I was the victim of sexual assault at an Airbnb location and was unfortunately more traumatized by AirBnB and law enforcement. I was put on extensive holds by Airbnb when I tried to report it even after I told them what happened. More than 15 minutes. And no one got back to me. I think they were just trying to get rid of me. When I emailed them after cancelling the reservation they sent me a very adversarial email demanding a police report and basically saying I was a liar. I actually went to the police and they didn’t want to deal with it and it was more traumatic because they didn’t think I’d drive back for the prosecution since I was from out of town and so they didn’t want to do any work on a Sunday when no one was at the office in this small town. I will never stay at an Airbnb alone and with a host again. And beware Airbnb doesn’t care about victims. FYI you can’t get a police report immediately after an incident and even so you just got a number for the report not the full report. They were obviously just trying to revictimize me with this ridiculous request.,https://itunes.apple.com/us/review?id=401626263&type=Purple%20Software,2020-01-25T20:36:05-07:00
4178694404,Fitty Cents,https://itunes.apple.com/us/reviews/id126402327,19.20,1,Shady and worst customer services,"Apparently allows the host to cancel the reservations last minute that can cause or mess up your vacation plan. Top of that customer services come up with complimentary coupons of $10-15 what a freaking waste of your money, time and more importantly your vacation precious times for which you have paid so much more than Airbnb reservation fees truly the worst customer services. I told them to keep $13 that was offered to me cause host cancelled my reservations at 6:30 pm when my check in time was 3:00 pm. I was told by customer services that this perfectly okay for host to do and they will give me $13 to make up for it. I had a toddler and my wife traveling with me I had to just cancel all my plans for the day and find another place at 7:00 pm so we can at least have a place  to sleep and pay premium fees for the last minute booking. Way to make money AirBnb your business and corporate policies will be shared with in my friends and family circle along with on social media. Hope you made money and also I know you guys don’t care much about your customers much.",https://itunes.apple.com/us/review?id=401626263&type=Purple%20Software,2019-05-19T20:46:40-07:00
2897377010,drod1020,https://itunes.apple.com/us/reviews/id429494475,18.28,1,They’re great... until you find yourself in a dump.,"Do not use Airbnb! I’ve been using them for years and did not have a problem until we recently checked into our Airbnb in Maui Hawaii. The place was riddled with bugs! They’re called coconut condos, do not stay there! Anyway, we had to cancel on the spot and Airbnb refused to refund my money. We couldn’t stay there, there were ants everywhere, I have video, but Airbnb didn’t want to see that. Then they closed my complaint ticket before we even returned from our vacation!! The told me in a message that the refund policy stated that there would be no refunds. This is all on top of us having to find a hotel to stay in the last minute. Then, THEN, after contacting AirBnB and telling them about the problem - THEY DELETED MY ENTIRE TRIP FROM MY PROFILE - which makes it impossible for me to go back and leave a review of the place we had to cancel because it was infested with bugs!!! I couldn’t even get arm others!!! AirBnB only likes great reviews I guess, but if you have a bad experience it’s “F*** you, no refund and you can’t share your experience.” Stick with VRBO.",https://itunes.apple.com/us/review?id=401626263&type=Purple%20Software,2018-07-12T22:46:47-07:00