id,userName,userUrl,version,score,title,text,url,updated
2461061487,Kylewade3,https://itunes.apple.com/us/reviews/id132163883,3.296.10001,5,Uber is unbelievablely unprofessional,"After studying for my Multivariable Calculus exam at an apartment near my college campus until 2 am, I called an Uber to go back to my dorm room. Uber informed me that the ride was 2 minutes away, but after waiting 10 minutes, the app had only gone up 6 minutes to a total of 8 minutes away. This compelled me to contact the driver, who was extraordinarily rude. This uber was extraordinarily unprofessional, had more than one of her own friends in the car, and talked to me in a condescending way when asking if she was alright and would prefer for me to find another ride. She then continued to drive away and lengthen the time of pickup after responding to me “we good you’ll be straight” after asking if she was okay and whether she’d prefer me to calm another ride. Because of the unfriendly system of the uber app, I was never able to contact the company in order to report the driver, while it was a major annoyance for me, it wasn’t the end of the world. But I want to report this driver for being unprofessional and Uber does not give the opportunity to do that, the app does not support the customers or even try to. Use lift whenever you can.",https://itunes.apple.com/us/review?id=368677368&type=Purple%20Software,2018-04-24T00:18:12-07:00
10196037178,No Longer Happy With Uber,https://itunes.apple.com/us/reviews/id380075744,3.572.10000,5,Not a good pickup,"Thalis pulled into parking lot as I was waiting outside doctor’s office, but didn’t pull over to me and didn’t identify herself. She sat in her car facing me so that I could not see the license plate. She didn’t call or text me. I eventually figured out she was my Uber and got in the car. It smelled like fish. When I tried to use the seat belt I couldn’t find the buckle as it was tucked away down between the seat and the door rather than at the top of the belt where it usually is. After what happened next I have to presume that a prior rider had given up trying to use the belt and just left it alone without putting it back in proper position. After I had finally found the buckle, it wouldn’t fit in the lock. Thalis asked me to move to the other side of the seat behind her. I did so and found the buckle right away, but still had some difficulty getting it in the lock. There was no apology. Now I find that she charged me $1.08 for “wait time”. This charge is ridiculous as I was outside and she didn’t identify herself or ask my name. I was the only person there. Who else would be outside in 90 degree heat?!",https://itunes.apple.com/us/review?id=368677368&type=Purple%20Software,2023-07-29T08:32:42-07:00
7985502137,AmazingMiami,https://itunes.apple.com/us/reviews/id108539210,3.482.10004,5,Terrible service with scam variable pricing,"The situation with Uber has gone out of control. They will hire anybody to drive, I have often been the victim of scams by Uber drivers. They claim to have arrived, they never arrive and then they claim a cancellation fee. I had also had a driver try to get paid for a ride she never arrived for by claiming I wasn’t wearing a mask. I was wearing a mask and she never even arrived. Took me several messages to get my money back. 

The other issue is their so called ‘variable pricing’. Everybody is up in arms here in MIami as they hike their pricing through the roof every time they feel demand is going to be higher (during events or the busy season). So for a ride that’s usually $5-7, they will ask upwards of $50!!!! I have repeatedly talked to Uber drivers about this and they have disclosed that over 90% of the inflated price goes to Uber and very little to the driver. So essentially they are taking advantage of both customers as well as their employees. 

I have now installed Lyft and I made that my go to app. Uber should be shut down, they are abusing their market power and behaving like a monopoly.",https://itunes.apple.com/us/review?id=368677368&type=Purple%20Software,2021-11-03T12:36:38-07:00
9689141650,Zoë Monet,https://itunes.apple.com/us/reviews/id141765985,3.552.10002,2,Over This App.,"I’m honestly starting to reach a breaking point with this app. I’ve been an Uber user for years and I’ve seen it go from a reliable and affordable option to the opposite. Not only is the app wildly overpriced for the distance you are traveling, but because of the way cancellations favor the driver you can’t reliably plan your trip at all. I have been late or have completely missed opportunities or appointments because drivers will cancel the ride if they don’t like the direction you are going. This is completely unacceptable in my opinion. The way I see it, you are providing a service and this is what you sign up to do. I as a customer have to pay a premium to get anywhere and I find it so frustrating that I can’t rely on a driver to actually pick me up. Several times I have waited over 20 minutes just for a driver to cancel on me. It makes the app unusable. There should at the very least be a maximum number of times a driver can cancel rides per hour or something to mitigate this. It’s so frustrating and I don’t even want to continue to spend my money on this anymore. At this point, I can’t even get a driver most times unless I wait 15 minutes for someone to accept the ride. It is beyond frustrating and I am at the point of deleting the app entirely.",https://itunes.apple.com/us/review?id=368677368&type=Purple%20Software,2023-03-07T08:42:37-07:00
8548493966,NovaRae24,https://itunes.apple.com/us/reviews/id186691145,3.504.10003,3,Decent but could be better and safer for riders,"Overall Uber is convenient and easy to use however I feel they do have some room to improve for the rider and driver’s benefits alike. I do like the share your ride feature. I do however wish you could see maybe traits on your driver like if their smokers or have any tickets or are safe drivers etc. I also believe Uber could benefit from a request box or options for when you book a ride. For example you could offer a quiet ride for those who have social anxiety and prefer to not converse, as well as a low sensory feature for those individuals who suffer from sensory overload and other similar triggers. This would make your service more accessible to all rather than few. Another great addition would be love agent texting through the app if the passenger(s) feel unsafe at anytime. That way they could walk you through the proper steps and alert the proper authorities if needed for you. Again Uber overall is a convenient and easy to use app but when it comes to reliable and safe ride service for all it has some room for growth. I will continue using because I need a ride to work once a week but I do look forward to seeing them attempt some improvement.",https://itunes.apple.com/us/review?id=368677368&type=Purple%20Software,2022-04-09T05:26:33-07:00
7957404080,Will Ungs,https://itunes.apple.com/us/reviews/id110498345,3.481.10002,2,APP BUG,"Bug 1: I use the app multiple times a week for business reasons and it is great for the most part, but there are some issues… Every week, I reserve multiple rides in advance, and the app prompts me to “reserve another ride” as a shortcut option; however, it never actually lets me reserve another ride when I push that button and I always have to go all the way back to the main menu and start from the “where to?” bar. Minor issue but it becomes tedious when reserving 5-10 rides at a time every week. I hope that the Uber app developers fix this bug soon as it has been like this for a few months now.

Bug 2: Today my driver was early for my scheduled ride. Therefore, I was under the impression that I could perhaps leave work early and get to my destination a little faster. However, instead I sat in the car with my driver for more than 5 minutes before we left the pickup spot because the app does not let the driver begin the ride more than 10 minutes before the scheduled pickup time. I do scheduled rides 6-10 times a week and many drivers have shared all sorts of problems they are having with the scheduled ride service. Your drivers (especially as contractors) should not have to apologize to me for problems associated with this app. Please fix this ASAP!",https://itunes.apple.com/us/review?id=368677368&type=Purple%20Software,2021-10-26T17:03:41-07:00
7155638929,admarprim,https://itunes.apple.com/us/reviews/id1274108698,3.449.10004,2,Expensive,"I’ve been riding with Uber for about 2-2.5 years now. It keeps getting more and more expensive making it harder to reach destinations. If you wanna go 10 min down the road it is $20-$34. The app says it’s cuz they are busy so fares are higher but it makes it extremely difficult for me the rider to get to places as I don’t have that money to pay every single day so I can get to work. I used to pay $8-$12 sometimes $15 just to go from my house to work and now I can’t even afford to go to work. It isn’t that helpful. While I understand the drivers need to get paid, the more expensive you create ur prices the more you will lose customers because nobody can afford to pay that much 5 days out of a week just to go to a job to support themselves. I literally sit on the app for 3 hours hoping the prices will decrease and change but they don’t they just get higher and higher every time I open the app. I can’t keep riding with a company that wants to charge me $30 every time I need to go 10 min down the street for a job to create a living. It is not affordable and is stressful when you can’t get a ride when you absolutely need one. When Uber first came out I liked it, now everything is extremely expensive and it takes forever just to get a ride. I will wait 30min for my ride to drive over to me to get me.",https://itunes.apple.com/us/review?id=368677368&type=Purple%20Software,2021-03-28T11:11:16-07:00
3715623859,beagle 777,https://itunes.apple.com/us/reviews/id653470337,3.336.10001,1,Reasons why I won’t use Uber again,Most of the times when I request a Uber the driver never shows up then they usually call me to tell me to cancel the ride if a customer cancels a ride Uber charges you for the ride regardless so that is the new way for these drivers to rip people off I spent a whole hour plenty of times trying to get a cab through Uber definitely won’t be using this app anymore and switching over to lyft or Juno the other day a driver refused to let me in the vehicle for no reason whatsoever pretty sure it’s cause I’m colored and he picked me up in a industrial area I was just getting off work once he saw me standing there he locked the doors as I was walking to the car then drove off Uber still charged me for the ride even though I never entered the vehicle when I reported it to Uber all they did was give me $5 credit on a $13 ride also most of the Uber drivers don’t even know the areas they drive unlike a yellow cab in nyc you won’t deal with them not knowing a area majority of Uber drivers in nyc don’t speak English and don’t pay attention to the signs or the roads Uber is a highly disappointing app I recommend all first time customers you are better off using lyft or Juno I have the worst experiences always with those Maniac Uber’s constantly texting and getting into car accidents it’s ridiculous my Uber rating is 4.94 yet I’m always getting bad drivers,https://itunes.apple.com/us/review?id=368677368&type=Purple%20Software,2019-01-31T00:54:26-07:00
2326054646,SubtlyObvious,https://itunes.apple.com/us/reviews/id342005828,3.290.10002,2,Used to love,"I take uber a lot to get to and from work, now I don’t even like using it as much anymore. It’s gotten more expensive for me. I can’t even afford it anymore. Lyft definitely has the more competitive option. Plus it is a lot easier to get in touch with a customer representative when I have issues. I always have to argue through emails with Uber because it seems like none of their reps know what they are looking at or understanding half the time. It’s such a pain to deal with. Why make it more difficult for users? It’s even worse when the app glitches. From did the driver even start the ride to I had to cancel the trip just for it to end the actual trip. Then the times where the app wasn’t working at all. Period. Oh, don’t let me forget about the drivers I’ve gotten as well. Made me question as to whether Uber will take just anyone as a driver. I’ve been harassed and money stolen off of trips and have reported it NUMEROUS TIMES,  but that seems to not get me anywhere. 2 stars. Financially crippling for those who have to take uber, but no longer can afford it for work. Awful customer service, especially when you need to get things done, response time is the worst. App glitches, OFTEN. No point on constantly updating when it doesn’t even change. Drivers that shouldn’t even be exposed to people.",https://itunes.apple.com/us/review?id=368677368&type=Purple%20Software,2018-03-20T02:48:17-07:00
10583630761,Megan unsatisfied customer,https://itunes.apple.com/us/reviews/id598660647,3.586.10001,1,Uber delivery,"I used Uber delivery today for the first time. I made the mistake of checking the box accepting responsibility for my items if they get stolen. Unfortunately Uber seems to be a master of deception and defends their employees. As long as the car was at the location of the gps they say it’s not their responsibility. The driver left my items at the wrong apartment. Didn’t even leave it at the same apartment complex. She delivered it at the townhomes on the other side of the highway. My brother spent over an hour on his bicycle locating my items. With nothing to go on but a picture taken of the floor mat. Couldn’t have At least gotten a shot of the unit number. Because they knew it was the wrong location and that Uber wouldn’t hold them accountable they just abruptly cut off communication with me because they knew they did wrong.  Mind you I stayed in communication with the Uber driver the entire time and clearly stated my correct building number and unit number. 
Oh but Uber can just say they were at the location. Close but across the highway? Seriously. Yea they were close but definitely the wrong location. 
Uber has no problem with this kind of service. I contacted customer service 3 times and they repeated to me that I’m responsible because I accepted responsibility which I didn’t see another option. Hopefully Lyft has better service.",https://itunes.apple.com/us/review?id=368677368&type=Purple%20Software,2023-11-13T21:29:13-07:00
5231247987,😡👏😡,https://itunes.apple.com/us/reviews/id983072912,3.378.10002,1,Unfair,I feel that Uber should change the age limit for Ubers. Some parents send their children in Uber/lyfts because they do not have transportation. By changing the age limit to ride in a Uber causes kids to NOT have any transportation and to not be safe outside in the cold without a ride/walking in the dark. You are also putting their lives in danger because the ride was already ordered and they have no way to get home. Uber DOES show the location on where you are at anytime. Uber DOES show how to share your location as WELL AS A SAFETY MODE. Uber does all these things for adults why can’t they do it for children(teenagers) too? They are still making more money AND WHEN YOU REFUSE THE RIDE YOU CHARGE $5.00. If you are going to charge $5 as a cancellation fee you might as well just allow them to ride. It’s also wasting time when the Uber driver IS ALREADY THERE then refuses the ride due to being a minor. I don’t think children should be allowed to make an account but be able to get in a ride to get home. I’m not saying “don’t take Uber” but I feel that some of their rules are unfair. “We will Uber to your place. Be right there.” Yeah you’re right there but you’re refusing me a ride home. I don’t think anyone under 10 should be getting in the car with a stranger but TEENAGERS. From 13 to beyond should be allowed to ride in Ubers. So they have a place to go and the parents won’t be worried.,https://itunes.apple.com/us/review?id=368677368&type=Purple%20Software,2019-12-03T22:41:21-07:00
9009487542,Harp9555,https://itunes.apple.com/us/reviews/id292202862,3.524.10000,1,Poorly Run from the Top,"I’ve been using Uber for many years, and while I’ve definitely had some horrendous experiences with getting refunds for falsely reported damage, I’ve always held that the app is great. It provides a great and reliable service. 

Lately, however, not only have prices been going up at a ridiculous and unsustainable rate, the framework for drivers being assigned rides has worsened. I talked with a driver recently and learned that instead of Uber assigning the closest driver for your ride, they allow drivers to snag up any ride on a first come first serve basis, regardless of their distance from the rider. This has resulted in ridiculous wait times for rides, to the point that I’m waiting 25 minutes for my driver to arrive for a 10 minute drive. Uber allowed me to cancel my ride in lieu of requesting a new driver once, but that was the only grace. Now, I am forced to wait ridiculous wait times for short drives unless I want to pay a fee for cancelling the ride and looking for a new driver. 

I’ve had to rely on Uber lately because I’ve had car issues. With the prices increasing and the wait times worsening, I’ve finally branched out and found other ride share and taxi services as an alternative to this app. I will continue to do so, and encourage others to do the same, until Uber addresses these issues and provides a resolution.",https://itunes.apple.com/us/review?id=368677368&type=Purple%20Software,2022-08-23T12:20:42-07:00
5250529065,Kindergarten Wrangler,https://itunes.apple.com/us/reviews/id499783134,3.381.10002,1,Time Estimates 30 minutes later than expected. Horrible Customer Service,"Every time I have used uber, I’ve learned that the “estimated” pickup and arrival times have been falsified for appeal. For example, my uber was supposed to come in 9 minutes, it arrived in 22 minutes. Therefore, we were late arriving to our destination over 30 minutes. There wasn’t much traffic at fault. Our driver was choosing and switching music on his iPad while he was driving. This ride cost over $23 for myself only. There were 6 other people in the car. The driver had the audacity to ask for a 5 star rating. Once I told him he did not earn a 5 star rating, he low-balled me! Now my overall uber rating is a 4.8! However, 4.8 and still can’t get customer service. I did email with Karen and Sara, so you know who to avoid in customer service.

Contacted uber support, as always, they did not do anything to solve the issue or follow their own standards and give me a refund. If the arrival time is over 5 minutes of the estimated time, their policy is to issue you a refund. They never do. 

I have heard rumors that people receive their refunds quickly, or get great customer service, but those rumors are false. Through research, no one I’ve even met had received even mediocre customer service. The great reviews online and in the store are actually paid or otherwise enhanced with perks and such.",https://itunes.apple.com/us/review?id=368677368&type=Purple%20Software,2019-12-08T18:13:51-07:00
3483071682,zoe.2222,https://itunes.apple.com/us/reviews/id172315296,3.327.10002,1,My Uber’s have now picked up the wrong person twice,"The Uber pool system definitely has some issues. To start, my Ubers have picked up the wrong person twice. A week ago my Uber picked up the wrong person, let them change the location of their drop off, and then charged me for the extended trip. Having used Uber many times before, I assumed it was a fluke and contacted Uber and received a full refund. However, this happened again today! This time I knew better and canceled my ride, right when I got the notification that I was on my way when I was still waiting on the curb. I got charged a cancellation fee, because I canceled mid trip. I tried calling the driver multiple times to no success, and was forced to contact Uber AGAIN. 

While Uber’s costumer service has been satisfying in the way that I have gotten my money back, the amount of time I have wasted these past few weeks has been irritating to say the least. I have spent at least an hour waiting for Ubers that weren’t coming, and trying time and time again to call another Uber. I have been late to several events because of this, and have been forced to use Uber x instead of Uber pool because my pools have canceled on me or taken the wrong person. Uber has been a waste of money and a waste of time, and it doesn’t help that they don’t have a costumer service line so I can talk to a real person.",https://itunes.apple.com/us/review?id=368677368&type=Purple%20Software,2018-12-01T16:14:35-07:00
3471267748,zaivek21,https://itunes.apple.com/us/reviews/id201475347,3.327.10002,2,Over charge for Delay!!,"The Uber driver that picked-up my trip had an estimated time of 6 minutes and the main reason for me to request a cab was because I was running out of time and the driver didnt arrive on time but in 12 minutes. That is a huge difference for a wait time. If I had cancel the trip because my driver was taking longer than I would have been charge a fee. How is that fair? On top of this, I had to change my destination so a re-arrange the new address but, the driver took twice the time which charged me an exaggerated amount for a faster drive. Why does it happens like this if besides taking long for it to arrive for pick-up and longer time for the trip I get charged more!! That is no help at all!! Not convenient at all!!! Uber has to be more conscious on the availability of cancellation of a trip if driver is taking longer!!!!! 
So, as well as there are benefits from using Uber there are some inconveniences. The most outstanding one I will say that is the estimated arrival for a pick-up. The app should not allow drivers to pick-up a trip of more than 5 minutes or even just 5 because it usually takes at least that or more. That is a waste of time as a customer since one of the main reasons we might be using this service is because we are in a rush, so we don’t have that time.",https://itunes.apple.com/us/review?id=368677368&type=Purple%20Software,2018-11-28T13:59:41-07:00
3113277638,Janeth 'too beast' Silva,https://itunes.apple.com/us/reviews/id230553649,3.313.10001,1,Angry customer,I just went through the most frustrating situation and uber did nothing. I ordered an uber to get to work just like I do every other day with 30 mins to spare to get to work on time (it only takes 12-15) mins to get to my job) once I got matched with a driver it let me know the ETA was 2 minutes. well first of all the uber driver could not figure out how to get to my location he did so many rounds by the entrance but never thought that’s where he should go I messaged him through the app to explain a little better that’s the entrance he should go through but disregards it then he finally calls me (this is already 10 mins into me requesting an uber) and asks where to go I talk him through it and says ok I’ll be there in a minute again he does two rounds but doesn’t go into the street I told him to another 5 minutes pass and finally I see his suv arriving a few feet away from me I go out into the street making it obvious I’m there and he just does a u turn and goes back to where he came from and cancels my ride. Are you friken kidding me I’ve already lost 16 minutes and they charge me a $5 cancellation fee when I didn’t cancel anything ! I disputed and they returned the $5 but how does this help me ? You’re just returning 5 that were already mine and now I’m late to work I should be getting a discount or 5 dollar for you cancelling my ride this app is THE WORSE APP!,https://itunes.apple.com/us/review?id=368677368&type=Purple%20Software,2018-08-25T10:35:55-07:00
8247684109,SpeedSkills,https://itunes.apple.com/us/reviews/id1365859687,3.492.10000,1,Be careful,"I was hesitant to book an uber bc of all the horror stories I heard about Ubers stealing credit card info, drivers kidnapping, robbing, and even raping customers but my husband and i needed an uber bc we were going out in Nashville the drop off went well nice driver clean car decent price but when it was time to pick us back up the app gave us a different driver we were out waiting on our ride freezing my phone ended up dying the driver never showed we walked a few blocks and found a way to charge my phone as soon as it came on it said the Uber cancel the ride and still charged me i Blamed it on my phone dying and just booked another ride it charged $50 more than the last Uber but I was desperate freezing and I just wanted a ride so I booked it we still waited almost an hour finally the driver came he was great but I had to ask why is this ride so much more he said when it’s a high demand for drivers the prices goes up RIDICULOUS I tried calling Uber to say we were at the pickup location and the driver canceled the ride we couldn’t get anyone on the phone for customer service and the app is automated responses can’t say I want use an Uber again bc I travel a lot but I do hope you guys do better with a rider being able to call from a different phone if their phone dies also the price changes aren’t fair",https://itunes.apple.com/us/review?id=368677368&type=Purple%20Software,2022-01-16T08:36:58-07:00
