id,userName,userUrl,version,score,title,text,url,updated
5455994693,Cflash212,https://itunes.apple.com/us/reviews/id8272531,6.3.27,5,"Pretty good, very surprised","This is a pretty great alternative to Google Authenticator. And it adds backup capability that Google Authenticator frustratingly lacks. The only thing I’d wish for is for the countdown clocks to turn red or something when time is about to expire like gauth does. But, otherwise, this app is perfect.",https://itunes.apple.com/us/review?id=983156458&type=Purple%20Software,2020-01-27T12:13:24-07:00
9842946992,not a bublaniac,https://itunes.apple.com/us/reviews/id1039985369,6.7.7,1,Very buggy. Don’t understand how this is released as is,"Found this app to be very buggy. Sometimes number matching notifications just do not work and only resolution is to uninstall/reinstall app. Why can’t MS fix this app?

Also in no way do notifications work for iOS. I can’t understand if this is intentional design but forcing a user to manually open the Authenticator app is user hostile design and bad UX. Ms needs to do more to improve the sign in experience.",https://itunes.apple.com/us/review?id=983156458&type=Purple%20Software,2023-04-20T13:15:51-07:00
9653836010,Timbofosho,https://itunes.apple.com/us/reviews/id246653525,6.7.5,3,Watch link broken again,"Suddenly unable to use my AppleWatch to authenticate again… It’s NEVER intuitive to try to figure out how to fix that broken connection! I get an alert on my watch, but all I can do is “dismiss” it! What good is that?! Sigh. Guess I’ll switch everything to Duo… it never has a problem working on my AppleWatch.",https://itunes.apple.com/us/review?id=983156458&type=Purple%20Software,2023-02-25T04:55:24-07:00
9590205012,Sleepy Possums,https://itunes.apple.com/us/reviews/id70019648,6.7.3,2,Bring Apple Watch Functionality Back!,"It didn’t work 100% of the time, but removing this functionality has been really frustrating.

I don’t always have my phone within reach and expediting the “Approve” process is important. 

I don’t know what your reasons were for removing it, but as long as they weren’t security related this feature worth the hassle.",https://itunes.apple.com/us/review?id=983156458&type=Purple%20Software,2023-02-06T10:24:29-07:00
7194426583,jmsjdu,https://itunes.apple.com/us/reviews/id1103421167,6.5.53,1,You’ll regret it,"This thing has my email messed up. I switched phones and was careful to switch all info and passwords to the new phone before resetting the original phone. Everything EXCEPT this app now works. It won’t sign it. I can’t use it but now my Microsoft outlook is linked to an app that doesn’t work. So I’m about to have to agree to 30 days of no access to my email, during tax season, in order to reset my password manually. Sorry I ever downloaded this thing.",https://itunes.apple.com/us/review?id=983156458&type=Purple%20Software,2021-04-07T07:28:25-07:00
7391252661,tp676555,https://itunes.apple.com/us/reviews/id1293449887,6.5.63,2,Not backing up mfa qr accounts,Only thing that’s backed up as the passwords. I lost access to the phone and then we got a new phone and install the authenticator it’s missing all the MFA accounts. Even with the Microsoft account connected to it relinking to the account didn’t bring back all the QRAuthentications.   It was a huge problem and wasn’t able to log into many accounts for days,https://itunes.apple.com/us/review?id=983156458&type=Purple%20Software,2021-05-26T09:53:17-07:00
3480071596,Jonny Champ,https://itunes.apple.com/us/reviews/id309751865,6.1.3,5,So much easier and faster,Just takes the multiple steps of security steps by using the app is great. Especially if you make your accounts a little to secure Authenticator just helps you add encryption for more security but easier for us users.,https://itunes.apple.com/us/review?id=983156458&type=Purple%20Software,2018-11-30T22:40:16-07:00
10289294871,Nigoda,https://itunes.apple.com/us/reviews/id121985161,6.7.13,1,Recovery doesn’t work,"If you lose your device, you can not recover even if you did backup your Authenticator using the iCloud backup feature.  Once recovered you have to rescan QR codes for every account you have entered… which you can’t do because you need MFA to get into any of them.  Pointless to have a backup of your Authenticator when recovery requires you to have a working Authenticator to do a full recovery.  Use this app with caution!!",https://itunes.apple.com/us/review?id=983156458&type=Purple%20Software,2023-08-22T22:06:00-07:00
8455786167,cairastravis,https://itunes.apple.com/us/reviews/id146465580,6.5.88,2,Apple Watch companion app broken,"I was happy with this until I bought an Apple Watch. Then I discovered that the companion app running on the Apple Watch is broken: most Authenticator requests approved there fail. So, instead of being a nice convenience, it instead sabotages the whole experience. I am deleting the companion app from my Apple Watch, but there’s no excuse for it being so badly broken.",https://itunes.apple.com/us/review?id=983156458&type=Purple%20Software,2022-03-14T12:53:51-07:00
8445152254,tjtjjtjt,https://itunes.apple.com/us/reviews/id133128985,6.5.88,1,It won’t go away,"I was asked to download a specific app in. Order to complete access I needed. Despite typing the exact name of that app into the App Store search, this came up first. I downloaded it and started a free trial before I realized my mistake. All that is obviously my fault. What irritates me is there is no obvious way to cancel. The instructions I found say to go to Account Settings and disable auto-renew. Except I don’t see an auto-renew in the account settings.",https://itunes.apple.com/us/review?id=983156458&type=Purple%20Software,2022-03-11T14:37:39-07:00
7825164072,ajacks1234,https://itunes.apple.com/us/reviews/id932417681,6.5.82,4,Very solid app,This app is very well put together and works exactly how you’d need and want ur Authenticator app too work! The only thing that could be improved to get a 5 out of 5 is fix the problem which is app would freeze for a split second and,https://itunes.apple.com/us/review?id=983156458&type=Purple%20Software,2021-09-19T23:01:38-07:00
6460473028,Me2x2,https://itunes.apple.com/us/reviews/id24743932,6.4.26,1,Worked well until iOS 14 update,"The app still works well, however the watch approval for office 365 account approval has stopped working both for my business and for my personal 365 accounts. Both accounts show up on the phone and watch, and I get an alert on my watch to approve the login, however I get a message on my watch that “something has gone wrong”. I have removed both the App from my watch and my iPhone. Otherwise worked great to approve login!",https://itunes.apple.com/us/review?id=983156458&type=Purple%20Software,2020-09-23T09:35:09-07:00
3693831580,Jane Average,https://itunes.apple.com/us/reviews/id140019722,6.1.11,2,Needs to coordinate updates with Outlook,"Every single time I update my Outlook password (as required by my job), Authenticator stops working and I get an error message to contact support. And every single time we do the “turn it off/turn it back on, uninstall/reinstall” dance like it’s 1994. And EVERY SINGLE TIME, nothing works, they are bewildered... and suddenly an Authenticator update hits and it’s magically fixed. SO MYSTERIOUS. It’s the same company, it shouldn’t be this hard!",https://itunes.apple.com/us/review?id=983156458&type=Purple%20Software,2019-01-25T11:44:18-07:00
1898381119,j_rath,https://itunes.apple.com/us/reviews/id634735119,5.4.5,5,Great update,"Before this update, when using 2 step verification and having to approve a sign in you would have to manually open the app to click approval, now the approval notification pops up instantly. Great app that keeps getting better",https://itunes.apple.com/us/review?id=983156458&type=Purple%20Software,2017-11-04T21:43:10-07:00
9786776631,PeytonpReviewNickname,https://itunes.apple.com/us/reviews/id1434010542,6.7.7,5,Please fix this issue,It’s a great app it’s reliable and always works but I have one issue with it I just got a new phone and signed in on the authenticator app and I didn’t transfer all my authentication codes,https://itunes.apple.com/us/review?id=983156458&type=Purple%20Software,2023-04-04T11:00:43-07:00
10261143301,Dudeonthebayou,https://itunes.apple.com/us/reviews/id163923587,6.7.13,3,Great overall Authenticator,"This is a great overall authenticator. However, I wish that you would be able to create groups for different codes. If you have a huge organization, then you might need to divide it up into groups, so please, Microsoft allow us to create groups within the authenticator.",https://itunes.apple.com/us/review?id=983156458&type=Purple%20Software,2023-08-15T08:29:59-07:00
10055024653,Andreroshane,https://itunes.apple.com/us/reviews/id516153659,6.7.11,1,Failed when it was needed for its purpose,"I have had this app for years, in fact since it was newly released to the point where I was my Authenticator across the board. Issue now is my phone failed and had to switch devices. Being I used this app as 2F EVERYTHING goes to it and despite doing a backup. It ONLY restored one account which is outlook. So now I’m royal ly screwed, good and proper locked out of all my other accounts….thank you…lesson learnt",https://itunes.apple.com/us/review?id=983156458&type=Purple%20Software,2023-06-20T15:58:01-07:00
10517637771,sttub wubbz,https://itunes.apple.com/us/reviews/id1387382321,6.7.17,5,Super Simple,"This app is extremely easy and simple to use.  I have had no issues with it at all.  And I also like the fact I can use apps that aren’t always just Google all the time, lol.",https://itunes.apple.com/us/review?id=983156458&type=Purple%20Software,2023-10-26T08:09:04-07:00
7362051056,johaed,https://itunes.apple.com/us/reviews/id806018812,6.5.63,3,Apple Watch approve access not working,Hello.. after updating my iPhone and Apple Watch to the lates IOS now is not syncing when signing in . When I enter my email password then it shows the notification on my Apple Watch to approve and deny but after approving it doesn’t open my account . Only works if I approve from iPhone . Please help .,https://itunes.apple.com/us/review?id=983156458&type=Purple%20Software,2021-05-19T11:23:43-07:00
6760749196,bkdsj,https://itunes.apple.com/us/reviews/id156575408,6.5.13,4,Almost Perfect,"iCloud backup is a nice addition, but it should go all in & allow the ability to sync to other devices (securely, of course — perhaps from a prompt on an already signed in device??).

Also would like to edit account names & photos.

Still, this is my favorite Authenticator App. Hoping for M1 Mac support!",https://itunes.apple.com/us/review?id=983156458&type=Purple%20Software,2020-12-16T13:37:55-07:00
6630609788,SoAdictted,https://itunes.apple.com/us/reviews/id38101510,6.5.4,4,Notifications not working anymore,"After the second to last IOS update for IPhone the app stopped sending notifications when there’s a new request for approval. 

I checked my notifications settings and the app doesn’t even show up in there to activate/desactívate. 

What happened?",https://itunes.apple.com/us/review?id=983156458&type=Purple%20Software,2020-11-10T11:58:52-07:00
3212010032,BrandoCalrizzian,https://itunes.apple.com/us/reviews/id42208667,6.0.4,3,Fustercluck,"I tried to love this app. I liked it clean and simple interface. I liked that it connected easily to my outlook account. 

I waited forever for a watch app. After a couple version testing the beta with no luck I think I’m in the clear once 12 comes out.. nope. Still won’t connect. Deleted Authenticator and moved over to OTP Auth where the watch app works flawlessly.",https://itunes.apple.com/us/review?id=983156458&type=Purple%20Software,2018-09-20T20:10:37-07:00
10668003645,A random not taken name,https://itunes.apple.com/us/reviews/id144794686,6.8.1,1,How did this build pass testing?,"Want to have outlook talk to an app made by the same company so you can seamlessly access your secured email? Well this authenticator will request you sign in on its own app and not outlook so it can send a request to itself and then you never see the request because it’s screen is below your current screen. But if you leave your current screen, it will cancel the request.",https://itunes.apple.com/us/review?id=983156458&type=Purple%20Software,2023-12-07T12:47:15-07:00
9903405441,Rommel87,https://itunes.apple.com/us/reviews/id754598831,6.7.9,1,Worst experience I’ve had with security,"This app seems not to work I’m trying to sign in to a website for school, it sends number or whatever, the app shows nothing. It’s updated and just doesn’t want to work for me. I’ve been trying to get this to work for three hours. Well waisted going to contact my school to hopefully resolve this issue and to advise them to remove some services with this app or Microsoft company.",https://itunes.apple.com/us/review?id=983156458&type=Purple%20Software,2023-05-07T13:38:41-07:00
9397267825,Miami Grown,https://itunes.apple.com/us/reviews/id1280646639,6.7.2,1,DO NOT USE THIS APP!,"By far the absolute worst authentication app I have used. I got a new phone recently and upgraded to the 14 pro max, long behold I no longer can access my mass of accounts I had because they are such simpletons to not consider to transfer them over. I know have to go and individually contact each company and let them know I won’t make the same mistake of ever trusting microsoft again to actually know what they are doing.",https://itunes.apple.com/us/review?id=983156458&type=Purple%20Software,2022-12-14T19:24:50-07:00
8741926043,SF Food Order,https://itunes.apple.com/us/reviews/id498030983,6.5.97,3,DOES NOT BACKUP BY DEFAULT,"I had to learn the hard way when I got a new phone today. I had made sure my phone, iCloud and device was backed up prior to making the switch. Turns out  MS Authenticator was disabled by default within the application, something I never considered to check or know. I hope this helps someone out there!",https://itunes.apple.com/us/review?id=983156458&type=Purple%20Software,2022-06-04T17:47:14-07:00
7137004925,wamtrum,https://itunes.apple.com/us/reviews/id735015118,6.5.38,1,Utter garbage.,"About a week and a half ago I denied a request for authentication so my work accounts were locked down (as a precaution and as expected), and ever since then this reeking pile of hot garbage has utterly stymied all attempts by myself and my employer’s IT department to regain access to my accounts on my mobile devices. The different strategies we have used are too many to go into here, on both phone and tablet, but they all end with “verification failed.” So thanks for that pain the a55 Microsoft.",https://itunes.apple.com/us/review?id=983156458&type=Purple%20Software,2021-03-23T15:41:26-07:00
3718333405,蔡光明888,https://itunes.apple.com/us/reviews/id174524453,6.1.11,4,"Sometimes is not working, please advise.","Sometimes is not displaying the approval window after the login request sent to the phone. Also, the password option should be off once user selected the option to use please advise, or password should be combined with the Authentication app. Thanks",https://itunes.apple.com/us/review?id=983156458&type=Purple%20Software,2019-01-31T16:53:49-07:00
10660117930,jorged200,https://itunes.apple.com/us/reviews/id280322939,6.8.1,1,Mandatory and doesn’t work,"Mandatory in order to use some of the Microsoft apps, even though they can easily be authenticated by phone number. it is a hassle to set up and the QR scanner doesn’t work. Microsoft always tries to make you use their apps and products until they realize it doesn’t work at all and then changes everything. It’s their constant way of losing money and clients.",https://itunes.apple.com/us/review?id=983156458&type=Purple%20Software,2023-12-05T06:38:42-07:00
7233471949,Big Banzz,https://itunes.apple.com/us/reviews/id867695570,6.5.53,5,thx,I lost my account before and some one tried to sign in to my account my account but they couldn’t I  got a message about and I changed my password and email,https://itunes.apple.com/us/review?id=983156458&type=Purple%20Software,2021-04-17T12:17:45-07:00
10424350789,lomree,https://itunes.apple.com/us/reviews/id621781276,6.7.15,1,Ridiculously Difficult,"The stupid of this app is unfathomable. No matter how many times I authenticate from the same device it still demands authentication making signing IMPOSSIBLE!!! It is for that reason I avoid using any of the Microsoft products.  The positive reviews are nothing more than fluff, and probably paid for. This is a useless tool and a useless product. Seriously, Billy boy, you need to fire your entire IT department.",https://itunes.apple.com/us/review?id=983156458&type=Purple%20Software,2023-09-30T12:23:35-07:00
9545848190,Emde-Ash,https://itunes.apple.com/us/reviews/id1492276693,6.7.2,1,"Uninstalled, as it asked to share my/user's data !!","Strangely, this MS app says, unless user / i share data, user / i cannot use it !! Uninstalled it. Another strange thing is, it provides only two options: [Accept] button to allow it to spy/steal data, or [Decline] button to decline the option !! Why is it ""Decline"" ? it should be [Decline & Uninstall] ... that wud make uninstallation easy. Or it can display a [Uninstall] button immediately after pressing [Decline].",https://itunes.apple.com/us/review?id=983156458&type=Purple%20Software,2023-01-25T06:42:44-07:00
9494087787,not Microsoft tech support,https://itunes.apple.com/us/reviews/id1148241682,6.7.2,1,Locked out of my account,So I used to use the Authenticator app but when I got a new phone because my old one broke I got a new number and I tried to login but is would not work because the “use my app” doesn’t work and because I changed phones the “text ************* number” doesn’t work either. Also it won’t let me make a new account. So basically I all banned for the Authenticator app. Is there a way to fix it?,https://itunes.apple.com/us/review?id=983156458&type=Purple%20Software,2023-01-10T18:59:01-07:00
9266250491,gyokusai,https://itunes.apple.com/us/reviews/id141234747,6.6.8,1,Trash,"Fails to work properly, had to reset 2FA, twice. Then won’t scan QR codes for additional accounts without overwriting the first. A problem known and discussed, but “solved” with a link to a “solution” that isn’t—because that link addresses a completely different problem. Everything you can possibly hate about Microsoft is condensed in this app in a nutshell. Deleted and replaced it with an authenticator app that actually works.",https://itunes.apple.com/us/review?id=983156458&type=Purple%20Software,2022-11-07T16:20:07-07:00
10666527406,FNQuawn,https://itunes.apple.com/us/reviews/id973160490,6.8.1,5,Love this app,This app is real dope. I have never had anything wrong with it. I have a my system information on them and always keep it safe it’s a 10/10 app. I have had this app for 6 years now,https://itunes.apple.com/us/review?id=983156458&type=Purple%20Software,2023-12-07T03:56:56-07:00
6995518917,Fini.us,https://itunes.apple.com/us/reviews/id680449926,6.5.27,1,Not friendly to elderly.,"I signed up for a new email address, and could not get past your antiquated , captcha program. I’m elderly and slower than I use to be because my eye site is growing dem. 

The pictures you show are dark, dim and fuzzy. This is modern day, we use computers. Aren’t there any better ways to run your business? Every day is a hassle because you don’t understand your older clients needs. 

Eighty % of us are the major population with the most buying power.",https://itunes.apple.com/us/review?id=983156458&type=Purple%20Software,2021-02-14T18:49:02-07:00
6735814850,SpartanSpider91,https://itunes.apple.com/us/reviews/id564264157,6.5.4,4,Doesn’t tell everything,"I let a family member use my account on their Xbox and this app only tells me when I sign in on my phone, not when they sign in every day. I’m concerned what this means about other devices that I potentially may not be aware of",https://itunes.apple.com/us/review?id=983156458&type=Purple%20Software,2020-12-09T16:40:25-07:00
10760011239,bippergoes,https://itunes.apple.com/us/reviews/id893945898,6.8.2,1,Hidden cost of use,"It is free, yet expensive, and that it tracks and drives information. Despite this Microsoft has without a doubt one of the most obtuse login workflows I have seen date. Utilizes complexity as a security feature at the cost of usability to the point that when one thing goes wrong, you are waiting 30 days to get back in to any account.

I can’t good conscience with so many other alternatives out there.",https://itunes.apple.com/us/review?id=983156458&type=Purple%20Software,2023-12-29T12:01:31-07:00
9230820718,boombastyk,https://itunes.apple.com/us/reviews/id27810267,6.6.7,5,Easy to use,I’ve really been enjoying this app. makes two factor authentication a lot easier. Scanning qr-codes easily gets information into the system.,https://itunes.apple.com/us/review?id=983156458&type=Purple%20Software,2022-10-28T08:40:17-07:00
10643959000,Nicool Durante,https://itunes.apple.com/us/reviews/id457229265,6.8.1,2,Counterintuitive,"Actually unusable. I have it for my work email and if you open Microsoft mail, it takes you straight to the app. 

In the Authenticator app, it says to open the Authenticator app and input numbers… but you can’t because the numbers it’s showing you is in the app, and does not allow you to put in numbers….

I’m stumped on how I’m supposed to use it",https://itunes.apple.com/us/review?id=983156458&type=Purple%20Software,2023-11-30T19:04:11-07:00
9797559102,Cool :-),https://itunes.apple.com/us/reviews/id111722532,6.7.7,3,Battery drain,"Recently, while the app is open it drains the battery extremely fast and the phone gets warm to the touch. 

I had the app open for about 10 minutes this morning and it drained 25% battery! 

I have now reported this from the in app feedback twice. Please fix this stat!",https://itunes.apple.com/us/review?id=983156458&type=Purple%20Software,2023-04-07T12:30:08-07:00
9590193393,Zephyre the 1st,https://itunes.apple.com/us/reviews/id327901196,6.7.3,1,Would have been 5 star,"Easily would have been 5 star but you took it off my watch. As a tech admin for a school district I’m constantly adding computers/laptops and have to authenticate many times a day, and it’s so much easier when I can just tap it on my watch because I don’t always have my phone out or able to get to it as fast. Please bring it back for my watch and I’ll gladly change to 5 star.",https://itunes.apple.com/us/review?id=983156458&type=Purple%20Software,2023-02-06T10:19:44-07:00
9427529439,jbelian,https://itunes.apple.com/us/reviews/id22398800,6.7.2,1,Fix the Watch problem!,"My company requires me to use this to do ANYTHING, and my job (educator) requires that I move nimbly from computer to computer, slogging through the same ridiculously long and complex authentication process over and over. The Watch interface made it tolerable. I could leave my phone in my office and still get logged on in every classroom. Now we go backwards again. So frustrating and stupid.",https://itunes.apple.com/us/review?id=983156458&type=Purple%20Software,2022-12-23T10:37:06-07:00
6765040344,CHelzYeah,https://itunes.apple.com/us/reviews/id479000760,6.5.14,5,Buggy,Last few updates have been buggy.  I have an  iPhone Xs with the latest iOS and the app often freezes and fails to load.,https://itunes.apple.com/us/review?id=983156458&type=Purple%20Software,2020-12-17T18:23:33-07:00
8012568796,KK-2050,https://itunes.apple.com/us/reviews/id1347228351,6.5.85,4,A MUST HAVE security solution for EVERYONE!,I love this Authenticator. Only reason for 4 stars instead of 5 is that I recently switched my devices and getting my with tokens transferred to a new device is all manual process. Please brainstorm and find a way of securely transferring this setup to a new device.,https://itunes.apple.com/us/review?id=983156458&type=Purple%20Software,2021-11-11T06:49:35-07:00
6976328711,sabu1690,https://itunes.apple.com/us/reviews/id104465727,6.5.27,1,Super secure,"Don’t ever worry about anyone breaking into your account!

In fact, you won’t even be able to log into your own email!

This piece of junk (no surprise, just like most other Microsoft products) not only locked me out of my email, but I am currently missing deadlines while waiting on “support” staff to find a solution. Easy solution. I have a password that I created to securely log into my email. Maybe, just maybe, that should give me access to what I have paid good money for!

False.

Microsoft has its head shoved so far up its own behind that they can’t even provide email service without screwing the pooch.

Way to go Bill!

How this piece of junk has 4.8 stars is beyond me. This provides no better security than Apple’s keychain.",https://itunes.apple.com/us/review?id=983156458&type=Purple%20Software,2021-02-09T22:56:23-07:00
9968227012,Jasondc1983,https://itunes.apple.com/us/reviews/id147246652,6.7.10,5,Words in left top corner,Change the color of the words in the left corner that allows you to switch back to the previous app.,https://itunes.apple.com/us/review?id=983156458&type=Purple%20Software,2023-05-26T12:35:46-07:00
