id,userName,userUrl,version,score,title,text,url,updated
3759841695,Big Spender$$$$$,https://itunes.apple.com/us/reviews/id847712045,4.2.0,5,No prize worth your real money spent,"I feel like there’s no reason to even spend your real money (US DOLLARS) on scratch offs or the golden spin or to be honest any of it. Just because every time I do spend money on a ad to try and win coins it’s literally never gives you anything worth your real money it is always giving you coins from 150 coins to maybe maybe 10,000 coins and that’s every once instead blue moon. Also I’m here to tell you I spend a lot of money on this game I really do and I just think it’s rigged up to pretty much take your money because it never gives you enough coins the first time you purchase something or buy a ad there’s really know reason for any prize over 10 thousand even being put on the golden spin because I’m telling you it never gives you anything above that so could the owner of this game please tell me why it’s set up like this I actually love playing the game it makes my day go by fast when there’s nothing to do I enjoy it but I’m honestly tired of getting ripped off.",https://itunes.apple.com/us/review?id=543186831&type=Purple%20Software,2019-02-11T18:17:52-07:00
5846249594,KoochieSlayer69,https://itunes.apple.com/us/reviews/id1158276439,4.8.4,4,Pretty Good.,"It’s nice to play but what I have noticed is that all I get from the wheel spin is either 100 or 250 coins which is kinda annoying especially if I spend money to get wheel spins and also the pool cue meter which I always accidentally hit and only inches the ball forward allowing the other person to win.                   

Update: What I’ve noticed is that if I make the smallest mistake the other person is able to move the ball anywhere(which is dumb) and I am in the lead 1-5 and the person is able to hit all of the balls in even though earlier they were bottling the whole time hitting it as hard as they can and then turn on decide to turn on sicko mode and win even I should have but some of the rules don’t really make since like one time I hit the opponents striped ball to hit in mine and made it only to have the opponent to be able to move the ball anywhere and then eventually win

Overall I think they should fix some rules and get rid of pool cue recharge and in get rid of the rule where if you make a tiny mistake the opponent is able to move the ball anywhere",https://itunes.apple.com/us/review?id=543186831&type=Purple%20Software,2020-04-21T19:54:47-07:00
6416680274,Troybal81,https://itunes.apple.com/us/reviews/id224889575,5.0.0,4,Good game but some aspects are bad,"I have been looking for a game that would get me to play for a long time to pass time. This game got me to play multiple games of pool against people around the world. It tells you the win rate that you have and how much coins you have accumulated over your career. There is a extremely large variation of pool sticks that all have different stats and you can even spin the ball. Plus there are a lot of mini games you can play like scratchers, lucky shot, and spin to win. They also have 9 ball and no guidelines. The one thing that is EXTREMELY Noticeable is the spin and win is very rigged. It says the most you can win is 1 m coins but I highly doubt that has ever happened. The most I have ever in my life gotten was 700 coins with my vip bonus. I have been playing for over a ye at hand had this game before then. I have probably spun that wheel 100 times and not gotten over 700 coins. Clearly some parts of the game are rigged but also I’m not paying 20 bucks on a game every day they come out with a new “deal” which is usually just one pool stick and coins and cash.",https://itunes.apple.com/us/review?id=543186831&type=Purple%20Software,2020-09-10T20:15:50-07:00
10270581991,Bushwic29,https://itunes.apple.com/us/reviews/id263558173,5.13.1,5,I like the game but it has a lot of problems.,There are achievements that I've completed and they don't unlock. There are cheaters who can hit crazy cushion shots that are impossible and it doesn’t even show the other players cue. It's obviously a hack and I've played a handful of players in the last week. Fix the cheaters!! The spin wheel is a rip of it always lands on the lower amounts I've never hit anything big. The makers don't seem to care because they don't even respond to reviews that I've seen so far maybe I'm wrong. I've seen other reviews where the maker was actively responding and helping to fix problems. I think as long as people play and spend money it doesn't matter what's wrong with the app. I also bought a piggy bank once and it said I would get a legendary x3 and I only got the piggy bank and not the legendary. What a rip-off when you think you're getting one thing and you get something else. I like the game I'm just not happy with the problems.,https://itunes.apple.com/us/review?id=543186831&type=Purple%20Software,2023-08-17T18:48:17-07:00
9049207280,Crabell2011,https://itunes.apple.com/us/reviews/id1444477913,5.9.0,3,"Great game, but glitches ALOT!","I LOVE this game! Been playing it a long time, but it glitches sooooo much, causing me wins and coins. I will make a legal shot, and instead of it being my turn again, it will give the other player ball in hand! Also, when you choose your bet on certain games where you choose your bet, say for example I hit 500, it will take 500 coins from me, but will only count it as 100. So if you win the game, your only getting 200 coins, and loosing coins even if you win since you selected 500 and it took 500! Also another thing is when it starts glitching when your making shots and it causes you to lose. I mean there are so many glitches! The spinning wheel is another thing that I feel like is a scam. I’ve never got over 250 coins, and I’m level 45 and was also a level 50 on my old account that I lost when I switched phones. Sometimes it seems you just can’t win, even though you should! Like I said, I love this game, but the glitches make it hard to want to play sometimes! These have been going on for months now! Please fix and I will give 5 stars!",https://itunes.apple.com/us/review?id=543186831&type=Purple%20Software,2022-09-03T13:18:43-07:00
8386474267,Marlene!!,https://itunes.apple.com/us/reviews/id1057884310,5.6.7,3,Coins,"I’ve never had issues with this before until I recently downloaded it again. Basically, this thing is stealing or lowering down my coins more than it should. I had 40,000 coins and I played for Sydney which only needs 100 coins as an entry. I loose the game and all of a sudden my coins went down to 37,000. Explain to me how that works. I start playing again to regain those coins and it just keeps lowering my coins. I just finished a game right now, I had 20,000 coins and I played a game in London which only needs 50 coins for entry fee. I loose that game and now I have 11,000 coins. I’m so frustrated, trying to get all my coins back but it just keeps lowering. Each time I loose a game, I loose about 10,000 coins. When I win, nothing happens, I just win the amount I’m supposed to win and we continue but whenever I loose, I not only loose the entry fee but also another 10,000 coins. It might be just me but I’ve tried everything and it still does the same thing. Fix this please!! I love this game, I’m addicted to it but how am I supposed to feel when y’all are legitimately stealing coins from me?",https://itunes.apple.com/us/review?id=543186831&type=Purple%20Software,2022-02-22T20:52:50-07:00
9045450194,Stormy Angel bandid,https://itunes.apple.com/us/reviews/id904524722,5.9.0,5,Pavez. Club name,Great game it’s a great But they should be able to translate when we play other people from different countries but an overall I’ll give it a five star I’ve been playing this game for a while now the game has improved and you guys keep coming up with new challenges which is great and does it get boring The only problem I have is I took over a club and like to be able to change the name I have built a great club but a lot of people don’t like the name is there anyway to change it? I doubt it very much did anyone’s going to read this but if there is thank you for all your work and It’s great to have something to get our mind off everything else in our lives once in a while we have to escape somehow specially when we can afford to go on vacation LOL Help we have tried to contact and Emails about my team not getting there winnings I have lost some great players cause of it Can you help us please Before I loose anyone else. Thank you,https://itunes.apple.com/us/review?id=543186831&type=Purple%20Software,2022-09-02T11:43:47-07:00
7571307751,im50/50,https://itunes.apple.com/us/reviews/id1308959900,5.4.5,3,Getting what was stolen from me!,"I must say I play tournaments of REAL Billards a lot and I’ve won and lost a lot on stupid choices! Those 90 degree shots are 1 in 10!  It has helped my game BUT.... crap freezing and ball in hand...more than a few I didn’t get to shot. Not cause he ran it. 2 ball in hands later in a tourney made me angry the 1st time. Happened over 50 times. Then ... ohhhh man... when I make an 8 ball, and minutes later it pulls the 8... then what... yea.. ball in hand for him... on the 8.! Just update! Now way you fixed it all BUT... at least there’s effort. I say put it all on... handling crowd serge. Not being able to get a game in is where my line is. If I can’t play because the vendor can’t do it... history. I’m 1 in billions but.... pool is a mathematical perfect game. It’s also Respect!!🧐My stats are BOGUS!!!! I know “They” will Not give them back.... so let’s let me just start from zero. According to you I’m 51.4%! That is a joke! Renew, start, fair... yea right..... Good luck to all! Things where kinda slow & nerdish back in the day but, easy..... now.. if you ain’t going... 
Your being PASSED!!!!! We all know about 2nd.🤬",https://itunes.apple.com/us/review?id=543186831&type=Purple%20Software,2021-07-13T03:56:01-07:00
4607327665,King Kat 777,https://itunes.apple.com/us/reviews/id502127815,4.5.2,1,Something weird is happening!,"UPDATE: I put my problem below and never got a response. I email them and tell miniclip about the situation. Ever since then when I play my coin result is different from everyone and what it was for me in past. For example your week results for would always end in 0 but now mine ends in another number. Example my friends might have weekly result of 5,550 while my result were 5,538. What is this???? Also I played a game and won it gave me like 200 less coins than the 5,000 I should of gotten. What is this please fix or explain.

HEY GUYS! CHEATING IS HAPPENING! CHEATING IS HAPPENING! When you play someone there is always some connection issues due to your WIFI or theirs. But a new thing is happening; somehow some opponents disconnect just before you make your final or difficult shot. When you reconnect you are left with no time and you lose your turn leaving them with the winning shot. This is especially BAD  when your at a big money table as happened to me, more than once. This is not due to WiFi issues but to unsportsmenship play. Please fix this I implore you. I don’t want to spend money on coins to have bad elements in the game take the fun and competition away.  Look into it. And speak up if this is happening to you.",https://itunes.apple.com/us/review?id=543186831&type=Purple%20Software,2019-08-12T08:56:03-07:00
9976492518,Homeless2Home,https://itunes.apple.com/us/reviews/id975164332,5.12.2,1,Wish I could give a half a star,"Honestly this game is just something to use if you have no other game to play in existence. It’s a pay to win, pay to earn, pay to gain app. Even though there are plenty of things the app gives “freely”. Ultimately, if you are new to the game, expect to be playing against players that are ranked severely higher than you and come equipped with everything that the game has to offer from purchase. You have some games where you’ll win due to playing an AI bot. However, then you’re thrown into a pool of highly ranked players (anywhere ranking from 5-150 levels ahead of you) whilst you are at the bottom of the list. I’ve had to email the company numerous times about how my “earnings” have disappeared multiple times. They ensure that only players who “cheat” or “misuse the game” are violated by taking coins or permanently banning them. I’ve had a couple millions in my “earnings” that I did work up (AND EVEN PURCHASED) all to have it taken away and left with less than 200,000 coins. If this is the game you want to get taken advantage of by a company that has an apparent greed issue, than I’d say have fun. I’d rather download some 8-bit pool game than to play this trash again.",https://itunes.apple.com/us/review?id=543186831&type=Purple%20Software,2023-05-28T23:57:12-07:00
2189277296,CalSni87,https://itunes.apple.com/us/reviews/id711738674,3.12.3,5,Great game but kinda upset about losing my coins!,"I’ve been playing for a few weeks now and I’ve really enjoyed this game! The only complaint I have is losing my coins after winning a game and not receiving my bet coins or my winning coins back after the game has been won. This has happened quite a few times to me and is getting really frustrating. I’d really like for the developer to hook me up with my coins or something if possible, but we all know that most developers don’t read these comments so I doubt I’ll see them. If it continues to happen I’m going to have to move to a different game because building up coins and then losing them so easily is not cool at all. I’m going to hang in there for a few and see what happens. Hopefully I get all of my winnings from now on and maybe one day my coins will magically re-appear. Overall I love the game and I’m definitely addicted to it. It’s great for a free game and even better if you have the spare money to buy coins, upgrades, cues, and everything else.",https://itunes.apple.com/us/review?id=543186831&type=Purple%20Software,2018-02-09T20:01:08-07:00
5182625572,A very grateful pokemon player,https://itunes.apple.com/us/reviews/id534984726,4.6.0,4,Quit pairing me with people 4 times my level!,"I’ve had this game for a little while now and I’ve been growing better and better at it. I wish I could say I have been having fun with the game but I’m not. After I spent $6.99 on an in app purchase I have been paired up with players who are 4 times my level or higher. It’s not fair or easy.
Another thing I’ve noticed is the constant pop ups showing you what deals you can buy. They will randomly open up after you exit a game and it’s very easy to accidentally tap one. The game is essentially rigged to make you purchase more coins by putting you up against people who don’t miss a shot. If you don’t get the break then you might as well quit the game right there. The devs really need to add skill based matchmaking. That way a level 18 player can’t be paired with a level 157 player. In what world does that make sense? Anyways it’s a fun game to play if you need to kill time. I don’t recommend trying to gain coins too quickly though otherwise they will pair you with level 500 no life Indians.",https://itunes.apple.com/us/review?id=543186831&type=Purple%20Software,2019-11-22T11:13:35-07:00
5619740168,Lil Johnny 1891,https://itunes.apple.com/us/reviews/id200477582,4.7.7,3,Be warned,"Okay so this is a fun game, great to just play. I bought a few of those .99 cents spins got some extra coins, then issues came about. I had almost 130k in coins mainly won by playing. Now I’m sitting at 5k coins. What the hell happened, I know I’m a good player with a winning rate of 51%. Now it just seems to be bots or someone with cheat codes because I lost 125k coins in a matter of hours. Went from winning at least 2 maybe 3 out of 4 games to barely able to win 1 game outta 10. You may call it whatever you want I know I can play shoot I made 100k without a single purchase. Now basic shots, simple taps won’t make the shot. The other player that I go against will make shots that I just tried with ease. The other players can barely tap the ball to sink it and what do you know, it goes in. I tried the same shot and I’ll be damned if the cue ball doesn’t travel all over the board to a hole, like you can just tell that ball is moving wayyyyyy to much for how lite of a tap you did but no it likes to slide around like its on ice. 
The game is fun, but after a small transaction it seems the attitude of the game did a full 180.",https://itunes.apple.com/us/review?id=543186831&type=Purple%20Software,2020-03-05T06:15:09-07:00