id,userName,userUrl,version,score,title,text,url,updated
2109435480,TrevorM89,https://itunes.apple.com/us/reviews/id389927587,3.281.10005,1,4th time a driver hasn’t picked me up,"This is the 4th time ever a driver has accepted my ride ONLY  to stay exactly where they were when they agreed to pick me up! Not ever evening  moving toward me at all!!!!! And just like the previous times, I’ve called and texted the drivers to figure out why the app shows they have not moved, some 5, 10, 15 minutes later!, only to be ignored. And like each time I REFUSE to “ cancel” the ride as the driver will collect 5 bucks of mine if I do. So instead I leave the app open in the background FOR HOURS until they cancel it on their end!!! I then have had to, 4 times now!, find an alternative way to get where I am going! These drivers are doing this on purpose to sit at home & collect these fees for accepting rides the NEVER INTEND TO PICK UP! They are hoping on you canceling!! BUT THERE IS NO WAY TO REPORT THIS TO UBER!!! There is no way to leave feedback for the driver regarding this issue. Uber cares not about its customer base, and their system for accepting user feedback shows this. I am very disappointed. I understand this is a driver related issue, but I rate this app poorly because I’ve searched through all Uber’s “ report” options & can find no way to report this type of behavior nor a way to get back the time I’ve wasted because I’m charged for the defrauding act of bad drivers & left w/ no course of action to remedy this problem.",https://itunes.apple.com/us/review?id=368677368&type=Purple%20Software,2018-01-20T14:51:55-07:00
5193213367,yuke msee,https://itunes.apple.com/us/reviews/id1103542055,3.378.10002,1,So frustrating to driver for Uber,"Uber does not value their drivers,  all they care is making money, having driven for Uber for more than 4years I am really disappointed, I recently did my vehicle inspection from the same place I have been doing it for the last 2 years only for it to be rejected with the reason that this is not a certified location, and I should go to a certified location to have the inspection done, this information of certified location was never communicated to the drivers , when I asked when this was implemented I was told by the support lady that she doesn’t know. 
I paid $30 for the first inspection and now I am being asked to go somewhere else to do the inspection, this means I have to go pay another $30 dollars, for something that I was not aware, considering that it can take me up to 6hours driving be able to make that $60 dollars is just frustrating. Whereas I have been using this location for the last 2 years, why wasn’t there any communication to drivers about this regulation? 

I talked to other drivers and one of the drivers used the same location I went recently in fact this year 2019  April but was not asked to go somewhere else, it’s only NOvember a difference of 6 months and now they can’t take inspections from there, that’s okay I guess but surely such information should be communicated to drivers.",https://itunes.apple.com/us/review?id=368677368&type=Purple%20Software,2019-11-24T15:13:27-07:00
8479648081,misterdoodoohead,https://itunes.apple.com/us/reviews/id1189743737,3.501.10002,5,Frustrated,"I’ve used this app for 5 years now, pretty much on a daily basis. I used to have no complaints, everything worked seamlessly and I had no issues. 
Lately however, it is impossible to get an accurate estimate for both wait time, and price of an Uber. I’m convinced they show you a short wait time so you’re more inclined to request a ride from them instead of Lyft, (because they actually tell you an accurate wait time, even if it’s higher) 
Uber will tell you it’s a 5 min wait and a $12 trip and then make you wait up to 30 mins and charge you an extra $10 with very little explanation or heads up. This is very frustrating when you rely on this service in order to get to work. I’m late every single day without exception, because no matter how early I call my ride, the wait time will ALWAYS say it’s at least 10-20 mins shorter than it actually is. And no, I don’t want your $5 in Uber cash. That doesn’t resolve anything. 
Awful customer service that they make almost impossible to get in touch with. 
Y’all are better off calling a Lyft.",https://itunes.apple.com/us/review?id=368677368&type=Purple%20Software,2022-03-21T05:07:27-07:00
3219850311,manimtim,https://itunes.apple.com/us/reviews/id318710955,3.317.10003,3,Uber unavailable in your location,"So it’s been a week since a hurricane hit our city and I’m disabled and have brain injury and limping and seizures from the accident and it is my only sores plus another app for rides cause I don’t do taxis and ever since I go this notice they are unavailable, I talked to some Uber drives I know and they are mad too cause this there sores of income and they can’t pick anyone up. And they try to call or email and they get no answer So for the past 5 days I have had to walk in the wet and tree limps and sand every where and dirt, with that said a Uber ride is 5-7 minutes for me and walking is about 30-45 minutes depends on traffic and stuff in the way helps me out but I had to walk with all the conditions I have; I’m kinda upset that they or the number you call to find out when they be up and running I get nothing and the regular Uber drivers I know don’t get an email or why they are down and they are losing money and income for themselves. I’m just upset that when your on the app seeing that they should tell us a start or approximately time frame and also for the drivers and they need a better and easier email and phone number for the complaints or for natural disasters. No warning like no other.",https://itunes.apple.com/us/review?id=368677368&type=Purple%20Software,2018-09-22T21:29:30-07:00
1827405623,SaddityT,https://itunes.apple.com/us/reviews/id163144796,3.261.4,1,Lyft is better.,"Seriously, when it comes to car services, every problem I've ever had has been with Uber. First time, my mom and I got dropped off at the Greyhound bus station to catch our bus back home. We quickly realized that she left her cell in the car and contacted the driver immediately. He refused to bring the phone back to the bus station. He made us take another Uber to him 30 minutes away to get the phone. Mind you, he was simply sitting in a parking lot doing nothing. We then had to catch ANOTHER Uber back to the bus station. When that driver picked us up, he said that that spot was the area drivers sit in to wait for calls from the airport. Seriously? Second time, I'm waiting a good 15 minutes for my driver who appears to be lost and doesn't have sense enough to call me. Then I see the driver pass by me. I call him and tell him he's passed me. He mumbles something and hangs up. Then I see that I've been assigned a different driver. So, he cancelled me. Then he passes me again and just leaves. Are you kidding. There's no way he didn't see me. Third time, a driver tries to drop me off in a random spot that was not the address I gave. I then had to navigate him to the address with my own phone. I complained about the extra time charge and I am waiting to be refunded. Get better navigation and better drivers. In the meantime, I'll be using Lyft. Smh.",https://itunes.apple.com/us/review?id=368677368&type=Purple%20Software,2017-10-04T14:31:16-07:00
8911884780,benopjska,https://itunes.apple.com/us/reviews/id1431484892,3.520.10001,2,App seems broken,"I don’t mind using Uber but as of 2 weeks ago it has been nothing but issues! This needs to be addressed and needs to be fixed for both drivers and riders! Firstly they aren’t giving proper directions for drivers. They’ve been taking the drivers to the street behind my house and then they have to go around to get to my location. Then on the way to work it takes them way past my work to an Asian buffet. I work at petsmart and it wants to take the drivers past my work and then I have to give them directions myself. With Uber being the way it’s supposed to be I should not be having to tell drivers to make u-turns and other directions. Secondly, it’s not letting me tip! I’ve even updated the app and it won’t let me tip. Tells me something is wrong. So I’ve had to give drivers cash or no tip at all if I don’t have cash which makes me feel like a jerk because I don’t like not tipping people and I rarely have cash on me! Third, there’s an issue with getting rides through the app. If I want to book a ride I have to go on Ubers website because the app will tell me there’s no drivers but it doesn’t give this issue to my coworkers. I live in Las Vegas there are ALWAYS drivers EVERYWHERE so this isn’t right either. Please fix this!",https://itunes.apple.com/us/review?id=368677368&type=Purple%20Software,2022-07-25T18:09:02-07:00
4399576902,Ogram Sotoph,https://itunes.apple.com/us/reviews/id294887676,3.358.1000,5,Language,"I have had great Uber drivers. Little to complain about however: When I book a ride to LAX and the driver speaks ZERO English, Huston, we have a problem! What if I want to tell him to take another exit, or look for Alaska Airlines terminal and he leaves me off at United, pointing to his phone GPS which tells him I want to go to United? Really? Anyway, there was no way to have a conversation with him.

That leads to a more serious point. NO ONE, no matter how good their driving skills, should be driving passengers without enough English to communicate if the trip is longer than 15 minutes! LAX was 50 minutes away. It required highway and exits. What if there was traffic jam, an emergency or I wanted to reroute for any reason? I certainly would NOT have allowed my daughter or son to ride with someone who could not communicate.

I understand giving people a chance to make a living. I also acknowledge that the driver I had was an excellent one. But, he could not speak to or understand me. Asking drivers for a minimum of English speaking skills is not unreasonable. Furthermore, it is a safety issue for both driver and passenger. Uber, rethink this.",https://itunes.apple.com/us/review?id=368677368&type=Purple%20Software,2019-07-01T22:27:42-07:00
7654393681,Saucy502,https://itunes.apple.com/us/reviews/id786441988,3.469.10001,2,Pick up spot,Uber is usually my go to but I realised that their pick up and drop off spots aren’t accurate for most of the time. So today I had practice and I didn’t want to get the ride from my house I wanted to get it from a gas station a couple blocks from me so I looked up the address making sure it was correct and put it in as the pick up spot. My uber ended up going to a totally different place i wasn’t even sure where he was at i just know that he was on the wrong street. I know for a fact i put the right pick up spot because when i put in the address the name of the gas station popped up. The thing that made me upset the most was that if the driver saw that the pick up spot was a gas station then why are you in front of a house or even the street address at least. I texted the driver to ask where he was but I didn’t get a response I let him know that we were at the gas station didn’t get a response for that either. He ended up cancelling the ride and they charged me 6 dollars saying that next time i should be ready🤨. Why am i paying your driver for being at the wrong spot his time wasn’t wasted mines was and I was late to where I needed to be. I was very unsatisfied I shouldn’t have to go through all this just to a ride .,https://itunes.apple.com/us/review?id=368677368&type=Purple%20Software,2021-08-04T07:33:37-07:00
3530398280,PhilipV88,https://itunes.apple.com/us/reviews/id138839358,3.329.10002,5,Highly Useful and Relevant,"Highly useful application. Very versatile and makes it surprisingly easy to find a ride. The different types of Uber rides are easy to select and they can be found quickly using the touch screen interface. The map is highly accurate and displays in real time where the driver is located so you can monitor your progress both too and from your destination. The trip is also tracked via time giving you an accurate estimate of the time between destinations. The driver can contact you and leave a message when they arrive so you do not have to keep them waiting. Finally, once the ride is complete you can rate them and leave a tip easily. The Uber drivers are always friendly and helpful when you get into the car. It helps to be prepared and alert for the trip just in case there are multiple routes to your destination of traffic delays. Truthfully, the app is a very convenient way of getting around and I use it frequently. I would recommend this application to anyone who needs a fast and accurately trackable way of getting from destination to destination.",https://itunes.apple.com/us/review?id=368677368&type=Purple%20Software,2018-12-14T09:32:29-07:00
3210453717,Brad palsey,https://itunes.apple.com/us/reviews/id169396460,3.317.10003,1,HUGE L on the UberPool,"Took an Uber express that was priced at $4.55. Matched with a Co-rider after I got picked up. GPS says the co-rider is in the middle of the street so the uber driver drives an extra 3 miles driving around in circles looking for my co-rider. He (the driver) doesn’t respond to the other riders text messages or the one phone call she made. So she (the Co-rider) cancels her ride. So all the time and the distance he drove looking for that woman was added to my charge which ended up being a bit over $16. I go to help section and press “driver got lost or took wrong turn” and was told my fare wouldn’t be adjusted because I was charged the price I was shown upfront. I then press “driver took poor route” and was told the same thing. I sent support multiple messages to support about the situation with no response. I even sent screenshots of his total driving distance (9.91 miles) and the true distance of my pick up and drop off which was 7.3 miles. My receipt from that ride shows a base charge, distance charge, and a time charge. Every ride I took that day that went from point to point with no problem don’t have those charges. But because he drove so off course I was charged for the extra time and distance he drove. WHICH makes no sense since a Uber pool or express has a set route the driver can’t deviate from. So if support wants to rob me so be it. Buyers be warned.",https://itunes.apple.com/us/review?id=368677368&type=Purple%20Software,2018-09-20T08:23:13-07:00
9944860373,Can't find themselves!,https://itunes.apple.com/us/reviews/id215508143,3.562.10000,2,No way to report a driver after trip is over… Also 4min arrival is cancelable,"I really like this ap and mostly I have terrific experiences.  BUT I did have a VERY scary experience with a driver some months ago who took me on a joy ride and was trying to pick a fight with me so he could kick me out. My daughter did find a VERY complicated process to report this driver but Uber needs to fix that!!!!!  This driver I’m sure was using someone else’s identity in order to be a driver for Uber because his photo looked NOTHING like the man who picked me up.  

Also AFTER you confirm your trip they can change the 4 minute arrival time to 15 minutes. And there’ll be a $5 cancelation fee then. I thinks that’s crap. I asked the driver how that happened and he said the driver that was 4min away must not have accepted the trip so he accepted the trip but was 15 minutes away. I could have driven myself in 15 minutes. So I really do not appreciate being asked to confirm the trip then get a “bait and switch” and get charged to cancel the trip. 

Great Ap but has some MAJOR issues they need to fix mainly for personal safety. They DO NOT VET THEIR DRIVERS!!!!!  Because that angry man who drove me was not the same man the had a photo of. Probably his friend applied and got him approved. This is DANGEROUS!!!!",https://itunes.apple.com/us/review?id=368677368&type=Purple%20Software,2023-05-19T17:09:28-07:00
9289041604,rickavery,https://itunes.apple.com/us/reviews/id335583901,3.535.10003,3,Bogus fee!,"I hadn’t used Uber in several years and was a little unfamiliar with the website but was able to figure it out pretty quickly. I summoned a ride from the Luxor hotel in Las Vegas to Ceasars Palace. We had an appointment to make and had 45 minutes to get there, about 2 miles. We started waiting and watching the driver drive around in circles near and around our pickup point. All of the hotels have a designated place for Uber/ Lyft to pick up people. This driver apparently didn’t know where he was going. After about 20 minutes, and our appointment time looming, the driver cancels the ride. No phone call or anything. We were lucky enough to spot a cab which took us to our destination just in time. Now I get a $5.45 charge for not showing up for our ride! I’ve sent Uber a message but I’m not sure if it went to the correct place as the website wasn’t people friendly to use. We’ll see!! To be fair, we used Uber two more times over the weekend and had no issues, even had one driver call to confirm where we were waiting which is what the driver mentioned above should have done. Must be easier to cancel the ride, get $5 quick dollars and be off to the next ride.",https://itunes.apple.com/us/review?id=368677368&type=Purple%20Software,2022-11-14T07:07:18-07:00
6010405699,BeanHuntin',https://itunes.apple.com/us/reviews/id25640958,3.406.10001,4,$200 Out,"I obtained a $200 Uber gift card. Like most gift cards, I loaded the funds onto the app for use and then got rid of the card. Later, attempting to take my first ride following the purchase of the card, I requested a driver. Said driver gets to me very shortly. The driver rolled down the window and asked, “Do you have your Uber card?”. I asked, “They have Uber cards now?” The driver responded, “No, your gift card.” I replied, “Well, I loaded it on my app and it shows the funds are there, so I threw the card away.” The driver then informed me, in a eye rolling manner, “You have to keep the card or it can’t be used.” I stated, “It does not give any notice to do so, and looks/operates as a gift card. Therefore, I made the simple assessment it worked like every other gift card I’ve had in which I load the funds onto the company website, and no longer need the card.” The the driver stated that I cannot use my funds without the card, regardless if they’ve been loaded onto the app. Quickly after, the driver drove away. Therefore, I am out $200 and unable to achieve any of my other tasks due to not having any funds to get me to where I need to go. Uber gets Negative 5 Stars from me.",https://itunes.apple.com/us/review?id=368677368&type=Purple%20Software,2020-05-29T12:06:45-07:00
3034789541,Daisy4mi,https://itunes.apple.com/us/reviews/id183805903,3.311.10001,1,“Don’t Bother”,"Today was a very busy day at work and picking up my daughter, my husband and I decided to try Uber Eat. We decided to order McDonalds for my daughter loves McDonalds. I placed the order and it was quick. However, first we didn’t get the cola that my husband requested and when he opened up the wrapper on the burger, he noticed that his burger was extremely raw. He immediately changed our daughters burger as well and it was also raw. Mine was not raw. So he was upset and called the McDonalds where we ordered from and the manager stated he cannot do anything for we had to call Uber. Upsetting as that may sound, it doesn’t get any better for we’ve looked for either and email or telephone number to Uber so we can get reimbursed for the two burgers and cola. To no avail. When you look for help none of the questions pertaining to this was available. There is not even an email so that I may write to them. Lastly when you sign up,, thinking perhaps I can get somewhere with this issue, it’s more to become an Uber Driver. So I had no chose to whip something up for dinner for us to enjoy with the only thing was good was the fries. So, so disappointing for I lost my money on a nasty raw burgers and no drink. If needed proof I can back that up for we took a photo. So disappointing to see there is no contact and we lost money. No more Uber Eat for us or anyone I know.",https://itunes.apple.com/us/review?id=368677368&type=Purple%20Software,2018-08-08T02:55:34-07:00
9572222991,kwbella2301,https://itunes.apple.com/us/reviews/id28433733,3.547.10000,1,Mainly GPS issues,"It’s been forever since I used Uber or Uber Eats, because every single time I try to use their services, the persons GPS is mixed up. One time I spent nearly an hour on the phone trying to guide an angry driver to my house, because the GPS simply doesn’t work, and they got mad at me for it. No customer or driver should have to deal with something like this malfunctioning when it’s so important to the process. I already did my part to check if my address was correct, and I actually made it a habit to put my address into the comment box to prevent this issue, which wouldn’t work because according to the drivers, “regardless of the address I put in, it’s taking me to a different area”. 

It’s unprofessional. Plain and simple. And I’m definitely only gonna use Uber if I absolutely have to. I mean seriously? It’s an app designed to drive people to their desired destinations, or for food delivery. But….the GPS doesn’t even work? 

Also, I’d like to mention: DO NOT GET UBER ONE FOR RIDES. Please do research and look up others experiences using Uber One with rides, you’ll see tons of evidence showing that they simply put fake prices and even charge you MORE than if you didn’t even have the subscription. Do yourself a favor and save money by NOT making the mistake of signing up with Uber One as I did.",https://itunes.apple.com/us/review?id=368677368&type=Purple%20Software,2023-02-01T11:16:55-07:00
9157457977,Ashbash7283,https://itunes.apple.com/us/reviews/id87252856,3.530.10001,1,Poor Handling of Account Status,"My Uber account was suspended several years ago and I have tried to get it reactivated a number of times over the years. I have no idea why the initial suspension occurred as I am just a regular user - taking rides when traveling and on vacation. I have continued to use Lyft with no issues and have never been suspended from anything before so the mystery still remains. I used to use Postmates frequently, but lost that once it came under the Uber umbrella. I’m fine without them as I can use Lyft, Doordash etc but am annoyed because I feel like something must have compromised my account. I also just recently asked to be reactivated again and someone from CS wrote back that it was taken care of and there was a misunderstanding on my account but as soon as I tried to place an UberEats order, it failed and the suspension came back. I emailed CS again and the answer was that I would continue to be suspended. I travel a lot - enough to have status on multiple airlines and access to all airport lounges - so not having Uber as an alternative option to Lyft when needed is an annoyance. Especially since I do not understand what happened to cause the suspension. Customer service, please do better - if there is a valid reason for my account suspension, I would like to know it.",https://itunes.apple.com/us/review?id=368677368&type=Purple%20Software,2022-10-06T08:41:33-07:00
7791428603,Jjjjjjjhshshss,https://itunes.apple.com/us/reviews/id364894267,3.474.10002,2,What’s going on lately?,"The app has been garbage recently. Every single trip I’m asked to “verify payment method,” over and over and over. Then, once the ride finally goes through after reentering my card information 13 times, it charges a different card that I didn’t ask it to? After my trip is complete, I am prompted with “add a tip,” I click and submit a $15 tip. I’m then met with an error message saying that my “request cannot be processed right now.” The ride still shows I have not rated my ride nor have I submitted a tip, so I try again. Now I see that I have been charged DOUBLE, and the first tip actually did go through, despite showing me an error message AND showing that there was no tip given. I reach out to customer support and I’m told “you need to double check how much you’re tipping before submitting,” as if it’s my fault. I am fully aware of how much I tipped, it is not my problem the app has bugs, nor is it professional for customer support to blame the customer when I clearly told them there was an issue with the app. The resolution I was given was not a refund, but Uber cash, forcing me to just give it right back to the company that stole it from me. Thank god I live in NYC and have many ride-share options.",https://itunes.apple.com/us/review?id=368677368&type=Purple%20Software,2021-09-10T07:44:53-07:00