id,userName,userUrl,version,score,title,text,url,updated
2461588380,Big D 4967,https://itunes.apple.com/us/reviews/id435230470,3.13.1,5,Almost complete,"The game is very good and fun to play. What it needs to make it complete, in my opinion, is that it needs to have the ability to enter your own comments during play. You can’t have all the things I would like to say so being able to add my own would be great. 
But the game is really enjoyable to play and it’s fun to play people from around the world and that checking the players profile we see what country they are from and what their win rate is and what rings they’ve won. Which I really like winning rings it’s just a shame that we really can’t wear them, that would be awesome!
If you like playing a game for free this is your game. You can spend money to get better cues and to get more coins but you can get more cues by winning games and getting gift boxes that you open in time or spend your dollar bills that you’ve acquired. But you can play without spending any real cash. Well I haven’t had to spend any yet and I’ve won 4 rings and working on number 5. All this is great fun and you can also play your friends and send friends gifts.",https://itunes.apple.com/us/review?id=543186831&type=Purple%20Software,2018-04-24T03:44:40-07:00
4045389357,darlindawne,https://itunes.apple.com/us/reviews/id864278040,4.4.1,5,D McD e,"I have been gaming long enough to know not to get my hopes up but when ur waiting for that bug fix that you know mustbe coming and then when it finally gets here youre elated only to find that the only bug they fixed was one that affects the hindi speaking players. Its extremely frustrating. I have put in a lot of time and effort trying to get 'good' at their game and find myself and efforts thwarted at every turn. I know not to take it personally but how long does one wait before being ableto actually play the real game and not some knock off version of it because the bug fix is missing. I know its not my device it is the game and im not the only player tohave the same problems where after the last upgrade we cannot even play one on one wo being thrown out and having to reconnect. If i did not have my own club perhaps it would have made some difference perhaps i would have left by now. I do hope they live up to their hype , a lot of ppl depend on it. Its a shame when they really could be the best!
      Help, ive been shanghaiied!!!!!",https://itunes.apple.com/us/review?id=543186831&type=Purple%20Software,2019-04-22T03:33:48-07:00
8030669207,Sirk210,https://itunes.apple.com/us/reviews/id1181729769,5.5.6,3,Tired,"I’ve been playing this game since 2014. I used to love it but it’s all glitchy now. The game steals time from you by saying slow connection and it loads and loads until you barely have any time to take a shot or you’ve already forfeited your shot by timing out. Also, idk when this started happening… but if you make a shot the cue ball is repositioned from where it landed as if resetting. It’s blatant and isn’t moved by just a little bit either. You could have a straight shot lined up then all of a sudden when it’s time for you to line up your shot; you have to shoot from a funky angle. I’m not a huge fan of the ranking system now where you have to win so many trophies to get to the next league. I was level 120 diamond league before I had to create a new account at the start of 2020. Now I’m a level 111 emerald league. And I’d unlocked all the trophies up to Toronto before the trophy thing started. With that update, it gave me all those trophies in one shot bc of how many games I’d won to that point which is ridiculous. This game is getting frustrating already. I wish they’d stop changing things and fix these glitches.",https://itunes.apple.com/us/review?id=543186831&type=Purple%20Software,2021-11-16T09:06:03-07:00
4602311528,whiteclawsnobras,https://itunes.apple.com/us/reviews/id912396697,4.5.2,3,Game is OK,"For some unknown reason my first account got deleted out of the blue after having spent a decent amount of cash in the App Store for in game coins/cash/pool cues etc. Had no other choice but to make another account. The way they match you up with an opponent doesn’t make sense, you can be level 40 and get matched against someone who’s level 140 and has won over a billion coins, or you could be level 40 and play against someone who’s a level 5 it doesn’t make much sense. It also seems that after you stop using the App Store to buy coins and only use the free coins they give that they match you against harder opponents intentionally to make you blow through your coins quicker. Another thing I don’t like is you can buy an upgraded cue with in game coins and cash or pay via the App Store but you have to constantly “recharge” the cue for its abilities of better aim/power etc to work and it seems as though the “charge” only lasts maybe a few games before the cue that you paid for works the same as a regular cue they give for free. I guess with any free app it’s never truly free, but with something so simplistic as 8 Ball Pool you’d expect it to not be such a pain to play.",https://itunes.apple.com/us/review?id=543186831&type=Purple%20Software,2019-08-11T08:06:17-07:00
5936481771,the taci eater,https://itunes.apple.com/us/reviews/id975875244,4.8.5,4,Unfair advantages for lower levels!:(,"It’s unfair because lower levels can always win just because they are worse players. It doesn't make any sense that every time I play against players 9-16 level players I always lose and I’ve been play for over 5 months and I’m level 21 with yellow rank so I don’t get it please read whole review but it’s going to be looong.

Putting me against people higher levels then me just so i lose:
They put me against people higher levels then me in $5000 game and all in game just so I can lose it’s no fair for low levels like me it should be SBMM (Skill Based Match Making) which means I should go against people that is level 21 or 22 so I don’t know why when I do all in I’m going against a level 30-50 players like unfair right so I should stop playing but I don’t give up and there is a glitch when I practice in offline play it says play again for $25 when I do but it doesn’t work so I keep pressing it but then it says I don’t have enough money I check my money I have about $0 left when I hade $1000 sooooo, but other then that it’s a great game.",https://itunes.apple.com/us/review?id=543186831&type=Purple%20Software,2020-05-12T09:42:20-07:00
5535904063,Richard N Ofelia,https://itunes.apple.com/us/reviews/id1108849042,4.7.5,5,Richard N Ofelia,"I have a complaint about the cue stick on the side that is too close where it has cost me over 100 games as At times I am ready to shoot the 8 ball in as I am going to touch the cue stick to shoot it goes off very slowly costing me games. And many other times as I am going to shoot  pop up appears to distract me costing me many more games. The worst part is that on top of all this I have been robbed of about 90 to 100,000 coins. Don’t know how someone in control is doing it but an example, I had 102,000 coins and suddenly before I knew it, I had 90,000 coins as I continued to play it dwindled to 22,000 coins and it continues to happen. The reason I have not complained is that I didn’t know who to complain to since we are not provided with a number or anywhere to complain. Someone has to look at this. If it’s happening to me then it must be happening to others. I hope I get a reply on this because it seems to be a way someone is using to get players to buy more coins. It’s very noticeable to me.",https://itunes.apple.com/us/review?id=543186831&type=Purple%20Software,2020-02-15T11:47:22-07:00
7272977324,pemchile,https://itunes.apple.com/us/reviews/id348320801,5.3.1,4,Entertaining,"This is a great game app. Many great qualities and lots of enjoyment. A few critiques. (1) when you finish an 8-ball game, the app sets you up for the next game by presenting the game that will consume the highest number if coins rather than the game you just played. I have inadvertently bet 100,000 or 500,000 coins on a game just because the app put that choice first. A better option would be fir you to be presented with the city you played in last as your default choice on the screen. This is probably intentional to get you to use up your coins, but it’s irritating. (2) when you watch videos to win coins, they don’t give you as many as they say they will. The 7,500 video gives you 5,000 coins and the 10,000 video gives you 7,500 most of the time. Sometimes you get what it says you will, but I haven’t figured out what causes it to give you less than advertised. By the way, I have played my entire 8-Ball Pool “career” with just the beginner cue. I think it’s more fun to match skills with all the players that use fancy cues and still win 53.2% of the time.",https://itunes.apple.com/us/review?id=543186831&type=Purple%20Software,2021-04-28T03:11:28-07:00
6468470204,WiggleBiggle,https://itunes.apple.com/us/reviews/id193655090,5.0.1,4,Good game but I don’t like the new update,"If you like playing pool, you’ll like this game. It is fun to play and once you complete the tutorial you’ll find you got the hang of it pretty quickly. The game levels you up by “xp”(experience points) and the amount of tokens/coins you win. I’m not sure what the top level is but I have seen players whose lvls are 100+. My only complaint about the game is a recent update they made, you used to win 1 ring per 20ish games you won per “location” you played at (Ex: one of the 1v1 game “location” is “London pub”) but they just changed it to trophies which forces you to spend more tokens and play the higher cost games (Ex: you “bet” 100 tokens to win 200... etc.). I don’t like how it forces you to play higher up games as it makes me feel like it’s less about winning/having fun/skill up and more about spending more/or making in-game purchases. It would be nice to opt for a hybrid of both systems so that as long as you’re winning you can still skill up/lvl up rather than the focus being on spending. Still a super fun game and recommend.",https://itunes.apple.com/us/review?id=543186831&type=Purple%20Software,2020-09-25T15:31:02-07:00
6326108229,HopeLovePeaceNotWar,https://itunes.apple.com/us/reviews/id1114569662,4.9.0,4,Complicated,"So overall I like this game, but there are a few things that make me want to rip my hair out. First, every time you open the app you are shown an add for their own game. And if you accidentally press the ad than you get paid for like some coins or whatever. Second, my connection is pretty good so I’m assuming this is game, but my cue is always like either moving super fast or not moving at all. It’s weird and frustrating. Third, the spin wheel thing is rigged. For example, every time I spin it I get a hundred coins or something when there are options for like twenty thousand coins. I have been on this game for a while now and I always get the lowest amount of coins offered on it. Fourth, they sometimes pair me up with like level seventy people. I’m at level twenty so that’s a big jump. I would perfer if we played against people on our level or a few levels below or above us. This was it’s more fair and we get to play against people with our own skill level. But in total this game is ok and it’s fun and stuff just if the developers fixed those few problems than it would be perfect. Thanks! :)",https://itunes.apple.com/us/review?id=543186831&type=Purple%20Software,2020-08-16T06:18:00-07:00
1994217390,rhoblidnen,https://itunes.apple.com/us/reviews/id30617110,3.12.0,5,Not the best update.,"This is the best pool game I have played on any platform, in terms of the physics of the balls. However, I think this update is getting a bit gimmicky. I was already a bit sceptical of the VIP Points system, and the new Rings seem pointless, and are clearly just an attempt to get more people to make in-app purchases. 

The worst thing, though, is the guidelines being put back into the two highest tournaments. There are already plenty of other places to play a game with guidelines, there was no need to change that. There should have been at least another two higher priced guideline free tournaments put in above them to compensate. The tournaments are no longer a challenge.

EDIT: The latest update is even more annoying. Rental fees for matches now? Really? They’re virtual coins for crap’s sake! You’re essentially just lying about the prize money amount for that table. And these annoying prize boxes that give worthless cues that you have to upgrade. It’s just bringing in all the worst bits from the less popular Miniclip games.",https://itunes.apple.com/us/review?id=543186831&type=Purple%20Software,2017-12-13T14:39:51-07:00
5465419257,KB Gamer1982,https://itunes.apple.com/us/reviews/id383036881,4.6.2,1,Spend money and get soft banned,"I play this game often. I don’t normally spend money on in-app purchases. However, I really like this game and decided “why not?” From time to time I treat myself to some extra cash (or coins) on the app. I’ve played over 15,000 games, win percentage 42.8%, and not a lot of wins. I go through winning and losing spurts, but I play tables ranging from $100k to $2.5mil. I signed on to check my 8 hour box, only to realize that everything that I have purchased and won (fair and square) has been taken. I get a “Final Warning” pop up (mind you this is the first pop up I’ve ever seen). I’ve never used third party modifications, don’t have any extra accounts to transfer coins, nor have I offended anyone (I keep my chat off when I’m playing the game). This cannot be legal. I can see if I was doing anything on their “Final Warning” list, but I have actually worked to build up my account fairly. I will be closing my account, but I am looking to take further action before I do. You don’t pay for a product and allow the store to take it back at their leisure all in the name of something they make up. I work hard for my money in real life. If I purchase a product (service) in good faith, you will not be allowed to take it and expect me to bow out gracefully.",https://itunes.apple.com/us/review?id=543186831&type=Purple%20Software,2020-01-30T01:25:41-07:00
3901099013,~Danny G~,https://itunes.apple.com/us/reviews/id321442307,4.3.1,3,Fun game BUT...,"This is really a fun game with a good look BUT...

I gave the game 3 stars because there is definitely something wrong here. The biggest issue is the connection. I have lost countless games because of “slow connection” issues. Well, it’s not on my end. There is obviously a problem with the server or something in the software and it’s incredibly frustrating. I have played games where I sank the 8 ball, and I should have won, then the screen refreshes and my opponent sinks the 8 ball for the win. Are you kidding me? I have been in the middle of the game, made and sank my shot, then all of a sudden my opponent is shooting? In tournaments it’s even worse. I have lost the majority of the tournaments I entered solely because of connection issues. Beyond frustrating!

Bottom line, fun for the first hour then the game just go south as you start to level. There are enough people playing this game that I’m sure the developers are more than aware of the issues. I can’t think of any reason it hasn’t been resolved yet. That’s bad form in my opinion and I’m not the only one experiencing these issues. If they ever fix the connection problems I would give this app another try.",https://itunes.apple.com/us/review?id=543186831&type=Purple%20Software,2019-03-19T10:24:08-07:00
10504582244,ZORAN X,https://itunes.apple.com/us/reviews/id348238088,5.14.0,3,Decent game …. but …,"Over good game but does occasionally have flaws that will drive you mad.  Aiming is accurate more than 97% of the time but can be off as checked by a straight edge as much as six inches on a real table.  Balls that ricochet in the pocket always bounce out and never bounce in so it doesn’t take forward momentum in to account.  

Cue ball is notorious for finding crazy spots to land killing your shots or has a bias to scratch.  I’ve been stuck at a 72.1% win rate for three years which I joking say is due to me not spending on the game anymore.  No matter how hard I play it always centers there.  At first I tried very hard to improve as a personal challenge to get my win rate up.  Was having fun until I played a player named GHOST.  This player has a 99% win rate over 4,200 games which based on just the shear randomness of play and the skills of other players is in my opinion statistically impossible.  I would guess the game has been hacked so don’t put too much faith in your play.  Just play to have fun.  I do keep coming back to the game even though it has frustrated me enough to delete it about 24-30 times.",https://itunes.apple.com/us/review?id=543186831&type=Purple%20Software,2023-10-22T13:25:19-07:00
9626668219,Egan 123455654432,https://itunes.apple.com/us/reviews/id232856094,5.11.1,1,Too many Bots,"I like playing this game to pass time, but it’s a completely rigged app and the English settings dont make sense sometimes. It’s is big on money making and will try to get you to buy coins or “break your piggy bank” coincidently having enough coins for the level you’re trying to get a ring or trophy points for. For some reason it has to keep your wins around 50-60 percent each way so the only way to do that is either play players who run the table or play bots that know the outcome of the break and run every ball. Every break is rigged to the advantage of the player depending on their win rate, and if it’s a bot just quit while you’re ahead. Even if you’re on the 8 ball and the other player has 1 ball on the table, it’ll still find a way to defense the 8 ball shot. I’ve seen it too many times. Also when you’re playing for a lot of coins and then they hit every ball in and make a 3 rail bank on the 8. Pretty funny stuff. They also need to fix the low English feature, it scratches if you hit low and hard everytime. Probably a glitch or something. This game used to be fun back in the day, but now it’s too rigged, and you can’t level up without payin money so I’m stickin to just playing friends on it.",https://itunes.apple.com/us/review?id=543186831&type=Purple%20Software,2023-02-17T05:46:55-07:00
9396503225,gameprothe1st,https://itunes.apple.com/us/reviews/id873127721,5.11.0,1,Seriously read this it’s awful.,"This game is more anger then it is fun. When you first download it, it will be a pretty decent game as it is new. However as you play you will start to notice how ridiculous it really is. I have played game pigeon 8 ball and I never have any problems with the que ball going in the pot as much as it does on here. Iv even had times where it seems like it curves, gets spin i didn’t put on it, or even goes in a different direction then shown just to go into the pot. Game pigeon does not do this (at least it doesn’t happen in there for me near as much). Why does it here? I have even had times where I have gotten to the 8 ball and it’s like the que ball just doesn’t loose momentum to go into a pot despite using the same power on almost every shot and it not doing this. Then there is another problem where they match you with a level 65 at level 20. I don’t believe the levels are the problem but most of the time they have a god tier que and all the time in the world to make the shot and your stuck with a cow que or something. I’m not going to say they are but I am pretty sure matches are pre-determined sometimes but you can see this for yourself by playing. Unless you don’t want to waste your time.",https://itunes.apple.com/us/review?id=543186831&type=Purple%20Software,2022-12-14T13:51:41-07:00
6879041842,Danko Bangs,https://itunes.apple.com/us/reviews/id566750873,5.2.3,2,Definitely a fixed game...,"First off, you never know how the order of breaking is. You can win a bunch of matches and still not be the one to break for 4+ games. Sometimes it varies. You can recharge your cues and sometimes it doesn’t even make a difference in the shooting techniques that the cue offers. The quick fire in offline mode is definitely a good example..you can get to almost any tier and the white ball always seems to travel more than any other ball on the table, especially to the pockets 😅 the time always runs even when you are not shooting because the balls are rolling forever...it’s definitely never the same time given back to you when you are potting balls left and right. You can get a whole table cleared in a matter of seconds and still have 10 seconds before you run out of time and guess what?...the white ball happens to be sunk in a pocket 🥴🤦🏻‍♂️ it’s almost as if they want you to lose in any given game. You pretty much know if you will or not. Maybe it’s just the way the games are played, but definitely something I’d be weary of as I do on the daily. The moment you lose a first game, it’s all downhill from there. All because the opponent broke first as per usual.",https://itunes.apple.com/us/review?id=543186831&type=Purple%20Software,2021-01-16T19:16:29-07:00
5396567544,Southern60,https://itunes.apple.com/us/reviews/id954654237,4.6.2,2,Lose coins when winning!,"I have been playing for a couple of months now. Even though the game can be fun, it has some flaws and down right cheats. The first flaw I saw was moving of the cue ball by the game after play. More than one time I have left the cue ball against the rail at a pocket making for a really difficult shot for my opponent. Next thing I see is the game more the ball off the rail making the shot easier for my opponent. The next flaw is the level of the opponent it pairs you with. 9 out of 10 times I’m playing against someone with much more experience, rarely someone of the same or near level. Now to the cheating. Several times when I had cue ball in hand after my opponent pocketed it, I would have just set the ball down to line up a shot only to be told “time ran out.” The most it had been was 3 seconds but now my opponent had the ball again. The biggest cheat is the loss of coins when you win. That’s right. LOST COINS WHILE WINNING!! Just today at 2 different times I lost coins when I won games. The first time I won 2 games in a row and lost 500 coins. The second time I won the game and my total went down 3000 coins.  Doesn’t sound like much but it does add up for those just starting out.",https://itunes.apple.com/us/review?id=543186831&type=Purple%20Software,2020-01-12T18:30:33-07:00
10250248003,Plumbcrazysteve,https://itunes.apple.com/us/reviews/id571569178,5.13.1,5,GIVE GAME TIME BEFORE RATING,"I downloaded this game a few weeks back. I threw a couple of dollars into it and got myself a fancy que to go dominate the 8-ball pool world. I got whooped at every turn because the players in this game are really good!! I got angry and gave up, I wrote a nasty review about how Bob from Pakistan was taking my lunch and the developer was a crook. Luckily the gameplay was so good it kept me coming back for more!!! I kept studying how I was getting beat and why and before you know it I was getting better and better and better! Now instead of being frustrated with someone I have just really learned to enjoy the game and the interactions with others around the world!! It’s really MUCH more than a game it’s a community!! So my advice to new players is don’t get overwhelmed with all this game has to offer and take your time getting to know all the ins & outs of this wonderful community of pool players from all over the globe!!! To the developers who I criticized early I do apologize!! It truly is a fantastic game!!!!!",https://itunes.apple.com/us/review?id=543186831&type=Purple%20Software,2023-08-12T11:59:22-07:00
1827373722,Shovster,https://itunes.apple.com/us/reviews/id522560598,3.11.0,4,Ok,"I play a lot of ""real"" pool and I'm considered to be a good player so I speak from experience when I say although I find the game to be fun, it is in some ways not very realistic. My biggest issue is the constant scratching when there's no way it should happen, (I'm a 61% shooter but subtract all the games I've lost do to unnecessary scratches I'd be in the 70s) part of the issue is that the balls can travel way farther then on a real table, it's hard to bank 5 rails on real table but could probably go 10 rails with the game!. Another big issue is the angles a ball can be cut, there's no way to cut over 90 degrees but with the game u can make impossible cuts making playing defense much harder! Also think when the cue ball is on the rail or up against another ball you shouldn't be able to use low English like in a real game. Another thing that drives me nuts is I'm usually trying to play for 10 mil but way to often it makes me play a game for as low as a $100, when there's 4000 played surly there's a player that could play for more!,...That being said I still like to play but the game needs tweaked a little",https://itunes.apple.com/us/review?id=543186831&type=Purple%20Software,2017-10-04T14:06:08-07:00
