id,userName,userUrl,version,score,title,text,url,updated
6257153756,Guy CR,https://itunes.apple.com/us/reviews/id85774256,2.7.0,1,Wants access to my Gmail account? No thank you!,"First of all, I was asked to download this app in order to track the shipping on my order. but once I finally got it all set up, all it showed me was that my order had, in fact, been ordered... 😒 No shipment status or tracking info whatsoever.

Second, and more importantly, it asked to read my Gmail account, allegedly to better track shopping-related emails. At least they were open about why they wanted access to my info — I sincerely appreciate that. And, to be fair, there was an option to continue by granting them access to my Apple iCloud account (!?) or, in really tiny letters at the very bottom of the page, to continue by only verifying that I own my email address. I’m usually pretty comfortable with sacrificing small portions of my online privacy as a trade off for convenience. But wanting to read all my emails in order to track my shopping habits? That seems like gross overreach, and instantly made me skeptical of everything else about this app.",https://itunes.apple.com/us/review?id=1223471316&type=Purple%20Software,2020-07-29T16:26:02-07:00
5946391540,anonymousaly,https://itunes.apple.com/us/reviews/id1168732117,2.0.1,1,THE WORST STORE TO EVER TRY TO BUY ANYTHING FROM.,"I had placed my order with several items. I had received an email saying that they had received my order, and then I check my email a few days later saying that the order had been cancelled due to “unforeseen circumstances”. I had then called Windsor, the lady on the phone said that my billing information didn’t match up with my card (which makes no sense, considering I had looked at my bank app, and it showed that Windsor had taken the money out for this purchase... they told me it would take 2-10 business days for the money to reflect back into my account, here it is two days later, not 10 but the money should have already been put back into my account. Whatever you do, DO NOT order from Windsor. They will scam you online.
 
-A very unhappy customer who just wanted her items,  & will no longer try to place an order with this store. 

-My only option was to select a 1 star, but if I had the choice to select zero stars that would be my choice.",https://itunes.apple.com/us/review?id=1223471316&type=Purple%20Software,2020-05-14T18:20:48-07:00