id,userName,userUrl,version,score,title,text,url,updated
2123653760,Katieball88,https://itunes.apple.com/us/reviews/id496077592,3.12.3,5,8 Ball Pool,"By far the best game I’ve ever played. I started playing this game in 2011, stopped because I had forgot about it and then started it back up and everyday when I get off of work and get home I sit down and play to wind down and have a good time. I hardly ever win, (I mean my percentage is lower than 35%! Lol), but I still look forward to it everyday. I’m surprised that people have constantly stated that there is glitches and issues. I have played this game for years, across many different platforms and versions, NEVER HAVE I HAD ANY ISSUES, when the connection is having issues, it is my understanding that it is the internet connection of myself or my opponent, and in this kind of situation if you wait it out then you will become the winner at the end of time out. I assume that both parties are assumed winners and I think that is a great way to deal with any issues among players. I’m assuming that the people who complain are just sore losers, and can’t be ok with accepting a loss. I think it’s fun either way win or lose, but I do think that I should be better by now with all the time I have played haha.",https://itunes.apple.com/us/review?id=543186831&type=Purple%20Software,2018-01-24T18:54:06-07:00
6507352314,Finchman123,https://itunes.apple.com/us/reviews/id1135224164,5.0.1,4,Big Bug,"I’ve had this game for 6 years now and have played it on and off the entire time. There is a new bug I’ve noticed the past couple weeks that resulted in a warning that my account could be reset because the system thinks I’m hacking. The past three weeks I’ve noticed that any time I win a game, the coins I win don’t count toward the leaderboards. So for the past three weeks my account shows that I haven’t gained any winnings despite winning a few dozen games each week. I think because of this bug the app’s anti cheat software flagged my profile for going up roughly 10M coins but not showing any wins. 

Overall, this is a really fun game and a great way to pass the time (I mean, it has retained me as a player for 6 years). I would be really upset and probably never return to the game if I were to lose 6 years of progress including being level 150, have a collection power of 60, a gold tier VIP member, and 755M lifetime winnings due to a bug that is outside of my control. This is a very serious bug and needs to be fixed quickly or they will lose a long time player who has bought all of the premium season passes and plans to continue to do so.",https://itunes.apple.com/us/review?id=543186831&type=Purple%20Software,2020-10-06T10:34:01-07:00
3892520796,Luvthatspeed,https://itunes.apple.com/us/reviews/id241952315,4.3.1,5,Beware of what city is defaulted upon entering!,"I love this game but a MAJOR gripe I have is the defaulted city displayed as you enter the game. The higher rank and more coins you have the default city changes. If you have 100,001 coins, it will default to Toronto and if you are not careful you can accidentally select Toronto as you try to swipe to another city. If you accidentally select and lose, now you have 1 coin remaining.  Obviously this is not a design flaw but a design in order to make it flawed so you undoubtedly need to purchase coins to continue to play. Really pisses me off as I had earned alot of coins at lower levels by winning alot and with one mistake it cost me $2.5M coins.  I lost to a “person” without ever having a turn...break and run.  There is also no option to back out...once you select a city, thats it! You are playing that city.  At a minimum, there ought to be an option that prompts you to confirm if you really want to play that city.  This would have saved me millions of coins four of the five times I have accidentally made a selection on a city I did not want to play!",https://itunes.apple.com/us/review?id=543186831&type=Purple%20Software,2019-03-17T05:27:09-07:00
10531931564,The World’s Best,https://itunes.apple.com/us/reviews/id31875261,5.14.0,3,Unrealistic and Unfortunate,"I’m writing this review because I enjoy the game the different tables, pool cues, etc.  however, I’ve been playing this game for quite sometime and begin to review analytics on this game.  It’s been to my advantage and disadvantage.  For instance, out of 50 games played against the competition, if you miss and you’re under 3 balls left on the table, no matter how lousy the competition was performing, they cleared the table a staggering 98% of the time. Anyone who has physically played this game knows that isn’t possible, however, I understand the developers must make it fun for the casual player in order to be successful.  Another unrealistic feature is how every competitor can cut amazing. Especially if you continue to spend money and purchase multiple pool sticks. It would be nice to add to the “Practice Offline” feature the fundamentals and science to educate your audience. I know that’s a missed opportunity on the developers.  Like other gaming platforms, billiards is a game of poise, confidence, stance, & knowledge. The developers have not taken the time to find a way remedy this challenge.  It’s like saying all football or basketball players are equal in which clearly that’s not the case.",https://itunes.apple.com/us/review?id=543186831&type=Purple%20Software,2023-10-30T08:27:22-07:00
2103716847,LorenzoGThomas,https://itunes.apple.com/us/reviews/id542968008,3.12.3,2,This game is RIGGED,"I gave it 2 stars because used to enjoy playing it. But once I started to jump on some of the deals (.99 cents - 1.99) things changed. I started getting cheated out of games. There is no way I will be able to explain all that has happened for people to get an understanding of what I mean. I just can’t understand the physical logic of how I can be “right next” to the 8 ball on the last shot (say bottom left pocket) and I would literally just “tap” that ball..I mean literally JUST TAP it and that cue ball would bounce 2 rails and scratch on me on the opposite end of the table...there was not that much power put into the shot for that to have happened and yet it has happened multiple times over and over and over...please understand me when I say I TAPPED that ball, I mean I moved that cue stick the shortest amount possible...no one will get it so I will stop trying to explain it... but I feel cheated here, game was fun, but there are tooooo many physical impossibilities I have seen and cheating is going on...then they put you up against higher rated players...like a 20 level would be placed up against a 125..I mean seriously? It’s like they are setting you up to lose all the time so you will spend more..after I leave this review I am deleting this rigged and cheat of a game",https://itunes.apple.com/us/review?id=543186831&type=Purple%20Software,2018-01-18T23:32:24-07:00
7742923932,EmmJay1971,https://itunes.apple.com/us/reviews/id1212693721,5.4.5,1,"Love the game, Needs a block option","I absolutely love this game but over the past 2 weeks it’s been awful. Someone (a player from Brazil) added me as a friend (I did not friend back and can’t as he does not have the option to), and send me constant challenges, in game and out. I’m talking more than 50 challenges a day. I have changed my settings to only allow challenges from friends, but since he “friended” me and I have no control over that, it continues to happen. When I’m playing he sends them over and over, blocking the top part of my screen and impacting my game play. I have emailed miniclip and got a form letter with nothing to do with my issue. When I replied to that, I got another form letter with again nothing to do with issue. I replied a 3rd time and have heard nothing. I have the users player ID and asked him to be manually blocked, nothing. Miniclip NEEDS to add a “block player” option - or they are going to lose a player. I have friends this is happening to as well; and no response at all from miniclip. I’ve spent a lot of money on this game; and I’m ready to walk away because of this. If miniclip will take my request seriously I will change my rating. My phone blows up all day every day with notifications from this guy even though I have it turned off.",https://itunes.apple.com/us/review?id=543186831&type=Purple%20Software,2021-08-27T21:45:10-07:00
5618428978,babySamsMom,https://itunes.apple.com/us/reviews/id170778225,4.7.7,2,Game instability only gets worse w/time; WAY worse.,"Same bugs/obvious algorithm cheats & player hacks are worse 5+ yrs later! Same glitches-worsened w/time.  I experience SAME bizarre probs reported for yrs by the masses! PLUS, now seeing entirely new mutations of BS. Last 24 hrs of play-no matter if I win/lose; chg to new game@new/diff level of play-higher stakes, etc.,I am not given my turns at the break?! Even tried rebooting, etc.,zilch...Not once..game used to trade off :( not anymore?? 12+games-not given any of my many rightful turns to break  Updates are now worthless waste of  GIANT data gobbling inconveniences. ZERO fixes/improvements! Wthell is going on at miniclip? You seemed to have a very successful, fun & lucrative gig going. It’s slipping/slipped thru your hands. Your most devoted, longstanding & loyal patrons are bored with the lack of accountability. Truly disheartening/disappointing.  No effective measures taken to correct CORE probs. No help given to rectify wrongdoing-loss of coins, game drops, time/clock hacking-sinking shots only to have ball(s) “pop” back out of pocket, loss of turn AND remaining balls in play are SCRAMBLED!?!?? Wld Love some actual remedies in the form of restoration of lost coinage/credits/vip levels/badge tiers that deliver on their promises?!  Explanations welcomed-as is-this is just plain sad, it’s reflection of Y-O-U...",https://itunes.apple.com/us/review?id=543186831&type=Purple%20Software,2020-03-04T23:51:27-07:00
1691006319,Fastdraw78,https://itunes.apple.com/us/reviews/id6573057,3.10.2,4,Addictive,"Great game! I have loved it and made it to the 90's in player level. Despite my love for this game I have recently dropped it from 5 to 4 stars and here is why. 1) it has become impossible for me to win consistently. I understand a players skill can fluctuate especially as you move up in rank. I just don't understand how I can go from having almost 2 million in coins and winning 100,000 coin games to being unable to consistently win 500 coin games. I don't trust computer programming because as you can see with the spinning wheel, it can easily be rigged. I don't trust organizations that make money from games like 8ball pool because what's to stop them from rigging the outcome of a players consistency. 2) like others I see connectivity issues. HOWEVER, I know they come from my wifi network. When I switch to cellular internet I do no have issues. Therefore I know where the problem is. The issue I have with the programming is that if I have a network loss the game will let me continue to the point where I even make a shot. Then all of a sudden my game goes back in time erases my shot and shows my opponent that I have timed out. Very strange",https://itunes.apple.com/us/review?id=543186831&type=Purple%20Software,2017-07-20T16:54:04-07:00
5100660600,Delete123,https://itunes.apple.com/us/reviews/id280234317,4.6.0,3,English,"For the most part they have the physics pretty good, but no cigar. 
Using reverse English will land your cue ball in a pocket, for a scratch shot. 
You can almost bet the farm on it. More than not. I thought that maybe it wasn’t a glitch and it wouldn’t happen if you upgraded my stick to the highest level. No such luck. My stick is upgraded to the max and it scrTches every time if using hard English. It’s maddening and costs you game after game. Because most games usually hinge on one particular shot, 
that if it happens that it’s a hard English shot (hard meaning striking the cue ball with some power, pace) it’ll cost you the game. I’ve seen the cue ball seemingly go around other balls, like a guided missile to end up in the pocket forfeiting my shot and a lot of times the game. For such a good game to have such a glaring bug is a shame. By the way, there was a period in my life, I made my living shooting pool. So I know how English is suppose to work. And in this case, not work. That’s my only tic about the game. And after all it’s just a game, designed for entertainment, so if never fixed it won’t really matter. Just a game I’ve had a lot of fun playing. As the saying goes: if this is as bad as it gets, we’re in good shape. 
Enjoy",https://itunes.apple.com/us/review?id=543186831&type=Purple%20Software,2019-11-07T14:13:29-07:00
2833993870,Backspinforce,https://itunes.apple.com/us/reviews/id468252546,3.14.0,4,Fun,"I have played this game for years. If you take your time and play the games based on coins within your means it is fun. Nobody likes to lose but is addictive. With 8 & 9 ball and then tournaments,  play different ones when you have made bad shots and lost or want to extend your fun. I do get mad at times like everyone else but if you are playing low coin games you can have lots of fun and then can add your messages to create more stress so if it good luck or trash talk all goes both ways back and forth. You get free coins every day and can watch videos for more too. Like any other game when you get mad or bored give it a break for a couple days and come back to it. I have played this game for fun when traveling or at a doctors office waiting and connection is important but at home you can play friends and message each other in the game which makes it more fun. I switch among 8&9 ball and tournaments with different coin values and even though I do lose when I thought I wasn’t it still give new life when you lost and then you finally win again. Probably one of my overall favorite apps too so give it a try for a while if you like pool!",https://itunes.apple.com/us/review?id=543186831&type=Purple%20Software,2018-07-04T03:22:09-07:00
10536706826,zinneeman,https://itunes.apple.com/us/reviews/id642729182,5.14.3,4,The game I love is 8️⃣ 9️⃣ Ball,"I started playing this game a long time ago. when it first came out, it was as nice and fun as it is now. However, now it’s a little bit different with money and wild and confusing. constantly gets in the way of you playing or doing what you want on the app. It
keeps on trying to make you buy things or upgrade. Always into spending money to me. That’s just a little bit petty. It's because there’s a lot of kids here on the site. They could easily fall into the trap. It's an OK fun game, but I think it has to improve. Also, it is nice to be able to communicate a little with players. The game that you have to pick the pocket before you play, it doesn’t give you the Q stick on your hand, for you to be able to aim it. Hard to guess without the Q stick. What’s with this timer when you have to play in a calm way? The aim of the game is extremely sensitive. Why is there the money that you’re sitting there and you can’t collect a deposit into your account? What’s the purpose of that? I don’t get it every time I want to upgrade something I have to get it from my bank .",https://itunes.apple.com/us/review?id=543186831&type=Purple%20Software,2023-10-31T17:54:35-07:00
8438547394,EFax Not,https://itunes.apple.com/us/reviews/id494116398,5.6.7,2,"Revised Review. Bots, Brazilians, & Balls","Past week or so, App is glitching all over the place. Offers you free coins to view videos. Click on that, end up with black screen, no coins. It has also just shut off completely & return you to your computer desktop. It is very disheartening that you have such a gorgeous app, & you cheat endlessly with your bots & game control. Have a certain shot sure to go in? Nope, obvious screen control takes over & either makes you miss pocket, or pot the cue ball. Ever seen the Magic 8 ball? First few times you laugh. After that, you know you are being cheated. Opponent will pot the 8 ball accidentally, should lose their turn, but magically, the 8 ball reappears on table. Developers: you are better than this. Please just let us have a great fun app without all the obvious cheating! Once you fix this. I’ll edit my review. Peace.

While, of course, this game isn’t like playing real pool, it is still fun. Unfortunately I have to agree with others on here about robotic opponents matching up with you, very unrealistic movements from them. I think I’ve played with every Brazilian citizen alive. Every other opponent that is matched with me is Brazilian. What’s with that? Anyway, still fun. Just don’t spend any money on it!",https://itunes.apple.com/us/review?id=543186831&type=Purple%20Software,2022-03-09T16:21:59-07:00
7774467546,Pheonix😂❤️,https://itunes.apple.com/us/reviews/id1084469240,5.5.3,3,My rant,"At first I liked this game cuz playing pool is my favorite thing to do. I like how we get new cues and can customize the tables. I don’t really like the idea of upgrading the cues cuz it doesn’t make a difference to me but whatever🤷‍♂️.

However the more I play this game the more I realize the game cheats you out of games for an example. Every time I start the app up I immediately lose three games in a row and win two times in a row and then lose and resets my streak. But I don’t really care about that. The main problem is the bots and how they magically get a ball in from an angle that is near impossible🙄. ,But that still isn’t the main problem. The main problem is the amount of time I’ve lost it’s always been due to the fact I’ve had “slow connection” but I have never had any problems with my wifi or internet not even on apps that require lots of data. Also stop automatically giving people our money whenever we leave or quit. It’s annoying cuz what if the situation is urgent or you just don’t want to play anymore? The person shouldn’t have to lose money for quitting that wouldn’t happen in reality unless there are inputting a rule like that",https://itunes.apple.com/us/review?id=543186831&type=Purple%20Software,2021-09-05T08:51:47-07:00
4837940294,Theawesome0103,https://itunes.apple.com/us/reviews/id622714649,4.5.2,5,Updates to think about,"I’ve been playing for a long time and defiantly have thought about possible updates for this game. 
First - I wish their was a way to watch your friends play live. Like Clash of clans or other games you can watch clan mates and friends attack live, which would be really cool on this game. Even if you could send just replays to the club chat so others can watch would be awesome. 
Second - tournaments could be worked as well. The ones we have work tremendously well but making more/new ones would be even cooler. Club tournaments could be a possibility in this. Sending a tournament to the club and allowing club mates to join and play for a small prize at the end would be so fun. Which leads me to my next point that tournaments should go up in size to see who has some real skill. Especially if you have a lot of people in a clan then it would help to have like a 16 person tournament or something of greater numbers than 8.

This game is amazing and fun as always, I just like to try and invent new ideas to further it’s gameplay. 👍",https://itunes.apple.com/us/review?id=543186831&type=Purple%20Software,2019-09-25T16:44:22-07:00
9787724302,"Walter, Donny & The Dude",https://itunes.apple.com/us/reviews/id418289475,5.12.0,2,It’s a joke for honest players - cheaters win,"I’ve played this game for a lot of years and at this point, there is no way to win at the high pay scales due to the abundance of users with altered/hacked versions. When a player makes a full power shot the goes 5 rails before hitting the first of 4 balls to be pocketed on a single shot, you know at that point you have no chance against that player. It appears that the app company is OK with this even though you can report the offending player, nothing happens… I’ve played pool on actual pool tables for 30+ years, I know a good player when I see one and I also know cheats in the app. I’ve also experienced several times in the app where the position of the balls on the table were altered after a break, and never to my advantage. The other frustrating thing is 1 out of 5 times (20%) when I start playing 1 on 1 matches (8 or 9 ball), I get the chance to break, but usually not.

When playing people straight up, it’s a nice diversion. 

The other main issue is when playing 9 ball 1 on 1 matches (not tournaments), it’s a crap shoot as to whether or not the actual wager will be placed or if it will be magically changed to some other random amount.",https://itunes.apple.com/us/review?id=543186831&type=Purple%20Software,2023-04-04T17:47:07-07:00
5400400299,z-?,https://itunes.apple.com/us/reviews/id681253682,4.6.2,1,The game allows you to cheat,Although the graphics on this game are very good. there are a couple of major problems with playing this game as an app as opposed to reality. Number one when you scratch the ball should be placed on the area where the ball was placed during the break. In reality you can place the ball anywhere from the bumper to the imaginary line where the ball was placed during the break and you can only line up a shot on the balls ahead of that line towards the far bumper. The app allows you to place the ball anywhere on the table that you like and because of that when people do that they are cheating they know it but the game doesn’t stop them Which is odd because throughout the game you can’t shoot your opponents ball but in reality you can shoot the opponents ball you just lose your shot if you make it. The bottom line is because the game allows you to place the cue ball anywhere you like on the table to make any shot after a scratch destroys the games credibility and since you can’t chat with your opponent you can’t tell them hey you can’t do that even though they know.  before I play this game again you will have to fix that glitch it is very frustrating to know people are cheating and the game is allowing it and you can’t do anything about it that’s why you get a one star,https://itunes.apple.com/us/review?id=543186831&type=Purple%20Software,2020-01-13T17:19:44-07:00
1895030244,Minecart11 YouTube,https://itunes.apple.com/us/reviews/id461617748,3.11.1,1,Dont play this game!!! Its incredibly rigged!,"In every game you play, the app decides if you win or not. If you play an all in game, they will put you up against level 150s when you are level 13 so they make sure that you lose all of your chips so you have to buy more or wait an hour for 30 chips. The daily spin and wins are rigged as well. You always land on either 150 or 250 no matter what since it always starts on the same number. Even if you play against your friends in real time, the balls will defy all laws of physics. DO NOT SPEND MONEY ON THIS GAME!!! THAT IS WHAT THEY WANT YOU TO DO. Do not buy the special cues! It costs the price you bought to “recharge the cue” to be able to put cue spin on the cue ball. There is also the most obvious evidence that it is rigged: Your balls bounce out of the pockets while the opponent’s won’t. Just install an app like GamePigeon or Pool Break Lite to play pool with your friends or online. You might think it isn’t rigged at first because thats how they bring in new players. Once you start playing more often, they will start making you lose for reasons like “potting the 8 ball” when none of the balls hit it. I have RECORDED evidence of this. If you post about it on their support fourms they will ignore you or even go as far as deleting it.

Anyway that was my rant on this terrible game.",https://itunes.apple.com/us/review?id=543186831&type=Purple%20Software,2017-11-03T11:57:40-07:00
3831468271,stevewonders27,https://itunes.apple.com/us/reviews/id582624686,4.3.1,1,Game Breaking Bugs and Matchmaking,"I really love this game, but it’s hard to when you aren’t able to play. Every single game I get paired with someone from India or Brazil or somewhere where our connection isn’t stable. I can’t even count the hundreds of thousands of coins I’ve lost due to a crash caused by poor connection. It’s come to a point where it happens so commonly and in such important, high stakes games, where I am afraid to play the game. At least when your game fails to establish a somewhat ideal connection, don’t take away my coins that I’ve been forced to spend money on. I know for a fact that it is not my WiFi, so you cannot possibly blame it on that. I have noticed that every time I play someone from my country or even my continent that the games are faster and can actually run. But, this only seems to happen once every 20 games. The number of times I’ve been about to win a high stake game and then I lose because of “poor connection to server” has become substantially high. I am seriously afraid to play your game until I can be assured that I will be able to play a game safely without losing my coins which are tied to my actual money. Trust me, this review should really be a 5 star, but your game needs some serious fixing and some decent customer service if you want that.",https://itunes.apple.com/us/review?id=543186831&type=Purple%20Software,2019-03-01T23:36:48-07:00
