id,userName,userUrl,version,score,title,text,url,updated
5943173900,AudreyGething,https://itunes.apple.com/us/reviews/id243099571,16.0.0,5,Overall,"TikTok is a fun app for teens and some adults. There are cool trends to follow, fun hacks, DIYS, cooking/baking, technology, dance, etc. It has taught me a lot of very useful things, and has brought a lot of joy and entertainment. However, there are some cons to TikTok. First of all, it takes up a lot of your storage. I would suggest making it so the videos don’t save to your camera roll. Second of all, it takes up your battery very quickly. Third of all, it is very distracting and not so good to be on all day. Fourth of all, it is not included on the App Store for MacBooks which is frustrating because I need it considering my phone might break and I like to post daily or once every two days. Fifth of all there’s quite a bit of inappropriate content around the app, and Finally, there’s a ton of negativity circulating on the app. Which is shocking considering we are all isolated during a worldwide pandemic when we all need a lot of love and support. One thing I do like though is the other side of the people who stand up against the horrendous hate and negativity, and trust me I’ve seen horrendous things. So all of those cons just take away one star, because other than that, TikTok is super fun, and somewhat educational.",https://itunes.apple.com/us/review?id=835599320&type=Purple%20Software,2020-05-14T00:16:20-07:00
3858052881,Captain Gabby,https://itunes.apple.com/us/reviews/id164630697,10.3.0,5,BIG PROBLEM,"So I recently saw the age limit thing where you have log in your age and Tik Tok decides whether you are either too young or old enough to have the app. I had to log in my birthday and I turned 14 this year and was told that I was too young for the app. The age limit is said to be 12 and up but apparently 14 is under the age of twelve. Like, come on! I’m so frustrated about this. My account is being slowly deleted and I’m just standing by and watching my hard work, and effort go to waste. I really did enjoy this app and creating videos, but I can’t do so and keep going if I don’t have an account to proceed with. I had at least 920 something tik toks and now I’m up to 299, including loosing my hearts at which I had 6,200 something as well. Now I’m at 2,446 or around there last time I checked. This problem needs to be addressed cause I’m sick of it all ready want to have my account back to the way it was. I’ve seen other people talk about there friends being old enough to have the app and have their accounts deleted anyways. So if my account gets deleted for good I’m not gonna make another one and watch that one get deleted as well. I went to check if my old account was there and that one was gone too. PLEASE ADDRESS THIS PROBLEM",https://itunes.apple.com/us/review?id=835599320&type=Purple%20Software,2019-03-08T11:29:08-07:00
7427460248,steff_23,https://itunes.apple.com/us/reviews/id608752583,19.6.0,5,Dear TikTok,I hope TikTok dosent get taken down because honestly this app is amazing... it keeps me busy and it keeps me entertained! When I first downloaded this app I was 15!!! At first it was called musically ! I had at least 400 followers. And then TikTok was made! And I started watching people’s videos and I started making some of my own! I started to gain a lot of followers and I just loved doing TikToks it made me happy! I started to gain more when I got pregnant and having so many people follow my journey.... it was amazing to have so many people watch my belly grow and seeing my baby grow. It’s really touching ! I would love if this app stayed because we need it and we love having all this fun. I love all the TikTokers and it’s fun seeing them all make you cool dances for us to do. So I’m hoping this app stays because there’s a lot of us that want this app to stay for ever.... there’s just a bunch of memories on this app. We can’t take it away from them. And I would be so sad if all my videos and all our hard work went to waste! I have too many h videos of me and my belly growing and just watching all my viedos. And looking back. And see where I got here. So please don’t take away this app. We love it too much(:,https://itunes.apple.com/us/review?id=835599320&type=Purple%20Software,2021-06-04T18:00:27-07:00
9762887013,👍rover,https://itunes.apple.com/us/reviews/id1513296992,28.4.1,3,It’s okay…,"as a teen myself, I basically grew up with musically which was such a fun and happy place for me because there were many kids that could relate with me and barely any adults (basically never had any inappropriate videos at all), but I feel like ever since tiktok came out, I just never liked it. I do have to say that it takes forever for tiktok to ban certain tiktoks spreading stuff such as misinformation, toxicity, being inappropriate etc. while a lot of the time, they spend their time banning accounts that have done little to nothing at all, and I find that really sad. 

the second bit genuinely has nothing to do with tiktok itself, but more of its creators and people in tiktok. I’ve happen to notice that people have really changed through tiktok, mostly negatively. mental health issues have been a big thing on tiktok and many teens have been bullied through social media, specifically tiktok. I find tiktok to be such a toxic place that I just can’t bring myself to be on it. the people on this app need major help because a lot of them are basically just confined to their beds and do nothing but scroll through tiktoks and hating on creators for absolutely no reason. 

I love the app and all, the concept of it is nice, but I extremely dislike the people who make tiktok the way it is today (toxic).",https://itunes.apple.com/us/review?id=835599320&type=Purple%20Software,2023-03-28T18:56:22-07:00
9821663724,Sparker73083,https://itunes.apple.com/us/reviews/id206369164,28.9.1,5,It’s an addiction and I love it!,"TikTok is my go to app! I barely use any other social media platforms now. I have noticed they are constantly changing the algorithm and it can be brutal on views at times though. It can get discouraging when you put out regular content and your views are only 1% of your following. The math isn’t mathing. Regardless, I’ve never connected to an app the way I’ve connected to TikTok. My only complaint at this point is that certain stickers (GIFS) I use all the time are no longer available. I’m not sure if they took them down or as my account has grown, my access to certain tools has changed but it is very unfortunate because I was trying to keep a theme on my page and I’ve had to change it three times now because the stickers are gone. And they were basic stickers, just circles so doesn’t make sense. Even with those minor issues, it’s still a 5 star app for me! It’s just the perfect app for my personality. Plus, I’ve connected with so many new people that have the same interests. I’ve learned so much about my mental and physical health, training my dog, organizing, cooking, and so much more. Things I never would’ve known without the TikTok community.",https://itunes.apple.com/us/review?id=835599320&type=Purple%20Software,2023-04-14T11:11:35-07:00
6556056009,Qkfnandkak,https://itunes.apple.com/us/reviews/id612488607,17.7.1,4,Great App but...,"I think TikTok is a great app to be honest! It has help me grow in all kinds of different ways and is kind of addicting in a good way. However, I feel like there is more that TikTok could do to improve the app. For example, you should be able to see who duets a video. I feel like it would be easier if we want to see other people’s reactions and want to share that as well. I also feel like we should be able to have a story that is up for 24 hours so we don’t have to make videos about something we want to share that is really not that important. In addition to that, we should be able to repost videos on our story as well. I saw a really REALLY good danganronpa edit and it was SUPER underrated but I couldn’t share it with anyone because when I duetted it, it only got 2 views in a day. Also, I think we should be able to go live (like a FaceTime on live) with other people. It would be super fun! We used to have a feature where we could pin comments, but we can’t do that anymore? Which is kind of disappointing, but if you can do that again, it would be great! We should also be able to pin videos incase someone is new to an account and people want to introduce themselves. 

Anyway, I think that’s about all I wanted to share to help TikTok grow as a community and app.",https://itunes.apple.com/us/review?id=835599320&type=Purple%20Software,2020-10-20T11:56:56-07:00
8688065531,GroundNutsRUs,https://itunes.apple.com/us/reviews/id37658440,24.4.3,5,Good,"I used to not like TikTok that much, but the more I’ve used it the better it has gotten. Ever since I started posting, the app has overall been way more enjoyable. If you are a child who isn’t allowed to post, I bet you’ll still have fun on the app but honestly might not think its as entertaining. I’ve seen reviews that says in inappropriate- which is true in some ways. When you first get TikTok, the app doesn’t know you therefore it shows you extremely random videos. If you keep watching and follow a selection of creators you like, overtime TikTok will get used to you and show more things on your fyp that you want to see. I’ve seen people look through their following list because they hate their fyp, but i don’t see the need for that. obviously it takes time but if ur patient u could get to love ur for you page. I would recommend it but do follow the age recommendation. You could see dangerous/inappropriate stuff that you shouldn’t be exposed to at a young age. Overall though I love the app and basically never see anything bad. Lucky for me, when I got the app there weren’t any inappropriate trends at all so TikTok could get to know me without showing gross things.",https://itunes.apple.com/us/review?id=835599320&type=Purple%20Software,2022-05-19T16:38:27-07:00
8784915475,LucillaGorilla,https://itunes.apple.com/us/reviews/id1302919309,24.8.0,1,This app is creepy,"Why is no one talking abt how creepy this app is?? My FYP can read my literal mind. I think about a dance or song, and boom, there it it. The recent generation also was the attention span of a goldfish, and TikTok used it up like water. Their short videos mean nothing. You might find yourself scrolling mindlessly for hours. Nothing about this brings you joy. Every once and a while, you might find a good video. But seconds later, you’ll be scrolling once again. This app isn’t just a “waste of time” it is a life taker. Your days will be gobbled up with the endless amount of videos while you just scroll… scroll… scroll… maybe you’ll even end up liking a video or start following someone. But what does this even really mean? 38k followers? That might make you happy, but how long will this really last? Not to mention some of the people on this app, posting inappropriate content while some how TikTok guild lines skip over it; while other people trying to post things like informational videos get taken down or get given a warning. Why doesn’t TikTok want us to learn about the real world? Do they just expect us to go by their rules like we’re some kind of puppet? Why is TikTok the way it is? Thank you so much for reading, I sure did write a lot. And not to mention, TikTok knows everything. From what you do on any other app, website, or screen, to even your location. Goodbye, please stay safe.",https://itunes.apple.com/us/review?id=835599320&type=Purple%20Software,2022-06-17T20:57:58-07:00
5830180895,Kbonecutter,https://itunes.apple.com/us/reviews/id253331960,15.7.0,5,more to tik tok,"i LOVE tik tok so much. i think i speak for most of the population when i say that basically all i do during quarantine is make and watch tik tok. however, there are a few suggestions that i have. my first would be that there should be a dislike button on videos. a lot of the time if there is a controversial video people have to like it to save it which gives that creator more clout. if you put a dislike button, it shows the creator how many people he/she truly upset. i understand why that could be a bad thing but maybe try it and take it away if it gets too bad? this next suggestion is one that i have thought of since i got the app. when i really like a video, want to recreate it, show it to my friends, watch later, etc. i put the video into my favorites. however, i now have so many videos in my favorites that i can’t even find the video i need at the time. for this issue, i wish so deeply that the favorites section had different folders that you could name. this way, when you go to put the video in your favorites it asks which folder, you could name a folder, watch later, dances, show to people, etc. tik tok is a great app but please please please take my last idea into consideration.",https://itunes.apple.com/us/review?id=835599320&type=Purple%20Software,2020-04-18T08:42:57-07:00
10393967044,bigheadpatric,https://itunes.apple.com/us/reviews/id357725414,31.2.0,5,#keepgoingbighead,Creative influencer with a creative mind I enjoy the random interactions with TikTok peeps. I love you guys. 🤓💚 Creativity saves the world. Keep going Bigheadpatric. It’s Christmas. 🎬🐛🦋 I’ll be back. It’s January. Been sick but still alive and creating music on tik tok. 🤓💚 Well it’s spring almost. Been enjoying my tik tok making. New music and art and random Everyday stuff. I don’t get many likes but I enjoy having a place to put my ideas. It’s really fun. It’s spring already. I think. Tik tok to the rescue. It’s June and I’m still at it on my Bday month. I’m trying the promotion assistant to see if I can get more views. 🤓💚 Been a few months since I took time to share my tik tok journey. It’s now a musical world to me. Filled with simple good thought. 🤓💚 Almost Christmas time. Following the good thoughts. #hope #wish # dream #believe #love #smile #play #kindness #charity #mentalhealth these are great hashtags to share. #keepgoingbighead 🤓💚 #followthegoodthoughts It’s now April of 2023. I’m still enjoying creating and having a place to go to feel good about what I do each day. All the creating is very good for mental Health. 🤓💚 well it’s fall 2023 and I just keep writing music and making content to inspire. 🤓💚,https://itunes.apple.com/us/review?id=835599320&type=Purple%20Software,2023-09-21T23:33:17-07:00
6887320755,f.abbiiee,https://itunes.apple.com/us/reviews/id1111949259,18.3.0,4,Eye opening ❤️,"Alright. Straight to the point. Tiktok popped up mid app to review and I pressed 4 stars to be realistic I guess. I love this app. I became a content creator and gained a massive family in the time of 9 months. I’ve never felt more loved, appreciated, and accepted for what I do. I found a place. I love inspiring kids, I love being looked at as a role model. The only reason it’s not a 5, is because of some safety issues. In the most respectful way, there’s been graphic content uploaded as videos, profile pics, or some even use this platform as a second option to a really bad mannered behavior. It’s scary for younger kids, or any one really but mainly for the kids. TikTok though has done ways to help prevent these things by making their guidelines more stricter and undergoing huge movements like the profile picture incident. Which is good of them. Tiktok is quick to react, let’s make this app safe! They are being more safer! This app should be kid friendly as well or friendly to anyone really! This new upcoming generation could be at risk if a huge used platform is letting these things out there. Yes I know it’s a worldwide use and not every little thing would be fix! That’s why it’s a 4 star rating with a good job to TikTok for being listeners and giving a space I can work with and be myself!",https://itunes.apple.com/us/review?id=835599320&type=Purple%20Software,2021-01-18T22:30:45-07:00
10575867854,My love my world <33,https://itunes.apple.com/us/reviews/id1474305849,32.0.0,1,I so done,"I’ve made so many tictok accounts do you know how many of them got banned literally all of them I don’t even have TikTok. I literally have to wait until my birthday to get Instagram and yes I am literally 13. I’ve tried so many times and it does not work so I decided to try again and guess what I didn’t even get to the passcode  so I tried it again logging in with Facebook did not work. I tried in with login with google did not work. I logged in with so many things it did not work so I decided to report the problem. It literally hit me with the thanks for your feedback so it’s been months I decided to try again, and I finally made a TikTok account a day later got banned. So I’m just saying if you want to make tictok videos anyone a TikTok account get ready because it will banned you or maybe you’re just unlucky in TikTok doesn’t like you and TikTok banned you for the weirdest reasons. It says that you post too many videos, you post videos over the age of 18 and you do not meet the age of 13 my sister who is literally a 16 year old got banned for looking the age of 13. I mean come on my mom made a TikTok account she got banned for posting videos over the age of 18 she didn’t even have videos up there and heck every single video she posted was literally only she can see it so I’m just saying get ready for the amount of stupid reasons you will get banned thank you for your time and reading this",https://itunes.apple.com/us/review?id=835599320&type=Purple%20Software,2023-11-11T16:03:08-07:00
7897047409,Please read! -jenijka,https://itunes.apple.com/us/reviews/id1235724105,21.1.0,3,It’s good but there’s a few cons,"So the app is really good it has a bunch of cool filters and funny videos you can make videos of you choice and promote your buissness if you have one and it makes it very easy to. Tik tok is good for like making small videos or like just doing it for fun even though they recently added the 3 minute feature, so we can do longer videos like story times and stuff. But some of the cons is that the app can be very toxic sometimes for example if you see a video where somebody had a disorder or is different for other it’s like you already know what the comments are going to be about and they are bullying the person and being really rude. that app used to be fun but now it’s like more of a toxic stage and there’s now a lot of gender wars and people making fun of each other and it’s not really that type of fun app you like to get on to escape reality anymore. And I really think the members need to some joe update that and figure something out because honestly a lot of people are not wanting to go in the app and delete it because 
now you can easily get a bunch of hate for just making one simple dance video and everybody picks and chooses the smallest things about your video out and picks on you about it. And it’s really just not that type of fun app anymore.",https://itunes.apple.com/us/review?id=835599320&type=Purple%20Software,2021-10-09T17:15:53-07:00
7409660700,KillinmeSmalls94,https://itunes.apple.com/us/reviews/id403996601,19.6.0,3,Love-Hate Relationship,"I hate Tiktok just as much as I love it. As a “creator”, you can have several viral videos and gain tens of thousands just from those but someone else can post videos that aren’t even there’s and involve no originality or just have a video that involves some kind of fight or drama and gain a hundred thousand in a day just for posting something involving a fight. It’s stupid. Also, the outcasts in society dictate who stays and who goes on this app. People get banned for a having opinions or beliefs contrary to what’s popular. Also, the community guidelines are a joke because of seen one celebrity post nothing but dildos as his content on an app for people 12+ and I reported his videos and they “didn’t break community guidelines”. How is the environment supposed to be safe for everyone if this app allows soft-core porn while limiting content creators who’ve done nothing wrong. It makes 0 sense. That needs to be remedied. Plus it also allows women to bully men without recourse or consequence but men get banned if they say one thing against a woman. It’s hypocrisy at its finest. 

Besides that, I do love the videos that are funny, wholesome, or creative, and I’ve found a lot of good musicians on this app. I can only give it 3/5 stars because the cons just about even the scales with the pros; they almost tip the scales. But it is what it is",https://itunes.apple.com/us/review?id=835599320&type=Purple%20Software,2021-05-31T05:44:05-07:00
10014814883,Rattifer,https://itunes.apple.com/us/reviews/id175355180,29.7.0,5,So far so good.,"Everything seems to be working good. My only suggestion is to have more song choices that are 2+ or 3+ minutes long, and then in the window where you can search and browse songs, have them actually be located in the “2+” and “3+” categories, because I have actually found some longer song clips that are not located in the 2+ and 3+ categories. There is barely anything actually in those categories and half of those items are a minute or less, despite being in there. Also, from what i am gathering, there are tons of filters, effects…bells and whistles, but I can’t seem to find them. What i see are very short lists with mostly really dumb stuff i would never use, yet i see fun things being used in other peoples videos, but i cant find them. I read somewhere where it was suggesting that you somehow find them in other peoples videos and use them but I have no idea how to do that. I have tried following various directions but they don’t seem to be accurate. ??? I don’t understand why they aren’t located inside of those icon on the right hand side when you are editing. Other than that everything seems good. Thank you.",https://itunes.apple.com/us/review?id=835599320&type=Purple%20Software,2023-06-09T01:42:49-07:00
9745667330,Rhampton2511,https://itunes.apple.com/us/reviews/id1268898920,28.4.1,5,Rose Marie Hampton,"TikTok has manage to not only get people around the world together and United it’s amazing how this app not only manage to do that it also has lots of  different subjects , concerns and the truth on what’s happening around the world than any news media out their it keeps us all connected with the world outside of United States it has everything that Google and Facebook and Instagram does not it’s full with truth, knowledge , medical, natural medicine and animals around the world , government and dances lots of thing for the young kids and parents and people of all ages , this has been an app that I have had no problem with someone hacking unlike Facebook and Instagram and twitter that has been hack any concern about the video and you report it they are quick to analyze it and get back quickly I simply love it !! Person that created this app had one thing in mind to get the world together as one and to make it safe for us  to use without worrying about someone hacking us or spying on us like Facebook , twitters and Instagram has this man that created this app is a Genius to create such an amazing app TikTok is the way of the future with truth !!!!  
                            Rose M Hampton",https://itunes.apple.com/us/review?id=835599320&type=Purple%20Software,2023-03-23T22:48:37-07:00
8165982107,B.⚓,https://itunes.apple.com/us/reviews/id310525075,22.5.0,5,Caught me by surprise,"At first I thought I was too old to be on Tiktok. But after giving it a try I saw that I could be on Tiktok as a creator but also as a regular person that can enjoy content. I like that it curates to everything I’m interested in watching and things I never thought I’d be into I get to see. I appreciate that you can see 2 sides. I can see the people who I follow what they are up to and see what else everyone is into. I feel like I’m up to date and free to see trends or anything that’s funny or cool to see from everyone. I’m not married to just one set of people. Personally as a creator the direction as other apps such as Instagram…I’m no longer making an investment into because you are not getting seen by the people you follow or discovered by anyone new. Too much drama for me. Tiktok I do see it can sometimes place you in a box to only a certain type of viewers but at least they do try to push the video as much as it can go I believe. I like the direction they are in with how they are running the app. Tiktok I appreciate you for creating a space where you can get discovered, you can promote and you give everyone a fair chance to be seen and heard.",https://itunes.apple.com/us/review?id=835599320&type=Purple%20Software,2021-12-24T20:25:12-07:00
