id,userName,userUrl,version,score,title,text,url,updated
10444928652,anime xx lol,https://itunes.apple.com/us/reviews/id1371120929,31.4.0,5,TikTok is the best😻,"I honestly love tiktok, its features like, videos, likes, comments, shares, chatting, ext… I’ve been having tiktok for about 2 years now, and I really don’t have anything bad to say about this app! When the pandemic started I really was bored and had nothing to do. Until I downloaded it, and I was having fun, it’s just brings so many memories with me. The community is literally so nice! But mind you not everyone is nice, which I wish it would stop but unfortunately can’t. If you are trying to look for an app that you can share your feelings, or even opinions, then this app is tods for you! I find so many relatable videos in my Fyp which helped me a lot when I was at my lowest. It made me realize a lot of other people are going through the same things as me, and that I’m not alone on this. TikTok can make friendships go, and come. At one point I had a friend, but I sadly moved until I got tiktok, and got in touch with her. Ever since then me and her have the best friendship, but I think that happened because whenever I sent her a relatable video our friendship grew stronger with trust. I can go on and on of howTiktoks  changed my life! If you are looking for a great app then this is your chance!!",https://itunes.apple.com/us/review?id=835599320&type=Purple%20Software,2023-10-06T05:36:33-07:00
10668618852,lil grouch,https://itunes.apple.com/us/reviews/id593401004,32.3.0,3,A lot of growth,"Tik tok being one of the newest social media application is not only one of the best social media platforms of this generation but also connects you with so many different cultures and communities! I’ve been online since the MySpace era and can say tik tok will be hard to top good job to everyone involved with this project I see big things for the future of social media, but unfortunately moderation and the attention you receive from the people behind some of the community guideline procedures play into favorites and also break community guidelines without any real probable cause to the reasons behind taking down content or restricting access to certain features. I feel that if you have regular creators you should try and have a REAL support team reach out to them and continue to help them because like I said earlier anyone can play favorites or do anything on this application I’ve seen just about everything and i barely post or go live anymore now I just pay attention to algorithms and how you will allow some creators to poke fun at racism and make  jokes but ban people of other ethnic backgrounds for doing the same to themselves! People have to walk on eggshells and if you don’t know somebody on the inside or have any necessary connections sadly you will never be able to prove your innocence.",https://itunes.apple.com/us/review?id=835599320&type=Purple%20Software,2023-12-07T17:22:55-07:00
9557399025,Nichaveli0311,https://itunes.apple.com/us/reviews/id483536677,27.7.1,5,Amazing,"Amazing app for so many things. But beyond the obvious entertainment aspect of it, it gives the user a sense of community support. Feeling connected. supporting each other. Making friends. And also it gives the user tools to be able to create and design , as well as star in their own content that is seen by up to millions of people potentially. This app is also getting families a chance to be involved in something together. Especially in a time like 2020 (to current day) and quarantine happened, people moved 6 ft apart but because of TikTok we remained connected. And in the case of the family at home during quarantine, TikTok made a way for families to grow closer, engage in fun challenges and videos together. To learn more about each other, grow deeper connections and have fun together. Also, this app has helped people feeling down, alone, and possibly having self harm ideation, to find comfort in other on the platform. To find others who have felt or feel the same way. TikTok gives opportunities to those to find support or comfort or laughter in what it is they are seeking. I believe TikTok is amazing. I just began using a few weeks ago and I am amazed. I am also not being paid to say this.",https://itunes.apple.com/us/review?id=835599320&type=Purple%20Software,2023-01-28T10:57:11-07:00
5886289123,kkp_gymnast,https://itunes.apple.com/us/reviews/id683310918,15.9.1,5,"Love the app, but....","Hi, first I just wanted to say that I absolutely LOVE TikTok and use the app on a daily basis, but I have noticed a few things that bother me. The first thing is when you are uploading a video, you can’t save videos,sounds,etc. This bugs me because there a several times I’m on the For You Page and I want to save a video or sound, but I can’t because I’m uploading a video, and then I will accidentally lose the video or sound and not be able to get it back. The next thing is I only ever see people with 1.5k or more likes on my For You Page, and I would appreciate it very much if it were easier for smaller accounts to get views, because most of the time the smaller accounts work just as hard as the larger ones. The last thing is about the comments. I wish people couldn’t limit the comment section to only ONE person. I understand if it is limited where only friends can comment or if nobody could comment, but I feel like limiting the comment section to only one person could make people feel not welcome and it is a big waste of a comment section. Thank you for making it this far in my review. Once again, I LOVE TikTok but these are just some small things I don’t love.",https://itunes.apple.com/us/review?id=835599320&type=Purple%20Software,2020-04-30T18:17:31-07:00
8595449691,Ailychees,https://itunes.apple.com/us/reviews/id584536962,24.1.0,2,Lack of a real Support Team & Lack of Consistency in Updates,These issues began fall of 2021.I don’t know if it’s favorites or if other people are paying to push their LIVEstream. It feels like they’re mimicking Instagram “pay to play” for LIVE. I just noticed you can select who in your followers list to notify if you go LIVE instead of it being automatic. In order to do that you have to pay to advertise to your followers your going LIVE. It’s not pushing out to all my followers even though their notifications are on. (-1 star) Received community guideline violations without specifying what went against guidelines while on LIVE. No rhyme or reason other than possible mass reporting by spam accounts or trolls. There’s no warning message that my account is temporarily banned from going LIVE. Then if you get another ban within a timeframe your account gets removed completely. Be clear about why the account was temporarily banned and permanently banned. I don’t want to guess why; please tell what went against the guidelines in order to dispute it. I get no response from a real person from support. (-1 star) For update features I wish it was more consistent throughout accounts. Some accounts have stories but some don’t; some accounts see 3 different things like comment bar in the video instead of the description or the moving bubble comments and likes. (-1 star),https://itunes.apple.com/us/review?id=835599320&type=Purple%20Software,2022-04-22T13:48:30-07:00
7148284675,Mama4duck,https://itunes.apple.com/us/reviews/id37246411,18.8.0,3,‼️Stolen content‼️,"When one of my videos gets posted I want people to enjoy them; not steal them!! I posted a video a while back and I accidentally tapped on the sound button for it (it's my original sound too) and I see another video so I tap on it and it's my video, my edit, that I worked for hours on, cropped and shared on someone else’s platform, when I went to report it for “intellectual property infringement” it won't work, I would like to report that some stole my edit and didn't give me credit or ask permission to post my edit let alone cropping out my watermark! And the button to report that problem won't work!! Because other people are seeing that video and they are telling the person who posted my edit cropped to look like theirs “wow this is so good”. I realized someone tagged me in the comments of that video and said the original belonged to me which was very nice to do, but the damage is already done because other people are going to think they worked hard on that edit when all they did was a 20-second crop. NOT COOL!! It is wrong and they need to see that what they did was wrong. And I hear many other people have this problem too!! You need to fix your reporting button so I can report “intellectual property infringement”!!! PLEASE PLEASE PLEASE fix this!! That person needs to learn their lesson.",https://itunes.apple.com/us/review?id=835599320&type=Purple%20Software,2021-03-26T15:08:06-07:00
4579272709,purplefoxyfox,https://itunes.apple.com/us/reviews/id930114578,12.4.0,5,Tik tok 🤩🤪 😐,"So tik tok is one cool app! There’s a few problems. I think the videos are too short Bc when people wanna post story times, they constantly have to make more parts and more! I chose 3 stars because it’s a cool app but isn’t the best of them all, at all. But anyways, let’s stick to positive again and go to reasons it’s good. It’s awesome and I love the aesthetic videos that people post! And more videos. All the trends 🤩🤩. But anyways, it’s cool Bc you can watch and make any videos you want; appropriate videos! I recommend this app a lot but you’ll probably get addicted and some not! But otherwise, it has a few problems. •short videos 😐😑 •inappropriate videos that when reported, doesn’t get deleted •somewhat pornography •cussing and F boys •opinionated, yet inappropriately, children (or and teens, maybe adults)! It’s bothering me Bc they say periods are disgusting and that a month or hair color changes your personality—like what?! •inappropriate comments! And that’s all the problems. Just a few..heh 😑😑. I would delete it but the addiction of the app rating is up to 📈!! ~• this is my opinion about the app but some parts are actually true and I’m sorry if this annoys y’all but I asked 10 ppl and they agreed!!•~ that’s all though but I still recommend this okay-ish! Bye •~",https://itunes.apple.com/us/review?id=835599320&type=Purple%20Software,2019-08-06T18:14:54-07:00
9858518951,19/ hi,https://itunes.apple.com/us/reviews/id1122029929,29.1.1,5,Give me my account please,"So I would’ve given this app a higher rating, but not anymore. Now, I think I hate it all because one night my account had been banned for no reason at all. I am of age and i haven’t violated any of the community guidelines so this was all a huge mistake!!! I’m doing everything I can to get my account back and ever since my ban I haven’t been able to have one night of sleep without crying. So please tiktok, and I know you’ve noticed me by how many reports I’ve made, give my account back!

Tiktok I actually hate this app. I’ve been banned at least five times now for absolutely no reason. I’ve tried to appeal before but it hasn’t worked. I’ve tomen pictures with my ID to show that I am of age to have tiktok but I guess apparently I’m still to young. Just because someone looks young doesn’t mean they are to young. I guess this shows how awful the security of online safety is. I honestly just think that whenever a video gets over 300 likes they immediately ban the person because I had just posted a video today that got 400+ likes and low and behold I was banned. I hate this app and I don’t recommend it. Tiktok please fix this and for the last time GIVE ME MY ACCOUNT BACK!",https://itunes.apple.com/us/review?id=835599320&type=Purple%20Software,2023-04-24T22:52:13-07:00
10801540192,T-Mobile4%,https://itunes.apple.com/us/reviews/id1597695462,32.8.0,3,Repost button is disappearing?,"Hi, before I address my problems, I just wanna say I love TikTok, TikTok is a very fun and good app I like to use, but the issue is, my repost button will randomly get taken off, I have 2 accounts in TikTok, one as my main account, and one as my backup. So recently I’ve been switching from my main account to my backup, and I’ve been on my backup account more often, but Everytime i switch from my main account, I go on my 2nd account and I’ll be scrolling, and if I find something I wanna repost, I tap the share button, and I can’t find the repost button, and when I try to look at inbox, it takes of the “active now” button. So if I’m on my main account I still have my repost button but once I change too my backup account, i don’t find my repost button and I can’t repost things, and it’s really irritating, because sometimes when I try to go back to my main it takes it off in there as well. I’ve mentioned it 2 or 3 times in the TikTok report, but it’s never been resolved. I would like for this to be fixed, I want to repost on my main and backup account. But it just randomly disappears, and it’s almost every time I switch. Please fix the issue, it’s very frustrating. I even deleted TikTok for a week and it still hasn’t fixed. As I said please fix it. Thank you!",https://itunes.apple.com/us/review?id=835599320&type=Purple%20Software,2024-01-09T00:40:09-07:00
7760244027,sis 1957,https://itunes.apple.com/us/reviews/id950407801,20.7.1,5,Concerned,Hello I don’t have much talent when it comes to you know making videos and what have you what I do have a talent for is listening and understanding and then trying to come up with a solution rather than throw fuel on the fire. I’ve noticed that a lot of the creators on TickTock that are of African dissent get in trouble for bullying and other things you feel are a violation. If we respond as an African-American woman if we respond to someone bullying us who are you two criticize and chastise us four verbally handling someone who is being disrespectful willfully disrespectful to us. This just shows me that you who are in control of TickTock are showing your true colors and maybe have blinders on if you can’t see or here what some Caucasian creators are saying about black people I’ll have you know I don’t look like a monkey nor do I sit out on the porch but yet and still this is what we are called porch monkeys you have to know that the God you serve had a son that has skin of amber and hair of sheep‘s wool his feet were like burnt bronze this man is of color stop being disrespectful to black creators and let them speak their minds without being put in what they called and I quote tick-tock jail thank you so much for listening,https://itunes.apple.com/us/review?id=835599320&type=Purple%20Software,2021-09-01T14:45:54-07:00
6678225816,The Most Wonderful App Critic,https://itunes.apple.com/us/reviews/id1158244668,18.0.0,5,Best app ever!,"I’m a teenager who got tiktok and honestly, I don’t regret it. Originally I didn’t want tiktok because it was so overrated, but with so many people using it I decided to give it a try, I have got to say, i made the right choice. I have a LOT of social media, and they don’t even compare. There is so much you can do on tiktok, and it’s actually very easy to get famous compared to other social media’s, because everyone has equal opportunities. Aside from that, when tiktok says trends start here, I used to just roll my eyes, but now I literally see that around 80% of the trends I see are based on tiktok. Anything can go viral there in less than an hour. About age limits, I wouldn’t recommend this app for anyone under 12, because it does have cursing, and content that is not appropriate for younger audiences, however, if it is a parent managed account, parents are able to control what their child watches, what their child posts, they can make the account private, so that only friends can see their posts, and they can even block curse words. If you are thinking about getting tiktok, whether you are a kid, teen, or parent, just do it, and if you don’t like what you see, you can always take it off.",https://itunes.apple.com/us/review?id=835599320&type=Purple%20Software,2020-11-23T11:55:41-07:00
7411095403,OatmealGangstee,https://itunes.apple.com/us/reviews/id1114538567,19.6.0,3,Don’t waist your time,"Now I’ll have to give it to TikTok it is a well made platform with many great creators and a bunch amazing qualities, but at the same time it feels like gambling of the media world. Now with most other platforms there is more choice in what you watch and consume but on TikTok there’s no filter, you watch what it points in front of you. And the vast majority of the creators, or should I say people who have posted some on TikTok, have no intentions of creating a actual good video. They are there to post something and get views. More then less the videos on TikTok are just to waist your time and try to pander to their audience and not make a good or worthwhile video. With that being said this goes nothing against the TikTok platform, I think TikTok was a great idea yet the publicity of it made it a place for people to search for stardom in their own way, since the bases of the TikTok platform can promote this single video that is bad quality with no reason to exist to million of views and likes. Now also TikTok is extremely addicting to a point where it is unhealthy. It’s strategy is for you when you are bored to open up and watch 1 or 2 videos but then you go down a long route of watching hundreds of videos and you spend hours of your life. My advice. Don’t get it, and watch a different platform.
Thank you",https://itunes.apple.com/us/review?id=835599320&type=Purple%20Software,2021-05-31T13:40:18-07:00
10734615671,Kingofbavaria,https://itunes.apple.com/us/reviews/id23031716,32.5.0,5,"TikTok is not what they’re claiming, fortunately.","There were several pretty cool videos on Facebook that I realized were from TikTok so that’s when I decided to get on this app as well. Originally I thought it was ridiculous crap like dancing hospital workers….and it was, until I learned the secret. When you scroll past the inane nonsense and start searching for the juicy stuff, that’s what you start getting, all the juicy stuff that was forbidden on the other social media apps. It was so obvious to me why Washington DC was so adamant about censoring it and ultimately shutting it down, why? Because among other things it makes them look bad. Not through slander or defamation of character, no not at all. What it does is just shows us who they really are, all their ignorance and hypocrisy, the way they’re trying to keep us at odds while they commit crimes of epic proportion, lying and stealing from us. So many clips you wouldn’t normally search for of a boring and or political nature brought to you highlighting their favorite past time, self serving. And I’m not concerned about China spying on me, Zuckerberg already sold my information to the highest bidder. I go to TikTok as frequently as I go to telegram, the others are child’s play.",https://itunes.apple.com/us/review?id=835599320&type=Purple%20Software,2023-12-23T02:47:54-07:00
10776124109,scipeoskicloud,https://itunes.apple.com/us/reviews/id1311631351,32.7.0,4,It’s alright.,"So overall it’s a pretty good app. But it’s like when I search something it’s like, for example I look up a tv show I like that’s underrated to see if there is a community that likes what I like. Then it just shows 2 videos about what I searched. Today I looked up for people who the exact same problem. Then it shows me stalkers getting caught on camera. And if watch a pretty funny video I will always tap the search before it was a new feature to me. It used to be great and helpful so you don’t have to spend like 3 minutes spelling what you want because of autocorrect. Now it’s stupid things I didn’t ask for. Stuff like, when I watch a stranger things 4 edit or video it says “stranger things 5 release date” and when it actually gives me what I searched for it will give some random pop up of “what others searched for” and it will say “Steve Harvey dead at 56” or “IShowSpeed gay kiss/gay confirmed.” Even “bugha gay.” TikTok please fix these issues. It’s still a good app. Maybe just give us a option to turn the search off when it seems to get a little weird. So please if your a person who wants the app and is reading this just beware of the problems of the search. Oh and please ban people that quite literally post porn and hentai.",https://itunes.apple.com/us/review?id=835599320&type=Purple%20Software,2024-01-02T12:52:25-07:00
7852049195,Camdog13108,https://itunes.apple.com/us/reviews/id1011595636,21.1.0,5,Enjoyable. Interactive.,"Hands down one of the best apps out there. This isn’t just a social media app, this is a place of laughter, hands to your mouth, tearing eyes, and so much more emotions with this app. TikTok is not like Snapchat or Facebook, it’s better. It’s so amazing to see how many people do so many great things. You can explore memes, people giving to the homeless, adult jokes, and so much more. You can comment on posts for millions to see. Like videos to show support. Follow to show love. Share to friends to help the creator grow. You can look at any topic you like including: music, art, wholesome, funny, memes, aviation, news, school subjects, and so much more. If you want to get away from people or the world for a little, this is the place to go. There are things strictly on this app only for kids 13+. But with the new TikTok policy, everyone is safe(including children). You can even chat privately with creators that follow you and you follow them. In order to do that you need to verify your account by giving your phone number. You can even make multiple accounts. TikTok is safe, fun, and engaging. All in all, TikTok is the go to app if your feeling lonely, sad, scared or more. Love you all! Thank you for reading.",https://itunes.apple.com/us/review?id=835599320&type=Purple%20Software,2021-09-27T15:06:20-07:00
10173157734,OhioCaliBama,https://itunes.apple.com/us/reviews/id100769915,30.4.0,1,Racially Biased App,"Since downloading this app I have noticed several complaints of racism and racially bias related issues. Specifically from “people of color”. I’ve seen people of color’s content be torn down, have their profile blocked, and even banned. All of which I have not seen equal treatment for “people of non color” on this app for the exact same issues. To provide context, I recently reported 5 videos on this app. Videos to which the reason for having decided to report were all the same. “Pornography and nudity.” Two of the 5 videos that I reported were women wearing “see through” shirts and showing off their nude chest. These two of course were “people of non color”. The reporting results for both videos was listed as “no violations found”. Meanwhile, the other three videos I reported were women of color. These women were much more concealed, however, they also showed some form of “pornography or nudity”. The reporting results for those three videos were listed as “under investigation”. As a person of color I find this to be completely and totally unacceptable. It is something that I have witnessed being reported by large amounts of “people of color”. Absolutely no actions to correct this inequality has been taken on behalf of the app’s administrator. As a “person of color”, I would like to see fairness and equality be displayed at a higher level for all people across social media and their supporting apps.",https://itunes.apple.com/us/review?id=835599320&type=Purple%20Software,2023-07-23T08:04:01-07:00
8741434469,Payton Jordan,https://itunes.apple.com/us/reviews/id1398046539,24.6.0,3,A place to start,"Hello! My name is Payton, today I am writing a review for one of my most favorite apps. There are so many good things about this app, the selections, the filters, the sounds, and the people you can meet on the app! You always want to keep on the good side of tiktok, with kind people and people who don’t expose their bodies for views. TikTok tries their best to ban people, but most of the time they end up banning the wrong people at the wrong time. TikTok makes multiple mistakes and has let me and others down, despite being my favorite app because of the things you can do on it, there truly is a bad side of TikTok. TikTok tends to have bugs here and there, but one of the bugs they have are so annoying. At a point in time, a few days ago, people couldn’t follow people back. This went on for 2-3 days. It didn’t fix until the next day because you could have 100 people following you, and you didn’t follow back at least 1 of them. Also , what is stupid is that they have sending messages too fast now. It’s annoying, what if it’s my best friend and we only text on tiktok ? Sometimes what TikTok does is actually annoying and makes me want to delete the app. Despite all of this, TikTok is a great app, but could use some improving. Thanks for reading this review, hope you have a great day! Chow !",https://itunes.apple.com/us/review?id=835599320&type=Purple%20Software,2022-06-04T13:46:33-07:00
