id,userName,userUrl,version,score,title,text,url,updated
9068809785,Soon2Bcutcord,https://itunes.apple.com/us/reviews/id497635364,22.33.3,5,Wow!,"This is an example of how we need to be great sellers! 
Excellent description, quick shipping, I only wish there was a business card! No worries I copied the info!! Thanks so much💥💥💥
Lesley",https://itunes.apple.com/us/review?id=632064380&type=Purple%20Software,2022-09-09T16:08:36-07:00
8311880244,Nanci Cruz,https://itunes.apple.com/us/reviews/id108152787,22.3.3,5,Good Application!,The only thing is that to many notifications and we need a sorting for the like items please.,https://itunes.apple.com/us/review?id=632064380&type=Purple%20Software,2022-02-02T12:47:49-07:00
8874853191,Waste of time!! 🙄,https://itunes.apple.com/us/reviews/id164009059,22.25.1,1,RUN.,I’ve been on Vinted for 5+ years now Aand can honestly say this is the WORST resale app. Both traffic and “support” are completely non existant. My items got deleted for “commercial resale” and it is impossible to contact support. I keep receiving threats of being blocked if I don’t delete what THEY think are commercial items. SMH. It’s not worth the download. Run fast & far!!,https://itunes.apple.com/us/review?id=632064380&type=Purple%20Software,2022-07-14T18:17:59-07:00
8132847091,crisrguez,https://itunes.apple.com/us/reviews/id1033197715,21.41.2,5,Amazing experience,Seller is very nice and responsive. She sent the package right away and included a little note + gift. Highly recommend!,https://itunes.apple.com/us/review?id=632064380&type=Purple%20Software,2021-12-15T06:41:00-07:00
10192981043,Wigglyss,https://itunes.apple.com/us/reviews/id1135685083,23.28.1,5,Recommend!,The items can just as pictured! and they were delivered earlier then expected 🥳,https://itunes.apple.com/us/review?id=632064380&type=Purple%20Software,2023-07-28T14:19:24-07:00
9741348528,LPearlJune,https://itunes.apple.com/us/reviews/id1498545132,23.11.2,5,Stripe Dress,"Such a cute little dress, costume quality, but I expected as much given what I paid for it. Wonderful seller, would shop her closet again!",https://itunes.apple.com/us/review?id=632064380&type=Purple%20Software,2023-03-22T15:39:36-07:00
8918662711,iwanttoski,https://itunes.apple.com/us/reviews/id663874056,22.27.0,5,Cool platform-inconsistent shipping prices,"Have had great luck with all the sellers I’ve bought from, just don’t love the shipping prices jumping up randomly.",https://itunes.apple.com/us/review?id=632064380&type=Purple%20Software,2022-07-27T17:56:01-07:00
9196364712,twiggiebottwig,https://itunes.apple.com/us/reviews/id1205150362,22.38.0,4,Good,It wouldn’t let me pay for a pier of shoes with and my my credit cards. Eventually one of them worked and they came in the mail. Overall it’s a nice app.,https://itunes.apple.com/us/review?id=632064380&type=Purple%20Software,2022-10-18T00:58:03-07:00
8783281267,scan for iphone21,https://itunes.apple.com/us/reviews/id1243305864,22.21.1,5,Beautiful dress and exactly how it was described,The dress came beautiful with tags and it looks absolutely gorgeous on my daughter. The seller was very prompt and got my order out fast.,https://itunes.apple.com/us/review?id=632064380&type=Purple%20Software,2022-06-17T08:47:21-07:00
8536090932,Della Storey,https://itunes.apple.com/us/reviews/id821042209,22.12.0,5,Cherry Earrings,The earrings are so pretty!!!  My granddaughter will love them!!!  The seller gave excellent customer service. I would definitely buy from her again. 🥰,https://itunes.apple.com/us/review?id=632064380&type=Purple%20Software,2022-04-05T17:00:19-07:00
8753255655,mincraftuser$,https://itunes.apple.com/us/reviews/id1054551365,22.20.0,1,I didn’t even get to use it,"The prices looked good and whatever but I can’t even make a account because it’s impossible to make a user name. EVERYTHING I typed in was either taken or “not valid” you can only use numbers and letters and apparently it can’t be more than 4 or 6, I tired for 20 MINUTES and I just ended up deleting it.",https://itunes.apple.com/us/review?id=632064380&type=Purple%20Software,2022-06-08T04:48:39-07:00
8343866316,Christynkids3,https://itunes.apple.com/us/reviews/id801219247,22.4.2,5,Christy,Very timely service. From questions responded to immediately & rec’ve item even faster then I hoped. 2days!! Will use her again!,https://itunes.apple.com/us/review?id=632064380&type=Purple%20Software,2022-02-11T06:46:40-07:00
10022812444,Eflo09,https://itunes.apple.com/us/reviews/id235122554,23.22.0,5,Jeans and sandals,I was very happy how fast she replied and put my order together and was easy about bundles. Package was mailed out fast and got it and was very happy.,https://itunes.apple.com/us/review?id=632064380&type=Purple%20Software,2023-06-11T07:39:26-07:00
9361992562,Mona1800,https://itunes.apple.com/us/reviews/id987327891,22.44.0,5,Thank you so much!…the item was excellent 👌and receive fast 🤓,Thank you so much!….the item was excellent 👌and shipped faster 🎄,https://itunes.apple.com/us/review?id=632064380&type=Purple%20Software,2022-12-04T19:25:40-07:00
9526219746,Ailes-dange,https://itunes.apple.com/us/reviews/id29951387,23.2.0,4,Wish you could sort closets,I have enjoyed using the app but I really wish there was a way to sort or filter out sizes in each closet.,https://itunes.apple.com/us/review?id=632064380&type=Purple%20Software,2023-01-19T19:04:17-07:00
9102404372,Ash Graham,https://itunes.apple.com/us/reviews/id1294091450,22.35.1,5,Happy Customer :),Everything arrived quickly and safely and shoes look great! Vee was also very communicative and easy to work with. Thanks again Vee!,https://itunes.apple.com/us/review?id=632064380&type=Purple%20Software,2022-09-19T20:07:10-07:00
8481339152,Curlytop19,https://itunes.apple.com/us/reviews/id188174593,22.9.0,5,Love everything!,Thank you so much! Fast shipping and both items were just as described. I love them!,https://itunes.apple.com/us/review?id=632064380&type=Purple%20Software,2022-03-21T16:44:17-07:00
8774516682,Someone012356549,https://itunes.apple.com/us/reviews/id303514852,22.21.1,1,BUYERS BEWARE!!!!,There is not protection for buyers on this app. I cannot believe this app makes the buyer pay $0.70 for “buyer protection” when there isn’t even any protection. Buyers should not have to pay for return labels if the seller mistags or lied about an item. The Vinted team or seller should have to pay for it. This app is a joke and I don’t think I will be selling or buying on it anymore.,https://itunes.apple.com/us/review?id=632064380&type=Purple%20Software,2022-06-14T16:03:46-07:00
8639988091,Jessy11112,https://itunes.apple.com/us/reviews/id291264379,22.15.1,1,DO NOT USE THIS HORRIBLE APP,"Worst app ever. Customer service is bull. They don’t listen to you. They simply don’t care. I don’t recommend to anyone. Save yourself the headache and don’t bother with this app at all. Don’t tell your friends or family about it. Stay away. Use mercari, poshmark, curtsy… much more reasonable… fees and all! I’d give zero stars here if I could cause they don’t deserve even one.",https://itunes.apple.com/us/review?id=632064380&type=Purple%20Software,2022-05-05T08:14:55-07:00
10718848646,Ninanainani,https://itunes.apple.com/us/reviews/id652165889,23.48.0,5,Great seller,My order arrived in perfect conditions. I asked them to ship it asap since it was a gift for Christmas and they were sooo helpful!!,https://itunes.apple.com/us/review?id=632064380&type=Purple%20Software,2023-12-19T10:35:18-07:00
8165978637,Gareth treating,https://itunes.apple.com/us/reviews/id404163426,21.42.0,1,Don’t be fooled by the good ratings,"Had around 30 listings and they all were suddenly taken down as they believed I was “commercial listing”. Takes a while to update each post (15 seconds) and I’m not very fond of their plain generic layout. As a buyer, I find a lot of junk for unreasonable prices. Go to Depop for exceptionally better vintage finds!",https://itunes.apple.com/us/review?id=632064380&type=Purple%20Software,2021-12-24T20:23:38-07:00
10396361553,MeekaJaySam,https://itunes.apple.com/us/reviews/id991117903,23.36.1,5,My order.,"Thanks so much for my beautiful bag, and also for the cute shorts! I love them both! They are exactly like I saw them in your listing. Thanks! ⭐️⭐️⭐️⭐️⭐️⭐️⭐️",https://itunes.apple.com/us/review?id=632064380&type=Purple%20Software,2023-09-22T15:05:01-07:00
9984317925,tvantic,https://itunes.apple.com/us/reviews/id609655503,23.21.0,5,Awesome seller,This is my first purchase so I am not sure this is review about the site or seller. About the seller nightly recommended . A  Amazing  communication and goes above and beyond. Thanks 🙏🙏🥰🥰💓💓,https://itunes.apple.com/us/review?id=632064380&type=Purple%20Software,2023-05-31T07:12:25-07:00
8661833045,HazyEyes03,https://itunes.apple.com/us/reviews/id961774510,22.16.0,5,Thank you,"I love this shirt so Much and you made
My day when i received it. Thank you so much! If i could give u ten stars i would:)",https://itunes.apple.com/us/review?id=632064380&type=Purple%20Software,2022-05-11T19:32:34-07:00
9652754814,schwabby17,https://itunes.apple.com/us/reviews/id1477451670,23.7.0,4,Slow after update,"Ever since the new update, my app won’t load. The app launches but none of the items will load.",https://itunes.apple.com/us/review?id=632064380&type=Purple%20Software,2023-02-24T21:18:13-07:00
10192079160,KMe W,https://itunes.apple.com/us/reviews/id830481468,23.28.1,5,Second life,I am so happy that this app allows us to give our clothes second life.,https://itunes.apple.com/us/review?id=632064380&type=Purple%20Software,2023-07-28T08:46:15-07:00
10782882244,Rzty51,https://itunes.apple.com/us/reviews/id405129805,23.50.1,1,Terrible app,I am going to sell my items back in Poshmark because It is such a waist of time to always send the same message to Vinted and fight to keep my post activated. They always deleate my posts because of copyright violation while those pictures are MINE and I took all those picture myself. Terrible such a waist of time.,https://itunes.apple.com/us/review?id=632064380&type=Purple%20Software,2024-01-04T05:24:43-07:00
10309592315,Digao.rod,https://itunes.apple.com/us/reviews/id168390818,23.33.1,1,No support!!,"I am having a terrible experience with this app.
Bought shoes to my baby and never received them. The sender affirms that the product was sent. The carrier has a confirmation delivery but I never got the package. And Vinted simply don’t help! No real support! Why me as a buyer have to pay for the flaw in the post?!
Lost my money! Don’t use this app!",https://itunes.apple.com/us/review?id=632064380&type=Purple%20Software,2023-08-28T13:22:51-07:00
9470798961,just_reii,https://itunes.apple.com/us/reviews/id1346739036,22.47.3,5,Great shoe and great price,As soon as I purchase the shoe was sent my way the next day. Came right on time for when I needed them.,https://itunes.apple.com/us/review?id=632064380&type=Purple%20Software,2023-01-04T08:47:14-07:00
9809009679,Lady4dogs,https://itunes.apple.com/us/reviews/id190614925,23.13.2,1,Blocked for nothing,"I never sold or bought anything on here. I was looking at dolls and saw a user had stolen images from another listing and let the original lister know someone was using their pictures, came back a few days later to see my account permanently blocked. Customer support is no help.",https://itunes.apple.com/us/review?id=632064380&type=Purple%20Software,2023-04-10T20:18:43-07:00
9539941781,Jociekabossy,https://itunes.apple.com/us/reviews/id318092073,23.2.0,3,Keeps taking down my own personal photos,I can’t sell anything without getting flagged not using stock photos either app needs major improvements,https://itunes.apple.com/us/review?id=632064380&type=Purple%20Software,2023-01-23T13:29:13-07:00
9049446621,Dekidia,https://itunes.apple.com/us/reviews/id716221288,22.32.0,5,Great Seller,Awesome seller! She sent everything off quickly!  Everything was clean and fresh! I Will definitely be back!!,https://itunes.apple.com/us/review?id=632064380&type=Purple%20Software,2022-09-03T15:14:50-07:00
8925693925,nitterlyn45,https://itunes.apple.com/us/reviews/id1347358482,22.27.0,5,Great purchase!,"Arrived quickly, just as described, and clothes smelled very nice! Would definitely buy from again 😊",https://itunes.apple.com/us/review?id=632064380&type=Purple%20Software,2022-07-29T19:11:22-07:00
8067085456,sam1748185629,https://itunes.apple.com/us/reviews/id1108375530,21.38.2,5,Good Thrifting app yes,"I use a lot of these apps and right now this one is definitely having its moment, the prices are great and there’s some really cool pieces on here.",https://itunes.apple.com/us/review?id=632064380&type=Purple%20Software,2021-11-26T17:26:02-07:00
8426161054,reptilectric97,https://itunes.apple.com/us/reviews/id375247675,22.7.2,1,This app had potential…,"Wake up Vinted, you’re losing users = $$$ 
I find it a waste of time by blocking our accounts for suspicious activity or commercial selling when we have dedicated our time to list. What’s the point of a selling app when you’re just gonna list 1 item every once in a while. Pathetic company!",https://itunes.apple.com/us/review?id=632064380&type=Purple%20Software,2022-03-06T02:08:37-07:00
10538031337,Buying Bolter,https://itunes.apple.com/us/reviews/id423686770,23.42.0,5,ON-Believable Great Purchase!,"The shoes were brand new, just as described, delivered quickly & will purchase from this seller again!",https://itunes.apple.com/us/review?id=632064380&type=Purple%20Software,2023-11-01T04:19:40-07:00
10773355969,D_Vagabond,https://itunes.apple.com/us/reviews/id1264046209,23.49.3,1,Change of product scam,I got a fake airpod 3 from a seller on Vinted going to 3 wks now and returned it through Inpost the very second day after I discovered and seller asked me to return. When the seller got the return it was a piece of clothing they delivered to him. The issue has not been resolved since then and I have not gotten back my £95. What a fraud!,https://itunes.apple.com/us/review?id=632064380&type=Purple%20Software,2024-01-01T21:07:54-07:00
9907421353,hadestavern,https://itunes.apple.com/us/reviews/id1526760563,23.18.0,5,Love it!!,The shirt fits exactly as I wanted it to and it came in reasonable time. Very nice customer service and cute stickers that come along with your order :),https://itunes.apple.com/us/review?id=632064380&type=Purple%20Software,2023-05-08T18:45:39-07:00
9860531200,Kmjoytdc,https://itunes.apple.com/us/reviews/id225867431,23.16.1,5,Quick shipping & great price,Super fast shipping and quick communication.  It’s just the color I have been looking for.,https://itunes.apple.com/us/review?id=632064380&type=Purple%20Software,2023-04-25T11:22:51-07:00
9339533267,Freejustice,https://itunes.apple.com/us/reviews/id132833786,22.44.0,5,Perfect,I find it amazing how it all looks. Perfect. Thank you definitely will be back again.,https://itunes.apple.com/us/review?id=632064380&type=Purple%20Software,2022-11-28T14:06:13-07:00
8818652751,Susie gil,https://itunes.apple.com/us/reviews/id1129948836,22.23.0,5,SUPER FAST SHIPPING,I found the fit to be perfect. I also loved the style and delivery was super quick. Also found the customer service to be great!,https://itunes.apple.com/us/review?id=632064380&type=Purple%20Software,2022-06-28T03:48:16-07:00
8605574968,jannaangel,https://itunes.apple.com/us/reviews/id1337681244,22.13.4,5,Order,Thank you so much love it will keep looking at her for more things to buy,https://itunes.apple.com/us/review?id=632064380&type=Purple%20Software,2022-04-25T11:17:42-07:00
8599518991,Nancy 3069,https://itunes.apple.com/us/reviews/id1380838407,22.13.4,5,Dress,Already getting compliments! It came so fast! Really happy put with my purchase and the quick delivery!,https://itunes.apple.com/us/review?id=632064380&type=Purple%20Software,2022-04-23T17:24:21-07:00
8585655365,KountryKK,https://itunes.apple.com/us/reviews/id1263634412,22.13.4,5,I love this selling app a lot. Compared to the other ones.,"Awesome seller,Shipped fast and the item is just like the picture.",https://itunes.apple.com/us/review?id=632064380&type=Purple%20Software,2022-04-19T17:12:26-07:00
10612943068,CsideAug,https://itunes.apple.com/us/reviews/id845278472,23.45.2,5,Beautiful Doen holiday dress,Thank you so much - the dress is absolutely beautiful and fits my daughter perfectly! Thanks for sending out so quickly!,https://itunes.apple.com/us/review?id=632064380&type=Purple%20Software,2023-11-22T07:39:51-07:00
8012714734,torrid92,https://itunes.apple.com/us/reviews/id622707389,21.36.0,4,Why can’t I access my old account?,My old account is gone who can I talk to about this? I built up a following and everything,https://itunes.apple.com/us/review?id=632064380&type=Purple%20Software,2021-11-11T07:36:53-07:00
10573274730,r.Marylise,https://itunes.apple.com/us/reviews/id1282663415,23.43.0,5,Everything great!,"Very good communication, fast sending of the item, and item as described. Great buying experience!",https://itunes.apple.com/us/review?id=632064380&type=Purple%20Software,2023-11-11T00:21:53-07:00
9931882982,Abcdhanah,https://itunes.apple.com/us/reviews/id408366509,23.18.0,5,Men’s joggers,I received my order with no issues and my son was very happy with the product. Thank you!,https://itunes.apple.com/us/review?id=632064380&type=Purple%20Software,2023-05-16T00:03:27-07:00
9693004000,Hejeien,https://itunes.apple.com/us/reviews/id190568270,23.9.1,5,Fast shipping and accurate description,Shipped quickly and item as described.,https://itunes.apple.com/us/review?id=632064380&type=Purple%20Software,2023-03-08T12:33:50-07:00
9894071537,B3II4,https://itunes.apple.com/us/reviews/id1325702932,23.17.1,1,Bad app keeps banning my account,I downloaded this app and it was good but I purchased one thing and they said my account was sketchy and they would ban me unless o emailed them. I emailed them and they never got back to me and i tried to create a new one and they banned that one within 3 hours. Bad customer service will not be back,https://itunes.apple.com/us/review?id=632064380&type=Purple%20Software,2023-05-04T22:45:05-07:00