id,userName,userUrl,version,score,title,text,url,updated
8775038682,Flybabyapril,https://itunes.apple.com/us/reviews/id13086328,2022.21.0,2,App vs. logged in Safari vs. search engine,"I almost always rate an app because of the functionality if it is a “bridge” app… just an easier or better way to access something on the internet. This review includes the differences. When I access Reddit without logging in on Safari and just clicking on the topic in the search results, it shows everything relevant to my search terms. Tons of other subjects completely relevant. If I log in on Safari, it only shows one topic usually with a “bot”answer (has a term or two in common but is quite obviously not anything someone real would answer). If I choose “open in Reddit” I get NOTHING related. Even if I put the EXACT same terms I used in Safari, I can’t even find the third similar question I was able to see in Safari before I logged in!! Makes me hate Reddit.",https://itunes.apple.com/us/review?id=1064216828&type=Purple%20Software,2022-06-14T20:17:49-07:00
8311454866,LauraSpokane,https://itunes.apple.com/us/reviews/id187318257,2022.03.0,1,"Daily user of Reddit, this app version is so terrible","Constant app glitches, can’t watch videos (stuck in buffering forever for no discernible reason or only play at really awful quality), shared links to friends won’t open but instead will take you to the App Store to download Reddit (they already have it and then the link won’t even open). Not sure why they released this update but I wish I could revert my version because this current version is so terrible and totally ruins the user experience. ALSO, trying to follow the trend of TikTok/Instagram of encouraging you just swipe through videos is terrible and I can’t understand why the devs think that Reddit users want this. If we wanted that we would use those other apps. It cuts off the last 10-15 seconds of videos and skips to the next one in the queue - this “feature” makes me want to honestly stop using Reddit",https://itunes.apple.com/us/review?id=1064216828&type=Purple%20Software,2022-02-02T09:53:19-07:00
6038106557,shopgirl517,https://itunes.apple.com/us/reviews/id103400837,2020.20.1,1,Unreasonable Mods,"Got in a argument with someone on a sub (on a different account than my main account) as a result I got banned then that changed into a full on suspension when I tried to reason with the mods, so I was like whatever I’ll just use my main account. Totally forgot about the whole situation because 2weeks had past, then this morning I went on the app to see that my main account has been PERMANENTLY suspended over a comment I made on a different account 2 WEEKS ago, I have had this account for YEARS 

So I tried to talk to a mod or really anyone who could help and to my surprise I couldn’t get a hold of ANYONE to ask them to help....

So now I can’t even use the app because the app will block me from trying to do anything and I just want to cry because I have had my account for years and to lose it over somthing that happened on a completely different account shouldn’t be possible and somthing needs to change.",https://itunes.apple.com/us/review?id=1064216828&type=Purple%20Software,2020-06-05T05:10:45-07:00
8169879215,MaskedMeatMan,https://itunes.apple.com/us/reviews/id1361698930,2021.47.0,5,Reddit - the happiest place on the internet lol,"I’m a new user and was welcomed nicely and respectfully into many subreddits, not just one. I found out that lots of things I like a lot of other people like to (and when I say a lot I mean A-LOT), even very specific things. It’s a good place to make friends with many options and even more users. I’d say the only problem is trying to search for certain post or users since sometimes it seems that they don’t even exist. Overall though it’s the only social media app you need since it offers so much more than other apps like TikTok, Snapchat, etc. Highly recommend, entertains me for hours on end.",https://itunes.apple.com/us/review?id=1064216828&type=Purple%20Software,2021-12-26T00:34:05-07:00
3782117277,Wmainard,https://itunes.apple.com/us/reviews/id22663503,4.27.1,4,Best way to share what your doing,It’s kind of a social media but it’s really not. People use it mostly for ideas so it’s not for popularity. Also there is no dislike. There is a down-vote button but it doesn’t dislike the post. It just lowers the number of upvotes (how u like a post) so there is no negativity or any notification saying so-and-so disliked your post. So there is no judgment. Except people can comment on your post and it can be negative but the reddit community is usually there to help. Advice: even if somebody comment rudely do not worry about them. They are just jerks who are arrogant and nobody likes them and they feel better to insult people. So don’t feel bad. Anyway reddit is awesome and overall a friendly community. People hoping to get it will enjoy it for sure.,https://itunes.apple.com/us/review?id=1064216828&type=Purple%20Software,2019-02-17T13:12:36-07:00
10083607551,moldy912,https://itunes.apple.com/us/reviews/id104164436,2023.24.0,2,Not a great experience,"The main issue I have is it is fairly featureless and just riddled with ads. There are so many user friendly features they could add but it’s clear they only care about monetization with ads being every other post. I’d rather use the browser version with an ad blocker. The service itself is also deteriorating, with the content being ruined by the company’s weird decisions. Im also worried about how much NSFW content there is that they won’t allow moderators to mark their subreddits as NSFW so children don’t see nudity and excessive profanity. I wish they would just try to be competitive in a fair market, and let moderators moderate the content appropriately. They have all the data, why can’t they just make a better app? The only redeeming thing about this app is that it’s free, especially notifications.",https://itunes.apple.com/us/review?id=1064216828&type=Purple%20Software,2023-06-28T19:40:14-07:00
10053788853,wootabaga,https://itunes.apple.com/us/reviews/id170656053,2023.23.1,1,Trash,"I used the official app for a couple years and it slowly got worse to the point I was driven to seek alternatives. I found Apollo. I switched because sorting options got so limited by this app. They might as well have just gotten rid of it, but that ruined my experience. Now, that’s why I switched but once I got Apollo, I truly saw how inferior this app is. It’s not customizable mostly, it’s not user friendly, and the layout is trash imo. If you put Apollo and this app next to each other, Apollo is significantly more easy to look at. Not to mention it doesn’t track you or collect your data like this app does. Now this heap of garbage is being shoved back down my throat and I just can’t after having a superior experience. It’s like going back to a horse and buggy after driving the latest luxury car. My time on Reddit dies with the Apollo app. Guess it’s my only way of sticking it to the man.",https://itunes.apple.com/us/review?id=1064216828&type=Purple%20Software,2023-06-20T08:06:39-07:00
10042468948,The Original Pancake House,https://itunes.apple.com/us/reviews/id1536758046,2023.23.1,1,No one who actually uses the app could have possibly honestly given it a positive review,"Title says it all. From crashes to the horrible video player to unintuitive and frustrating controls, the Reddit is a pain to use. I only downloaded it because Reddit would beg me every time I visited the web site and would block a significant portion of the viewing window bugging me to use the app. Honestly, even with the annoying pop-ups and reduced viewing window, I’d still take the web page over the app. 

I hardly ever leave reviews, but I felt compelled to add this one after seeing that the average rating was a 4.8 (as of this time I’d writing). I have no idea how that is even possible. The app is horrible and everyone I know who uses it hates it as well. 

It’s insane that a company as large as Reddit can’t develop and maintain a functioning app. I’d use a third-party app, but now Reddit is ruining that too.",https://itunes.apple.com/us/review?id=1064216828&type=Purple%20Software,2023-06-17T01:27:59-07:00
8572412203,omfgletmepickanickname,https://itunes.apple.com/us/reviews/id139152593,2022.14.0,2,Google searches don’t show up,"Reddit is notorious for not having a useful search engine for its site. That’s where Google comes in handy, whenever I google search a reddit question or post and click on the mobile site, it will redirect me to the app. This hasn’t been happening with the latest update, though. Idk if it’s just my phone but I’ll open a post on safari, and it’ll say it’s unreviewed and try to take me to the app or back to the reddit home page. I’ll click on the option to take me to the app, but it’ll just bring me here to the app store where i can “open” the app. In order to read the post on mobile i have to keep reloading the page and hoping i can get my info quick enough before it tries to redirect me again. I restarted my phone and uninstalled and reinstalled but to no avail. Please fix!!!",https://itunes.apple.com/us/review?id=1064216828&type=Purple%20Software,2022-04-15T22:43:24-07:00
8516483620,gilliland38,https://itunes.apple.com/us/reviews/id241742363,2022.12.0,2,A poor Reddit client,"For the longest time, Reddit didn’t have its own mobile app. When they created their own, I tried it out. It was fine. Not the best, not the worst. But in recent months, they have tried their very best to ruin it. Videos are now set up in a way that mocks TikTok. They constantly change the location of buttons. Recently, they moved the menu that allows you to view all of your subreddits to the side menu and made it worse. You can no longer scroll by letter, and you have to go all the way to the bottom to find your multireddits (now known as “custom feeds”). They replaced the old subreddit menu with a “discover” page. Reddit is trying so hard to copy Instagram and TikTok that they are ruining their own app in the process. I recommend a third-party Reddit client such as Narwhal or Apollo. This is one of the worst.",https://itunes.apple.com/us/review?id=1064216828&type=Purple%20Software,2022-03-31T09:50:12-07:00
8343725602,ph4tbr4t,https://itunes.apple.com/us/reviews/id929751134,2022.05.0,4,Love it,"I love using reddit and communicating with people whom share the same interests as I do. The more I connect with whomever it may be I am talking to, the more I want to follow them. And thats just my problem. I can’t follow a single person when using the app. I can follow people using reddit on a computer or my phone’s browser, but why would I go to either of those options to browse reddit when theres a perfectly good app? I also cannot edit my profile on the app which is extremely annoying. I can join other subreddits perfectly fine and can interact with everything but the edit button and the follow button. It would be nice to gain some kind of feedback so that I can resolve my issue.",https://itunes.apple.com/us/review?id=1064216828&type=Purple%20Software,2022-02-11T06:02:40-07:00
3731494995,buchanarama96,https://itunes.apple.com/us/reviews/id926778662,4.26.0,5,Dope.,"I’ve seen people use Reddit as long as it has been around, but I’ve never had the itch to download and use it for myself. Now, I’m seeing why folks like it so much. First and foremost, being the big wrestling fan I am ( yes I know it’s scripted, still love it ), it has some rad stuff dedicated to that, and now I’ve loaded more threads, pages on there. Some dedicated to food, recipes, memes, sports like mma, football, both college & national. Other funny stuff, it’s all just wonderful experience. It’s a lot like message boards, that for a while died out, but with Reddit they’re making a comeback. So, yeah, hope this helps anybody that maybe wanting to download this application. It is fun, and you’re not gonna regret it! Cheers!",https://itunes.apple.com/us/review?id=1064216828&type=Purple%20Software,2019-02-03T23:28:04-07:00
6007876671,LilMsSix,https://itunes.apple.com/us/reviews/id285585301,2020.17.0,4,Reddit needs improvement,"First off, this app rocks, but I have issues with the 'blocking' feature. Blocking someone is to prevent them from seeing your information, but on Reddit, it’s the opposite. If you block someone, you stop yourself from seeing them, but they can still see you and everything in your profile, everything you post and/or respond to. This is stupid. It’s just stupid. 

On the flip side, it’s an amazing way to communicate with a lot of people at once... but there are tons of people trolling Reddit just to argue... as if they’re stuck in grade school looking for someone they can chew out and blame for their own misery. People like them should be blocked, and unable to see your posts, and yet Reddit doesn’t have this feature...",https://itunes.apple.com/us/review?id=1064216828&type=Purple%20Software,2020-05-28T22:37:49-07:00
4281059900,1BlessedGuardian,https://itunes.apple.com/us/reviews/id360660841,4.35.0,4,Awful,"My god I hate this app. It doesn’t want to load sometimes. My biggest issue is the videos or gifs. You’ll press play and after FINALLY loading, they’ll pause with the audio still playing and half the video frozen in place and warped. It will do that on almost all of them if it starts too. You’ll have to close the app down completely to stop it. sometimes if you’re in the middle of watching something and walk away from your phone and your phone goes to screensaver mode, it will kick you out of the app completely. This app is utter garbage and I’ve been using it for awhile. I never make reviews but I want to make everyone aware of its issues. Use something else for reddit like Reddit is Fun, Apollo, or Bacon Reader. They’re much better.",https://itunes.apple.com/us/review?id=1064216828&type=Purple%20Software,2019-06-07T20:04:04-07:00
9063186960,Sparthage,https://itunes.apple.com/us/reviews/id210575459,2022.33.0,2,"Reddit is great, but this app isn’t","I love using Reddit, and I have for years now, but over the last few months this particular app has plummeted in quality and usability. It used to be easy to access and search through your list of subreddits, but they’ve made it much harder to get to where you want to go. They’re pushing these new “popular” tabs that nobody really asked for. They’re now also removing the ability to easily change how posts are sorted. Not to mention that the ads are growing more and more obtrusive by the day. I don’t really care if they’re there and they blend into the app, but when the first thing I see when I open the app is an ad that takes up two-thirds of the screen, it completely kills any desire I have to look further. Reddit had a good thing going, but they’ve thrown it away.",https://itunes.apple.com/us/review?id=1064216828&type=Purple%20Software,2022-09-07T22:15:19-07:00
9986686633,EchoingRelativity,https://itunes.apple.com/us/reviews/id523760763,2023.21.0,1,Clunky and Predatory,"This official Reddit app has been unusable since pretty much its inception. The UI is incredibly clunky and ads are done twitter-style, essentially being around 80% of what you see on your homepage…. and the subreddits…. and the comment section. And now, Reddit seems to have taken a liking to twitter’s other absurd profit-tanking practices. 

After hearing about Apollo (a third-party reddit app), I gave it a shot and its user experience had left me with this conclusion: I will never use the official reddit app again. Now with Reddit’s announcement for API pricing, essentially banning small(er) developers like Apollo, I’m forced to revise my conclusion: I will never use Reddit again. If you seriously wanted an app that could steal data from people for absurd profits, you should have taken a leaf out of every other tech giants’ book and make the user experience something that doesn’t directly reflect that.",https://itunes.apple.com/us/review?id=1064216828&type=Purple%20Software,2023-05-31T23:24:23-07:00
9414716810,GrantL79,https://itunes.apple.com/us/reviews/id24107200,2022.45.0,1,Give the Home feed sort options back!,"I’ve been a Reddit user for over 15 years. There have been a LOT of changes in that time, most of which were fine. Some worse than others. The one thing I’ve appreciated most about Reddit thus far is that it wasn’t an algorithmically generated firehose of random stuff. It was the most popular things from the subs I chose to follow.  That was until this latest update.  Now I can’t change how my feed sorting off of what they consider “Best”

Officially from the Reddit admins this is to give us “more control of our feeds” and that is a bunch of crap. Since when does giving us fewer options give us more control?!?  Now I have no choice to sort by Hot, Top, Controversial, or Rising. Just “Best” which I turned off as soon as it was released because I hate it. 

Give us the old sort options back. I’ll be using Apollo on my phone until then.",https://itunes.apple.com/us/review?id=1064216828&type=Purple%20Software,2022-12-19T18:49:06-07:00
8877097955,BrokenReaper,https://itunes.apple.com/us/reviews/id42428814,2022.26.0,2,Copying TikTok ruined a good UI experience,"I used to love the Reddit app but there has been a small change that kind of ruined the experience for me and my friends that use it. You can't scroll right and left anymore when viewing any feed in full-screen (either on your own feeds or in a subreddit) and has instead been replaced by only being able to swipe down for algorithmically-selected content... I get that copying TikTok's design can be good for business but what I don't get is forcing this upon everyone. I even welcome the change as long as we can still scroll like before. 

A simple solution: Let users scroll left and right to see the feed THEY CHOOSE first and then if the user wants, they can scroll down for similar content as much as they desire.

Please fix this, Reddit was already a 5 star app.",https://itunes.apple.com/us/review?id=1064216828&type=Purple%20Software,2022-07-15T09:41:56-07:00
8640039680,Gush/,https://itunes.apple.com/us/reviews/id110868131,2022.17.0,1,Doesn’t even work,"Reddit was a brilliant concept poorly executed- since so many ppl have to use it now did you just completely stop any form of maintenance? The app has always been a pain to use but several weeks ago it decided my posts could no longer be edited. I have to use a desktop (not desktop mode on a mobile because you made sure that didn’t work at all). I started adding changes in comments because it was just too ridiculous. But now it won’t even POST anything new at all! That’s the most. Basic. Function!! And it’s been weeks on that now too. 

Oh and I don’t know why it’s so ridiculously important to you that posts be published to subreddits but I’ve always been extremely aggravated about the ridiculous extra steps needed to simply post something to my profile. That’s more pathetic than clickbait, fake thumbnails, and fake game ads combined.",https://itunes.apple.com/us/review?id=1064216828&type=Purple%20Software,2022-05-05T08:33:35-07:00
7550263316,KF10987,https://itunes.apple.com/us/reviews/id434644581,2021.26.0,1,The updates this year have been horrible,"I’ve used Reddit for a decade now and have always been trying to get my bf to use the app for the cute features like stickers. The recent updates however have been just horrible. The whole reason I use Reddit is because it’s a different feed and platform from Facebook or Instagram but for SOME REASON the product team there has decided to make it another mindless copy of apps I already have on my phone. WHY do you collapse the comment sections? THEY ARE THE BEST PART OF REDDIT THAT MAKES IT WORTHWHILE. WHY do you make me swipe up on videos for comments OR to play the next “reel”? IM ON IOS - THAT MINIMIZES THE APP. Seriously, I’m so near my wits end using this app that my Reddit usage and visits have gone way down. I think I’m staring to head towards the light…and it’s called Alien Blue. I’m sorry I ever trusted Reddit to hope to keep the integrity of what made it special in the first place.",https://itunes.apple.com/us/review?id=1064216828&type=Purple%20Software,2021-07-07T10:50:19-07:00
6420697998,jay987rdn,https://itunes.apple.com/us/reviews/id395634605,2020.34.0,1,Reply timer,"I have the gilding heavyweight award. I have a history of purchasing a large amount of coins to spread small bits of happiness by awarding Redditors comments and posts giving them reddit premium. I will now no longer be doing this and will be advocating to anyone I can to never buy coins or reddit premium ever. Random redditors can downvote me for just disagreeing with what I say or for no reason at all and because of that I’m punished with a reply timer and can be barred from posting or replying by an ever increasing amount of time. This is a ridiculous measure that needs to go away. Especially considering how much money I’ve dumped into the pockets of these people. Restriction timers should only be attributed when in conjunction with a ban or serious issue. Just because someone is downvoted is unacceptable. Congratulations reddit, you will never get another dime from me and I will strictly use reddit now to spread my position convincing others to do the same.",https://itunes.apple.com/us/review?id=1064216828&type=Purple%20Software,2020-09-12T01:21:34-07:00
5612427172,Kyleowl,https://itunes.apple.com/us/reviews/id509795608,2020.6.0,1,really..,"I had this app for so long and for so long i’ve been trying to find at least something funny, but most posts/memes/sections I go through, a lot of them aren’t even jokes or funny. I have realized that a lot of the people on here are just conforming to popular opinion and may be insecure. This leads to the same post or meme over and over again because it’s the same format with the same sentence and the “big brain,” while there is little to no funny things to laugh at. Also, a lot of people on this app are desperate for coins or rewards, and a lot of posts are literally about someone’s “cake day” or upvotes, where there is no punchline and it isn’t funny in the slightest. I have reached out to many communities to find funny posts, for example r/memes, r/dankmemes, r/weirdcomments, etc., and most posts I happen to see are the exact same with no punchline. After a long time I’ve had this app, i’m sorry to say i’m dissappointed...",https://itunes.apple.com/us/review?id=1064216828&type=Purple%20Software,2020-03-03T15:11:33-07:00
10156153860,Krahnin,https://itunes.apple.com/us/reviews/id34930087,2023.28.1,1,Downgrades Upon Downgrades,"I very frequently find my Reddit iOS experience to be unnecessarily painful. Just to rattle off a few issues:
- Want to open the app directly to the Popular tab? Not possible.
- Feed? Riddled with ads.
- Video player? Terrible. If I unmute one video, I don’t want every other video (including ads) unmuted.

I could go on, but I digress. About two months ago I tried out Apollo and found that yes, a developer can make an app that is not a nightmare to consume for its user base. Honestly, my Reddit use and sharing increased dramatically. Clearly Reddit didn’t want that exposure or site traffic because they killed it. 

Going backwards was bad enough, and I find myself using the app less and less.  Now it seems like Reddit is attempting to even more blatantly price gouge its users. What’s with the ugly 8bit icon and locking the normal standard icon behind a premium subscription? I cannot for a minute fathom how they think this is a good idea unless they’re counting on a high enough percentage of users to roll over and just take it. For me, I’m done and uninstalling. I browse social apps in my down time. That time to myself should not be wasted on frustrating and poorly designed UX or apps trying to force people into a subscription model via the removal of features.",https://itunes.apple.com/us/review?id=1064216828&type=Purple%20Software,2023-07-18T20:09:24-07:00
10090938671,Erithian1,https://itunes.apple.com/us/reviews/id382842009,2023.25.0,1,Reddit has failed its community,"Reddit has been a huge part of my life for years. From researching a topic of interest, to news updates, to just mindlessly scrolling for a few laughs, I have used Reddit almost every day. However, with its decision on the new API pricing Reddit has ruined most 3ed party apps that not only a substantial part of their user base loved but relied upon for features that the default Reddit app lacked or implemented poorly. When the community found out and protested Reddit just said they didn’t care, when 3ed party developers said please work with us to make a mutually beneficial experience Reddit said “no”, and when 3ed party app developers posted phone calls between them and Reddit showing Reddit lying about changes Reddit got angry at the developers and made excuses. It’s a shame to say goodbye but unfortunately Reddit has shown that it just doesn’t care about what it’s users want.",https://itunes.apple.com/us/review?id=1064216828&type=Purple%20Software,2023-06-30T21:01:55-07:00
