id,userName,userUrl,version,score,title,text,url,updated
9913909660,Ferdette27,https://itunes.apple.com/us/reviews/id487386973,3.561.10001,5,Felipe a 5 + driver,"Having used another service , I didn’t what to expect.  I scheduled an early pickup, glad I did.  He was early but so was I so off we went.  My scheduled arrival was what I make it in when I drive, but not to day, we were doing great till we came upon stopped traffic. Usually moves at snail pace, nope dead stop, we sat for approximately 30 minutes.  I was going to have surgery which he didn’t know and he kept me entertained so I did’t think about it. Instead of a 2 hour wait it was only 30 minutes. Thank you so much, it made a bad day tolerable.  Apparently traffic was shut down both North and South bound. 
Now KUDOS to Uber while we were sitting still for a while the texted me to make sure everything was alright and I was safe.  I never expected that but it was nice to know we were monitored.  Thank you Uber and Felipe for a very positive experience.   Next time I won’t think about who I have to call.  You have moved up on my call list. Rosemary Haigwood",https://itunes.apple.com/us/review?id=368677368&type=Purple%20Software,2023-05-10T17:02:38-07:00
3218159200,myrealuv,https://itunes.apple.com/us/reviews/id104032119,3.317.10003,4,A Great Travel Option,"I use Uber almost everywhere I go. My biggest complaint is the receipts. There are so much space and so many ads in the midst of the expenses until I end up with three pages of nonsense with my expenses in the middle of it all. How about pitting the map at the end or doing away with it altogether? Consider putting miles/time traveled at end and please, please, please put your ads at the end AFTER the expenses, not before or in the middle. I just need the entire expense report to fit on a single page. Do that and I’ll consider you finally at a five star level.
Haven’t had any real problem with non-English speakers but agree that it would be a benefit. 
Also, I have my pic on my profile but the driver stated they do not get to see our pics. It would help them identify who they are picking up. It’s the only reason I added my pic. I don’t want some racist picking me up because they wasn’t aware of it before arriving. Let the drivers see who they’re picking up. I know you probably have a policy against discrimination, but policies don’t change character or hearts.",https://itunes.apple.com/us/review?id=368677368&type=Purple%20Software,2018-09-22T09:55:02-07:00
2342213084,Njstitcher,https://itunes.apple.com/us/reviews/id208733784,3.290.10002,1,"Didn’t work, missed appt","I just tried to use Uber for the first time.  I set the app up on my phone yesterday, verified it and thought it was ready.  First problem was it was locating me four houses up from where I am.  That had to change.  Then after requesting a pick up, I kept getting a message “Oops, something went wrong. We are unable to process your request.  Check the in-app help.”  I checked that; there was nothing there to help me.  I kept trying and getting the same msg.  I checked settings to be sure it was right and was forced for some reason to change my password.  Finally I got on my iPad to their web site to see if there was better help.  There was something about not being able to request a ride, but it did it resolve my issue.  I tried one last time moving the very small address icon and it finally took my request.  But after 10 minutes I still had no driver.  Since I didn’t know how long it would be before I got one, I was forced to cancel the request and cancel my appt.  I thought starting a half hour prior to a five min ride to appt would be enough time. Apparently it’s not.  I am not happy with this at all.  If it can’t be relied on to be responsive in a reasonable amount of time it’s basically useless.",https://itunes.apple.com/us/review?id=368677368&type=Purple%20Software,2018-03-24T12:13:47-07:00
5550464087,51ShadesofGravity,https://itunes.apple.com/us/reviews/id49680941,3.392.10003,5,Tipping Uber Drivers does not work on my iPhone X Causing Other Issues,"The Uber app has not let me tip drivers for many months now and it’s very annoying. I’ve reached out to Uber Support via twitter and they gave me a generic response saying drivers might opt out of tipping; I find this hard to believe as I live in NYC and take Ubers often and have this issues on every single ride. I can rate the driver, but I can’t tip. It’s a big issue because not being able to tip has plummeted my rating. I am otherwise a pleasant passenger and yet my score has been gradually going down. Having a lower score impacts on the types of drivers I get or if drivers even want to take my request. Whenever I remember I bring cash to tip drivers because the app won’t let me, but it’s 2020 I should be able to tip in the app. Other than tipping and Uber support not helping me fix this issue the app has been okay. That said not being able to tip is a big problem and I often find myself taking Lyft or Vias as they don’t give me issues with this.",https://itunes.apple.com/us/review?id=368677368&type=Purple%20Software,2020-02-18T19:53:32-07:00
9181259903,Ermygrd2 intense,https://itunes.apple.com/us/reviews/id457901932,3.531.10000,2,Recent changes create long waits,"Recently the system was changed so that drivers can see where you want to go. While I would have supported this change before it was implemented, in practice it creates issues. For context, there is a roughly 20 minute trip I often make between two nice neighborhoods around three o’clock and at seven o’clock. I have a 4.96 rating, and I always tip the max. I used to get drivers who were close by and it rarely passed over a driver in my area. Now, there may be a driver 5 minutes away from me at all times, but the trip is usually declined by at least 2-3 drivers, presumably because they don’t want to stray from within a very small area. This means that though there may be three cars within 10 minutes from me, I often wait 15 minutes or more.

I think it’s unfair for drivers to not be able to see the trip destination. However, ultimately, the customer here is the rider. If drivers are using this change not just to avoid dangerous areas and gratuitously long trips, but to be super picky and selective on which short trips in nice areas they want, then I can’t recommend the app in its current state.",https://itunes.apple.com/us/review?id=368677368&type=Purple%20Software,2022-10-13T12:56:09-07:00
9797617753,Busa64,https://itunes.apple.com/us/reviews/id184985273,3.556.10002,5,Customer assistance was 5 stars!,"On my original ride, the driver refused to take me to my destination citing that it wasn’t worth the trip. His vehicle was dirty and reeked of cigarettes . Then the driver attempted to ask me to increase his rate if I wanted that trip and then cancelled me out. I immediately noticed a charge to my credit card for the ride. That driver removed my bags from his vehicle and stated he was not accepting the ride. I contacted customer support and the issues were addressed. Fortunately, customer support indicated that they had credited my account for the 1st ride (never taken)with Azthar and I rebooked my ride and met a lovely gentleman who picked me up and had no problem getting me to my destination. Phillip was a first class ride and we had a lovely conversation for the duration. I was glad to give him a token of my appreciation. This scenario could have gone differently and I’m thankful that all issues were reduced and the start to my vacation was not ruined.  Thanks again, a loyal Uber user.  M",https://itunes.apple.com/us/review?id=368677368&type=Purple%20Software,2023-04-07T12:54:01-07:00
4311780542,xchacha611,https://itunes.apple.com/us/reviews/id660002256,3.355.10002,1,Why I need to pay for your error?,"Uber map dropped me to a totally wrong location to Cambridge, Ma but the restaurant I wanted to go was in Boston, MA. So I need to order Uber again and pay another $14 to get to the correct location. The place Uber dropped me off was a restaurant with a totally different name. 
Not sure why Uber came out with this address and when I asked for refund, they push the problem back to my phone’s location and also google map and never admit it is their fault. But even on google map, it has only one location for this restaurant but Uber map has two in it own app. It is obvious that Uber has something wrong in their system but they refused to send me the refund. Why is Uber’s fault but I need to pay $28 for a trip that supposed to be $14 and also extra time to get to my destination? It is ridiculous!No more Uber again!

Follow up: It has been three days after I sent their support team the message but they did not reply and labeled my message as no need for a response. Their developer sent me the link to update this issue but the link still goes to their stupid support team. It doesn’t make sense to talk about the problem again and the support team showed me again how they tried to get rid of responsibility.",https://itunes.apple.com/us/review?id=368677368&type=Purple%20Software,2019-06-13T18:08:48-07:00
3968236811,Heygurlhry,https://itunes.apple.com/us/reviews/id379068575,3.345.10001,4,Convenient but I have some concerns,I’ve used Uber in the past with no complaints. Last weekend my friend and I used her phone to get a ride from Uber after leaving a concert. 1 driver was on the way then suddenly canceled the ride and the 2nd rider did the same thing. I’m not sure if you can rate drivers who do that but you should be able to. I used my phone my phone instead and thankfully a driver did cone pick us up. I received 4 emails for the fare to/from the concert as well as what I tipped. However I noticed on my bank statement that there was an additional charge. The amount was small so I assumed it was a surge/convenience fee due to the concert traffic. I contacted Uber and sent them the info they requested only for them to say they do not see this charge on their records and to contact my bank. When I contacted the bank they just ended up canceling my card and will be sending me a new one. This is inconvenient since now I have to wait for a new card. I wish I had left it alone but kind of glad I didn’t in the event someone has potentially stolen my card info,https://itunes.apple.com/us/review?id=368677368&type=Purple%20Software,2019-04-04T05:17:38-07:00
3681468583,Gueebs,https://itunes.apple.com/us/reviews/id148474311,3.335.10000,2,Going Downhill Fast,"Uber used to be a reliable and affordable service but it’s quickly becoming a headache and a scam. 
The pickup time you see BEFORE deciding to request the ride is never accurate. They lure you in with shorter estimates that increase dramatically AFTER you’ve already requested the ride. Then, if you want to cancel it there’s a fee. Or god forbid you make them wait an extra second, they’ll leave or charge you for that too. 
The “walk a few blocks to save money” feature should NOT be automatically applied, making users manually deselect it. I’ve forgotten to do so several times and had to walk in the rain because of it. To my knowledge, I don’t even think it shows you where you will be dropped off ahead of time, just where you have to walk to be picked up. The price you see also should NOT reflect this feature automatically. It’s very deceiving. 
I’ve also had a driver refuse to pick me up and literally text me saying he drove off because he only picks up customers that are “educated”. I contacted customer support and screenshot the text, along with the driver’s information, and was merely offered $5 off my next ride. Uber does not care about its customers.",https://itunes.apple.com/us/review?id=368677368&type=Purple%20Software,2019-01-22T05:27:25-07:00
3609448333,Chef Doffy,https://itunes.apple.com/us/reviews/id710614594,3.329.10002,2,Needs immediate fixing,"So I’m trying to uber home from the train station. The app continuously said that every car was busy for 5 whole minutes. I closed then opened the app up just for the same response. Another time reopening, instead of saying every car was busy, nothing was popping up. I decided to try to order one anyways. It was letting me go through with it. Next thing I know, it starts saying it wasn’t working and no ride could come through. I closed the app. Open it again only to see that it mysteriously ordered a ride anyways. However it ordered the uberpool walking system, which I did not want. So while the app was looking for a driver, I tried to cancel. It then tells me they had a problem canceling my ride. It did that every time I tried to cancel. Once again, I closed the app, reopened it just to see that a ride was 6 mins away. Meaning it just came through. So I canceled and they’re still charging me for a cancel fee. I shouldn’t have to pay for a mistake the app made. This is not okay and needs to be fixed immediately. Just honestly makes using uber all the more irritating knowing that you can just get YOUR money taken when THEIR app made a mistake.",https://itunes.apple.com/us/review?id=368677368&type=Purple%20Software,2019-01-03T18:25:44-07:00
3544998820,migratorius,https://itunes.apple.com/us/reviews/id15930449,3.329.10002,4,Walk radius inaccurate,"Im generally a big Uber fan—BUT over the past few months as there has been more and more requirement to walk much further distances to meet a pool driver I have been increasingly frustrated. Last night the app showed me a radius of about 2.5 blocks around where I wanted to be picked up. But then when I accepted, it wanted me to walk to a spot 5 blocks away—more than two blocks outside the radius that had been shown. I canceled and tried again a few minutes later; same issue. So I canceled again and then there was no way in the app to give this feedback. It’s not the cancellation charge or the walking, it’s the fact you’re lying about how far the pickup radius is. Sometimes I’m taking an Uber because I’m by myself at night and I don’t want to walk many blocks (especially down a poorly lit area shown last night) alone. Be honest in the app about how big the pickup/drop off pool radius will be and I will be honest about whether I want to accept the risk/inconvenience. And where is the feedback in the app??? I took a Lyft instead, twice yesterday alone.",https://itunes.apple.com/us/review?id=368677368&type=Purple%20Software,2018-12-18T06:15:10-07:00
3183018449,Chell-oh M,https://itunes.apple.com/us/reviews/id191885177,3.316.10002,3,"Oh, Uber","1. I am always ready to go when I ping for a ride so I never keep the driver waiting.  2. I always say hi and verify I'm the correct rider for the driver. 3. I don't eat in the car. 4. If riding with my kid, I always make sure he's ready to go in his security vest in lieu of booster (FMVSS 213 certified). 5. We make no noise, leave no trash. 6. I always tip. 7. I don't slam doors or ask to put things in the trunk. I don't change up the ride midstream re: destination, what music the driver wants, nothing. We don't touch the windows. Doesn't seem to be enough. I'm told I need to be _more_ engaging and tip _more_ than 20% even when the driver is taking me the long way (my sole purpose is to save time to get to work and home faster for my kid - the long way home means I might as well take Muni for $2.50) So now not only do I pay for the ride and am extremely polite and friendly whenever the driver wants to chat even though I'm exhausted and just want to nap, give 5 stars when really your star system makes no sense, tip out the wazoo, I have to entertain my driver as well? That's super great. Really super great. I so love you guys. Uber, just pay your guys more already. Ffs.",https://itunes.apple.com/us/review?id=368677368&type=Purple%20Software,2018-09-12T19:05:05-07:00
3617781841,Dedee83,https://itunes.apple.com/us/reviews/id282795052,3.329.10002,5,Needs work,"I have a love hate relationship with Uber. While Uber is super convenient in a day in age where everyone has a card and few carry cash, it’s frustrating because this app needs work. There have been too many occasions where I’ve had to dispute a charge due to the driver waiting in the wrong place incurring a wait fee at my expense. Solution: make it possible to drop a pin to where the passenger is exactly so that there are no discrepancies... like Lyft does. Also while waiting for my driver the app will show the driver driving in circles (endless u-turns) meanwhile he/she is closer than I think or outside. I’ve had the unfortunate experience of a driver starting my ride without me in his car and I’ve had to cancel the ride just to order another. And let’s not talk about the gps that guides the driver to the destination. Instead of taking the easiest/logical route it most times takes the scenic, annoyingly round about route... which is frustrating when I’m trying to get to work on time.",https://itunes.apple.com/us/review?id=368677368&type=Purple%20Software,2019-01-05T21:28:37-07:00
9102822792,AnonymousUser_99,https://itunes.apple.com/us/reviews/id749727940,3.527.10002,2,"Reliable, but fraudulent!","I have been a long time customer of Uber, I think 5 years now. It’s always been really helpful when I needed it for work, leisure travel, etc. BUT THINGS CHANGED! I noticed an authorized charge on my debit card from Uber, a ride that I did not request for. Upon chatting with customer service, they said someone else requested a ride using my card info and also was under the other person’s Uber account. First of all, I don’t know who that person is and I’m the only who uses my Uber account. Second, I’m the only one who uses my debit card and don’t share such private info. Customer service did not reply back at all and did not care to see that the time and date was not in my ride history and the name on the Uber account was hers and my debit card was not hers! I’m still waiting for a reply. Mind you, I’m a platinum rider and no one has gotten back to me yet. So much for priority support. Their privacy and safety is not strong enough and they fail to review accounts and ride history, therefore they mix an Uber account of a stranger you don’t know so that you can pay for their ride! What a shame Uber! A complete fraud.",https://itunes.apple.com/us/review?id=368677368&type=Purple%20Software,2022-09-19T23:57:03-07:00
6492374143,Jordan Legacy,https://itunes.apple.com/us/reviews/id1086263356,3.424.10003,1,This app steals money,Do not ride with Uber they will take counts of loads of money from you When you request a Uber ride they take the money at the time of the purchase and then the next day you may wake up with the same charge again taken twice from your from your account Or they will wait a couple days and then take money off your account and say that it was a authorization hold I am very punctual when it comes down to check in my bank account Uber has been the far worst This is coming from someone that was riding with Uber since they first opened Most of the drivers don’t even make effort to pick you up they will ride by you cancel the ride and then you would have to wait 15 minutes maybe 60 minutes for another ride to get to you I wouldn’t even say that your card is safe on the Uber app because Uber is the one who takes charges from your account..without notice  I spoken with customer service so many times I am so sick of it If I  were you don’t download and don’t even waste your timeAnd if you do use the app take your card off very frequently if you can because they will take charges for nothingAnd then act oblivious as if you don’t know what you’re talking about when you ask about the charge,https://itunes.apple.com/us/review?id=368677368&type=Purple%20Software,2020-10-02T07:34:41-07:00
5089920178,desapoinned colombian,https://itunes.apple.com/us/reviews/id1096573852,3.376.10006,1,The driver didn’t wanted to drive me,"When I request my Uber I forgot to set that we were two people, which doesn’t matter because the max capacity for Uber Pool is two people so there wasn’t any problem about that, but when my driver saw that we were two people she started asking me to change it on the app which is impossible, and she started telling me that if someone asked for another two people Pool we wouldn’t fit and it wasn’t true because there was 2 seats more, then she started refusing about taking us on the ride and tried to ask my grandma which is the Person that was with me and plus is a senior, that if someone else came in she had to go, and I consider that the most  disrespectful fact, because I was paying for that ride and the Max people was 2 and we were 2, so she toke a long time to drive us and we really had to go but she didn’t care and she parked on a side and she started calling Uber witch they told her that she did could drive us because the max people was 2, but she started yelling at some point saying that it wasn’t the rules. So that toke us like a long time, but finally she had to drive us in the most annoyed way, I wish someone teach her how to treat her clients and Uber care about this things",https://itunes.apple.com/us/review?id=368677368&type=Purple%20Software,2019-11-05T08:38:18-07:00
4516660952,TTYME2020,https://itunes.apple.com/us/reviews/id401833945,3.361.10002,3,The Fare Ratings Are Ludicrous!!,"I actually have a very good rating (though not a 5) from the myriad of drivers I’ve encountered. Here’s my issue - how in the HECK do you have the right to judge customers, who are paying for your services in general? If they are truly awful, you should be able to have an internal complaint system that ranks them and flags or blocks repeatedly problematic or dangerous fares. Even then, that fare should have an email, or in-app notification of the cause(s) for their ratings. As customers, we are asked what the driver did well, could improve, or should stop doing. I’m sure they get that composite feedback so they can improve. If they don’t, that too is very crappy. A scoring system with no background and real examples comes across a arbitrary, very petty, and subjective. Like, they can just ding a person because they don’t like their looks or the fact that the tip is not what they think they deserve or in the form (ie, a nice wad of cash on the seat) they want. How else are folks to know exactly how you want them to behave?? Get rid of the ratings or provide the actionable (with honest examples) feedback to back them up!",https://itunes.apple.com/us/review?id=368677368&type=Purple%20Software,2019-07-25T13:45:50-07:00
3486563744,heartpalmeiras,https://itunes.apple.com/us/reviews/id424345025,3.327.10002,2,Horrible helping solve issues,"I am a blind Uber user using Voiceover on my phone. Living in Massachusetts I am part of the pilot program. I have to reactivate my ride pass every month and never had any issues until yesterday when the app wouldn’t allow ride passes to be purchased through the app for pilot program users. I contacted uber on facebook asking to be sent the link to activate my ride pass online as my friends who were noot able to complete the ride pass purchase on the app were able to do so online. I provided my email and phone number as requested but they never sent me the link and it was as if they didn’t even read my message because they kept saying to purchase ride pass i needed to be eligible, even though i clearly explained i am blind and have been eligible, as well as have been using ride pass every month for over a year. It is not the first time they completely ignore simple requests online in my experience and often i am left with no customer support at all and having to resolve issues myself or by asking other users. As it has been said many times on here...the quality of customer service is non-existent and gets a 0 rating.",https://itunes.apple.com/us/review?id=368677368&type=Purple%20Software,2018-12-02T13:00:38-07:00
2532537102,ToHellWithSurgeRates,https://itunes.apple.com/us/reviews/id564849298,3.298.10000,2,My review,"The app is pretty darn good. What takes the score down is the surge prices you charge. These are completely unfair. When I’m waiting to get an uber, and the app shows 2+ cars literally sitting outside the building I am in, it is not fair or right to charge absurdly high surge rates. The fare to my house from work is in the $5.15-$5.95  range, but it surges to over $20 when it’s “busy”? Not cool. It’s not busy if there are 2 or more cars sitting outside waiting, you can’t charge surge prices like that, it’s immoral and wrong and price gauging. 
Also, you should not allow drivers to take a fare if they are still driving someone else home. Numerous times I get a driver, it tells me they are X amount of minutes away, but still finishing another trip, so the X minutes away keeps going up and up, meanwhile, another Uber shows up close to me that I could get but I can’t because I have already been claimed by another driver that keeps getting farther away, and I’ll be charged if I cancel with them. This is garbage, it should never happen. If a driver is still on another trip, it shouldn’t be allowed to accept another one, but even if that happens, I should be able to cancel with no penalty.",https://itunes.apple.com/us/review?id=368677368&type=Purple%20Software,2018-05-11T06:27:35-07:00
