id,userName,userUrl,version,score,title,text,url,updated
7806745744,PresidentWill,https://itunes.apple.com/us/reviews/id185414444,4.2135.1,5,Latest update adds unnecessary taps for simple actions,"In your inbox, you used to be able to long press a message and multi-select would then automatically be enabled, letting you select multiple emails to move, mark as read, or delete. Now that same long press brings up a pop up menu of options that are, quite frankly, redundant and unnecessary. You then have to select the option for Multi-Select, hence adding an unnecessary extra tap. I used the old method daily for years and so this change is super irritating.",https://itunes.apple.com/us/review?id=951937596&type=Purple%20Software,2021-09-14T16:03:50-07:00
3113467677,Stanley Ipkiss!,https://itunes.apple.com/us/reviews/id123811390,2.91.0,4,Almost great,"2 things are still lingering for issues with this app. 
1. The email inbox still doesn’t update when a new email comes in while looking at an email/looking at the inbox. You can refresh all you want, but unless you close the app completely and reopen it won’t show. 
2. Ability to save/copy emails to add them to another email chain. * Being a business professional I need this. From system issues to referring to other email chains requesting information, I am forced to forward the old email to the new recipients in the old chain versus new. 

Those two things would make my life so much easier and better with his app.",https://itunes.apple.com/us/review?id=951937596&type=Purple%20Software,2018-08-25T11:47:26-07:00
3041944609,Reese125,https://itunes.apple.com/us/reviews/id108759885,2.89.0,4,Ability to look at another email while replying,"I’ve experienced many bugs with this app—the marker not being represented while trying to copy and paste, scrolling up and down the email replying to a message —causing me to close the message and come back in fixes it, and MOST importantly the ability to look at another email while you’re composing, replying or forwarding a message. If Apple mail allows you to slide down the current email and look at your inbox messages -why Microsoft can’t is unimaginable.  I should be able to do that with ease.  I shouldn't need to close out the email then go back in. Microsoft-please fix this major inconvenience!",https://itunes.apple.com/us/review?id=951937596&type=Purple%20Software,2018-08-09T14:55:38-07:00
9931315121,@All¥,https://itunes.apple.com/us/reviews/id1454682179,4.2316.1,4,I’m happy and Suggestions for improvement,"Mostly a wonderful app. There are some uncomfortable features: when I type a new email, I would love it to be easier if I could attach files right away. I would also prefer if when I leave the app it would return me back to the same page I was working with ( if I opened a specific email, and have to leave the page to go look for something else on the phone, I would like to return to the outlook app to the same open email. Currently it is throwing me out and makes me to have to look for that email and reopen it every time) 
Thanks",https://itunes.apple.com/us/review?id=951937596&type=Purple%20Software,2023-05-15T19:11:19-07:00
9481722429,Lrcavallo,https://itunes.apple.com/us/reviews/id175362255,4.2248.3,1,I Am So Surprised,"that this app has such a great score.  It’s a huge time waster.  You would think a tech company with the capabilities MS has, they could prevent junk e-mail from ever entering your email box.  There is repeated emails about lawsuits, Lowes, keurig, etc.  Why does my email ever have to be exposed to this?  Why does my eyes ever have to see this?  Sure, it goes in the junk mail folder, but I need to scan that folder for mistakes.  Hence, it’s a huge time waste.  Setting up rules only works for items that make it to your inbox.

The items flagged by MS as junk can’t be controlled by rules to make them go to the delete folder.  They go directly to the junk folder and there’s nothing you can do but review and delete.  If you don’t do this daily, you have a huge mess.

Why is this?  Could it be that MS gets money from these spammers to allow this KNOWN junk into your email account?  Well, here I go wasting time again documenting a well known problem.  Spend real $ on this?  Right!

It’s just unfortunate that I’ve had my email address since before MS bought HoTMaiL years ago.  Just another big company like Apple that could care less about their customers.",https://itunes.apple.com/us/review?id=951937596&type=Purple%20Software,2023-01-07T07:45:08-07:00
6250111970,OSOMANOSO,https://itunes.apple.com/us/reviews/id22364998,4.47.0,5,Organizes Everything,"Outlook is not just an email tool; it organizes everything. I start off by looking at my email, categorizing them into actions, then scheduling them out as tasks. Sometimes I’ll retain emails as reference and use the information they contain later. Most of the time, emails require action and I prioritize them, organize them, give them a due date, and make the appropriate appointments. 

Outlook helps me plan my work and play to make the most out of all the things I do. It’s one place to see everything and to plan for success. It is a great product.",https://itunes.apple.com/us/review?id=951937596&type=Purple%20Software,2020-07-27T21:21:34-07:00
6362466738,Mr Jgeo,https://itunes.apple.com/us/reviews/id221254576,4.52.0,1,This Version Broke the app,"This recent version caused the app to be completely unusable.  The app says to log into Microsoft 365 to authenticate.  When I tap the login to 365 button Microsoft Authenticator opens up and freezes. I am 100% unable to use Microsoft Outlook now and I am 100% work from home so I am at a stop work.

Please fix this!!!

Also, when I tap settings, help and feedback (like the instructions say) there is no option to send feedback.  Only options to send logs or reset my contacts.  Please fix this too as it is also broke.  I am guessing the button to send feedback used to be there but it is missing now.  My first attempt to use help and feedback and it failed. So my confidence in this app has gone down. It used to be a really solid app and I enjoyed using it. Now it is broken, so I have to stop using it completely.",https://itunes.apple.com/us/review?id=951937596&type=Purple%20Software,2020-08-26T03:29:44-07:00
5176620593,vendoragnostic,https://itunes.apple.com/us/reviews/id533408561,4.12.0,5,IOS kills this app in background,"If you have a few things open already and are using outlook to compose an e-mail, switching out of the app and back forces the app to restart. This sends you searching for the draft you were just writing which is a huge time waste. As someone who copies and pastes things into emails all day the “memory management” feature is actually a bug that’s slowing me down - A LOT. I hope to see this fixed as Microsoft has a great app here but productivity is still the best feature of them all and this seemingly minor issue is making me reconsider the iPhone/Outlook combo entirely.",https://itunes.apple.com/us/review?id=951937596&type=Purple%20Software,2019-11-21T05:00:00-07:00
2475338272,m()()ner,https://itunes.apple.com/us/reviews/id86522425,2.74.0,5,iPhone email app killer,"Outlook rocks! All my email issues went away once I made the switch.  Seemed like I was constantly battling the native iPhone email app with missing mail, just hanging, not refreshing.  I must have reset it up a dozen times.   With outlook it all works.  Calendaring is rock solid as well.  

I do have some criticism of outlook.   The last update email quit working until I did the update.   It would have been nice to have a notification that clearly said your email will not update until the app is updated.  Instead I wasted time trying to troubleshoot email, including resetting it up.",https://itunes.apple.com/us/review?id=951937596&type=Purple%20Software,2018-04-27T09:50:37-07:00
1904306168,Andy Cordova,https://itunes.apple.com/us/reviews/id49649199,2.48.0,5,Amazing email application,"Even though I had downloaded outlook app in my iPhone I used Alto to deal with multiple email accounts in multiple devices. Since they are discontinuing the Alto application I gave it a second try. Only factor deterred me from using earlier was Apple put an extra security measure to get into my iCloud account which was very cumbersome and difficult. 
Now I have got all my email accounts in one roof that is Microsoft Outlook.
It’s a beautiful friendly beta version super easy to navigate.
I think this is the best email application I have used so far and very happy with it. And it is free. Amazing.",https://itunes.apple.com/us/review?id=951937596&type=Purple%20Software,2017-11-07T10:10:51-07:00
10566942740,Fit after50,https://itunes.apple.com/us/reviews/id292128865,4.2343.0,5,The Best Email App,"I’ve used Apple mail, mail, spring, Thunderbird, several other email apps. In my opinion, outlook is hands-down, the best. The only challenge, I wish I could have a multiple instances of outlook. It’s such a great tool, that I would use it for all of my emails, and I have about six different emails that I manage on a regular basis. It would be ideal to be able to separate those out in the different apps, and since I can’t have multiple instances of Outlook, I have to use other tools. That being said, without any close competitor, outlook is the best.",https://itunes.apple.com/us/review?id=951937596&type=Purple%20Software,2023-11-09T06:05:58-07:00
1900566474,HC Traveler,https://itunes.apple.com/us/reviews/id107984202,2.48.0,3,Poor iPhone interface,"One would think that writing an application to run on iOS that it would follow many of the standard usages like swiping left to delete (like every other app on iOS) but Outlook immediately sends everything to the “archive” folder. Also, to indicate that want to select a message for deletion if you don’t do it long enough then it opens the message. Not a nice feature in your junk mail folder - you just verified your email address as active to spam entity and now your email address will shared and/or sold to some other spam entity.  Very frustrating! I’ve been a outlook user since 1998 and if I didn’t have so many pointed to my email address I would absolutely dump this app and move on.",https://itunes.apple.com/us/review?id=951937596&type=Purple%20Software,2017-11-05T18:59:23-07:00
6954439142,bbelgarde,https://itunes.apple.com/us/reviews/id501249143,4.2104.0,5,Outlook mobile app,"I like this app and recommend it for everyone.  It organizes all my Microsoft accounts and can manage my Gmail accounts too. I have six email accounts in my profile. The Focused Inbox is a great feature for filtering out all my less essential email. I can update my calendar easily because it’s built in to the app. If you hate seeing ALL your mail in one list, account by account, (I’m looking at you iPhone Mail) and are constantly swiping away your less useful email to find the important ones from your colleagues, Get This App.",https://itunes.apple.com/us/review?id=951937596&type=Purple%20Software,2021-02-04T14:10:36-07:00
8946104659,JenniKH,https://itunes.apple.com/us/reviews/id525830558,4.2230.0,1,Sending Emails Late,"I needed to send something that was very time sensitive. I sent it in time but apparently it didn't go completely through until the next day, more than 26 hours later. Why? I'm not even sure. I hit send and it was in the email thread along with the other messages. It was time stamped 3:47pm, but I get a response the next day telling me it's too late. The email had just sent two minutes prior. 

I understand that the email contained several files so it needed so time to send, but if it hadn't sent yet would have been nice if it said pending. Also a notification that the email failed or hadn't sent yet could have helped me avoid this. Normally I wouldn't take this so seriously, but that email not reaching the recipient in time quite literally affected my livelihood.",https://itunes.apple.com/us/review?id=951937596&type=Purple%20Software,2022-08-04T19:54:42-07:00
8395036159,keysmahs here idk help,https://itunes.apple.com/us/reviews/id582938253,4.2207.0,3,Folders need to be able to collapse,"I think the app is great, I use the web version and it’s really easy and helps me organize better, however I do see one issue.

I organized all my emails into folders and subfolders on the web version where they can collapse. I assumed the same was possible on the app.
Now, when I check the email on my phone, I have to scroll through all of my folders with their sub folders under them, just to get to a folder I want. 
I have 4 different folders with at least 5 subfolders each. That makes me have to scroll past at least 15 lines of just folders / subfolders just to get to the a folder below the others, and 19 if I go to the lowest subfolder.

I would like the convenience of collapsing my folders so that I can see the 4 folders I have and not all the subfolders stored under them, unless I actually need to access one.

It’s seems a lot of people have had the same concerns for years now, all mentioned on the Microsoft website, so I find it a bit odd that it hasn’t been added by now.",https://itunes.apple.com/us/review?id=951937596&type=Purple%20Software,2022-02-25T07:44:34-07:00
7677800804,DCA1999,https://itunes.apple.com/us/reviews/id338734181,4.2130.0,3,"Works fine, BUT","With the new version all my messages go to the junk folder. Sure I can then move them to the inbox by labeling each one I want as “not junk”. Is that really better than everything going to the inbox, like it did previously, and allowing me to label the junk???   

Also with the new version when I flag an inappropriate, unwanted email, it doesn’t do anything. They keep coming and exposing me to things I really don’t want in my life.  

By-the-way, the money advertisers spend to send ads is totally wasted on people like me. I don’t look at them, and if I do see an ad, it is so irritating that I refuse to buy from them even if they have a good product.",https://itunes.apple.com/us/review?id=951937596&type=Purple%20Software,2021-08-10T11:38:26-07:00
6292182133,minzegwu,https://itunes.apple.com/us/reviews/id910649528,4.49.1,5,Simple and Feature Rich,"I enjoy using this app. I like the fact that you can have multiple accounts. My experience with the app is mostly positive. I do not use the feature as much as I perhaps could but I do like having the Cortana integration.
The one glaring drawback/demerit I would assign to this application is the fact that there is only one unified application for both email and calendar.I, personally, I would prefer two separate applications, in part, so that I can see the calendar/date on my home screen. The unification idea, I suppose, it’s a good one. But I feel that it fall short in practice.",https://itunes.apple.com/us/review?id=951937596&type=Purple%20Software,2020-08-07T13:17:10-07:00
3721912354,MChalky,https://itunes.apple.com/us/reviews/id35803062,3.8.1,5,Office 365,The Outlook for Office 365 allows me to address work emails from wherever I am which is very helpful. There are only two things I’d like to see integrated into the mobile app. I wish that Color Categorizations from my desktop carried over to the mobile app. I use the colors to highlight and segregate emails by type and importance and I miss it not crossing over to my phone. Also my desktop folder order and my Outlook app order are different (not sure if there’s a fix for that?) but certainly not a deal breaker either. Again a phenomenal companion app to my desktop Office Outlook available on my iPhone.,https://itunes.apple.com/us/review?id=951937596&type=Purple%20Software,2019-02-01T14:54:24-07:00
2280720800,Masmusic9,https://itunes.apple.com/us/reviews/id168179422,2.67.0,5,Last night’s uodate is locking up app on iphone 8,"In general I like the app and use it constantly.  I have been frustrated by the inability to read attachments in calendar appointmentments so that addition is very good. But since last nights update the app has frozen several times this morning. Never happened before. I was just reading email or switching between calendar and email when it locked. And, one other comment. It would be really helpful if I could see Outlook “notes” from my desktop/laptop application. That doesn’t seem possible, but perhaps i just can’t figure out how.",https://itunes.apple.com/us/review?id=951937596&type=Purple%20Software,2018-03-07T06:36:04-07:00
9858468416,TWiewel,https://itunes.apple.com/us/reviews/id25509155,4.2314.0,5,Great for mobile,"For a quick on the go email, this app has all of the necessary features. In my opinion, if you’re wanting higher functionality than viewing, replying and sorting emails then no matter what email app you’re using, you need to switch to a computer / desktop view. You’re never going to get as many features on mobile that you can on a PC and to think otherwise is unfair. 

For what this app is, I like it and it’s much more reliable than using the general “mail” app that comes preloaded on your iPhone.",https://itunes.apple.com/us/review?id=951937596&type=Purple%20Software,2023-04-24T22:25:45-07:00
9810556208,MusicAl99,https://itunes.apple.com/us/reviews/id142901733,4.2312.1,5,Really Great,"I love how Outlook calendar syncs with my Teams calendar so I never miss a meeting or appointment. The feature that allows me to listen to my messages is very intuitive and helpful. I am off every week Friday through Monday and when I return on Tuesday, I always have 200 unread emails. With this feature I can safely catch up on my messages while driving between patients. When I come across a message that needs more of my attention, I can easily and safely mark it as unread so I can go back to it when I have time to type a response.",https://itunes.apple.com/us/review?id=951937596&type=Purple%20Software,2023-04-11T07:18:56-07:00
9269131292,74256274,https://itunes.apple.com/us/reviews/id193687427,4.2243.1,1,"Missing Folders, terrible syncing","I really wanted to switch from the iOS native mail app to Outlook because of all the features Outlook has on the Windows application, primarily the ability to set up rules. But Outlook on iOS doesn’t sync correctly with its own Windows application. On Windows, everything in Outlook is set up the way I like it. However, in Outlook for iOS, the mail folders don’t match and can’t sync correctly the way they do in Outlook for  Windows. The iOS version is showing old, deleted folders and other folders are simply missing even though the windows application shows all folders and is syncing perfectly. I’ve double checked all the settings, deleted and reinstalled the app and reset the app. Still doesn’t match the setup I have in Windows.",https://itunes.apple.com/us/review?id=951937596&type=Purple%20Software,2022-11-08T12:20:08-07:00
5065508723,Tayraygaynignig,https://itunes.apple.com/us/reviews/id357842486,4.9.0,1,The absolute worst email provider,"This is single handedly the worst email platform available. Always logging you out of your email, then when you try to log back in it says your password is incorrect, then when you try to reset it you have to jump through so many hoops it’s unreal. Even a call to the customer support number is absolutely no help. Try to send in the proper forms to reset the password and get denied every single time. And there’s no way around this. Apparently there’s “nothing they can do” over the phone, even though they have no idea what the problem is that your calling about in the first place. Absolutely disappointed and frustrated. I’ll definitely be making the permanent switch to gmail after I can finally get in to review my medical forms that I can’t even get access to. What a joke.",https://itunes.apple.com/us/review?id=951937596&type=Purple%20Software,2019-11-01T17:12:22-07:00
10290582258,Hoosier242,https://itunes.apple.com/us/reviews/id34610685,4.2332.0,2,can’t see when emails were sent to me,"The UI experience is terrible in that the latest email in the thread from a day prior (iPhone) never shows when it was sent. You can see whenever ALL previous mails were sent, but for some bizarre reason this app never displays the time stamp of the most relevant email in my inbox. You basically have to reply all, find a way to expand/show the rest of the thread, and hope you don’t accidentally send a reply all email with no new content, just to see when the last email in the thread was sent/ received other than the ambiguous and useless “yesterday” or “Tuesday”. Every other earlier mail in the thread has an exact date and time. Why? Terrible.",https://itunes.apple.com/us/review?id=951937596&type=Purple%20Software,2023-08-23T06:34:38-07:00
10261164401,oscarchele,https://itunes.apple.com/us/reviews/id1123945660,4.2329.1,3,Thank you Microsoft,"The only reason why I gave you guys a 3 star is because as business owner I receive way too many spam, phishing, and fraudulent emails sent to me. I have flagged these people and reported them but I continue to receive their annoying emails. If you could please find a solution to stop these crooks from continuing to send me emails if immensely appreciate it! 

Everything else is awesome on my outlook email. It’s helped me to stay more organized and the views of the emails are pretty crisp. I like how profesional it look when I receive and send out emails to my clients. So thank you for creating outlook it definitely has been a great tool for me to utilize for work.",https://itunes.apple.com/us/review?id=951937596&type=Purple%20Software,2023-08-15T08:36:09-07:00
6925548943,👑Prince👑,https://itunes.apple.com/us/reviews/id462434222,4.2103.0,5,Geary app with easy and understandable layout,"When I arrived at college we were all given outlook email accounts. At first I thought it would be annoying, but ive been soo happy with this email account. The app has a great layout that virtually anyone could easily navigate. My notifications from the app are swift and perfectly formatted for reading without entering the app. Lastly the separate folders and filters for spam on this app are immaculate. I dont even check my spam folder anymore because everything there is ACTUALLY spam unlike many other email providers. Overall, I love it",https://itunes.apple.com/us/review?id=951937596&type=Purple%20Software,2021-01-28T14:18:42-07:00
9572030938,Not-Mozart,https://itunes.apple.com/us/reviews/id142642276,4.2303.0,1,Broken file structure,"You can’t move a folder inside another folder to organize and combine for viewing. It just doesn’t work. You cannot save important emails in a folder and see them in the same list as other emails, therefore important emails are hierarchically equal to junk emails. Thanks for the bad design that makes our lives unnecessarily more difficult. Worse, for some reason MS refuses to make a dedicated calendar app and confusingly they poorly shoehorned a calendar into two other apps that are used for communicating — you have to plan ahead to create a calendar event because you can’t easily see the calendar as you’re communicating. Complete anti-design. Also as a person who once had to write email HTML, MS your Outlook HTML engine is 15 years behind the rest of the world.",https://itunes.apple.com/us/review?id=951937596&type=Purple%20Software,2023-02-01T10:03:19-07:00
9500119863,4 th try nickname,https://itunes.apple.com/us/reviews/id368443810,4.2252.0,4,A good app that needs changes,"Outlook has worked well for me but I keep running into an issue with deleting emails from the deleted folder. I delete emails from this folder every couple of months. There can be 500 plus in that time. Using the app to delete, I have only been able to remove a small portion at a time. I end up going to the outlook website to delete all my emails. This is an inconvenience but it works. The other issue is that some emails take a long time to load. Again an inconvenience that should not be there. I hope that these issues will be addressed.",https://itunes.apple.com/us/review?id=951937596&type=Purple%20Software,2023-01-12T11:14:38-07:00
8012889916,DirtDiver,https://itunes.apple.com/us/reviews/id42163462,4.2144.0,1,"Not great, gets worse…","My school and work make me use this app for my email, and I prefer to keep it separate from my personal so I only have it on outlook. Each update that adds new features has been seeming to make it worse. There are some good things to it, but overall it doesn’t work well. Recently a widget has been added that still won’t show you your emails, but with 1 touch is supposed to take you to your inbox (by the way, the focused thing, is crap), but instead, now the app only crashes and I can’t even open it now. It really is a bit ridiculous how little Microsoft is able to successfully accomplish when it comes to making technology that works lately. At this moment, I recommend NOT using outlook, at least not until they fix it!",https://itunes.apple.com/us/review?id=951937596&type=Purple%20Software,2021-11-11T08:35:52-07:00
