id,userName,userUrl,version,score,title,text,url,updated
8509399514,frosty-brandon,https://itunes.apple.com/us/reviews/id734032273,3.503.10000,1,Okay at best,"Uber has its moments, where you need to get somewhere and it’s a better option. But there are so many issues with this app, it’s insane. I can forgive the 15 or 30 minutes wait times for drivers, I get it, there aren’t always people around you. But the obnoxiousness of the cancelling feature is what made me delete this app. If Uber cancels your ride, or your food delivery, it doesn’t tell you! It just expects you to be checking your app every second for an update on the driver. If you want food, you can order it through the app, it usually takes around an hour to be delivered, but it will say that the order is in progress for an hour, only to silently cancel the order and not even provide a push notification. The audacity. These orders sometimes cost over $100, and we’re waiting for an hour and a half only to check Uber and find out that the restaurant/driver/app itself cancelled the order, giving us no warning, and leaving us stranded or hungry because we didn’t get the service we paid for. I have an AmEx gold card, which gives an Uber credit and an Uber Gold subscription, but even that free $10/month won’t entice me to redownload this app. I’m over it.",https://itunes.apple.com/us/review?id=368677368&type=Purple%20Software,2022-03-29T12:09:52-07:00
8059486028,Youlearn2earn,https://itunes.apple.com/us/reviews/id199588641,3.486.10002,1,Driver did not come as promised,"Sergy was supposed to pick us up in 10 minutes and the app said he was near then after 15 minutes no Sergy. I’m assuming he had a profitable other candidate and put us back. We then cancelled because no one explained why he wasn’t there and there was no way to contact Uber. We went RE assign and it was now $100 more than our original cost (hmm ) after a while we put in agai. For a ride at about the same original price…they assigned the same guy , I mean you can’t make this up. He stated he was here by text but he was at the wrong area. We tried calling but he wouldn’t pick up . I advised him exactly where we were and he said “I ok  got it” we came outside and he wasn’t there. We looked up and think we saw his car 50 paces ahead and began rushing to the vehicle. As we approached, he pulled off and we immediately got a notification “sorry your driver is having difficulty locating you” then disconnected. This is and was an awful experience. I’m surprised because I’ve had good experiences in the past but this makes me Leary. Watch out for Sergy in Silicon Valley . Oh and they still want to charge $5 I mean seriously? I hadn’t used in a while but I remember it being easier",https://itunes.apple.com/us/review?id=368677368&type=Purple%20Software,2021-11-24T14:01:02-07:00
5582818035,Hollidayyyyy,https://itunes.apple.com/us/reviews/id101801141,3.392.10003,1,I feel for the victims,"Uber is a pretty appalling company. They hide behind driver independence for most complaints, and then for others it’s just a refusal to help. And when I say refusal, I mean the bots that run the support on their app cannot help at all. I get that they don’t want to pay staff to do customer service, but at least hire basically competent developers for the bots. The worst part is when they ask for screenshots that are then not reviewed and you just get a dismissive response. Or when they repeatedly put on the same message asking for details that you’ve provided.  Oh and when you type the word bot the next response is always from someone who identifies that they are from a priority support team. If you have faith in your technology, why pretend? It’s like when companies used to force their offshore contact centres to use Anglo-Saxon names. If you want to do things on the cheap, at least have the integrity to own it and see how loyal your customers really are.

The response below is ludicrous, predictable and appears to have come from a bot - the irony is hilarious. I have tried to raise concerns about the bots and it’s just a chain of asking for more details with the same message over and over.",https://itunes.apple.com/us/review?id=368677368&type=Purple%20Software,2020-02-26T04:42:15-07:00
4248523038,Frightened and disappointed,https://itunes.apple.com/us/reviews/id243472577,3.353.10002,1,Horrible ride and overcharge,"I have lived at my home for 16 years and go to the airport at least 3-5 times a month using my navigational system daily to detect accidents, etc..

I know the quickest and most direct way to the airport from my home.   When I told the driver not to turn, he did anyway and took me down a street that was not going to my house. I started to panic and told him to turn around; he started to yell at me. Then he took me so totally out-of-the-way that I started to panic more and wanted to get out of the car. He insisted the GPS was taking him that way. My heart was beating so fast.   Eventually, he got back on track.… But 10 minutes longer than it should’ve taken to get to my home. 

My ride was supposed to be $29 But I was charged much more. I know where I live, the shortcuts, and travel by my navigational system daily. There is no way we would’ve gone down those streets as they were miles in the opposite direction. I am still shaking. I know the reviews for this driver are stellar. I don’t know what happened but it frightened me. He swears the navigational system took him in this roundabout way.… but this was not possible and we went miles out of our way to get to my home.  Will report this to American Express for adjustment.",https://itunes.apple.com/us/review?id=368677368&type=Purple%20Software,2019-06-01T17:34:21-07:00
3524232979,Ford mustang 2012,https://itunes.apple.com/us/reviews/id275632664,3.329.10002,2,Convenient but needs work,"Been an Uber customer now for roughly 3 years with nothing lower than a 5 star rating. Their service is good and makes traveling convenient, especially when out of state.

That being said, they need to work on their customer service aspect of their business. I had a driver who tried to charge me $80 in cleaning fees for no reason. He simply submitted a picture of a wet blanket on top of his car seat to Uber and reported me for things I didn’t even do. Trying to get a hold of their customer service department took over a day due to high volume on the chat feature on their app. They quickly sided with the driver and it took some time to finally get the charge removed. However, now my rating is affected by this fraudulent driver who keeps banging his customers for cleaning fees and other false charges/incidents.

I would recommend adding a 1-800 number for starters and suggest that Uber has penalties for its drivers who try to jack up their fees for no reason and lies about incidents. Again I have been a loyal customer for 3 years, with a 5 star rating and got no incentives from them to keep using their services. Instead I get an $80 cleaning fee as a thank you.",https://itunes.apple.com/us/review?id=368677368&type=Purple%20Software,2018-12-12T16:34:57-07:00
4758046651,Djaiden,https://itunes.apple.com/us/reviews/id110120980,3.368.10004,3,I really hate Uber,"I hate the fact that you can’t physically talk to a real person over the phone when you have a problem. Especially when it comes to payment and safety. Numerous times I have been picked up off the side of a busy street. Not at a light or a stop sign or a pull off road. IN THE MIDDLE OF THE STREET. I have tried contacting Uber multiple times through email but they kept saying adjust your pin. Which I do and it keeps telling drivers to pick me up in the middle of a busy street. This is dangerous .
Also multiple times payment has been double charged and can’t contact an Uber to fix this issue to make sure it will be resolved. Multiple times Uber drivers refuse my ride cause I have a service dog and so I get charged a cancellation fee which is paid with my credit card. But Uber wants to give me a credit. But lately no credit is showing up!!! Please give us a real person to talk to and not shove us to the side with a stupid email. This is annoying especially when I pay up to 40$ per trip. Like that’s a lot of money for someone to pay and you can’t treat your customers right. !!",https://itunes.apple.com/us/review?id=368677368&type=Purple%20Software,2019-09-10T11:30:21-07:00
4014043991,GirstaliKeys,https://itunes.apple.com/us/reviews/id1005654007,3.346.10002,1,They can go eat a fat one,"So I was in a rural area, I needed an Uber home, it was a long ride and cost a lot ($107) but because of it being such a rural area, no Uber’s were available. So after 3 attempts, I went over to Lyft, tried a couple times and same thing, no rides. Not a big deal, got a taxi instead and went home. Come later that night I open my bank app only to find Uber took $322 out of it for my attempted rides, even though they were never done and it doesn’t show them on my app!! I contacted them about this issue, only to be forwarded a email “we are sorry for this inconvenience, your money will be returned to your account in 3-5 days” so because of Uber’s mistake I have to now wait multiple days to get over $300 back that they took (put a hold on) they then proceeded to try blaming this on my bank, stating that this is a very common thing done between all drive share apps. Meanwhile Lyft never took any money from me for my attempted rides, and after speaking to them. If the ride does not pair with a driver, they do not take the money. So I am out $320 for about 4 days, Uber services was no help in getting it back faster, and they lied about this being something all companies do.. will not be using them ever again. Snakes",https://itunes.apple.com/us/review?id=368677368&type=Purple%20Software,2019-04-14T20:00:30-07:00
5504394820,Rockettothemoonworkshops,https://itunes.apple.com/us/reviews/id1003331808,3.390.10003,5,Isn’t it Ironic,"Last night I had a driver refuse to pick me up at a train station unless I walked to the Duncan Donuts store in Ronconcomo New York. After I phoned to explain that I had luggage and a broken foot he insisted again I go to the Donut Shop if I wanted him to drive me. When I explained again that I had no idea where Duncan Donuts was located and reiterated my circumstances he began to yell at me and tell me that I was to far away and it would inconvenience him to drive to the other side of the station. When I questioned why he hung up and cancelled my trip. 

The great news is after 15 min of waiting for the driver who cancelled my trip and another 6 minutes for another Uber I had the “Best” Driver and most fascinating conversation. Not only did the Driver get out of his car to pick up my luggage, when we arrived at my destination, he took my 2 suitcases up 2 flights of stairs. His gracious, kind, compassionate behavior was exemplified by his actions...and so it goes from a nightmarish experience to one filled with Joy. Isn’t it Ironic.",https://itunes.apple.com/us/review?id=368677368&type=Purple%20Software,2020-02-08T08:01:08-07:00
2024710083,Laurelana,https://itunes.apple.com/us/reviews/id223662361,3.275.10000,1,Driver Committed A Crime Against Me,"I went for my first Uber ride today, on Christmas Eve morning. I always treat people who work in service jobs well because I am acutely aware that they are often treated and paid unfairly. I had a nice ride with the driver, asked him about his holidays, etc. It was a 10 minute drive for $15 dollars and I tipped him $5. I also gave him 5 stars on the spot. (He said he was going to give me a good rating; I guess they rate their riders?) Well, this evening, I opened my email to a message that I damaged his car. Pictures were included of cigarette burns. Well, I do. Not. Smoke. EVER! Being anywhere near cigarettes triggers migraine headaches for me. And I certainly didn’t cause that. The car smelled like it had been smoked in every day of its life, to the point that it was giving me a headache. I suspect that he wants Uber to recompense him for his already-burned car. I am furious, to say the least. I tried to call Uber, but it’s funny how they are unavailable. It’s an unfair mark on my name  and goodwill, and I can do nothing to fix it. I can’t even amend my review of this slimebag. All I know is that his name is Abilio and he is driving in the Danielson-Killingly-Putnam-Pomfret area of northeast CT. I deeply regret spending my hard earned money and humanity on this company.",https://itunes.apple.com/us/review?id=368677368&type=Purple%20Software,2017-12-24T17:11:33-07:00
1965781763,ErikJaffe,https://itunes.apple.com/us/reviews/id27122826,3.273.10000,1,Worse and worse over time update,"From the truly appalling GPS directions that send drivers on foolish paths, to the latest innovation of giving the trip to a driver that still has not finished another trip, the designers of this app have done a disservice to the brilliance of the original idea. Now when you look at the app and see ten cars just minutes away, don’t believe the lie. Once you request the car, the app does not give you one of those many available cars, but instead someone who is much farther away and not finished with a current fare. Never used to be like this. No longer trust the App. Did they lose all the good designers?  Or is customer experience simply no longer a priority?  Definitely will start looking at Lyft to see if they can do better.  Don’t know if they can, but Uber has lost any loyalty it built over the years.

Update:  once again Uber shows disdain for customers, assigning trips to drivers who are far away and not done with a previous trip. Driver then cancels forcing rider to start over with another driver far away. Can’t fathom why Uber isn’t losing customers and market value hand over fist. Awaiting next decline in quality, hopefully it will kill inspire competent competing services.",https://itunes.apple.com/us/review?id=368677368&type=Purple%20Software,2017-12-02T14:42:32-07:00
3594586103,usetoloveuber,https://itunes.apple.com/us/reviews/id647876449,3.329.10002,5,Pick up and drop off,"On several occasions the driver’s GPS states a different address other than the one I entered. This results in the cost of my ride to increase when the driver had to wait for me to walk to where he is. At $0.39 per minute the cost of my ride was increased by over $2.00 with UberX. I’m frustrated, the driver is frustrated; he shows me the address his GPS recorded, I show him the address entered and recorded on my phone. To add an additional stop or address also creates a problem. In one instance, I entered one change... the driver’s GPS added an additional one. I had to show the driver the entries recorded on my phone. This is very disturbing and could be considered fraud on Uber’s part. Please fix this problem.
Uber walk is the worst idea Uber has so far... to be dropped off in the middle of no where, nor knowing if one should go right or left to get to one’s destination at night, in a strange neighborhood is asking for a disaster to occur. In my opinion, Uber walk should not be the first option offered.",https://itunes.apple.com/us/review?id=368677368&type=Purple%20Software,2018-12-30T23:28:47-07:00
3051591846,raven 19,https://itunes.apple.com/us/reviews/id115077017,3.311.10001,3,Ok for Drop-offs not Pickups,"The general idea behind the app is that it’s a car- hailing app. Based off of my experience it is good if not great in this area, I’m always able to request rides and the drivers are very easy to talk with and are great at driving you to your locations, never had a missed destination. However the app is totally internet dependent, meaning that if your not connected to wi-fi the app won’t work for you.  This is very short- sighted, I believe, because things happen there should be ways available to contact Uber, cancel rides or modify trips other than through the app itself.  Hence my title, sometimes I request pickups but things come up and I am not able to contact the drivers or cancel my trip( not every location has wi-fi).   Secondly, the app has added protective features such as call 911 and share my ride with family along with app changes like rider ratings but these are more so-so  features that really don’t change anything; if I have no access to wi-fi I can’t use the protective features and the whole idea of rider ratings could be insulting to some people, Trips aren’t free.",https://itunes.apple.com/us/review?id=368677368&type=Purple%20Software,2018-08-11T16:20:11-07:00
3517222568,jaelyntran,https://itunes.apple.com/us/reviews/id947712041,3.329.10002,1,Bad customer service,"I scheduled my ride more than 2 hours beforehand, at about 12:30 P.M., and I supposed to get my ride at 3:05 P.M. - 3:15 P.M. as Uber assured. 
But when it was pickup time until half an hour later, I saw nothing. I had wait for half an hour. At first I thought it was problems with my phone, so I called the driver and checked if he was near my place. I called him 2 times and 2 times he answered me that he was on his way, and that had 2 other riders he had to pick up and drop off before he could get to my place. I told him to tell me exactly where he was, it turned out that he was amazingly far away from my place. 
I had to cancel the ride and booked another ride, this time I waited for another 10 minutes but nothing had happened. 
Finally I had to cancel it again and booked my ride for the third time, this time it worked and I got home after an hour of waiting. 
What's the point of schedule ahead of time when you guys make me wait for an hour to get home while I had scheduled it in advance? After making me wait for an hour, you guys just sent me $10 Uber Credits after I myself canceled the ride? I mean it's not about money, it's about your service. This is extremely disappointing and annoying.",https://itunes.apple.com/us/review?id=368677368&type=Purple%20Software,2018-12-10T16:25:57-07:00