id,userName,userUrl,version,score,title,text,url,updated
7757413465,Red Grange,https://itunes.apple.com/us/reviews/id34334299,4.2134.0,1,STILL Useless,"This app is unusable garbage. Year after year, Microsoft promises to provide iOS, iPad OS, and Mac OS users the same features in Outlook that Windows users have enjoyed for over a decade. Still, nothing. Outlook is a silly little toy for Apple users (if your organization is on a MS Exchange network you are doomed). The MOST IMPORTANT feature for Outlook Calendar is to “see” the calendar of a co-worker in order to set up a meeting. On Windows, a simple task. On an Apple device? Nope. MS hears this complaint often and yet after promising a real upgrade, nothing. Thank goodness there is MS OWA. A truly useful app that does all we need. It is industrial strength and should take the place of silly little Outlook. Maybe 2022 will be the year that Outlook might become a true solution and “all grown up” app that it should be.... or maybe in 2023, 2024….",https://itunes.apple.com/us/review?id=951937596&type=Purple%20Software,2021-08-31T20:49:48-07:00
6732209140,R91240sx,https://itunes.apple.com/us/reviews/id114368714,4.2048.0,5,Great Email Client,"Have to say I really like the functionality of this app. Mobile version is a lot better compared to PC version in my opinion. App is stable & works great especially when being notified of certain emails that you need. Customer service is quick to response which I have to say a lot of other companies I have used in the past don’t. Some your lucky if you ever get a response which is bad business. Keep up the great work guys !!!! 

*Only wish I could use my government email with out having to delete my other personal emails but other then that it’s good.",https://itunes.apple.com/us/review?id=951937596&type=Purple%20Software,2020-12-08T15:59:58-07:00
6232194535,Yodermand,https://itunes.apple.com/us/reviews/id260293678,4.47.0,5,The Best Getting Better,"Thanks for a great APP!

It is super easy to maintain a heavy load of emails. With the Focus and Other tabs plus the ability to select all emails with one touch; this email APP has become a favorite and the developers are paying attention; looking for ways to tweak the best to better. Thanks for a great APP!

23 July 2020 - Still the best email app in town. I have 6 email accounts and get 20 zillion emails daily on stock and option trading suggestions. Easily wade through them and evaluate their usefulness while keeping up with day to day operations. Live the app!",https://itunes.apple.com/us/review?id=951937596&type=Purple%20Software,2020-07-23T06:00:54-07:00
3159534638,Ginadrylie,https://itunes.apple.com/us/reviews/id72026072,2.94.0,5,Exceeds its reputation,"We’ve all worked jobs that are still running a Microsoft package from the nineties. You might expect this to be clunky, inefficient, outdated, but you’d be VERY wrong. They really took care to make this as useful as possible. I prefer it to gmail actually, because here you can put a “pin” in something where it stays pinned to the top of your inbox, for messages you need to frequently reference. It also has a nice integration with other Microsoft products, like you can edit a document within the email using a mini Word processor, and save the versions within an email thread",https://itunes.apple.com/us/review?id=951937596&type=Purple%20Software,2018-09-06T04:47:04-07:00
4983279022,Random.Reviewer7,https://itunes.apple.com/us/reviews/id103324179,4.7.1,2,Had issues that weren’t resolved,"The app itself is decent if it works for you, the support seems to be largely useless though. I’ve had issues loading emails for a few months and the support hasn’t really helped. There’s been a bunch of generic reinstall/update and restart advice. There’s been back and forth going back months that has involved simply getting them information, and their last suggestion was to download another app to see if it helps, but it didn’t. On top of that they closed the support channel multiple times without any resolution and there’s no escalation or customer support ticketing policy in place either for app issues. In short, if it works for you great but if you encounter issues just try something else instead.",https://itunes.apple.com/us/review?id=951937596&type=Purple%20Software,2019-10-20T00:26:18-07:00
9647502689,CH CH YEAH,https://itunes.apple.com/us/reviews/id929118468,4.2306.0,5,Never going back to Gmail,"I grew up using google and all of its associated apps for work and school, but recently for no reason Gmail just wouldn’t work without being connected to secure wifi. This stopped me from being able to check my emails on the go and being able to keep up on my school work. I looked for another app for ages and came upon possibly the best app available. Outlook doesn’t require secured wifi and it makes everything so much easier with the simple account switching. Never going back!",https://itunes.apple.com/us/review?id=951937596&type=Purple%20Software,2023-02-23T08:22:18-07:00
2228697566,Rubén P,https://itunes.apple.com/us/reviews/id42619180,2.64.0,1,"Longtime, loyal user, now very disappointed.","For a corporate user of Office 365, Outlook for iOS was the best mobile client by far, but in the last weeks it seems the development and operations team released half cocked versions with this not so useful “universal search” that misses some emails on the results. Then a day long downtime with connections to Office 365 accounts that required to erase and reinstall the app, reconfigure the accounts, signatures and all configuration. And finally yesterday removed without any notice the option to attach a Dropbox file, only remains the option to send a link to the Dropbox site, that in fact is not attaching a file. 

In a typical mail-reply situation where you have to respond attaching two documents you have on your Dropbox account now you can’t do it with Outlook. 
This feature was available more than 2 years ago. 

Now I’m receiving mail also on the native iOS mail account just to be able to reply an email with a Dropbox attachment. 

Being Outlook for iOS the official Microsoft client for Office 365 Enterprise E3 subscription, this shouldn’t happened. This has to be a stable product, there is no reason for removing features without alternative solutions.",https://itunes.apple.com/us/review?id=951937596&type=Purple%20Software,2018-02-20T05:48:13-07:00
1836062977,"!!""InHim""!!",https://itunes.apple.com/us/reviews/id637571365,2.45.0,5,Review of Outlook App for iPhone,"I am pleased to use my secure eMail account on my Apple devices as I have preference to those over other brands.  
I believe my Apple cellphone to be superior to others in quality, preferences, and security.  I am NOT excited about the iPhone 8 augmented reality feature scheduled for distribution on November.  When it comes to email, I prefer Outlook, especially with the thumbnail Security pass option.  I would would like better access to emails from the past.  It is my understanding that if I place emails within the archives area, they do stay on my cell phone.  Thanks for asking.",https://itunes.apple.com/us/review?id=951937596&type=Purple%20Software,2017-10-08T17:04:21-07:00
8924042571,President Cheeto,https://itunes.apple.com/us/reviews/id614256552,4.2229.0,4,Better than others.,"I typically favor Outlook because I perceive it to be more secure than Google. That said, the interface is clunky for someone with multiple accounts. No way to differentiate which is what. The circles used are not customizable in any way and can’t be ordered. I could go on but it boils down to lazy programming, which is the new norm.
[Revised 7/22] 
No upgrades to the interface since my original review. Microsoft is not listening to me. Or you.
I am a function guy. Fashion is nice, but function rules.
Still no way to customize account icons, so there’s still no way to tell which icon is associated with which email account. This is no big deal if you have one or even two accounts, but many people have many accounts. Full blown Outlook for PC is a pretty snazzy program once you learn it, and as a tech I did. You can’t expect a mobile application to perform like a desktop program. But this is an easy fix, guys.
I still give Outlook mobile 4 stars.",https://itunes.apple.com/us/review?id=951937596&type=Purple%20Software,2022-07-29T07:35:28-07:00
7651285803,saleh.makki,https://itunes.apple.com/us/reviews/id1032105214,4.2130.0,4,Almost perfect,"I liked outlook on my tablet and my phones. Everything looks good and friendly. But the only issue I’m concerned about is that contacts from other emails can’t be retrieved. I have two work account, one is using outlook and the other one is using gmail. When I added my outlook work account to gmail app, all contacts under my work domain were there and were easy to search and find. But when I used outlook app and added my gmail work account, it was hard for me to look and search for contacts under my work domain in gmail. Outlook app works perfect for outlook account.",https://itunes.apple.com/us/review?id=951937596&type=Purple%20Software,2021-08-03T11:45:24-07:00
7387797325,tangen7,https://itunes.apple.com/us/reviews/id155141838,4.2119.0,4,Nearly useless,"If writing more than a few lines of text on iPhone SE 2 or iPhone 6 (smaller) line of phones because the text above the small text area scrolls off screen. Scrolling back “up” to the top of your message is impossible because the app “smartly” scrolls all the way down to the bottom of message.. even if the cursor is at the top!! So, there’s no practical way to revise your message. I guess it may not be as much of a problem on larger phones or tablets because I see nearly 5 stars for this app. A larger phone isn’t an option for me so this app is useless as is. Wasn’t always the case, btw.",https://itunes.apple.com/us/review?id=951937596&type=Purple%20Software,2021-05-25T12:34:03-07:00
7094678132,phxpaul,https://itunes.apple.com/us/reviews/id38573578,4.2109.0,3,"Meh, nothing spectacular","I tried using this app as my daily driver for everything it does. Just email now and not for my primary account. My accounts get a lot of ads that I want to delete. I haven’t found a multi select to bulk delete messages. I’ve only been able to swipe away

Also, the new widget feature that Apple introduced, this app and another fail to recognize the current day. I’ve put a small square widget on the 1st home page screen (either app) and it often will be stuck on 2 days past. Outlook widget doesn’t offer ‘edit widget’ but the other did, it didn’t matter if the widget was set to ‘mirror system’, or ‘mirror app’. So I think the bug is in iOS, not the respective apps.",https://itunes.apple.com/us/review?id=951937596&type=Purple%20Software,2021-03-12T06:28:39-07:00
6570921970,A.Sings,https://itunes.apple.com/us/reviews/id654994451,4.60.0,3,Like outlook but a problem with cursor,"I like my Outlook a lot. However, when I go to write a message it’s very difficult to use the cursor. When I put my finger on the cursor and want to move it, it will want to jump up to the next line of text, or move the page around instead of going directly to the letter I want to correct, sometimes it won’t move it all - even after repeated attempts. This gets very frustrating when I’m trying to quickly correct my typos, or incorrect words or letters when using speech recognition.
The speech recognition function could still use refinement. As my arthritis progresses, it becomes more painful to use my thumbs to write emails.
Otherwise I very much like Outlook.",https://itunes.apple.com/us/review?id=951937596&type=Purple%20Software,2020-10-24T18:54:53-07:00
5250292867,Linden27,https://itunes.apple.com/us/reviews/id87757746,4.14.0,4,Generally wonderful...a few missing features hold it back from excellent,"I love Outlook for iOS generally. It’s easy to use, intuitive, and robustly featured. 

That said, I travel frequently for work and would like iPad to be my primary mobile device when I do so...but Outlook is missing the multi-window capability, and drag/drop for files/links, etc that was introduced in the latest iPad OS version. You can run the app alongside other apps, but not alongside itself (sometimes I have to draft an email and pull attachments from another email...this is INCREDIBLY cumbersome!) 

Anyway, I hope they update this soon to be able to run multiple windows!",https://itunes.apple.com/us/review?id=951937596&type=Purple%20Software,2019-12-08T16:29:48-07:00
3794683428,Sndmn7,https://itunes.apple.com/us/reviews/id86134651,3.11.0,2,Good email function bad calendar app for the traveler.,I like the email portion of the app but the inability of the calendar app to set a time zone means all meeting times change with every time zone you visit. That means when I plug in my two o’clock meeting in LA for next week and I’m at home in Denver. When I show up in LA the meeting time has changed to one o’clock because it sets it as two - mountain time.  I really want to like this app but I have meetings all over the country and it’s ridiculous to have to input my 12 o’clock meeting in NY as 10 so when i show up on the east coast it says 12 and when i look up my meeting time during my layover realize that the meeting says 11 but it’s actually 12 because I’m currently in central time. Looks like it’s back to the stock iOS calendar app. :(,https://itunes.apple.com/us/review?id=951937596&type=Purple%20Software,2019-02-20T16:38:02-07:00
3735797460,カビッド,https://itunes.apple.com/us/reviews/id43407147,3.8.1,1,Most glitchy iOS app I have ever used,"App constantly freezes, locks up, fails to render new data when clicking an email or button to change view.  While it seems to work better on my iPad Pro, it still has same issues just less frequently. On my iPhone though this app is nearly useless do anything other than notifications of meetings as known at the start of the day or arrival of new emails.  Should the calendar change through the day, fat chance the updates will sync in a timely fashion.  Furthermore, should I want to actually read the new email or reply, better switch to iPad Pro to have a greater than ZERO % chance of success, or desktop to achieve 100% chance of success.  If it weren’t for the fact that this is only way to access company e-mail, I would purge this app full stop.",https://itunes.apple.com/us/review?id=951937596&type=Purple%20Software,2019-02-05T04:03:39-07:00
3201853652,Kayencee,https://itunes.apple.com/us/reviews/id101113612,2.96.0,2,Sunrise was better,"Sunrise was pretty much the perfect calendar app ever. Now that Outlook integrated sone of the features, and forced me to switch over, I'm very unfair. The features are not nearly as robust as sunrise calendar. For example, if I sync a Google calendar, have access to the entire mailbox in the Outlook app as well. I don't want a whole mailbox synced, I only want the calendar (I'm syncing my husband's business calendar and I don't want all his emails up in my box). Next, calendar data earlier than approximately three months is deleted. It's September now and when I went back to view my calendar for May this year so that I could start planning for May next year, all of the data was erased from June and before. What good is a calendar if I can't view data to plan?",https://itunes.apple.com/us/review?id=951937596&type=Purple%20Software,2018-09-17T23:37:01-07:00
10050915808,Dr Donnachaidh,https://itunes.apple.com/us/reviews/id1052958310,4.2321.1,5,Outlook is Outstanding,"Most people do not know Outlook’s history.  The US House of Representatives in 1996 was the largest email location user in the world.  Microsoft Exchange was the tool then.  We had dedicated people from Microsoft there, constantly upgrading and improving exchange so that it became more reliable and robust.  It was a real pressure cooker.  I remember getting 150 emails each day while I was on staff for 10 years.

Finally, the program became updated and absolutely reliable.  It was renamed outlook and the world has a wonderful email tool to this day.

William A Duncan PhD",https://itunes.apple.com/us/review?id=951937596&type=Purple%20Software,2023-06-19T11:19:27-07:00
10283598062,"It's me, Alan",https://itunes.apple.com/us/reviews/id408961583,4.2331.0,4,"Functionally Great, Could Use some Aesthetic Improvementd","Functionally the app does almost everything I need, and I couldn’t be happier with the product. 

 A few suggestions: 

 - The dark theme seems like an afterthought. They just turned the background black and the text white and called it a day seemingly. It’s not easy to see the text at times, especially for the gray tones and the pure white is harsh on the almost pure black background.

- Too many buttons at times. There’s a set of buttons at the bottom to switch between mail, calendar, etc. and there’s a set of menus at the left for changing account and for viewing different mailboxes within the account (if in the mail tab at least). It seems like the app is trying to do too much at once with limited screen real estate. A little like they ported some UI ideas from the desktop version. Would be nice if the app was streamlined with fewer sub menus or maybe the app tries to do too much at once…",https://itunes.apple.com/us/review?id=951937596&type=Purple%20Software,2023-08-21T07:44:55-07:00
8864342826,Whatchamacallit!,https://itunes.apple.com/us/reviews/id318316908,4.2226.0,5,"Outlook Is Awesome, but…..no personalized signature available for app/mobile application.","I always enjoy the efficiency of this Microsoft email and file management system with one significant caveat.  
It does not permit me(or anyone) to build or even convey an existing personalized, branded signature in emails generated from the mobile application.
This is significant because sometimes critical or time sensitive communication between businesses are sent without my/our standard logo signature as when they are generated on my laptop or desktop computer.  It creates an inconsistent look in communication. 
Some, or even most times this may not be as important, however there are other times that this is more critical or advantageous.  
Hopefully this is an issue that is possible to fix.  With all of the world’s best program developers available to Microsoft, I have to believe that this is entirely possible to write into the Outlook app. 
All the best!",https://itunes.apple.com/us/review?id=951937596&type=Purple%20Software,2022-07-11T16:30:06-07:00
8971551044,IBilldobaggins,https://itunes.apple.com/us/reviews/id497158216,4.2231.0,2,Ok as long as your messages aren’t urgent,"First off, Outlook works smoothly most times and does its job well with minimal hiccups. The reason for the 2 stars?  It’s 2022, I can set my security, unlock my doors, start my car, and turn my lights on all with my smart phone.  Using outlook however I cannot send an urgent email. How difficult is it for Microsoft to add this simple but useful feature?  Unfortunately I’m stuck using this app for work when I can’t access my laptop, and am in need of sending urgent emails often.  Would be nice to not need to stop, set up hotspot, and get laptop out just to send a short email when under any other condition I can simply open my phone.  Hopefully by 2032 they’ll add this feature.",https://itunes.apple.com/us/review?id=951937596&type=Purple%20Software,2022-08-12T08:46:58-07:00