id,userName,userUrl,version,score,title,text,url,updated
6917316504,RubixNoob,https://itunes.apple.com/us/reviews/id921596106,2021.02.0,5,"Good communities, Even the micro-transactions are a plus.","Obviously there are exceptions, but I’ve always found Reddit to be a social media platform that is very positive. You get to curate exactly the content you’re interested in and even political debates that I’ve seen are fairly civil compared to the vulgarity on Facebook and Twitter. I feel like I still have a soul after I spend some time on Reddit whereas I don’t when I used to use Facebook. 

The micro-transactions for awards is also a very positive experience. Personally I don’t use them, but people are willing to spend their own money in order to recognize others for achievements, humor, or touching personal moments that they’re willing to share. It engenders positivity.",https://itunes.apple.com/us/review?id=1064216828&type=Purple%20Software,2021-01-26T15:26:53-07:00
6601319943,Mreeves336,https://itunes.apple.com/us/reviews/id553863205,2020.41.0,1,Poor notification system. Image posts,"I don’t know what’s going on and I thought the issue would be fixed but I have literally had the same issue for years. I am never able to click on a Reddit notification and just be taken to the post I was notified about. NEVER. It only takes me to my post and shows no comments to where I then I have to back out and click on the notification inside of the app. EVERY. SINGLE. NOTIFICATION. There’s no way something as core as that should not work well???? I have to fight to get to whatever I’m being notified about every single time. 

I’m glad we can post multiple photos now but if the maximum amount of characters is 300 for image post, then why don’t you have a counter telling us how many characters we have? I literally have to copy and paste my text into a character counter on Google to figure it out. It’s weird how we have to use other resources like imgur to enjoy reddit fully",https://itunes.apple.com/us/review?id=1064216828&type=Purple%20Software,2020-11-02T07:28:38-07:00
3336957106,rasco13,https://itunes.apple.com/us/reviews/id85229548,4.21.0,3,I wanted it to be good,"I really wanted the official reddit app to be good. Today I have to take it off my phone. Coming from the wonderful time of alien blue into the Reddit app took some time getting used to. After using it since it was first released on iOS, until today, it has not been an enjoyable time. I will say that it does have the right intentions and the accessibility that any user would want. With that being said, it still has so much to fix. Long loading times, freezing, crashing, and preferring cell data over wifi are the small things that have never gone away and occur frequently. So much time has passed and lots of nice features have been added but stability is not one of them. I hope that it stays in the direction of improvement, but for myself I will be looking for another app.",https://itunes.apple.com/us/review?id=1064216828&type=Purple%20Software,2018-10-23T22:17:18-07:00
10585519828,Once a great platform,https://itunes.apple.com/us/reviews/id1357933879,2023.45.0,1,Reddit was once a great platform,"Reddit used to be great, but it’s really gone downhill these past few years. Reddit has given all control of the app to their mods, who are essentially low life people who have time to be on Reddit 24/7. These guys just have too much power, and essentially follow whatever rules they want. I had a post removed last week for criticizing my sports team after a bad play. Mods removed my post with no explanation other than they probably didn’t like me criticizing our team, and other things have happened before. 

To top it off, Reddit just killed Apollo. I’m not sure how 1 man can build an app that works so much better than reddits wholes development team, but the Reddit app is just bad. Far too many ads and sponsored posts, and the app itself is not as intuitive as it was. This was just a decision based off greed looking for a few extra bucks a year.",https://itunes.apple.com/us/review?id=1064216828&type=Purple%20Software,2023-11-14T10:30:07-07:00
10249444811,JaninosaurusRex,https://itunes.apple.com/us/reviews/id132347756,2023.31.0,1,I keep turning notifications off. It keeps switching them to immediate.,"I don’t know if it is exploiting iOS, but you cannot turn off notifications. If you have them off, it asks you to turn them on, you hit “no”, and then it turns them on anyway somehow. And as “immediate” which breaks through do not disturb settings. It’s distracting and awful. So you go into notifications, turn them off altogether, and then next time you open the app, they’re back on immediate. So if you want minimal or no notifications on your phone, the only way to use this app is to delete it after using it and then reinstall the next time you want to check Reddit. Since you don’t interact with the iOS interface for this to happen, this developer is being very shady. I have no idea why Apple allows this.

If this happens to you, please report it. The app should not be able to override iOS.",https://itunes.apple.com/us/review?id=1064216828&type=Purple%20Software,2023-08-12T07:32:53-07:00
10084273857,Someone else XVIII,https://itunes.apple.com/us/reviews/id170603205,2023.24.0,1,"Slow app, extortionate pricing, hostile UX","I don’t think I’ve had any other app slow my phone down like this app does on slow internet when it tries to refresh in the background. Is it extra tracking? I have no idea. Native apps should feel snappier than this.

Reddit is a great online community, but the official application from ten years ago that just displayed the mobile site of the time was more pleasant than this. The amount and size of advertisements is unacceptable for a site of Reddit’s stature, and the fact that the pricing for ad-free access is only per-account rather than having a cheaper per-device option with no extra features is very frustrating. I’m not paying 100$+ a month for my separate Reddit identities to be accessible with no ads. 

Moderation tools still seem to be undercooked, despite the application being several years in development.

I haven’t figured out how to sort the homepage, which is frankly ridiculous.

I do like some of the new changes to Reddit such as community awards, I think they’re good and they add variety to how we interact with each other on the site. But this app seriously needs a lot of work. Reddit is the heart of the internet, at least right now, and I’m pretty surprised at the state the app is in.

I really wish this app was better.",https://itunes.apple.com/us/review?id=1064216828&type=Purple%20Software,2023-06-29T00:49:06-07:00
10037314393,Nebuchadnezzar 4th,https://itunes.apple.com/us/reviews/id135082134,2023.23.1,1,Inconsistent & Buggy,"I cannot believe that I am being forced to use this app now. I switched to Apollo because of how frustrating this app preforms. 

Nevertheless, this review is about the app itself rather than my experience on having to switch.

No way to view friends list.

I’ve experienced several instances now where I attempt to go to the comments section from home and it fails to do anything. I’m not talking attempting to load the page. I’m talking full unresponsive as if it failed to register the tap. It always requires the force close the app and try again. 

Not a huge fan on how video content is displayed. If I want to watch the video linked, I’ll watch the video. If I want to read the comments, I expect to be able to ready the comments with have to see the video and manually move the comments section overtop of the video. 

Search on Apollo was also a lot better. It allowed me to easily differentiate between searching for a subreddit, user, or comment. Search on this app is as good as using search on Reddit site which should tell you all you need to know. You might as well go to google and search “xxxxxxx Reddit”. 

Overall it just leaves me feeling disappointed because I know how good the app could be because we have had great apps for a while now.",https://itunes.apple.com/us/review?id=1064216828&type=Purple%20Software,2023-06-15T12:26:47-07:00
10031481269,Clover_Bird,https://itunes.apple.com/us/reviews/id548977529,2023.23.0,1,Driving Themselves Into the Ground,"Reddit is a platform where the community does 99% of the work maintaining the site.

By charging an exorbitant cost to all 3rd party app developers, they are not only removing the superior ways to view the site, and all of the necessary moderation tools that their own site and app do not provide, but they are also removing accessibility options for disabled users (e.g. Reddit-official does not support screen readers, which are vital for blind users).

They claimed they won’t be charging any 3rd party developers for API access so long as those developers do not charge for the use of their applications or make a profit from it otherwise, but this is a lie. Multiple completely free 3rd party apps with no income have had their developers contacted with the financial costs they will incur once the API restriction is instated in just a few days.

They are spitting in the face of the community that not only made their site what it is today, but who have also kept it that way all this time.

Numerous subreddits with HUGE member counts (1,000,000+ members individually) will be permanently shut down due to the upcoming removal of vital moderation tools. It will become a shell of what it once was unless they roll back these ridiculous demands.

They’ve dug their own grave and are driving themselves into the ground.",https://itunes.apple.com/us/review?id=1064216828&type=Purple%20Software,2023-06-13T20:24:30-07:00
10015761011,Slthompsonn,https://itunes.apple.com/us/reviews/id1310964099,2023.22.0,1,Trash,"After the unreasonably high API price proposal that will destroy 3rd party apps, I wanted to finally review my experience with the official app since its soon going to be the only option. Well. Not the only option. On June 30th I’ll be permanently deleting my accounts which are 9, 6, and 3 years old, respectively. 

There’s a reason I switched to Apollo years ago - the official app is clunky, unintuitive, and is overall a net negative user experience. The ads, the “suggestions” on other subs to follow, and the menu bars mean that the majority of your phone screen is always displaying a significant amount of content that you have NO interest in engaging with. 

Overall, Reddit isn’t worth the trouble unless API pricing is made reasonable (with a set pricing guarantee over whatever the subscription period might be), as Reddit has had more than enough time to improve their own app with key user and moderator features.",https://itunes.apple.com/us/review?id=1064216828&type=Purple%20Software,2023-06-09T07:37:13-07:00
9603703560,Thekittenz,https://itunes.apple.com/us/reviews/id303812780,2023.05,2,Probably THE worst video player of ANY app!,"Terrible video player that frequently breaks and refuses to play specific videos, requiring a restart of the app and losing your place. Utterly inexcusable incompetence by the developers, who should be placing this as a high priority issue to be fixed instead of the occasional “performance optimization”. To anyone facing this issue, you can bypass it by pasting a link in a chat client and clicking it to open up the video in the still-open app, demonstrating how RIDICULOUSLY easy it would be for the developers to fix or even band-aid by adding a “reload video” option. Opening any “Open in Reddit” link from your browser will just open this App Store page, to add even more insult to injury.
As of this update the news tab is completely broken and shows all subjects regardless of your filter choices.",https://itunes.apple.com/us/review?id=1064216828&type=Purple%20Software,2023-02-10T10:11:23-07:00
9106807188,xraijinx,https://itunes.apple.com/us/reviews/id1365766697,2022.34.0,3,*DEVELOPERS PLEASE LOOK INTO THIS*,"Can’t report problem through app, so I’ll just do it here.
I’ve been going on Reddit a lot lately, mostly for the news and funny/random stuff. Then one day, Reddit had an update…I can no longer see my daily feed, posts, messages, or anything. Every tab I tap on says, “can’t load page” something like that. I tried logging off or switching to a different account, it gives me an error and I’m unable to switch or log off. So I tried a different method, I uninstalled and installed the app, thinking it will fix the problem…instead it made it worst. Now whenever I open the app, all I see is a blank white screen and nothing happens. Developers, please look into this, this has been going on for a while now ever since the last update.",https://itunes.apple.com/us/review?id=1064216828&type=Purple%20Software,2022-09-21T06:07:51-07:00
8426809731,Zeebopi,https://itunes.apple.com/us/reviews/id503053495,2022.08.0,1,Video player broken,"They change the UI constantly, never for the better. They keep finding new ways to shove communities I’m not interested in down my throat. They put my list of joined communities in a sidebar which lacks the feature it used to have allowing me to see my recently visited communities. 
The algorithm of the order it shows posts in is pretty weird too. It hyper fixates on the couple that you visit most, to the point that near the top of my feed, it’s basically all posts from the same 3. That becomes a self fulfilling prophecy. 
And the video player is completely broken. For the past two days since the last patch, 75% of the videos won’t play. It just says “something went wrong” and since a large portion of the things I want to see are videos, this has made using the app pointless. It’s not a wifi thing. It happens on strong, fast networks as well as 5G.",https://itunes.apple.com/us/review?id=1064216828&type=Purple%20Software,2022-03-06T05:59:28-07:00
7165586334,Raevyn🥀,https://itunes.apple.com/us/reviews/id592468314,2021.12.0,4,Great app but I would like to see something change...,"I have been on Reddit for a little while now and I believe it’s a great app. You never know what you’re going to get! However, when I delete a post, it never completely goes away and that’s something I find a bit bothersome. If I deleted something, I would like for the entire post to go away because I most likely deleted for a good reason. Having to see it when looking at old comments I might want to delete, is fairly unsettling for me because it serves no purpose as to still being on my account. Hidden posts are included in this too. If I hide a post, it’s for my own selfish reasons. I don’t want anyone to be able to look it up. Other than all of that, I really like it!",https://itunes.apple.com/us/review?id=1064216828&type=Purple%20Software,2021-03-31T01:36:32-07:00
6935273464,Kirrawynne,https://itunes.apple.com/us/reviews/id37196651,2021.03.1,1,Format changes,"I love to waste time on Reddit, however, changes made to the mobile app really leave a lot to be desired and makes using it frustrating! First, the arrow button that used to sit at the bottom of the screen that would scroll to the next section of comments has been moved to the middle right side, which my thumb constantly accidentally hits while scrolling with my thumb so I always have to go back and find where I was reading. Also, and even more frustrating, when I leave a reply, it automatically scrolls up to the top of the comments and you have to scroll through the comments and find where you left off. Both of these issues really are annoying and interrupt the enjoyment of going through comment sections, especially when there is 500+.

Please change this back. It really makes it hard to enjoy the site as much as I used it. It interrupts the immersion into discussion.",https://itunes.apple.com/us/review?id=1064216828&type=Purple%20Software,2021-01-30T23:13:45-07:00
6926111659,EpicLink22,https://itunes.apple.com/us/reviews/id384244397,2021.03.0,4,Not a Fan of the New Video Player,"I love Reddit, everything about is really good except for the new video player on mobile that was recently added. It feels slow and clunky, I never really cared much for the r/Pan interface, and when they brought it to everything I clicked it was sort of annoying. Reddit videos take longer to load and the comments are a few more annoying touches to get to, and aren’t even full screen. The video player feels like a more cluttered version of tik tok or Instagram reels. I wish there was an option to turn it off and go back to what I had before. Otherwise though, I really enjoy the Reddit app, just not as much with the new video player, and if you look on r/mobile you’ll see I’m not alone with this sentiment",https://itunes.apple.com/us/review?id=1064216828&type=Purple%20Software,2021-01-28T17:29:46-07:00
6031050492,Stephanie H12,https://itunes.apple.com/us/reviews/id301637962,2020.20.1,5,BLM,"Everyone is furious about the icon color change but not taking action to reform and uproot the police system in America that is based on oppression and systematic killing of people of color. I am an American citizen and I am smart enough to know we need to change. Thank you Reddit for standing with us. ALL LIVES WILL MATTER ONCE BLACK LIVES MATTER. If you have 5 kids and one kid gets cut, do you give a bandaid to all 5 kids? No, because that kids pain is more severe and the other kids are not injured. No one said your life as a white person did not matter, (AllLivesMatter is stupid and takes away from the pain and troubles of the BLM Movement) but one is more severe. George Floyd died for no reason but rampant racism and bigotry in the police system. BLM. RIP. ACAB.",https://itunes.apple.com/us/review?id=1064216828&type=Purple%20Software,2020-06-03T11:34:36-07:00
3126419152,MCRIDETHIS,https://itunes.apple.com/us/reviews/id474298160,4.17.0,5,The only app you’ll ever need,"Reddit is the zeitgeist of the internet. Communities are born and shaped here. While trying to balance quality content with a clean UI in this wide of a scale is nearly impossible, I feel that the Reddit app does exactly what it sets out to do and more. 
While improvements need to be still made for the app, I feel that the app is a more efficient and more satisfying to browse than either of the website versions.
I’ve tried other Reddit apps, but they just don’t have the same seamless feel to me. Only on this app can I immerse myself in the world of Reddit as I see fit. There is a reason that Reddit is growing so much. I don’t think I’ll ever stop using Reddit. It is everything I need it to be.",https://itunes.apple.com/us/review?id=1064216828&type=Purple%20Software,2018-08-28T16:10:26-07:00
5855689385,Redditor04729,https://itunes.apple.com/us/reviews/id299569035,2020.14.1,4,Clicking on picture glitch,"Overall, Reddit itself is very customizable and there’s a subreddit for just about anything. A huge problem is that when clicking on pictures and then backing out, my feed will be set to a random post and when I scroll it loads in a completely random place in my feed. This is very annoying as it happens about 50% of the time I click on pictures straight from my feed. If I click on the post then the picture the problem happens way less often. Sometimes it loads past a bunch of posts, sometimes it goes very far back and makes me scroll for a while to get back to the spot I was originally in. While this isn’t a big deal, after a while it can become very frustrating.",https://itunes.apple.com/us/review?id=1064216828&type=Purple%20Software,2020-04-23T21:03:31-07:00
4521715504,<<Dylann>>,https://itunes.apple.com/us/reviews/id954718198,4.38.1,5,Love it! Great App,"I’ve found reddit to be an overall wonderful and honest community. People on Reddit are quite quick to call out others for bigotry and general BS, which is great sometimes, not always. The App itself is more visually customizable than most, which is nice. I prefer dark mode. You can also edit the layout posts appear in, which is cool. Making new accounts if needed for privacy and etc is very easy as well. Overall pretty great app, though I’ve heard of some extremely unsavory subreddits that were reported being sustained despite obvious abuse taking place there, which is very disheartening and scary. However, as long as you stay off those subs, you’ll be fine. Hope it stays around.",https://itunes.apple.com/us/review?id=1064216828&type=Purple%20Software,2019-07-26T12:39:58-07:00
2571133965,Kate Rose Tyler,https://itunes.apple.com/us/reviews/id172180856,4.9.3,4,I like this app...except for one thing,"I would love to be able to give gold on this app, I see at least one comment every day that makes me laugh because it's clever or funny and I'd love to gild it, but I can't! It's so frustrating! So I'm knocking off a star for that.

The actual app I quite like, I have night mode on all the time and it's only crashed a handful of times. I can count the times on one hand. Yeah the UI switch of collapsing comments without letting us know was annoying but I figured it out. people will complain about anything.

The general functionality is great, I like it just fine. the messages tab is actually way better then the desktop version. actually I just like the mobile version better than the desktop version, the desktop version is overwhelming to me and kind of unorganized but on mobile I do miss the creative subreddit banners. I like the cut-and-dry UI though, no fancy embellishments, just text. maybe I'm boring.

moral of this story: PLEASE add the ability to give gold to this mobile app. that's my major complaint. honestly it's kind of ridiculous that the OFFICIAL Reddit app doesn't have that functionality ???? that's just bizarre to me",https://itunes.apple.com/us/review?id=1064216828&type=Purple%20Software,2018-05-19T21:27:44-07:00
2081923663,Woohooguy,https://itunes.apple.com/us/reviews/id142446784,4.1.0,4,"Please fix ""open in app imgur bug""","Pretty good app. It's mostly functional, but sometime during the last week for some reason trying to open imgur images in the imgur app no longer works. When you click on the open in app, while viewing the image in the reddit browser, instead of opening the app, it jumps to a page saying ""the official imgur app ...."" which describes it a little bit. Opening in a browser asks you to open the App Store as if I don't already have the app. And yes I know for certain I have the app. If I go to the App Store via the link and click open it works, but it's a hassle. Please fix this. It was so much more convenient to be able to go directly between the two apps. It was working just fine about a week ago.",https://itunes.apple.com/us/review?id=1064216828&type=Purple%20Software,2018-01-12T06:55:39-07:00
10242422983,nquinn02,https://itunes.apple.com/us/reviews/id918889314,2023.31.0,4,Just made a profile - not letting me comment,"I love everything about Reddit except for it thinking all new users and their comments are bots. It’s ridiculous that I’m unable to comment under someone’s post, especially in the dating realm of Reddit, because my profile is less than 3 days old. I think there needs to be a more accurate way of determining which profiles are real and which ones are bots. I just don’t get it… under all of the dating threads and bios, I haven’t been able to see an actual comment - all have been removed by Reddit for whatever reason. It’s just stupid imo. If they have issues with bots, then they need to develop a more efficient screening method to prevent them from overwhelming the app.",https://itunes.apple.com/us/review?id=1064216828&type=Purple%20Software,2023-08-10T11:11:44-07:00
10089591452,sarai o,https://itunes.apple.com/us/reviews/id459986420,2023.25.0,4,Privacy concerns,"I love the app but even when you select to not have Google cache everything thing you do or say. That discourages me from participating in conversations on here and caused me to delete my first account; where I didn’t know about the privacy setting. Even on my new account; stuff is still on Google. Now I am considering deleting this entire thing which still doesn’t help the main issue which is that Google is storing everything I say. Not cool ; especially when you’re in a parenting forum, family or relationships. You want to feel a sense of community within Reddit not exposed to the world. Yeah you can make a special user name and not tell personal details but I still don’t like that.",https://itunes.apple.com/us/review?id=1064216828&type=Purple%20Software,2023-06-30T11:26:59-07:00
9399196270,azuroll,https://itunes.apple.com/us/reviews/id1477808056,2022.45.0,2,Keeps getting worse,"The app keeps getting worse and worse. The home page now shows content outside of the subs you want to see. What is the point of joining a sub if my home page is not going to show what I joined a sub to see. What really made me make this review was the change of the browse button where you can see previously visited subs and subs you joined to the discover button. I don’t want to discover any more subs. This app is already a big time waster. Until recently, one of my accounts still had the button. However, I joined a sub going from 1 to 2 subs joined and a few days later, the discover button appeared again. I might just download another app at this rate since it seems they keep flip flopping between having the discover button and not and that goes for other features as well.",https://itunes.apple.com/us/review?id=1064216828&type=Purple%20Software,2022-12-15T08:31:32-07:00
