id,userName,userUrl,version,score,title,text,url,updated
9602739515,Fashiondetective,https://itunes.apple.com/us/reviews/id118718282,23.5.1,5,Beautiful dress!,Grazie mille. L'abito è bellisimo. Me fascina!  Raccomando questo venditore. This elegant dress is stunning. I love everything about. I highly recommend the seller. Thank you very much for selling me this beautiful dress.,https://itunes.apple.com/us/review?id=632064380&type=Purple%20Software,2023-02-10T04:49:47-07:00
9669460050,boat0619,https://itunes.apple.com/us/reviews/id383877517,23.8.3,1,Was better when shipping was cheaper.,"I used to be able to buy a tank top and shipping was a dollar. Now it’s like 3.99. Shipping for a sweater is like 6.99. I strictly used this app instead of Poshmark because their shipping prices are ridiculous, and now the prices are increasing. 

Update 2023: shipping for tank tops is now 6 bucks.",https://itunes.apple.com/us/review?id=632064380&type=Purple%20Software,2023-03-01T16:23:36-07:00
8959284569,sunchild74,https://itunes.apple.com/us/reviews/id1144914118,22.28.1,5,Better than pictured,I LOVE these glasses. I look so good in them! Much sturdier than expected. Fast shipping. Very happy with purchase,https://itunes.apple.com/us/review?id=632064380&type=Purple%20Software,2022-08-08T17:35:45-07:00
9175191902,RealSnazzyBanana,https://itunes.apple.com/us/reviews/id585882543,22.37.0,1,Worst selling app ever,"They blocked my account after posting a pair of shoes. They are authentic and I didn’t even get to sell them or talk to a buyer about it at all. They just deleted my account for no reason and claimed I was fraud. Horrible app. Use OfferUp, posh mark, eBay, or something else. Would give 0 stars if I could.",https://itunes.apple.com/us/review?id=632064380&type=Purple%20Software,2022-10-11T16:37:36-07:00
8689389372,Adry1116,https://itunes.apple.com/us/reviews/id266047273,22.17.1,5,Perfect!,"I am very happy with this purchase, the item was exactly as described & the seller is very sweet. I got a thank you card 🌻",https://itunes.apple.com/us/review?id=632064380&type=Purple%20Software,2022-05-20T03:32:08-07:00
8687837657,tnt atomic,https://itunes.apple.com/us/reviews/id132820540,22.17.1,5,Awesome,Thank you! This piece is so pretty. It arrived on time and just as described. She also added a little extra. The cutest green floral earrings.,https://itunes.apple.com/us/review?id=632064380&type=Purple%20Software,2022-05-19T14:45:00-07:00
8207789077,mental1997,https://itunes.apple.com/us/reviews/id609848298,21.43.1,5,Awesome,The seller was so amazing!!! My item was more beautiful in person!!! Thank you for such a positive shopping experience!!! :),https://itunes.apple.com/us/review?id=632064380&type=Purple%20Software,2022-01-05T10:01:02-07:00
10400268471,mary green 11,https://itunes.apple.com/us/reviews/id638008170,23.36.1,5,Easy to list!!!!,Quick listings and fast payments,https://itunes.apple.com/us/review?id=632064380&type=Purple%20Software,2023-09-23T16:48:14-07:00
10712210619,jamiefrank06,https://itunes.apple.com/us/reviews/id553477157,23.48.0,2,Mediocre at best,"I been selling on here 5 years and this site has gone downhill. Shipping fees are ridiculously high, traffic is sub par, the promotions we pay for are useless and support is all but non existent. I don't recommend wasting time posting on here.",https://itunes.apple.com/us/review?id=632064380&type=Purple%20Software,2023-12-18T07:32:16-07:00
9155134164,N Keys,https://itunes.apple.com/us/reviews/id857165283,22.36.0,5,"Super nice, great communication","Will definitely buy from her again. 
Thank you!",https://itunes.apple.com/us/review?id=632064380&type=Purple%20Software,2022-10-05T16:02:37-07:00
8738979710,Skydkysejiwt,https://itunes.apple.com/us/reviews/id392232350,22.19.2,5,Amazing,Loved my sunglasses! She shipped literally the next day and also threw in a little gift! Thank you so much it’s amazing !!,https://itunes.apple.com/us/review?id=632064380&type=Purple%20Software,2022-06-03T21:12:38-07:00
8317431452,ItsInsane,https://itunes.apple.com/us/reviews/id604441843,22.3.4,5,Sacoche,Everything went well,https://itunes.apple.com/us/review?id=632064380&type=Purple%20Software,2022-02-04T02:59:28-07:00
8009823378,firstmerch,https://itunes.apple.com/us/reviews/id545566106,21.36.0,5,Review,This seller is such a sweetheart. Very nice packing and a sweet card with gift. Super fast shipping. Would highly recommend. Thanks again,https://itunes.apple.com/us/review?id=632064380&type=Purple%20Software,2021-11-10T11:44:08-07:00
10636656799,Emo.Care,https://itunes.apple.com/us/reviews/id100968405,23.46.1,5,Smooth Transaction,"Great, fast transaction! Love the item I bought! Great quality and clean! Thanks",https://itunes.apple.com/us/review?id=632064380&type=Purple%20Software,2023-11-28T17:52:32-07:00
10597808073,Fr0ggy4U,https://itunes.apple.com/us/reviews/id375838906,23.44.1,5,Great experience,"The item was exactly as described and fast shipping.
I will be wearing the dress to my Daughter’s wedding, fits perfect!
Thank you so much!!",https://itunes.apple.com/us/review?id=632064380&type=Purple%20Software,2023-11-18T01:53:25-07:00
10423936567,hanary2006,https://itunes.apple.com/us/reviews/id738249608,23.37.0,5,Trapstar bag,I am really pleased with the bag😍 it was brand new nothing wrong with it and came really quick,https://itunes.apple.com/us/review?id=632064380&type=Purple%20Software,2023-09-30T09:54:39-07:00
9548654570,ganeshou,https://itunes.apple.com/us/reviews/id100582605,23.3.0,5,Fantastic,Thanks a lot I am extremely happy. & thank you for the little gift 🤍,https://itunes.apple.com/us/review?id=632064380&type=Purple%20Software,2023-01-26T02:21:09-07:00
8812543572,Prayana1,https://itunes.apple.com/us/reviews/id1109456128,22.22.0,5,Blouse purchase,Thank you so much for including a message of appreciation it was a fabulous touch,https://itunes.apple.com/us/review?id=632064380&type=Purple%20Software,2022-06-26T07:14:04-07:00
9538591916,RANK1N5309,https://itunes.apple.com/us/reviews/id508977207,23.2.0,1,0 Star,"Vinted keeps deleting my posts for the reason that it was a stock photo. I use another app to remove the background to look more professional. I was so tired posting, then in a few hours, it was deleted. I’m so done. Deleting this app. I don’t want to waste my time.",https://itunes.apple.com/us/review?id=632064380&type=Purple%20Software,2023-01-23T05:10:34-07:00
9371096029,Amy tepee,https://itunes.apple.com/us/reviews/id116957253,22.45.1,1,"App keeps changing to French, can’t get past signup because of this","After a quick google, it seems this is a problem that’s years old. Maybe fix it? Deleted as it was too much trouble to try and figure out on my end",https://itunes.apple.com/us/review?id=632064380&type=Purple%20Software,2022-12-07T09:54:08-07:00
8641759663,lisaobrien6,https://itunes.apple.com/us/reviews/id586432740,22.15.2,5,Fantastic Seller,Items came quickly and seller communicated well. Great bundle deal as well! Thank you!,https://itunes.apple.com/us/review?id=632064380&type=Purple%20Software,2022-05-05T21:43:22-07:00
10571989909,nathalie13,https://itunes.apple.com/us/reviews/id41450338,23.43.0,5,Perfecto,Thank you.    Seller was amazing.    Packaging was amazing and got a little love note as well.  Will deff buy again.   Love them,https://itunes.apple.com/us/review?id=632064380&type=Purple%20Software,2023-11-10T15:15:20-07:00
8564665112,Pax 6,https://itunes.apple.com/us/reviews/id115981740,22.12.1,1,Awful Customer Service and next to ZERO Traffic,"High volume seller here.  After being with Vinted for four years and selling about 2% of the volume I do on other platforms, I decided to leave this company for lack of volume and awful customer service.",https://itunes.apple.com/us/review?id=632064380&type=Purple%20Software,2022-04-13T18:39:46-07:00
8197685219,Sharko3000,https://itunes.apple.com/us/reviews/id373461275,21.42.1,3,not enough options,The clothes are nice but having only one option of payment is not smart,https://itunes.apple.com/us/review?id=632064380&type=Purple%20Software,2022-01-02T17:08:35-07:00
9786333317,Claudz21,https://itunes.apple.com/us/reviews/id281722748,23.13.1,5,Perfect!,Everything was perfect from the packaging to the jeans! Highly recommend this seller :),https://itunes.apple.com/us/review?id=632064380&type=Purple%20Software,2023-04-04T08:28:55-07:00
10155933552,uwu/uufy,https://itunes.apple.com/us/reviews/id564031831,23.27.0,4,Fantastic,As much as i love the app i wish i could sort my favorited items like a regular search.,https://itunes.apple.com/us/review?id=632064380&type=Purple%20Software,2023-07-18T18:41:45-07:00
10027277393,muffo87,https://itunes.apple.com/us/reviews/id49381694,23.23.0,1,Bad experience,"This is an over simplified purchase experience that doesn’t work. I was forced to use this app by a seller after finding the items in another website, but I didn’t find it user friendly at all.",https://itunes.apple.com/us/review?id=632064380&type=Purple%20Software,2023-06-12T14:23:14-07:00
9836281291,FlorenzaCampos,https://itunes.apple.com/us/reviews/id21606870,23.15.0,1,Worst app ever for sellers,"After being a seller for 8+ years I tried to sell my authentic vintage Louis purse and they BLOCKED my account, even though I sent all proof of authentication. No one was able to give me a real response. Do not try to sell anything of value here because they will block you. Outrageous.",https://itunes.apple.com/us/review?id=632064380&type=Purple%20Software,2023-04-18T15:04:49-07:00
9662783063,25309,https://itunes.apple.com/us/reviews/id158277764,23.8.0,5,Review,Great to do business with. Everything as described and fast shipping. Thanks again,https://itunes.apple.com/us/review?id=632064380&type=Purple%20Software,2023-02-27T17:29:12-07:00
8917970492,fizzypop4,https://itunes.apple.com/us/reviews/id438288191,22.27.0,5,Great hoodie,This is almost the exact same hoodie that I wore til it had holes all up the sleeves - so happy to have a nearly new one :),https://itunes.apple.com/us/review?id=632064380&type=Purple%20Software,2022-07-27T12:23:44-07:00
9498220081,shaayydiiyyy,https://itunes.apple.com/us/reviews/id962574517,23.1.0,1,Blocked me after a day of usage with no contact,This was my first time using this app and all I did was message a seller to purchase their item yet I got blocked for doing so. I’ve contacted Vinted and waited longer than 48 hours and still have not received any contact for help!,https://itunes.apple.com/us/review?id=632064380&type=Purple%20Software,2023-01-11T23:21:07-07:00
8878376908,MWalker0505,https://itunes.apple.com/us/reviews/id451696523,22.25.1,5,Wonderful service!!,Items shipped asap. Came wrapped beautifully and thoughtfully!,https://itunes.apple.com/us/review?id=632064380&type=Purple%20Software,2022-07-15T19:22:18-07:00
8830995817,skiecoalton,https://itunes.apple.com/us/reviews/id1271132638,22.23.1,5,Best service ever,This has been the easiest buy I ever made on the app thank you I love it so much,https://itunes.apple.com/us/review?id=632064380&type=Purple%20Software,2022-07-01T16:25:54-07:00
8578678851,Chesterfield Jules,https://itunes.apple.com/us/reviews/id195131110,22.12.1,5,Shirt,"It came fast, it was all that you posted ~ thank you!",https://itunes.apple.com/us/review?id=632064380&type=Purple%20Software,2022-04-17T16:27:00-07:00
8444608723,vjokokomo,https://itunes.apple.com/us/reviews/id1208160120,22.8.1,5,Outstanding,"Easy to work with, great communication and quick delivery!",https://itunes.apple.com/us/review?id=632064380&type=Purple%20Software,2022-03-11T10:41:16-07:00
10015787090,lj1art,https://itunes.apple.com/us/reviews/id20437992,23.22.0,5,A great buy. Attentive seller. Prompt dispatch. I am happy to recommend this seller.,A great buy. Attentive seller. Prompt dispatch. I am happy to recommend this seller.,https://itunes.apple.com/us/review?id=632064380&type=Purple%20Software,2023-06-09T07:45:13-07:00
7943107456,oops✨❤️❤️🧚‍♂️,https://itunes.apple.com/us/reviews/id1188118972,21.34.3,1,unable to get unblocked,"I was blocked for no reason, i bought a shirt and then was told that i needed to security check. I did this but i was later blocked for not approving my card? makes no sense. i tried contacting them but it just sends me a list of different instructions",https://itunes.apple.com/us/review?id=632064380&type=Purple%20Software,2021-10-22T15:50:56-07:00
10317851518,Snoopy 12345678,https://itunes.apple.com/us/reviews/id962751018,23.33.1,4,Loved the boots poor packaging,Could have been packaged better they needed to be in a box to protect them gave 4 stars because of packaging,https://itunes.apple.com/us/review?id=632064380&type=Purple%20Software,2023-08-30T21:03:58-07:00
9972327659,Kimattamoon,https://itunes.apple.com/us/reviews/id1417365852,23.20.0,5,Cute,She was so sweet and the clothes and packaging were so cute def buying from here again,https://itunes.apple.com/us/review?id=632064380&type=Purple%20Software,2023-05-27T17:32:55-07:00
9627405333,kim85kay,https://itunes.apple.com/us/reviews/id224912310,23.6.0,5,Great app,"Highly recommend, to sell and buy",https://itunes.apple.com/us/review?id=632064380&type=Purple%20Software,2023-02-17T09:58:44-07:00
9614344143,TNLibby,https://itunes.apple.com/us/reviews/id1093615702,23.6.0,5,Converse Jean Jacket and hat,"Thank you sooo much…
Very easy to work with responds quickly and ships fast.  
Items were in great condition.",https://itunes.apple.com/us/review?id=632064380&type=Purple%20Software,2023-02-13T10:06:01-07:00
8694219278,go great spps,https://itunes.apple.com/us/reviews/id1016950650,22.17.1,5,Excellent!!,"Seller was friendly, very quick to reply and shipped my package right away!",https://itunes.apple.com/us/review?id=632064380&type=Purple%20Software,2022-05-21T11:35:45-07:00
9310073742,Patrick Kilvut,https://itunes.apple.com/us/reviews/id658319249,22.42.1,1,Zero buyer protection,"If the seller lies blatantly about the condition of the item you buy, you will have to pay for the return shipping and the seller will not be penalized in any way for such malpractice. 

I even opened a PayPal dispute, and PayPal sided with Vinted, that’s all you need to know about one hand washing the other. Take care, this is borderline scam.",https://itunes.apple.com/us/review?id=632064380&type=Purple%20Software,2022-11-20T07:22:37-07:00
9230659922,Lylyam9,https://itunes.apple.com/us/reviews/id360342722,22.39.0,2,Not the best,"They have  a fee that seems optional at first but it’s not when you are a buyer. It supposed to protect the buyer but not really.
They are missing categories, too many items are put in other.",https://itunes.apple.com/us/review?id=632064380&type=Purple%20Software,2022-10-28T07:45:46-07:00
10683978703,Boba Bobby,https://itunes.apple.com/us/reviews/id967290808,23.48.0,5,Great Seller!,"gorgeous top! came in perfect condition, and the seller even included cute add ons (crystals and stickers!) very happy with my purchase!",https://itunes.apple.com/us/review?id=632064380&type=Purple%20Software,2023-12-11T17:47:00-07:00
8685385151,SeineRiver,https://itunes.apple.com/us/reviews/id153832778,22.17.1,1,Something wrong with the payment,I’ve been using the same card for months and 2 days ago it suddenly stopped working. Some generic error that blocks the payment. CS says they are investigating the issue but seeing no progress from my side,https://itunes.apple.com/us/review?id=632064380&type=Purple%20Software,2022-05-18T21:00:39-07:00
8188590918,im doing this for gems 0000,https://itunes.apple.com/us/reviews/id678414031,21.42.1,1,frustrating!!,"i was blocked for absolutely no reason, and my account was put under investigation for suspicious activity. when i tried contacted the link they gave me to try and get my account back, i was blocked from that as well. i’ve tried contacting their team, and it’s honestly been the most frustrating experience of my life. get better customer service if you actually care about your customers and service. never downloading or buying from again.",https://itunes.apple.com/us/review?id=632064380&type=Purple%20Software,2021-12-31T06:52:12-07:00
10663144497,Pomohedon,https://itunes.apple.com/us/reviews/id16260906,23.47.1,5,Nice Service!!,I absolutely love this sweater!!  And recommend this seller as she sent it so fast!  Thank you so much!  🎅🏼⛄️🌲❄️,https://itunes.apple.com/us/review?id=632064380&type=Purple%20Software,2023-12-06T04:21:37-07:00
10014561118,fe371,https://itunes.apple.com/us/reviews/id1297825179,23.22.0,2,Boo,The app is buggy but the real letdown was shipping prices literally almost doubling. That’s absurd as a buyer and as a seller I can’t expect to sell things to people if they have to pay more for shipping than the thing itself. I hate it!,https://itunes.apple.com/us/review?id=632064380&type=Purple%20Software,2023-06-08T23:37:31-07:00
10019771954,PesoPlumasLeftTestie,https://itunes.apple.com/us/reviews/id1531795865,23.22.0,1,Blocked my Account Because of an IPod,Sold a nano and my account got blocked because apparently I was “committing illegal activities”. It was a pure authentic Apple product and got blocked for no reason when there is millions of replica shoes in the website and they let that slide. Shame on y’all I’d rate this one star,https://itunes.apple.com/us/review?id=632064380&type=Purple%20Software,2023-06-10T10:12:32-07:00