id,userName,userUrl,version,score,title,text,url,updated
9459991991,MaeSimAn,https://itunes.apple.com/us/reviews/id37710511,3.539.10003,1,Save yourself the headache and frustration!,"Unless you’re in a major city in Europe (and I mean MAJOR, like London) or the USA, Uber’s quality is drastically different, and I mean that in the worst way possible. I waited over an hour while it supposedly searched for available drivers, and the ride was cancelled multiple times. Ended up taking a black cab which cost significantly more than Uber rates, but guess what, at least they were there! Just on that fact alone I was happy to give them my money since they actually deserve it. My ride was only 2.5 miles from the airport, no way you can’t find a driver FROM the airport and especially for a short distance. If you have other options besides Uber I’d take it, public transport especially in a major city will save you a ton of money and it’ll also literally take the same amount of time to arrive as it would for an Uber to drive you to your destination. Download CityMapper and you’ll see. Otherwise if public transport isn’t available see what other options are available and only do Uber as a last resort. My friend in Delhi waited over an hour and she had the same thing happen to her. There’s no repercussions for the drivers cancelling and wasting your time, so take the cab because at the very least they understand that giving rides means they get to feed their families.",https://itunes.apple.com/us/review?id=368677368&type=Purple%20Software,2023-01-01T13:43:13-07:00
8545929863,jimy93,https://itunes.apple.com/us/reviews/id38447573,3.504.10003,1,Not worth the risk!,"I had to make a flight at 6am out of JFK with an hour drive to get there plus the line through security I figured it was best to set up for a ride several days ahead of time so that I don’t risk there not being any drivers around at 4am. I get notifications the day before about my ride coming up but when the morning came the ride disappeared from my account, no cancellation or email as I’ve had in the past, just an empty screen. I scrambled to find a driver at the last minute who thankfully was in just as big of a rush as I was but good lord was their car a mess! 

The car that picked me up is not something I would have trusted to get me to the airport if I had been driving myself with countless lights on the dash and more mechanical noises and shakes than it should have to pass inspection. Sadly this isn’t the only time I’ve had this issue, I had another driver pick me up in a “2016” Nissan that was a 2006 (plates and driver description matched) with similar problems. If it weren’t for the fact that no other drivers were around and I missed the train to yet another flight I wouldn’t have taken the ride at all. 

I’ve had some decent experiences with Uber but they need to do a better job at checking out the vehicles people are using and notifying customers when they cancel your ride for no reason at all",https://itunes.apple.com/us/review?id=368677368&type=Purple%20Software,2022-04-08T11:31:00-07:00
5693254095,Wren421,https://itunes.apple.com/us/reviews/id241079025,3.396.10000,3,Not ADA friendly,"This app is probably fine for most people, but it is horrible for low vision users who prefer not to be conspicuos by using voiceover in public.  Zero accessibility features and  miniscule font even when iPhone’s large font function is employed.  Ironic given how many blind and low vision people don’t drive and would be potential regular users of the service.  To be fair, Lyft’s app is only marginally better in this regard.

Update:  the app developer sent me a message asking for specific suggestions.  Like i said, build in a way to increase font size or have the app make use of the iPhone already-existing large font features.  Another idea is to not assume “accessibility” only means people on wheelchairs or who use guide dogs.  How much would it help customers  AND drivers if “rider is low-vision” or “rider is deaf”could be voluntarily added to the profile?   Understand that very few “blind” people are completely blind just as very few deaf people are 100% deaf, so many of us prefer to use tech as naturally and inconspicuously as possible.  

Thing is, it is not just a low -vision problem.   When i complained to my spouse and a couple of friends —alll of whom have eyesight in the normal range, they all said they found this app’s font hard to read.",https://itunes.apple.com/us/review?id=368677368&type=Purple%20Software,2020-03-21T12:41:50-07:00
5494822510,Shenzaii,https://itunes.apple.com/us/reviews/id101513658,3.390.10003,3,"Good app, not so good drivers and support","Gonna be honest, I’m lazy as heck. If taking an Uber lets me stay in bed til the last possible moment, I take one. That being said, I’m on first name basis with nearly all the drivers in my area. However, there are some bad apples out there. My main dislike is when drivers don’t end the trip. I work at an airport, and I’ve had drivers take me home and go all the way back without ending the ride until they get there. This results in a ~$25 trip costing $50+. Of course, this makes me have to go open a help ticket with support. (They made this harder to do it seems). Another trick of some drivers is to get close enough to start the ride, then if they don’t like it, they’ll either cancel it, or drive away somewhere far enough where I’ll have to cancel it. On my dollar. What’s more, if the support team see you have a ‘pattern’ of requesting a refund, they can deny you one. Even if it’s clear it’s an error on part of the driver. 
I feel like the driver’s app should have a fail safe built in. If they make it to the drop off location, and leave farther than a certain distance, the trip should automatically end. God forbid I’m busy when I make it home or to work and can’t check if the driver still has the trip up. Sheesh",https://itunes.apple.com/us/review?id=368677368&type=Purple%20Software,2020-02-06T03:24:56-07:00
5387033136,carvic124,https://itunes.apple.com/us/reviews/id114473032,3.382.10006,1,Payment Issues & Lack of Support,I used to love Uber & lately I’ve never had so many issues. It won’t let me add my debit card & id contacted support and it took over 5 days for any assistance & still haven’t been able to add it. They did things to my account that I had never asked like refunding the money I put on my account. I’ve had holds placed on my card that their refunds don’t process quickly. Each time I asked for customer support a new person would contact me back with repeated information that had nothing to do with my issues. I purchased a gift card  while being abroad in the country I’m using the app in & I go to enter the gift card and it says it can’t be used in this country. I’ve never struggled so much with Uber and it’s the main form of transportation where I am currently at... so you can sense how important it is & I was never taken serious by customer support. They tried to deny me a refund of the gift card I purchased until I went a different route with gift card support. It’s all so frustrating. I’m still having issues & it almost seems that I’ve been locked out of using any sort of financial on my account. I would delete my account and start a new one but there would probably be issues there too. I truly dislike how dependent I have to be on Uber when it’s not taken seriously by their own support team with assistance.,https://itunes.apple.com/us/review?id=368677368&type=Purple%20Software,2020-01-10T15:07:47-07:00
3592152644,Lildreamer2003,https://itunes.apple.com/us/reviews/id852429953,3.329.10002,5,I have a ❤️ hate relationship with Uber,"I use this service at least once a day. Over the last couple days though I’ve had horrible drivers that I’ve had to contact Uber about. I give them credit though bc when I write them they get back immediately and they at least try to rectify the issue. With a small credit or something. What I dislike is that a driver will accept ur ride but then take 5-10 mins to leave their house. Other times they are on the road and arrive in a timely manner. I had one driver refuse to let me stop at a fast food restaurant. I had another that missed the turn and ended up costing me an extra $7 for a trip I take frequently. And actually the day that happened I sent my friend a text sharing my location because we were lost, he ended the trip, and I had no clue where we were. I feared the worse. Anyway that’s my rant. I still ❤️ Uber and will continue to use them. The great thing is that if you rate a driver poorly, Uber won’t match u with them again. The bad part is, u have to add all stops BEFORE ur trip. It’s not like Lyft where u can add a stop while ur already in the car.",https://itunes.apple.com/us/review?id=368677368&type=Purple%20Software,2018-12-30T08:14:07-07:00
5068437846,fei6292,https://itunes.apple.com/us/reviews/id339151565,3.375.10000,1,Awful first time experience; felt TERRIBLY unsafe,"My driver came to pick up me and 1 other girl up but when he arrived he did tell me my name. When I asked him to provide a name he didn’t tell us and when my friend looked to his phone his car smelled like cigarettes and he told us, “you’re cheating you can’t do that” and got back into his car and and left us. Before he left he stopped a few feet in front of us and threw out a box of cigarettes and drove away. He then told us to cancel the trip. He refused to cancel the trip on his end. When I messaged him back saying I don’t know how to cancel the trip he said “you figure it out”. We could not use the uber app unless we cancelled the trip so we paid the cancellation fee. We tried to locate another uber and the same driver accepted our request. Out of fear we paid the cancellation fee again because we did not feel safe with him. After we tried to request another uber, my account was disabled. I tried to verify my account but because this is my first time taking an uber I cannot describe two recent uber trips (which was required on the website). I have the information of the driver and his car type + license plate and conversation history but because we were forced to cancel the trip on our end there is no rider history. I do NOT recommend this app to anyone unless they want to be harassed like we were.",https://itunes.apple.com/us/review?id=368677368&type=Purple%20Software,2019-11-02T00:43:50-07:00
3645926777,lakelake2,https://itunes.apple.com/us/reviews/id963543084,3.332.10005,1,First Time User,We arrived in Fort Lauderdale on a evening flight and after picking up our bags submitted our request for UBER.  I put in the address of 555 NW 62 St Fort Lauderdale as that was the of the Hotel we had reservations (Sheraton Suites Fort Lauderdale) I got a message saying I needed to move to the ride sharing area at the airport.  Saturday night at this airport was extremely hectic with dozens and dozens trying to use UBER. During this time my back back with laptop and many other valuables was stolen.  A witness reported he seen the guy take it and re-enter the airport.  I went in and reported my loss to airport security.  Returning I got a message that my ride had expired and would have to resubmit request.  I did and another Uber driver was on his was.   I asked him if he had the address 555 NW 62nd St and he said he did.  I then said that it was a Sheraton Hotel and was not far away.  He said ok.  After a few minutes we asked again although his English was pretty much non existent he said yes 555.  Shortly we found out we were on our way to Miami.  He then let us out at Wendy’s way south of Fort Lauderdale and said I would have to “request a new driver sorry”. So then we got another Uber that delivered us to the right address.  If the driver spoke English the situation would have been resolved earlier.  Our first experience with Uber was not a good one costing us over $60 to go just a few miles.,https://itunes.apple.com/us/review?id=368677368&type=Purple%20Software,2019-01-13T07:55:55-07:00
3627758542,jasmine morrow,https://itunes.apple.com/us/reviews/id181776244,3.332.10004,1,Unsatisfied Customer,"Although this is a billion dollar company that still doesn't make it rite to treat your customers as if they don't matter. Today I had the worst experience w/ uber & i've been riding w/ the company since it started! I had a driver leave me as well as hang up on me due to miscommunication. I was on a uber pool ride, I understand that there are pick up locations. I was walking towards my pick up location while on the phone w/ the uber driver (Jesus), he hung up on me & cancelled my ride. I requested an uber for the second time & he was the driver again. I called an abundance of times which I have the records of my call history to prove that,  he stopped answering for me. I called again & he answered stating that he was parked 2 blocks over at the ""pickup location"". I asked if we could stay on the phone so that I can meet him; w/ frustration in his voice he agreed. I walked in the area he stated that he was in, he was not there. I told him a landmark of mine & he drove over immediately! In less than 1 minute! The moral is, I was charged a cancellation fee along w/ cancelling & I never cancelled my ride. I would like my money back as well as would like to report this driver. I was traveling w/ minimal funds, it'll be nice for uber to have an ""oops we charged you"" here's a free corteous ride due to UBER mistake! I had no $ to get another uber & used my last on a ride I never took!",https://itunes.apple.com/us/review?id=368677368&type=Purple%20Software,2019-01-08T13:58:31-07:00
3222064427,qbrown620,https://itunes.apple.com/us/reviews/id623192359,3.317.10003,1,App is working poorly,"Uber was working great for me but as of the last week or so, it has been terrible. I keep trying to request a ride and then a driver is found for me but the driver never comes. I had to cancel like 3 rides, two I was charged for. I literally can’t request a ride with Uber anymore. I’m not sure what’s going on with this app but something needs to be fixed. I use to love Uber, I use them very often for work and personal. I got a credit for my fees I was charged for a cancelled ride and was issued a credit. BUT I STILL CANNOT USE THE APP AND REQUEST A RIDE TO EVEN USE THE CREDIT. He navigation is always off. Drivers asking me where to go, or the navigation just goes way out of the way making a 15 minute trip into a 30 min. It’s ridiculous. I really want to continue using Uber but I can’t keep getting cancellation charges for something that is Uber’s fault. I requested an Uber and it showed that the driver was on the way. It said he was literally a minute away. I called the driver 3 times and I got no response so I cancelled the ride. And I got charged. Same thing happened twice. I’m very disappointed. I hope Uber can make it worth the customers while to persuade them to stay. Because the competitors are looking good right now. They are a tab bit more expensive but at least the competitor is reliable. That is more than I can say for Uber as of late.",https://itunes.apple.com/us/review?id=368677368&type=Purple%20Software,2018-09-23T10:04:37-07:00
3088169836,eappleme,https://itunes.apple.com/us/reviews/id160639340,3.312.10000,1,Don’t Try To Contact Customer Service,"I have been using Uber for years. The drivers are (usually) great and the pricing is (usually) fair. In all the years I have used Uber, I have never once been satisfied with my interactions with Customer Service. They don’t read the support messages sent and just respond with a form letter that they generate based on the first few words of your message, or just which option you initially select for the support topic. I have sent detailed messages, even going so far as to bullet point the issues I have had or the troubleshooting steps I have taken, and I get the same message each time: Did you try updating the app? Did you try logging out and back in? Sorry, we can’t help you with that.

I am trying to purchase a ride pass for the third month in a row and every time I go through the link in the app it tells me I need the app to complete the purchase. I try clicking the link in my email. I need the app to complete the purchase. I contact support. I need the app to complete the purchase. I am incredibly frustrated with the lack of care shown by customer support. My issue is not with the app or  the company I guess.

I read through the list of reviews after mine and they all were responded to by a “let’s make sure we connect message and one contact medium” so they obviously don’t care about customer service.",https://itunes.apple.com/us/review?id=368677368&type=Purple%20Software,2018-08-19T16:58:40-07:00
7259052366,robert_smithy,https://itunes.apple.com/us/reviews/id100414416,3.454.10001,1,Cannot cancel without fee even if 20+ minutes away,"Recently because of the pandemic there’s far less drivers, so often enough there are none available and that’s understandable; but when there is, even if they’re over 20 minutes away, you can’t cancel without a fee. This has happened multiple times: I have a place to get to by a certain time, their app tells me a driver is 8 minutes away (great!) so I confirm, then it suddenly tells me my driver is 25 minutes away (this specific instance happened today). Now I’ll be late, so I have to cancel and take the train which is fine - but in those 2 minutes of using the app, they’ve now taken my money and provided absolutely zero service. Considering the inaccurate time given, and then the inability to change my mind without it costing me when I find out the service offered is very far from the initial expectations given to me by the company, this fits the basic definition of a scam and you’ve officially lost my business until this company either entices more drivers or finds out a way not to nickle-and-dime their customers. You destroyed the taxi business because you had a ‘better product’, but if you expect me to support you because your business model is struggling and drivers don’t want to return, I’m sorry but that’s just plain stupid.",https://itunes.apple.com/us/review?id=368677368&type=Purple%20Software,2021-04-24T08:38:02-07:00
7173645451,Seriously nicknames????,https://itunes.apple.com/us/reviews/id173292300,3.450.10002,1,I’m not sure if it’s an update issue or uber is just trying to take more money from people,There’s been two strikes for uber in less than a week already. 1. I used uber eats to order food and the food was extremely late with no updates as to what was happening. I contacted support and they said they were experiencing difficulties finding drivers near by and if I would wait a while longer instead of getting a refund they would give $3.50 to my account. I agreed to this. My account was credited $3.50 and my food arrived an hour late past the maximum wait time. Right after my food arrived uber debited the $3.50 from my account....excuse me? Really? So I was like whatever I’ll just drop it. Today while ordering an Uber the driver accepted the ride and then 4 mins into coming to my location to pick me up cancelled it...yet uber charged me a cancellation fee when I wasn’t even the one to cancel it the driver did! Why should I pay a cancellation fee to the driver when the driver canceled the ride before even getting to me? This is ridiculous. I received my money back to my uber account but at this point I want it back to my credit card because uber clearly can’t be trusted to not just try to take the money back. I’m not sure if anyone else is experiencing similar issues. I’ve used uber for years and it’s only recently become untrustworthy and an issue for me.,https://itunes.apple.com/us/review?id=368677368&type=Purple%20Software,2021-04-01T23:29:53-07:00
10038021097,JohnMWood,https://itunes.apple.com/us/reviews/id23105658,3.566.10000,1,Uber is consistently getting worse,"Uber service seems to get worse by the day. I’ve finally hit my breaking point and have to voice this where a decision maker at the company might eventually hear. I have to request a ride with at least 30m of EXTRA cushion (above the average drive time) before I need to be somewhere as the matching process now takes at least 10m. Then you have to factor in the fact that at least two drivers cancel your pickup. Then another 10m match comes… until they just give up matching you. Lyft doesn’t have this problem - why does Uber? Immediately before writing this review three drivers cancelled my accepted ride, then Uber said there are “not enough drivers in the area, try again later.”

This is San Francisco - a tier 1 city where the company is even headquartered. I’m not complaining about this and being in some small city with no drivers.

To whoever is making decisions at Uber - you need to up the penalty for your drivers cancelling an accepted ride. They knew the fare beforehand. You can’t provide this inconsistent level of quality when it comes to transportation or people (like me) will drop your service. I’m officially now using Uber as my last resort (used to be first) for getting a ride. Seriously this service is only about an inch above taking the bus at this point.",https://itunes.apple.com/us/review?id=368677368&type=Purple%20Software,2023-06-15T17:49:33-07:00
7936425324,Domivvp,https://itunes.apple.com/us/reviews/id526906921,3.480.10004,1,Switching to Lyft :),"I used to use Uber, but after being charged $11 extra for a NJ toll which wasn’t in the predicted route I am now switching to Lyft. What was initially the predicted fee of 22$ became $33 simply because the driver took their own route, passed a toll booth that at most would’ve charged $2. I tried reaching customer service to explain my situation but was in a dead end and could not reach a representative. However, I tweeted about it and Uber support reached out within 5minutes. The fact that a representative had to reach out to me VIA Twitter instead of the Uber app speaks for itself. Uber should update their system. I was told that the upfront price was the same that they charged me which was not, I had the screenshot of the email where it stated that they updated the pricing last minute, and the screenshot of the bank statement as proof of the $22 hold instead of $33. They rather charge the customer extra than to advise their own drivers not to take their own route because it affects their ratings, tips, + customer experience. I am switching to Lyft, at least they have representatives that are a chat away. I was advised by many friends to switch a long time ago because Lyft was CHEAPER too. Can’t wait to join the Lyft community, I will be sharing this experience with my friends and family as well. Thanks Uber 🙏",https://itunes.apple.com/us/review?id=368677368&type=Purple%20Software,2021-10-20T18:27:55-07:00
2492065783,JL64,https://itunes.apple.com/us/reviews/id43973735,3.296.10001,1,Hacked after a week,"I’ve had Uber exactly one week and received an email and text stating my acct settings (phone number and emails have changed and if I did not do this to go to the link provided. I have been emailing back and forth now for the better part or four hours. First they wanted name, phone number, and some recent trips I took. I sent those. Then they wanted me to reply to an email and write in my email address to prove it was me. Did that. Another email came requesting I send more info on the trips I took. Sent that. Then I get an email requesting a screenshot of my own phone number in my contacts list. Done. Waiting for the next email requesting additional info...all the while my acct is possibly hacked and could be used by someone if that is the case. TERRIBLE CUSTOMER SUPPORT at this point!  Going on Day2. They managed to finally reset my account and allow me to login in to the website but the app still does not work. When I open it, it goes directly to a sign-up screen for new customers. It does not allow me to login with existing credentials. Even if I try to use them, it tells me they are already in use. I’ve deleted and reinstalled the app twice and still have the same issue. I do have options...I can use one of the other services out there, but I really did like Uber the few times that I used it....so please get this app fixed!!",https://itunes.apple.com/us/review?id=368677368&type=Purple%20Software,2018-05-01T06:39:42-07:00
