id,userName,userUrl,version,score,title,text,url,updated
10933343939,петров артем,https://itunes.apple.com/us/reviews/id1553768325,10.7.1,4,заебали,исправьте сука баги с кружочками,https://itunes.apple.com/us/review?id=686449807&type=Purple%20Software,2024-02-12T23:45:21-07:00
10933216562,nznxjdj,https://itunes.apple.com/us/reviews/id1073309179,10.7.1,1,FREEZING,My screen freezes every time i click on a chat,https://itunes.apple.com/us/review?id=686449807&type=Purple%20Software,2024-02-12T22:45:21-07:00
10932659050,不做韭菜头,https://itunes.apple.com/us/reviews/id1282257618,10.7.1,5,开发者你好,请问怎么下载中文版,https://itunes.apple.com/us/review?id=686449807&type=Purple%20Software,2024-02-12T18:30:40-07:00
10932493969,notkananimrf,https://itunes.apple.com/us/reviews/id1574642421,10.7.1,1,ПАМАГИТЕ МНЕ,ТГ СОВСЕМ НЕ ЗАГРУЖАЕТ ПАМЯТИ ДОСТАТОЧНО ИНТЕРНЕТ ОТЛИЧНЫЙ В ЧЕМ ПРОБЛЕМА ? Я УЖЕ ЖДУ ЦЕЛЫЙ ЧАС И НЕ ЗАГРУЗИЛОСЬ ДАЖЕ ПРОСТО ОЖИДАНИЕ ХЕЛП ХЕЛП,https://itunes.apple.com/us/review?id=686449807&type=Purple%20Software,2024-02-12T17:20:19-07:00
10932234838,TSL8R,https://itunes.apple.com/us/reviews/id1575282960,10.7.1,3,Different experience,"I had an android for a long time using telegram then i changed to an iphone. Being straight forward, without a care of judgement because majority of users use it for the same purpose, but there are restrictions on my iphone keeping me from viewing X-rated content yet if i pull it up on my android (i luckily decided to keep) i can view the content… ? Ive looked all over the settings to see if i can change this but it just says i am not allowed to view it on my device. Is there a way yo remove this censorship on my iphone or is this another way apple has control of my usage?",https://itunes.apple.com/us/review?id=686449807&type=Purple%20Software,2024-02-12T15:22:36-07:00
10931432863,Lord Arya 2001,https://itunes.apple.com/us/reviews/id1131542068,10.7.1,5,Beeeeeeeeeest,"i like it so much, makes my life easier...",https://itunes.apple.com/us/review?id=686449807&type=Purple%20Software,2024-02-12T09:44:40-07:00
10929266755,Sara khedri,https://itunes.apple.com/us/reviews/id1204486127,10.7.1,4,Sara,Khedri,https://itunes.apple.com/us/review?id=686449807&type=Purple%20Software,2024-02-11T19:18:04-07:00
10927752591,aidakhalaj80,https://itunes.apple.com/us/reviews/id663833178,10.7.1,5,Problem,I deleted my telegram and then download it but I can’t login:)) I don’t have my telegram in another device and it doesn’t send sms for me! What should I do?,https://itunes.apple.com/us/review?id=686449807&type=Purple%20Software,2024-02-11T09:09:52-07:00
10927534858,Nurmuhammad Nabi,https://itunes.apple.com/us/reviews/id1623830532,10.7.1,4,Creating a profile,It would be great if there'll be a chance to create an account using an email address as well,https://itunes.apple.com/us/review?id=686449807&type=Purple%20Software,2024-02-11T08:02:21-07:00
10927451146,MikeT9410,https://itunes.apple.com/us/reviews/id8967655,10.7.1,3,App does not function when iPhone is in Lockdown Mode,"Telegram does not function when iPhone is in lockdown mode.  When I receive a message and try to open it from the notification center, telegram opens but remains completely black.  If I open the app first, and then try to open any conversation, the app freezes and does not respond, causing me to force close it.",https://itunes.apple.com/us/review?id=686449807&type=Purple%20Software,2024-02-11T07:36:58-07:00
10927114322,Missi0706,https://itunes.apple.com/us/reviews/id1491691509,10.7.1,2,Arreglen el Telegram,"No sé qué le hicieron al Telegram pero desde las últimas actualizaciones me va súper mal, cada vez que lo uso el celular se me calienta que parece que va a explotar y me chupa la batería , la carga se me va en media hora, arréglenlo por favor :/",https://itunes.apple.com/us/review?id=686449807&type=Purple%20Software,2024-02-11T05:54:34-07:00
10927102546,пнмнрм,https://itunes.apple.com/us/reviews/id1363907863,10.7.1,2,Разблокируйте номер телефона,Здравствуйте разблокируйте пожалуйста номер телефона Telegram меня заблокировал мой номер телефона просто так я уже сообщение по разблокировке телефона отправляю больше месяца разблокируйте пожалуйста мой номер телефона я ничего такого плохого не делал в телеграмме  номер телефона 8 (905)-529-52-94,https://itunes.apple.com/us/review?id=686449807&type=Purple%20Software,2024-02-11T05:50:53-07:00
10926336363,mhebrahimi,https://itunes.apple.com/us/reviews/id674050102,10.7.1,5,excellent,"The program is really great, but my problem is that the cache memory is not fully removed and the phone memory is occupied over time",https://itunes.apple.com/us/review?id=686449807&type=Purple%20Software,2024-02-11T01:03:24-07:00
10926279639,Darryl9718,https://itunes.apple.com/us/reviews/id398792348,10.7.1,1,Unresponsive,I can’t open any of my chats. When I try to open up my chat. the app freezes. I have to close out the app and reopen it.,https://itunes.apple.com/us/review?id=686449807&type=Purple%20Software,2024-02-11T00:39:30-07:00
10926024355,karzuniii,https://itunes.apple.com/us/reviews/id1170713321,10.7.1,1,ГДЕ ЗВУК БЛЯТЬ,"сука где звук на кружках, разрабы уебаны",https://itunes.apple.com/us/review?id=686449807&type=Purple%20Software,2024-02-10T22:46:57-07:00
10925301210,Ranimay99,https://itunes.apple.com/us/reviews/id546451209,10.7.1,3,"Great sometimes, disaster at other times.","No notifications coming to me since update!! 
Also if you wish to remain anonymous, it’s probably best that you don’t send notifications about someone in your contacts joining telegram.. they’re obviously going to recognize you if you have a pic up. Or maybe by your name since it will literally tell you their contact name has joined, I’m assuming they probably get a similar notification and could lurk on your account to see what pics and bio you have up or whatever. Should not connect to contacts in any way if I don’t want you to. Please fix notifications though, this is the main issue and very annoying. Will be going elsewhere until it’s fixed. And yes, all my settings are fine.",https://itunes.apple.com/us/review?id=686449807&type=Purple%20Software,2024-02-10T17:29:45-07:00
10925163118,megaperdunishka,https://itunes.apple.com/us/reviews/id1619682001,10.7.1,1,sound,fix the sound on video massages 💥,https://itunes.apple.com/us/review?id=686449807&type=Purple%20Software,2024-02-10T16:30:33-07:00
10924900090,unknown Hasbeen that never was,https://itunes.apple.com/us/reviews/id1478939952,10.7.1,1,I’m been scammed,Someone saying they are LeAnn Rimes has scammed me on this app,https://itunes.apple.com/us/review?id=686449807&type=Purple%20Software,2024-02-10T14:34:32-07:00
10924693379,TempUser4444,https://itunes.apple.com/us/reviews/id153453260,10.7.1,3,Message does not exist!!,"Someone please tell me how to fix this problem.   When I search for a topic and then click on one of the returned results, a message pops up that says “Message does not exist”.  I have tried everything I can think of to fix this, including the YouTube remedies.   Please help.   Thanks.",https://itunes.apple.com/us/review?id=686449807&type=Purple%20Software,2024-02-10T13:07:42-07:00
10923586145,LeraBaranova,https://itunes.apple.com/us/reviews/id1225533284,10.7.1,4,😔,"Паш, ну вот что произошло? Почему когда я отправила кружок, он превратился в квадратик без звука. Уже не первый раз с этим сталкиваюсь, почемууу?",https://itunes.apple.com/us/review?id=686449807&type=Purple%20Software,2024-02-10T06:55:22-07:00
10921806586,fonewiz,https://itunes.apple.com/us/reviews/id37418978,10.7.1,3,Zero notifications,I have notifications on in Telegram settings and in IOS but they never work. If there’s no notifications the this app is useless to me. Works fine in MacOS version just not in iPhone. Worked fine in previous versions of app.,https://itunes.apple.com/us/review?id=686449807&type=Purple%20Software,2024-02-09T19:21:08-07:00
10921467723,Biggy shoes,https://itunes.apple.com/us/reviews/id296440054,10.7.1,1,Unknown ban,"My number was banned and I did nothing wrong! I have tried all contact information to get it unbanned but no luck, any one have suggestions",https://itunes.apple.com/us/review?id=686449807&type=Purple%20Software,2024-02-09T17:01:36-07:00
10920339166,Pat412010,https://itunes.apple.com/us/reviews/id1623140535,10.7.1,1,App is Unresponsive,"I’ve used Telegram for years, but recent bugs make it unusable for me. I can’t open any existing chats or start any new ones.",https://itunes.apple.com/us/review?id=686449807&type=Purple%20Software,2024-02-09T09:24:33-07:00
10919653406,Russia 482842,https://itunes.apple.com/us/reviews/id466253767,10.7.1,2,Проблема последнего обновления,"Telegram для нас всех был всегда самым быстрым и безопасным мессенджером. Но с последним обновлением с января 2024 года впервые мы массово столкнулись с проблемами 
(iPhone 13)
1) кружочки через раз записываются без звука
2) Telegram стал сильно подвисать
3) отображение превью при поиске GIF переодически работает не корректно
4) кружочки обрываются и не воспроисзвоятся до конца
5) в кружочке звук отстает или опережает картинку",https://itunes.apple.com/us/review?id=686449807&type=Purple%20Software,2024-02-09T05:52:52-07:00
10919536722,Mdrfuhjklftcnf,https://itunes.apple.com/us/reviews/id1509830394,10.7.1,3,Voice,"Dear telegram, Every thin g is good except voice messages. I can't send voice messages(I gave permission for voice but it doesn't work)",https://itunes.apple.com/us/review?id=686449807&type=Purple%20Software,2024-02-09T05:15:52-07:00
10919094505,MajicJones37,https://itunes.apple.com/us/reviews/id1545215864,10.7.1,1,Need to erase account,Help,https://itunes.apple.com/us/review?id=686449807&type=Purple%20Software,2024-02-09T02:37:40-07:00
10917929629,Azamchik,https://itunes.apple.com/us/reviews/id365401847,10.7.1,1,TURN OFF STORIES,"PLEASE GIVE ME AN OPTION TO TURN OFF ALL STORIES. So annoying I swear, this is the reason I don’t use Instagram",https://itunes.apple.com/us/review?id=686449807&type=Purple%20Software,2024-02-08T18:03:16-07:00
10916508469,Jeks sk,https://itunes.apple.com/us/reviews/id339432905,10.7.1,1,Not working at all?,Not working at all?,https://itunes.apple.com/us/review?id=686449807&type=Purple%20Software,2024-02-08T08:28:10-07:00
10916181576,眉山居士,https://itunes.apple.com/us/reviews/id1538062999,10.7.1,3,苹果12无法进入到消息页面,一点击消息就卡死,https://itunes.apple.com/us/review?id=686449807&type=Purple%20Software,2024-02-08T06:44:05-07:00
10916133577,Майнкрафтер228хд,https://itunes.apple.com/us/reviews/id1318259443,10.7.1,1,Обновление,"После обновления куча проблем, самое главное - глючит музыка при входе в приложение",https://itunes.apple.com/us/review?id=686449807&type=Purple%20Software,2024-02-08T06:29:08-07:00
10915860500,Nobody Impotant,https://itunes.apple.com/us/reviews/id109058026,10.7.1,1,Deleting,App only freezes now whenever I try to use it. Worthless. Done all the updates and still only freezes,https://itunes.apple.com/us/review?id=686449807&type=Purple%20Software,2024-02-08T05:02:22-07:00
10915583154,ахыььылв,https://itunes.apple.com/us/reviews/id1614359112,10.7.1,1,г,с каждым обновлением все хуже и хуже👎,https://itunes.apple.com/us/review?id=686449807&type=Purple%20Software,2024-02-08T03:26:18-07:00
10915063471,Angelata Negron,https://itunes.apple.com/us/reviews/id1097332772,10.7.1,3,Is good,The app is very good but I would like an update where I can log in with my email account.,https://itunes.apple.com/us/review?id=686449807&type=Purple%20Software,2024-02-07T23:43:07-07:00
10914920751,Fdysbich,https://itunes.apple.com/us/reviews/id1477760912,10.7.1,5,Problem,There is a problem in the voice notification for contact messages that is not notified,https://itunes.apple.com/us/review?id=686449807&type=Purple%20Software,2024-02-07T22:38:45-07:00
10914773795,Pa1inas,https://itunes.apple.com/us/reviews/id1622589099,10.7.1,2,"«Отличное» обновление, всем спасибо",С каких пор после обновления в кружочках нет звука?,https://itunes.apple.com/us/review?id=686449807&type=Purple%20Software,2024-02-07T21:31:18-07:00
10914640787,快手顶尖傩囍,https://itunes.apple.com/us/reviews/id1622575832,10.7.1,5,F y,懂的都懂,https://itunes.apple.com/us/review?id=686449807&type=Purple%20Software,2024-02-07T20:30:11-07:00
10913100674,sheikh221093,https://itunes.apple.com/us/reviews/id1391188745,10.7.1,1,Scam app!,"They will ban anybody without a reason, unless you pay them 36 dollars to subscribe to premium! 

How about you charge channels & groups that makes money off of people? No? Just make sure everyone pays? 

Nope! 

This greedy app executives have turned greedy. Sooner or later people will bring a replacement & dump this sorry excuse for a chat app!

Scam! Absolute scam app.",https://itunes.apple.com/us/review?id=686449807&type=Purple%20Software,2024-02-07T10:04:07-07:00
10912374354,Kirito_k05,https://itunes.apple.com/us/reviews/id1361070578,10.7.1,5,Идеально 👌🏻,Есть всё но хочется телеграмм премиум остальное всё идеально,https://itunes.apple.com/us/review?id=686449807&type=Purple%20Software,2024-02-07T06:14:06-07:00
10910942937,Sugar-smacks,https://itunes.apple.com/us/reviews/id1582818297,10.7.1,3,Less than satisfying,Seemed to be a great app but lately it’s been inconvenient and messages don’t send. Needs major updating. I’ve installed and reinstalled but the issue still persists.,https://itunes.apple.com/us/review?id=686449807&type=Purple%20Software,2024-02-06T20:59:36-07:00
10910444784,Dtfufrgg,https://itunes.apple.com/us/reviews/id109566248,10.7.1,4,Update broke search,"Update is great overall but now you can no longer skip to certain search results. Ie: I search for something in a group, there’s 400 results, I used to be able to show as list and skip to the oldest result, then using the down arrow to skip to the next oldest result. This no longer works, when I skip to the oldest result and hit the down arrow, it goes all the way back to the newest result. Please fix, this is very useful for some groups.",https://itunes.apple.com/us/review?id=686449807&type=Purple%20Software,2024-02-06T17:34:26-07:00
10910423998,@napoima,https://itunes.apple.com/us/reviews/id913140626,10.7.1,4,Marycolombo,Mosqueracity1953,https://itunes.apple.com/us/review?id=686449807&type=Purple%20Software,2024-02-06T17:26:13-07:00
10910231228,T805x,https://itunes.apple.com/us/reviews/id701738639,10.7.1,1,Ridiculous,I got banned from the app for no reason. I’m so confused and annoyed lol,https://itunes.apple.com/us/review?id=686449807&type=Purple%20Software,2024-02-06T16:07:52-07:00
10909043551,nate5ks,https://itunes.apple.com/us/reviews/id248663287,10.7.1,1,Lucas Gage Censored,This app worked great until I stopped being able to see Lucas Gage’s posts. Please fix this.,https://itunes.apple.com/us/review?id=686449807&type=Purple%20Software,2024-02-06T08:34:28-07:00
10908448543,Oceank1d,https://itunes.apple.com/us/reviews/id1621988567,10.7.1,5,Пропал звук в кружках после обновления.,"После обновления приложения до 10.7.1 у меня появилась некая проблема, дескать появился шум в кружках, вместо звука. Ничего не слышно, кроме шуршания(?) Или как это правильно обозвать, не знаю. А меня слышно очень-очень тихо.",https://itunes.apple.com/us/review?id=686449807&type=Purple%20Software,2024-02-06T05:34:37-07:00
10908232716,gandonchik1488,https://itunes.apple.com/us/reviews/id1424560435,10.7.1,1,pidr,does not record sound in video circle,https://itunes.apple.com/us/review?id=686449807&type=Purple%20Software,2024-02-06T04:28:31-07:00
10907813782,小葱jeff,https://itunes.apple.com/us/reviews/id209402977,10.7.1,3,Not able to receive notifications when new messages arrive,"In recent updates, I am not able to recieve notifications when new messages arrive. Please fix this . iPhone 14 Pro Max",https://itunes.apple.com/us/review?id=686449807&type=Purple%20Software,2024-02-06T01:55:52-07:00
10907638977,شمس الدین,https://itunes.apple.com/us/reviews/id668316352,10.7.1,1,When use proxy then stop run and exit,Please dowhgread to 10.7 Version 😏🙏,https://itunes.apple.com/us/review?id=686449807&type=Purple%20Software,2024-02-06T00:43:08-07:00
10907452930,月杪,https://itunes.apple.com/us/reviews/id228404774,10.7.1,1,Notifications failed after update,Notifications failed again and again,https://itunes.apple.com/us/review?id=686449807&type=Purple%20Software,2024-02-05T23:24:00-07:00
10907230315,Leti98,https://itunes.apple.com/us/reviews/id157729524,10.7.1,1,Garbage,9 days I can’t sign in “for my protection “ after I paid for their “premium” service! Garbage app. And a rip off!,https://itunes.apple.com/us/review?id=686449807&type=Purple%20Software,2024-02-05T21:46:17-07:00
10907188447,SkySchoolForIdiots,https://itunes.apple.com/us/reviews/id1325338070,10.7.1,1,im on ipad,i dont have a phone number,https://itunes.apple.com/us/review?id=686449807&type=Purple%20Software,2024-02-05T21:27:44-07:00