id,userName,userUrl,version,score,title,text,url,updated
1944361780,Tenshi24,https://itunes.apple.com/us/reviews/id273192253,4.5,3,I love this app however...,"A few days ago it was working perfectly fine, the next night I go to use it on my iPod, it crashes out multiple times. I've tried uninstalling and then reinstalling it. Did nothing (just did it a third time same result) I even did a restart on the device itself, a couple of times and nothing! None of the usual fixes work for this! It still works on my phone but I use it on my iPod when I use my phone to watch a movie or something so I don't have to constantly pause and 'tab' out. And this is usually when I am in my bed at night and not near my desktop which also has Telegram on it. But this is getting really annoying please fix it!!!!",https://itunes.apple.com/us/review?id=686449807&type=Purple%20Software,2017-11-23T20:28:06-07:00
9023251050,"All, nicknames, are, taken.",https://itunes.apple.com/us/reviews/id796374805,8.9.1,1,Notifications are stupid,"No matter what I turn off, this app notifies me of anyone of my contacts joining telegram. I dont give a duck what obscure contact I have that I speak to once a year joins telegram, please make a setting to stop it. Another thing is I have to go thru 3-4 steps to delete a conversation. If I swipe, then I have to select the dele option, and then confirm. Or hold my finger down, tap delete, then confirm. I can’t select multipl chats/convos either. Sheesh, when you have 30 retarded notification that your contact has joined telegram and then 3-4 each to delete…. Come on. I just don’t understand why I have to be forced notified about these contacts and then make it so hard to delete. Otherwise the app is fine but this one issue makes it the experience too unpleasant.",https://itunes.apple.com/us/review?id=686449807&type=Purple%20Software,2022-08-27T08:02:32-07:00
8823285604,f*ck a nickname apple,https://itunes.apple.com/us/reviews/id1410208653,8.8.1,1,1 STAR; zero organization; no support,"It just shuffles all my channels all the time. They just get added en masse to a folder and that’s it, the whole mess of channels in now stuck in the folder. I can manually exclude some, but only 100, and that doesn’t solve 300 unrelated channels getting added to a category. Then on top of it, Telegram will just randomly unfollow channels or groups, and you will have some turn up you never joined. 

And there’s zero support. It’s not volunteer support if no one is volunteering. It’s just zero support. Months and months—exactly zero replies. I guess they don’t do support, which is unfortunate with SO MANY BUGS. You’d think since they’re running a premium now, they could afford to have someone at least unsatisfactorily answer questions, but no. Of course not.",https://itunes.apple.com/us/review?id=686449807&type=Purple%20Software,2022-06-29T11:12:14-07:00
9155775399,Fatima_Ta,https://itunes.apple.com/us/reviews/id1226371702,9.0.1,4,It has become so slow,"Telegram was great until it's last two updates. Absolutely it has become the greatest ever in the features but on my iphone 5s ios 12.5.5, it has become really slow. I click on buttons but sometimes it takes even up to 20 seconds for them to work. I updated it again to the last version in hope of fixing it but it didn't work. If the problem is my ios, so it shouldn't show updates to me... I want the previous fabulous and fast working Telegram back! Thanks to its team, I will wait for it to fix in the next update^^",https://itunes.apple.com/us/review?id=686449807&type=Purple%20Software,2022-10-05T21:07:59-07:00
6789093391,Y-U-Turn,https://itunes.apple.com/us/reviews/id639004474,7.3,4,A very useful app ✅👏✨,"In a nutshell you could do a variety of things in telegram: messaging ✅, audio calling ✅, video calling ✅⚠️, using bots ✨ to send automated updates to a group.  

If you want to use telegram to manually 🎮 or programmatically 💻 send updates in a group chat, you can. Take a look at telegram API 🎯. 

You can also open telegram on multiple devices: computer 💻🖥, smartphone 📱and in a browser 🌎. A direct contrast with WhatsApp: you can use WhatsApp web on your computer provided it is opened on your phone as well. Telegram imposes no such limitations👍👏. You can have telegram on as many devices as you please with the same account. ✨

Now areas of ⚠️IMMEDIATE IMPROVEMENT⚠️:

I see a bug 🐞🪲🪳when using the video call feature between a computer and a smart phone. The video is typically rotated by 90 degrees. There should be a mechanism for the video to rotate (as the user pleases) on any side of the conversation: you may have an auto rotate feature, but being able to manually rotate it will be very useful.",https://itunes.apple.com/us/review?id=686449807&type=Purple%20Software,2020-12-24T09:35:47-07:00
8640461644,fredexjewski,https://itunes.apple.com/us/reviews/id1401726566,8.7.1,5,Best messaging app.,"I love your service please don’t change how it’s currently working but include more to what it is. Thanks. I can’t say but it’s better than any messaging app I’ve seen since the beginning of messengers. It’s faster, smooth, easy to communicate, additive, and can edit sent messages. It can switch from a mobile to another inclusively adding all sent messages plus videos. How cool is that ? Better than anyone I know. Privacy settings are the best so far! Thanks Telegram team. 👍 Love your engineers. They got the smartest brain alive 🧠",https://itunes.apple.com/us/review?id=686449807&type=Purple%20Software,2022-05-05T11:24:55-07:00
6725465202,lorde__,https://itunes.apple.com/us/reviews/id1177550680,7.2.1,4,No download when you leave the app,"Telegram is so amazing but when you want to download something you cant go to another app..,The app immediately stops downloading when you go to another app .I mean it’s so annoying please fix it . And also I would like to leave an opinion as to making some sort of organizer or type of file manager just to identify everything you’ve downloaded from telegram or in the telegram folder and organize it as in according to file type or date , you don’t need to scroll through every channel to look for a content you downloaded ..it will a win win for all of us.. thanks",https://itunes.apple.com/us/review?id=686449807&type=Purple%20Software,2020-12-06T17:45:47-07:00
3389183998,ThatGuyWithAReview123445,https://itunes.apple.com/us/reviews/id558583923,5.0.15,1,17+ but not really,"As a Furry, I downloaded this app because everyone likes the sticker mechanic. I was having fun chatting with people I knew on it until I discovered groups. This opened up a whole new way of communicating with people who have common interests with me. I started connecting with these random people, building relationships, having laughs, using this 17+ app to spread 17+ content but low and behold the group that I became the admin of and was spreading 17+ content in was blocked. Nothing from Telegram saying why or if it could be fixed so I may continue enjoying their app. Nothing about what content specifically called for the blocking. Nothing. If you wish to use this for a fun time, turn back while you can cause even Twitter is better. They aren’t 17+ but they have thriving 17+ accounts. Why are they allowed to have that and not telegram?",https://itunes.apple.com/us/review?id=686449807&type=Purple%20Software,2018-11-06T17:09:49-07:00
6866154831,unzesty,https://itunes.apple.com/us/reviews/id23525050,7.3.1,3,I would give five stars but...,"Two things that they need to fix first and I will change to five stars;
First, in group chat if I close my phone without exiting the chat then get back on later it puts me at the bottom of all the unread messages, I’ll have to scroll up until I get to my last read message, so I have to exit the chat each time and then when I get back on it puts me at the top of my unread messages.
Second, I don’t have the ability in group chat to see who has read my messages, so I always have to scroll up to see who’s been online and at what time so that I can guess that maybe they’ve read the message.

Telegram please fix these two things",https://itunes.apple.com/us/review?id=686449807&type=Purple%20Software,2021-01-13T12:57:05-07:00
9010201152,Tumblrlover157,https://itunes.apple.com/us/reviews/id107768890,8.9.1,4,Please bring back easier .gif searching,"I need you to know that I only communicate in gifs. With this most recent update I have to click past the stickers (which lets be honest, no one uses), then the search function to search for what I want. AND now you can’t hold down to see the full gif, so you have to hope that the first one that pops up is the one you want. 
Please, I can’t communicate with anyone anymore. I’m five seconds away from searching gifs on my phone browser, saving them to my phone, and attaching them that way. 
Please, don’t make me beg.",https://itunes.apple.com/us/review?id=686449807&type=Purple%20Software,2022-08-23T18:00:48-07:00
5576121062,Art.Sepanta,https://itunes.apple.com/us/reviews/id453817291,5.15.2,5,Categorizing channels & groups,"Hi there
i need to be able to Categorize my channels and groups not just putting them in Archives , as i have groups or channels about school , fun , Business , news ,sports,etc . So why wouldn’t u just let us decide to manage our groups and channels by folders therefore we could have some sorted folders by the user desire??? ??? i could move certain channels or groups about news in news folder also on the other specific folder,thus when i open archives i could see folders so i wouldnt say what a mess every fffff time i open Archives in telegram !!!!",https://itunes.apple.com/us/review?id=686449807&type=Purple%20Software,2020-02-24T16:23:17-07:00
2482187349,GooglymooglyEli,https://itunes.apple.com/us/reviews/id281338105,4.8.1,1,REPORTING MAJOR BUGS.,"First off, telegram NEVER correctly downloads an entire chat from a group chat. It’ll say there haven’t been any messages since 6am when in reality there have been over a hundred. To fix this I am CONSTANTLY deleting and re-downloading telegram. This happened again and I had to delete and download again, and now it’s showing a glitch that it cannot log me in because I have no internet connection. I’ve tried restarting my device, tried on other devices, tried on data instead of WiFi, same glitch. Yet every single other application (Instagram, Facebook, Twitter, Email) is working just fine and I have perfect internet speed and connection. Fix this because it’s incredibly frustrating and I have to use this app as a part of my job, this is stopping me from doing so.",https://itunes.apple.com/us/review?id=686449807&type=Purple%20Software,2018-04-29T00:34:54-07:00
1924047110,Kkuluuk,https://itunes.apple.com/us/reviews/id381287235,4.5,2,"Okay, perhaps by now it should work with iOS11...","Telegram has been a messaging service that is very light, quick, yet full of useful features such as mentioning — and most of all, completely free without disturbing adds and other privacy concerns. 
Yet even with the latest update, this app still has a number of glitches on the iOS 11. Some are crucial — like if you open the app as slide over on an iPad with hardware keyboard attached, the input field will be hidden beneath the keyboard shortcut UI, making it very hard to type correctly. 
Besides all the issues I’m having, this still is my favorite messaging service yet, and really hope to see it fully optimized for iOS — possibly with support for drag-and-drop and VoiceOver — as soon as possible.",https://itunes.apple.com/us/review?id=686449807&type=Purple%20Software,2017-11-15T19:06:02-07:00
4714550209,beegeetea,https://itunes.apple.com/us/reviews/id945767243,5.10,5,Telegram is Honestly so perfect.,"I looooove Telegram. 
I’ve been using it for at least 5years now, and I have never had a complaint. It honestly keeps getting better and better.
Simple, Low data usage, fast, and all the features it provides, so detailed and necessary. 
Then the bots!!! Telegram allows users to develop their own bots. Which is so perfect because nobody really knows what you need more than a fellow user. Plus they’re perfect for groups and channels, when you need to collect data... 
 I know I sound super biased, but honestly these people deserve it. God bless y’all Telegram people. 👌🏾❤️",https://itunes.apple.com/us/review?id=686449807&type=Purple%20Software,2019-09-02T04:50:44-07:00
3848458722,joamapan,https://itunes.apple.com/us/reviews/id987841259,5.4.1,2,Update killed replying to messages through notifications,"This is an easy application to use and I really appreciate end to end encryption. Dynamic dark mode is nice too. However, the latest update won’t send the messages I type when replying directly from a notification. More often than not, this is the way I interact with the app. For two days I have been replying to messages thinking that they have been sent, only learning that they have not been sent at all after opening the app. I asked my contacts if they had received the messages, that maybe they just weren’t showing up for me, and they had not. This loss of functionality makes using Telegram very frustrating. I hope this is an easy fix.",https://itunes.apple.com/us/review?id=686449807&type=Purple%20Software,2019-03-06T00:14:12-07:00
2339205572,Neowface,https://itunes.apple.com/us/reviews/id421173728,4.8,5,I love this app so much but I just ran into a problem,"I love using this app everyday, it is my life, but I ran into a very annoying problem that I have used the support contact on the device for. My app has this annoying problem where when I leave the app open for a long while and don’t use it the background in all of my chats will turn pure white, I had no problem before the newest update. Please please fix this as I do not wish to keep re-adding the background over and over after not using my app for 30 minutes to an hour.",https://itunes.apple.com/us/review?id=686449807&type=Purple%20Software,2018-03-23T18:02:21-07:00
7686498964,Nk bellic,https://itunes.apple.com/us/reviews/id227544607,7.9.2,3,What happened?,"I love this app! I am so happy that I can use it across different platforms (like my iPhone and iPad, which is something I cant do with Whatsapp for example), but since I upgraded to the last version, everything is working...well, worse! It stutters, it lags, sometimes messages are not send, other times I cant download voice notes or videos even though I am connected to Wifi or mobile data, so, I guess it just needs some more polishing! Hope this can be fixed soon, and thanks to all the developers and people behind this app that are constantly working to improve it. You are doing an amazing job!",https://itunes.apple.com/us/review?id=686449807&type=Purple%20Software,2021-08-12T19:40:33-07:00
4544162702,jackpresto,https://itunes.apple.com/us/reviews/id698955757,5.9.1,2,Not accessible with VoiceOver,"No doubt the app is amazing, but it is of no use to me and millions like me who could not look into the app like most of the people do, we use an accessibility service called Voice Over screen reader  instead that would read aloud what’s there on screen. But unfortunately VO does not work that well on this app, I am not even able to go from  one message to another by swiping, this is a result of bad coding practice wrt accessibility.

If you are coming across this kind of request for the first time, suggest you to Google “Developing accessible apps on iOS” and learn about implementing  accessibility APIs offered on iOS, so that everyone could use it easily.

Still you need assistance  to make your app accessible, I would be happy to help.",https://itunes.apple.com/us/review?id=686449807&type=Purple%20Software,2019-07-30T20:18:20-07:00
8538819370,Yerrrrrz,https://itunes.apple.com/us/reviews/id150119330,8.6,5,"I love Telegram, Hate Apple","Time to abandon Apple. Censorship on every single app on a device I own? No thank you. I know, I know...TOS and all that legal crap I accepted. Apple if you are reading this, I’m ensuring that every individual I know abandons you. A lot of them are onboard, even without having to talk to them. A company that holds a moral high ground over what’s ideologically “correct,” right down to every component to touch a child’s hand in your manufacturing facilities. This is being typed from an iPhone 7 and the last Apple device I’m ever going to purchase. Good riddance.",https://itunes.apple.com/us/review?id=686449807&type=Purple%20Software,2022-04-06T10:57:33-07:00
10168531328,熊子谦,https://itunes.apple.com/us/reviews/id356747362,9.6.4,1,Stay away before you get involved into illegal material,"I have been using this app mainly because there's some BDSM and investing community, but recently I find out one can easily be playing with the fire here: someone claimed selling legal pg18 content but in fact they are also trying to sell you illegal underaged pornography. That's the last thing you want to get involved into. 

Though I do accept legal adult content, I do not want to have any connection to those people so I quit using telegram. Also there are a lot of gambling scammer, human information seller and all kinds of dark web people adding you from time to time. So if you want to keep being a decent citizen, stay away from this app cause it's very easy to get into the dark side of humanity.❌",https://itunes.apple.com/us/review?id=686449807&type=Purple%20Software,2023-07-22T02:48:46-07:00
6874018561,Aniiisss,https://itunes.apple.com/us/reviews/id392776808,7.3.1,5,Just one thing please!,"I really enjoy using Telegram! It’s high Speed, smoothe, secure, and so functional!
But I really wish it had delivered sign/status (it already has the “sent” & “read” sign, but in my experience being sure that the message is delivered to the contact is even more important than “read” . In business and private use, this is a crucial factor . Imagine when your contact is on a flight and you text them, you wanna know if the phone is turned on already... just saying .
I really look forward to seeing the “delivered” sign ..
Thanks , good luck",https://itunes.apple.com/us/review?id=686449807&type=Purple%20Software,2021-01-15T12:53:42-07:00
6213459561,CaliKai89,https://itunes.apple.com/us/reviews/id1131450741,6.2.1,3,Current version has issue with gifs on iPad Pro,"Gifs can cause the iPad to crash. Begins with stuttering performance and dropping animation frames. Regardless of whether you’re using the magic keyboard or touch, it’ll eventually become unresponsive to the point where your iPad is frozen and you have to force-reboot it. If you do manage to get out of the app the issues persist until you remove the app from your recents list. Really hoping this can be addressed soon. Telegram is my go-to for messaging and this is simply debilitating at this point.

Update: still has significant performance issues and will randomly cause the iPad to restart. Really hoping these problems can be addressed.",https://itunes.apple.com/us/review?id=686449807&type=Purple%20Software,2020-07-18T10:25:28-07:00
5710798561,Kimdoddk,https://itunes.apple.com/us/reviews/id492442105,5.15.2,1,Nth Room-we need your cooperation,"Because Telegram is the main communication channel for Nth Room - a group of 260,000 S.Korean child sexual abusers who blackmailed more than 80 little girls of ages 9+ to produce child porn and snuff films such as group raping, cutting their nipple off, putting living worms inside their bodies, etc. 

They are still producing, watching, and distributing the films under Telegram’s protection and the only way to throw every single one of those animals in jail as they deserve it is for Telegram to admit that “safe messaging” and “privacy” only apply to human beings, not monsters like these, and cooperate with the S. Korean police. 

Until Telegram makes that right decision to cooperate, I will only be able to relate Telegram with child sexual abuse. This is the reason why Im leaving Telegram. Please cooperate and help the abused girls, and the women fighting to protect them.",https://itunes.apple.com/us/review?id=686449807&type=Purple%20Software,2020-03-25T04:42:33-07:00