id,userName,userUrl,version,score,title,text,url,updated
10926336363,mhebrahimi,https://itunes.apple.com/us/reviews/id674050102,10.7.1,5,excellent,"The program is really great, but my problem is that the cache memory is not fully removed and the phone memory is occupied over time",https://itunes.apple.com/us/review?id=686449807&type=Purple%20Software,2024-02-11T01:03:24-07:00
10925301210,Ranimay99,https://itunes.apple.com/us/reviews/id546451209,10.7.1,3,"Great sometimes, disaster at other times.","No notifications coming to me since update!! 
Also if you wish to remain anonymous, it’s probably best that you don’t send notifications about someone in your contacts joining telegram.. they’re obviously going to recognize you if you have a pic up. Or maybe by your name since it will literally tell you their contact name has joined, I’m assuming they probably get a similar notification and could lurk on your account to see what pics and bio you have up or whatever. Should not connect to contacts in any way if I don’t want you to. Please fix notifications though, this is the main issue and very annoying. Will be going elsewhere until it’s fixed. And yes, all my settings are fine.",https://itunes.apple.com/us/review?id=686449807&type=Purple%20Software,2024-02-10T17:29:45-07:00
10924693379,TempUser4444,https://itunes.apple.com/us/reviews/id153453260,10.7.1,3,Message does not exist!!,"Someone please tell me how to fix this problem.   When I search for a topic and then click on one of the returned results, a message pops up that says “Message does not exist”.  I have tried everything I can think of to fix this, including the YouTube remedies.   Please help.   Thanks.",https://itunes.apple.com/us/review?id=686449807&type=Purple%20Software,2024-02-10T13:07:42-07:00
10923586145,LeraBaranova,https://itunes.apple.com/us/reviews/id1225533284,10.7.1,4,😔,"Паш, ну вот что произошло? Почему когда я отправила кружок, он превратился в квадратик без звука. Уже не первый раз с этим сталкиваюсь, почемууу?",https://itunes.apple.com/us/review?id=686449807&type=Purple%20Software,2024-02-10T06:55:22-07:00
10921806586,fonewiz,https://itunes.apple.com/us/reviews/id37418978,10.7.1,3,Zero notifications,I have notifications on in Telegram settings and in IOS but they never work. If there’s no notifications the this app is useless to me. Works fine in MacOS version just not in iPhone. Worked fine in previous versions of app.,https://itunes.apple.com/us/review?id=686449807&type=Purple%20Software,2024-02-09T19:21:08-07:00
10919536722,Mdrfuhjklftcnf,https://itunes.apple.com/us/reviews/id1509830394,10.7.1,3,Voice,"Dear telegram, Every thin g is good except voice messages. I can't send voice messages(I gave permission for voice but it doesn't work)",https://itunes.apple.com/us/review?id=686449807&type=Purple%20Software,2024-02-09T05:15:52-07:00
10916181576,眉山居士,https://itunes.apple.com/us/reviews/id1538062999,10.7.1,3,苹果12无法进入到消息页面,一点击消息就卡死,https://itunes.apple.com/us/review?id=686449807&type=Purple%20Software,2024-02-08T06:44:05-07:00
10915063471,Angelata Negron,https://itunes.apple.com/us/reviews/id1097332772,10.7.1,3,Is good,The app is very good but I would like an update where I can log in with my email account.,https://itunes.apple.com/us/review?id=686449807&type=Purple%20Software,2024-02-07T23:43:07-07:00
10914920751,Fdysbich,https://itunes.apple.com/us/reviews/id1477760912,10.7.1,5,Problem,There is a problem in the voice notification for contact messages that is not notified,https://itunes.apple.com/us/review?id=686449807&type=Purple%20Software,2024-02-07T22:38:45-07:00
10914640787,快手顶尖傩囍,https://itunes.apple.com/us/reviews/id1622575832,10.7.1,5,F y,懂的都懂,https://itunes.apple.com/us/review?id=686449807&type=Purple%20Software,2024-02-07T20:30:11-07:00
10912374354,Kirito_k05,https://itunes.apple.com/us/reviews/id1361070578,10.7.1,5,Идеально 👌🏻,Есть всё но хочется телеграмм премиум остальное всё идеально,https://itunes.apple.com/us/review?id=686449807&type=Purple%20Software,2024-02-07T06:14:06-07:00
10910444784,Dtfufrgg,https://itunes.apple.com/us/reviews/id109566248,10.7.1,4,Update broke search,"Update is great overall but now you can no longer skip to certain search results. Ie: I search for something in a group, there’s 400 results, I used to be able to show as list and skip to the oldest result, then using the down arrow to skip to the next oldest result. This no longer works, when I skip to the oldest result and hit the down arrow, it goes all the way back to the newest result. Please fix, this is very useful for some groups.",https://itunes.apple.com/us/review?id=686449807&type=Purple%20Software,2024-02-06T17:34:26-07:00
10910423998,@napoima,https://itunes.apple.com/us/reviews/id913140626,10.7.1,4,Marycolombo,Mosqueracity1953,https://itunes.apple.com/us/review?id=686449807&type=Purple%20Software,2024-02-06T17:26:13-07:00
10908448543,Oceank1d,https://itunes.apple.com/us/reviews/id1621988567,10.7.1,5,Пропал звук в кружках после обновления.,"После обновления приложения до 10.7.1 у меня появилась некая проблема, дескать появился шум в кружках, вместо звука. Ничего не слышно, кроме шуршания(?) Или как это правильно обозвать, не знаю. А меня слышно очень-очень тихо.",https://itunes.apple.com/us/review?id=686449807&type=Purple%20Software,2024-02-06T05:34:37-07:00
10907813782,小葱jeff,https://itunes.apple.com/us/reviews/id209402977,10.7.1,3,Not able to receive notifications when new messages arrive,"In recent updates, I am not able to recieve notifications when new messages arrive. Please fix this . iPhone 14 Pro Max",https://itunes.apple.com/us/review?id=686449807&type=Purple%20Software,2024-02-06T01:55:52-07:00
10905396823,Степан1997,https://itunes.apple.com/us/reviews/id1621697696,10.7.1,3,Проблема с видеосообщением.,"В общем, я как обычно хотел записать видеосообщение и появился какой то фоновый шум(при записи голосового сообщения этого шума не было) так же я проверял микрофон и все отлично работает(так как телефону 2 дня)",https://itunes.apple.com/us/review?id=686449807&type=Purple%20Software,2024-02-05T09:42:39-07:00