id,userName,userUrl,version,score,title,text,url,updated
3343623423,Quinnfuzzball,https://itunes.apple.com/us/reviews/id626230398,5.0.14,4,Awesome app.,"Worth getting to replace any IM you have had in the past. Simple and easy to use, regular, group, and secret chats, free stickers and the option to add your own, an audio player, completely free, and easy and large file sharing. Worth getting. 

Although, after this recent update, .WAV file playback of previously downloaded audio is not working. As a music artist, I tend to send others and myself the music I have made in this format as its high quality and I can play it wherever I am even without a internet connection. The player that used to open on .WAV files I assume has been switched for the player that plays .MP3 files. It does not play the .WAV files I had downloaded.",https://itunes.apple.com/us/review?id=686449807&type=Purple%20Software,2018-10-25T15:53:03-07:00
8777534172,Nima1323,https://itunes.apple.com/us/reviews/id555500199,8.7.1,2,"This app don’t pay attention to user or solve problem ,user don’t pay attention to rules!","In this app you can see many bad channel for example you see many pornography, violence, hate speech or …,I reported many channel or post and telegram app moderator don’t pay attention to this my report also I don’t prefer this app 
2-proxy don’t work in new update and people should use vpn app and telegram moderator don’t solve this problem
Also I  get 2 star until I can see telegram remove bad channel or kick bad user ! All app have rules and telegram don’t pay attention how many people pay attention to rules and how many not
Also until I don’t see this problems will solve I don’t prefer this app but if I see this problem solve I will get 5 star to this app !",https://itunes.apple.com/us/review?id=686449807&type=Purple%20Software,2022-06-15T14:12:05-07:00
7559637082,Mohammadbagher Bagheri,https://itunes.apple.com/us/reviews/id1288324382,7.8.2,5,Bug when trying to upload a new profile picture.,"Dear Telegram team. I am writing this to first thank you for your great work. I have been using Telegram for a long time and had no problem with it whatsoever. That's until today. I wanted to add a new profile picture . When selecting the new picture as the screen is navigating to the crop page the app freezes and stops working. The problem might be in rendering the crop screen. I am using Iphone 12 pro max IOS 14.6. 
I have tried closing the app. 
I have tried restarting my phone. 
None of those worked.",https://itunes.apple.com/us/review?id=686449807&type=Purple%20Software,2021-07-09T23:35:56-07:00
8336377330,mikeymike1213,https://itunes.apple.com/us/reviews/id167471910,8.5.1,4,Suggestion for app developers,"Dear Telegram developer team, 
In the latest update in which you provided some cool features to group chats like “slow-mode”, it’s been a very interesting tool for group admins 

My only complaint is that the way slow-mode currently works in groups is that when activated it affects all members in the group chat unless that member is added to the exception list. 

it would be so much easier if there’s a way to literally keep the entire group chat exempted from the slow-mode an only have slow-mode affect certain individuals. 

it’s way to time consuming for admins to constantly have to make sure that all members are on that  exception list so they don’t get annoyed with the slow mode activity. 

in the next update can you please have a feature to -[ ADD ONLY ]- slow mode 
In which admins can add members to a slow mode parameters on certain individual who message WAY TO MUCH in groups. 

please respond back if you have a possible solution to this request / issue.",https://itunes.apple.com/us/review?id=686449807&type=Purple%20Software,2022-02-09T05:28:19-07:00
9170627923,ILLBDAJUDGE,https://itunes.apple.com/us/reviews/id163003087,9.0.2,1,Beware,Bottom line this app has literally ruined my day. After signing up the app sent messages to people that I’m on telegram. I wish they would have asked if it was okay to allow people to know I'm on the app. Someone that I have an order of protection against has started sending me messages. Clearly this person could care less about the protection order. And now calling me saying I know you are available because you are on telegram.  I can’t even delete my account. There’s no option to erase my account. I didn’t allow access to my contacts. However as long as a person has your number in their contacts telegram will automatically notify them. Had I known that I would have NEVER downloaded this app. No warning or anything at first to make you aware of this action.,https://itunes.apple.com/us/review?id=686449807&type=Purple%20Software,2022-10-10T07:30:11-07:00
8643659862,AaronChronicles,https://itunes.apple.com/us/reviews/id364939138,8.7.1,1,Not and Scams,"Sadly an app with the potential of being a wonderful Reddit competitor, yet it falls short by allowing scammers and bots flood it’s platform with no precautionary measures and  regulations to keep them out. As well as people losing thousands of dollars by a simple DM. Other than that, getting your account locked because someone either accidentally reports you, when you warn of scams then blocks you from a chat causes Telegram bots to lock your account. If someone decides to just hit the report or ban button, you don’t get any say so, it’s bias and without a warning or background check on what has been reported. Bots high quantity over quality is not the way to go. Help the users security better, make sure these accounts are not scammers, regulate power hungry mods/admins. This is coming from someone with REAL law enforcement experience.",https://itunes.apple.com/us/review?id=686449807&type=Purple%20Software,2022-05-06T10:25:59-07:00
10619886458,ام سرى,https://itunes.apple.com/us/reviews/id342358795,10.2.6,3,Premium,Telegram is literally the besttttt but the only problem is the premium of story and butting story video unfortunately I’m in a country I can’t get telegram premium honestly if I could I would get it for 100% but I can’t I would be very happy if u could do the story putting more even if u won’t make it free just but it more like I can put more than 7 stories a week and more than three stories a day I would be so happy and thank u soooooo much for such a fantastic app 🫶🏻🫶🏻🫶🏻 and I wanted to say one more thing can u do everything free for one day and that day is the person using telegram birthday like on people’s birthday do it free for ‘em they can do everything only for ‘em and only on their birthday,https://itunes.apple.com/us/review?id=686449807&type=Purple%20Software,2023-11-24T06:01:40-07:00
3968182194,Nolldor,https://itunes.apple.com/us/reviews/id216896620,5.5.1,4,Best Messenger - But Please Fix This,"This is no doubt my favorite messenger app and I advocate for it among my friends.

One problem: since some update about a month or two ago, messages that failed to be sent due to no connection (that lasted for a significant amount of time: 30min, 60min), don’t get sent automatically in the background once the internet connection appears. 

I am angry because I am used to the behavior that if I once press Send on a message, I don’t have to think about it again and it is *guaranteed* be delivered. Without this behavior, I have to manually check each and every message I’ve sent (which I don’t do) and otherwise get into inconvenient situations when someone needed to get my message hours earlier.

I would like to hear a reply from the Telegram team as for the reason for removal of this feature or a confirmation that it is just a temporarily bug that you will solve. If this is a performance issue, please provide an option in the settings to persistently keep trying to send messages, as it used to work before.",https://itunes.apple.com/us/review?id=686449807&type=Purple%20Software,2019-04-04T05:02:31-07:00
7148652034,mrmeach1967,https://itunes.apple.com/us/reviews/id1100045151,7.6.1,3,Starting to Censor I see,"Yep.  Didn’t take long to ruin an otherwise good idea.  Telegram has been “influenced” to censor the infamous attorney Lin Wood, for making “illegal” comments. Illegal? Lin Wood? Seriously? I know he’s not Jesus and is prone to error, but, my God! You actually have the balls - and stupidity - to accuse a lawyer who specializes in defamation of not knowing where the line is drawn on this particular subject.  You better change your tune quickly or be prepared to face actual litigation in the near future.  I use your service instead of Twitter or Facebook precisely to avoid dealing with stupid crap like this.  Signal here I come.

Update: I’m adding a star ⭐️ (2 —> 3) since you decided to let Mr. Wood out of jail.  But now you’re on probation.  Behave yourself and I might remember to add another one.",https://itunes.apple.com/us/review?id=686449807&type=Purple%20Software,2021-03-26T17:33:28-07:00
2837208210,Robot RX13669,https://itunes.apple.com/us/reviews/id797655328,4.8.4,5,Fantastic,Factional morning my friend who has been a big girl in my past life is the most important things I’ve seen for her to be with you and you have never seen a person like me in the world and I wanna life would be more than life I love and love the fact allowing my hair for him and very long for Just it to become options so we could have seen the way I do it and it looks really cool to see the difference between a two year deal with you and the girls and the kids and the boys and the other people’s lives in their World Wide Web think they want me and my young ones people who have different styles for them.,https://itunes.apple.com/us/review?id=686449807&type=Purple%20Software,2018-07-04T12:00:17-07:00
4359389555,zahra0050,https://itunes.apple.com/us/reviews/id396281078,5.7,5,the best app,"it’s literaly not one of the best communicating apps but THE BEST communicating app 
I almost do my everything with it . calls, messaging ,sending docs and photos , downloading and listening to music ,even downloading movies or reading books from some amazing channels . some even do online bussines with telegram. 
and it’s so pittiful that my country’s government has banned this app and we have to use vpn ti connect or even it’s happened that we can’t use it for some days . if you could do sth to solve this problem of ours ,it could be lifesaving and a good slap in our politician’s faces😂
thank u thank u thank u for your amazing flawless app❤️",https://itunes.apple.com/us/review?id=686449807&type=Purple%20Software,2019-06-23T09:59:11-07:00
10553190483,MissPATRIOTChelseaGirl,https://itunes.apple.com/us/reviews/id141129113,10.2.2,2,Please change the editing options back to the way it was,"Selecting text and editing text for posting is a nightmare. Please change the options back to the way it was. It takes twice the time now to use the tools when posting. Underlining/Bolding/Linking/Selecting text is a mess. The new options need to be added to the end not the original options that are actually used the most. Also when selecting text it’s takes FOREVER and is very “slippery.” If part of the word is bold/underlined and you select multiple words to bold/underline it removes all of the bold/underline first so you have to do it all over again to get what you want bold/underlined. Before it would bold/underline all of  the selected text first, not remove it first.",https://itunes.apple.com/us/review?id=686449807&type=Purple%20Software,2023-11-05T07:23:57-07:00
5356487632,Mr.Core2Man,https://itunes.apple.com/us/reviews/id128849045,5.13,4,"My favourite app, but still has some room for improvement","Dear developers,
I appreciate the last changes, but it seems that something has changed to sharing feature. In previous versions when I wanted to share from another app to Telegram it all worked flawlessly. Now for some reason after  command to share via Telegram it pop-ups another sharing screen, where I need to share it again. Oddly enough, it has different colour scheme: my main theme is dark and first sharing screen also comes in black, as it supposed to be. However second one pop-ups in white. Hope you will address this issue in the next update. Happy New Year!",https://itunes.apple.com/us/review?id=686449807&type=Purple%20Software,2020-01-03T10:26:08-07:00
10250431285,SweetSexy Melissa,https://itunes.apple.com/us/reviews/id654024232,9.6.6,5,Telegram Social Media Platform,"Dear Telegram,
I Love Your Amazing Social Media Platform, there is nothing that compares to the absolutely beautiful and amazing people whom make this place a great place to call home away from home.

It has been the most amazing experience connecting to new found friends, that most definitely will be spoken about for years to come. I Love what you give to so many after such a devastating moment in time such as this we are currently living through with so much pain.

I pray you will continue to bless our lives with your presence, and maybe consider not charging memberships at the present moment in time. I know you have many costs involved delivering your business throughput many Countries, but you will do much better by holding off with your extra cost too members, that need every penny they can muster up to be here participating and sure will have no problems paying at a later date.

Kindest Regards,
Lissa 69",https://itunes.apple.com/us/review?id=686449807&type=Purple%20Software,2023-08-12T13:13:14-07:00
5087923249,Mc tuna,https://itunes.apple.com/us/reviews/id116240974,5.12.1,4,"I love Telegram, but","Why don’t voice recordings (made outside the telegram app but sent in chat) and GIFs show up in “shared media?” Maybe in a future version, would it be possible to see GIFs in the shared media section, excluding the ones that are stickers? 

I also have some wild ideas I can’t keep to myself! 

Feature suggestion: it would be awesome if I could jump to the point in the standard chat where a photo was sent. Like I could tap on the picture in shared media, and there would be an option to jump to the day/time it was sent. 
Another related feature- what if I could jump to a specific time? “Hmm, what were we talking about on Nov. 4, 2019?” And I could somehow jump to the start of that day. 
One more! - what if we could “bookmark” specific moments in the chat, so we could jump back to that point and reread messages? I suppose a bookmarks section would be needed for this.

Telegram is a great app. I really love the improved search! It shows every time a word was said, instead of just the most recent time. It’s great!",https://itunes.apple.com/us/review?id=686449807&type=Purple%20Software,2019-11-04T21:48:58-07:00
8862646420,jefjo20,https://itunes.apple.com/us/reviews/id585109424,8.8.3,4,Voice recording is only complaint,"Most of the app works beautifully. I very much enjoy the features and the security. My only complaint about it is that the voice message feature is no good. Almost every time I play a voice recording that someone sent to me, the app crashes. If I play someone else’s voice message, it will play through without crashing maybe 10% of the time. I always have to force quit the app and relaunch it. It is quite annoying. The app displays this exact same issue on both of my iPhones (which are two different models), so it is clearly not my device.",https://itunes.apple.com/us/review?id=686449807&type=Purple%20Software,2022-07-11T03:45:40-07:00
9886653394,I used to love this...,https://itunes.apple.com/us/reviews/id679575532,9.6.3,1,No privacy,"This app alerts everyone you've ever known that you joined IMMEDIATELY (this includes people who have been deleted from your contacts list before the cloud existed, multiple phones and multiple carriers ago) without first giving you the option of syncing (or not) every person you've ever looked sideways at in the grocery store. It's an invasion of privacy to the degree that it felt assaultive. People I hadn't talked to in over 15 years (and had no intention of ever speaking to again through my dying day) messaged me before I had even picked out a profile picture. Frankly, it was so overwhelming and stress provoking it made me physically ill. I deleted it within an hour, and I'm only writing this to forewarn others so they know what they're getting into before they install it.",https://itunes.apple.com/us/review?id=686449807&type=Purple%20Software,2023-05-02T18:38:23-07:00
9107089235,Blared,https://itunes.apple.com/us/reviews/id104713004,9.0,3,Bugs,"I’ve used telegram for many years, maybe a decade now and I’ve always loved it, when they started adding stuff it got me excited and I still am but..

Seems they are adding so many things but breaking some other, I have issues with stickers not playing, not being able to select them, they’re grey and I’ve tried everything and now lately they randomly rearrange, I always have the animated one first and at the bottom I have the normal ones and now they’re all over the place and it’s the second time it happens

I also wish you could hide the last suggested packs because I like to scroll fast to the bottom but now I can’t",https://itunes.apple.com/us/review?id=686449807&type=Purple%20Software,2022-09-21T07:42:38-07:00
5746612297,xCrunchyRollx,https://itunes.apple.com/us/reviews/id410299144,6.0.1,4,Stickers,"My husband and I have been using this app for quite a while since we used to use Line but have been having issues with notifications not coming through. We like telegram a lot, it’s very clean and simple and FAST! However I would like to add a suggestion regarding the stickers; I love how there was a huge selection of stickers on Line, I have sooooo many on that app right now but cannot use them anymore due to issues with the app itself, is there any way to have more of a bigger selection of stickers like Line? I know you can make your own but honestly I don’t think I have the time to sit there and work on a pack of stickers.",https://itunes.apple.com/us/review?id=686449807&type=Purple%20Software,2020-04-01T08:50:04-07:00
9549244082,BenjiWorth,https://itunes.apple.com/us/reviews/id248786565,9.3.2,2,I don’t care who joined Telegram,"After years, I can’t believe Telegram is still sending me messages whenever a Contact joins Telegram.  I turned off notifications of this non-event, but they still open a chat.  Which means I get these messages cluttering up my inbox daily.  It’s spammy.  

Furthermore, somehow people have the illusion it’s more secure than WhatsApp. It isn’t, at all.  True, it’s not Meta potentially snooping, at least.  But if you really want security, Signal is the better choice.  

Telegram seems now to be marketing itself on goofy emojis etc.  Personally I don’t care about that crap.  I just want a secure, non-spammy messaging app.  I use this app only for friends who insist on it, for reasons I think are misinformed about its privacy and security.",https://itunes.apple.com/us/review?id=686449807&type=Purple%20Software,2023-01-26T05:54:05-07:00
8914530368,Heckwood,https://itunes.apple.com/us/reviews/id1398204411,8.8.3,1,Download Problems,"I could see a lot of reviews from people on different issues concerning the latest update but for me it’s downloading problems. seriously, with this new changes on the app if you don’t do something about it you’re gonna lose a lot of users, myself included. ever since i updated my app to the later version i’ve not been able to download any file at ease. it takes forever for me to download even a 10mb and it’s not my internet connection. i use the same internet connection to download from other apps and i don’t experience such problem except telegram. please it’s either you take down the premium subscription you’ve included or you fix whatever bug that’s causing us these problems or we stop using the app. you choose",https://itunes.apple.com/us/review?id=686449807&type=Purple%20Software,2022-07-26T12:10:01-07:00
9045655875,RiverMarie,https://itunes.apple.com/us/reviews/id1444153569,8.9.1,3,Love this app. But kinda upset about the new “telegram plus”.,"I’ve been using telegram sense around 2018. And it was and is amazing. Telegram and Telegram x were my favorite texting apps and it still is, all the features are amazing and it’s just an overall nice and organized app. However I do have one single problem with it. Telegram plus. I would just like to know WHOS idea it was to make features that have been free for years before hand. Suddenly not accessible unless you PAY for them?! I love this app. And I will continue to use it as my daily messaging app. But telegram I don’t know what made you decide to implement telegram plus but I’m going to need you to stop. Thank you. 😁",https://itunes.apple.com/us/review?id=686449807&type=Purple%20Software,2022-09-02T13:16:53-07:00
8849039641,untouchamp,https://itunes.apple.com/us/reviews/id1425487850,8.8.1,3,A strange approach to organizing messages,"I got plenty of chats, channels and groups on my Telegram account and i also have a lot of contacts that I want to chat with. So, my problem is, every time somebody texted me via Telegram, I easily missing his message, because all my channels brings him down, cuz to be on top, my friends should be spamming me more often than my groups do. I hope u feel me. 
Of course I could organise important dialogues in separate folders, but what if I know that somebody should contact with me on this week, but I don’t know his number yet? Should I stalker for them during all week? 
I hope u will fix that, cause ur app is great at many aspects, but this one :(",https://itunes.apple.com/us/review?id=686449807&type=Purple%20Software,2022-07-07T01:02:07-07:00
7718360473,Javihair,https://itunes.apple.com/us/reviews/id384914748,7.9.2,5,Looking at other members sign up notifications,"I find that looking at other members sign notifications is annoying, we don’t want to see that anymore, we like viewing our content instead not the notifications when someone is added to every time, it’s too much. We like looking at our messages the most. Please find a way to get rid of that Please and thank you in advance. Great app by the way. 👍👍 thumbs up on that. It needs new features also, I hope you have plenty on your sleeves. Hehehe 🤭 That would be great. 😊",https://itunes.apple.com/us/review?id=686449807&type=Purple%20Software,2021-08-21T07:07:46-07:00
6041232867,DiamondBrony,https://itunes.apple.com/us/reviews/id199060370,6.2,5,The best one,"I am using this as my main messaging app for the past 3-4 years. It has never let me down. And every update just brings more and more useful features to this already almost perfect app. 
Everyone is talking about how the video calls are important and giving lower ratings because this feature is not yet implemented. I am very disappointed by this. Telegram’s main goal always was maintaining privacy. If they can’t make video calls 100% secure — they will not add this feature. But I’m sure they will crack this one soon enough!
Thanks for literally the best app out there :)",https://itunes.apple.com/us/review?id=686449807&type=Purple%20Software,2020-06-05T22:02:59-07:00
7935176926,tobsmit,https://itunes.apple.com/us/reviews/id23341004,8.1.2,4,Needs Layout Change for iPad,"I love Telegram and use it daily which is why I feel like the layout on iPad and iPad Mini needs an update. It would be so much easier to read and scroll if the feed was in full screen instead of split between the list of chats. 
If it was updated to shift to full screen after selecting a chat, like on the phone versions, with a back button to go back to the list of chats it would make the reading and scrolling experience infinitely better and easier to read. 
Thank you guys for your hard work with app development, we appreciate you.",https://itunes.apple.com/us/review?id=686449807&type=Purple%20Software,2021-10-20T09:12:12-07:00
4460509879,k1.Mirzaei,https://itunes.apple.com/us/reviews/id412387575,5.9.1,5,Good but not excellent,"I’m enjoying the app for about 5 years. It’s getting better and more user-friendly with every update. But I have some more suggestions
1: Let users hide saved messages from the messages bar.
2: If you archive some chats or groups, it becomes unarchived by the time somebody mentions you in the group or chat. This feature is not that match with the archiving ability (which is used much as a hiding feature not a archive feature)
3: I think it would be very helpful if you let people to post messages and send files (pics, videos, and etc.) with knowing that nobody could forward those (taking screenshots are inescapable.
4: Let people archive their chats in a file as they can access them later if anything happened to their telegram account. I mean that the telegram messenger app has the ability to read files and apply it for messages and to recover chats if we took a backup already.
By the way. Thanks for your time.",https://itunes.apple.com/us/review?id=686449807&type=Purple%20Software,2019-07-14T07:51:44-07:00
