id,userName,userUrl,version,score,title,text,url,updated
11027413350,Makeup looks54,https://itunes.apple.com/us/reviews/id512627757,2.146.0,5,love this app!!!,"super helpful, don’t know how i did online shopping without it",https://itunes.apple.com/us/review?id=1223471316&type=Purple%20Software,2024-03-09T17:36:01-07:00
11027373716,elisaischaka,https://itunes.apple.com/us/reviews/id1497267226,2.146.0,1,No,My package never came,https://itunes.apple.com/us/review?id=1223471316&type=Purple%20Software,2024-03-09T17:20:16-07:00
11027068740,Dwyall,https://itunes.apple.com/us/reviews/id726880792,2.146.0,5,Fire,Pants are so fire give some time and they will arrive trust.,https://itunes.apple.com/us/review?id=1223471316&type=Purple%20Software,2024-03-09T15:14:41-07:00
11027031221,Callesol75,https://itunes.apple.com/us/reviews/id39179885,2.146.0,5,Great fit!,"It's a great looking practical sweater,  love the look.",https://itunes.apple.com/us/review?id=1223471316&type=Purple%20Software,2024-03-09T14:58:43-07:00
11027014088,SHOP thieves,https://itunes.apple.com/us/reviews/id359138677,2.146.0,1,"Double orders, no refund","I was happy with the app for a while until I started getting auto double orders and being charged for items I didn’t receive plus shipping with no way to reach the app company, (they have a fake phone number), so all money lost and expensive lesson learned. They tell you to call the boutique you ordered the item from. I guess they work together bc their customer service doesn’t reply or answer their phone. I’m done with it all!",https://itunes.apple.com/us/review?id=1223471316&type=Purple%20Software,2024-03-09T14:51:13-07:00
11026974361,Momo Renee,https://itunes.apple.com/us/reviews/id622837274,2.146.0,5,Ready to Rock and Roll,"The process of receiving took a little longer than I expected, but I’m ready to reep the benefits",https://itunes.apple.com/us/review?id=1223471316&type=Purple%20Software,2024-03-09T14:34:24-07:00
11026925934,KINLOCHJAY4,https://itunes.apple.com/us/reviews/id649007691,2.146.0,5,That was Quick,That was Quick,https://itunes.apple.com/us/review?id=1223471316&type=Purple%20Software,2024-03-09T14:13:46-07:00
11026849673,Liliam Moummar,https://itunes.apple.com/us/reviews/id1596973045,2.146.0,5,Perfumes árabes,"Hola. Me encantaron los perfumes, huelen muy rico y el regalo, muchas gracias. Los recomiendo",https://itunes.apple.com/us/review?id=1223471316&type=Purple%20Software,2024-03-09T13:41:39-07:00
11026804955,WestheimerTiger,https://itunes.apple.com/us/reviews/id1432973375,2.146.0,1,Shady Business Practices,This app requires access to READ all your emails if you want to be able to track packages,https://itunes.apple.com/us/review?id=1223471316&type=Purple%20Software,2024-03-09T13:23:15-07:00
11026738517,Brandy Frazier,https://itunes.apple.com/us/reviews/id1052310276,2.146.0,5,Besties Gang collection is a black on business,"bestiegangworld.com has a amazing Ph soaps all natural Yoni and body bars shower, gels body make up lip gloss moisturizer drops please just check it out more on the website. I’ve been a customer for maybe six years very good customer service.",https://itunes.apple.com/us/review?id=1223471316&type=Purple%20Software,2024-03-09T12:56:26-07:00
11026733832,Oldorrie,https://itunes.apple.com/us/reviews/id289051312,2.146.0,5,Love my outfit!,Amazing customer service can’t believe I ordered and got it in the same week! And the best part it’s gorgeous!!,https://itunes.apple.com/us/review?id=1223471316&type=Purple%20Software,2024-03-09T12:54:34-07:00
11026692359,Nairbjc,https://itunes.apple.com/us/reviews/id426635641,2.146.0,5,SHOP - Great service,"I enjoy how easy it is to use this app. 
Shop keeps track of my favorites and my purchases. Lets me know the statuses of my orders and they also have items on their app that you can purchase that the other company might not have. For instance I wanted to purchase an item but the company’s website didn’t have it but SHOP did. I made a purchase through SHOP. 
 Thank you",https://itunes.apple.com/us/review?id=1223471316&type=Purple%20Software,2024-03-09T12:38:06-07:00
11026660867,Little man 76,https://itunes.apple.com/us/reviews/id295007627,2.146.0,4,Wish there were more external account options,"I love that this app shows you your carbon impact as well as details of your package has been, but I really wish you could connect more external accounts and have a better variety of them too, and I wish you could add a permission to where it could look into your yahoo or your iCloud account and see tracking numbers and automatically track them so you don’t have to forward the email that they give you",https://itunes.apple.com/us/review?id=1223471316&type=Purple%20Software,2024-03-09T12:25:53-07:00
11026636938,Lionessface247,https://itunes.apple.com/us/reviews/id1135603786,2.146.0,5,Very Satisfied Customer,"Shop is great, the only place I like to shop💚",https://itunes.apple.com/us/review?id=1223471316&type=Purple%20Software,2024-03-09T12:16:35-07:00
11026608663,MelMorris1,https://itunes.apple.com/us/reviews/id148201872,2.146.0,5,"Love, love love Laura Geller products!!!!!","I absolutely LOVE all of Laura’s skin & makeup products!  They really deliver the full face beauty that she shows & the models show in the ads & commercials.  I’ve never used such great quality products as i get whenever i use Laura Geller.  This time, because of the specials & kits, i was able to purchase more of what I really wanted and to purchase a gift for my best friend who also loves Laura Geller makeup.  Now with the specific gifts & promotions I can get what i want & also what my friend loves.  We’re both now getting mature skin as we’re in our mid-60’s and the products really deliver great quality products for basically any age!  Try Laura Geller & you’ll never use anything else again!

Thank you Laura!  You’re the absolute best with items that really deliver what you say they will!!!!!

Melodie Morris",https://itunes.apple.com/us/review?id=1223471316&type=Purple%20Software,2024-03-09T12:05:51-07:00
11026565550,Shani’s thoughts,https://itunes.apple.com/us/reviews/id1251766159,2.146.0,1,Help,My first package was as expected this one today was empty with no eyelash kit and that was messed up I’d like my money back,https://itunes.apple.com/us/review?id=1223471316&type=Purple%20Software,2024-03-09T11:49:30-07:00
11026454353,kdm.3,https://itunes.apple.com/us/reviews/id1010848435,2.146.0,5,Review,Very excellent.,https://itunes.apple.com/us/review?id=1223471316&type=Purple%20Software,2024-03-09T11:08:51-07:00
11026403574,Lj7326,https://itunes.apple.com/us/reviews/id1066955809,2.146.0,1,Is Lord and Taylor legit?,"Ordered 2 dresses, returned 1 & recieved confirmation of ups return 2/15 but no refund as of 3/9. Other complaints reported with BBB. 
No response from help@lordandtaylor & no legit phone number to talk to someone.",https://itunes.apple.com/us/review?id=1223471316&type=Purple%20Software,2024-03-09T10:50:42-07:00
11026382797,Venmo lvr,https://itunes.apple.com/us/reviews/id1195953195,2.146.0,5,SozaVita,"I love this family owned, faith based business. Marsha, Katie and Chris are wonderful and strive to make your shopping a five-star experience. The products are organic and natural…no toxins allowed!! Give SozaVita a try. You won’t be disappointed!!!",https://itunes.apple.com/us/review?id=1223471316&type=Purple%20Software,2024-03-09T10:43:38-07:00
11026365196,Maleekleeekleesk,https://itunes.apple.com/us/reviews/id1132967244,2.146.0,5,Grade A App,Successful!,https://itunes.apple.com/us/review?id=1223471316&type=Purple%20Software,2024-03-09T10:37:38-07:00
11026343296,MsSheenaKay,https://itunes.apple.com/us/reviews/id418909027,2.146.0,5,Love Shop!,Love how I can track all my packages in one place!!!,https://itunes.apple.com/us/review?id=1223471316&type=Purple%20Software,2024-03-09T10:30:03-07:00
11026326780,Hinkle_J,https://itunes.apple.com/us/reviews/id1225264999,2.146.0,5,Great service.,"Everything you need all in one. Payments, shipping updates etc.",https://itunes.apple.com/us/review?id=1223471316&type=Purple%20Software,2024-03-09T10:24:20-07:00
11026315852,Mlener554,https://itunes.apple.com/us/reviews/id1275762215,2.146.0,5,Stop nineteen,Fast service and love the merchandise!!!,https://itunes.apple.com/us/review?id=1223471316&type=Purple%20Software,2024-03-09T10:20:35-07:00
11026236756,Pyxyqpur,https://itunes.apple.com/us/reviews/id884707879,2.146.0,5,Narcissism for Her,Beautiful scent - recognized it right when I opened the box and the bottle was packed impeccably - looks nice with the others on my shelf. My order was delivered quickly and with a bonus gift and nice card - excellent service.,https://itunes.apple.com/us/review?id=1223471316&type=Purple%20Software,2024-03-09T09:53:56-07:00
11026206335,Kimadina,https://itunes.apple.com/us/reviews/id161008136,2.146.0,3,Works ok but,Works ok but when I log in and it wants my email it says it will send a code and I never get it.  One shop allows me to track status but would like to see them all.,https://itunes.apple.com/us/review?id=1223471316&type=Purple%20Software,2024-03-09T09:43:55-07:00
11026153630,OOctopussy,https://itunes.apple.com/us/reviews/id782873947,2.146.0,1,Bad experience !!,Bad experience ;(. Do not order from them.,https://itunes.apple.com/us/review?id=1223471316&type=Purple%20Software,2024-03-09T09:26:55-07:00
11026141358,Fernando1julio,https://itunes.apple.com/us/reviews/id1404742914,2.146.0,5,Very Quick,"Great deal, Exelent service",https://itunes.apple.com/us/review?id=1223471316&type=Purple%20Software,2024-03-09T09:22:55-07:00
11026126987,shar_juicy,https://itunes.apple.com/us/reviews/id1037749766,2.146.0,5,Perfect,On time,https://itunes.apple.com/us/review?id=1223471316&type=Purple%20Software,2024-03-09T09:18:20-07:00
11026065000,huhghhhhjr,https://itunes.apple.com/us/reviews/id686970773,2.146.0,5,Good,Really good,https://itunes.apple.com/us/review?id=1223471316&type=Purple%20Software,2024-03-09T08:58:49-07:00
11026005011,J in Tex,https://itunes.apple.com/us/reviews/id412043068,2.146.0,5,Plants by Mail,"All 6 plants arrived today and they are absolutely gorgeous, very green and healthy. So happy with this first time purchase. We will definitely be ordering again!!",https://itunes.apple.com/us/review?id=1223471316&type=Purple%20Software,2024-03-09T08:40:06-07:00
11025960804,1Alpadog,https://itunes.apple.com/us/reviews/id258450186,2.146.0,5,Shop,"Shop is pretty good. They are doing what they said and I like the installment plans. Oh, it’s nice to know when my package is arrived.",https://itunes.apple.com/us/review?id=1223471316&type=Purple%20Software,2024-03-09T08:26:32-07:00
11025870606,katindiri,https://itunes.apple.com/us/reviews/id686637895,2.146.0,1,Order never received,Tracking says delivered but nothing got anything,https://itunes.apple.com/us/review?id=1223471316&type=Purple%20Software,2024-03-09T07:59:47-07:00
11025796733,kxb07,https://itunes.apple.com/us/reviews/id1304283305,2.146.0,5,Awesome experience,Thanks for keeping me updated during the whole shipping and delivery process.,https://itunes.apple.com/us/review?id=1223471316&type=Purple%20Software,2024-03-09T07:37:35-07:00
11025616938,mumicoo,https://itunes.apple.com/us/reviews/id581907837,2.146.0,5,Easy,"I like the fact that i can have all my orders in one place and for the most part virtual stores have the shop app which has all my payments in it so making it quick and easy so i don’t have to put in my card everytime. Easy to figure out as well 
I normally don’t even make reviews and or joke but im not joking this is a great app",https://itunes.apple.com/us/review?id=1223471316&type=Purple%20Software,2024-03-09T06:46:25-07:00
11025344741,Bridgette is the name,https://itunes.apple.com/us/reviews/id21667616,2.146.0,5,Reluctant to Rejoicing,"OK, maybe rejoicing is a bit too much but I do really like the Shop app way more than I anticipated. I resisted downloading the app for a long time. So. many. apps. I can’t recall why I finally jumped in, but I was pleasantly surprised at how useful it is. I love having all of my delivery tracking and the notifications in one place. I also use the app to shop but that piece is limited still.",https://itunes.apple.com/us/review?id=1223471316&type=Purple%20Software,2024-03-09T05:25:46-07:00
11025308544,Omar Ladner,https://itunes.apple.com/us/reviews/id296151833,2.146.0,5,ABE NANO SOCKS,Best socks I’ve ever purchased,https://itunes.apple.com/us/review?id=1223471316&type=Purple%20Software,2024-03-09T05:14:39-07:00
11025056460,Adam llc,https://itunes.apple.com/us/reviews/id636428124,2.146.0,1,35% overpriced,35% overpriced in all items in market!,https://itunes.apple.com/us/review?id=1223471316&type=Purple%20Software,2024-03-09T03:51:33-07:00
11024213463,CJGJCS,https://itunes.apple.com/us/reviews/id104528679,2.146.0,5,Best case for my needs.,Awesome every detail as advertised. Get one!,https://itunes.apple.com/us/review?id=1223471316&type=Purple%20Software,2024-03-08T22:08:51-07:00
11024133353,Steph123p,https://itunes.apple.com/us/reviews/id861188706,2.146.0,1,Straw topper,I was really disappointed of my order. I paid $21. For the straw topper. It definitely was not worth it. It took over a month to receive it. I will not be buying anything else plus I will tell my friends not to order from this site.,https://itunes.apple.com/us/review?id=1223471316&type=Purple%20Software,2024-03-08T21:32:09-07:00
11023739739,meriheart,https://itunes.apple.com/us/reviews/id250394530,2.146.0,5,Feet for sewing machines,Love them,https://itunes.apple.com/us/review?id=1223471316&type=Purple%20Software,2024-03-08T18:45:28-07:00
11023334964,Txskid94,https://itunes.apple.com/us/reviews/id1369652733,2.146.0,5,Kimes mystery hat box,Was worth it completely,https://itunes.apple.com/us/review?id=1223471316&type=Purple%20Software,2024-03-08T16:04:31-07:00
11023237324,JimmyG914,https://itunes.apple.com/us/reviews/id211978099,2.146.0,5,Shop is so EASY,That is so easy to use and it’s so fast!,https://itunes.apple.com/us/review?id=1223471316&type=Purple%20Software,2024-03-08T15:23:38-07:00
11023078884,oleskooldunk,https://itunes.apple.com/us/reviews/id589457098,2.146.0,5,Coon Hunter,Great Service,https://itunes.apple.com/us/review?id=1223471316&type=Purple%20Software,2024-03-08T14:15:41-07:00
11022961396,Mr me too!,https://itunes.apple.com/us/reviews/id1556118667,2.146.0,5,Dopeness!,Great in every way. Appreciate the service!,https://itunes.apple.com/us/review?id=1223471316&type=Purple%20Software,2024-03-08T13:25:29-07:00
11022911047,dee383,https://itunes.apple.com/us/reviews/id517090197,2.146.0,1,Horrible,Got the box with no sunglasses inside.  Empty eyeglass container,https://itunes.apple.com/us/review?id=1223471316&type=Purple%20Software,2024-03-08T13:04:18-07:00
11022886382,Frany the fab,https://itunes.apple.com/us/reviews/id490300839,2.146.0,5,Omg,I’m so happy this bliss will last 30 seconds,https://itunes.apple.com/us/review?id=1223471316&type=Purple%20Software,2024-03-08T12:53:48-07:00
11022882637,QB247,https://itunes.apple.com/us/reviews/id770348822,2.146.0,5,Absolutely amazing,It looks so natural and like my own hair. Right out the box as promised. I look good 😌,https://itunes.apple.com/us/review?id=1223471316&type=Purple%20Software,2024-03-08T12:52:15-07:00
11022871086,Negra 76,https://itunes.apple.com/us/reviews/id909037455,2.146.0,5,Satisfied,I love it it was really quick I’ll definitely recommend ya,https://itunes.apple.com/us/review?id=1223471316&type=Purple%20Software,2024-03-08T12:47:16-07:00
11022827880,KaylaC.14,https://itunes.apple.com/us/reviews/id330156826,2.146.0,1,Boho so slow,Ordered two dresses from Boho.  Took over 3 weeks to arrive. There was NO shipping details available at time of ordering I wouldn't have bothered. What possibly takes three weeks to ship these days and the dresses did not fit to size. Too small will never order from Boho again.,https://itunes.apple.com/us/review?id=1223471316&type=Purple%20Software,2024-03-08T12:29:12-07:00
11022822029,georgiab1949,https://itunes.apple.com/us/reviews/id912136626,2.146.0,4,Shop is great but no phone app,I like the app on my IPad but I cannot get an app for it on my phone.,https://itunes.apple.com/us/review?id=1223471316&type=Purple%20Software,2024-03-08T12:26:46-07:00