id,userName,userUrl,version,score,title,text,url,updated
10754903443,ليندل,https://itunes.apple.com/us/reviews/id241448911,23.50,5,My experience,"Great app and all Airbnb support and Ambassadors are amazing, knowingly will solve any issue and continuously contact me till the matter is solved",https://itunes.apple.com/us/review?id=401626263&type=Purple%20Software,2023-12-28T06:23:17-07:00
10753331350,Combo2023,https://itunes.apple.com/us/reviews/id1517364808,23.50,1,Air bnb invaded my privacy,Everything about you and your information is not safe with airbnb total fraud,https://itunes.apple.com/us/review?id=401626263&type=Purple%20Software,2023-12-27T20:20:59-07:00
10753169632,wesbanco ruined the app,https://itunes.apple.com/us/reviews/id1272529765,23.50,1,Cleaning fees?,Why am i expected to clean the room and pay 200 dollars for a cleaning fee. Trash app,https://itunes.apple.com/us/review?id=401626263&type=Purple%20Software,2023-12-27T19:16:23-07:00
10752889263,PAssword@23,https://itunes.apple.com/us/reviews/id732140141,23.50,2,Advertised price not even close real final price,Show the full price up front and quit wasting peoples’ time by advertising a low nightly rate when the real rate is often 250% more due to arbitrary fees.,https://itunes.apple.com/us/review?id=401626263&type=Purple%20Software,2023-12-27T17:28:14-07:00
10750950478,Dan Washington d-c,https://itunes.apple.com/us/reviews/id32728226,23.50,1,Horrible stays,"Booked a three day stay on airbnb, first time trying this in NYC. The host was horrible and locked us out, and airbnb wouldn’t refund anything. Had to get a last minute hotel in the middle of winter.

Hotels are there for a reason. Don’t try airbnb unless you are prepared to lose all your money.",https://itunes.apple.com/us/review?id=401626263&type=Purple%20Software,2023-12-27T06:24:30-07:00
10749162158,Befreereview123,https://itunes.apple.com/us/reviews/id1591646366,23.50,1,Feels like a scam,"How amazing and horrible experiences with the private hosts wouldn’t be it still can’t change the fact that Airbnb’s help center is useless.
Every communication with the support is painful and it feels just easier to switch to another platform even if it’s more expensive or has worse listings just because it feels extremely unsafe to book anything with Airbnb knowing that your are on your own if any issue occurs. My last communication with the support staff included name calling, rude unprofessional style of communication and it took me three tries to finally make it clear for them what was my question about. And still I wasn’t able to receive any useful response about my issue. 
The platform itself is developed very poorly and it’s really hard to find accommodation with such a little amount of filters. A lot of things feel like scam, like new accounts get lower service fees, comparing to other platforms that give you discounts if you stay with them longer and if you book more. 
In general very disappointing service however unfortunately other rental platforms are less popular and most hosts use Airbnb. It’s hard to find an alternative but still might be a better option .",https://itunes.apple.com/us/review?id=401626263&type=Purple%20Software,2023-12-26T18:54:33-07:00
10748239072,sergiokv,https://itunes.apple.com/us/reviews/id1352085230,23.50,1,Seguros Falsos,"Soy Anfitrion en Airbnb y me pasaron una multa por malos tratos de parte de un huésped.
Tengo el ticket de la multa y valor del cobro del gasto, los envié mediante un reclamo y aún Airbnb no me quiere reembolsar el dinero, sino que me indican que es el huésped quien debe pagarlo.
¡Los seguros de AIRBNB NO EXISTEN!",https://itunes.apple.com/us/review?id=401626263&type=Purple%20Software,2023-12-26T13:02:05-07:00
10747866901,Ash00b,https://itunes.apple.com/us/reviews/id114546779,23.50,4,Great app as host and guest w/ one major suggestion,"Have been hosting a year and also used as guest. Both interfaces are great. 

From host side, one major suggestion that would be a game changer is being able to block check-in and check-out for specific days, such as holidays, but not completely block so guests can reserve as part of a multi-day stay. This would be tremendous help to manage turnover.",https://itunes.apple.com/us/review?id=401626263&type=Purple%20Software,2023-12-26T10:51:36-07:00
10747221697,ijlentz,https://itunes.apple.com/us/reviews/id1020497455,23.50,1,New “high safety risks” restriction is ridiculous,"I’ve used air bnb for 6 years and have a 5 star rating from all the hosts I’ve had. 
I went to book an air bnb for 9 people in a place that fits 12.
I was blocked by air bnb from making this booking.
I messaged the host asking if they could override this and they responded “you’ll have to contact air bnb. we are unable to override them from our end. We would be happy to host you though!”
So… even though I have a PERFECT rating and the host wants to make money by having us stay at their place (the whole point of this app) air bnb is going to block me because they have “implemented restrictions that prevent guests from making reservations when the system detects that booking may present higher safety risks”
This is absolutely ridiculous to me. 
Air bnb also says “but you do still have options in finding another booking, as these restrictions don't apply to hotel or private room listings”
The whole reason I started staying at air bnbs is due to it being a bigger space with a kitchen and other amenities at a cheaper than hotels.
As a long time user, this is the first time I’ve reconsidered using air bnb ever again. I’ll be looking into other apps such as VRBO.",https://itunes.apple.com/us/review?id=401626263&type=Purple%20Software,2023-12-26T07:31:48-07:00
10745375153,Ashy8701,https://itunes.apple.com/us/reviews/id285615262,23.50,4,Unable to view inbox through the app,"Only works in the browser. I tried to report a problem, but I wasn’t able to select the options needed to complete it.",https://itunes.apple.com/us/review?id=401626263&type=Purple%20Software,2023-12-25T19:39:04-07:00
10744898019,Belladkca,https://itunes.apple.com/us/reviews/id87195962,23.50,3,Bugs in the system,"It won’t let me reply to a guest reviews on the app. Yet, it will on my husbands phone. I keeps saying to leave the guest a review even after it’s been done and published.",https://itunes.apple.com/us/review?id=401626263&type=Purple%20Software,2023-12-25T16:26:08-07:00
10744673011,Pep423,https://itunes.apple.com/us/reviews/id948927315,23.50,1,Still waiting on refund,Host cancelled my trip. Airbnb took my money and still has not refunded me. I need my refund to book another trip somewhere else.,https://itunes.apple.com/us/review?id=401626263&type=Purple%20Software,2023-12-25T14:51:45-07:00
10744220141,3omarshar8i,https://itunes.apple.com/us/reviews/id341937499,23.50,1,Worst support system,"My fiancé booked a room for us and I flew in before her to check in and set up. To my surprise I’ve found out that the host had amended the reservation without informing us and Airbnb support team was useless and they did not fix the issue nor did they help. They claim that since I’m the second guest and not the “main guest” they can’t help or do anything about it. Why have the option to add a second guest on the reservation? Why can’t Airbnb be more reliable and helpful? Why do they have crooks on their app?!!! 
Btw, properties listed on Airbnb are more expensive than they really are.",https://itunes.apple.com/us/review?id=401626263&type=Purple%20Software,2023-12-25T11:53:43-07:00
10743328214,BM1800BLK,https://itunes.apple.com/us/reviews/id27090421,23.50,1,Scam Host,"Beware of Airbnb and the host on this app. I have booked a place on Christmas and the apartment smell like weed. When I complained the host denied to return my money and Airbnb refused to allow guest who paid money to leave a review. You are better off going to a hotel. The service fee they have in the place allow them to scam you out of money even when.

Be highly careful using this app. The Airbnb rep don’t resolve anything. They allow the host to dictate what the want and will put you and your family in danger.",https://itunes.apple.com/us/review?id=401626263&type=Purple%20Software,2023-12-25T07:01:56-07:00
10741641996,Zaviyar123,https://itunes.apple.com/us/reviews/id638686710,23.50,1,Worst app,I had some trouble at my  resorts. Things were not as described and Airbnb was no help at all this was the second time Airbnb was no help to me . I had worst experience using this app.,https://itunes.apple.com/us/review?id=401626263&type=Purple%20Software,2023-12-24T20:26:23-07:00
10740552657,Heushzbjxishw,https://itunes.apple.com/us/reviews/id359025922,23.50,2,This app drives me crazy,"I constantly have “1” number next to the app icon. It randomly shows that I have an unread message, or unseen notification or need to download a new version. And even if I finish all those side quest, there’s still that annoying “1” notification on app icon. 
I learn to ignored it, so it made me miss so many messages from host because it never changes the number of notifications whenever I have real messages waiting or not. 
Pls fix already, i have that issue for years.",https://itunes.apple.com/us/review?id=401626263&type=Purple%20Software,2023-12-24T12:52:15-07:00
10739212463,<<-Dom->>,https://itunes.apple.com/us/reviews/id262276562,23.50,3,"Decent service, bad UI","Service is good, but the UI is very bad on phones, with consistent popup ads for unrelated features, and menu bars consistently vanishing",https://itunes.apple.com/us/review?id=401626263&type=Purple%20Software,2023-12-24T05:45:07-07:00
10737965510,adiashsa,https://itunes.apple.com/us/reviews/id693081207,23.50,1,Left my family stranded due to racist policies,Denied my family the right to stay at a location due to the fact we’re primarily black.,https://itunes.apple.com/us/review?id=401626263&type=Purple%20Software,2023-12-23T22:08:20-07:00
10737487264,Reviewer_323,https://itunes.apple.com/us/reviews/id129168363,23.50,1,Ridiculous new rules,"I have enjoyed using Airbnb for years now, but their new rules are getting ridiculous. 

I went to book a stay for my friends and me recently and was told by Airbnb that it could not be booked because of the probability of an unauthorized party. 

Mind you, I have had great reviews at every stay over the last 5 years because my guests and I go out of our way to ensure we leave the homes as we found them. I understand trying to prevent parties, but why have homes that sleep 8+ people if you’re not going to allow people to book with that many guests? Make it make sense.",https://itunes.apple.com/us/review?id=401626263&type=Purple%20Software,2023-12-23T18:57:06-07:00
10737434738,Delilahdnjs,https://itunes.apple.com/us/reviews/id289311397,23.50,1,Unauthorized guests & no support,"Be careful if you are going to host through air bnb they do NOT support landlords and let guests do what they please at your home. We had a guest and they brought extra people and backed up our trash with their extra mess trash and no one helped us. They claim if and only if the guests wants to pay then one can get reimbursed. What kind of business is that!! Very bad business and no host support very biased and unfair. We have unlisted and just rented our home the traditional manner. Do not trust or let them brain wash you with all the 3rd world individuals they have as customer service is the worst I can barley understand what they are saying and if one wants to rebuttal or defend your self because everything will be a tug a war, well good luck! Everything is a struggle , fight and tedious endless trace of people you have to speak to and call. It’s impossible to get any help. BEWARE!",https://itunes.apple.com/us/review?id=401626263&type=Purple%20Software,2023-12-23T18:37:02-07:00
10737365850,inweho90069,https://itunes.apple.com/us/reviews/id796705121,23.50,1,Do not install this is app shady business,"This is a shady business if you book with them be cautious you will find out that people who post love to false advertise their Home ! 

Shady people run air bnb’s ! 
Air bnb employees are shady ! 
Do not install !!!",https://itunes.apple.com/us/review?id=401626263&type=Purple%20Software,2023-12-23T18:11:12-07:00
10735415055,AU55555,https://itunes.apple.com/us/reviews/id259007546,23.50,1,Tracks location,App tracks location even though I have not given it permission,https://itunes.apple.com/us/review?id=401626263&type=Purple%20Software,2023-12-23T06:49:58-07:00
10733719377,Oly999,https://itunes.apple.com/us/reviews/id308691180,23.50,1,Terrible customer support,"Customer for years and now not able to book. After over a week of using the chat, talking to reps, and the message service no resolution. Verified id entity, sent a selfie, waited 24 hours as suggested, tried four payment methods many times, and still no resolution. Worst customer support experience I’ve had.  Will move on to other services.",https://itunes.apple.com/us/review?id=401626263&type=Purple%20Software,2023-12-22T20:52:28-07:00
10733324591,suaidbdjskfiamfbId,https://itunes.apple.com/us/reviews/id1181626670,23.50,3,Fees are outrageous!,Cleaning fees and Airbnb fees have skyrocketed over the past few years. Would be better to include costs related to fees in the nightly price.,https://itunes.apple.com/us/review?id=401626263&type=Purple%20Software,2023-12-22T18:21:18-07:00
10732395317,Loyal User Quits Cold Turkey,https://itunes.apple.com/us/reviews/id264377269,23.50,1,Exploitative Hosts,"I have used airbnb since 2015, in numerous different countries. This month, I had a host message me with a sketchy link asking me to fill out my “Boarding Pass” to verify my identity, which I had never heard of. The hosts (beware of Salman, Luxana, Shane, & Shane if you’re in the Philadelphia, PA area) blatantly lied to me, saying that information would not be stored or used for any other purpose— a quick look into “Enso Connect” shows how untrue that is. They share all your information including banking/payment details with their “clients” and store it indefinitely in “Amazon Web Services.” When I reached out to Airbnb about this exploitative behavior— they did nothing to protect me or my trip, nor did they do anything to correct this behavior of the Hosts. If Airbnb already verifies my identity— why allow hosts to require their own verification, especially when it seems like I’m risking identity theft. After nearly ten years of happy airbnb usage, I’m saddened to delete the app, but am shocked and displeased by the lack of costumer support and protection.",https://itunes.apple.com/us/review?id=401626263&type=Purple%20Software,2023-12-22T12:26:40-07:00
10729283661,Reload25,https://itunes.apple.com/us/reviews/id116145750,23.50,1,Scammy practices by Airbnb,Was viewing a listing and refreshed the page. The price went up. I thought it was a bug so I refreshed again and the price went up again. Super scammy practices by Airbnb. Not sure I will book again. Be careful everyone.,https://itunes.apple.com/us/review?id=401626263&type=Purple%20Software,2023-12-21T18:46:40-07:00
10728121885,Jaspar77,https://itunes.apple.com/us/reviews/id37860453,23.50,1,Customer Service,"Unfortunately Airbnb has one of the most ineffective customer service departments that exist. If everything is ok with your reservation then there’s no issue. But if you ever have to get them involved it’s a total disaster:
A complete lack of effort every time.",https://itunes.apple.com/us/review?id=401626263&type=Purple%20Software,2023-12-21T11:37:43-07:00
10725521289,Yeamee,https://itunes.apple.com/us/reviews/id808857996,23.50,1,Events,App didn’t let me book for the days 30-1 due to them saying may lead to “unauthorized partying the home” while it was only for me and another person. Resham B. Was the person that did not help at all ! Thanks,https://itunes.apple.com/us/review?id=401626263&type=Purple%20Software,2023-12-20T21:31:55-07:00
10725236953,NotJalpy,https://itunes.apple.com/us/reviews/id276067456,23.50,1,Support?,"Absolutely worst customer support I’ve ever dealt with. I rarely judge a company by their support team and often overlook bad reviews when they discuss issues with support. But this has been absolutely crazy. 

Opened a support chat with them and was told responses usually take “a few minutes”. I received a response the next day at 5am. Their response simply asked for more information, I provided it to them, received my next response 9 hours later. We have been going back and forth for three days at this point receiving just about 2 messages back from them each day despite responding immediately on my end. 

If you’re willing to gamble, the app works fine. But if you run into ANY issues just know you’re screwed if it involves their support team.

I recommend taking your time and money elsewhere, there are plenty of airbnb competitors out there and often with identical properties.",https://itunes.apple.com/us/review?id=401626263&type=Purple%20Software,2023-12-20T19:42:31-07:00
10725097022,New guy to Airbnb,https://itunes.apple.com/us/reviews/id252745667,23.50,5,First time experience is excellent,Dealing with the Hosts has been excellent and they have been very responsive.,https://itunes.apple.com/us/review?id=401626263&type=Purple%20Software,2023-12-20T18:52:36-07:00
10724833332,boopyboy69,https://itunes.apple.com/us/reviews/id1055330837,23.50,1,Doesn’t make sense,Doesn’t make sense that a company this big hasn’t fixed some bugs in their map. Nah it’s not one star it’s more like 3.5 I just had to give a one to draw attention and drop the average. Map feature is frustrating to work with and there’s other bugs.,https://itunes.apple.com/us/review?id=401626263&type=Purple%20Software,2023-12-20T17:21:22-07:00
10724795969,123825177,https://itunes.apple.com/us/reviews/id367969393,23.50,1,Ripped off by Air B N B,"I got ripped off for cancelling a reservation 10 minutes after I requested to book it. The host took my $110 and wouldn’t refund me. When I called and asked to stay the night anyway and rebook like the host told me to air b n b was no help, they wouldn’t rebook it for me and told me I was out of luck if the host doesn’t refund me. Do yourself a favor and book a hotel that won’t rip you off. So after air b n b took my $110 and wouldn’t refund me OR let me stay at the place I PAID FOR, I had to book a $160 hotel. The cherry on top is that they won’t even let me give a negative review of the host because it wasn’t a “stay” since I cancelled.",https://itunes.apple.com/us/review?id=401626263&type=Purple%20Software,2023-12-20T17:08:34-07:00
10723172573,06Jt,https://itunes.apple.com/us/reviews/id728104316,23.50,1,Suppressing customer reviews,I recently stayed at a Swedish cottage in Lake Tahoe ( hosted by Debra) and my people in my party contracted PINK EYE and the host was super rude and intrusive. Therefore I left a review accurately describing my disgust with the place and the host then Airbnb called saying because she is a super host and only gets 5 stars they are going to remove my review! I would rather stay in my car then an Airbnb again!!,https://itunes.apple.com/us/review?id=401626263&type=Purple%20Software,2023-12-20T08:23:01-07:00
10722349483,YinzDave,https://itunes.apple.com/us/reviews/id1336640091,23.50,2,"Negative experience as a host, and as a traveler","I’ve had nothing but negative experiences with Airbnb. The company cannot be relied on to remedy issues for hosts, or for guests. I’ve had multiple instances of theft, insufficient, sleeping conditions… Damage… And the Airbnb company/help center in the app has been nothing more than a place to document this with no follow up.",https://itunes.apple.com/us/review?id=401626263&type=Purple%20Software,2023-12-20T04:57:56-07:00
10721360055,kaybarsla,https://itunes.apple.com/us/reviews/id85540011,23.50,1,A dangerous investment,Airbnb provided a copy and paste response to a life threatening issue.,https://itunes.apple.com/us/review?id=401626263&type=Purple%20Software,2023-12-19T23:36:52-07:00
10718632339,You gotta get.,https://itunes.apple.com/us/reviews/id215860406,23.50,1,Toxic hosts,Better hope you have a good host.,https://itunes.apple.com/us/review?id=401626263&type=Purple%20Software,2023-12-19T09:41:59-07:00
10717814474,Kilt50,https://itunes.apple.com/us/reviews/id359557890,23.50,4,Needs a no party / party allowed filter,Needs a filter to determine if property allows parties.,https://itunes.apple.com/us/review?id=401626263&type=Purple%20Software,2023-12-19T06:43:51-07:00
10715502623,Farvefan,https://itunes.apple.com/us/reviews/id85405504,23.50,2,App needs work,They try to pigeon hole you into certain things like you can’t just search for all rentals in x area. You have to choose beach house or hut or cabin. They also sway you towards the hosts they want. It’s frustrating,https://itunes.apple.com/us/review?id=401626263&type=Purple%20Software,2023-12-18T20:49:50-07:00
10714246942,FlwrGirl66x,https://itunes.apple.com/us/reviews/id1080266072,22.45.1,1,App fails on Apple,Unable to use my mobile device to access the app which defeats the purpose of the app. App says update but no update available. Website options. Not very user friendly. Too bad.,https://itunes.apple.com/us/review?id=401626263&type=Purple%20Software,2023-12-18T16:11:44-07:00
10708594956,jeffygg,https://itunes.apple.com/us/reviews/id565821359,23.50,5,"Easy, fast, & good cancellation policy",What the title said,https://itunes.apple.com/us/review?id=401626263&type=Purple%20Software,2023-12-17T09:53:27-07:00
10705561992,WillTillz,https://itunes.apple.com/us/reviews/id85195066,23.50,1,Poor Customer Service,Customer service representatives do not speak English proficiently. We had a serious issue and we couldn’t get any help from the support. Please use people to actually speak English fluently it’s disrespectful to your customers.,https://itunes.apple.com/us/review?id=401626263&type=Purple%20Software,2023-12-16T18:32:34-07:00
10704935031,hokage sav,https://itunes.apple.com/us/reviews/id1165227724,23.50,1,If I could I’d give this 0 stars,Not only did they not issue me a refund because of a family death I had to cancel they didn’t even give me anything back for a refund. They took a whole week to talk to me about getting a refund only to tell me that I wouldn’t receive one because of the hosts policy. That is just horrible to do I paid alot of money for a place I didn’t even get to stay at. Never will I ever do business with shady organizations like this. I urge you folks to do the same. Especially if you have circumstances like mines with a family death and airbnb not giving you your money back.,https://itunes.apple.com/us/review?id=401626263&type=Purple%20Software,2023-12-16T15:20:42-07:00
10704864380,NotGio,https://itunes.apple.com/us/reviews/id1067472190,23.50,1,This app is Excrement.,Tried reserving a place for the first time in my life and I can’t because somehow I’m already flagged and every place I try to get is turning me down making me feel discriminated for my age or maybe race.,https://itunes.apple.com/us/review?id=401626263&type=Purple%20Software,2023-12-16T14:58:19-07:00
10703927934,Ojkingsom,https://itunes.apple.com/us/reviews/id515269366,23.50,1,Used to love it. Now it's ridiculous,I have never had an issue with Airbnb until recently. I have kept being denied being able to book and NOBODY KNOWS WHAT MY RESTRICTION IS. I keep being told to verify my identity and it's already verified. The last time I booked was 2021. Now this year I need a larger space to travel to a quick local destination and BOOM they think it's a party . It's kids and two chaperones. I'm over it no one is willing to understand in support and even the hosts that I was honest and intentional with are confused on why I can't book. It's SICKENING. Because now I have to try and book hotels rooms near a busy area which will cost way more. I'm disappointed and won't be using them until they fix that bug.,https://itunes.apple.com/us/review?id=401626263&type=Purple%20Software,2023-12-16T10:34:38-07:00
10703440429,Ripen234,https://itunes.apple.com/us/reviews/id1003552225,23.50,1,Fraudulent app and Fradulent host by BHANU,"I’m writing to warn everyone about Indian host in Kitchener, Ontario for Scamming of $318 and he was added by the support staff of Air BNB. The app should be blacklisted permanently. Imagine making full payments for six nights and mistakenly mixed up the date of arrival and The host refused to refund my money or change the date. Support staff of the Air BNB aided fraud and I demanded that BHANU a Homeowner be blacklist and asked to refund my money in full for not offering any services as agreed.",https://itunes.apple.com/us/review?id=401626263&type=Purple%20Software,2023-12-16T08:45:03-07:00
10701898826,andiiiiiiii94,https://itunes.apple.com/us/reviews/id1277728804,23.50,1,rude unwelcoming hosts,i found this app to be unfriendly and hostile especially with the hosts . they treat their home like as if it was a hotel when in all reality it’s not at all . the services they provide aren’t at all what a hotel does and they recently have started charging more than a hotel . this app is full of scammers and most listings are catfish . i would avoid and just do a hotel with proper service and reception x,https://itunes.apple.com/us/review?id=401626263&type=Purple%20Software,2023-12-16T03:36:37-07:00
