id,userName,userUrl,version,score,title,text,url,updated
11063317212,Tocablox:),https://itunes.apple.com/us/reviews/id1551731486,11.3.1,5,Maravilloso,Me encanta es súper buena para editar videos ya subí de seguidores por esta app me encanta 100/100 :),https://itunes.apple.com/us/review?id=1500855883&type=Purple%20Software,2024-03-19T16:14:47-07:00
11063298346,Inspirational Creations,https://itunes.apple.com/us/reviews/id676976737,11.3.1,5,The best edit app I know 10 out of 10,Easy to work with love it,https://itunes.apple.com/us/review?id=1500855883&type=Purple%20Software,2024-03-19T16:06:58-07:00
11063278947,Oreorhebunny,https://itunes.apple.com/us/reviews/id1620299913,11.3.1,5,So good for my YouTube videos!,So I make this for my YouTube videos and ITS SO GOOD highly recommended! Can you also subscribe to Oreorhebunny,https://itunes.apple.com/us/review?id=1500855883&type=Purple%20Software,2024-03-19T15:58:50-07:00
11063254867,Joey from Duval,https://itunes.apple.com/us/reviews/id1456053924,11.3.1,5,Review,CapCut is a frfr game changer!,https://itunes.apple.com/us/review?id=1500855883&type=Purple%20Software,2024-03-19T15:48:48-07:00
11063236922,37508246,https://itunes.apple.com/us/reviews/id1149225927,11.3.1,4,Melek,I don’t like the adds in it but it’s so good I love doing videos and stuff,https://itunes.apple.com/us/review?id=1500855883&type=Purple%20Software,2024-03-19T15:41:21-07:00
11063197206,Sofia likes the app!,https://itunes.apple.com/us/reviews/id1618490137,3.5.0,5,AMAZING APP,This is the best thing ever and matches my exact requierments!  Thanks so much for all the help my videos are so much better and i recomend this app so much! THIS APP RULESSS!!!!!,https://itunes.apple.com/us/review?id=1500855883&type=Purple%20Software,2024-03-19T15:24:49-07:00
11063186712,DanoMac2,https://itunes.apple.com/us/reviews/id115695615,11.3.1,5,Capcut is soo good,I love cap cut its all I need,https://itunes.apple.com/us/review?id=1500855883&type=Purple%20Software,2024-03-19T15:20:29-07:00
11063184267,vanv1111,https://itunes.apple.com/us/reviews/id213144385,11.3.1,5,Using Pro for almost a year,Very easy app to use. It can create some amazing content very easily. Highly recommend.,https://itunes.apple.com/us/review?id=1500855883&type=Purple%20Software,2024-03-19T15:19:27-07:00
11063094429,#crazymegs,https://itunes.apple.com/us/reviews/id649041962,11.3.1,5,Download it,It’s good,https://itunes.apple.com/us/review?id=1500855883&type=Purple%20Software,2024-03-19T14:41:53-07:00
11063085454,Erika☝🏻🤨,https://itunes.apple.com/us/reviews/id1636194121,11.3.1,5,Should download,Such a good app 10/10,https://itunes.apple.com/us/review?id=1500855883&type=Purple%20Software,2024-03-19T14:38:12-07:00
11063062419,Mizuki Yamazaki,https://itunes.apple.com/us/reviews/id929888897,11.3.1,3,Love the app but…,"I have been using capcut for the past 3-4 years now, I have always love the effects and cool animations I was able to use. But ever since capcut pro had been released most of the effects I used to use aren’t available to me. As a younger being with strict parents, I am not willing to ask them to pay for something online.",https://itunes.apple.com/us/review?id=1500855883&type=Purple%20Software,2024-03-19T14:28:38-07:00
11063053482,Ethan MT,https://itunes.apple.com/us/reviews/id1283001455,11.3.1,4,It do be good,Edit good for free fr,https://itunes.apple.com/us/review?id=1500855883&type=Purple%20Software,2024-03-19T14:24:53-07:00
11063042844,Djgabrielveloza,https://itunes.apple.com/us/reviews/id245950877,11.3.1,5,Excelente herramienta,Nice,https://itunes.apple.com/us/review?id=1500855883&type=Purple%20Software,2024-03-19T14:20:33-07:00
11063040215,A person...?!,https://itunes.apple.com/us/reviews/id1242624676,11.3.1,5,It is a fun editing app,It is a great thing to use instead of TikTok and I am super happy it is here,https://itunes.apple.com/us/review?id=1500855883&type=Purple%20Software,2024-03-19T14:19:28-07:00
11063011575,ice cream is the yeyyeeyey,https://itunes.apple.com/us/reviews/id784820185,11.3.1,5,I love this,Capcut an a amazing app but the thing is I can’t see my remakes and I use my face for some of my remakes so I’m kinds scared now so Imma maybe delete my templates that have my face and other ppls faces so ya I wanna see my remakes capcut but Amazing App so far but the data part kinda scares me,https://itunes.apple.com/us/review?id=1500855883&type=Purple%20Software,2024-03-19T14:07:39-07:00
11062985187,UwU kitty meow,https://itunes.apple.com/us/reviews/id1637285604,11.3.1,5,It’s just good,I just like it,https://itunes.apple.com/us/review?id=1500855883&type=Purple%20Software,2024-03-19T13:56:54-07:00
11062972286,lonucoolg957,https://itunes.apple.com/us/reviews/id1484062152,11.3.1,5,I love it,It is cool,https://itunes.apple.com/us/review?id=1500855883&type=Purple%20Software,2024-03-19T13:51:41-07:00
11062971669,Walkerscobellswifeeee,https://itunes.apple.com/us/reviews/id1637284381,11.3.1,4,It has a lot of glitches,I like it and I use it to edit a lot but sometimes it doesn’t let me import clips and that gets me a little mad but other then that it’s pretty good! There’s just a couple bug I think they could fix!,https://itunes.apple.com/us/review?id=1500855883&type=Purple%20Software,2024-03-19T13:51:25-07:00
11062940793,eli or rose,https://itunes.apple.com/us/reviews/id946810415,11.3.1,5,YouTuber feedback :D,I used capcut to edit and make most of my videos on YouTube so I’m glad to write this feedback about the app :),https://itunes.apple.com/us/review?id=1500855883&type=Purple%20Software,2024-03-19T13:38:53-07:00
11062935423,ᴀᴜᴅʀᴇʏ ᴡ,https://itunes.apple.com/us/reviews/id1341344844,11.3.1,5,Amazing!,"Capcut is where I make all of my edits and they are all super good! After a long day, go to capcut to make some edits to calm me down. This app is definitely recommended!",https://itunes.apple.com/us/review?id=1500855883&type=Purple%20Software,2024-03-19T13:36:41-07:00
11062921142,ههففل,https://itunes.apple.com/us/reviews/id903930445,11.3.1,5,شكرا كاب كات,شكرا لكم جميعا,https://itunes.apple.com/us/review?id=1500855883&type=Purple%20Software,2024-03-19T13:30:50-07:00
11062908198,han of Rebootedpoppy,https://itunes.apple.com/us/reviews/id1445439285,11.2.1,5,Omg I love this app,I am a new YouTuber then my friend told me about CapCut and I have been creating so good edits but I need pro for most of them which is okay but as I said it is amazing I been using this app to make gacha edits roblox edit and much more and about the war against the most popular editors I support both so yeah,https://itunes.apple.com/us/review?id=1500855883&type=Purple%20Software,2024-03-19T13:25:38-07:00
11062902384,saylorthebeast,https://itunes.apple.com/us/reviews/id1440464148,10.4.1,5,My best,My best app by far,https://itunes.apple.com/us/review?id=1500855883&type=Purple%20Software,2024-03-19T13:23:19-07:00
11062875793,....olijtduufyd,https://itunes.apple.com/us/reviews/id1460241988,11.1.1,5,Rate,Too much fun,https://itunes.apple.com/us/review?id=1500855883&type=Purple%20Software,2024-03-19T13:12:41-07:00
11062827883,B00bÿ,https://itunes.apple.com/us/reviews/id1578310394,11.3.1,5,CapCut,CapCut is great way to make edits and is a good app and has helped me in many ways,https://itunes.apple.com/us/review?id=1500855883&type=Purple%20Software,2024-03-19T12:54:00-07:00
11062804016,Chamber84,https://itunes.apple.com/us/reviews/id548024045,11.3.1,5,The Best!!,Absolutely love this app!! Wouldn’t know what to do without it. Please don’t change a thing!,https://itunes.apple.com/us/review?id=1500855883&type=Purple%20Software,2024-03-19T12:44:34-07:00
11062684469,coyboy676,https://itunes.apple.com/us/reviews/id1191352410,11.3.1,5,Yt,Been helping me with yt,https://itunes.apple.com/us/review?id=1500855883&type=Purple%20Software,2024-03-19T11:57:48-07:00
11062655535,justfsrt,https://itunes.apple.com/us/reviews/id663411675,11.3.1,5,grwat,good,https://itunes.apple.com/us/review?id=1500855883&type=Purple%20Software,2024-03-19T11:46:32-07:00
11062631586,Sammie#11,https://itunes.apple.com/us/reviews/id1208304040,11.3.1,4,CapCut,I love CapCut. It has everything. It just needs so many updates othersise it will glitch like crazy!,https://itunes.apple.com/us/review?id=1500855883&type=Purple%20Software,2024-03-19T11:37:11-07:00
11062568387,LeBron James.🥇,https://itunes.apple.com/us/reviews/id1191934157,11.3.1,5,Nice,This is a perfect website for sick edits,https://itunes.apple.com/us/review?id=1500855883&type=Purple%20Software,2024-03-19T11:13:04-07:00
11062558267,Cha0s__,https://itunes.apple.com/us/reviews/id1631531066,11.3.1,5,Nice app you got there,Good job 👍,https://itunes.apple.com/us/review?id=1500855883&type=Purple%20Software,2024-03-19T11:09:11-07:00
11062520899,Fay alshimmary,https://itunes.apple.com/us/reviews/id1597306468,11.3.1,5,Cup cut,My amazing app,https://itunes.apple.com/us/review?id=1500855883&type=Purple%20Software,2024-03-19T10:55:12-07:00
11062518900,The only one and Aries,https://itunes.apple.com/us/reviews/id1457929402,11.3.1,5,This is so fun,This is the best app better than TikTok and I mean that you can make your own CapCuts,https://itunes.apple.com/us/review?id=1500855883&type=Purple%20Software,2024-03-19T10:54:26-07:00
11062514576,Que Chulada d mujer,https://itunes.apple.com/us/reviews/id1463848091,11.3.1,5,Muy buena aplicación,Me encanta,https://itunes.apple.com/us/review?id=1500855883&type=Purple%20Software,2024-03-19T10:52:48-07:00
11062511775,Princessella53210,https://itunes.apple.com/us/reviews/id961373783,11.3.1,1,No,I hate this I’m sorry it takes so much space and I can’t delete it.,https://itunes.apple.com/us/review?id=1500855883&type=Purple%20Software,2024-03-19T10:51:45-07:00
11062475176,12345 mina,https://itunes.apple.com/us/reviews/id1564556408,11.3.1,5,♥️♥️😁😁,Nah I’m not joking it’s so good! It’s a live changer !! It’s so amazing I told my whole family members to download it!,https://itunes.apple.com/us/review?id=1500855883&type=Purple%20Software,2024-03-19T10:38:10-07:00
11062440212,PaoMasterChef,https://itunes.apple.com/us/reviews/id383020010,11.3.1,5,Thank you,Gracias,https://itunes.apple.com/us/review?id=1500855883&type=Purple%20Software,2024-03-19T10:25:23-07:00
11062432009,Lalayayay,https://itunes.apple.com/us/reviews/id1491781559,11.3.1,5,CapCut is the best app,I love CapCut it’s so much fun and cool,https://itunes.apple.com/us/review?id=1500855883&type=Purple%20Software,2024-03-19T10:22:27-07:00
11062430424,Thirty-one momma Brit,https://itunes.apple.com/us/reviews/id247008449,11.3.1,4,Awesome but needs work,Now I find this app very addicting and fun but it keeps asking me for storage all though I have deleted around 10 apps for CapCut. Yes I know I needed it but I only have like 4 apps left and it’s still asking for storage,https://itunes.apple.com/us/review?id=1500855883&type=Purple%20Software,2024-03-19T10:21:52-07:00
11062404828,I am Jaida,https://itunes.apple.com/us/reviews/id1487238046,11.3.1,5,Geat,Very easy to use with ultimate tools and it's very easy to use. I’ve made multiple perfect videos and I love CapCut.,https://itunes.apple.com/us/review?id=1500855883&type=Purple%20Software,2024-03-19T10:12:35-07:00
11062393710,NickieBear88,https://itunes.apple.com/us/reviews/id1419546696,11.3.1,5,Ty,Love it,https://itunes.apple.com/us/review?id=1500855883&type=Purple%20Software,2024-03-19T10:08:39-07:00
11062362707,Spider-Chels,https://itunes.apple.com/us/reviews/id968229183,11.3.1,5,A. Life. Saver.,I couldn’t not do my job without this!!,https://itunes.apple.com/us/review?id=1500855883&type=Purple%20Software,2024-03-19T09:57:38-07:00
11062312453,Yessivnailz,https://itunes.apple.com/us/reviews/id517384064,11.3.1,5,5 stars ‘,Literally the best app for easy & cool effects while exiting I truly enjoy all the things and options on this app !,https://itunes.apple.com/us/review?id=1500855883&type=Purple%20Software,2024-03-19T09:39:53-07:00
11062310581,JJ FCA,https://itunes.apple.com/us/reviews/id1637222876,11.3.1,5,Love it so much,Hahahahhqhah,https://itunes.apple.com/us/review?id=1500855883&type=Purple%20Software,2024-03-19T09:39:14-07:00
11062304233,Hanjoberg,https://itunes.apple.com/us/reviews/id499393699,11.3.1,1,It logged me out and now won’t let me back in,I pay for premium too. I logged on with my TikTok and now it redirects me to a webpage to re-login,https://itunes.apple.com/us/review?id=1500855883&type=Purple%20Software,2024-03-19T09:36:58-07:00
11062258546,Coupons are good,https://itunes.apple.com/us/reviews/id405037165,11.3.1,5,Great app,Thanks for sharing this app! Lots of fun!,https://itunes.apple.com/us/review?id=1500855883&type=Purple%20Software,2024-03-19T09:21:14-07:00
11062200402,Mandolinpower,https://itunes.apple.com/us/reviews/id298707187,11.3.1,5,Wonderfully easy,Love it. Simple and fun. Hard to beat this app for the beginner.,https://itunes.apple.com/us/review?id=1500855883&type=Purple%20Software,2024-03-19T09:01:37-07:00
11062192633,duonghung27061962,https://itunes.apple.com/us/reviews/id657643916,11.3.1,5,Ok,Ok,https://itunes.apple.com/us/review?id=1500855883&type=Purple%20Software,2024-03-19T08:58:59-07:00
11062165846,Madieve12,https://itunes.apple.com/us/reviews/id1208343591,11.3.1,5,CapCut,This app is an amazing app,https://itunes.apple.com/us/review?id=1500855883&type=Purple%20Software,2024-03-19T08:49:46-07:00
11062147358,Kaylee.steele,https://itunes.apple.com/us/reviews/id1637206270,11.3.1,5,CapCut is amazing,CapCut is amazing because it helps me with my TikTok account and I get so many likes and follows,https://itunes.apple.com/us/review?id=1500855883&type=Purple%20Software,2024-03-19T08:43:30-07:00