id,userName,userUrl,version,score,title,text,url,updated
11030072266,Chesapeake Nick,https://itunes.apple.com/us/reviews/id671751734,2024.10.1,5,My view of Reddit,"Generally speaking, I like it and have a lot of fun reading through the various posts. Unfortunately, I cannot post on a site called jokes because they say I haven’t posted enough elsewhere. That simply isn’t true but either way I can’t get in to post a joke.",https://itunes.apple.com/us/review?id=1064216828&type=Purple%20Software,2024-03-10T10:42:40-07:00
11030044996,Jcs8528,https://itunes.apple.com/us/reviews/id194451660,2024.10.1,1,Echo,Reddit is simply a left wing echo chamber.  Most of the users are obvious Chinese bot and it pushes a distinct narrative that all must obey or be banished.  The mods on reddit are basement dwelling nut jobs.  This app should be labeled as a DNC propaganda arm.,https://itunes.apple.com/us/review?id=1064216828&type=Purple%20Software,2024-03-10T10:33:44-07:00
11030038809,realmovieguy,https://itunes.apple.com/us/reviews/id36969622,2024.10.1,1,"Bad app, toxic community, power hungry mods","The entire experience of Reddit app and its community was awful.
Toxic communities with mods that abuse power for their own opinions and violate their own rules.
Cannot support a company that sets a system that produces toxic culture in nature",https://itunes.apple.com/us/review?id=1064216828&type=Purple%20Software,2024-03-10T10:31:46-07:00
11029865399,jrp_93,https://itunes.apple.com/us/reviews/id976758290,2024.10.1,3,Reddit,Please revert the comment button update that scrolls to the first comment,https://itunes.apple.com/us/review?id=1064216828&type=Purple%20Software,2024-03-10T09:36:15-07:00
11029690581,Definitely not a plant,https://itunes.apple.com/us/reviews/id184844014,2024.10.1,4,Not bad,"Sometimes formatting is annoying.  And the ads are terrible.  But so are the people so I can’t complain too much, I guess.  Once I made the top of the front page and another time I had the top rated comment in a single day.  That was rad.  I wish people liked me irl.",https://itunes.apple.com/us/review?id=1064216828&type=Purple%20Software,2024-03-10T08:43:12-07:00
11029129258,O1K.99,https://itunes.apple.com/us/reviews/id1623172687,2024.10.1,5,Goated,"Dis app is goated.Im 16,just got my new phone and installed it",https://itunes.apple.com/us/review?id=1064216828&type=Purple%20Software,2024-03-10T05:55:10-07:00
11029010466,chi_town_999,https://itunes.apple.com/us/reviews/id168783948,2024.10.1,1,Reddit Hates iPads,"Bugs bugs bugs. Reddit has destroyed the functionality of using Reddit on an iPad. The “Cards” view is way over sized, most “Cards” are so over sized they don’t even fit on the single screen.  And now with the latest update videos keep playing and stay unmuted after they are closed.  Each “new” update make Reddit less and less enjoyable.",https://itunes.apple.com/us/review?id=1064216828&type=Purple%20Software,2024-03-10T05:15:56-07:00
11028857019,Tapster0402,https://itunes.apple.com/us/reviews/id128886956,2024.10.1,2,Feature of the Newest Update Made the App Worse,"The new update made it so you swipe left while on a post to switch posts. On a post with more than one picture, you swipe left to see more pictures. I don’t want to randomly be looking at a different post when I’m trying to look at all the pictures on one post.",https://itunes.apple.com/us/review?id=1064216828&type=Purple%20Software,2024-03-10T04:21:38-07:00
11028740219,STR8SAV,https://itunes.apple.com/us/reviews/id479611668,2024.10.1,5,This app bans people for no reason,Delete reddit,https://itunes.apple.com/us/review?id=1064216828&type=Purple%20Software,2024-03-10T03:37:31-07:00
11028584895,Bojiden_balls,https://itunes.apple.com/us/reviews/id1382706952,2024.10.1,1,I just can’t,I’m banned again I haven’t been on Reddit in three days and somehow I’m banned Jesus man,https://itunes.apple.com/us/review?id=1064216828&type=Purple%20Software,2024-03-10T01:36:29-07:00
11028068685,iphoneUserNumber57,https://itunes.apple.com/us/reviews/id1254109220,2024.10.1,1,New gestures ruin the app,"Now a left swipe to leave images. How do you leave from the end of an album? You have to either scroll the whole way back, or use your other hand to hit the “x” in the top left corner. Also, swiping one further than the end of the album now takes you to a completely different post so seamlessly that you sometimes don’t even notice. Really insane change and terribly thought out. Makes the app near unusable.",https://itunes.apple.com/us/review?id=1064216828&type=Purple%20Software,2024-03-09T22:02:12-07:00
11028005169,RCosR,https://itunes.apple.com/us/reviews/id30201409,2024.10.1,1,Stop changing everything!!!!!!,"When I click on a thread that has 2 photos, STOP scrolling at the 2 PHOTOS!!! I don’t care about whatever thread that comes after. Jesus. Are all the devs (and CEO) that stupid??",https://itunes.apple.com/us/review?id=1064216828&type=Purple%20Software,2024-03-09T21:34:02-07:00
11027886573,nomoreasking,https://itunes.apple.com/us/reviews/id921243834,2024.10.1,5,Love it,I been looking for this all day since I got my new phone keep them coming I just wanna see some sites were penetration is going on in hot sex is jumping on love you give it a good work,https://itunes.apple.com/us/review?id=1064216828&type=Purple%20Software,2024-03-09T20:42:47-07:00
11027786486,Fiona aka dragontail,https://itunes.apple.com/us/reviews/id157982186,2024.10.1,1,Didn’t regret deleting my nearly 3-year old account!,"Let’s just say that it was a great thing that I finally had the willpower to delete this particular social media account just like I deleted several others! 

I should’ve deleted it when the communities went on strikes against the API changes on mid-2023! Thankfully, the disassociated posts and comments I made weren’t explicit or very controversial to the point of causing fights. They were merely harmless opinions on fictional media, relatable situations and close calls. I just up and left for my own sanity on March 2024! 

Best to stick to Instagram and Tumblr because at least the filtration is way better! And ppl there are much more friendly!",https://itunes.apple.com/us/review?id=1064216828&type=Purple%20Software,2024-03-09T20:01:27-07:00
11027484796,Chaosmouse,https://itunes.apple.com/us/reviews/id43180849,2024.10.1,1,Where to begin,"This app is full of bugs that the devs simply will not address since they’re more busy figuring out more ways to slurp up user data to sell for profit. 

Bugs include (these have been here for over a year btw):
-when tapping an image in your homepage, sometimes it opens 3 or 4 other threads behind what you actually clicked, often times playing audio from the videos in those background threads. 
-sometimes when closing a video the video continues to loop in the background with audio and cannot be stopped without closing the app completely, causing you to lose where you were in the thread/subreddit/whatever.

Reddit should just allow 3rd party apps again. There were free options that collect less data and actually worked.",https://itunes.apple.com/us/review?id=1064216828&type=Purple%20Software,2024-03-09T18:03:59-07:00
11027211209,themandan365,https://itunes.apple.com/us/reviews/id169590548,2024.10.1,5,Platform for common interests,I love that Reddit provides a community of specific interests where I can seek first hand experience or provide my own. Many subjects may be understood in theory but plays out differently in practice. I love being able to ask questions and answer others on Reddit. This is a platform that differs from others in that it is a place to interact with people regarding a particular subject matter.,https://itunes.apple.com/us/review?id=1064216828&type=Purple%20Software,2024-03-09T16:14:34-07:00
11027097286,alan 2076,https://itunes.apple.com/us/reviews/id425961613,2024.10.1,5,I love it,It’s one of the best apps .and you can find anything you want 👍,https://itunes.apple.com/us/review?id=1064216828&type=Purple%20Software,2024-03-09T15:26:48-07:00
11026859396,IHikinghalo,https://itunes.apple.com/us/reviews/id1512281884,2024.10.1,5,Funny and interesting,"A lot of the replies on some posts are hilarious, I like the AITA because it’s kinda juicy sometimes, kinda intriguing and it makes you think “what is wrong with some people” and then you can write the question, stretched out or just simple, in other words, this is an amazing app, 10/10! Would recommend!",https://itunes.apple.com/us/review?id=1064216828&type=Purple%20Software,2024-03-09T13:45:46-07:00
11026841425,Chalkness,https://itunes.apple.com/us/reviews/id231460568,2024.10.1,3,Update is moving backwards,"Why has Reddit changed the swiping gestures feature where when you swipe it takes you to a random post instead of moving to the next post on that page?? Especially when viewing a user’s posts, swiping will take you to a random post by someone else instead of the next post that user made, that doesn’t make sense.",https://itunes.apple.com/us/review?id=1064216828&type=Purple%20Software,2024-03-09T13:38:15-07:00
11026726966,yfctcfu kudou itu iltirrx,https://itunes.apple.com/us/reviews/id777710782,2024.10.1,5,Fvyvyvyvyvyvtvuobjv,Gyc rdtucyicfuciyc,https://itunes.apple.com/us/review?id=1064216828&type=Purple%20Software,2024-03-09T12:51:47-07:00
11026694510,Exastiken,https://itunes.apple.com/us/reviews/id274628098,2024.10.1,1,The lack of ability to hide religious ads really hurt the app’s user-friendliness,"The religious ads from accounts like /u/HeGetsUs are obnoxious and have such a forceful presence that they are shown to everyone regardless of the user’s personal religious affiliations. Other ad categories such as alcohol and gambling have preference toggles to hide those ads, but there is no such toggle for religion. This evident Christian ad supremacy hurts Reddit’s interactions with its users by sending incompatible yet alienating ads to the incorrect audience, and refusing to allow users to choose to hide ads they find offensive or antagonistic.",https://itunes.apple.com/us/review?id=1064216828&type=Purple%20Software,2024-03-09T12:39:00-07:00
11026687754,Dalim93,https://itunes.apple.com/us/reviews/id305037564,2024.10.1,1,"With every new release, they make the experience than before.","I'm always amazed at what they come up with to make the experience worse than before. 
Adding new steps to do simple things. Ridiculous. They need new product managers.",https://itunes.apple.com/us/review?id=1064216828&type=Purple%20Software,2024-03-09T12:36:20-07:00
11026451214,Literroy,https://itunes.apple.com/us/reviews/id33025752,2024.10.1,1,A worse experience than Reddit in Safari,"This app baffles me. It’s a worse experience to use than just going to the web version of Reddit in Safari. They don’t seem to have any interest in improving it. And they shut down all third-party apps, including many that worked much better than this, for what I can tell are purely arrogant and selfish reasons. They could have told third-party apps they had to deliver ads. They could have bought the apps and turned them into the official app. They could have hired the developers to improve their own app. Tons of choices. They picked the one that hurts their own users the most. Why? Frankly, it’s insulting. And now they’re really trying to go public with this level of disdain for their users?

At any rate, just use Reddit on the web. It works a lot better than this app does.",https://itunes.apple.com/us/review?id=1064216828&type=Purple%20Software,2024-03-09T11:07:44-07:00
11026065814,McCrispFlipdippyquardlongjohn,https://itunes.apple.com/us/reviews/id1443935823,2024.10.1,1,Unlawful bans,"I get permanently banned whenever I say who I politically prefer in a completely nonjudgmental way, simply just saying who I prefer and I get permanently banned",https://itunes.apple.com/us/review?id=1064216828&type=Purple%20Software,2024-03-09T08:59:04-07:00
11024808311,PhilosophicalBipolarDepression,https://itunes.apple.com/us/reviews/id103314839,2024.10.1,1,Out of control.,"Dystopian landscape of rampant bigotry, misinformation, minimal regulation, bare minimum news feed and timeline customizations, decrepit algorithm system bombarding the user with spam advertisements and corporate propaganda, scroll limit non-existent, snail's speed innovation, unpleasant to look at, its slow and the video player is like a wet noodle flailing around in a kids ball pit.",https://itunes.apple.com/us/review?id=1064216828&type=Purple%20Software,2024-03-09T02:16:50-07:00
11024688002,rheannajaime,https://itunes.apple.com/us/reviews/id1633470012,2024.10.1,4,Reddit,I enjoy using this social media app,https://itunes.apple.com/us/review?id=1064216828&type=Purple%20Software,2024-03-09T01:28:38-07:00
11024295878,Bob90000000,https://itunes.apple.com/us/reviews/id1364719528,2024.10.1,1,Change policy,Y’all need to change the policy I got permanently ban for no reason y’all said give warnings but didn’t even got a warning please change policy about voting anyone who reads this don’t download this app if you want get ban for no reasons if you do a appeals they won’t care about your appeals all the five stars they got are fake. So this app is trash don’t download very bad,https://itunes.apple.com/us/review?id=1064216828&type=Purple%20Software,2024-03-08T22:45:48-07:00
11024028800,Joe C131313,https://itunes.apple.com/us/reviews/id1358141693,2024.10.1,5,My Reddit Family,I see said the blind man!,https://itunes.apple.com/us/review?id=1064216828&type=Purple%20Software,2024-03-08T20:45:44-07:00
11023904795,acknice,https://itunes.apple.com/us/reviews/id168385128,2024.10.1,5,Awesome platform,"I love how people help each other instead of on Fb, you get sliced for asking a ?.",https://itunes.apple.com/us/review?id=1064216828&type=Purple%20Software,2024-03-08T19:52:24-07:00
11023815985,🪦😵🫦,https://itunes.apple.com/us/reviews/id1587229897,2024.10.1,3,Very disturbing in some ways,"Although this app can be used to find information, I have seen some disturbing videos of people k*lling themselves and blowing their heads off with shotguns.",https://itunes.apple.com/us/review?id=1064216828&type=Purple%20Software,2024-03-08T19:15:54-07:00
11023800271,ansjsjdjdjdjdnnd,https://itunes.apple.com/us/reviews/id163344575,2024.10.1,1,Bad UI,Garbage app. It literally needs to do 2 things allow you to read and allow you to type. Half the time while I'm typing a comment if the screen moves a tiny bit it just disappears and the only way to do anything is to discard the comment and exit out. They are more concerned with hiding their ads to look like content.,https://itunes.apple.com/us/review?id=1064216828&type=Purple%20Software,2024-03-08T19:09:34-07:00
11023791082,Wilcompa,https://itunes.apple.com/us/reviews/id299813806,2024.10.1,5,Riddled by leftists and by government disinfo agents. Other than that…great platform.,Riddled by leftists and by government disinfo agents. Other than that…great platform.,https://itunes.apple.com/us/review?id=1064216828&type=Purple%20Software,2024-03-08T19:05:55-07:00
11023741802,becausecriscan,https://itunes.apple.com/us/reviews/id39557210,2024.10.1,5,📝,👨🏾‍💻,https://itunes.apple.com/us/review?id=1064216828&type=Purple%20Software,2024-03-08T18:46:18-07:00
11023494997,Mr Numbus,https://itunes.apple.com/us/reviews/id517054987,2024.10.1,1,Much worse than the third party apps I am used to,Just as the title says. This app is so much worse than Apollo. Reddit in general has been on a steady decline since 2015 and the forced use of this app is a symptom. Bring back third party API access for free or a REASONABLE fee Bring back r/all including NSFW content. Stop bowing down to advertisers and the almighty dollar. I’m sure the IPO is going to make this all worse.,https://itunes.apple.com/us/review?id=1064216828&type=Purple%20Software,2024-03-08T17:09:02-07:00
11023253582,Don Glover7,https://itunes.apple.com/us/reviews/id111794735,2024.10.1,1,live sorting gone,"the removed the live comments, makes it annoying while watching live events and having to reload the thread.",https://itunes.apple.com/us/review?id=1064216828&type=Purple%20Software,2024-03-08T15:30:25-07:00
11023214154,shrug emoji,https://itunes.apple.com/us/reviews/id673587014,2024.10.1,2,Can't listen to music while scrolling,"No matter what I do, the second I open the app on my phone, my music playing through Spotify pauses. Swiping down to the control center and hitting play does nothing. It just pauses my music the moment I swipe the control center away. I've turned off autoplay (and turned it back on and then off again) and have gone through my settings multiple times on both Reddit and Spotify to make sure I'm not missing anything, but the issue still persists. 

The fastest way to get me to not use an app is to force pause my music. There doesn't even have to be any videos on the screen and it will still pause. It pauses in post comment sections too. It's ridiculous. I don't have this issue with any other app, which is why I believe the problem lies somewhere within Reddit's poor UI. Fix it.",https://itunes.apple.com/us/review?id=1064216828&type=Purple%20Software,2024-03-08T15:13:55-07:00
11023132600,nicuumuu,https://itunes.apple.com/us/reviews/id872382170,2024.10.1,4,Sorting by search by “new” is useless,Everything else is fine but when you sort by “new” the search gives you the most unrelated posts. You have to search through google to actually find the new and relevant posts because the search function within the app is so inaccurate,https://itunes.apple.com/us/review?id=1064216828&type=Purple%20Software,2024-03-08T14:38:52-07:00
11022757591,Grizhman,https://itunes.apple.com/us/reviews/id233812901,2024.10.1,1,Doesn’t respect preferences,"Even if you say no to allowing notifications, they will be turned on. Ridiculous that you have to go into iOS settings and disable notifications regardless of your answer. If you’re going to force notifications, why even ask?",https://itunes.apple.com/us/review?id=1064216828&type=Purple%20Software,2024-03-08T12:00:35-07:00
11022026932,Great!! BUT,https://itunes.apple.com/us/reviews/id406619267,2024.10.1,1,Moderators can ban you for no reason. Defeats the purpose of using reddit.,"You can be banned for absolutely no reason. I got restricted from a community for trying to bring someone’s confidence up. All my comment said was “I agree”. What’s the point of using this app if you can’t comment, or interact with the communities that interest you? You can even google it, people have been banned from communities that they haven’t even commented or liked. Moderators have too much power. You’re better off using something like Facebook.",https://itunes.apple.com/us/review?id=1064216828&type=Purple%20Software,2024-03-08T07:37:44-07:00
11021972116,Jhdyf,https://itunes.apple.com/us/reviews/id127955834,2024.10.1,1,Censored cesspool,Mods have unlimited power and can get you banned from the site after bullying you.,https://itunes.apple.com/us/review?id=1064216828&type=Purple%20Software,2024-03-08T07:20:10-07:00
11021880992,tim luccey,https://itunes.apple.com/us/reviews/id569571092,2024.10.1,1,Be aware of fake reviews of this app,"Everyone be aware that all the 5 star reviews are fake and are either made by the Reddit team themselves or a bot to boost their star count on the App Store, people get banned and silenced for absolutely no reason this site is horrible, there’s child P@rn R@pe and all kinds of nasty rancid stuff people post but when I report it, nothing happens but god for it I calm thes e people out and my comment goes agianst community guidelines and gets me banned permanently, I’m seeing plenty of false reviews about how “people talk a lot that’s cool, I think” like yea totally a real review from an actual Reddit user. Just be aware and read the 1-2 star reviews to actually decide if this app is for you",https://itunes.apple.com/us/review?id=1064216828&type=Purple%20Software,2024-03-08T06:51:47-07:00
11021816217,antonionorris,https://itunes.apple.com/us/reviews/id1154840540,2024.10.1,1,harassment,"i love that if your a teen using this app u can be sexually harassed or annoyed by reddit sights and can’t block them just like youtube, it’s almost like it’s sort of illegal hmmmm🧐🤔",https://itunes.apple.com/us/review?id=1064216828&type=Purple%20Software,2024-03-08T06:31:47-07:00
11021790007,Cephditoren,https://itunes.apple.com/us/reviews/id46082244,2024.10.1,1,Keeps removing features.,"Removed the feature to sort by top, hot, rising, or new in your personal feed and for the popular feed for some stupid reason.",https://itunes.apple.com/us/review?id=1064216828&type=Purple%20Software,2024-03-08T06:23:37-07:00
11021658379,gremus18,https://itunes.apple.com/us/reviews/id834183091,2024.10.1,1,They like to ban people,"The lowest form of life on Earth is a Reddit mod, that’s the sole point of their existence and they get a power trip by banning people over made up rules inconsistently applied towards people they don’t like. 

Beware that if someone doesn’t like you, they will report you to kids who will interpret something like “defending yourself in an attack) as “advocating violence” and permanently ban you. They also ban people over questing anything with transgender rights. A bunch of woke idiots run Reddit.",https://itunes.apple.com/us/review?id=1064216828&type=Purple%20Software,2024-03-08T05:42:48-07:00
11021487221,jsjajaiwoxooxod,https://itunes.apple.com/us/reviews/id621948095,2024.10.1,2,Frustrating UX,Buggy and borderline unusable. Worse with every update. Tweaks useless features nobody cares about. I miss Apollo m.,https://itunes.apple.com/us/review?id=1064216828&type=Purple%20Software,2024-03-08T04:48:18-07:00
11021282952,Itsl2,https://itunes.apple.com/us/reviews/id1588964528,2024.10.1,2,Trash update,"Barely works on iPad now, loads half the time and just spins the rest.",https://itunes.apple.com/us/review?id=1064216828&type=Purple%20Software,2024-03-08T03:37:24-07:00
11021263293,ajelllyfish,https://itunes.apple.com/us/reviews/id256734386,2024.10.1,1,Buggy updates,"App won’t load after the most recent update. My phone is fully updated and I even tried to delete and redownload the app, still won’t load any feed or content.",https://itunes.apple.com/us/review?id=1064216828&type=Purple%20Software,2024-03-08T03:30:09-07:00
11021241911,qwerty1234*8,https://itunes.apple.com/us/reviews/id36894663,2024.10.1,1,Wow incredibly buggy and slow,Latest update on iOS 17.4 the app moves at glacial pace 20 seconds to a minute to load comments and 4 to ten seconds to respond to clicks and taps basically non functional.,https://itunes.apple.com/us/review?id=1064216828&type=Purple%20Software,2024-03-08T03:21:59-07:00
11020763602,Seldom amused,https://itunes.apple.com/us/reviews/id100705464,2024.10.1,2,Force login,I hate having to for login to see stuff,https://itunes.apple.com/us/review?id=1064216828&type=Purple%20Software,2024-03-07T23:55:12-07:00
11020626096,Gouge had,https://itunes.apple.com/us/reviews/id507283814,2024.10.1,4,Reddit RCA - The Future Is Here,"If you don’t know, now ya know *****!

Search that, the title…

I told you. Don’t act naive when it hits hard.",https://itunes.apple.com/us/review?id=1064216828&type=Purple%20Software,2024-03-07T22:49:24-07:00