id,userName,userUrl,version,score,title,text,url,updated
10987424195,$moneygirlon,https://itunes.apple.com/us/reviews/id1398773898,6.0.240211,5,Not working,I need help making it download,https://itunes.apple.com/us/review?id=422689480&type=Purple%20Software,2024-02-27T20:02:27-07:00
10987292163,It_caveman,https://itunes.apple.com/us/reviews/id122178451,6.0.240211,1,Google broke iPad landscape with last update.,Google broke it now they need to fix it.,https://itunes.apple.com/us/review?id=422689480&type=Purple%20Software,2024-02-27T19:02:51-07:00
10986973265,Jakabin,https://itunes.apple.com/us/reviews/id1411434958,6.0.240211,5,Gmail feedback,"Gmail is a great way to set up an email as well as receive them quickly. My only wish is that a live person in customer service was more readily available, as well as one who has a dialect that understands what I’ve spoken, and one I can understand as well! Gmail is great for today and I don’t want any other email",https://itunes.apple.com/us/review?id=422689480&type=Purple%20Software,2024-02-27T16:47:56-07:00
10986782573,Tjaltz,https://itunes.apple.com/us/reviews/id10483055,6.0.240211,1,iPad version (6.0.24) crashes and locks up,"The Gmail ipad app used to work well, but then update (6.0.24xxxxx) came out and ruined it. It crashes, locks up, won’t allow you to get back to your inbox. Unusable on iPads right now. Reported the bugs several times, no response.",https://itunes.apple.com/us/review?id=422689480&type=Purple%20Software,2024-02-27T15:24:02-07:00
10986732494,Yaknorob,https://itunes.apple.com/us/reviews/id476764415,6.0.240211,5,Ron Boronkay POA,"Dana Peterson, Leah, and Illumifin’s Customer Service reps have been very helpful to me and my mother in handling my mom’s LTC policy. 

They were patient and pleasant during each call I made to set up my mother’s new claim. 

Good work.",https://itunes.apple.com/us/review?id=422689480&type=Purple%20Software,2024-02-27T15:02:07-07:00
10986728901,HnyBear,https://itunes.apple.com/us/reviews/id135918195,6.0.240211,1,Recent updates breaks notification previews,Just like the title says. Aft the most recent update it no longer shows a preview of the email in notifications it only says you’ve received a message.,https://itunes.apple.com/us/review?id=422689480&type=Purple%20Software,2024-02-27T15:00:33-07:00
10986409071,Pullamus Sullamus Maximus,https://itunes.apple.com/us/reviews/id411509438,6.0.240211,4,Too many ads!,Unbelievable amount of ads! I’ll change when I find a better service.,https://itunes.apple.com/us/review?id=422689480&type=Purple%20Software,2024-02-27T12:41:31-07:00
10986288523,Extreme Hurricane,https://itunes.apple.com/us/reviews/id1211112838,6.0.240211,5,Google,App is glitch and needs update,https://itunes.apple.com/us/review?id=422689480&type=Purple%20Software,2024-02-27T11:51:40-07:00
10986261686,DependableKen,https://itunes.apple.com/us/reviews/id379438058,6.0.240211,3,Newest updates don't show message preview,Pleae fix this.,https://itunes.apple.com/us/review?id=422689480&type=Purple%20Software,2024-02-27T11:40:45-07:00
10986260970,smmdnr,https://itunes.apple.com/us/reviews/id1035544910,6.0.240211,1,Poor customer service,Someone hacked my account. I have email recovery it didn’t let me do it! No it support!. No other way to get back the account. Can’t use Face ID because it’s offed,https://itunes.apple.com/us/review?id=422689480&type=Purple%20Software,2024-02-27T11:40:29-07:00
10986220944,Artyess,https://itunes.apple.com/us/reviews/id107498856,6.0.240211,3,Too much junk,"Too,too much junk",https://itunes.apple.com/us/review?id=422689480&type=Purple%20Software,2024-02-27T11:24:17-07:00
10985960765,fake_cleetus,https://itunes.apple.com/us/reviews/id1160188681,6.0.240211,3,My review,it’s okay,https://itunes.apple.com/us/review?id=422689480&type=Purple%20Software,2024-02-27T09:45:14-07:00
10985795562,bekhuda,https://itunes.apple.com/us/reviews/id40042729,6.0.240211,3,New version of Gmail app is malfunctioning,"If I open a message and try to hit the back button to go back to all of my emails, it will not respond.  If I hit the mail button at the bottom, it won’t respond.  I have to swipe up and clear the entire app in order to open it again, then I can get my mail.  I don’t know if this has to do with Apple’s new version 17 or the app itself.",https://itunes.apple.com/us/review?id=422689480&type=Purple%20Software,2024-02-27T08:46:35-07:00
10985506472,Maxim-100fuegos,https://itunes.apple.com/us/reviews/id1502221094,6.0.240211,5,Excelente Gmail,Imprescindibles los servicios de Gmail. EFICIENTES.,https://itunes.apple.com/us/review?id=422689480&type=Purple%20Software,2024-02-27T07:11:43-07:00
10985431174,Real Review God,https://itunes.apple.com/us/reviews/id1364883154,6.0.240211,1,Logging in,Since when is my email and my password not enough to verify it’s me. This is non sense I should not have to have a recovery account AND a phone number just to log in every time.,https://itunes.apple.com/us/review?id=422689480&type=Purple%20Software,2024-02-27T06:47:53-07:00
10985409599,Nsisbsi,https://itunes.apple.com/us/reviews/id349078299,6.0.240211,5,Service,Exceptional and professional service,https://itunes.apple.com/us/review?id=422689480&type=Purple%20Software,2024-02-27T06:41:17-07:00
10985033884,LI Icedt,https://itunes.apple.com/us/reviews/id295665110,6.0.240211,2,New update -Please fix,"Recent update occasionally when opening on ipad shows full web page view of email and unable to use go back button, only way to get rid of view is to close down program on open programs page on ipad. Tried uninstalling, reinstalling , same issue. Ipad 9th gen.",https://itunes.apple.com/us/review?id=422689480&type=Purple%20Software,2024-02-27T04:48:28-07:00
10985018506,bryvion,https://itunes.apple.com/us/reviews/id429197223,6.0.240211,5,Review,Great app I use it every morning and throughout the day at times I absolutely love how it gives us a scripture every day and also has someone to break the scripture down and interpret the word for us God Is Amazing GOD BLESS US ALL,https://itunes.apple.com/us/review?id=422689480&type=Purple%20Software,2024-02-27T04:43:58-07:00
10984979412,WarBuddha,https://itunes.apple.com/us/reviews/id955523732,6.0.240211,1,Broken,Latest update made it unusable.,https://itunes.apple.com/us/review?id=422689480&type=Purple%20Software,2024-02-27T04:30:36-07:00
10984718746,PO1 Coffee,https://itunes.apple.com/us/reviews/id1254171743,6.0.240211,5,Thank you!,Great work!,https://itunes.apple.com/us/review?id=422689480&type=Purple%20Software,2024-02-27T02:52:58-07:00
10984664744,nickel_ann_07,https://itunes.apple.com/us/reviews/id607620711,6.0.240211,1,Latest update,This most recent update has caused my app not to work. It doesn’t load at all. Just a loading screen the entire time.,https://itunes.apple.com/us/review?id=422689480&type=Purple%20Software,2024-02-27T02:29:31-07:00
10984337890,Maria G Rivera,https://itunes.apple.com/us/reviews/id1629404323,6.0.240211,1,Se me borro todo mi correo importante !,Que le pasa a Gmail ? Se me borraron todos mis correos importantes ! Ni en la pepelera aparecen 😖 QUE ESTA PASANDOOO ?,https://itunes.apple.com/us/review?id=422689480&type=Purple%20Software,2024-02-26T23:54:22-07:00
10984127380,OrangeBang74,https://itunes.apple.com/us/reviews/id15889672,6.0.240211,1,The latest version freezes,"Since the last update, Gmail sticks on an email, and won’t let me select a different email. All I can do is restart my iPad or uninstall and reinstall the app. Then I can see all my emails, but once I exit the app then go back to the app, it freezes up again.",https://itunes.apple.com/us/review?id=422689480&type=Purple%20Software,2024-02-26T22:06:57-07:00
10984012154,Djdhejhdbd,https://itunes.apple.com/us/reviews/id1341073809,6.0.240211,5,Hash,Mid,https://itunes.apple.com/us/review?id=422689480&type=Purple%20Software,2024-02-26T21:06:20-07:00
10983795273,123345778,https://itunes.apple.com/us/reviews/id1467894882,6.0.240211,5,Is good,Is good,https://itunes.apple.com/us/review?id=422689480&type=Purple%20Software,2024-02-26T19:19:12-07:00
10983352799,Trip at knight,https://itunes.apple.com/us/reviews/id1325318735,6.0.240211,5,"Amazing, truly.","I had to take some time out of my day to say, whoever thought about adding the track package deserves a round of applause. No seriously whoever you are your a genius and if it was thought up by a team, Bravo!",https://itunes.apple.com/us/review?id=422689480&type=Purple%20Software,2024-02-26T16:01:01-07:00
10983311365,"Angry, tall, Pete",https://itunes.apple.com/us/reviews/id1264367989,6.0.240211,1,Review,I can’t get back into my account dammit every time I try you guys aren’t sending me the codes I’m so sick and tired of this I can’t even watch my television so I’m not happy,https://itunes.apple.com/us/review?id=422689480&type=Purple%20Software,2024-02-26T15:41:39-07:00
10983235728,Rsdeye,https://itunes.apple.com/us/reviews/id203228805,6.0.240211,5,Thank you,Thank you,https://itunes.apple.com/us/review?id=422689480&type=Purple%20Software,2024-02-26T15:06:19-07:00
10982999496,blooolp,https://itunes.apple.com/us/reviews/id1117507439,6.0.240211,1,Doesn’t have an option to sort all emails by most recent,"This is the only feature that matters when it comes to email, to be able to find an email that you know exactly when you recieved it, who sent it, and its contents, yet good luck ever finding it because Google makes it as hard as they possibly can. Maybe if they stopped hiring mentally ill histrionic losers for their company, and found some actual coders, we’d actually have a functional app. Unfortunately Google has decided to be evil and I genuinely pray every night that every person who works there becomes homeless.",https://itunes.apple.com/us/review?id=422689480&type=Purple%20Software,2024-02-26T13:18:57-07:00
10982772512,gcdf TV b j,https://itunes.apple.com/us/reviews/id896486531,6.0.240211,1,Customer service,We set up an email account for my husbands Fitbit. After a few days it was deactivated. We sent an appeal and they said to get a code. When we tried to get the code it said the phone number had been used too many times. We have tried everything to get this settled. You can’t talk to a customer service representative about email. Now we have a Fitbit we can’t use and will have to return it. We are very unhappy with this situation. You would think a big company like this would have better customer service. After looking for ways to deal with this other people have had this problem also.,https://itunes.apple.com/us/review?id=422689480&type=Purple%20Software,2024-02-26T11:41:14-07:00
10982694617,rob_oconnor,https://itunes.apple.com/us/reviews/id42055071,6.0.240211,1,Update broke notifications,No longer able to see previews of messages on notification screens.,https://itunes.apple.com/us/review?id=422689480&type=Purple%20Software,2024-02-26T11:09:00-07:00
10982653669,Aubrey Garza,https://itunes.apple.com/us/reviews/id1222406294,6.0.240211,3,Not been able to chat,Gmail is pretty nice but recently I have not been able to chat people,https://itunes.apple.com/us/review?id=422689480&type=Purple%20Software,2024-02-26T10:52:18-07:00
10982617914,sitmike2,https://itunes.apple.com/us/reviews/id1256751200,6.0.240211,1,Stuck on open email - IOS bug,"If you open an email (IOS IPad app) that’s all you can see. It won’t go to other boxes or anything. Gmail for IOS keeps getting worse. Last year, they took away custom signatures now this.",https://itunes.apple.com/us/review?id=422689480&type=Purple%20Software,2024-02-26T10:37:49-07:00
10982613740,Howlingdog837,https://itunes.apple.com/us/reviews/id26057864,6.0.240211,2,Buggy,"Mobile device is iPad Pro with iOS 17.3.1.  Update: the last update installed on the iPad broke the app function for me.  It freezes and buttons are non responsive.  I have deleted and reinstalled the app multiple times. The iPhone version is working well though.  I have used the app for many years and enjoyed it, but this last issue has me shifting another direction.

Earlier this year:  This app crashes almost daily, plus the emails contents will disappear when clicked on. If the device is rebooted, then the email will appear and can be read, but the disappearing act will soon begin again. A frustrating app to use, these issues have been long standing.",https://itunes.apple.com/us/review?id=422689480&type=Purple%20Software,2024-02-26T10:36:07-07:00
10982538191,NNFMES,https://itunes.apple.com/us/reviews/id213125270,6.0.240211,1,Gmail has a major problem on my IPad Air 4th generation.,If I go to the right side to read an email I can’t go back to the left of the app without closing first.,https://itunes.apple.com/us/review?id=422689480&type=Purple%20Software,2024-02-26T10:06:29-07:00
10982314616,Síl3nt,https://itunes.apple.com/us/reviews/id403433508,6.0.240211,5,Great,Much better than stock mail app with instant push notifications,https://itunes.apple.com/us/review?id=422689480&type=Purple%20Software,2024-02-26T08:43:13-07:00
10981679839,DC FF,https://itunes.apple.com/us/reviews/id100447003,6.0.240211,1,24FEB2024 update broke the app,Very buggy and needs to be force closed since this week’s update.,https://itunes.apple.com/us/review?id=422689480&type=Purple%20Software,2024-02-26T05:08:02-07:00
10981436262,kennymig,https://itunes.apple.com/us/reviews/id300232677,6.0.240211,1,Update f-up?,"With latest update, whenever I open my minimized gmail, it opens in a previously viewed email and there is not way to get to the inbox without first closing the app and reopening.  FIX IT PLEASE",https://itunes.apple.com/us/review?id=422689480&type=Purple%20Software,2024-02-26T03:40:10-07:00
10981339737,ppppč,https://itunes.apple.com/us/reviews/id1207498155,6.0.240211,5,Бравл Старс,Я смогу по играть в бравл Старс,https://itunes.apple.com/us/review?id=422689480&type=Purple%20Software,2024-02-26T03:01:09-07:00
10980593197,TrapEseLos,https://itunes.apple.com/us/reviews/id1246269742,6.0.240211,5,What’s up Google,"Yo you continue to amaze me. You have so much stuff from Gmail to business graph charts and more. Yo am little speechless just thinking about what all you have put so much hard work and time into making life better on all playing fields. 

Thank you",https://itunes.apple.com/us/review?id=422689480&type=Purple%20Software,2024-02-25T20:51:05-07:00
10980482958,Tu marido el del braso de 35,https://itunes.apple.com/us/reviews/id1496321295,6.0.240211,5,Me gusta usar este apl,Es muy bueno con todo los informaciones muy claramente,https://itunes.apple.com/us/review?id=422689480&type=Purple%20Software,2024-02-25T19:55:53-07:00
10980324330,Archer_007,https://itunes.apple.com/us/reviews/id1518204345,6.0.240211,1,Doesn’t show notification in detail,From past couple weeks i get notifications but doesn’t shows email preview as it does before even it is unlocked and no settings are changed. Also sometimes hyperlink doesn’t open and work in emails. Please fix it asap.,https://itunes.apple.com/us/review?id=422689480&type=Purple%20Software,2024-02-25T18:41:28-07:00
10980308221,Jillanin,https://itunes.apple.com/us/reviews/id1489625148,6.0.240211,3,Hello,Update,https://itunes.apple.com/us/review?id=422689480&type=Purple%20Software,2024-02-25T18:34:21-07:00
10980274886,Wwlions1,https://itunes.apple.com/us/reviews/id1309439049,6.0.240211,3,MOBILE UPDATE MALFUNCTIONING,"I tried to contact support. That is a joke. 🤬 
The latest update will NOT UPDATE. 
It’s in a continuous loop. HELP ‼️‼️‼️",https://itunes.apple.com/us/review?id=422689480&type=Purple%20Software,2024-02-25T18:19:20-07:00
10980266584,Soaplovesdirty,https://itunes.apple.com/us/reviews/id671766268,6.0.240211,1,Turn notification previews back on,The latest update made the app a lot less useful since you’re forcing the user to open the app in order to read an email…I use the notification preview function to determine which emails I need to respond to and I don’t need any “assistance” from the app,https://itunes.apple.com/us/review?id=422689480&type=Purple%20Software,2024-02-25T18:15:35-07:00
10979906855,BC Traveler,https://itunes.apple.com/us/reviews/id158360730,6.0.240211,3,It’s upside down,Why is the newest email on the bottom of the string & is there a way to put it on top like outlook?,https://itunes.apple.com/us/review?id=422689480&type=Purple%20Software,2024-02-25T15:31:29-07:00
10979526313,technological progress myth,https://itunes.apple.com/us/reviews/id1160166498,6.0.240211,1,Gmail app sends a email verification to gmail?,"How can I verify gmail when I am already in the app 
It’s a stupid verification process 
But Gmail won’t update it’s verification process 
Idiots!!!",https://itunes.apple.com/us/review?id=422689480&type=Purple%20Software,2024-02-25T12:45:50-07:00
10979127727,oscarguedezdrums,https://itunes.apple.com/us/reviews/id842432249,6.0.240211,5,Great,Good,https://itunes.apple.com/us/review?id=422689480&type=Purple%20Software,2024-02-25T10:16:08-07:00
10978989384,laslow10,https://itunes.apple.com/us/reviews/id135113222,6.0.240211,2,You Have a New Message,"Here lately, every time this app needs the teeniest update, all the notifications will read “You Have a New Message” and won’t actually preview until after you’ve updated. It’s really irksome and so irritating I’m about to switch email providers if it happens again. If I didn’t want to preview the email, I would have specified that in the settings, but for some reason Google has taken it upon themselves to make emails even more unbearable than they already are. Thank you for spending millions of dollars to be worse.",https://itunes.apple.com/us/review?id=422689480&type=Purple%20Software,2024-02-25T09:28:59-07:00
10978893337,James White lll,https://itunes.apple.com/us/reviews/id1628867183,6.0.240211,5,It within the touch of your finger,I’m  so organized now. Unbelievable.,https://itunes.apple.com/us/review?id=422689480&type=Purple%20Software,2024-02-25T08:57:14-07:00