id,userName,userUrl,version,score,title,text,url,updated
11056732079,whotookDuneCune,https://itunes.apple.com/us/reviews/id387460404,3.605.10000,5,Godly drivers,This man I drove with was a,https://itunes.apple.com/us/review?id=368677368&type=Purple%20Software,2024-03-17T19:14:37-07:00
11056711292,Sal Gal 2,https://itunes.apple.com/us/reviews/id211556951,3.605.10000,5,Safe trip home,Sam was great,https://itunes.apple.com/us/review?id=368677368&type=Purple%20Software,2024-03-17T19:05:31-07:00
11056683957,Uppwr,https://itunes.apple.com/us/reviews/id423140932,3.605.10000,5,Left phone,The driver brought my phone back!! Thanks,https://itunes.apple.com/us/review?id=368677368&type=Purple%20Software,2024-03-17T18:53:27-07:00
11056660442,3332345,https://itunes.apple.com/us/reviews/id1196760478,3.605.10000,1,pure negligence,DO NOT USE THIS APP,https://itunes.apple.com/us/review?id=368677368&type=Purple%20Software,2024-03-17T18:43:09-07:00
11056623863,Eric the tattoo man,https://itunes.apple.com/us/reviews/id684924508,3.605.10000,5,How I feel,Uber is the best,https://itunes.apple.com/us/review?id=368677368&type=Purple%20Software,2024-03-17T18:27:18-07:00
11056620173,La narga,https://itunes.apple.com/us/reviews/id1391699710,3.605.10000,2,Tengo muchos problemas con sus conductores ladrones,Cada ves tengo problemas con sus conductores porque la aplicación dice un precio y ellos le quieren cobrar más de ese precio y cuando uno le dice que no tiene más que cancelen no cancelan de maldad y tengo que llegar tarde a mi trabajo,https://itunes.apple.com/us/review?id=368677368&type=Purple%20Software,2024-03-17T18:25:41-07:00
11056609703,Gigi’s62,https://itunes.apple.com/us/reviews/id1280603391,3.605.10000,5,Uber ride,Randall was very friendly and a good driver.,https://itunes.apple.com/us/review?id=368677368&type=Purple%20Software,2024-03-17T18:21:04-07:00
11056609549,Gfy2024,https://itunes.apple.com/us/reviews/id1424432528,3.605.10000,1,I got robbed by Uber . I never made a mess whatsoever.,$162 for a 5 minute ride ?! No picture on his account now?,https://itunes.apple.com/us/review?id=368677368&type=Purple%20Software,2024-03-17T18:21:00-07:00
11056573826,Stephlovesgames11,https://itunes.apple.com/us/reviews/id419113037,3.605.10000,5,Awesome ride,Great ride! Safe and friendly. Thank you,https://itunes.apple.com/us/review?id=368677368&type=Purple%20Software,2024-03-17T18:05:30-07:00
11056563708,gtbhyujmq,https://itunes.apple.com/us/reviews/id29990696,3.605.10000,5,Awesome driver,"He did awesome job, and I am so thankful for him being here at my time of need",https://itunes.apple.com/us/review?id=368677368&type=Purple%20Software,2024-03-17T18:01:11-07:00
11056559196,FuxSultan,https://itunes.apple.com/us/reviews/id33112098,3.605.10000,5,Reliability,Uber has your back.,https://itunes.apple.com/us/review?id=368677368&type=Purple%20Software,2024-03-17T17:59:17-07:00
11056532820,U can't Hendel the Truth,https://itunes.apple.com/us/reviews/id34857831,3.605.10000,1,Waited over 20 minutes for a ride Sunday afternoon in LA,Drivers kept canceling on me. I have a 4.84 Uber rating.,https://itunes.apple.com/us/review?id=368677368&type=Purple%20Software,2024-03-17T17:47:46-07:00
11056508729,ran2371!,https://itunes.apple.com/us/reviews/id1628876216,3.605.10000,5,Great driver,Thank you so very much for getting my wife home safe and sound . Your highly recommended by us!!!,https://itunes.apple.com/us/review?id=368677368&type=Purple%20Software,2024-03-17T17:37:09-07:00
11056493493,nickname567821fgl6,https://itunes.apple.com/us/reviews/id241541861,3.605.10000,5,Helpless in Como,Maurizio saved us. The trains and buses where not running and the four of us needed a ride to como. Maurizio was the knight to save us at midnight Sunday and took us to the hotel. He is a wonderful driver and a great person as well.  Thank you again Maurizio.,https://itunes.apple.com/us/review?id=368677368&type=Purple%20Software,2024-03-17T17:30:35-07:00
11056487011,DevikaG,https://itunes.apple.com/us/reviews/id11369497,3.605.10000,5,Driving was excellent!!,I would love to request this driver again.,https://itunes.apple.com/us/review?id=368677368&type=Purple%20Software,2024-03-17T17:27:49-07:00
11056466081,Rtggvb,https://itunes.apple.com/us/reviews/id488386772,3.605.10000,3,Uber app is lame.,My Uber keeps saying “dismiss”.,https://itunes.apple.com/us/review?id=368677368&type=Purple%20Software,2024-03-17T17:18:48-07:00
11056436719,Bruinbuddy,https://itunes.apple.com/us/reviews/id541918228,3.605.10000,5,Great driver!,Very clean and comfortable car. Very friendly.,https://itunes.apple.com/us/review?id=368677368&type=Purple%20Software,2024-03-17T17:06:06-07:00
11056431977,Magda #1,https://itunes.apple.com/us/reviews/id895316471,3.605.10000,5,Nick was awesome,Nick is the nicest person.,https://itunes.apple.com/us/review?id=368677368&type=Purple%20Software,2024-03-17T17:04:03-07:00
11056363160,sinxsd,https://itunes.apple.com/us/reviews/id1155792256,3.605.10000,5,Good Uber driver,Nice car friendly driver can't really ask for more,https://itunes.apple.com/us/review?id=368677368&type=Purple%20Software,2024-03-17T16:33:52-07:00
11056344011,chulis Snakis,https://itunes.apple.com/us/reviews/id617308127,3.605.10000,5,Driver Ricky Very Pleasant,Driver arrived early..very clean car and overall a nice person. Thank you Ricky!!,https://itunes.apple.com/us/review?id=368677368&type=Purple%20Software,2024-03-17T16:25:39-07:00
11056330947,Two suburban chicks,https://itunes.apple.com/us/reviews/id907783713,3.605.10000,5,Leslie,"Leslie was great, clean car, soft music… very nice!",https://itunes.apple.com/us/review?id=368677368&type=Purple%20Software,2024-03-17T16:20:00-07:00
11056329808,elpotrillorm,https://itunes.apple.com/us/reviews/id220672869,3.605.10000,5,Driver,Our driver was such a nice guy very informative,https://itunes.apple.com/us/review?id=368677368&type=Purple%20Software,2024-03-17T16:19:30-07:00
11056324207,Salahudin67,https://itunes.apple.com/us/reviews/id666320790,3.605.10000,1,I need to speak to someone!,"I’ve been charged additional money for whatever purpose I don’t know, and I would like for somebody to contact me so we can come to a conclusion",https://itunes.apple.com/us/review?id=368677368&type=Purple%20Software,2024-03-17T16:17:06-07:00
11056321386,2 wear stripped sweater,https://itunes.apple.com/us/reviews/id453127734,3.605.10000,5,Best Uber driver ever,This fish will get you where you need to h,https://itunes.apple.com/us/review?id=368677368&type=Purple%20Software,2024-03-17T16:15:51-07:00
11056320837,Rella NY,https://itunes.apple.com/us/reviews/id928653823,3.605.10000,5,Warm Welcome,Great guy. Very friendly. Felt like we were warmly welcomed to Orlando,https://itunes.apple.com/us/review?id=368677368&type=Purple%20Software,2024-03-17T16:15:38-07:00
11056311683,Mr. Absent Minded,https://itunes.apple.com/us/reviews/id227933323,3.605.10000,5,Christopher was great!,Christopher was right on time to pick me up from the hospital and was very helpful and friendly! Thank you!,https://itunes.apple.com/us/review?id=368677368&type=Purple%20Software,2024-03-17T16:11:46-07:00
11056296997,ThisIsTheTruth,https://itunes.apple.com/us/reviews/id24078596,3.605.10000,2,Dark pattern,Uber is using dark patterns to get customers to provide tips to drivers. Will not prefer this app over Lyft anymore.,https://itunes.apple.com/us/review?id=368677368&type=Purple%20Software,2024-03-17T16:05:29-07:00
11056286438,mshdhfbrjd,https://itunes.apple.com/us/reviews/id225580954,3.605.10000,5,Review,He was very good and very nice,https://itunes.apple.com/us/review?id=368677368&type=Purple%20Software,2024-03-17T16:01:03-07:00
11056250271,Lesa’s reviews,https://itunes.apple.com/us/reviews/id25648403,3.605.10000,5,Very Friendly,"Great ride, car clean and driver super friendly.",https://itunes.apple.com/us/review?id=368677368&type=Purple%20Software,2024-03-17T15:45:34-07:00
11056246126,Asad Chow,https://itunes.apple.com/us/reviews/id908484957,3.605.10000,5,Reliable,Feel reliable and safe with Uber. Drivers always caring and dependable. Best wishes.,https://itunes.apple.com/us/review?id=368677368&type=Purple%20Software,2024-03-17T15:43:50-07:00
11056205654,Roxci8,https://itunes.apple.com/us/reviews/id786657247,3.605.10000,5,👍🏽,Great service,https://itunes.apple.com/us/review?id=368677368&type=Purple%20Software,2024-03-17T15:26:46-07:00
11056163855,TonyRashad,https://itunes.apple.com/us/reviews/id428987562,3.605.10000,5,Amazing,Worth the ride and such an amazing person,https://itunes.apple.com/us/review?id=368677368&type=Purple%20Software,2024-03-17T15:09:18-07:00
11056159098,MichieGK,https://itunes.apple.com/us/reviews/id114299244,3.605.10000,5,Airport pick up was so easy!,"Gabriel was great. Pleasant, courteous, and safe on the roads.",https://itunes.apple.com/us/review?id=368677368&type=Purple%20Software,2024-03-17T15:07:18-07:00
11056127093,Ivanna1967,https://itunes.apple.com/us/reviews/id511166717,3.605.10000,5,Friendly and a true angel who rescue me from a tunnel after an accident. He’s a big asset to Uber,Thankful,https://itunes.apple.com/us/review?id=368677368&type=Purple%20Software,2024-03-17T14:53:55-07:00
11056126278,Barry.2,https://itunes.apple.com/us/reviews/id1083636484,3.605.10000,5,Uber,Always reliable,https://itunes.apple.com/us/review?id=368677368&type=Purple%20Software,2024-03-17T14:53:35-07:00
11056091411,Greatlake Parts,https://itunes.apple.com/us/reviews/id377037273,3.605.10000,5,Driver,Driver was cordial and nice. Enjoyed the talk and the ride.,https://itunes.apple.com/us/review?id=368677368&type=Purple%20Software,2024-03-17T14:39:15-07:00
11056067257,Jeanettecarriker,https://itunes.apple.com/us/reviews/id172501580,3.605.10000,5,Very nice,Super nice person to ride with,https://itunes.apple.com/us/review?id=368677368&type=Purple%20Software,2024-03-17T14:29:17-07:00
11056062812,mary joey,https://itunes.apple.com/us/reviews/id848969356,3.605.10000,5,Great trip,"Very efficient, on time - no wait!!  Very personable driver and back home in no time.  Thank you",https://itunes.apple.com/us/review?id=368677368&type=Purple%20Software,2024-03-17T14:27:27-07:00
11056043566,sir usesalot,https://itunes.apple.com/us/reviews/id931371828,3.605.10000,1,unpleasant and unreliable,"drivers are sketchier and less reliable than lyft. more last minute cancellations, more curbs hit, and more unpleasant conversations with drivers' personal lives.",https://itunes.apple.com/us/review?id=368677368&type=Purple%20Software,2024-03-17T14:19:35-07:00
11056031795,alexgordis,https://itunes.apple.com/us/reviews/id1350302203,3.605.10000,4,good,it was good my first but not last,https://itunes.apple.com/us/review?id=368677368&type=Purple%20Software,2024-03-17T14:14:48-07:00
11056028755,ChrisHolloway,https://itunes.apple.com/us/reviews/id26113486,3.605.10000,1,Most cluttered app I use,What happened?! There is so much stuff jammed in this app that the core functionality has significantly degraded. Please hire a new UX Leader!!!,https://itunes.apple.com/us/review?id=368677368&type=Purple%20Software,2024-03-17T14:13:36-07:00
11056008746,Drsole,https://itunes.apple.com/us/reviews/id9683122,3.605.10000,5,Polite. Helpful. Excellent driver,Great ride,https://itunes.apple.com/us/review?id=368677368&type=Purple%20Software,2024-03-17T14:05:45-07:00
11055972503,Age36,https://itunes.apple.com/us/reviews/id236197258,3.605.10000,5,Entertainment,Thank you for helping us find a place to enjoy for grown folks.,https://itunes.apple.com/us/review?id=368677368&type=Purple%20Software,2024-03-17T13:51:27-07:00
11055971627,Pass1@1,https://itunes.apple.com/us/reviews/id1473044382,3.605.10000,3,Chauffeur impatient,"Uber c est une bonne application mais vos chauffeurs ne sont pas patients, après 2minutes d attente ils vont annuler la course et pour celá Uber vous factureras 5 Dollars",https://itunes.apple.com/us/review?id=368677368&type=Purple%20Software,2024-03-17T13:51:07-07:00
11055958418,马成！就是马到成功,https://itunes.apple.com/us/reviews/id882910608,3.605.10000,5,Good UBER,管理的特别好！,https://itunes.apple.com/us/review?id=368677368&type=Purple%20Software,2024-03-17T13:45:50-07:00
11055951350,gramaannie,https://itunes.apple.com/us/reviews/id679082676,3.605.10000,5,From from airport to home,"Fared is a very kind and gentle person. He is from Afghanistan, and is very soft-spoken and grateful to be in America.",https://itunes.apple.com/us/review?id=368677368&type=Purple%20Software,2024-03-17T13:43:03-07:00
11055918253,Ispy44,https://itunes.apple.com/us/reviews/id494336847,3.605.10000,5,Discriminated and BLOCKED from Uber,I have been using Uber for over 6 years.One day i tried to get an Uber to work i realized i could not requested a ride contacted them.Said I must delete and reinstalled the app i did like 5 times still the same thing.Contacted them they telling me something about some legal issues.I have no idea if someone havked my account or what but they just blocked me from using the app without any real explanation…if this not discrimination I dont know what is…The way the lady was talking to me it was if she speaking to a criminal…I have never committed a crime in my almost 50 years of my life so for Uber to be treating me like one is beyond me….But thank you Uber for taking my thousands of dollars willingly for over six year and now decide to treat me like a criminal,https://itunes.apple.com/us/review?id=368677368&type=Purple%20Software,2024-03-17T13:30:00-07:00
11055903952,Vulgar demos,https://itunes.apple.com/us/reviews/id293921160,3.605.10000,1,So buggy,You can no longer listen to anything while riding an Uber because app takes over audio output. I suppose due to stupid ads? Going downhill.,https://itunes.apple.com/us/review?id=368677368&type=Purple%20Software,2024-03-17T13:24:18-07:00
11055896966,RA1222tffg,https://itunes.apple.com/us/reviews/id968433751,3.605.10000,5,Carlos,Carlos was amazing,https://itunes.apple.com/us/review?id=368677368&type=Purple%20Software,2024-03-17T13:21:36-07:00
11055855830,Philip2485,https://itunes.apple.com/us/reviews/id931406654,3.605.10000,5,Omar,Great experience! Definitely recommend Omar!,https://itunes.apple.com/us/review?id=368677368&type=Purple%20Software,2024-03-17T13:05:54-07:00